subreddit,title,selftext,author,id,permalink,url,created_utc,score,upvote_ratio,ups,downs,num_comments,total_awards_received,gilded,is_video,is_original_content,is_self,over_18,spoiler,link_flair_text,thumbnail,name
webdev,Does such a testing tool/strategy test? Probabilistic testing. ,"In my experience, in the context of web development, we're either doing some kind of unit test/component test, where we'll mock our API interactions with a tool like MSW, or there's e2e tests where you'll deploy some kind of real application and run it cypress/playwright tests against it. 

The problem that these strategies run into is that: 

1. Defining API mocks particularly becomes quite cumbersome, particularly for things CRUD like operations where you create a todo, now refresh the page and expect to see the new todo there. We end up having to reimplement our API in our tests. 

2. For e2e style tests, we either deal with an unreliable system, or a _too_ reliable system, that isn't going to be testing our error cases, or our tests are brittle and break when the data on the system changes. 

What both of these styles of test have in common that they make an assumption that 'when I go to this page, the application is going to be in this state'. 

What I'm wondering is if there's a style of test that is: 

- Go to X page. 
- These are the possible options: 
   - I see an error. 
   - I see a log in screen. 
   - I see products [A, B, C]
   - I see products [D, E, F] 

Now for each of these paths write test behaviour. 

We end up writing a tree of possibilities.

Then to run the test, we can either run this against a real deployment and our tests can navigate it fine. Or there's some kind of mocking behaviour, that observes the kinds of responses that typically occur and probabilistically returns responses of that type. 

",davidblacksheep,1gwzfz1,https://reddit.com/r/webdev/comments/1gwzfz1/does_such_a_testing_toolstrategy_test/,https://www.reddit.com/r/webdev/comments/1gwzfz1/does_such_a_testing_toolstrategy_test/,2024-11-22 04:21:00,2,1.0,2,0,3,0,0,False,False,True,False,False,,self,t3_1gwzfz1
webdev,Investor wants a working product by end of Q2 2025,"I'm working on a project where the investor expects a working software product that could theoretically go to market by the end of Q2 2025. I’m trying to plan the best approach to achieve this goal while balancing speed, quality, and flexibility, and I’d love to meet expectations and then some.

Ideally, we'd like to start with a solid foundation, avoid too much technical debt, and still move quickly enough to meet our investor's deadline.

* For teams that have delivered in similar time frames, did you opt for a more iterative release process (i.e., launching early betas) or did you focus on building most features before even testing with users? 
* How early should we prioritize automated testing and continuous integration (CI)? To what extent do you recommend investing in testing infrastructure at the MVP phase?",Abouttreefittyy,1gwpats,https://reddit.com/r/webdev/comments/1gwpats/investor_wants_a_working_product_by_end_of_q2_2025/,https://www.reddit.com/r/webdev/comments/1gwpats/investor_wants_a_working_product_by_end_of_q2_2025/,2024-11-21 20:23:48,8,0.68,8,0,18,0,0,False,False,True,False,False,,self,t3_1gwpats
webdev,React revist,"Hello, fellow devs! I had learned React, made notes on it, and even completed a project with the help of a tutorial. However, I later moved on to backend development.

Now, when I revisited my notes and the project's code, I found that I don't understand much of it and have forgotten the syntax.

Should I watch a one-shot tutorial on React, or should I try making projects to relearn the syntax and concepts?

Please guide me.
",Sufficient-Scheme-77,1gx2l9p,https://reddit.com/r/webdev/comments/1gx2l9p/react_revist/,https://www.reddit.com/r/webdev/comments/1gx2l9p/react_revist/,2024-11-22 07:40:22,0,0.5,0,0,11,0,0,False,False,True,False,False,Question,self,t3_1gx2l9p
webdev,Safest way to allow users to charge on my platform ?,"I want to allow users to make money on my platform. Small amounts, less than 5 bucks per sale. 

Last time I did this, scammers used my site to charge stolen card numbers and I lost 2k. 

Part of it was my fault for not putting limits on the amount they can charge. 

But this time I want to be extra careful so seeking advice first. 

Last to I used stripe connect to pay the directly each transaction. 

This time I’m okay escrowing the money until no disputes are filled. 

But I’m open to all ideas. What’s the best way to not shoot myself in the foot ",IAmRules,1gwugje,https://reddit.com/r/webdev/comments/1gwugje/safest_way_to_allow_users_to_charge_on_my_platform/,https://www.reddit.com/r/webdev/comments/1gwugje/safest_way_to_allow_users_to_charge_on_my_platform/,2024-11-22 00:07:44,3,1.0,3,0,1,0,0,False,False,True,False,False,,self,t3_1gwugje
webdev,Anything like bulletproof-react but for backend?,"I find myself coming back to the [bulletproof-react](https://github.com/alan2207/bulletproof-react/blob/master/docs/project-structure.md) docs all the time for frontend, in a world where there are so many different ways to do things, I feel like it's such a good resource that is very clear on what is good practice and what is not.

I can't really find something similar for the backend/node.js side though - It seems a lot more convoluted and unclear. Are there any such resources for backend?",bae-va,1gwj3dx,https://reddit.com/r/webdev/comments/1gwj3dx/anything_like_bulletproofreact_but_for_backend/,https://www.reddit.com/r/webdev/comments/1gwj3dx/anything_like_bulletproofreact_but_for_backend/,2024-11-21 16:19:27,9,0.86,9,0,4,0,0,False,False,True,False,False,,self,t3_1gwj3dx
webdev,Download file from API response,"Apologies if I am not using the right terms to explain.

I am building some public API endpoints which will request data from another service. The response is a stream of data. How can I trigger download action (since there is no client side js in work, I doubt I can use any HTML tags to do it.)

Tried setting the disposition header but it did not help either.   
I believe I should store this stream response somewhere like s3 or some cloud storage and trigger the download from there or can I send a zip file as a response? 

EDIT: The disposition header worked with a get call. Thanks for helping out.

It also works with post I think but I will test that at a later point.",yohohohooho,1gx09xi,https://reddit.com/r/webdev/comments/1gx09xi/download_file_from_api_response/,https://www.reddit.com/r/webdev/comments/1gx09xi/download_file_from_api_response/,2024-11-22 05:07:34,0,0.5,0,0,8,0,0,False,False,True,False,False,,self,t3_1gx09xi
webdev,What is the best thing I can do during idle times at work?,"The new company I'm at does things fairly slow. I don't think they expect me to be idle and not work during work hours and so I tactfully brought the point up with my lead and they said to research the codebase between tasks.

Some days there is tasks plenty, but some days there's half a day or more of idle time. 

Maybe I'm ""bad at researching the codebase"" but I feel there's a limited amount you can soak in with just browsing the code. Am I doing it wrong?

I like everything about this job except the fear that they might come to feel I am redundant. However, it's not a US company so they can't just fire away willy-nilly. I also don't want to leave, I feel I won the lottery here.

I'm at a low-ish mid level, and they invested a lot of time to onboard me and teach me things they need me to know. I am confused that now that they taught me all that, there doesn't seem to be a lot of work for me. I think I do the least amount of work in the company (it's a fairly small company).

Any advice?",RedditorUserNetizen,1gwce18,https://reddit.com/r/webdev/comments/1gwce18/what_is_the_best_thing_i_can_do_during_idle_times/,https://www.reddit.com/r/webdev/comments/1gwce18/what_is_the_best_thing_i_can_do_during_idle_times/,2024-11-21 09:28:23,31,0.85,31,0,41,0,0,False,False,True,False,False,Question,self,t3_1gwce18
webdev,Server rendered or spa? For line of business applications,"Hi Guys! I would like to ask what do you use for business apps. Django, rails, laravel or spa react, angular, vue etc ? Im an old school django mvt, rails &amp; jquery btw. Should I move to spa since it’s the current trend?",PatrickJohn87,1gwyaqk,https://reddit.com/r/webdev/comments/1gwyaqk/server_rendered_or_spa_for_line_of_business/,https://www.reddit.com/r/webdev/comments/1gwyaqk/server_rendered_or_spa_for_line_of_business/,2024-11-22 03:18:32,0,0.4,0,0,39,0,0,False,False,True,False,False,,self,t3_1gwyaqk
webdev,Not possible to verify online company on Google,"Struggling to verify a company website on Google - three videos submitted and now they say that online companies cannot be verified. Is this an issue anyone else has found, and if so how do you manage to appear in rich results? ",BeginningPie9001,1gwnwxs,https://reddit.com/r/webdev/comments/1gwnwxs/not_possible_to_verify_online_company_on_google/,https://www.reddit.com/r/webdev/comments/1gwnwxs/not_possible_to_verify_online_company_on_google/,2024-11-21 19:27:07,5,0.86,5,0,1,0,0,False,False,True,False,False,,self,t3_1gwnwxs
webdev,An Illustrated Proof of the CAP Theorem,,fagnerbrack,1gwt1il,https://reddit.com/r/webdev/comments/1gwt1il/an_illustrated_proof_of_the_cap_theorem/,https://mwhittaker.github.io/blog/an_illustrated_proof_of_the_cap_theorem/,2024-11-21 23:03:40,2,0.67,2,0,2,0,0,False,False,False,False,False,,default,t3_1gwt1il
webdev,I've seen posts on Bruno (open source and native git Postman replacement) in here before. Pretty good release today. I really doubt I'll ever go back to Postman or anything else based on this pace. ,,uncomfortableiterati,1gwpxup,https://reddit.com/r/webdev/comments/1gwpxup/ive_seen_posts_on_bruno_open_source_and_native/,https://www.reddit.com/r/programming/comments/1gwmlyu/bruno_opensource_and_native_git_postman/,2024-11-21 20:50:30,4,0.83,4,0,0,0,0,False,False,False,False,False,,default,t3_1gwpxup
webdev,Development laptop,"Hi, I'm looking to buy a laptop for web development mostly NodeJS, Adobe Photoshop, Figma and so on ; although I would like to also run Android Studio smoothly.  
Problem is my budget, I have at most $500 dollars to spent  
Most people vouch for Macs, for the Apple Silicone and whatnot.  
But their too expensive and I don't know if a 2015 Mac is gonna do it...

I also saw people talking bad about the Ryzen when used on laptops, and quirky optimizations, because they are fast to get hot, over 101 C.

Suggestions pls? Thanks in advance

Edit: Thanks for the insight, really! I'm kind of lost on what is mainstream nowdays.  
My last pc was a desktop one, but it got broken. it had an A6-7470k(dualcore) and a R5 integrated in the cpu. So, I always have been using the options at the low end of the spectrum.  
Most people recommended me a MacBook or mini for web development, if possible from 2015/2017. I'm sure that as of today, that is kinda trash-ish, since there are great options.  
There was also a suggestion to use WSL on windows, but I like to use the linux shell, and from what I heard macOS has a pretty similar, since both are based on Unix",Frequent_Badger5523,1gwspkr,https://reddit.com/r/webdev/comments/1gwspkr/development_laptop/,https://www.reddit.com/r/webdev/comments/1gwspkr/development_laptop/,2024-11-21 22:48:51,2,1.0,2,0,19,0,0,False,False,True,False,False,,self,t3_1gwspkr
webdev,Ecommerce for Print on Demand - a simple setup for an intermediate developer without too many catches?,"I am working on setting up a site for a print-on-demand shop. I am planning to use Printify for the supplier, but am happy to use something else like Printful, etc. if that makes it smoother.

All the suggestions I read, though, are either very complicated, or overly reliant on a specific system. For instance, I was going to go with Shopify, as that is almost always what I see recommended. They terminated my shop while I was still setting it up, with no explanation as to why. As far as I know I am not doing anything that could possibly be against their terms. I tried to dispute it, but the form they provide for this gives an error upon submission. I chatted with someone to see if they could fix this another way, but Shopify seems to be in no rush to help, and now I am hesitant to even rely on them at all.

WooCommerce appears to be the next most popular, but it seems convoluted, and relies on WordPress. I am OK with using WordPress if I HAVE to, but I prefer to work with something more developer-friendly - frameworks like Django or Rails or Laravel. Like, to set up WooCommerce, the standard way is to install it through the WordPress interface. This is not very reproduceable. You can automate some of it with the WordPress CLI, but that seems like a hack. I much prefer having a .env file I can put the configuration in, or at least coding things in a reproduceable way.

Medusa.js looks incredible, but I cannot for the life of me tell how much will ""just work,"" versus how much I will have to write custom code for. I do not mind doing some development to get things working, but I would like the stuff that would be very bad to fail, like order management, billing, etc. to work without having to trust myself to implement it all correctly from scratch. I assume I would use Stripe with this for payment processing, but I am not clear on how many other services I would need to rely on.

Are there any solutions that just kind of work? Shopify was the most hopeful, but they have quickly proven unreliable. WooCommerce would be good if it was not designed for manual setup, but maybe I am wrong and assuming that based on lack of knowledge? Medusa.js is promoted as a replacement for these, but I cannot tell how much more would be required.

I am open to any other options. I just thought that, with Ecommerce being so common, there would be some options besides Shopify that were relatively simple to set up, so I could focus on developing the site itself.

Thank you in advance to anyone who even bothers to read this overly-long post.

  
Edit: I know there are other services, like BigCommerce for instance, but none of them seem to have nearly as much information out there about integrating them with your tools. I get the impression that the Shopify DX is much better than most others, but would like to be told otherwise. If there is something that provides just their basic functionality - shopping cart, order management (including automating sending orders to POD service), billing. Like something I could plug into a Django project without too many other libraries/APIs.",LennyMcLennyFace,1gwxadm,https://reddit.com/r/webdev/comments/1gwxadm/ecommerce_for_print_on_demand_a_simple_setup_for/,https://www.reddit.com/r/webdev/comments/1gwxadm/ecommerce_for_print_on_demand_a_simple_setup_for/,2024-11-22 02:26:44,0,0.5,0,0,16,0,0,False,False,True,False,False,,self,t3_1gwxadm
webdev,Text Color for Maximised Contrast (Manual or Can be Automated),So I was studying the OpenAI’s landing page right. Then I noticed that it has multiple card-like shapes with images. What amazes me is that the text color takes into account the images so that it maximises contrast. Do you guys think this is done manually or is there a tool for this?,SusBakaMoment,1gwhfg0,https://reddit.com/r/webdev/comments/1gwhfg0/text_color_for_maximised_contrast_manual_or_can/,https://i.redd.it/7ax58v4xk92e1.jpeg,2024-11-21 14:23:08,7,0.68,7,0,14,0,0,False,False,False,False,False,Discussion,https://b.thumbs.redditmedia.com/Mw5iOZn42HAru86d0v5t-JCQPY2u6WAKjR2eA5YtLlU.jpg,t3_1gwhfg0
webdev,Where do u keep ur code snippets?,"Over the years as I'm developing I come across code snippets or develop a component or learn a new process. I save odd ones on my own system, some in codepen, some as gists on github and a few elsewhere.  
What do you use to store and keep track of your components / code snippets. Is there a way to store and easily search for bits of code you've written? ",darren_of_herts,1gw8wq4,https://reddit.com/r/webdev/comments/1gw8wq4/where_do_u_keep_ur_code_snippets/,https://www.reddit.com/r/webdev/comments/1gw8wq4/where_do_u_keep_ur_code_snippets/,2024-11-21 05:25:57,33,0.84,33,0,71,0,0,False,False,True,False,False,Question,self,t3_1gw8wq4
webdev,Cheap and Easy Website Builder for Small business?,"I am increasingly being asked what is the cheapest and easiest way to get a website up. These are brochure sites with modest needs that can't afford a robust solution or a developer. These are typically solopreneur or gig work stuff like; catering, pressure washing, fence building, or even auto body shops. These are not technical people, and just want something that looks nice and is easy to update. 

There are lots of great platforms that could do this for $20/month or more, and often increase after the first year. Most of these businesses are not profitable or operating yet, so it needs be as cheap (&gt;$10/mo) as possible or wont be sustainable for them.

Two very cheap options that seem suitable are [web.com](http://web.com) or [hostinger.com](http://hostinger.com) but there are many others.  I also see mixed reviews at this price point. Can you fine folks suggest your preferred service that could fill this need?",AndyMagill,1gwig9s,https://reddit.com/r/webdev/comments/1gwig9s/cheap_and_easy_website_builder_for_small_business/,https://www.reddit.com/r/webdev/comments/1gwig9s/cheap_and_easy_website_builder_for_small_business/,2024-11-21 15:50:41,5,0.78,5,0,6,0,0,False,False,True,False,False,Question,self,t3_1gwig9s
webdev,Captcha Suggestions ,"Hello, I just wanted some input on different types of Captcha programs you may have on your website, or have tried out for a vendor. 
I currently have Googles ReCAPTCHA implemented but the challenge images it presents to users sometimes are not clear and can be very difficult. As someone with not very good eye sight I really struggle with these myself. I know they have the audio option but that requires you to continuously educate those who are having issues on how to use that function. ",infinite_corncob,1gwji82,https://reddit.com/r/webdev/comments/1gwji82/captcha_suggestions/,https://www.reddit.com/r/webdev/comments/1gwji82/captcha_suggestions/,2024-11-21 16:35:33,3,1.0,3,0,13,0,0,False,False,True,False,False,Discussion,self,t3_1gwji82
webdev,How to choose the right DB for your project?,"I am building a side project that gonna have users - it’s a link in bio tool.

But i am stuck with DB.

Since i am pre-revenue i am not sure which DB is the best.

Cloudflare D1 - generous free tier - buts its SQLITE ( never seen startups use that )

Neon Db - PostgreSQL - but i busted the free tier in development itself

What other options do i have?
What does pre-revenue startups choose?",Abood-2284,1gwbxn3,https://reddit.com/r/webdev/comments/1gwbxn3/how_to_choose_the_right_db_for_your_project/,https://www.reddit.com/r/webdev/comments/1gwbxn3/how_to_choose_the_right_db_for_your_project/,2024-11-21 08:54:24,10,0.71,10,0,44,0,0,False,False,True,False,False,Question,self,t3_1gwbxn3
webdev,Does Amazon have a public API that I can use to monitor product prices?,"I've been tracking nutrition supplements on a giant spreadsheet, updating certain products with new prices whenever it's time to refill. I'd much rather be able to just pass an array of URLs to an API call to retrieve an array of current product listings so that I can just update the entire spreadsheet all at once. Is there a way to do this? I know that there are apps/websites that allow you to track prices, so either they're scraping the HTML or there's an actual API.",GoBackToLeddit,1gwkt31,https://reddit.com/r/webdev/comments/1gwkt31/does_amazon_have_a_public_api_that_i_can_use_to/,https://www.reddit.com/r/webdev/comments/1gwkt31/does_amazon_have_a_public_api_that_i_can_use_to/,2024-11-21 17:26:21,1,0.56,1,0,5,0,0,False,False,True,False,False,,self,t3_1gwkt31
webdev,Slow Deployment Causes Meetings,,fagnerbrack,1gwq7lu,https://reddit.com/r/webdev/comments/1gwq7lu/slow_deployment_causes_meetings/,https://tidyfirst.substack.com/p/slow-deployment-causes-meetings,2024-11-21 21:01:44,0,0.5,0,0,1,0,0,False,False,False,False,False,,https://b.thumbs.redditmedia.com/6yFQ3R0nZNDNAYw2QTcwipzbWvnGM3MeLu3OItOXBAA.jpg,t3_1gwq7lu
webdev,What are some front-end tricks that people tend to overlook but make the difference?,"I'm building a news website for fun and I always get to this point where I have a lot of the functionality I want but it looks like trash and I actually don't know what to do to improve it and make it look like a real professional news site. 

I got it to a point where I can write up some sort of dummy articles with good SEO buzzwords just to test organic traffic but I know for a fact that anyone coming across the site would just exit right out just from the smell of how amateur it is.

What are some common mistakes people make and what are some ways to clean up a junky looking site that a lot of new developers overlook?",mr4sh,1gwox6p,https://reddit.com/r/webdev/comments/1gwox6p/what_are_some_frontend_tricks_that_people_tend_to/,https://www.reddit.com/r/webdev/comments/1gwox6p/what_are_some_frontend_tricks_that_people_tend_to/,2024-11-21 20:08:22,1,1.0,1,0,1,0,0,False,False,True,False,False,,self,t3_1gwox6p
webdev,Biggest client website yet - noob question about hosting server size,"Hi all - I currently host a Digital Ocean server on cloudways which I have several client websites on. These are typically the php cms framework 'Kirby' which means no databases as it's a flat file system. All of these websites are relatively small local companies and so server performance has never been an issue for me; I've only ever really needed to keep en eye on disk space.

But I've got a new client who are a much more popular company and receive around 1.3m page views a year in traffic which is significantly higher than what I've dealt with before. I really don't know how to go about finding out what server size I require based on this traffic, and wondered if anyone could give me some tips?  
  
My current server has the following specs: 4 GB RAM, 80 GB NVMe Disk, 4 TB Transfer, 2 Core Processor

And this server is scaleable, so would people recommend just scaling up this server (if the above is not enough) and still housing all my clients on the one server, or does it make sense to give it it's own dedicated server?

Thanks for any help in advance!",Tiny_Major_7514,1gwekln,https://reddit.com/r/webdev/comments/1gwekln/biggest_client_website_yet_noob_question_about/,https://www.reddit.com/r/webdev/comments/1gwekln/biggest_client_website_yet_noob_question_about/,2024-11-21 11:58:52,5,0.86,5,0,10,0,0,False,False,True,False,False,,self,t3_1gwekln
webdev,"Building a Team for Hackathon
","Hi everyone. I’m building a team for an ongoing hackathon, and we’re looking for skilled front-end and backend developers to join us! We already have a development team in place, but we need someone to help design a user-friendly interface and bring our project to life visually.

If you have experience in front-end development and are excited to collaborate, send me a message!

Dm me for details. Thanks",improvemental,1gwnw8f,https://reddit.com/r/webdev/comments/1gwnw8f/building_a_team_for_hackathon/,https://www.reddit.com/r/webdev/comments/1gwnw8f/building_a_team_for_hackathon/,2024-11-21 19:26:18,0,0.4,0,0,6,0,0,False,False,True,False,False,,self,t3_1gwnw8f
webdev,Online Tech Events,"Do you know any upcoming online events? 
",Fraan3D,1gwnsqv,https://reddit.com/r/webdev/comments/1gwnsqv/online_tech_events/,https://www.reddit.com/r/webdev/comments/1gwnsqv/online_tech_events/,2024-11-21 19:22:11,1,1.0,1,0,0,0,0,False,False,True,False,False,Question,self,t3_1gwnsqv
webdev,I created a visually pleasing HTML Color name display,,Madsenmm,1gvt91o,https://reddit.com/r/webdev/comments/1gvt91o/i_created_a_visually_pleasing_html_color_name/,https://www.colorpalette.dk/,2024-11-20 16:19:40,145,0.94,145,0,42,0,0,False,False,False,False,False,Resource,default,t3_1gvt91o
webdev,Release Notes for Safari Technology Preview 208,,feross,1gwnaee,https://reddit.com/r/webdev/comments/1gwnaee/release_notes_for_safari_technology_preview_208/,https://webkit.org/blog/16285/release-notes-for-safari-technology-preview-208/,2024-11-21 19:01:39,1,0.67,1,0,0,0,0,False,False,False,False,False,,default,t3_1gwnaee
