subreddit,title,selftext,author,id,permalink,url,created_utc,score,upvote_ratio,ups,downs,num_comments,total_awards_received,gilded,is_video,is_original_content,is_self,over_18,spoiler,link_flair_text,thumbnail,name
webdev,TIL - Why is the terminal called that,"I was listening to lecture on linux -this [one](https://www.youtube.com/watch?v=gojeTqXdBH0), but it's in Arabic- and the lecturer talked about the first time the terminal was used, which was interesting and worth sharing, so I asked Claude to talk about the point he mentioned in more details so I can share it here:

The term ""terminal"" in computing comes from its literal meaning as an ""endpoint,"" rooted in the Latin ""terminus"" (meaning boundary or end). In early computing, terminals were physical endpoints - devices with just a screen and keyboard that connected to massive mainframe computers. Unlike other input methods like punch cards (which were more like dropping off mail and waiting), terminals were special because they were interactive endpoints where users could have real-time, two-way conversations with the computer.

Picture a mainframe computer in a room with cables running out to multiple terminals - each terminal was literally at the ""end"" of a connection, where the computer system met the human user. When you typed on your terminal, your input would travel up to the mainframe, get processed, and the results would immediately come back to your screen. This was revolutionary compared to punch cards, which required you to submit your entire program at once and wait hours or days for results.

Today's ""terminal"" or command-line interface isn't a physical device anymore, but we keep the name because it serves the same purpose: it's your direct, interactive conversation point with the computer, where you can type commands and get immediate responses. Modern terminals are actually programs (like Terminal on Mac or Command Prompt on Windows) that simulate those old physical terminals, carrying on that legacy of being the ""endpoint"" where human and computer meet for direct communication.",Mohammed_MAn,1gzhqp7,https://reddit.com/r/webdev/comments/1gzhqp7/til_why_is_the_terminal_called_that/,https://www.reddit.com/r/webdev/comments/1gzhqp7/til_why_is_the_terminal_called_that/,2024-11-25 12:30:35,0,0.42,0,0,20,0,0,False,False,True,False,False,,self,t3_1gzhqp7
webdev,How do create animations like this?,I want to showcase the languages and tools that I am familiar with in a similar animation which on hovered gets rotated. I actually want the spider web like animation not the globe itself but in sphere shape. I donot know 3js but will learn if it is needed.Although I know framer motion I think it isnot possible from it. If anyone have knows any video or any other resources to achieve this type of animation could you provide it please.,Sharp_Growth_6,1gzf3j9,https://reddit.com/r/webdev/comments/1gzf3j9/how_do_create_animations_like_this/,https://i.redd.it/tgqn9ckoo03e1.jpeg,2024-11-25 09:32:16,0,0.33,0,0,5,0,0,False,False,False,False,False,Question,https://a.thumbs.redditmedia.com/KiA3h8Nb5A1fM7esir_vnk-NhBK_OXYUMDIXj9rwcM0.jpg,t3_1gzf3j9
webdev,Weird font on some websites,"https://preview.redd.it/4ovhu4u00v2e1.png?width=2495&amp;format=png&amp;auto=webp&amp;s=050ad017bd1f8f26569e83f88bf90ed7994ed9df

Why some websites appear in this weird font in chrome and edge but tried firefox looks fine, how can I fix that?",KareemAhmed37,1gys520,https://reddit.com/r/webdev/comments/1gys520/weird_font_on_some_websites/,https://www.reddit.com/r/webdev/comments/1gys520/weird_font_on_some_websites/,2024-11-24 14:27:13,6,0.8,6,0,1,0,0,False,False,True,False,False,Question,https://b.thumbs.redditmedia.com/WZ4s4Ql91r_G94yiPGcxStYOKgHGxigj1X8y4dxgwto.jpg,t3_1gys520
webdev,How to avoid duplicating html page in a static site ?,"I'm not a web dev. I have built a static website with two html pages so far

a) home page shows 6 products in a grid, each product image is a link.

b) a second html page shows details about first product.

My problem is that I found my self needing to duplicate the product.html page 6 times for each product.

All product pages have same structure and look and feel , except product name, description, and image.

what tool / technology / keyword do I need to look for to achieve this ?

I don't need dynamic/server, I have a static small list of products.

\----------------------

Update, I went with this solution:

* page 1 redirects to page2.html?someValue=ABC
* Page 2 can then read the query string and the key 'someValue'

Page 2 have in java script array list of products ( name, description, image )

Page 2 access the array based on the parameter.

Though static site generator like Jekyll and Astro looks cool and better.",ShojanNaN,1gymbja,https://reddit.com/r/webdev/comments/1gymbja/how_to_avoid_duplicating_html_page_in_a_static/,https://www.reddit.com/r/webdev/comments/1gymbja/how_to_avoid_duplicating_html_page_in_a_static/,2024-11-24 08:27:50,13,0.7,13,0,27,0,0,False,False,True,False,False,Question,self,t3_1gymbja
webdev,any great home pages to inspire from? retro if possible ,lemme know if you remember any,Altruistic_Gap2719,1gyyj0c,https://reddit.com/r/webdev/comments/1gyyj0c/any_great_home_pages_to_inspire_from_retro_if/,https://www.reddit.com/r/webdev/comments/1gyyj0c/any_great_home_pages_to_inspire_from_retro_if/,2024-11-24 18:59:59,2,1.0,2,0,1,0,0,False,False,True,False,False,Question,self,t3_1gyyj0c
webdev,GDPR Regulations Question Regarding Hashing + Salting,"I see GDPR come up a lot and the usual response is to not keep any PII data, and if you do that it should be encrypted during transit and at rest. 

Which got me thinking if you encrypt data at rest, then change the salt used to hash the PII, the original data is lost right? ",P-TownHero,1gyyfsf,https://reddit.com/r/webdev/comments/1gyyfsf/gdpr_regulations_question_regarding_hashing/,https://www.reddit.com/r/webdev/comments/1gyyfsf/gdpr_regulations_question_regarding_hashing/,2024-11-24 18:56:09,2,0.75,2,0,11,0,0,False,False,True,False,False,,self,t3_1gyyfsf
webdev,Instagram Content (Story Highlights) on Website,"Hi all, 

I work for an education federation. Most of our updates end up on our Instagram, so I thought it'd make sense to mount that on our federation website instead of reuploading everything manually. 

I've found a couple of decent widgets that display the Instagram's main content tiles, but I'd like to somehow implement the story highlights separately. We have different story highlights for certain areas of the federation - ""Enrichment"", ""Early Years"", ""Training"" etc - where content gets grouped. I'd like similar buttons to appear on our website so that when they're pressed, people can easily look through the images without being redirected to Instagram itself. 

I've tried a widget by SociableKIT, and it was nearly what we needed, but it didn't pull through the titles, on the circular buttons. 

Any thoughts about how this could be achieved? 

Many thanks!

This is how they appear on Instagram: 

https://preview.redd.it/gi8rscm91w2e1.png?width=2104&amp;format=png&amp;auto=webp&amp;s=363d9c19acfd83839c337258abf40c68ce1bb522",Foxington_the_First,1gyx1nl,https://reddit.com/r/webdev/comments/1gyx1nl/instagram_content_story_highlights_on_website/,https://www.reddit.com/r/webdev/comments/1gyx1nl/instagram_content_story_highlights_on_website/,2024-11-24 17:57:10,2,0.75,2,0,0,0,0,False,False,True,False,False,,https://a.thumbs.redditmedia.com/HdBE4DKtme5Y4xabI8KSsgrMlcTg5MJB5TO0FRd5ur0.jpg,t3_1gyx1nl
webdev,How I Built a Tool to Help Developers Showcase Portfolios That Get Noticed,"I created [https://webportfolios.dev](https://webportfolios.dev), a platform designed to help developers showcase their portfolios, get inspired by others, and overcome common challenges when building their own.

I built this because I know how overwhelming it can feel to start a portfolio from scratch or to figure out how to make one that stands out.

A quick success story:  One of our users who recently uploaded their portfolio doubled their traffic to their portfolio just by uploading their portfolio to the platform!

Would love to hear the hardest part of building a portfolio for you? Let's discuss and help each other out!",yeahimjtt,1gyviww,https://reddit.com/r/webdev/comments/1gyviww/how_i_built_a_tool_to_help_developers_showcase/,https://www.reddit.com/r/webdev/comments/1gyviww/how_i_built_a_tool_to_help_developers_showcase/,2024-11-24 16:54:57,2,0.75,2,0,2,0,0,False,False,True,False,False,,self,t3_1gyviww
webdev,Optimizing for PageSpeed Insights ,"Hi friends! I've been teaching myself while building a Shopify store for a baby &amp; children's clothing brand over the past few months. One thing that I have not been able to figured out is how to optimize for load performance. No matter how decompressed my hero banners are (or even without a banner at all), my LCP always tanks my performance score. I'm wondering this is a Shopify issue or is there anything I can do to improve it? My performance score is 40-60 depending on the day. Below is my Shopify store for reference. Thank you in advance!

[www.dreamblyme.com](https://www.dreamblyme.com)",Pingfao,1gz0mch,https://reddit.com/r/webdev/comments/1gz0mch/optimizing_for_pagespeed_insights/,http://dreamblyme.com,2024-11-24 20:27:25,1,0.67,1,0,4,0,0,False,False,False,False,False,Question,https://b.thumbs.redditmedia.com/U7YjYtDAtdmn3Dkpu7FpfbCjuQAlWEyv8pQTY3_pxXg.jpg,t3_1gz0mch
webdev,Yes Indeed,"https://preview.redd.it/18j4t7lpmv2e1.png?width=1044&amp;format=png&amp;auto=webp&amp;s=2f6e0fb816b74752f7ca4f8078bc8b400be65c89

",sallu9000,1gyuzlh,https://reddit.com/r/webdev/comments/1gyuzlh/yes_indeed/,https://www.reddit.com/r/webdev/comments/1gyuzlh/yes_indeed/,2024-11-24 16:32:29,1,0.53,1,0,6,0,0,False,False,True,False,False,,https://a.thumbs.redditmedia.com/7q59tFJRudJPSdiNWeoCoACTe2Of9O6wDsuYce4GL94.jpg,t3_1gyuzlh
webdev,Is a good source for “traditional” web development?,"All my professional experience since college has been React SPAs and I’m interested in learning a more old school approach through a side project with server side rendered html. 

To give an idea of what I mean, I’m talking about things like using an html form with inputs and a submit button to send data back to the server as opposed to controlled react inputs and a POST request. Then redirecting after that form submission by returning a 303 response rather than reading the POST response and using whatever method the routing library wants you to use.

Basically I’m looking for ways that I can leverage the built in capabilities of the browser or http spec to accomplish things rather than doing it all in JavaScript like I learned through react. I can find these things in isolation, or through specific searches, but if there’s any resources for “proper” or “traditional” web development that aggregates these sorts of best practices I’d appreciate it. ",SegFaultHell,1gyzlq3,https://reddit.com/r/webdev/comments/1gyzlq3/is_a_good_source_for_traditional_web_development/,https://www.reddit.com/r/webdev/comments/1gyzlq3/is_a_good_source_for_traditional_web_development/,2024-11-24 19:44:35,0,0.45,0,0,13,0,0,False,False,True,False,False,Question,self,t3_1gyzlq3
webdev,PowerPages to host website?,"I work in a school and created a small report/web app to track students who are failing or in danger of failing courses. The app displays their attendance, grades, missing assignments, and what sports they play, if any.

Previously, I outputted the report as a giant PDF and stored it on OneDrive, sharing a link to disseminate it. However, the missing assignments feature is dynamic and can't be captured in a static PDF.

I've been searching for a way to host the web page while restricting access to certain users within our domain. I stumbled upon Power Pages and thought it might be a solution.

My goal is to upload the fully formed page and its assets, using Power Pages solely for secure storage behind an Azure AD login. Unfortunately, I haven't figured out how to achieve this. Ideally, there would be an FTP-like mechanism to simply upload the folder and be done.

Right now I can't even figure out how to upload the image assets, each student's attendance is represented by 2 graphs for YTD attendance and 5 day attendance.

https://preview.redd.it/0mf96880mr2e1.png?width=1889&amp;format=png&amp;auto=webp&amp;s=a1696d4d9a00682c0908016771a8ccf089c1e476

",Mini_Couper,1gyz1ut,https://reddit.com/r/webdev/comments/1gyz1ut/powerpages_to_host_website/,https://www.reddit.com/r/webdev/comments/1gyz1ut/powerpages_to_host_website/,2024-11-24 19:21:21,1,1.0,1,0,5,0,0,False,False,True,False,False,,self,t3_1gyz1ut
webdev,Framework for generating dynamic forms. ,"Hi all,

I am mostly a backend developer and not great with JS. So, looking for some advice. 

I have a project where there is an API, written by me, that provides JSON description of a form. As well as an endpoint to submit the form. 

Currently, I have vanilla JS with jQuery and bootstrap. That based on an FormID and containerID will render the specified form in the container. After getting the JSON from the API. 

The JS itself is now over 1000 lines long and a bit unmanageable. Thanks to there being a function for each input type. 

 I want the JS to be portable so that we can reference the script on any site and call the render function to inject the form. 

Any suggestions on frameworks ect on the best approach to manage this JS. ",Greedy_Rip3722,1gyqwq3,https://reddit.com/r/webdev/comments/1gyqwq3/framework_for_generating_dynamic_forms/,https://www.reddit.com/r/webdev/comments/1gyqwq3/framework_for_generating_dynamic_forms/,2024-11-24 13:26:07,2,0.75,2,0,4,0,0,False,False,True,False,False,,self,t3_1gyqwq3
webdev,The Open Web Application Security Project (OWASP) has updated its Top 10 list of risks for large language models (LLMs) and introduced a sponsorship program to improve AI security.,"The Open Web Application Security Project (OWASP) has updated its Top 10 list of risks for large language models (LLMs) and introduced a sponsorship program to improve AI security. This update highlights the vulnerabilities and threats specifically associated with LLM applications, providing guidance on mitigating risks such as data poisoning, adversarial attacks, and bias.

Source: https://remoteupskill.com",Diligent_Relative_36,1gyvvnr,https://reddit.com/r/webdev/comments/1gyvvnr/the_open_web_application_security_project_owasp/,https://www.sdxcentral.com/articles/stringerai-announcements/owasp-updates-top-10-risks-for-llms-and-introduces-sponsorship-program/2024/11/,2024-11-24 17:09:17,1,0.6,1,0,0,0,0,False,False,False,False,False,,https://b.thumbs.redditmedia.com/jy5yeDTyROrsYjyQiY2KtSdSNUBAGPAu7IZn6mXdH6g.jpg,t3_1gyvvnr
webdev,"My color palette generator now supports common export types such as ASE files! Written in vanilla HTML, CSS &amp; JS",,afusta,1gy9wq7,https://reddit.com/r/webdev/comments/1gy9wq7/my_color_palette_generator_now_supports_common/,https://i.redd.it/vpm2i6c0vp2e1.png,2024-11-23 21:08:24,22,0.92,22,0,9,0,0,False,False,False,False,False,Showoff Saturday,https://b.thumbs.redditmedia.com/DDyoFwc9qzGYALWYWAQ_izNS8wMApjlsohunnQOIFxQ.jpg,t3_1gy9wq7
webdev,Form where each field is its own form and sends  automatically ?,"I made this for my client who wanted modifications to be saved immediately. So I made an input component that is its own form and posts to the server as soon as it looses focus.

I'm tempted to always use this from now on. Any reason I shouldn't?",permaro,1gz1erq,https://reddit.com/r/webdev/comments/1gz1erq/form_where_each_field_is_its_own_form_and_sends/,https://www.reddit.com/r/webdev/comments/1gz1erq/form_where_each_field_is_its_own_form_and_sends/,2024-11-24 21:00:46,0,0.33,0,0,16,0,0,False,False,True,False,False,,self,t3_1gz1erq
webdev,I build a website to help people get genuine feedback for free,,MasterDranoel,1gy4a2y,https://reddit.com/r/webdev/comments/1gy4a2y/i_build_a_website_to_help_people_get_genuine/,https://i.redd.it/86x1u4n2no2e1.png,2024-11-23 17:02:20,33,0.83,33,0,6,0,0,False,False,False,False,False,Showoff Saturday,https://b.thumbs.redditmedia.com/_aJ0cWp3SAnOFcF0ywcD5_aAkVgA7syq2C5DULTt8wE.jpg,t3_1gy4a2y
webdev,I built a website for my chrome extension : brainrotreader.com 😺,,No_Recording_9753,1gy8wiu,https://reddit.com/r/webdev/comments/1gy8wiu/i_built_a_website_for_my_chrome_extension/,https://i.redd.it/ib90gfpwmp2e1.png,2024-11-23 20:23:40,17,0.87,17,0,2,0,0,False,False,False,False,False,Showoff Saturday,https://b.thumbs.redditmedia.com/fNsP9GJun3To4eSL7_fPZdxgFYzlzQDIA-yEnNf6vOQ.jpg,t3_1gy8wiu
webdev,I built a site to end fake stripe screenshots,"Over the past few weeks I’ve noticed a rise in stripe screenshots. I think that a lot of these can be legit, but a lot of comments seem to disagree. So I made a site to clear up any doubt: [showproof.link](https://www.showproof.link)

Showproof **profiles only display verified web analytics, revenue data, and social accounts**. This is great to prove you’re not just yapping on Reddit, but it can be even more valuable when trying to showcase your success to customers or clients. For example, if you want to sell ad space on your website, or you’re trying to showcase past success as a freelancer. 

So far I’ve integrated Stripe, Google Analytics, Plausible, and Twitter, but there will be more integrations coming soon. Also, I want to add an explore page so that people can gain some more exposure and traffic, I’m just trying to get more users first.



Also here are some FAQs from my previous posts in other subs:

**Is this just IndiePage?** No, IndiePage is cool too, but it is triple the price and doesn’t include web analytics. 

**Is this just for people to brag on Reddit?** No, people can use it like that if they want, but this is mainly for people conducting business online that want to boost credibility.

**How is data verified?** In short, Oauth and API keys, but there are more in-depth details on the site.

**Why don’t you post your own account?** I'm pretty new to indie hacking and barely make any money, but if you’re interested you can check it out here [showproof.link/matt](https://www.showproof.link/matt)",mst152,1gy1tuf,https://reddit.com/r/webdev/comments/1gy1tuf/i_built_a_site_to_end_fake_stripe_screenshots/,https://www.reddit.com/r/webdev/comments/1gy1tuf/i_built_a_site_to_end_fake_stripe_screenshots/,2024-11-23 15:15:09,43,0.92,43,0,3,0,0,False,False,True,False,False,Showoff Saturday,self,t3_1gy1tuf
webdev,Looking for Solutions: Building a Dental Clinic Management App (ERP or Otherwise),"I’m planning to build a dental clinic management app with features like patient management, employee tracking, finance, inventory, and more. Initially, I thought of using Laravel and Next.js, but since I’m working solo, starting from scratch feels overwhelming and it will take forever as an already full time software engineer.

I’m now considering using ERP frameworks like Odoo or ERPNext, but I’m open to other solutions as well. My key questions:


1. How easy is it to customize these frameworks for dental-specific needs (e.g., treatment history, appointment reminders)?

2. Are there better tools or platforms to save time while keeping flexibility?

3. Any challenges or advice when integrating third-party tools (e.g., payment gateways, SMS)?


I’d love to hear your experiences or suggestions on the best approach to take. 🙏🏻🙏🏻",ShatteredExistence_,1gylrj9,https://reddit.com/r/webdev/comments/1gylrj9/looking_for_solutions_building_a_dental_clinic/,https://www.reddit.com/r/webdev/comments/1gylrj9/looking_for_solutions_building_a_dental_clinic/,2024-11-24 07:48:11,2,1.0,2,0,6,0,0,False,False,True,False,False,,self,t3_1gylrj9
webdev,I made an extension allowing commenting and live-chat unique to every webpage,,2urnesst,1gxumkb,https://reddit.com/r/webdev/comments/1gxumkb/i_made_an_extension_allowing_commenting_and/,https://i.redd.it/vuyk5rt3yl2e1.gif,2024-11-23 07:58:57,150,0.91,150,0,63,0,0,False,False,False,False,False,Showoff Saturday,https://b.thumbs.redditmedia.com/1liOd7TMyJJN-CaMT6pD6kxMUNLFuzMNqtCdZFjLV2U.jpg,t3_1gxumkb
webdev,"Built beautiful, dead-simple api yet highly customizable interactive file-tree renderer for documentation | One command to generate, tons of props to customize, and a beautiful UI 🌳","edit: holy smokes the images are awful @ 3840 x 1600 on 100%. Zoom in or view the links.



I am rolling my own auth system, for me to usje and  to prove it doesn't have to be complicated, and probably easier then solutions like NextAuth. Have to make docs, Firstly I created this [beautiful code block renderer ](https://beautiful-code-block.remcostoeten.com/)

[My own copy-able code block. Lovely imo](https://preview.redd.it/94a8msyhtt2e1.png?width=1873&amp;format=png&amp;auto=webp&amp;s=1cc31a00e89c9ae82706bc0e94f985920ab35552)

and then I got carried away and created[ this interactive file-tree ](https://interactive-tree.remcostoeten.com/)component.

[aspect ratio is a bit off. Had a settings menu allowing changing of space\/font\/settings but rebase dungoofed me.](https://preview.redd.it/j5wm0y9utt2e1.png?width=1199&amp;format=png&amp;auto=webp&amp;s=bcd6719c37e9da1a274e048117792a2c0789b5cb)

Comes with a CLI that generates your entire tree + file contents in one command. Super customizable with tons of props, and (if I do say so myself) looks pretty damn good. It's not perfect, but it might be useful for someone else's docs or whatever use-case.

Cheers,

remcostoeten

*^(Color scheme+ neutral icons are a prop ;)**)*",Hoxyz,1gyo30v,https://reddit.com/r/webdev/comments/1gyo30v/built_beautiful_deadsimple_api_yet_highly/,https://www.reddit.com/r/webdev/comments/1gyo30v/built_beautiful_deadsimple_api_yet_highly/,2024-11-24 10:31:46,1,1.0,1,0,1,0,0,False,False,True,False,False,Showoff Saturday,https://a.thumbs.redditmedia.com/hx3fjcj02yKcmMNvUMUWkJWB4Wo1AAVxlUiGyk1kTo0.jpg,t3_1gyo30v
webdev,Portfolio website critique!,"I am a Media Studies Senior with a minor in CS. Looking to get feedback on my portfolio website. I think I have a vague idea of what I don't like about it, mainly it being that it's less about 'me' and more on the three.js scene. But, please give me some pointers! I am new to web dev and I'd like to know where to improve.

[shokkunn.art](https://shokkunn.art)

Thanks!

https://preview.redd.it/1a718zsf2s2e1.png?width=2511&amp;format=png&amp;auto=webp&amp;s=c788f40c1c55a3fbede20b84cd2a7a32a55e19e6

",Jupiternerd,1gyirsz,https://reddit.com/r/webdev/comments/1gyirsz/portfolio_website_critique/,https://www.reddit.com/r/webdev/comments/1gyirsz/portfolio_website_critique/,2024-11-24 04:31:41,3,1.0,3,0,2,0,0,False,False,True,False,False,Showoff Saturday,https://b.thumbs.redditmedia.com/naC9cySY_K3_VImTOaM0ROuVNcv5a5IIg9ZKPzj7V3o.jpg,t3_1gyirsz
webdev,Video Player Options,"Hello

I'm building a video platform and I've been using videojs, I've noticed its a little finicky and I've started looking at other options. Curious if anyone has any suggestions on a better player. 

Ideally it needs to handle hls and dash videos with quality controls, closed captions and airplay/chromecasting.

There seems to be a million of them and they all have video backends with them but I already have that, just need the player to be more polished than what I'm getting with video js. 

  
thanks!",alexhackney,1gyig98,https://reddit.com/r/webdev/comments/1gyig98/video_player_options/,https://www.reddit.com/r/webdev/comments/1gyig98/video_player_options/,2024-11-24 04:13:07,3,1.0,3,0,4,0,0,False,False,True,False,False,,self,t3_1gyig98
webdev,How to deal as a developer with large-ish json files embedded inside of an angular app?,"Context:

I have to maintain an angular 16 application, it is purely front-end.

The application has several large configuration files acting more like tables in a database which it gets it's data from.

Each file has an array of aprox 50 objects, which might not seem much but every object is very embedded with objects within objects within objects.

***I cannot change this, I tried asking, I tried offering other solutions (keep data on server in mongo or sql or etc and the FE app gets it via calls) it's not happening. The files are here to stay.***

A large part of my tasks ends up with me doing changes in these files by hand.

I know it doesn't sound like much but we're talking about large embedded objects without schemas, sometimes I need to only edit one sometimes I need to basically do a manual query to see some field from everything, sometimes I need to change in just 3 out of 50 objects.

My point is the work is very error prone because it's by hand and by me reading the files again and again to understand them.

***I cannot change this structure.***

As a developer what tools can I use to view/edit/manipulate these large json files in a sensible manner?

I am using VS Code as my code editor and my OS is Linux.

Thank you for reading this.",GeorgeSharp,1gy9xrk,https://reddit.com/r/webdev/comments/1gy9xrk/how_to_deal_as_a_developer_with_largeish_json/,https://www.reddit.com/r/webdev/comments/1gy9xrk/how_to_deal_as_a_developer_with_largeish_json/,2024-11-23 21:09:36,10,0.73,10,0,25,0,0,False,False,True,False,False,Question,self,t3_1gy9xrk
webdev,How to make more reliable reports using AI — A Technical Guide,,phicreative1997,1gyni8o,https://reddit.com/r/webdev/comments/1gyni8o/how_to_make_more_reliable_reports_using_ai_a/,https://firebirdtech.substack.com/p/how-to-make-more-reliable-reports,2024-11-24 09:52:57,0,0.43,0,0,0,0,0,False,False,False,False,False,Resource,https://b.thumbs.redditmedia.com/o7XqRO-SoeTj0SIfxKm_gkMlwo2HPzXqqND5lvS7FSc.jpg,t3_1gyni8o
