subreddit,title,selftext,author,id,permalink,url,created_utc,score,upvote_ratio,ups,downs,num_comments,total_awards_received,gilded,is_video,is_original_content,is_self,over_18,spoiler,link_flair_text,thumbnail,name
webdev,What are your Black Friday hauls (courses only),"For me, it’s:
1. joyofreact by Josh Comeau
2. CSS in JS by Josh Comeau 
3. Rails + Hotwire by pragmatic studios

stoked to get through them!",Ok-Carob5798,1h1kan0,https://reddit.com/r/webdev/comments/1h1kan0/what_are_your_black_friday_hauls_courses_only/,https://www.reddit.com/r/webdev/comments/1h1kan0/what_are_your_black_friday_hauls_courses_only/,2024-11-28 01:14:43,0,0.31,0,0,1,0,0,False,False,True,False,False,Resource,self,t3_1h1kan0
webdev,Asking for a webdev role sanity check,"I was hoping I could get some thoughts and observations about my current position and role. It doesn't make sense to me that my company is run this way, but here I am. 

We are an e-Commerce company (with a couple physical retail locations) that does about $15m a year through our Shopify website. We also do almost that much through Amazon. We have maybe 110 employees, most of which are in product development and fulfillment. 

I am the sole developer in the company. We have 1 IT guy, who helps run Netsuite as well as all IT functions. We have a Tech Manager who just started and is the 3rd one we've had in a year, who will mostly own Netsuite. I seldom speak with these people as our roles don't overlap.

I do *everything* regarding the website. I am a Front End Dev by training with 18 years experience (both in agencies and ecommerce). So, obviously I manage the functionality and look/feel of our site. I also build &amp; launch all of our products in Shopify (800+ SKUs), as well as maintain all of their information/images. I build all of the themes to swap for different site changes, promos or product launches. I build all of the discounts and promotions and upsells.  I own probably 25 of the 3rd party apps we have installed in our store to add functionality, meaning I am the point of contact if any of them have an issue. Search, cart, bundles, reviews, subscriptions, Klaviyo, etc. 

Our Shopify store was built by an agency 2 years ago, yet somehow I was not involved in that process. I was tasked with keeping our previous store running. The agency customized a ton of code because the our people involved *had* to have this or that functionality (most of which are no longer with the company anyway). There are no code comments or documentation of what they did or changed. This is my first Shopify experience, and I am trying to pick up Liquid as I go. 

Speaking of customized solutions... we are also running both a B2B and D2C solution off of the same platform that was NOT designed to do that natively. We have custom scripts running to calculate prices and shipping rules that don't play nice with other things we try to accomplish. 

I am also the point of contact for all of our employees for any issue with Shopify via Slack. I am 2nd layer support for any of our customers who have store issues our CS team cannot solve. 

I report to the marketing manager. She is not very technical. I make just over 90k. I work remote from home. Luckily, I don't touch anything order related, nor Amazon or Netsuite.

I have to ask... This isn't normal, right? 

I am barely keeping my head above water. I don't have any actual QA. I don't have any technical support (beyond Shopify support). I don't have any back up. I work on a non-technical marketing team. We are in the depths of holiday, and as you can imagine, it is unbelievably crazy. 

Do other $30m a year companies run like this? 

I often get approached from our VP of marketing with some idea that GAP or Sephora are doing on their website. Sure, that's a cool feature. I'm going to assume those places don't have a single developer who spends half his day context-switching. 

I've been here 6 years. When I started, we had 3 back end devs and myself. Slowly, they left and were never replaced. Which was why we went to Shopify. I guess this has been a 'slowly boil the frog' situation. 

I know I should probably find another job, but I live in a place that doesn't have a ton of jobs, and every remote job listing I see has 100+ applicants before I've even read it. I'm burnt out, looking for a sanity check. 

Thanks in advance. ",HippoLaxitive,1h0s00m,https://reddit.com/r/webdev/comments/1h0s00m/asking_for_a_webdev_role_sanity_check/,https://www.reddit.com/r/webdev/comments/1h0s00m/asking_for_a_webdev_role_sanity_check/,2024-11-27 00:58:10,14,0.95,14,0,14,0,0,False,False,True,False,False,,self,t3_1h0s00m
webdev,Finding remote jobs from US companies that will let me work from Europe ,"I’ll be moving to Spain next summer and my current employer won’t let me keep my job. I’d like to find something else with a US company that will let me work outside the US. 

If anyone has any recommendations for specific job boards or ways to find companies like this, that’d be awesome. Or any advice really for finding something like this. ",TacoWaffleSupreme,1h1ix61,https://reddit.com/r/webdev/comments/1h1ix61/finding_remote_jobs_from_us_companies_that_will/,https://www.reddit.com/r/webdev/comments/1h1ix61/finding_remote_jobs_from_us_companies_that_will/,2024-11-28 00:06:06,0,0.2,0,0,4,0,0,False,False,True,False,False,,self,t3_1h1ix61
webdev,Advice needed. Am I doing the right thing to switch to Dev?,"Hi everyone. 
I’m in need for some advice.
I’ve been working as a DevOps Engineer for about 5 years now. I’ve done system analysis for another 5 before that.
The reason why I moved on to DevOps was because I was given false hope and fell for the commercial of my employer. I was on my way to moving from Sys Analysis to Android Development because that was what I studied for. I was told by my current employer that I will be able to do development and will be able to sit with the developers and learn from them for experience but will work in DevOps. It’s been 5 years and I’ve never even met any of the developers face to face and only work with them if it’s Ops related. I want to get back into Developing but it’s been so long. I’m currently learning Kotlin but, I’m also 30 now and not sure if it’s worth it, or maybe just very despondent.
Any advice please?",NurieD,1h11xf7,https://reddit.com/r/webdev/comments/1h11xf7/advice_needed_am_i_doing_the_right_thing_to/,https://www.reddit.com/r/webdev/comments/1h11xf7/advice_needed_am_i_doing_the_right_thing_to/,2024-11-27 11:11:04,2,0.67,2,0,12,0,0,False,False,True,False,False,Question,self,t3_1h11xf7
webdev,JavaScript Best Practices: Tips for Writing Clean and Maintainable Code,,fernandes2d,1h0ztit,https://reddit.com/r/webdev/comments/1h0ztit/javascript_best_practices_tips_for_writing_clean/,https://qirolab.com/posts/javascript-best-practices-tips-for-writing-clean-and-maintainable-code,2024-11-27 08:35:27,3,0.8,3,0,1,0,0,False,False,False,False,False,Article,https://b.thumbs.redditmedia.com/O2AMBU0vCzBAPbOzNoncrbKo_0OZvrYKO5HP19PsQ5w.jpg,t3_1h0ztit
webdev,FormFast: Shadcn Form Builder,"https://preview.redd.it/a7hk67lxxa3e1.png?width=3437&amp;format=png&amp;auto=webp&amp;s=fa3888f064ff2474c6b6f330e6cd89a146ce859a

Building forms is a repetitive task, time-consuming, and quite complex to get it right. Due to the Shadcn components, Zod, and other open-source libs, I could build a tool for building forms quickly and easily. You will use a user interface to define the forms' data &amp; attributes then the code will be auto-generated for you including Zod schema and shadcn components. Feel free to try it out.

[https://ui.indie-starter.dev/form-builder](https://ui.indie-starter.dev/form-builder)

Source code  
[https://github.com/Ali-Hussein-dev/indie-ui](https://github.com/Ali-Hussein-dev/indie-ui)",PerspectiveGrand716,1h0zngj,https://reddit.com/r/webdev/comments/1h0zngj/formfast_shadcn_form_builder/,https://www.reddit.com/r/webdev/comments/1h0zngj/formfast_shadcn_form_builder/,2024-11-27 08:22:34,3,0.71,3,0,3,0,0,False,False,True,False,False,Resource,https://a.thumbs.redditmedia.com/vUpWWQLHGnrYYzpvWyWlNn7C0z9NktTRm9ewCbkK624.jpg,t3_1h0zngj
webdev,How to Handle Currency Conversion and Rounding Issues on a Global Platform?,"`To Be fair i am not a native English speaker so took some help from chat gpt for rewirting my problem to make it less painfull for you guys to read. my apologies` 

  
Hi everyone,

I’m working on a platform where service providers can list their offerings, and users from around the world can book them. We support multiple currencies, but our backend stores everything in USD for consistency. I’m facing a few challenges with pricing, conversion, and rounding, and I’m curious how others handle similar issues.

Here’s the setup:

1. A service provider creates a package with an hourly rate in their local currency (e.g., 100 GBP).
2. The backend converts the price to USD using the current exchange rate (e.g., 100 GBP → 124.56 USD).
3. Users see the price in their local currency, rounded to the nearest whole number (e.g., 125 USD).

Now the issues:

1. **Rounding Discrepancies**:
   * If the user books a package for 3 hours, they see `125 * 3 = 375 USD`. But the backend calculates `124.56 * 3 = 373.68 USD`. This mismatch confuses users.
   * If I always round on the frontend, the service provider might receive less than they expected.
2. **Currency Volatility**:
   * Exchange rates change over time. Locking the rate at the time of booking solves this for transactions, but I’m unsure how to handle edge cases, like refunds after months of exchange rate changes.
3. **Adding New Currencies**:
   * Storing prices in every currency a user might use isn’t scalable. If we add a new currency later, recalculating and storing all previous package prices in the new currency seems impractical.

**Questions for the Community**:

1. How do platforms like Airbnb or Fiverr handle pricing and rounding across currencies?
2. Is there a better way to deal with rounding discrepancies without overpaying/underpaying either party?
3. Are there efficient ways to handle refunds in multi-currency setups when exchange rates fluctuate?
4. Any scalable strategies for introducing new currencies without recalculating older data?

Would love to hear how you’ve tackled similar issues or any creative ideas you might have!

Thanks in advance! 😊",Aware-Silver-2221,1h101lb,https://reddit.com/r/webdev/comments/1h101lb/how_to_handle_currency_conversion_and_rounding/,https://www.reddit.com/r/webdev/comments/1h101lb/how_to_handle_currency_conversion_and_rounding/,2024-11-27 08:52:50,2,1.0,2,0,6,0,0,False,False,True,False,False,Discussion,self,t3_1h101lb
webdev,I don't understand how they build apps with AI,"To keep it short. I am modifying an app that uses python flask for backend, and I used SQLAlchemy as an ORM layer to work with my database. I had a model that is already in the db and I needed to add new boolean not nullable field to it. I know how to do it, but decided to test chatGPT. Yes, it was great at correcting auto-migration, as you need to pupulate this new field somehow to create it not nullable. But then things got tricky. I needed to add this field to my admin panel, and I wanted it to be 'read-only', so when user can see it but cannot edit it. And it tried to do it, he added it to list view and edit view, disabled the field, removed it from create view, added logic to assign value when the model is created in admin panel, BUT it cannot solve the issue, that when I start editing sexisting model where this disabled field is equal to True and save it, it gets saved to the DB as false, as disabled fields are not part of the form and then ORM treats it like False value. I gave it a chance, tried different promts but it couldn't correct this behaviour. 

So my thought is, I don't know how people are able to develop somethig complex with it. Sure, it helps me with snippents (like with migration), but when you try to get some even simple looking functionality it may introduce bugs and you are lucky if it is you who catches them, not the end-user. Also I get more satisfaction by researching and writing code myself, not writing instructions for who knows how long to get what I need. 

I just needed to put my thouths here as this situation got me a bit angry. Would be interesting to know your thoughts or experience of using AI, maybe it is me who doing something wrong.",NoWeather1702,1h095wr,https://reddit.com/r/webdev/comments/1h095wr/i_dont_understand_how_they_build_apps_with_ai/,https://www.reddit.com/r/webdev/comments/1h095wr/i_dont_understand_how_they_build_apps_with_ai/,2024-11-26 10:54:47,92,0.77,92,0,212,0,0,False,False,True,False,False,Discussion,self,t3_1h095wr
webdev,CUID2 is actually insecure?!??,"I took a dive into cuid2 source code and realized it does not use cryptographically secure random generator - it uses `Math.random` by default. This can be seen in multiple functions [here](https://github.com/paralleldrive/cuid2/blob/main/src/index.js).

This means that default / recommended way of using library relies on `Math.random`:

    import { createId } from '@paralleldrive/cuid2';
    
    const id = createId();

What??? Why `Math.random` is default in`cuid2`? In `cuid1`, default is `crypto.randomBytes`, `Math.random` is used only if first one is not available (check source code).

Does all this make `cuid2` insecure???",Zogid,1h0o22h,https://reddit.com/r/webdev/comments/1h0o22h/cuid2_is_actually_insecure/,https://www.reddit.com/r/webdev/comments/1h0o22h/cuid2_is_actually_insecure/,2024-11-26 21:58:10,9,0.6,9,0,16,0,0,False,False,True,False,False,,self,t3_1h0o22h
webdev,Gamespot API,"Has anyone used the Gamespot game api?
I’m trying &amp; it just seems so complicated. There’s numerous endpoints with specific fields in each one. I need the review score from the reviews endpoint which also has a game object within the results with the id &amp; name &amp; a releases object which contains an array of multiple releases of each game (by region or edition). Then there are games &amp; releases endpoints. games contains fields such as name, release_date, description, deck, an object of images for cover art etc, an array of genres etc. The releases endpoint seems to be the only one with platform, age rating, publishers &amp; developers fields. Each review &amp; release has its own id. There seems to be a game id in the game object within reviews that I can then access the same game in the games endpoint but that id won’t return the same game in the releases endpoint. I’m just finding it very challenging to get all of these fields which are spread out over numerous endpoints to align for the same game. There must be a simpler way. 

",mattsteen14,1h0e0fg,https://reddit.com/r/webdev/comments/1h0e0fg/gamespot_api/,https://www.gamespot.com/api/documentation,2024-11-26 15:08:14,22,0.89,22,0,9,0,0,False,False,False,False,False,Question,https://b.thumbs.redditmedia.com/K_RtIg64oHxKIXmFO9ZuunMbHJZK7dIMqTXl3eZ1szM.jpg,t3_1h0e0fg
webdev,How to code a blog? ,"Hi dev’s!
Hope you’re all having a great week.

I’m a fairly new web developer and mainly focus on front end and design side with html/css/JS. I’ve recently had some freelance success but some clients are asking for a functioning blog. I would love to add this as something I can offer my clients but I don’t know where to start. If somebody could point me in the right direction where I can learn how to do this? Any suggestions or tips are welcome! Thank you. ",PrincipleLazy3383,1h18obm,https://reddit.com/r/webdev/comments/1h18obm/how_to_code_a_blog/,https://www.reddit.com/r/webdev/comments/1h18obm/how_to_code_a_blog/,2024-11-27 16:44:17,0,0.29,0,0,9,0,0,False,False,True,False,False,Question,self,t3_1h18obm
webdev,Video series where someone builds a full-stack web app from scratch,"Hi everyone,
I'm looking for a video or video series where someone builds a full-stack web app from scratch—preferably unscripted or live-streamed. I'd like to see the entire process from development to production, including testing, best practices, and more.

I’d love it if the project uses the PERN stack, but I'm more interested in the overall approach and problem-solving so any stack will do. Most of the videos I've found are polished tutorials, mainly for beginners where everything is cut and edited to perfection. I'm looking for something more raw and realistic.

Any suggestions?",Lostpollen,1h0cnrt,https://reddit.com/r/webdev/comments/1h0cnrt/video_series_where_someone_builds_a_fullstack_web/,https://www.reddit.com/r/webdev/comments/1h0cnrt/video_series_where_someone_builds_a_fullstack_web/,2024-11-26 14:06:15,28,0.79,28,0,20,0,0,False,False,True,False,False,,self,t3_1h0cnrt
webdev,See what's new in Gimli Tailwind 4.4,,JHjertvik,1h1b9xv,https://reddit.com/r/webdev/comments/1h1b9xv/see_whats_new_in_gimli_tailwind_44/,https://gimli.app/gimli_tailwind_4_4,2024-11-27 18:31:51,0,0.17,0,0,1,0,0,False,False,False,False,False,,default,t3_1h1b9xv
webdev,Fast ecommerce,"Hey everyone, long story short. I built a custom website for my buddy's mechanic shop and now he wants an e-commerce store. I don't care to build the backend for that. 

What would your solutions be to implementing a quick store for this site that can stay relative to theme and can take payments. I've been looking into stuff like Shopify or woocommerce but it seems like they need to be implemented through a theme. ",yoiinkk,1h0pecp,https://reddit.com/r/webdev/comments/1h0pecp/fast_ecommerce/,https://www.reddit.com/r/webdev/comments/1h0pecp/fast_ecommerce/,2024-11-26 22:55:57,3,0.72,3,0,6,0,0,False,False,True,False,False,,self,t3_1h0pecp
webdev,How is this possible?,"I have a customer who asked me to create something similar to this turninghearts.com. They have a web app (app.turninghearts.com) where people can upload and save their (unlimited) photos.
What I dont understand is how can this bussines work from cost perspective? They charge a one time payment for the profile but aws s3 bill just keeps growing every month. Wouldnt the aws bill eventually be so big that they wouldnt be able to cover it?
Any explanaition or experiance on the matter is much appreciated",Dvorator1,1h06h2y,https://reddit.com/r/webdev/comments/1h06h2y/how_is_this_possible/,https://www.reddit.com/r/webdev/comments/1h06h2y/how_is_this_possible/,2024-11-26 07:37:57,64,0.9,64,0,35,0,0,False,False,True,False,False,Discussion,self,t3_1h06h2y
webdev,SmarterASP.NET for Hosting a Low-Traffic Web App?,"I've developed a web app (currently running only on my PC) with the following stack.

Frontend: Angular (TypeScript, HTML, CSS)
Backend: ASP.NET Core (.NET 8.0) in C#
Database: Any database that supports SQL and stored procedures (or equivalent)

With many years of desktop application development, this is my first time working with web development and specifically ==&gt; deploying a web app. I'm unfamiliar with the process and which hosting services are the most reliable.

I'm trying to figure out the most practical hosting for a 'low-traffic app'. 

Microsoft's Azure hosting seems powerful, but its pricing is high and confusing.

SmarterASP.NET, on the other hand, has incredibly simple pricing plans-so simple they seem almost too good to be true. My main question is: Is SmarterASP.NET a good choice? Has anyone used it, and are there any drawbacks or hidden issues I should know about?",PossibleBig6306,1h0xn6n,https://reddit.com/r/webdev/comments/1h0xn6n/smarteraspnet_for_hosting_a_lowtraffic_web_app/,https://www.reddit.com/r/webdev/comments/1h0xn6n/smarteraspnet_for_hosting_a_lowtraffic_web_app/,2024-11-27 06:03:51,1,1.0,1,0,2,0,0,False,False,True,False,False,,self,t3_1h0xn6n
webdev,How to reduce LCP,"Hello,

I am stuck at 92/100 performance score on mobile devices for my website [nextbestai.com](http://nextbestai.com)

To get to this score was rough, and I have done all I can think of in terms of cache and using lightweight builders like elementor and blocksy. 

Now from the pagespeed insights it seems the issue comes from LCP , more specifically the H1 which covers quite a big chunk of space over the fold. I have tried editing, simplifying it, but it still won't get my score higher / lower the LCP.

What am I missing? 

Any tips are appreciated.

https://preview.redd.it/xs0wgvjmlf3e1.png?width=1790&amp;format=png&amp;auto=webp&amp;s=13f6e642c555b0a4f1fe683bbba2ec7505283f56

https://preview.redd.it/f0473jkklf3e1.png?width=1728&amp;format=png&amp;auto=webp&amp;s=d18a8e742fd1611f5f273ec8cbdb46c17cb5beab

Any feedback would be a blessing, thank you in advance",Emotional-Bee-474,1h12egf,https://reddit.com/r/webdev/comments/1h12egf/how_to_reduce_lcp/,https://www.reddit.com/r/webdev/comments/1h12egf/how_to_reduce_lcp/,2024-11-27 11:42:24,0,0.29,0,0,6,0,0,False,False,True,False,False,,https://b.thumbs.redditmedia.com/g-UrxusUGAvKYX8QB3mNix77ym4xcTssnmyp96DYP4Q.jpg,t3_1h12egf
webdev,"A question on canvas, bootstrap, and resizing","Hi all, I'm trying to make a page which loads an image into a canvas and then allows drawing on top of the image. The image itself is large, so I would like to be able to resize it by altering my window size.

Currently, the image is loaded into an &lt;img src&gt; and has Bootstrap's img-fluid class and that manages scaling nicely. However, I would like to add a canvas on top of the image to draw on it. If I change the &lt;img src&gt; to a &lt;canvas&gt; with the background specified as the image, I run into all sorts of problems. Either the image is tiny or the image is huge, depending on how I'm setting the background (use the style tag and the image is tiny, use javascript to perform a drawImage and it's huge), and in either case it does not scale with the page.

I am pretty stuck with Bootstrap but I'm not particularly stuck with canvas if there is a different or better way to do this. If anyone has any suggestions then please let me know. Given how few results are available from googling, I assume I must be doing something this was never intended to do (?)",Monster-Zero,1h0wevc,https://reddit.com/r/webdev/comments/1h0wevc/a_question_on_canvas_bootstrap_and_resizing/,https://www.reddit.com/r/webdev/comments/1h0wevc/a_question_on_canvas_bootstrap_and_resizing/,2024-11-27 04:49:41,1,1.0,1,0,0,0,0,False,False,True,False,False,Question,self,t3_1h0wevc
webdev,Struggling with Creativity: Need Help Designing My Startup's E-Commerce Site,"I'm working on my startup and can handle the backend, build the frontend with React, and perfectly align all the divs on the screen. But when it comes to creativity, I struggle. If I choose color combinations or images myself, it’s likely to be a disaster.

I need advice on how to approach this. I need to build an e-commerce site and app, but at this early stage, I can't afford to spend $1,000+ on professional designs. My budget is around $300, but that might only get me basic quality work.

What are my options? How can I create a decent design without breaking the bank?",HurryFormal7067,1h0m27t,https://reddit.com/r/webdev/comments/1h0m27t/struggling_with_creativity_need_help_designing_my/,https://www.reddit.com/r/webdev/comments/1h0m27t/struggling_with_creativity_need_help_designing_my/,2024-11-26 20:34:57,3,1.0,3,0,10,0,0,False,False,True,False,False,,self,t3_1h0m27t
webdev,"allais.site Create UI for React , Svelte and Vue.js ",,Real_Young7886,1h12q5x,https://reddit.com/r/webdev/comments/1h12q5x/allaissite_create_ui_for_react_svelte_and_vuejs/,https://i.redd.it/bzd59t36pf3e1.gif,2024-11-27 12:02:52,0,0.25,0,0,4,0,0,False,False,False,False,False,News,https://b.thumbs.redditmedia.com/D0YD4_229wSvmO5x7X4IgnEwLyeDSrUl4HAmWm9ThkY.jpg,t3_1h12q5x
webdev,Automated Decision Logs in AI-Assisted Coding,,feross,1h0tkbc,https://reddit.com/r/webdev/comments/1h0tkbc/automated_decision_logs_in_aiassisted_coding/,https://addyosmani.com/blog/automated-decision-logs/,2024-11-27 02:16:08,1,0.6,1,0,0,0,0,False,False,False,False,False,,https://b.thumbs.redditmedia.com/8eJpzeQTA6fB94kWBvmtwrf_KZ0bYgOeksnjnjPebXY.jpg,t3_1h0tkbc
webdev,"WebStorm 2024.3 says it collects data to ""validate compliance"" with non-commercial license",,taxiforone,1h024fz,https://reddit.com/r/webdev/comments/1h024fz/webstorm_20243_says_it_collects_data_to_validate/,https://i.redd.it/522yg978y53e1.png,2024-11-26 03:16:55,61,0.84,61,0,16,0,0,False,False,False,False,False,,https://b.thumbs.redditmedia.com/bZPEHR7c7XBYLhy5nScPKuxc7xGLMecsFFd6e5fgWUo.jpg,t3_1h024fz
webdev,Stop using CSS and Test Ids to locate elements in tests,"My opinionated article on how to select web elements in tests. Looking forward to your feedback.

[https://medium.com/codex/stop-using-css-and-test-ids-to-locate-elements-0001041d1709](https://medium.com/codex/stop-using-css-and-test-ids-to-locate-elements-0001041d1709)",RevolutionaryLocal54,1h10q5s,https://reddit.com/r/webdev/comments/1h10q5s/stop_using_css_and_test_ids_to_locate_elements_in/,https://www.reddit.com/r/webdev/comments/1h10q5s/stop_using_css_and_test_ids_to_locate_elements_in/,2024-11-27 09:45:00,0,0.33,0,0,22,0,0,False,False,True,False,False,,self,t3_1h10q5s
