subreddit,title,selftext,author,id,permalink,url,created_utc,score,upvote_ratio,ups,downs,num_comments,total_awards_received,gilded,is_video,is_original_content,is_self,over_18,spoiler,link_flair_text,thumbnail,name
webdev,Monthly Getting Started / Web Dev Career Thread,"Due to a growing influx of questions on this topic, it has been decided to commit a monthly thread dedicated to this topic to reduce the number of repeat posts on this topic. These types of posts will no longer be allowed in the main thread.

Many of these questions are also addressed in the sub FAQ or may have been asked in [previous monthly career threads](/r/webdev/search?q=flair%3AMonthlyCareerThread&amp;restrict_sr=on&amp;sort=new&amp;t=all).

Subs dedicated to these types of questions include [r/cscareerquestions](/r/cscareerquestions) for general and opened ended career questions and [r/learnprogramming](/r/learnprogramming) for early learning questions.

A general recommendation of topics to learn to become industry ready include:

- [HTML/CSS/JS Bootcamp](https://www.udemy.com/course/javascript-beginners-complete-tutorial)
- [Version control](https://www.atlassian.com/git/tutorials/what-is-version-control)
- [Automation](https://blog.logrocket.com/tools-and-modern-workflow-for-front-end-developers-505c7227e917/)
- [Front End Frameworks (React/Vue/Etc)](https://www.freecodecamp.org/news/complete-guide-for-front-end-developers-javascript-frameworks-2019/)
- [APIs and CRUD](https://www.freecodecamp.org/news/crud-operations-using-vanilla-javascript-cd6ee2feff67/)
- [Testing (Unit and Integration)](https://raygun.com/blog/javascript-unit-testing-frameworks/)
- [Common Design Patterns](https://www.patterns.dev/)

You will also need a portfolio of work with 4-5 personal projects you built, and a resume/CV to apply for work.

Plan for 6-12 months of self study and project production for your portfolio before applying for work.",AutoModerator,1gh3oc5,https://reddit.com/r/webdev/comments/1gh3oc5/monthly_getting_started_web_dev_career_thread/,https://www.reddit.com/r/webdev/comments/1gh3oc5/monthly_getting_started_web_dev_career_thread/,2024-11-01 12:00:30,17,0.91,17,0,145,0,0,False,False,True,False,False,Monthly Career Thread,self,t3_1gh3oc5
webdev,Is this still valid for frontend devs who are not designers?,,an4s_911,1h352kj,https://reddit.com/r/webdev/comments/1h352kj/is_this_still_valid_for_frontend_devs_who_are_not/,https://i.redd.it/tjghy1vq0z3e1.jpeg,2024-11-30 05:00:27,717,0.94,717,0,107,0,0,False,False,False,False,False,Question,https://a.thumbs.redditmedia.com/uYdeznY2yqpPTMu0jkv0GcxUBrx1nutxjyP1xFYKNz4.jpg,t3_1h352kj
webdev,Shopify devs did a lot of work again this year ,,Previous_Influence_8,1h300yi,https://reddit.com/r/webdev/comments/1h300yi/shopify_devs_did_a_lot_of_work_again_this_year/,https://bfcm.shopify.com/,2024-11-30 00:23:38,226,0.94,226,0,23,0,0,False,False,False,False,False,,https://b.thumbs.redditmedia.com/I3K4i4i2qZJ8BcKHm6SYh2F6Ad0ZkZC8yDMpRzvHj4g.jpg,t3_1h300yi
webdev,AI Won't Replace Us Developers Yet (A Humble Reality Check),"So there I was neck-deep in a MySQL nightmare. 🤯

Tried ChatGPT. Struck out. Claude? Nope. Gemini was  a total bust as well. These AI models were giving me solutions that looked technically correct but were just wrong.

Spent hours frustrated ready to tear my hair out.

Then I did what we ALL do, Stack Overflow. And boom    
 some legend had posted EXACTLY my problem from two years ago. With a solution written by an actual person. Commented, explained, and nuanced.
No AI could've navigated the specific context of my issue like that person did.

Moral of the story, AI is a tool. We're the craftspeople. 💻🛠️",Banksareaproblem,1h2xkzo,https://reddit.com/r/webdev/comments/1h2xkzo/ai_wont_replace_us_developers_yet_a_humble/,https://www.reddit.com/r/webdev/comments/1h2xkzo/ai_wont_replace_us_developers_yet_a_humble/,2024-11-29 22:25:58,202,0.84,202,0,126,0,0,False,False,True,False,False,,self,t3_1h2xkzo
webdev,PSA: You are good enough !,"I am not sure why I felt compelled to write this post. 

Perhaps it is the long unemployment stint I have been on and the rough interview loops I've been enduring or maybe I just needed the cathartic release. 

Either way, I want to take those who are interested down memory lane with me and reflect on a past experience of mine that helps me through tough times like this. 

It all started many years ago when I worked at a company with another developer. Lets call him Robert. Robert was by no means a super star developer but he was an amazingly nice person and was a pleasure to work with. 

However, he did not show qualities I would expect of a top developer.  No great understanding of CS. Not an algorithmic god. Minimal knowledge of craftmanship aspects in software. No extensive knowledge of building systems. He was just an every-day developer. 

One day Robert gets called by a FANG adjacent recruiter telling him that a team is interested in hiring him.  

What was different about this situation was the recruiter did not send him through the front door.  His interview loop consisted of 3 calls. 1 recruiter screen, 1 call with the hiring manager, 1 call with the wider team. 

He did not have to endure a single technical round (I don't want to go into the circumstances of why as I don't want to dox myself)

He of course takes this offer, and starts two weeks later. I was very happy for him and wished him the best and that was that. 

Fast forward to today. I am sitting here going through the trenches, 5 - 6 round loops. Code + system design + Behavioural. The whole sh\*t fest. 

Occasionally, the doubts creep in. Am I good enough ? should I throw in the towel and go into the #trades ? is my experience worthless ?

Then I always think back to our boy Robert.

Roberts story showed me that a vast number of developers probably can work these ""top"" roles if given the chance. 

The interview practices we endure are nothing more than a filter to whittle down the demand.  

When you fail an interview you are doing just that, failing a filter. It has no bearing on you, your ability, or your identity. Like Robert, if you could jump past all the interview mess you would be just fine!

As an aside, I believe that Robert would likely not have made it through the traditional interview loop for the same position.

  
Anyways, I hope you liked my story and wish you all the best if you are going through it also.

Lastly, I realise this post comes across bitter and jealous. It is not my intention (although perhaps I am a little). I am just a beaten-down dev struggling through it. I wish Robert the best and hope he is happy and killing it.

  






  


  
",Invisible_Wetface,1h3deuo,https://reddit.com/r/webdev/comments/1h3deuo/psa_you_are_good_enough/,https://www.reddit.com/r/webdev/comments/1h3deuo/psa_you_are_good_enough/,2024-11-30 14:13:55,7,0.89,7,0,0,0,0,False,False,True,False,False,,self,t3_1h3deuo
webdev,"Updating to the latest Chrome removes the ability to skip the ""Your connection is not private"" page for localhost","Restarted Chrome today, which triggered the auto update.

Since then, visiting the same localhost pages I used to open brings up the ""your connection is not private"" screen (NET::ERR\_CERT\_AUTHORITY\_INVALID), forcing me to have to manually bypass it every time.

chrome://flags/#allow-insecure-localhost no longer exists. I used to have that enabled. Is that why?

Anyone got any workarounds? Can't find anything online yet.

The expiry date for my certificate hasn't passed yet, so it's not that.

I don't think its anything to do with my device either, since I've been able to dev as normal a day ago, and all I've done is shut my laptop (haven't restarted it or anything) - I've checked the localhost certs on my device and they havent expired.",ButterscotchTiny6828,1h38tho,https://reddit.com/r/webdev/comments/1h38tho/updating_to_the_latest_chrome_removes_the_ability/,https://www.reddit.com/r/webdev/comments/1h38tho/updating_to_the_latest_chrome_removes_the_ability/,2024-11-30 09:11:52,14,0.86,14,0,4,0,0,False,False,True,False,False,,self,t3_1h38tho
webdev,We made a free repo of 100+ Black Friday Deals for Front End Devs,"We were looking for stuff to buy for myself and decided to collate a list for anyone hoping to snag a good deal this sale season. Hope this helps you guys too.

It includes learning resources, tools and templates curated for the front end dev community.

Support it with a star and let us know if we should continue doing this for next year!

[https://github.com/greatfrontend/black-friday-cyber-monday-deals](https://github.com/greatfrontend/black-friday-cyber-monday-deals)",yangshunz,1h31e4p,https://reddit.com/r/webdev/comments/1h31e4p/we_made_a_free_repo_of_100_black_friday_deals_for/,https://www.reddit.com/r/webdev/comments/1h31e4p/we_made_a_free_repo_of_100_black_friday_deals_for/,2024-11-30 01:33:25,26,0.74,26,0,10,0,0,False,False,True,False,False,,self,t3_1h31e4p
webdev,"What exactly is ""streaming"" a video?","I'm working on a youtube clone app(just to learn) and I've managed to get the video uploads to aws s3 working, but I'm confused about how I should be serving the videos to the frontend.

I always thought it's as simple as making a html video element, getting cloudfront infront of s3 and just pass in the cloudfront url as the src attribute, but people are talking about streaming videos and now I'm wondering if this is not actually the correct way to display videos from your backend. Am I supposed to set up a stream in my backend and serve the data in chunks instead, as opposed to simply making a html video element, throwing the url to the src and calling it a day?",bae-va,1h2mth4,https://reddit.com/r/webdev/comments/1h2mth4/what_exactly_is_streaming_a_video/,https://www.reddit.com/r/webdev/comments/1h2mth4/what_exactly_is_streaming_a_video/,2024-11-29 14:22:08,198,0.92,198,0,38,0,0,False,False,True,False,False,,self,t3_1h2mth4
webdev,What tools or physical items help you learn?,"I noticed for me it’s easier to think when I stand or walk around my room, so I was thinking maybe I should buy a standing desk.

Also, if I’m learning some algorithm, it’s easier to visualize it if I draw on a physical whiteboard, like many of YouTube videos do explaining the algorithm. 

Or maybe an iPad but it’s expensive. 

So I’d love to hear your tools or physical items which help you learn and understand, basically an investment to become better ",lponkl,1h3ajvz,https://reddit.com/r/webdev/comments/1h3ajvz/what_tools_or_physical_items_help_you_learn/,https://www.reddit.com/r/webdev/comments/1h3ajvz/what_tools_or_physical_items_help_you_learn/,2024-11-30 11:19:46,3,1.0,3,0,7,0,0,False,False,True,False,False,Question,self,t3_1h3ajvz
webdev,How much would it cost for an art portfolio website?,"Hello! I've made this post to find a ballpark value for a multipage website for my art portfolio. 

Some of the features I'm looking for:

Blog-like post creation with the ability to post multiple images and videos in a thread-like fashion with a comment section and like buttons.

Ability to make simple text posts and host polls.

Different pages with a nav bar: Home, socials, different threads, etc..

Most recent posts on the home page.

Site banner with my basic details and a revolving random image tray of my works.

Ability to archive and remove posts.

---

Sorry if this is extensive. But I like have a lot of features at my disposal. I hope to one day add a courses navigation to the site, which is why I'm adding a lot of this functionality now. Anyway! A ballpark value for what this would cost me would be appreciated. ",Gry1080,1h39rnh,https://reddit.com/r/webdev/comments/1h39rnh/how_much_would_it_cost_for_an_art_portfolio/,https://www.reddit.com/r/webdev/comments/1h39rnh/how_much_would_it_cost_for_an_art_portfolio/,2024-11-30 10:22:49,3,0.71,3,0,14,0,0,False,False,True,False,False,Question,self,t3_1h39rnh
webdev,I Built a Website for Christmas Movie Lovers: UltimateXmasMovies.com,"Hi everyone! I’ve been working on a passion project just in time for the holidays. [UltimateXmasMovies.com](https://ultimatexmasmovies.com/) is a platform where Christmas movie enthusiasts can discover, vote for, and rank their favorite holiday films. It also features a 24 Days of Christmas advent calendar with daily movie picks and trivia to get you in the festive spirit.

I’d love your feedback or suggestions to make it even better! 🎄✨",goldenking55,1h3a12n,https://reddit.com/r/webdev/comments/1h3a12n/i_built_a_website_for_christmas_movie_lovers/,https://www.reddit.com/r/webdev/comments/1h3a12n/i_built_a_website_for_christmas_movie_lovers/,2024-11-30 10:41:37,2,1.0,2,0,2,0,0,False,False,True,False,False,,self,t3_1h3a12n
webdev,"Understand IAM, OAuth, OpenID Connect, SAML, SSO, and JWT in one article",A useful post for understanding nowadays auth.,Party_Refuse8887,1h34qxe,https://reddit.com/r/webdev/comments/1h34qxe/understand_iam_oauth_openid_connect_saml_sso_and/,https://blog.logto.io/iam-oauth-oidc-saml-sso-jwt,2024-11-30 04:41:02,7,1.0,7,0,0,0,0,False,False,False,False,False,Article,https://b.thumbs.redditmedia.com/5PUjT6rgA5Lz04b5Bb0cTt1GZQG-ai4ltXuAURGia6k.jpg,t3_1h34qxe
webdev,"I found this beautiful website and I wanted to recreate it and know what kind of stack would be optimal for it, also are there any nocode website builders that this kind of animations and components can be made with easily, like WordPress and Wiz? (Link in description)","https://tokyocatspecialists.jp/

Thank you very much to anyone who decides to help me, much love",Monkeyke,1h35ulc,https://reddit.com/r/webdev/comments/1h35ulc/i_found_this_beautiful_website_and_i_wanted_to/,https://www.reddit.com/r/webdev/comments/1h35ulc/i_found_this_beautiful_website_and_i_wanted_to/,2024-11-30 05:47:14,4,0.7,4,0,3,0,0,False,False,True,False,False,Question,self,t3_1h35ulc
webdev,First Portfolio Feedback,"Hello!!

I'm 19 years old starting my web dev journey and trying to land my first job (Things are looking pretty hopeless right now, life is hard and I want to cry) but I just completed my 17 week bootcamp and made my first ever portfolio using react!!

I tried to make it video game themed but idk if its too weird or cringe. I'd really appreciate some honest feedback and constructive criticism like is it responsive or too laggy? Any feedback would be gold! :))

Here it is: [https://nooryas-portfolio.netlify.app/](https://nooryas-portfolio.netlify.app/)

Note: I didn't have enough time to make it fully responsive on mobile, so please don't view it on your phone 😭😭 Also I tried really hard but idk how to make the text shadows look consistent on safari so I just gave up but Firefox and chrome should be ok?",Possible-Success7043,1h30u71,https://reddit.com/r/webdev/comments/1h30u71/first_portfolio_feedback/,https://www.reddit.com/r/webdev/comments/1h30u71/first_portfolio_feedback/,2024-11-30 01:04:27,8,0.84,8,0,6,0,0,False,False,True,False,False,Showoff Saturday,self,t3_1h30u71
webdev,🚀 I created a social blogging app with tons of feature,"Hello everyone,

I would love to get your feedback on my latest project, it's a fully fledged content sharing platform built specifically for the React community.

Live: [https://pure-react.vercel.app/](https://pure-react.vercel.app/)

GitHub Repo: [https://github.com/Bharat610/pureReact](https://github.com/Bharat610/pureReact)

**Note:** Please sign up with an actual email id to check out the features, however if you don't want to sign up you can use this for testing -- username: akash\_321 password: Akash@123

**Features:**

* Secure user sign-up with email verification and JWT-based authorization
* **Create, Edit, and Delete Posts**: Create post with **rich text editor**, add cover image, add category to post, edit and delete existing post from user page. \*Like a post, comment on a post, sort post based on popularity and recency, filter post based on category.
* Save posts to reading list.

I would love to hear your feedback and suggestions! Please check it out and let me know what you think and areas where I can improve.

Thanks!!",Any_Somewhere_61,1h3ahz2,https://reddit.com/r/webdev/comments/1h3ahz2/i_created_a_social_blogging_app_with_tons_of/,https://www.reddit.com/r/webdev/comments/1h3ahz2/i_created_a_social_blogging_app_with_tons_of/,2024-11-30 11:15:51,0,0.5,0,0,8,0,0,False,False,True,False,False,Showoff Saturday,self,t3_1h3ahz2
webdev,Wix and WordPress exist,"If a person is only familiar with HTML, CSS, a little Java script, decap CMS....

Should I become familiar with WordPress development and headless CMS, wix would then be a breeze to pick up? And vice versa?",zackzuse,1h3ac05,https://reddit.com/r/webdev/comments/1h3ac05/wix_and_wordpress_exist/,https://www.reddit.com/r/webdev/comments/1h3ac05/wix_and_wordpress_exist/,2024-11-30 11:03:58,0,0.4,0,0,1,0,0,False,False,True,False,False,,self,t3_1h3ac05
webdev,How to host a dynamic java web app?,"[https://github.com/Safnaj/Java-Web-Application](https://github.com/Safnaj/Java-Web-Application)

Say this is a project I want to host. How do I proceed?",No_Place_6696,1h3518g,https://reddit.com/r/webdev/comments/1h3518g/how_to_host_a_dynamic_java_web_app/,https://www.reddit.com/r/webdev/comments/1h3518g/how_to_host_a_dynamic_java_web_app/,2024-11-30 04:58:19,3,1.0,3,0,1,0,0,False,False,True,False,False,,self,t3_1h3518g
webdev,CSS Today: Powerful Features You Might Not Know About,,jtimo,1h2hiv7,https://reddit.com/r/webdev/comments/1h2hiv7/css_today_powerful_features_you_might_not_know/,https://blog.meetbrackets.com/css-today-powerful-features-you-might-not-know-about-39adbbd5c65b,2024-11-29 08:44:44,113,0.97,113,0,21,0,0,False,False,False,False,False,Article,https://b.thumbs.redditmedia.com/Y5HejNwX2ukqsHp4TMk0PJ406Jf2C7z00UkIlclO68A.jpg,t3_1h2hiv7
webdev,[Showoff Saturday] Track Real-time Video Game Leaderboards with Friends!,"Hi all, at the start of this month (November) I started a 12 projects in 12 months endeavor. I just wrapped up my first project:

[https://www.brds.gg/](https://www.brds.gg/)

My friends and I would track our stats in a google spreadsheet for FPS games we play. I figured I would build a website around that for the first project!

It allows you to:

1. Create a library of games and add whatever metrics you'd like.
2. Create ""sessions"" that you can share with friends
3. Compete in real-time via leaderboards
4. View analytics on past sessions

 Its bare bones right now but should function! Feedback welcome if you have any...

Tech Stack: Next JS, Convex, Redux Toolkit, Tailwind, Fathom Analytics",dazftw,1h39mwl,https://reddit.com/r/webdev/comments/1h39mwl/showoff_saturday_track_realtime_video_game/,https://www.reddit.com/r/webdev/comments/1h39mwl/showoff_saturday_track_realtime_video_game/,2024-11-30 10:12:44,1,1.0,1,0,0,0,0,False,False,True,False,False,,self,t3_1h39mwl
webdev,New company has clients point by nameserver instead of A record? There has to be a better way.,"Hey everyone, I recently started working at a website development company and ran into something that feels unnecessarily complicated. Here’s the situation:

When we build a website for a client, we ask them to point their domain to our **nameservers** so the website can go live. This means we end up managing their entire DNS, even though we’re just the website provider. It's an extra burden, especially when clients request changes for things like email or subdomains.

I asked why we don’t just have clients point their domain to our server using an **A record**, and here’s the explanation I got:

“If we ever need to change our server’s IP address (which has happened a couple of times), all clients would need to update their A record to the new IP. That’s impractical with thousands of clients. Nameservers avoid this issue because we can make IP changes behind the scenes without involving the client.”

Okay, that makes sense, but using nameservers feels inefficient for so many other reasons... I feel like there has to be a better way to solve this problem without the extra workload.

I’d love to hear your thoughts considering my role at the company isn't as technical but this workflow is hugely affecting my output and I want to offer them a better solution. What’s the most practical way to minimize client disruption while reducing our DNS management responsibilities?",ZeusBabylonski,1h2oz0r,https://reddit.com/r/webdev/comments/1h2oz0r/new_company_has_clients_point_by_nameserver/,https://www.reddit.com/r/webdev/comments/1h2oz0r/new_company_has_clients_point_by_nameserver/,2024-11-29 16:02:56,25,0.81,25,0,33,0,0,False,False,True,False,False,Discussion,self,t3_1h2oz0r
webdev,How to create a blog section like this?,"I want to create a blogging section on a website that looks like this: [https://www.apollo.io/magazine](https://www.apollo.io/magazine)

How can I design this?",1tagupta,1h37fln,https://reddit.com/r/webdev/comments/1h37fln/how_to_create_a_blog_section_like_this/,https://www.reddit.com/r/webdev/comments/1h37fln/how_to_create_a_blog_section_like_this/,2024-11-30 07:31:45,1,0.6,1,0,1,0,0,False,False,True,False,False,Question,self,t3_1h37fln
webdev,How to make LLM update code in the code editor seamlessly,"So I have a project I'm working on and it will require an LLM to update existing code and write it back to the editor,where I'm having issues is finding a good way to update anywhere within the code without Messing up unchanged ones, I know converting the source code to AST can help when doing function/class wide updates it has easy as transversing the nodes and identifying which function or classes require change.

But for use cases where the updates are limited to few lines of code or for code that are just scripts with no classes and functions,I can't really come up with a good solution to update the code with  messing up other lines that aren't affected, I've tried searching on Google to see similar implementations or articles on it but all of them only talk about how to parse and transverse AST.",FickleSwordfish8689,1h3b2pu,https://reddit.com/r/webdev/comments/1h3b2pu/how_to_make_llm_update_code_in_the_code_editor/,https://www.reddit.com/r/webdev/comments/1h3b2pu/how_to_make_llm_update_code_in_the_code_editor/,2024-11-30 11:56:33,0,0.33,0,0,2,0,0,False,False,True,False,False,Question,self,t3_1h3b2pu
webdev,New technology in prod fears,"I'm wondering if anyone else has fears of trying new tech in prod. I'm not just talking about trying out a new library. I'm talking about standing up stuff that you've never really used in prod before.

I feel like I can play around with new tech locally but I always fear that there must be some prod specific stuff that I'm missing. Extra load revealing issues, incorrect assumptions made, config stuff that I'm expected to know but don't, etc. I tend to use stuff I'm familiar with just because there are some bugs that have been really hard to figure out. Managers have asked before *how* a bug could ***possibly*** be introduced, and the thought of saying, ""eh, this is just my first time using it and I'm learning"" sounds like a good way to get on someone's shitty developer list. Most managers that I've had seem to think that any bug is just completely unacceptable, so the thought of admitting to incompetence or ignorance seems like out of the question.

Do most of you just stick with shit you know, or do you take the plunge if you think something might be better? Or go with something new that might work just as well but also save some paint points from existing tech? I'm not talking about going with new stuff just because it's new.

  
**Example**

I used to work at a place with multiple applications. I was talking to someone on another team in the enterprise one day about their architecture. This team literally didn't use a load balancer to load balance between different servers. They literally made separate URLs for the internal team to use. If one server went down, they would launch up the other and tell the internal customers to go the other URL. Load balancing is SO basic and it used to strike me as extremely weird that they wouldn't just add that in. I can imagine that it might be really scary for them though because of how critical the app was, and you could really screw up production if you messed up your session management setup. You might set up the load balancer and show that you're hitting the servers and that the website is working well, and then totally not do anything about session management. It hits production and then it's a disaster! Ok - you see errors and then you just shut down the other servers and you're pretty much back where you started. Not the end of the world but hopefully you see my point.",wannacommissionameme,1h35jrd,https://reddit.com/r/webdev/comments/1h35jrd/new_technology_in_prod_fears/,https://www.reddit.com/r/webdev/comments/1h35jrd/new_technology_in_prod_fears/,2024-11-30 05:28:34,0,0.5,0,0,3,0,0,False,False,True,False,False,,self,t3_1h35jrd
webdev,First Website Created-- Need frontend feedback,"Hey, I am currently 18 years old and I just wanted to get feedback on my website design. Spent quite a bit of time since I am new to web developing, but please give me feedback on how the website looks and the interactibility of it. Also, what are the best frontend languages for making a sleek landing page?

Here is the website: [asorti.co](http://asorti.co)

Thanks!!",One-Smile-69420,1h35esx,https://reddit.com/r/webdev/comments/1h35esx/first_website_created_need_frontend_feedback/,https://www.reddit.com/r/webdev/comments/1h35esx/first_website_created_need_frontend_feedback/,2024-11-30 05:20:23,1,0.67,1,0,3,0,0,False,False,True,False,False,,self,t3_1h35esx
