subreddit,title,selftext,author,id,permalink,url,created_utc,score,upvote_ratio,ups,downs,num_comments,total_awards_received,gilded,is_video,is_original_content,is_self,over_18,spoiler,link_flair_text,thumbnail,name
devops,Seeking suggestion for Industry level Devops projects.,"Hi all,
I'm looking to create  industry-level DevOps project which can help me to land a job in Devops or Cloud industry .

I have experience with Docker, Kubernetes, Jenkins, AWS, Git, Prometheus, and Grafana, and I want to combine these tools into a practical, resume-worthy project.

I’m aiming for a project that:

Highlights best practices in CI/CD pipelines.

Includes monitoring and logging with Prometheus and Grafana.

Leverages Kubernetes.

Uses AWS for infrastructure (e.g., ECS, EKS, or S3).


If you’ve worked on or know of any projects like this, I’d love to hear your suggestions! Bonus points if it reflects real-world use cases or solves a specific problem.


Thanks in advance!

",Abhi-1331,1hc3rsb,https://reddit.com/r/devops/comments/1hc3rsb/seeking_suggestion_for_industry_level_devops/,https://www.reddit.com/r/devops/comments/1hc3rsb/seeking_suggestion_for_industry_level_devops/,2024-12-11 20:53:14,3,1.0,3,0,6,0,0,False,False,True,False,False,,self,t3_1hc3rsb
devops,"VPS, self hosted runner, docker compose with traefik for a small microservices application ","I am running a small scale web app very few users and few other related microservices services on a vps (cheap server). I am running a github self hosted runner on the server, which runs docker compose on the server using github actions. Using traefik to expose the API for a s3 hosted web app. 

I am a dev, so I would like to understand what risks are involved in the above setup in terms of security and other aspects. Got DDOSed recently which made everything unusable until I restarted the vps and restored a db backup. ",hlleowlrod,1hc1t7f,https://reddit.com/r/devops/comments/1hc1t7f/vps_self_hosted_runner_docker_compose_with/,https://www.reddit.com/r/devops/comments/1hc1t7f/vps_self_hosted_runner_docker_compose_with/,2024-12-11 19:31:17,2,1.0,2,0,1,0,0,False,False,True,False,False,,self,t3_1hc1t7f
devops,"Repeatable database change workflows for Azure DevOps: Live “how-to” learning session 🗓️ Thurs, Dec 19 @ 11am CT","Team using Azure DevOps: you no longer need to struggle through manual database change review requests!

Within your existing architecture, Flows offer customized, governed, repeatable database change workflows for easy and quick self-serve deployments. 

In this live event, Liquibase expert James Bennett screen shares his process for setting up Flows in Azure DevOps with the Liquibase Pro database DevOps solution. 

Whether you use Liquibase yet or not, you’ll gain a hands-on understanding of how Flows brings:

* Fast, yet consistent workflows
* Self-serve deployments
* Enhanced governance
* Streamlined database integration

Join us to follow along at home:

📅 Thursday, Dec. 19 | 🕒 11:00 AM CT

🔗 [Register](https://hubs.li/Q02YBKNS0)

",liquibase,1hc1g7y,https://reddit.com/r/devops/comments/1hc1g7y/repeatable_database_change_workflows_for_azure/,https://www.reddit.com/r/devops/comments/1hc1g7y/repeatable_database_change_workflows_for_azure/,2024-12-11 19:16:21,2,1.0,2,0,1,0,0,False,False,True,False,False,,self,t3_1hc1g7y
devops,US hourly rate for senior/principal-level devops consultant,"As in title, what would be a sensible hourly pay-as-you-go rate for experienced devops consultant in US?  
I'm thinking about a client that has presence in Texas and Maryland.",ironhalik,1hc1bvq,https://reddit.com/r/devops/comments/1hc1bvq/us_hourly_rate_for_seniorprincipallevel_devops/,https://www.reddit.com/r/devops/comments/1hc1bvq/us_hourly_rate_for_seniorprincipallevel_devops/,2024-12-11 19:11:14,5,1.0,5,0,3,0,0,False,False,True,False,False,,self,t3_1hc1bvq
