subreddit,title,selftext,author,id,permalink,url,created_utc,score,upvote_ratio,ups,downs,num_comments,total_awards_received,gilded,is_video,is_original_content,is_self,over_18,spoiler,link_flair_text,thumbnail,name
webdev,Best place to hire U.S. based web devs?,"I've tried options like Indeed but just get flooded with candidates who are poor fits.  I've heard Craigslist can be a good resource, but never had much luck with it.  
  
It seems like there are a lot of devs out there looking for work, and I'm just not sure what the best way is to connect with them.

I have a small Shopify agency, and we need someone to lead our dev efforts, mostly involving working with Liquid, TailwindCSS, various JS frameworks (Vue, AlpineJS, etc), building out custom Shopify apps, working with APIs, etc.

I really want someone U.S. based who speaks English natively.  Is there a site or service out there that can help me find that person?",friendofron,1haf5iy,https://reddit.com/r/webdev/comments/1haf5iy/best_place_to_hire_us_based_web_devs/,https://www.reddit.com/r/webdev/comments/1haf5iy/best_place_to_hire_us_based_web_devs/,2024-12-09 17:31:04,0,0.5,0,0,44,0,0,False,False,True,False,False,,self,t3_1haf5iy
webdev,Please give AdonisJS a shot,"As someone who was fatigued by the influx of JS frameworks, I did the smart thing and... learned another JS framework...

But no no trust me, this one's different. It breaks all of the JavaScript rules and allows you to write a Rails-like app using TypeScript.

Ive always wanted to try RoR and Laravel, but couldn't get past having to learn another language. Adonis was the perfect solution for that.

It's an incredible framework, one that I really hope will gain some steam. Please give it a shot, its worth your time.",Practical_Race_3282,1haxnkj,https://reddit.com/r/webdev/comments/1haxnkj/please_give_adonisjs_a_shot/,https://www.reddit.com/r/webdev/comments/1haxnkj/please_give_adonisjs_a_shot/,2024-12-10 08:58:22,49,0.64,49,0,87,0,0,False,False,True,False,False,Discussion,self,t3_1haxnkj
webdev,I made a new programming language to simplify web development - would love your feedback!,"Hey everyone! 👋

I wanted to share a project I'm really excited about - a new programming language called BuckshotPlusPlus that aims to make web development more intuitive.  
Here's how a simple component looks:

    view button {
        type = ""button""
        content = ""Click me!""
        background-color = ""#007bff""
        color = ""white""
        padding = ""10px 20px""
    }

  
The language includes built-in session handling, data caching, and component management. I'm working on video tutorials on [youtube ](https://www.youtube.com/watch?v=j0k22uoR9Bc&amp;list=PLttkrjVo_pZoPMCZgw_ByK6Y9Yb_r--oA&amp;index=3)to help people get started , and I'd love your input on what topics to cover!  
The project is open source: [https://github.com/BuckshotPlusPlus/BuckshotPlusPlus](https://github.com/BuckshotPlusPlus/BuckshotPlusPlus)

  
I'm actively working on improving it and would love to hear your thoughts on what would make this truly useful for your web development needs. Feel free to share your ideas or ask any questions!

",JhonnyVerse,1half2r,https://reddit.com/r/webdev/comments/1half2r/i_made_a_new_programming_language_to_simplify_web/,https://www.reddit.com/r/webdev/comments/1half2r/i_made_a_new_programming_language_to_simplify_web/,2024-12-09 21:48:49,61,0.67,61,0,77,0,0,False,False,True,False,False,,self,t3_1half2r
webdev,Heatmaps are coolest effect ever!,"https://i.redd.it/pldq0d5ikv5e1.gif

Hey all,   
  
I've recently discovered that heatmap.js exits. I was working on eyetracker and it is perfect effect for my website! Hope you will enjoy it!",TraditionalDistrict9,1hai59v,https://reddit.com/r/webdev/comments/1hai59v/heatmaps_are_coolest_effect_ever/,https://www.reddit.com/r/webdev/comments/1hai59v/heatmaps_are_coolest_effect_ever/,2024-12-09 19:32:41,0,0.42,0,0,6,0,0,False,False,True,False,False,,https://b.thumbs.redditmedia.com/pdOolDmOrHDEUEiyRF7szB1e1OfSxHB491LEXNzRYXU.jpg,t3_1hai59v
webdev,Looking to create a web store - Can anyone point me into the right direction as to what platform this website is using? Seems popular,,nicholaspham,1harnn6,https://reddit.com/r/webdev/comments/1harnn6/looking_to_create_a_web_store_can_anyone_point_me/,https://i.redd.it/yoerixqapx5e1.png,2024-12-10 02:42:55,0,0.38,0,0,6,0,0,False,False,False,False,False,Question,https://a.thumbs.redditmedia.com/Wozg6vPP_RxkuBIZrTWGLivx3IQdzeszdtP6ajZJaV0.jpg,t3_1harnn6
webdev,How this website is developed?,"Hi, I tried to search source code of  https://www.coffeefriend.co.uk/. 

It has a smart way to integrate WP with Vue.js and I can't figure out what they use. I had made headless websites in the past but this one is so nice. 

  
I know that WP part is hosted in /wp/ but if I try to login as a guest through /wp/wp-admin it transfers to /my-account/

Theme is loaded through /app/themes/coffeefriend

Maybe this is some sort of WP + Vue integration that could be found online?",Polarmesh,1hagofs,https://reddit.com/r/webdev/comments/1hagofs/how_this_website_is_developed/,https://www.reddit.com/r/webdev/comments/1hagofs/how_this_website_is_developed/,2024-12-09 18:32:37,0,0.38,0,0,3,0,0,False,False,True,False,False,,self,t3_1hagofs
webdev,"First Month Update - $6K in revenue, here is what I learned","Hey fellow web developers,

Hope you’re all doing amazing! I wanted to share a bit about what the past month has been like for me.

I'm pretty sure you are all familiar with my product - ChatGPT Toolbox, I posted about it here before, But in case you missed it, it’s a Chrome extension designed to supercharge your ChatGPT experience. It bridges all the gaps and adds tons of useful features, like creating folders, pinning chats, saving and reusing prompts, exporting conversations, and even downloading messages as MP3 files with 9 different voice options. And that’s just scratching the surface—there are plenty more cool tools packed in!

you can read more about it here:

www.ai-toolbox.co

 Last Saturday marks a full month since my extension officially became a paid product, and wow, what a ride it’s been. It’s been a month packed with lessons, challenges, and a few wins that I’m really proud of. To celebrate hitting 5,500 users and $6,000 in revenue in just the first month, I wanted to share 5 big lessons I’ve learned along the way.

1️⃣ A great product isn’t enough.
This one hit me hard. You can have the most amazing product ever, but if you can’t clearly explain its value to people, it’s not going anywhere. I had to work on really understanding what my audience needed and how to communicate that effectively.

2️⃣ Marketing isn’t optional.
Honestly, I thought the product would ""sell itself"" at first. Big mistake. Even if it’s great, no one will buy it if they don’t know it exists. Marketing has been a steep learning curve for me, but I’ve realized just how critical it is to make some noise about your product.

3️⃣ Customer support = magic.
I answered 97% of customer emails within 3 minutes (the other 3%? I was asleep 😅). People were blown away by the quick responses. If email didn’t solve their issue, I jumped on a Google Meet with them. The reaction was always the same: pure shock and gratitude. Those moments reminded me how much a little extra effort can make a huge difference.

4️⃣ I shine in live interactions, not on social media.
I was invited to present my extension in front of 700 people during a webinar, and it was such a rush. People loved it, and the feedback I got afterward was unreal.

What stood out to me, though, was that I connect much better with people live than through social media. Whenever I try posting videos or updates, they don’t seem to land the same way. But when I’m live? That’s where I thrive. Definitely something I’ll need to figure out moving forward.

5️⃣ Organic growth is the real MVP.
Every single user so far has come from organic traffic. I hired a marketing agency to help scale, but honestly, they haven’t brought in even one new customer yet. It’s frustrating, but I’m staying patient.

Meanwhile, I’ve been focusing on rolling out cool new features. I have about 70,000 ideas buzzing in my head 🤯, and this month, I pushed out updates like crazy. I just ran a quick poll in my community, and the top-voted feature was live within 24 hours. That was such a fun win!

So, what’s next?
I’ve realized that for my next product, I really need to build a personal brand to make this process easier. But that’s easier said than done—what language do I use? what platform? Still trying to figure that out.

It’s been a wild month, and I feel like things are just getting started. Would love to hear your thoughts or any questions you might have—let’s chat in the comments!",john2219,1hajki5,https://reddit.com/r/webdev/comments/1hajki5/first_month_update_6k_in_revenue_here_is_what_i/,https://i.redd.it/b0pvquu0vv5e1.jpeg,2024-12-09 20:31:19,0,0.31,0,0,19,0,0,False,False,False,False,False,,https://b.thumbs.redditmedia.com/LWDKOp2yHZwvPqsU1WOu3fV02h1UddWyO9Xf1nEQMZM.jpg,t3_1hajki5
webdev,I am new in web dev but cant figure out which project to build,I can help you make your website for free with nodejs express mysql and react ,Right-Key-4310,1hawqu9,https://reddit.com/r/webdev/comments/1hawqu9/i_am_new_in_web_dev_but_cant_figure_out_which/,https://www.reddit.com/r/webdev/comments/1hawqu9/i_am_new_in_web_dev_but_cant_figure_out_which/,2024-12-10 07:47:48,1,0.55,1,0,7,0,0,False,False,True,False,False,,self,t3_1hawqu9
webdev,You heard of a website builder allowing NSFW? ,"I got mixed opinions. I heard Wix, they don’t allow much. And also on Weebly. I read on their TOS. 
Even after I was told Weebly does allow; and Wix too; simply don’t. They state”no adult themes, even if it is dating; absolutly no porn.” 

Edit: my goal is mainly a neutral, grey zone; stating I am just a former worker at“consulting”. Lmao. It is all SFW.

I do NSFW only outside the website. Indo video calls/ sexting, ONLY outside the website.
If someone wants to report it, they can not say I am doing NSFW there.",tnybrunette,1hb01h6,https://reddit.com/r/webdev/comments/1hb01h6/you_heard_of_a_website_builder_allowing_nsfw/,https://www.reddit.com/r/webdev/comments/1hb01h6/you_heard_of_a_website_builder_allowing_nsfw/,2024-12-10 11:51:34,0,0.29,0,0,11,0,0,False,False,True,True,False,Question,nsfw,t3_1hb01h6
webdev,we get lots of great feedback but not much traffic,"We created a recordable doll that allows you to send stories from anywhere in the world. I fill like we have great SEO for things like deployment doll, military doll, and daddy doll. My site is not seeing much traffic. Please just a little advice to point me in the right direction. [umbobooks.com](http://umbobooks.com/)",atcmatt18,1hasv5j,https://reddit.com/r/webdev/comments/1hasv5j/we_get_lots_of_great_feedback_but_not_much_traffic/,https://www.reddit.com/r/webdev/comments/1hasv5j/we_get_lots_of_great_feedback_but_not_much_traffic/,2024-12-10 03:47:09,1,0.6,1,0,3,0,0,False,False,True,False,False,,self,t3_1hasv5j
webdev,GitHub pages won't load css but local mac will,"Hey yall, I'm just wondering if somebody can help me understand why github pages won't load my css files? Everything is running correctly locally however when I try to do it on GitHub pages nothing works correctly. I'm trying to make a python version of the building java programs website for my senior project and I'm trying just to get a live version of what I have so far so I can show my teacher.   
ChatGPT told me to use GitHub actions instead of the default deployment but that didn't fix anything, my repo is located [here](https://github.com/25Braeden/bpp) and any help would be appreciated. ",Debtz,1hanjrw,https://reddit.com/r/webdev/comments/1hanjrw/github_pages_wont_load_css_but_local_mac_will/,https://www.reddit.com/r/webdev/comments/1hanjrw/github_pages_wont_load_css_but_local_mac_will/,2024-12-09 23:22:10,1,0.57,1,0,10,0,0,False,False,True,False,False,Question,self,t3_1hanjrw
webdev,What resources do you use to make your web designs?,"I am looking for some expert advice on the resources and inspirations that they use to build some awesome web designs.

Reply about your resources and inspirations ",ysuraj,1habsbe,https://reddit.com/r/webdev/comments/1habsbe/what_resources_do_you_use_to_make_your_web_designs/,https://www.reddit.com/r/webdev/comments/1habsbe/what_resources_do_you_use_to_make_your_web_designs/,2024-12-09 15:07:53,8,0.7,8,0,39,0,0,False,False,True,False,False,,self,t3_1habsbe
webdev,What website builders use Masspay?,I wonder what website builders accept Masspay to be there integrated. ,tnybrunette,1hawlxp,https://reddit.com/r/webdev/comments/1hawlxp/what_website_builders_use_masspay/,https://www.reddit.com/r/webdev/comments/1hawlxp/what_website_builders_use_masspay/,2024-12-10 07:37:34,0,0.33,0,0,0,0,0,False,False,True,False,False,Discussion,self,t3_1hawlxp
webdev,Ecommerce choice for almost 500k monthly visitors?,"Hey, I am currently in process of building a rather heavy ecommerce that will have a lot of features ( including all normal ecommerce features such as shipping, stock management, order status types, user registration, loyalty features etc). And I will likely need something really strong and customizable, I will also need something that I can go headless route which will allow me to decouple front from back.

Shipping and order management should be something I can fully customize though (like offer free shipping after a certain amount, set order status to what shipping method is used).

There will also be recurring payments, which will be monthly, bi weekly or weekly depending on user package (they will be just a small part of the shop though, I can set the recurring payments via stripe or paypal if needed).

Shop will be operating in Europe and will likely end up being a multi store type shop (different for every country it will operate in, not many countries max 4).

So far I have checked out Shopify Plus, Shopware 6, Medusajs etc.

Shopify Plus while good doesn't really seem to fit the criteria for my project considering client doesn't want to pay monthly for addons and such so I've ruled it out. 

I did look at Medusajs but to be honest it seems like it lacks so many features out of box that most shops have, it lacks category nesting (based on what I have seen) which is something I really need to have.

Shopware 6 to me seems like a good choice, since it is customizable enough for it to work for me and headless seems like a good enough option for it. 

I have ruled out some things like Woocommerce (too slow and can't rely on its security), Magento 2 (too much dev time) and PrestaShop.

My question is, is there anything better and faster considering project scope than Shopware 6? 

Thank you very much for reading.

Edit: I do have the option of going for custom solution backend which is indeed likely the best choice when it comes to this project? ",NDragneel,1hany2y,https://reddit.com/r/webdev/comments/1hany2y/ecommerce_choice_for_almost_500k_monthly_visitors/,https://www.reddit.com/r/webdev/comments/1hany2y/ecommerce_choice_for_almost_500k_monthly_visitors/,2024-12-09 23:40:40,0,0.38,0,0,16,0,0,False,False,True,False,False,Question,self,t3_1hany2y
webdev,"Is contenteditable=""true"" bad to use?","Hey everyone,

I'm a high school student and working on building a web app. I am trying to enable users to be able to edit an item's text by clicking directly on it and update it in the backend when they tap a save button. **Currently, I'm using contenteditable on an h2** (I'm also using contenteditable on multiple &lt;p&gt; tags)**.** When the user clicks on the text, a div with buttons cancel-edit and save-edit in it will appear. Once the cancel or save button is clicked, the div disaperas and js runs a function that changes the backend. 

Is using contenteditable fine? If it isn't, what are some other ways I can allow users to change text? (Preferably not another modal)

If anyone needs clarification feel free to ask, I can provide more information.

Ty in advance!",Cyb3rPhantom,1hajheh,https://reddit.com/r/webdev/comments/1hajheh/is_contenteditabletrue_bad_to_use/,https://www.reddit.com/r/webdev/comments/1hajheh/is_contenteditabletrue_bad_to_use/,2024-12-09 20:27:48,8,0.75,8,0,15,0,0,False,False,True,False,False,,self,t3_1hajheh
webdev,First time website creator,"I have worked really hard to get my website up and performing well. I am a bit confused with the difference in my websites performance score on lighthouse and page speed insights. I’m focusing on mobile performance as my desktop performance is consistent. Currently I have a 90 for performance on lighthouse, yet my performance rating on Page speed insights is 64. Which is a more accurate representation of what users in the US will experience? I’m located in the southeast US, and my service area is limited to the northern half of one state. Any insight would be greatly appreciated as I continue to learn about website development.",Legal_Personality617,1hb1nte,https://reddit.com/r/webdev/comments/1hb1nte/first_time_website_creator/,https://www.reddit.com/r/webdev/comments/1hb1nte/first_time_website_creator/,2024-12-10 13:24:41,0,0.5,0,0,4,0,0,False,False,True,False,False,Question,self,t3_1hb1nte
webdev,How to use jwt with http-only cookies?(particularly in django rest),"So, I read that using http-only cookies is more secure against XSS attacks.

But, - how to refresh access token if can\`t take refresh token from cookies for api call?

How to set Authorization header in js when make api call?

Thanks!",mikhailo_k,1haxtxr,https://reddit.com/r/webdev/comments/1haxtxr/how_to_use_jwt_with_httponly_cookiesparticularly/,https://www.reddit.com/r/webdev/comments/1haxtxr/how_to_use_jwt_with_httponly_cookiesparticularly/,2024-12-10 09:11:25,0,0.5,0,0,4,0,0,False,False,True,False,False,Question,self,t3_1haxtxr
webdev,Has anyone found PR review bot that can be configured using AI prompts?,"The way I would imagine this works, is that we'd have a file like conventions.yaml, that file will have prompts that we want to uphold, e.g.

```
convention: use build_json_object for grouping related SQL
rule: If a SQL query is returning multiple fiels from a joined table, require that json_build_object is used to group those fields under a single object
```

... and every time a PR is raised, bot evaluates changes against these conventions and adds comments when it sees a drift happening.

Anyone found anything like this?",gajus0,1haffmg,https://reddit.com/r/webdev/comments/1haffmg/has_anyone_found_pr_review_bot_that_can_be/,https://www.reddit.com/r/webdev/comments/1haffmg/has_anyone_found_pr_review_bot_that_can_be/,2024-12-09 17:42:24,0,0.5,0,0,0,0,0,False,False,True,False,False,Question,self,t3_1haffmg
webdev,"Warning, Smartrmail app contains 'bad' automatic permissions in the terms &amp; conditions, and will plant your business's email in everyones' spam.","I recently made a giant mistake by downloading this one Shopify add-on app... right from that wholesome official Shopify app store.

I recently decided to try out this marketing app, Smartrmail (bad idea). I have to say... the experience was so negative, that I felt the need to protect fellow store owners.

Once you download the app, you'll notice the option to create a password for your account (recommended by the app for ""security purposes"" lol). Once you create a password, you'll never be able to delete your account or change the email attached. Not kidding.

The option to delete your account isn't available. You cannot remove your important business-email from this account profile. The option isn't available. You will be stuck.

Next, they'll start sending shitty emails from a shitty template from your email address, because you agreed to 'let' them by checking the box that says ""I agree to these terms and conditions."" They will send emails to every single one of your customers, and the emails look TERRIBLE.

This is so heinous, I had to dig deeper. The company was active about three years ago in late 2020, and then closed it's doors. The application business, Smartrmail, was acquired in 2023 by new owners. At the bottom of the page, the app claims to be owned by Intercom (Google showed it as an AI chat bot business for retail), however, there isn't any proof anywhere else on the web that shady ass Smartrmail is ACTUALLY owned by Intercom. The Shopify app store says it's owned by a company called Relay. So, who is who? We just don't know yet.

Worse, this app has received 500+ 5 star reviews... yet their official youtube channel has less than 100 views total for the three half-ass AI videos they have up. All of them use AI voices. Why on earth wouldn't anybody want their actual name/face or voice affiliated with Smartrmail. Is there something wrong with it? I'm still seriously considering calling the US &amp; Australian FBI, this app is sooooo effing shady. It blows my mind the Shopify app store approved it... yikes

I care about this community, so that's why I'm recommending you stay away from this super-scam Smartrmail app on Shopify. You deserve better. We all do. I love Shopify as much as the rest of us. I can't believe Shopify is letting this app continue... so embarrassing for them.

Don't believe me? Log-out, and open a separate, free 30-day Shopify trial using a dummy email address, and see for yourself. You'll see what I'm talking about. This app is designed to hurt sellers. I'm honestly not sure what can be done about this.",AutumnLeaves420,1hau8mv,https://reddit.com/r/webdev/comments/1hau8mv/warning_smartrmail_app_contains_bad_automatic/,https://www.reddit.com/r/webdev/comments/1hau8mv/warning_smartrmail_app_contains_bad_automatic/,2024-12-10 05:02:56,22,0.83,22,0,1,0,0,False,False,True,False,False,Discussion,self,t3_1hau8mv
webdev,"As a front-end developer, do I need to learn any AI-related skills?",Can you suggest any certifications related to AI in web development to help me prepare for the AI revolution?,Vedavyas7,1haiuu8,https://reddit.com/r/webdev/comments/1haiuu8/as_a_frontend_developer_do_i_need_to_learn_any/,https://www.reddit.com/r/webdev/comments/1haiuu8/as_a_frontend_developer_do_i_need_to_learn_any/,2024-12-09 20:02:01,0,0.22,0,0,18,0,0,False,False,True,False,False,Discussion,self,t3_1haiuu8
webdev,"why most mainstream backend framework rely heavily on OOP, can't it be done with other programming paradigms?","I really got curious how come most if not all mainstream frameworks used in web were built using oop pattern, why no one attempted to make a procedural or functional pattern of a  framework???",Hzk0196,1hb3ihb,https://reddit.com/r/webdev/comments/1hb3ihb/why_most_mainstream_backend_framework_rely/,https://www.reddit.com/r/webdev/comments/1hb3ihb/why_most_mainstream_backend_framework_rely/,2024-12-10 14:53:44,0,0.13,0,0,13,0,0,False,False,True,False,False,Discussion,self,t3_1hb3ihb
webdev,Is Programmatic Review Flagging Possible via Google API?,"Hi,

I work for a marketing company that manages multiple businesses, and one of my responsibilities is flagging Google reviews that breach Google's policies and following up with Google based on the outcome.

The main challenge is that this is a manual process—we have to log in to each client account and perform this task individually. I’ve noticed that some other platforms offer a dashboard where users can flag specific reviews and receive feedback on Google’s response regarding those reviews. If Google’s reply is negative, these platforms allow users to provide additional information through the same dashboard to support their reason for flagging the review.

I know this process can be done manually via a business’s Google My Business (GMB) account and the Google Reviews Management Tool to submit more information for a review. However, I’ve searched extensively and can’t find any information in the Google API that would enable the above scenario programmatically.

This makes me wonder if these other companies are falsely marketing their dashboards and actually have someone manually performing the process in the background, while simply updating the dashboard with Google’s feedback.",startup4you,1haol26,https://reddit.com/r/webdev/comments/1haol26/is_programmatic_review_flagging_possible_via/,https://www.reddit.com/r/webdev/comments/1haol26/is_programmatic_review_flagging_possible_via/,2024-12-10 00:10:21,0,0.33,0,0,0,0,0,False,False,True,False,False,,self,t3_1haol26
webdev,How to Build a Subscription-Based API System with Request Limits ? ,"
Hey ,

I'm working on a project to build a subscription system that tracks API requests and enforces limits based on user plans (e.g., free users get 1,000 requests/month). On Oracle 

Here’s what I’m trying to figure out:

1. Any recommendations for a free open source API I can use to test and implement the system?


2-  What security risks should I be aware of (e.g., API key exposure), and how can I mitigate them?


3- How can I ensure scalability in tracking requests and maintaining uptime? 


4- Any tips for managing API limits and DevOps processes for a system like this?


I’d appreciate any advice or resources. Thanks!

",Murky-Principle6255,1hanytg,https://reddit.com/r/webdev/comments/1hanytg/how_to_build_a_subscriptionbased_api_system_with/,https://www.reddit.com/r/webdev/comments/1hanytg/how_to_build_a_subscriptionbased_api_system_with/,2024-12-09 23:41:35,0,0.4,0,0,3,0,0,False,False,True,False,False,Question,self,t3_1hanytg
