subreddit,title,selftext,author,id,permalink,url,created_utc,score,upvote_ratio,ups,downs,num_comments,total_awards_received,gilded,is_video,is_original_content,is_self,over_18,spoiler,link_flair_text,thumbnail,name
books,The best thing that ever happened to me ...,"So…. this happened on a Sunday when I was extremely bored and I'm the kind of person who chooses books over anything to get rid of boredom. When I was scrolling through Goodreads, I laid eyes on a book with some kind of a crucifix on its cover. I immediately picked that book (this was approximately 2 weeks back). I knew it was a series and my initial plan was to read a single book. 

As I started the first book, within a few chapters I fell in love with the characters, Robert Hunter and Carlos Garcia. So after completing the first book in a day or two (which is way faster than my usual speed, considering I work on week days), I decided to proceed with the series. Now here I am, I finished the whole series in 2 weeks and I'm craving for more books by Carter. After this I can easily say that Chris Carter will forever be my favourite author and Robert Hunter, my favourite protagonist. 

Every book in the series was intriguing and brutal. In my opinion, if gore outweighs the actual content, it might become a negative in itself but here it works the opposite way. Apart from how the killer is found, the mystery behind why the crime is committed in a certain way and the motive for such brutality, are points of great interest in every book. 

Leaving these aside, there's a book in this series called An Evil mind. I was completely blown away by it. I never imagined that Carter could create an antagonist who is as powerful as Hunter.  But Lucien Folter overshadowed Hunter and he's the best antagonist according to me ( including every book and movie I have ever watched). 

I'm now anticipating the release of the next book in the series. I know it might take a year for the next book release so I'm planning to re-read the available books once more. I was not in a great mental state when I just started this series and Carter offered me the much needed distraction. Currently I'm at least one step better because of him and I'm grateful for that.",Alternative-Bit-999,1h8lpzr,https://reddit.com/r/books/comments/1h8lpzr/the_best_thing_that_ever_happened_to_me/,https://www.reddit.com/r/books/comments/1h8lpzr/the_best_thing_that_ever_happened_to_me/,2024-12-07 05:37:58,8,0.61,8,0,19,0,0,False,False,True,False,False,,self,t3_1h8lpzr
books,The Guardian view on humanities in universities: closing English Literature courses signals a crisis,,ArmadilloConnoisseur,1h7ldj3,https://reddit.com/r/books/comments/1h7ldj3/the_guardian_view_on_humanities_in_universities/,https://www.theguardian.com/education/2024/dec/05/the-guardian-view-on-humanities-in-universities-closing-english-literature-courses-signals-a-crisis?fbclid=PAZXh0bgNhZW0CMTEAAaYJsvDo8abA5RURncYJaS-pG-GoOH9qz4qLMTK9w1XAlUb4rIpRB3utlCI_aem_nisoEJ0A0nOClFIczSAbsw,2024-12-05 22:11:07,1745,0.95,1745,0,392,0,0,False,False,False,False,False,,https://a.thumbs.redditmedia.com/kOUHWPEmxU6un9TrvXjo_zpsHYZA0uqk6zbAeNvk4u8.jpg,t3_1h7ldj3
books,"Dark Evenings: ""The Darkest Evening of the Year"" by Dean Koontz.","And now the fourth Dean Koontz book that I've been reading for the past few days is now complete tonight! ""The Darkest Evening of the Year"" is that novel.

We meet Amy Redwing, a woman who has devoted her entire life to rescuing dogs. But there is a unique bond that she shares with a golden retriever named Nickie, a dog she had saved in a very dangerous encounter, one that is really deep.

But in one night, this loyalty will be put to the test, and they will prove to each other how far they can go--even when the stakes turn deadly.

This one's pretty similar to another Koontz novel ""Hideaway"", as it is a thriller mixed with the supernatural. It might not be as original as one would think, but I still found it pretty decent enough to find it enjoyable.

Koontz has written a lot, with some being either great or really decent, and ""The Darkest Evening of the Year"" fits into the decent category. Most would say that his writing has become repetitive, but for me they're still enjoyable. Not really deep, but incredibly satisfying. And now that I've had my quota of Koontz for now, it's time to move on to another book by a different author, or authors in this case, as this one is written by two authors.",i-the-muso-1968,1h8je8d,https://reddit.com/r/books/comments/1h8je8d/dark_evenings_the_darkest_evening_of_the_year_by/,https://www.reddit.com/r/books/comments/1h8je8d/dark_evenings_the_darkest_evening_of_the_year_by/,2024-12-07 03:20:23,6,0.65,6,0,6,0,0,False,False,True,False,False,,self,t3_1h8je8d
books,God emperor of dune is so interesting ,"I loved this book. I loved leto’s ramblings and I loved moneo. And I loved the way the golden path is explained. 

But this book had a few major issues for me. 

The biggest is the dialogue. Half the time I had no idea wtf anyone was talking about. The other half, the dialogue felt so robotic. And the emotion is so unreadable. Also, I’ve never seen anyone use as many exclamation points as frank herbert. Especially when they’re not needed or when they don’t fit the scene and emotion. A character doesn’t cry but exclaims. A character can be trying to say something quietly but there’s an exclamation mark. It sends so many mixed signals that it’s hard to tell what’s happening. I swear there’s at least one exclamation point in every paragraph. 

The second is that everyone except Leto is very flat.  Hwi noree and Duncan and moneo and siona could have been so interesting but they are barely explored. And these characters barely show emotion besides anger. The only exception is Hwi. But she is written to be crying in response to almost anything that Leto says. No matter what he says. Leto could say “man, it sucks to be a dictator” and she just starts bawling for no reason. 

One last thing: Hwi and Duncan had zero chemistry. Idk why their love was even included. Especially because it makes no sense in the context of the plot and had no impact on the plot. Presumably Duncan met Hwi once “off screen.” And the next time we see them, they just have sex. Like wtf. That came out of nowhere. And it’s not like their love has any impact on the plot because their relationship is ignored by Leto. Siona doesn’t give a shit. And moneo acts like it’s blasphemy but doesn’t do anything to stop them other than just saying stop. 

Also I would have liked to see leto’s ‘peace’ explored a bit more. How did his atrocities compare to his father. Paul’s ascension to the throne caused the death of 61 billion. How much did leto’s stagnation of progress do? The stagnation of medicine, of ecological developments, of new helpful technology, etc.

Edit: also the homophobic rants were also pretty irritating to read",Feisty-Treacle3451,1h7vko7,https://reddit.com/r/books/comments/1h7vko7/god_emperor_of_dune_is_so_interesting/,https://www.reddit.com/r/books/comments/1h7vko7/god_emperor_of_dune_is_so_interesting/,2024-12-06 06:56:08,95,0.85,95,0,27,0,0,False,False,True,False,False,,self,t3_1h7vko7
books,"My whole life I've wanted a large library, now I'm having an existential crisis","**Edit:**  
*There has been a wellspring of replies to this post and I am overwhelmed by the positive and life-affirming reactions. Thank you everyone, for the wonderful, thought-provoking and oftentimes personal replies. I've been reading every one!*  
  
Whether it's related to guilt over my participation in recent Black Friday sales, the need to make space for a proper kids' playroom, or a long-simmering reckoning against too many material possessions--I am considering significantly downsizing my book collection.

Literature (writing and reading) is largely my main hobby in life, but I am starting to look at my bookshelves and wonder, ""Do I really need that book?"" I recently began purchasing the odd ""fine press"" edition of favourite books (its own form of excess, I know, but hear me out) and it got me thinking about the worth I place on my \~1,000 books. Do I want to keep books that weren't life-changing, 5-star reads, just so I can hoard like some literary goblin who gets to point and say to guests, ""See, I read lots!""?

Has anyone else gone through a sort of reckoning like this? Did you sell them to recoup some of the costs over the years/decades, or just donate them? How did you go about downsizing--clear everything that wasn't an absolute favourite? Hold the ones that were 4 stars that others might enjoy? Hold onto classics just because they are classics? Hold onto rare or expensive or sentimental?

Help!",calibancreed,1h7geh2,https://reddit.com/r/books/comments/1h7geh2/my_whole_life_ive_wanted_a_large_library_now_im/,https://www.reddit.com/r/books/comments/1h7geh2/my_whole_life_ive_wanted_a_large_library_now_im/,2024-12-05 18:43:12,657,0.92,657,0,394,0,0,False,False,True,False,False,,self,t3_1h7geh2
books,Can’t get myself to like “Things We Never Got Over” by Lucy Score,"The writing style is too distracting for me to get into the story. 
The dialogue seems to have only one pace and all the characters have the same “voice” .. just with differing accents. 
Sometimes it doesn’t flow and just feels like she’s trying too hard.  Sometimes frantic. 
The characters are cliche. 
Neither character or dialogue feel ~real~ which makes it hard for me to connect. 

But I’m only in the first 40 pages. Does it get better? :/",Difficult-Future9712,1h8ngt9,https://reddit.com/r/books/comments/1h8ngt9/cant_get_myself_to_like_things_we_never_got_over/,https://www.reddit.com/r/books/comments/1h8ngt9/cant_get_myself_to_like_things_we_never_got_over/,2024-12-07 07:37:06,0,0.45,0,0,15,0,0,False,False,True,False,False,,self,t3_1h8ngt9
books,just finished “lonesome dove” and i am crying ,"i am so sorry for this rant but i have to get this off of my chest 😭😭

wow wow wow wow. i am completely in awe of this book. this is an understatement.

first off, i don’t really read western type of books. i mostly stick to classics, literary fiction, short stories, YA (every once in a while), etc. the only “western” author i read was cormac mccarthy. i LOVED “no country for old men” and “the road” (to be honest , those are the only books i read from mccarthy lol). and i also tend to read shorter books because of my attention span 😩

but every once in a while, i like to challenge myself. in the beginning of this year, i decided to try “war and peace” and was blown away by it.

i decided to finish this year off with a long book but i wasn’t sure which one. then i saw a bunch of people on my goodreads and reddit feed praising “lonesome dove.” i got curious. i figured that if i didn’t like it, i could always dnf.

let me just say—i never thought of dnfing this book. from the first sentence i was HOOKED!! the writing style was so vivid and raw without being tedious. mcmurtry’s writing style was honest and interesting. every single character had their own way of speaking and mannerisms it was incredible. all the characters were fleshed out; they came across like actual people from that time period. 

i loved all of the characters (except jake spoon). my favorite ones were gus, newt and lorena. i think that with these characters, mcmurtry’s writing style was the most powerful. i loved how he treated lorena with grace—he didn’t treat her like many of the men treated her (and other prostitutes). and on that note, he also treated minorities (like the native americans and black people) with respect—meaning, not rudely or even “special.” as a black woman reading this, i had to brace myself. i thought mcmurtry would paint the native americans, prostitutes and black people as either evil, mary sues who could do no wrong, or just victims. but he didn’t do that. he was realistic. just like the white men in the story, these minority groups had the potential for being good, neutral or bad. they were all humans. he was realistic. i hope this makes sense.

mcmurtry was so skillful that i felt like i was physically in the story with his characters, traveling with them, roping horses, etc. it was so good that i was thinking about learning how to ride a horse and channel my inner cowboy 🤠 

what i loved the most about this story was the narrative style. it wasn’t choppy. it was the perfect blend between dialogue and description. that was my biggest concern when i thought about reading this book. i was scared that this big book would have either just dialogue or tedious descriptions. but it was a perfect combination of both. i know this is minor to most people but this issue had led me to dnf so many books during my (short) lifetime.

i also liked how mcmurtry approached this time period. i’m not crazy about historical fiction (i tend to get bored), but he did a fantastic job. it made me curious to actually learn more about this time period.

mcmurtry captured leaving and staying in places so well. as someone who moved around, so much of his characters’ journey resonated with me. there was a sense of excitement for a new place and yet a loneliness in that that resonated with me. i might have cried during the last chapter.

and im so sad that now this journey is over. i was dragging my feet a little towards the last few chapters because i quite literally didn’t want to finish the book. but now it’s done. while i have left this beautiful story, i suspect that the story will not leave me.

and this quote below perfectly describes the book and my feelings about finishing it:

""It's funny, leaving a place, ain't it?"" he said. ""You never do know when you'll get back.""

😭😭😭😭",trailofglitter_,1h7hghp,https://reddit.com/r/books/comments/1h7hghp/just_finished_lonesome_dove_and_i_am_crying/,https://www.reddit.com/r/books/comments/1h7hghp/just_finished_lonesome_dove_and_i_am_crying/,2024-12-05 19:26:50,225,0.91,225,0,87,0,0,False,False,True,False,False,,self,t3_1h7hghp
books,"Weekly Recommendation Thread: December 06, 2024","Welcome to our weekly recommendation thread!  A few years ago now the mod team decided to condense the many ""suggest some books"" threads into one big mega-thread, in order to consolidate the subreddit and diversify the front page a little.  Since then, we have removed suggestion threads and directed their posters to this thread instead.  This tradition continues, so let's jump right in!

**The Rules**

* Every comment in reply to this self-post must be a request for suggestions.

* All suggestions made in this thread must be direct replies to other people's requests. Do not post suggestions in reply to this self-post.

* All unrelated comments will be deleted in the interest of cleanliness.

____

**How to get the best recommendations**

The most successful recommendation requests include a description of the kind of book being sought.  This might be a particular kind of protagonist, setting, plot, atmosphere, theme, or subject matter.  You may be looking for something similar to another book (or film, TV show, game, etc), and examples are great!  Just be sure to explain *what* you liked about them too.  Other helpful things to think about are genre, length and reading level.

____

All Weekly Recommendation Threads are linked below the header throughout the week to guarantee that this thread remains active day-to-day.  For those bursting with books that you are hungry to suggest, we've set the suggested sort to new; you may need to set this manually if your app or settings ignores suggested sort.

If this thread has not slaked your desire for tasty book suggestions, we propose that you head on over to the aptly named subreddit /r/suggestmeabook.
               
- The Management",AutoModerator,1h7yviu,https://reddit.com/r/books/comments/1h7yviu/weekly_recommendation_thread_december_06_2024/,https://www.reddit.com/r/books/comments/1h7yviu/weekly_recommendation_thread_december_06_2024/,2024-12-06 11:00:09,13,0.89,13,0,82,0,0,False,False,True,False,False,WeeklyThread,self,t3_1h7yviu
books,Celebrated Author/Poet Refaat Al Areer’s Posthumous Book “If I Must Die” is Coming Out. ,,annonymous_bosch,1h7alh0,https://reddit.com/r/books/comments/1h7alh0/celebrated_authorpoet_refaat_al_areers_posthumous/,https://www.newarab.com/features/refaat-alareer-legacy-honoured-posthumous-book-if-i-must-die?amp,2024-12-05 14:37:45,431,0.88,431,0,63,0,0,False,False,False,False,False,,https://b.thumbs.redditmedia.com/4YVVC4EvwxKursVYSq0c6WKuE1DQ3imLZDM9u_XluBM.jpg,t3_1h7alh0
books,Indie Bookstores Report a Strong Start to a Short Holiday Season ,,EvenFix2,1h7a5io,https://reddit.com/r/books/comments/1h7a5io/indie_bookstores_report_a_strong_start_to_a_short/,https://www.publishersweekly.com/pw/by-topic/industry-news/bookselling/article/96640-indies-report-a-strong-start-to-a-short-holiday-season.html,2024-12-05 14:17:02,133,0.94,133,0,18,0,0,False,False,False,False,False,,https://b.thumbs.redditmedia.com/yYa8ZPjMAV9imce54ClyEOcy9Jp6IPpgVGdEUEQWFAk.jpg,t3_1h7a5io
books,Favorite Books about Viruses: December 2024,"Welcome readers,

December 1 was [World AIDS Day](https://worldaidsday.org/) and, in honor, please use this thread to discuss your favorite books about viruses.

If you'd like to read our previous weekly discussions of fiction and nonfiction please visit the [suggested reading](https://www.reddit.com/r/books/wiki/r/booksrecommends) section of our [wiki](https://www.reddit.com/r/books/wiki/index).

Thank you and enjoy!",AutoModerator,1h78njn,https://reddit.com/r/books/comments/1h78njn/favorite_books_about_viruses_december_2024/,https://www.reddit.com/r/books/comments/1h78njn/favorite_books_about_viruses_december_2024/,2024-12-05 13:01:34,48,0.82,48,0,92,0,0,False,False,True,False,False,WeeklyThread,self,t3_1h78njn
books,I love finding rare old books but then it’s so difficult to read that English - Robinson Crusoe 1965 copy,"I found this rare gem 1965 edition, it’s in pretty good condition and was really cheap at 2nd hand shop.

But the page spacing is really not eye friendly, sometimes it doesn’t stop with periods and often don’t use capital letters. And above all the level of English makes it more difficult as it doesn’t feel like “common tongue” anymore. I often think about the meaning of the words more than the actual story.

I don’t want to give up this copy but at the same time I feel like I’m not actually enjoying it like I would with a modern one.",xSypRo,1h75h45,https://reddit.com/r/books/comments/1h75h45/i_love_finding_rare_old_books_but_then_its_so/,https://www.reddit.com/r/books/comments/1h75h45/i_love_finding_rare_old_books_but_then_its_so/,2024-12-05 09:35:42,53,0.72,53,0,77,0,0,False,False,True,False,False,,self,t3_1h75h45
books,Taylor Swift’s ‘Eras Tour Book’ just became the fastest-selling release of the year,,ubcstaffer123,1h8b365,https://reddit.com/r/books/comments/1h8b365/taylor_swifts_eras_tour_book_just_became_the/,https://www.usatoday.com/story/entertainment/books/2024/12/05/taylor-swift-eras-tour-book-sales/76797012007/,2024-12-06 20:36:41,0,0.33,0,0,14,0,0,False,False,False,False,False,,https://b.thumbs.redditmedia.com/eQD6wzrSpk3jcAYZUgfTZd-xe9QzkzbsslrZn45AMbQ.jpg,t3_1h8b365
books,"I'm sorry, I just finished East of Eden... ","And I have no one to talk to about how much I loved it.   
  
I used to read a lot as a kid and in spurts throughout my adulthood. After about 2 years of starting but never finishing a book I have read 15 in the past year. Mostly really disturbing horror and transgressive stuff with some modern/post modern lit peppered in.

East of Eden's grand scope, memorable and lovable characters(Samuel Hamilton and Lee come to mind) and beautiful descriptions along with Steinbeck tackling some really challenging human topics spoke to me. ",UnscarredVoice,1h6koy6,https://reddit.com/r/books/comments/1h6koy6/im_sorry_i_just_finished_east_of_eden/,https://www.reddit.com/r/books/comments/1h6koy6/im_sorry_i_just_finished_east_of_eden/,2024-12-04 16:47:32,380,0.9,380,0,91,0,0,False,False,True,False,False,,self,t3_1h6koy6
books,Unreliability in Penance by Eliza Clark,"I really enjoyed this book and am continuing to think about it, but I'm realizing there isn't a lot of payoff for the framing narrative/unreliable narrator-- the points where he's being self-serving or antagonistic are usually pretty clear during his first-person sections and the interviews he conducts, and looking for distortions or lies in his invented sections hasn't borne anything for me. It seems like Clark is using him as a justification for the more straightforward prose sections &amp; as a good conduit for the themes (e.g. the reveal at the end that he &gt;!obtained and published the girl's first-hand accounts illegally!&lt;), but that overall his perspective doesn't influence the 'truth' of the story Clark is telling very much. Did anyone get a different conclusion from reading those prose sections more closely, or from the book generally?",udibranch,1h776z5,https://reddit.com/r/books/comments/1h776z5/unreliability_in_penance_by_eliza_clark/,https://www.reddit.com/r/books/comments/1h776z5/unreliability_in_penance_by_eliza_clark/,2024-12-05 11:37:01,10,0.78,10,0,7,0,0,False,False,True,False,True,,spoiler,t3_1h776z5
books,Taylor Swift’s Eras Tour book criticized for multiple grammatical errors,,ubcstaffer123,1h6bamo,https://reddit.com/r/books/comments/1h6bamo/taylor_swifts_eras_tour_book_criticized_for/,https://www.independent.co.uk/life-style/taylor-swift-eras-tour-book-grammatical-errors-b2658214.html,2024-12-04 08:18:48,1457,0.86,1457,0,415,0,0,False,False,False,False,False,,https://b.thumbs.redditmedia.com/dEzge4Hs_1y5INEyHt1GNlj7mkHfWU7GVHAYOa_aUrs.jpg,t3_1h6bamo
books,[Esquire] Brandon Sanderson Knows He’s Risking Everything with ‘Wind and Truth’,,educated_giraffe,1h7xqz7,https://reddit.com/r/books/comments/1h7xqz7/esquire_brandon_sanderson_knows_hes_risking/,https://www.esquire.com/entertainment/books/a63071459/brandon-sanderson-wind-and-truth-interview/,2024-12-06 09:37:32,0,0.23,0,0,26,0,0,False,False,False,False,False,,https://b.thumbs.redditmedia.com/Aqx4xMnGKgfPFaMD975BpaHd2MZxgYGcV5sDs1SWtTk.jpg,t3_1h7xqz7
books,'A dream come true': Meet the best-selling B.C. author that's chronicled Taylor Swift's style,,ubcstaffer123,1h7x6pj,https://reddit.com/r/books/comments/1h7x6pj/a_dream_come_true_meet_the_bestselling_bc_author/,https://www.burnabynow.com/local-news/a-dream-come-true-meet-the-best-selling-bc-author-thats-chronicled-taylor-swifts-style-9909048,2024-12-06 08:54:58,0,0.16,0,0,3,0,0,False,False,False,False,False,,https://b.thumbs.redditmedia.com/6hLbt7OczS5TdcaDZkaneLuYdbAD63qv_tm1LzSbqfI.jpg,t3_1h7x6pj
books,"A World Full of Weirdos: Interview with Mark Dery, Part One",,subsonico,1h6x8v6,https://reddit.com/r/books/comments/1h6x8v6/a_world_full_of_weirdos_interview_with_mark_dery/,https://retrofuturista.com/a-world-full-of-weirdos-interview-with-mark-dery-part-one/,2024-12-05 01:29:08,12,0.8,12,0,0,0,0,False,False,False,False,False,,https://b.thumbs.redditmedia.com/kDCrmq80ti8cDuaDhK1b5rkGIMB0QVGY49hV4W7tPhk.jpg,t3_1h6x8v6
books,Of course the girls are reading horny fairy books. It’s cheaper than travel and more fun than therapy,,ArcaneKind,1h5m8t1,https://reddit.com/r/books/comments/1h5m8t1/of_course_the_girls_are_reading_horny_fairy_books/,https://www.theguardian.com/commentisfree/2024/nov/29/of-course-the-girls-are-reading-horny-fairy-books-its-cheaper-than-travel-and-more-fun-than-therapy,2024-12-03 12:26:02,8162,0.9,8162,0,763,0,0,False,False,False,False,False,,https://b.thumbs.redditmedia.com/UlxGC7XVyFR-7z6PEgLcLIy802qM8YFxYkJn1iqeuIw.jpg,t3_1h5m8t1
books,Literature of Lebanon: December 2024,"'ahlaan bik readers,

This is our monthly discussion of the literature of the world!  Every Wednesday, we'll post a new country or culture for you to recommend literature from, with the caveat that it must have been written by someone from that there (i.e. Shogun by James Clavell is a great book but wouldn't be included in Japanese literature). 

Today is [Eid il-Burbara](https://en.wikipedia.org/wiki/Eid_il-Burbara) and to celebrate we're discussing Lebanese literature!  Please use this thread to discuss your favorite Lebanese books and authors.      
                
If you'd like to read our previous discussions of the literature of the world please visit the [literature of the world](https://www.reddit.com/r/books/wiki/literatureof) section of our [wiki](https://www.reddit.com/r/books/wiki/index). 

Shukraan lakum and enjoy!",AutoModerator,1h6ffkd,https://reddit.com/r/books/comments/1h6ffkd/literature_of_lebanon_december_2024/,https://www.reddit.com/r/books/comments/1h6ffkd/literature_of_lebanon_december_2024/,2024-12-04 13:01:29,41,0.83,41,0,3,0,0,False,False,True,False,False,Literature of the World,self,t3_1h6ffkd
books,Writer Thoreau warned of brain rot in 1854. Now it's the Oxford Word of 2024,,zsreport,1h5loej,https://reddit.com/r/books/comments/1h5loej/writer_thoreau_warned_of_brain_rot_in_1854_now/,https://www.npr.org/2024/12/02/nx-s1-5213682/writer-thoreau-warned-of-brain-rot-in-1854-now-its-the-oxford-word-of-2024,2024-12-03 11:51:46,971,0.95,971,0,109,0,0,False,False,False,False,False,,https://b.thumbs.redditmedia.com/M1nTT_dBy-XzpDCA3BatG8Fmyep6TASXSiJSuPauOVM.jpg,t3_1h5loej
