subreddit,title,selftext,author,id,permalink,url,created_utc,score,upvote_ratio,ups,downs,num_comments,total_awards_received,gilded,is_video,is_original_content,is_self,over_18,spoiler,link_flair_text,thumbnail,name
books,I read The Song of Achilles and felt nothing ,"I was promised great love and a heartbreaking ending, and that’s the only reason i was putting off reading this book. It sounded like just the book that would devastate me. Don’t get me wrong, the book is certainly sad, but in a somber, drab way, not in a heartbreaking, stay with you for a long time after you finished it kind of way.

Throughout the entire book bad things just pile on for our protagonist Patroclus. There really aren’t many moments of reprieve, the dread is ever present in the book. The main thing i felt for him is pity and then annoyance for being so passive. The only time he ever showed any agency is when he was following Achilles around, making sure he stayed by his side. 

When they were in the mountains, with a god who could supposedly teach them anything, any skill, fighting or life, Patroclus apparently didn’t learn much of anything. They were in that cave in the mountains for years. Just the two of them and the teacher who could teach him anything…

The romantic relationship is not fleshed out. For the most part Achilles is an aloof character, we don’t really know the boy, and later the man, we see him through Patroclus’ eyes only. And from his perspective, everything is perfect, from his beauty, to his excellence, to his “mischief” and sense of humour. Also, apparently Achilles is somewhat of a pacifist in his early days. Now, I don’t know much about Greek mythology, but i know this just isn’t so lol.

The war sucked though. I would also hate if i had to go, so understood them there. Fuck Agamemnon and Menelaus, and fuck Paris and Helen of Troy too.

Like i said, this book is sad throughout, and even after both of them died, things somehow still managed to get worse.

If we didn’t get that resolution and small glimmer of hope in the last few minutes of the book, my rating would go from 3, to literally 1,5. 
This book didn’t devastate me into a heartbreak, but it slowly drowned me into numbness.",amazingamy19,1h48hn5,https://reddit.com/r/books/comments/1h48hn5/i_read_the_song_of_achilles_and_felt_nothing/,https://www.reddit.com/r/books/comments/1h48hn5/i_read_the_song_of_achilles_and_felt_nothing/,2024-12-01 17:32:31,516,0.75,516,0,278,0,0,False,False,True,False,False,,self,t3_1h48hn5
books,"Weekly Calendar - December 02, 2024","Hello readers!

Every Monday, we will post a calendar with the date and topic of that week's threads and we will update it to include links as those threads go live.  All times are Eastern US.

---

Day|Date|Time(ET)|Topic|
-|-|-|-
^Monday|^(December 02)||[^(What are you Reading?)](https://redd.it/1h4sg6l)
^Tuesday|^(December 03)||^(New Releases)
^Tuesday|^(December 03)||[^(Simple Questions)](https://redd.it/1h5k2hk)
^Wednesday|^(December 04)||^(Literature of Lebanon)
^Thursday|^(December 05)||[^(Favorite Books about Viruses)](https://redd.it/1h78njn)
^Friday|^(December 06)||[^(Weekly Recommendation Thread)](https://redd.it/1h7yviu)
^Saturday|^(December 07)||[^(Simple Questions)](https://redd.it/1h8pd84)
^Sunday|^(December 08)||[^(Weekly FAQ: How do I better understand the book I'm reading?)](https://redd.it/1h9hdva)",Reddit_Books,1h4sg4k,https://reddit.com/r/books/comments/1h4sg4k/weekly_calendar_december_02_2024/,https://www.reddit.com/r/books/comments/1h4sg4k/weekly_calendar_december_02_2024/,2024-12-02 11:00:06,7,0.72,7,0,0,0,0,False,False,True,False,False,meta,self,t3_1h4sg4k
books,"I just ""read"" The Third Policeman by Flann O'Brien","The quotes are because I skipped the footnotes, so i'm not sure if i can say I read it since there were so many footnotes. 

I'm not sure how I feel about the book. joe is a delight and should be a national treasure, but disappears in the last 20% of the book. i only read this book because Terry Eagleton made it sound like such a creepfest in his book ""On Evil."" But it's not really creepy. It's pretty funny at times, but not enough of the time for it to not feel like a slog sometimes. I might also have been coming down with a low key head cold in the last 20% of the book, and that might have affected my perception of it. 

My question is: was the narrator actually evil? who was the main motivator behind the robbery and killing, divney or narrator? or am i asking the wrong questions here and missing some major point (since i skipped all the footnotes...)?

And in general, what did y'all think of this book? to be honest i'm more confused more than anything else.",quantcompandthings,1h5fa3d,https://reddit.com/r/books/comments/1h5fa3d/i_just_read_the_third_policeman_by_flann_obrien/,https://www.reddit.com/r/books/comments/1h5fa3d/i_just_read_the_third_policeman_by_flann_obrien/,2024-12-03 04:31:15,0,0.43,0,0,26,0,0,False,False,True,False,False,,self,t3_1h5fa3d
books,The dismal childhood of Becky Sharp - Vanity Fair ,"I’ve just finished Vanity Fair and loved it, one of the most fascinating portrayals of 19th Century society I’ve ever read. I loved Thackerays satirical voice as the narrator.

Becky Sharp is as interesting character as they come, I was alternately repulsed and charmed by her cunning and devious methods of getting her own way. I know it’s not made explicit in the book, but I got the impression that she may have been subject to sexual abuse as a child, which informs why she acts the way she does as an adult.

1) We’re told she had to coax and cajole all of the men her father was in debt to, and she was surrounded by her fathers adult friends from an early age

2) It’s said near the beginning that she was “a woman” from very early in her life

3) There’s a passage where it says she’s pondering sadly about the “dark times” in her childhood. This could refer only to poverty, but there are other ways to read it.

This tracks with how she uses her sexuality to manipulate men into serving her - this is all she knows about how to get by in the world. 

And it also makes sense with why she might hate Rawdon junior, because she resents him for having the childhood she never got to have.

Further, it makes sense why she is borderline obsessed with the Marquess of Steyne - a much older man who she may be drawn to due to her past trauma. Also, this is one of the only characters in the book who strikes genuine fear into her. This may be explained by him simply being one of the most powerful and cunning people ever in her circle, but again, there are other ways to read it.

I’m using none of this to excuse Becky ruining other characters lives, abusing and neglecting her son, betraying her husband, killing Jos(?!) etc, but it gave me an understanding of her character that made sense and assisted in my ability to empathise with her.

I’d be really interested to hear if anyone else has arrived at this conclusion. Or maybe this take is common! Amazing book, 5/5.
",IrascibleOnion,1h4895t,https://reddit.com/r/books/comments/1h4895t/the_dismal_childhood_of_becky_sharp_vanity_fair/,https://www.reddit.com/r/books/comments/1h4895t/the_dismal_childhood_of_becky_sharp_vanity_fair/,2024-12-01 17:22:28,62,0.96,62,0,3,0,0,False,False,True,True,False,,nsfw,t3_1h4895t
books,Do You Ever Picture a Different Ending for a Book?,"You know that feeling when you finish a book, and while you liked it, you can’t help but think, “What if it ended differently?” Maybe the characters made a choice you didn’t agree with, or the plot left too many loose ends.

For me, it was 1984. I get why the ending is the way it is, but part of me wonders how the story would have felt if Winston had actually succeeded in resisting the Party. Would it still be as powerful?

Have you ever read a book and imagined a different ending? What would you have changed, and why?",mauibuilt89,1h4app2,https://reddit.com/r/books/comments/1h4app2/do_you_ever_picture_a_different_ending_for_a_book/,https://www.reddit.com/r/books/comments/1h4app2/do_you_ever_picture_a_different_ending_for_a_book/,2024-12-01 19:06:22,35,0.78,35,0,53,0,0,False,False,True,False,True,,spoiler,t3_1h4app2
books,Finally: More Sympathetic Take on Mary in Austen's P&amp;P ,"[https://www.nytimes.com/2024/12/01/opinion/pride-prejudice-jane-austen.html?unlocked\_article\_code=1.eE4.iRPy.I62uy82HS4SZ&amp;smid=url-share](https://www.nytimes.com/2024/12/01/opinion/pride-prejudice-jane-austen.html?unlocked_article_code=1.eE4.iRPy.I62uy82HS4SZ&amp;smid=url-share)

Reading this essay reminded me that, yes indeed, Austen comes down pretty hard on sanctimonious bookworm Mary, sister #3 in Pride and Prejudice. The essay quotes some of that. It also mentions a new novel, told from Mary's perspective, the BBC series is adapting for a 10-part series.

Plain women finally get their say!",GardenPeep,1h4di2f,https://reddit.com/r/books/comments/1h4di2f/finally_more_sympathetic_take_on_mary_in_austens/,https://www.reddit.com/r/books/comments/1h4di2f/finally_more_sympathetic_take_on_mary_in_austens/,2024-12-01 21:04:33,25,0.67,25,0,51,0,0,False,False,True,False,False,,self,t3_1h4di2f
books,What happened to quotation marks? ,"I'm not an avid reader and English is not my first language. So maybe I missed something. But this is the third book that I'm reading where there are no quotation marks for dialogues. What's going on? 

The books that I read previously were prophet song, normal people and currently I'm reading intermezzo. All by Irish authors. But the Sally roony books are written in English, not translation. So is it an Irish thing? ",Rich-Personality-194,1h3uo4q,https://reddit.com/r/books/comments/1h3uo4q/what_happened_to_quotation_marks/,https://www.reddit.com/r/books/comments/1h3uo4q/what_happened_to_quotation_marks/,2024-12-01 04:01:14,419,0.85,419,0,408,0,0,False,False,True,False,False,,self,t3_1h3uo4q
books,(SPOILERS) Babel - Character Motivations,"Please don't read on if you haven't read this book:  

I want to explore Letty's motivations to turn her friends into the police by reenacting what potentially happened when she went to the Police Station:  

--  

**Letty**: Hello Officer, I want to report a crime.  My friends who I am complicit in murder with are plotting to stop the empire from waging unjustified war against China potentially saving the lives of 10s of thousands of people.  

**Officer**: Oh thats horrible, how are they planning on stopping this.  
  
**Letty**: They plan on passing out fliers in London to influence public opinion as well as writing members of parliament to get them to vote against the motion to go to war.  
  
**Officer**: Dastardly! We can't have that, tell me their location and we will raid them asap!  
    
**Letty**: Theyre at the Old Library. I just have two requests:  I'd like to join your raid and I'd like a gun.  
  
**Officer**: Do you even know how to use a gun?  
  
**Letty**:  I'm the daughter of an admiral who believes women shouldn't be allowed to read and are only good for Marriage, of course he taught me to use a gun.  
  
**Officer**: As the daughter of an admiral if I put you in harms way and something happened I would be hanged, correct?  
  
**Letty**: Yes absolutely.  
  
**Officer**: Very well, here's a gun, I'd like you on the vanguard of the raid.  I think its best if you confront your friends with a gun.  
  
**Letty**:  (Proceeds to shoot one of her friends dead for no reason). 
  
*fin*

--
Seems to check out, I was worried her actions were unjustified but after writing this out I see why it all unfolded the way it did.",dangerwig,1h48hic,https://reddit.com/r/books/comments/1h48hic/spoilers_babel_character_motivations/,https://www.reddit.com/r/books/comments/1h48hic/spoilers_babel_character_motivations/,2024-12-01 17:32:21,25,0.77,25,0,13,0,0,False,False,True,False,True,,spoiler,t3_1h48hic
books,how to say babylon unsolved,"i just finished the memoir and am confused about a few things. 

1) grandma sweet P - was terrible to Djani, but seemed to be sweet with the grandkids, why
2) did Djani have a mental illness? he seemed to move between normal to rage-filled at the snap of fingers
3) why didn't Safiya take Djani to court
4) why did they keep going back to the house even when they left, could they not make it on their own
5) for all the positives her mother had, why did she let the father beat Safiya over the shoes, push her back into the beating
",avochocolate,1h55jhw,https://reddit.com/r/books/comments/1h55jhw/how_to_say_babylon_unsolved/,https://www.reddit.com/r/books/comments/1h55jhw/how_to_say_babylon_unsolved/,2024-12-02 20:56:24,0,0.36,0,0,9,0,0,False,False,True,False,True,,spoiler,t3_1h55jhw
books,The Divine Farce by Michael S. A. Graziano -Very Short Review,"5-Stars!

This book was a recommendation from Goodreads because I enjoyed A Very Short Stay in Hell by Steven L Peck. The cover kind of grabbed me and the description hooked me:

“Three strangers are condemned to live together in darkness, crushed together in a concrete stall so small that they can never sit down. Liquid food drips down from above. Waste drains through a grid on the floor. So begins one of the strangest, most surreal comments on the human experience, on love and hatred and the human ability to find good in any situation, no matter how difficult.”

I’m not the best at reviewing books, honestly the description above from the back cover sets up the story perfectly. The writing is very descriptive and the prose are amazing vivid and disturbing. The world the author paints is a nightmare and yet…there’s definitely beauty in the filth. 

How much did I love this book? It arrived on my doorstep this morning at around 09:00, I was reading it by 09:10. It’s now 13:40 and I’ve finished the book (it’s only 125 pages) and I’m now rushing to tell you all it’s a page turner for sure! I’ve never sat down and read a book from cover to cover in one sitting, not even a short one like this. I was truly captivated. ",therealredding,1h4a7wl,https://reddit.com/r/books/comments/1h4a7wl/the_divine_farce_by_michael_s_a_graziano_very/,https://www.reddit.com/r/books/comments/1h4a7wl/the_divine_farce_by_michael_s_a_graziano_very/,2024-12-01 18:45:31,14,0.87,14,0,7,0,0,False,False,True,False,False,,self,t3_1h4a7wl
books,"Weekly FAQ Thread December 01, 2024: How do I get through an uninteresting book?","Hello readers and welcome to our Weekly FAQ thread!  Our topic this week is: How do I get through an uninteresting book?  Sometimes we want to read something because we're ""supposed to"" and want to say that we did.  Or, it's something that needs to be read for a school assignment.  Either way, how do you get through books you find uninteresting?
              
You can view previous FAQ threads [here](https://www.reddit.com/r/books/wiki/faq) in our [wiki](https://www.reddit.com/r/books/wiki/index).

Thank you and enjoy!",AutoModerator,1h41smj,https://reddit.com/r/books/comments/1h41smj/weekly_faq_thread_december_01_2024_how_do_i_get/,https://www.reddit.com/r/books/comments/1h41smj/weekly_faq_thread_december_01_2024_how_do_i_get/,2024-12-01 12:00:12,11,0.87,11,0,19,0,0,False,False,True,False,False,WeeklyThread,self,t3_1h41smj
books,New Releases: December 2024,"Hello readers and welcome! Every month this thread will be posted for you to discuss new and upcoming releases! Our only rules are:

1. The books being discussed must have been published within the last three months OR are being published this month.

2. No direct sales links.

3. And you are allowed to promote your own writing as long as you follow the first two rules.

That's it! Please discuss and have fun!",AutoModerator,1h403pr,https://reddit.com/r/books/comments/1h403pr/new_releases_december_2024/,https://www.reddit.com/r/books/comments/1h403pr/new_releases_december_2024/,2024-12-01 10:00:11,13,0.82,13,0,9,0,0,False,False,True,False,False,WeeklyThread,self,t3_1h403pr
books,Novelist Maggie O’Farrell: ‘Children don’t just need butterflies and rainbows’,,zsreport,1h39wpf,https://reddit.com/r/books/comments/1h39wpf/novelist_maggie_ofarrell_children_dont_just_need/,https://www.theguardian.com/books/2024/nov/30/novelist-maggie-ofarrell-children-dont-just-need-butterflies-and-rainbows,2024-11-30 10:32:48,837,0.94,837,0,125,0,0,False,False,False,False,False,,https://a.thumbs.redditmedia.com/2cqfd8vaKsnv5tBOQrHcX_UozOkY8OZOrQKWMtYpIs4.jpg,t3_1h39wpf
books,Finding it difficult to read books written by men?,"In a lot of books written by men (if it’s not glaringly obvious), I’m noticing this undercurrent of misogyny in a lot of their books I try to read. I’m currently reading “The Shadow of the Wind” by Carlos Ruiz Zafón, and the way women are described is just gross, makes me roll my eyes, and I honestly don’t feel like I want to pick up the book anymore because of it. I’m enjoying the plot otherwise, but it just gives me this nasty feeling any time a woman’s appearance is described. And this isn’t even *close* to being the worst example. I often DNF books with male authors because it seems like they just view women as sexual objects and not really deep characters. It makes it harder for me to relate to the story. ",sunlover010,1h4yb1i,https://reddit.com/r/books/comments/1h4yb1i/finding_it_difficult_to_read_books_written_by_men/,https://www.reddit.com/r/books/comments/1h4yb1i/finding_it_difficult_to_read_books_written_by_men/,2024-12-02 16:02:24,0,0.41,0,0,143,0,0,False,False,True,False,False,,self,t3_1h4yb1i
books,"After I finish reading a book, I always write a review. If I think the book is good or amazing, I give it 5 stars. But if it's bad I usually rate it 4 stars because I don't want to hurt the author's feelings.","As I don’t want to hurt the author’s feelings, I never rate a book 1 star. Imagine putting in all that effort and time to write a book, only to get a 1 star rating, that must be really disheartening. For books I don't like or even bad books I give 4 stars and explain in the comments why it received that rating. I think this provides better feedback for the author, as they’ll understand why the book didn’t earn 5 stars. Also, before I read a book I do some research so most of the books I finish, I really enjoy. There are only a few that I don't like, but as far as I remember  I've never rated a book 1 star. Also, I don't think a 5 star rating is always sufficient, a 10 point scale would be better. If that were available, I could rate a book 6 or 7 if I didn't like it, but never 1 star.",Delicious_Maize9656,1h50vwm,https://reddit.com/r/books/comments/1h50vwm/after_i_finish_reading_a_book_i_always_write_a/,https://www.reddit.com/r/books/comments/1h50vwm/after_i_finish_reading_a_book_i_always_write_a/,2024-12-02 17:48:01,0,0.25,0,0,57,0,0,False,False,True,False,False,,self,t3_1h50vwm
books,Why Outer Dark by Cormac McCarthy is a deeply unsettling work of fiction,"This book is wild. Just reading the back cover, I knew I was in for something crazy, but *Outer Dark* surpassed even my wildest expectations.

*Outer Dark* back cover:

*""A woman bears her brother's child, a boy; he leaves the baby in the woods and tells her he died of natural causes. Discovering her brother's lie, she sets forth alone to find her son. Both brother and sister wander separately through a countryside being scourged by three terrifying and elusive strangers, headlong toward an eerie, apocalyptic resolution.""*

This is an extremely dark read, but I loved every word McCarthy wrote. It was fantastic.

As I mentioned in my review of All the Pretty Horses, Cormac McCarthy is probably my favourite author. *Outer Dark* continues to reinforce that belief.

Interestingly, as I started reading *Outer Dark*, a Vanity Fair article surfaced claiming that Cormac McCarthy had a 16-year-old muse late in his life. While I haven’t been able to access the full article due to subscription barriers, the excerpts and discussions I’ve encountered paint the piece as overly stylized, almost as if the author is attempting to mimic McCarthy’s own prose. This stylistic choice, combined with the extraordinary claims made, makes the story feel exaggerated, if not dubious. I’m not dismissing the possibility that some of it might be true—if it is, it’s deeply troubling—but the lack of concrete evidence and the outlandish nature of certain allegations leave me skeptical. It’s also worth noting that McCarthy is no longer alive to respond or clarify these claims. While the article has sparked debates about separating art from the artist, I believe McCarthy’s literary contributions remain vital. His works deserve to be read and analyzed, even as we remain mindful of the complexities surrounding his personal life.

Now, back to *Outer Dark*.

This is an amazing piece of fiction. From the very beginning, the book is relentlessly dark. Set in Appalachia, McCarthy creates an eerie, almost fantastical world that feels alive in its desolation. The brother and sister live in an isolated shack deep in the woods, and when they venture out on their separate journeys, they encounter a cast of vivid and unforgettable characters. Some of these figures are helpful, while others are downright malevolent. These secondary characters breathe so much life—and death—into the story, amplifying its intensity.

The first time Culla Holme, the brother, meets the three elusive strangers face-to-face, right after his ride on the ferry, is one of the creepiest scenes I’ve ever read. The way McCarthy describes the shadows moving in the clearing and the strangers’ unsettling mannerisms—how they move, stare, laugh, and speak—is masterful. The tension is almost unbearable.

You know they’ll return, and when they do, McCarthy doesn’t disappoint.

*""Well, I see ye didn't have no trouble findin us.*  
*I wasn't huntin ye.*  
*You got here all right for somebody bound elsewhere.*  
*I wasn't bound nowheres. I just seen the fire.*  
*I like to keep a good fire. A man never knows what all might chance along. Does he?*  
*No.*  
*No. Anything's liable to warsh up. From nowheres nowhere bound.*  
*Where are you bound? Holme said.*  
*I ain't, the man said. By nothin. He looked up at Holme. We ain't hard to find. Oncet you've found us.""*

This scene is haunting, and when the strangers appear again—with the one-eyed baby and the tinker in the tree—the atmosphere is downright terrifying. I’m not sure if *Outer Dark* is officially considered a horror novel, but it’s probably the scariest book I’ve ever read.

I’m not a big horror reader. People rave about Stephen King, but I haven’t been impressed. I’ve read *The Dead Zone* and *The Shining*, and neither really did it for me. I actually prefer Kubrick’s adaptation of *The Shining* because it improved on the source material in tone and execution. That said, I love Dan Simmons, I mostly know him as a science fiction author, however, I read Drood and loved it, though it wasn’t the horror elements that hooked me. If you have horror recommendations, I’d love to explore more.

But *Outer Dark*? It qualifies as horror in my book.

Religious themes also run deep in this story, coming to the forefront in the latter half. One of the most memorable scenes is when Holme meets the hog drovers. After one of their brothers dies and Holme gets blamed, a preacher shows up, declaring his guilt without any knowledge of the situation. The absurdity of this preacher, casually pronouncing judgment, is both comical and thought-provoking—a sharp critique of blind religious authority.

Rinthy Holme, Culla’s sister, has her own strange and fascinating encounters, though none are as grotesque as her brother’s.

This was an incredible read. Any Cormac McCarthy fan needs to pick up *Outer Dark*. Being one of his earlier works, it’s not as widely discussed as some of his other novels, but it deserves to be. It’s right up there with the rest of his literature in my opinion. I wouldn’t necessarily recommend *Outer Dark* as a starting point for McCarthy newcomers, but for fans, it’s an absolute must-read.",Sudden-Database6968,1h3gwu8,https://reddit.com/r/books/comments/1h3gwu8/why_outer_dark_by_cormac_mccarthy_is_a_deeply/,https://www.reddit.com/r/books/comments/1h3gwu8/why_outer_dark_by_cormac_mccarthy_is_a_deeply/,2024-11-30 16:59:00,130,0.7,130,0,77,0,0,False,False,True,False,False,,self,t3_1h3gwu8
