subreddit,title,selftext,author,id,permalink,url,created_utc,score,upvote_ratio,ups,downs,num_comments,total_awards_received,gilded,is_video,is_original_content,is_self,over_18,spoiler,link_flair_text,thumbnail,name
webdev,How often do you push code to GitHub?,"Wondering if I'm in the majority: I push my code everyday, but only once with all of my commits.",yeahimjtt,1ha0wrc,https://reddit.com/r/webdev/comments/1ha0wrc/how_often_do_you_push_code_to_github/,https://www.reddit.com/r/webdev/comments/1ha0wrc/how_often_do_you_push_code_to_github/,2024-12-09 03:45:47,4,0.55,4,0,58,0,0,False,False,True,False,False,Question,self,t3_1ha0wrc
webdev,How many $(document).ready() should I have in my code?,"How many $(document).ready() should I have in my code? Currently I have way too many, around 10+. Should I combine everything into one $(document).ready()? What are some cases where I should have more than one?",Cyb3rPhantom,1h9xvjt,https://reddit.com/r/webdev/comments/1h9xvjt/how_many_documentready_should_i_have_in_my_code/,https://www.reddit.com/r/webdev/comments/1h9xvjt/how_many_documentready_should_i_have_in_my_code/,2024-12-09 01:04:19,19,0.62,19,0,108,0,0,False,False,True,False,False,,self,t3_1h9xvjt
webdev,How to find how site was built?,Is there a way to see how someone build their site? Whether it was with a no code builder or they wrote the code themselves? How would I find out if there’s a way?,buff_mac466,1ha3hgf,https://reddit.com/r/webdev/comments/1ha3hgf/how_to_find_how_site_was_built/,https://www.reddit.com/r/webdev/comments/1ha3hgf/how_to_find_how_site_was_built/,2024-12-09 06:19:56,0,0.5,0,0,8,0,0,False,False,True,False,False,Question,self,t3_1ha3hgf
webdev,Cloud based server??? ,"

WTF am I doing guys so the team developing my app is using a cloud based server and I honestly have no idea what they’re doing but the one they’re using seems like they’re up selling me and I’ve been trying to find a good server that meets my needs without paying too much (like an annual subscription)

Description: small app, no more than 40 users at once. Basic functions like financial transactions, account creation and editing profile, post listings with pictures and descriptions (very simple version of an e-commerce website, probably won’t have many users at all) 


‘Build 4’ is what they currently want me to pay for. 

Does anyone have suggestions for alternatives? ",oreo_lester,1h9mm8i,https://reddit.com/r/webdev/comments/1h9mm8i/cloud_based_server/,https://i.redd.it/6pwl06aijn5e1.jpeg,2024-12-08 16:32:33,31,0.71,31,0,58,0,0,False,False,False,False,False,Question,https://b.thumbs.redditmedia.com/fKhCZcvQpiNAbjYHuzXdeToQMCcR-D2OxHQ5KiCydqg.jpg,t3_1h9mm8i
webdev,What are the most useful features you've discovered in your IDE?,"In my case, I found out WebStorm has a built-in database client and a basic HTTP client, the latter being my go-to tool for drafting network requests. These allowed me to replace external apps, and made it very convenient without the need to switch between external apps.

PS: I'm exploring developer productivity for my thesis. If you'd like to share your experiences, here's a quick survey 📝: [https://forms.gle/4B9GAtXD1nahwvn48](https://forms.gle/4B9GAtXD1nahwvn48)",Kartm,1ha3t33,https://reddit.com/r/webdev/comments/1ha3t33/what_are_the_most_useful_features_youve/,https://www.reddit.com/r/webdev/comments/1ha3t33/what_are_the_most_useful_features_youve/,2024-12-09 06:42:04,2,0.6,2,0,1,0,0,False,False,True,False,False,,self,t3_1ha3t33
webdev,What is the best open source alternative to Tailwind UI?,"I'm \*\*really\*\* bad at UI/design, but if I have examples, I can pretty much create anything. I'm starting a new project and I need a good UI to use. There is anything open source as good as Tailwind UI? I'm not using javascript frameworks. I just need the HTML and CSS.",fenugurod,1h9lnwe,https://reddit.com/r/webdev/comments/1h9lnwe/what_is_the_best_open_source_alternative_to/,https://www.reddit.com/r/webdev/comments/1h9lnwe/what_is_the_best_open_source_alternative_to/,2024-12-08 15:50:08,0,0.35,0,0,24,0,0,False,False,True,False,False,Question,self,t3_1h9lnwe
webdev,What advice would you give to someone with 10 years of experience in IT (non dev) wanting to transition to a Java Backend role.,"Looking for some suggestions on where to start, what version to learn, expections, career growth etc.",t7Saitama,1ha6q2p,https://reddit.com/r/webdev/comments/1ha6q2p/what_advice_would_you_give_to_someone_with_10/,https://www.reddit.com/r/webdev/comments/1ha6q2p/what_advice_would_you_give_to_someone_with_10/,2024-12-09 10:22:13,2,0.62,2,0,12,0,0,False,False,True,False,False,Question,self,t3_1ha6q2p
webdev,What is Facebook on Android?,,bunzelburner,1ha0qus,https://reddit.com/r/webdev/comments/1ha0qus/what_is_facebook_on_android/,https://i.redd.it/gbz8ogeytq5e1.png,2024-12-09 03:36:44,61,0.79,61,0,12,0,0,False,False,False,False,False,,https://b.thumbs.redditmedia.com/hG4OgO65X-n1Clw00wlVDjqh8wJZmap28ZpO-R7znoE.jpg,t3_1ha0qus
webdev,Render's 750 hours instance clarification?,"I dont get it, it has 750 hours of free compute every month, that means that if your server is up for 31 \* 24 hours it will always be less then 750 hours. 

Basicaly even if with the free-plan that the server is active 24/7 and there's lots of traffic, you will never run out of render hours? what's the catch?",badboyzpwns,1ha45sz,https://reddit.com/r/webdev/comments/1ha45sz/renders_750_hours_instance_clarification/,https://www.reddit.com/r/webdev/comments/1ha45sz/renders_750_hours_instance_clarification/,2024-12-09 07:05:51,1,0.56,1,0,10,0,0,False,False,True,False,False,Discussion,self,t3_1ha45sz
webdev,AI Code Reviews - For Development teams?,"Hi folks,

  
I run an agency with around 10 web devs and wondered if there is any good tooling out there for code reviews? Essentialy I'm a technical PM and want to improve my dev team work flow and I was thinking of introducing AI Code Reviews to point out best practices etc, accessiblity, optimisation, refactoring ideas.  
Would love to hear workflows of people in a similar situation

  
Let me know what you guys are doing! Thanks",badgerbaws,1ha4kuf,https://reddit.com/r/webdev/comments/1ha4kuf/ai_code_reviews_for_development_teams/,https://www.reddit.com/r/webdev/comments/1ha4kuf/ai_code_reviews_for_development_teams/,2024-12-09 07:35:53,0,0.33,0,0,6,0,0,False,False,True,False,False,,self,t3_1ha4kuf
webdev,great and terrible crutches,,HoraneRave,1ha0smr,https://reddit.com/r/webdev/comments/1ha0smr/great_and_terrible_crutches/,https://i.redd.it/l77tub1cuq5e1.png,2024-12-09 03:39:30,0,0.4,0,0,1,0,0,False,False,False,False,False,Discussion,https://b.thumbs.redditmedia.com/rmCdnf6KZesJPwSKvEQBvezGaB5CZxTj0B2QjlcKPDs.jpg,t3_1ha0smr
webdev,Offering financing to clients,"Own a digital agency and IT consultancy. 

Something I've thought about for a while is offering finance options to clients. For example, if an ecommerce site costs £30,000, they could put down a deposit and spread the cost, say £1000 a month for 36 months (subject to credit check). Clients wouldn't gain ownership of anything until it is paid off entirely.

Another alternative is potentially leasing whereby we include maintenance and hosting but the monthly is indefinite. They'd commit to a minimum time period and keep paying after this to keep the site active or start again and rebuild. 

Changes outside of the agreement would be billed at ""x"" amount extra for the remaining agreement months. 

Could offer this by partnering with a bank/broker potentially. Contracts would have to be watertight. 

Drawback - debts die with the company if it folds unless we enforce a personal guarantee. 

Thoughts? 
",dillonlawrence0101,1h9wsfj,https://reddit.com/r/webdev/comments/1h9wsfj/offering_financing_to_clients/,https://www.reddit.com/r/webdev/comments/1h9wsfj/offering_financing_to_clients/,2024-12-09 00:10:01,0,0.4,0,0,5,0,0,False,False,True,False,False,,self,t3_1h9wsfj
webdev,Help needed - Embassy Appointment ,"Need help

Hello,
I have been trying to get a germany study visa appointment for the last six months. All the appointments get taken in a few seconds. I have tried everything. I had to defer my semester and now the deadline is going to pass again. 
The problem is that there is a server side limit of 3 seconds before which you can't submit the captcha and appointment form. Considering this limit, the earliest you can submit the form after the appointments are open is 4 seconds (one second to click the appointment slot, open the form and fill it; and 3 seconds wait before the submission). I have many a times clicked the submit button at exactly the 4 second mark, but still no luck . 
I was told that there are some people who have somehow bypassed this limit and they can submit the form and captcha from the client side before the 3 second limit. They book all the appointments. 
I don't know if this is true. But if someone can confirm this or help me, i would be eternally grateful.
Here is the link to the appointment website:
https://service2.diplo.de/rktermin/extern/choose_realmList.do?locationCode=kara&amp;request_locale=en",msani321,1h9w5ef,https://reddit.com/r/webdev/comments/1h9w5ef/help_needed_embassy_appointment/,https://www.reddit.com/r/webdev/comments/1h9w5ef/help_needed_embassy_appointment/,2024-12-08 23:39:02,1,0.6,1,0,0,0,0,False,False,True,False,False,,self,t3_1h9w5ef
webdev,Trouble keeping footer on the bottom of the page,"I have trouble keeping my footer on the bottom of the page.
I'm using dynamic bootstrap elements, and in some cases the footer is in the background and not on the bottom.

For example: https://imgur.com/a/YOdXIyZ

My code: https://imgur.com/a/WmCvlQG

Css: https://imgur.com/a/PyrxDBd

What can I do to keep the footer under everything?
 I think the problem might actually be the bootstrap classes section or some cols.
What can I do to keep them inside the body keeping some space for the footer? Thank you🙏🏼",ale_zampie,1h9v3q1,https://reddit.com/r/webdev/comments/1h9v3q1/trouble_keeping_footer_on_the_bottom_of_the_page/,https://www.reddit.com/r/webdev/comments/1h9v3q1/trouble_keeping_footer_on_the_bottom_of_the_page/,2024-12-08 22:48:54,1,0.6,1,0,3,0,0,False,False,True,False,False,Question,self,t3_1h9v3q1
webdev,It turns out I'm still excited about the web,,fagnerbrack,1ha2boe,https://reddit.com/r/webdev/comments/1ha2boe/it_turns_out_im_still_excited_about_the_web/,https://werd.io/view/6707fe1b68490c909b0770a2,2024-12-09 05:06:31,0,0.27,0,0,2,0,0,False,False,False,False,False,,https://b.thumbs.redditmedia.com/xBr-2zAToW6w403Q8vlrFXImrqd6s_fD4TUeimBRuic.jpg,t3_1ha2boe
webdev,What happened to the `sitemap` NPM package? It's no longer on NPM...,,SkydiverTyler,1h9p3n1,https://reddit.com/r/webdev/comments/1h9p3n1/what_happened_to_the_sitemap_npm_package_its_no/,https://www.npmjs.com/package/sitemap,2024-12-08 18:22:05,0,0.25,0,0,6,0,0,False,False,False,False,False,Question,default,t3_1h9p3n1
webdev,Profitability of solo website development by order?,Is it profitable to be a solo or small team web developer and take orders from small and medium businesses to make websites for them?,Zaza_Zazadze,1ha7sc3,https://reddit.com/r/webdev/comments/1ha7sc3/profitability_of_solo_website_development_by_order/,https://www.reddit.com/r/webdev/comments/1ha7sc3/profitability_of_solo_website_development_by_order/,2024-12-09 11:37:19,0,0.43,0,0,2,0,0,False,False,True,False,False,,self,t3_1ha7sc3
webdev,What causes 'bad days' for developers?,,mmaksimovic,1ha90yk,https://reddit.com/r/webdev/comments/1ha90yk/what_causes_bad_days_for_developers/,https://newsletter.getdx.com/p/factors-contributing-to-bad-developer-days,2024-12-09 12:52:01,14,0.75,14,0,37,0,0,False,False,False,False,False,,https://b.thumbs.redditmedia.com/_rBXtT_4My9iNcm_b9cCgDz6MW00DrCDYGZroXjsiBg.jpg,t3_1ha90yk
webdev,How to get clients ?,"I'm Zade, I'm a web designer and developer. I have worked for like 4-5 clients till now, I've tried fivver but it sucks and can't find enough opportunities on reddit I'm a student so can't even look for a full time job. So want some suggestions from people who have already done it.",scoop_creator,1ha01rs,https://reddit.com/r/webdev/comments/1ha01rs/how_to_get_clients/,https://www.reddit.com/r/webdev/comments/1ha01rs/how_to_get_clients/,2024-12-09 02:59:21,0,0.5,0,0,17,0,0,False,False,True,False,False,Question,self,t3_1ha01rs
webdev,Privacy-protecting Web hosts?,"What's the latest on Web hosts that protect owners' privacy? I want to be clear, this is for a legal purpose and I have zero interest in evading law enforcement. This would be for a Web forum, and some topics get contentious so there have been issues in the past with owners getting doxxed. I'm more concerned about protection against that than anything. I'm asking here because this seems to be one of those things that there are a million fake ""review"" sites on promoting every single hosting option out there, so I was hoping some of y'all might have some real-world experiences.

I think I'd be looking for a dedicated host, something modest in horsepower but generous in bandwidth (forum users love their pic attachments). CDNs like Cloudflare are valuable, but you can't host something like XenForo in their ""Workers"" or ""Pages"" containers. I'm EXTREMELY familiar with AWS and DigitalOcean but other sites have had bad experiences there. I was initially thinking OVH, but I feel like their servers have gone up a lot in price lately - their inventory lists a lot of ""game"" servers but I'm really more in the $10-$40/mo ""commodity"" category....",CodeAndBiscuits,1h9zq38,https://reddit.com/r/webdev/comments/1h9zq38/privacyprotecting_web_hosts/,https://www.reddit.com/r/webdev/comments/1h9zq38/privacyprotecting_web_hosts/,2024-12-09 02:41:41,1,0.67,1,0,1,0,0,False,False,True,False,False,,self,t3_1h9zq38
webdev,[Meta] Does offering payment for a solution violate the no commercial promotions rule?,I’m working on recreating my photography website but am not super experienced about the type of webdev tools out there (despite watching many videos about this topic). I have a bunch of needs and was creating a writeup about what I need and what I've tried but it got really large. I was thinking of offering $10 as a token of appreciation to anyone who provides a viable solution. Would this be considered a violation of the rule against commercial promotions or solicitations?,TestFlightBeta,1h9m2fk,https://reddit.com/r/webdev/comments/1h9m2fk/meta_does_offering_payment_for_a_solution_violate/,https://www.reddit.com/r/webdev/comments/1h9m2fk/meta_does_offering_payment_for_a_solution_violate/,2024-12-08 16:08:07,0,0.25,0,0,1,0,0,False,False,True,False,False,,self,t3_1h9m2fk
webdev,"is it a must to know Docker, k8s today? ",As title says,ballbeamboy2,1h9lwb3,https://reddit.com/r/webdev/comments/1h9lwb3/is_it_a_must_to_know_docker_k8s_today/,https://www.reddit.com/r/webdev/comments/1h9lwb3/is_it_a_must_to_know_docker_k8s_today/,2024-12-08 16:00:33,102,0.88,102,0,78,0,0,False,False,True,False,False,Discussion,self,t3_1h9lwb3
webdev,Just a Reminder: GoDaddy 👎👎👎 (And How I Deployed My SvelteKit App Without the Headache),"Hey everyone! 👋

I just published a guide on Medium about deploying a SvelteKit app to GitHub Pages with a custom domain. If you’ve ever struggled with DNS settings, SSL certificates, or figuring out how to go live with your app, this is for you. Just a reminder that GoDaddy 👎👎👎.

In the article, I share:

* A step-by-step walkthrough for deploying a SvelteKit app.
* Why GoDaddy was a nightmare for me (and how Porkbun saved the day).
* Tips for setting up DNS and GitHub Pages without losing your mind.

Whether you’re a beginner figuring this out for the first time or a seasoned dev looking for a quick guide, I’d love for you to check it out. Let me know if you have questions or if there’s something I missed!

👉 [Read it here](https://medium.com/@zuma3434/deploying-your-sveltekit-app-to-github-pages-with-a-custom-domain-ditch-godaddy-for-porkbun-f331259181fe?source=friends_link&amp;sk=fb21e8e3920502ece54e74e5b70e997d)

Would love to hear your thoughts, and if you’ve got other deployment tips or domain provider recommendations, share them in the comments!",cuco3434,1h9r32n,https://reddit.com/r/webdev/comments/1h9r32n/just_a_reminder_godaddy_and_how_i_deployed_my/,https://www.reddit.com/r/webdev/comments/1h9r32n/just_a_reminder_godaddy_and_how_i_deployed_my/,2024-12-08 19:49:06,0,0.25,0,0,1,0,0,False,False,True,False,False,,self,t3_1h9r32n
webdev,Random Color Generator tool for the web!,"Hi, couple of months ago I created a [random color generator](https://www.innateblogger.com/p/random-color-generator.html) tool for fun and made a post [here](https://www.reddit.com/r/webdev/comments/1fmc93p/i_created_a_random_color_generator/).

Got some good feedback and ideas about it. Today, I updated the tool again and tried to implement most of the feedback. Please share your thoughts on it now.

Thank you.",Dimention_less,1h9qqn3,https://reddit.com/r/webdev/comments/1h9qqn3/random_color_generator_tool_for_the_web/,https://www.reddit.com/r/webdev/comments/1h9qqn3/random_color_generator_tool_for_the_web/,2024-12-08 19:33:25,6,0.8,6,0,6,0,0,False,False,True,False,False,Discussion,self,t3_1h9qqn3
webdev,Underrated Front-End Skills Employers Are Looking For in 2024?,"At this point I figure everyone is already proficient in Typescript, React, etc. What other skills are desirable that aren't back-end focused?

Here are some I'm considering learning while I look for work

D3.js  
GraphQL  
Svelte  
Three.js

",digitalWizzzard,1h9wgaq,https://reddit.com/r/webdev/comments/1h9wgaq/underrated_frontend_skills_employers_are_looking/,https://www.reddit.com/r/webdev/comments/1h9wgaq/underrated_frontend_skills_employers_are_looking/,2024-12-08 23:53:51,83,0.89,83,0,88,0,0,False,False,True,False,False,Discussion,self,t3_1h9wgaq
webdev,I tested 45 configurations for the GraphQL stack in the JS/TS landscape! It's quite interesting how they can differ when it comes to performance,,tomekdev,1ha60fh,https://reddit.com/r/webdev/comments/1ha60fh/i_tested_45_configurations_for_the_graphql_stack/,https://tomekdev.com/posts/benchmarking-graphql-solutions-in-the-js-ts-landscape,2024-12-09 09:26:15,2,0.67,2,0,3,0,0,False,False,False,False,False,,https://a.thumbs.redditmedia.com/YXX2si2q7IQRltexrOBmQWgf18N8f46B_T16ykuypI0.jpg,t3_1ha60fh
webdev,Itch.io has been taken down by Funko,,Infinite-Addendum-52,1ha63vv,https://reddit.com/r/webdev/comments/1ha63vv/itchio_has_been_taken_down_by_funko/,https://bsky.app/profile/itch.io/post/3lcu6h465bs2n,2024-12-09 09:33:34,142,0.92,142,0,15,0,0,False,False,False,False,False,News,default,t3_1ha63vv
webdev,How do I get this floating type icons that interact on mouse hover on a website?,,mallickaniket,1ha7oju,https://reddit.com/r/webdev/comments/1ha7oju/how_do_i_get_this_floating_type_icons_that/,https://www.redgifs.com/watch/grandrelievedneondwarfgourami,2024-12-09 11:30:20,0,0.25,0,0,12,0,0,False,False,False,False,False,,https://b.thumbs.redditmedia.com/nHXX3sC3m7oBBpRp1iC1bqu3swYv38-3_k2E4EoSPkY.jpg,t3_1ha7oju
webdev,How to get a .org website for a political initiative,"Hi. I want to set up a very simple home page for a website for a political initiative. I don't intend to make money off it, gather data, or host an active forum. I just want a page with basic information and contact details and so forth, really just a holding page for the moment so that I have a website I can add to an email sig.

I tried to buy a domain and make a website through Wix, found it to be a difficult process. If buying a domain and building something myself through Wix is the only route I'll just crack on at it but I was wondering if there's some other way I'm not aware of. I just want something that;

Contains basic information, hyperlinks to relevant resources, contact details etc  
Involves no economic activity, is a .org  
Looks reasonably professional  
Doesn't require that I sign up for anything for more than a year  
Costs $10 a month or less  
Requires the minimum possible amount of time and expertise from me in website design and building

Thanks for your help",Minute_Try_7194,1ha7ftw,https://reddit.com/r/webdev/comments/1ha7ftw/how_to_get_a_org_website_for_a_political/,https://www.reddit.com/r/webdev/comments/1ha7ftw/how_to_get_a_org_website_for_a_political/,2024-12-09 11:13:38,3,0.72,3,0,4,0,0,False,False,True,False,False,,self,t3_1ha7ftw
webdev,WIP: Angular-inspired Bun Web Framework,"https://preview.redd.it/vbmwn0r2cq5e1.png?width=806&amp;format=png&amp;auto=webp&amp;s=106bc2901856af85e7c6474b511b1525281a8c15

I have been working on a side project - a web framework built on top of Bun that is supposed to feel like Angular, as that's the framework I'm most comfortable with. I have components that update on property changes &amp; I'm building the components out using Google's incremental-dom. I am currently a little stuck on SPA routing and am wondering if anyone has ideas for what libraries might work well for inspiration, or if anyone has tips on how to put together a minimalistic router. I have taken a peek at the Angular repo &amp; routing is insanely complicated - I'm trying to start out small. TIA  
",tbosk,1h9yvmd,https://reddit.com/r/webdev/comments/1h9yvmd/wip_angularinspired_bun_web_framework/,https://www.reddit.com/r/webdev/comments/1h9yvmd/wip_angularinspired_bun_web_framework/,2024-12-09 01:56:38,5,0.86,5,0,0,0,0,False,False,True,False,False,Discussion,https://a.thumbs.redditmedia.com/H2ZY6OTAP2qytefMXFOvl0XQwxeK3ZS5DbqchWPoOb0.jpg,t3_1h9yvmd
webdev,I created this all-in-one JSON Toolkit,"This post might come across as a bit self-promotional, but I created this tool for personal use, and some of my colleagues have found it helpful. It's mainly for developers and testers, so I think r/webdev is a good place to share it, and I hope it will be useful to others too.

This tool addresses some pain points I face when developing, debugging, or testing features that involve JSON data.

* I often need to search for each key whenever I get the data, so I built a way to query multiple keys at once.
* It's difficult to remember deep paths to locate my data, so I built a JSON viewer that lets me extract any path by simply clicking on the key.

Some might argue that I should use Postman test scripts or Postgres' `json_extract_path`. But I find these solutions better suited for stable APIs or data. When I’m developing a new feature or debugging an issue, the target field can pop into my mind at any moment. So I prefer to quickly access the field and the data directly, rather than having to write a Postman script or SQL query.

If you're interested in the tool, here it is: [https://www.devtoolkits.tech/](https://www.devtoolkits.tech/)

I’d love to hear your feedback to help improve it!",Lac-TranAn,1ha9e90,https://reddit.com/r/webdev/comments/1ha9e90/i_created_this_allinone_json_toolkit/,https://www.reddit.com/r/webdev/comments/1ha9e90/i_created_this_allinone_json_toolkit/,2024-12-09 13:11:49,6,0.81,6,0,8,0,0,False,False,True,False,False,,self,t3_1ha9e90
webdev,Any easy to use white label scheduling API?,"I have a startup where clients can register and book appointments on my web app. I’m looking for the best scheduling API that scales and allows me to have multiple accounts. 

Any ideas?

I don’t mind the price, as long as it is easy to use and works well. 

Thanks Reddit ",edoar17,1h9qulc,https://reddit.com/r/webdev/comments/1h9qulc/any_easy_to_use_white_label_scheduling_api/,https://www.reddit.com/r/webdev/comments/1h9qulc/any_easy_to_use_white_label_scheduling_api/,2024-12-08 19:38:26,7,0.89,7,0,7,0,0,False,False,True,False,False,Question,self,t3_1h9qulc
webdev,update on my open-source social media scheduler,"Hi everyone, I built a little bit more into my open-source free scheduler :)

Postiz is an open-source social media scheduling tool that offers scheduling on the following:

Instagram, YouTube, Dribbble, LinkedIn, Reddit, TikTok, Facebook, Pinterest, Threads, X, Slack, Discord, Mastodon and BlueSky.

[https://github.com/gitroomhq/postiz-app](https://github.com/gitroomhq/postiz-app)

There are some cool new features:

* Option to add stories to Instagram and tag people for collaboration.
* Customer separation - you can group accounts per customer, and when you schedule, you can filter by customer.
* Option to tag companies on LinkedIn (I wanted to tag people also, but it was not possible)
* Fixes for different social media posts failing.
* **Introducing Plugs!** This is a concept you can find in other tools that can boost your engagement for your current posts. Here are some examples:
   * Once your post reaches X amount of likes, repost it (to regain visibility to it)
   * Once your post reaches X amount of likes, add another message to it (all your existing commenters will get a notification)

**What's next:**

* Public API - I have been too lazy to make it, I have to push more :)
* One Inbox - so you can reply to all your messages from one place.
* Google My Business provider
* AI Agents - I am still trying to figure out what to do with it, but it looks interesting.

Special thanks to this community that supports me with every post ❤️",sleepysiding22,1ha8wod,https://reddit.com/r/webdev/comments/1ha8wod/update_on_my_opensource_social_media_scheduler/,https://www.reddit.com/r/webdev/comments/1ha8wod/update_on_my_opensource_social_media_scheduler/,2024-12-09 12:45:22,38,0.95,38,0,10,0,0,False,False,True,False,False,,self,t3_1ha8wod
