subreddit,title,selftext,author,id,permalink,url,created_utc,score,upvote_ratio,ups,downs,num_comments,total_awards_received,gilded,is_video,is_original_content,is_self,over_18,spoiler,link_flair_text,thumbnail,name
webdev,"Stuck, I Need a good music api With streaming links",So Im creating a music app for my cs project And it was fully functioning using spotifys API but now They have made the previewUrl redundent in the track that you get from the api. Was wandering if anyone knew any other apis i could get a streaming link from. Deezer is ass and doesnt have enough songs and things like soundcloud arent accepting any new Developers. Any help is appreciated,FlunkyDan,1h24hot,https://reddit.com/r/webdev/comments/1h24hot/stuck_i_need_a_good_music_api_with_streaming_links/,https://www.reddit.com/r/webdev/comments/1h24hot/stuck_i_need_a_good_music_api_with_streaming_links/,2024-11-28 20:04:46,0,0.5,0,0,2,0,0,False,False,True,False,False,Resource,self,t3_1h24hot
webdev,"Switching from BootstrapVue (Bootstrap v4): Suggestions for a Modern, Lightweight UI Library?","Hey everyone!

We're looking to replace our current component library, which is built with **BootstrapVue**. The main reasons for the switch are:

1. **Incompatibility with Vue3**
2. BootstrapVue uses **Bootstrap v4** under the hood which is very heavy-weight as it still uses jQuery.

We already use **TailwindCSS** and **SCSS** in our development, so we're considering **shadcn** as a potential replacement. One key requirement is that the new library must be **heavily customizable** to help us maintain the look and feel of the Bootstrap components we're currently using.

We also need it to support:

* Accessible components
* Responsive design
* Vue3 compatibility
* Interactive Components (Modals, Dropdowns, etc.)
* Animations and Transitions
* Comprehensive Documentation and Active Community
* Potentially Dark Mode Support

Does anyone have experience using shadcn in a Vue3 + Tailwind environment? Are there other UI libraries or frameworks you'd recommend that offer a good balance between performance, customization, and accessibility?

Thanks in advance for your insights!",Unchart3disOP,1h242rn,https://reddit.com/r/webdev/comments/1h242rn/switching_from_bootstrapvue_bootstrap_v4/,https://www.reddit.com/r/webdev/comments/1h242rn/switching_from_bootstrapvue_bootstrap_v4/,2024-11-28 19:45:26,2,0.67,2,0,3,0,0,False,False,True,False,False,Question,self,t3_1h242rn
webdev,MacBook RAM: 16GB or 24GB for webdev work? ,"I’m likely going purchase a MacBook Air M3 for web development work. I’m not entirely sure how much RAM I should go with. I’ll mostly be working with Node, Bun, and Laravel. Applications will include: 

- VSCode
- Postman 
- Docker 
- maybe IntelliJ 
- ??? 

Would 16GB be adequate? Or will it be worth the money to upgrade to 24GB? ",alexmacarthur,1h21v3r,https://reddit.com/r/webdev/comments/1h21v3r/macbook_ram_16gb_or_24gb_for_webdev_work/,https://www.reddit.com/r/webdev/comments/1h21v3r/macbook_ram_16gb_or_24gb_for_webdev_work/,2024-11-28 18:03:33,0,0.46,0,0,105,0,0,False,False,True,False,False,Question,self,t3_1h21v3r
webdev,Advice with Building a Bare-Bones DIY Website (Decentralized Hosting?),"Hey folks,

I’m working on a unique, artistic project and want to build a super bare-bones website for it. Like, minimalist to the core. The simplicity is intentional and works for my brand. I’m not looking for anything polished or traditional.

Here’s the deal: I want to DIY this for full creative control, but I’m new to web dev. I’ve heard about decentralized hosting options like WTTP and love the idea of really owning my content. Is this practical for a beginner, or should I stick with something simpler for now?

I was thinking about getting a domain through Cloudflare but open to other ideas. Any advice on:
	•	Getting started with building something super simple like that.
	•	Whether WTTP or other decentralized options make sense here.

Appreciate any input! Just trying to get from point A to point B and keep things as DIY and independent as possible. Thanks in advance!

p.s. I also thought about implementing some ASCII, but as a complete beginner, I have no clue of how complicated that’d actually be…",xtaltheo,1h21k3s,https://reddit.com/r/webdev/comments/1h21k3s/advice_with_building_a_barebones_diy_website/,https://www.reddit.com/r/webdev/comments/1h21k3s/advice_with_building_a_barebones_diy_website/,2024-11-28 17:50:05,2,0.6,2,0,4,0,0,False,False,True,False,False,Question,self,t3_1h21k3s
webdev,Question about GDPR and CCPA and cookie banners,"I'm making an startup that collects analytics and marketing data, [https://storyteller.so](https://storyteller.so)

The whole point of the app is to collect that data in-house, not using 3rd party tools or sending it to different providers.

From my understanding, the fact that the app is collecting information it requires to function, and isn't using 3rd party collection, it should be compliant to both laws without the need for a bunch of ""accept cookie"" banners.

It is also my understanding that sites that prompt those annoying cookie banners aren't really complying with the law.

I also don't understand the consequences of not following those laws if I'm not in  California or Europe, so I'd like to understand this and make sure I am compliant without doing needless feature work.



EDIT::: So I asked chatGPT but I dont knwo if I can trust it's answer, but it seems reasonable.

If your site and app use cookies **only for essential purposes**, such as maintaining user sessions and tracking which A/B testing version a user is seeing, and you gather analytics directly on your own backend without setting additional cookies for these purposes, your GDPR and CCPA obligations may differ:

# GDPR Considerations

1. **Essential Cookies**: Cookies used solely to maintain sessions and ensure functionality (like tracking A/B testing variations) are generally considered ""strictly necessary."" Under GDPR, **strictly necessary cookies do not require user consent**. However, users must still be informed about their use in a cookie policy or privacy policy.
2. **Analytics Without Cookies**: If you gather analytics server-side without setting additional cookies, this avoids the need for consent typically associated with analytics cookies. However, GDPR still requires you to:
   * Be transparent about data collection (e.g., in your privacy policy).
   * Justify the data processing under a lawful basis such as **legitimate interest**.
   * Minimize data collection to what is necessary for your stated purpose.
3. **A/B Testing**: Tracking A/B testing versions via session cookies can qualify as strictly necessary if it is essential for delivering the service users expect (e.g., ensuring they see a consistent version of your site during a visit).

# CCPA Considerations

1. **Session Cookies and Analytics**: Under CCPA, session cookies used for functionality or analytics collected directly by you (not involving third-party tools) are typically not considered a sale of data. However, you must:
   * Disclose that you collect analytics data in your privacy policy.
   * Provide a mechanism for users to opt out of data collection if the data is considered personal information.
2. **A/B Testing**: Similar to GDPR, if the data collected is necessary for providing the service (e.g., ensuring users experience the same A/B testing variant), it is unlikely to trigger additional obligations. Still, you should disclose it transparently.

# Do You Need a Cookie Banner?

* **No Cookie Banner Required**: If the cookies used are strictly necessary, and no analytics or tracking cookies are set, a cookie banner is not required under GDPR.
* **Transparency Required**: Both GDPR and CCPA require you to explain in your privacy policy:
   * The types of data collected (e.g., analytics data, session tracking).
   * The purposes for which the data is processed.
   * Users' rights (e.g., access, deletion, or opting out under CCPA).

# Key Steps to Ensure Compliance

1. **Privacy Policy**: Clearly state:
   * What data is collected (e.g., session cookies, analytics data).
   * Why it is collected and how it is used (e.g., A/B testing, site functionality).
   * User rights (opt-out under CCPA, access, or deletion).
2. **Avoid Non-Essential Cookies**: If you don’t use cookies for analytics or third-party tracking, this simplifies compliance significantly.
3. **Lawful Basis**: For GDPR, rely on a lawful basis like legitimate interest for server-side analytics and strictly necessary cookies.

By sticking to these practices, you avoid the need for a cookie banner while still meeting the transparency and accountability obligations under GDPR and CCPA.",IAmRules,1h21jfl,https://reddit.com/r/webdev/comments/1h21jfl/question_about_gdpr_and_ccpa_and_cookie_banners/,https://www.reddit.com/r/webdev/comments/1h21jfl/question_about_gdpr_and_ccpa_and_cookie_banners/,2024-11-28 17:49:14,1,0.54,1,0,57,0,0,False,False,True,False,False,,self,t3_1h21jfl
webdev,"Which one to use: Copilot, Tabnine, Codeium, CodeWhisper, OpenAI GPT plugin, IntelliCode. ","Hello, I'm a Software Engineer, and work with software a lot. I wanted to kindly ask for a recommendation on a NLP tool integrated to the IDE (I use VSCode) that can track all codebase to do/ask things like:

* Where is the logic that does X thing in this code?
* Based on the style of this code, how would you do X thing?
* Summarize the architecture of this module.

I know similar things can be achieved with Copilot, but wanted to know your personal experiences. Thanks!!",Low_Mathematician266,1h20eq5,https://reddit.com/r/webdev/comments/1h20eq5/which_one_to_use_copilot_tabnine_codeium/,https://www.reddit.com/r/webdev/comments/1h20eq5/which_one_to_use_copilot_tabnine_codeium/,2024-11-28 16:59:51,0,0.33,0,0,12,0,0,False,False,True,False,False,,self,t3_1h20eq5
webdev,Regex Validation Phone Number &amp; Ngx-translate,"What is best pratice for validating phone number? I had regex that accept varius of formats but that didin't work out. Now user can input whatever he want and when we send to the backend, we send clena number. What is your practice? 

Why Ngx-translate have problem using variables? When i switch from language to language using variables for translation, error occurs - i see key {} - to translated. Do someone have problem wirh this? ",ScallionNo2755,1h203fq,https://reddit.com/r/webdev/comments/1h203fq/regex_validation_phone_number_ngxtranslate/,https://www.reddit.com/r/webdev/comments/1h203fq/regex_validation_phone_number_ngxtranslate/,2024-11-28 16:45:35,2,0.67,2,0,3,0,0,False,False,True,False,False,,self,t3_1h203fq
webdev,"Tool that removes all empty attributes in HTML/XML, without regex?","Wyswig tools often add a lot of empty attributes like `style=""""`. In an XHTML document, is there any tool that removes all such empty attributes?

I asked AI's, and they told me to use regex (which can be problematic) or gave me fake extensions/plugins that do not exist.",evolution2015,1h1wu6c,https://reddit.com/r/webdev/comments/1h1wu6c/tool_that_removes_all_empty_attributes_in_htmlxml/,https://www.reddit.com/r/webdev/comments/1h1wu6c/tool_that_removes_all_empty_attributes_in_htmlxml/,2024-11-28 14:14:12,4,0.64,4,0,37,0,0,False,False,True,False,False,Discussion,self,t3_1h1wu6c
webdev,Would you recommend a good 27” 2k VA monitor for programming and occasional gaming?,"Hello I'm looking to buy a new monitor to replace my current one, which is a BenQ XL2411P that I bought mainly for gaming. Nowadays I do very little gaming, but it can happen a few times a month, and using this monitor is horrible because of the washed-out colors, poor contrast, pixelated text, etc. I'm looking for a new monitor to replace my current one. I want to move up to a 27-inch screen because I sometimes find it too small for programming on my current monitor, but I don't want a 32-inch screen because it's too big for me and I don't have much space on my desk. I'd also like to go for a VA screen to reduce eyestrain, as I spend around 12 hours a day in front of my screen.

I want to be able to use this new monitor for programming\*,\* watching videos, reading text on websites and occasional gaming.

What do you think of these monitors?

**AOC G27G3XMN**

**Dell S2722DGM 27”**

**Acer Nitro ED270U S3 27”**",Valwex63,1h1wk5f,https://reddit.com/r/webdev/comments/1h1wk5f/would_you_recommend_a_good_27_2k_va_monitor_for/,https://www.reddit.com/r/webdev/comments/1h1wk5f/would_you_recommend_a_good_27_2k_va_monitor_for/,2024-11-28 14:00:24,0,0.3,0,0,10,0,0,False,False,True,False,False,,self,t3_1h1wk5f
webdev,Black Friday Deals for a Web Dev,"Are there any great deals out there that you’re looking to scoop up for Black Friday? 

Courses, Equipment, Software? Let’s combine the deals in this thread! ",WholesaleBacon,1h1vyrn,https://reddit.com/r/webdev/comments/1h1vyrn/black_friday_deals_for_a_web_dev/,https://www.reddit.com/r/webdev/comments/1h1vyrn/black_friday_deals_for_a_web_dev/,2024-11-28 13:29:32,91,0.9,91,0,75,0,0,False,False,True,False,False,,self,t3_1h1vyrn
webdev,Why would somebody need a website when they can sell directly in social platforms?,"I'm kinda having hard time figuring it out exactly why somebody would need a website nowadays? Usually the website provides - 

- Brand image
- Product and business information
- Buying option

Nowadays, you can create videos about all of the information and can sell your stuff in social platforms. In my country, a huge number of businesses are operating through facebook ads and selling their products in DM's. 

They don't need a website for marketing, ads and videos does that it tiktok/fb/youtube. They don't need a site to sell, customers could talk to them via chat and order directly.

So your marketing effort does everything about building your brand image and awareness. You don't need a site to present your business informations. And you can sell through chat.

So it's making website unnecessary.

One risk factor we developers are selling is, social platforms could anytime ban you. But I don't think it would be financially logical for them to invest on a site.

What are other logical reasons we could bring here that would be financially logical?",Fardin_Shahriar,1h1vv6l,https://reddit.com/r/webdev/comments/1h1vv6l/why_would_somebody_need_a_website_when_they_can/,https://www.reddit.com/r/webdev/comments/1h1vv6l/why_would_somebody_need_a_website_when_they_can/,2024-11-28 13:23:49,0,0.29,0,0,19,0,0,False,False,True,False,False,Discussion,self,t3_1h1vv6l
webdev,Address Validation (Radar.com),"Anybody here used radar.com for address validation/autocomplete? I'm not understanding the terms of service - theres is similar to Google (one of their named competitors). It says you can't pre-fetch, cache or store autocomplete addresses beyond 30 days. Does that apply to validated addresses as well?

How would a company, after a transaction (assuming that is the point of the 30 days), handle providing receipts to the end user beyond 30 days? I would assume an end user would still want to be able to verify what address a product was sent to beyond that time frame and a company probably would want to store that address longer to deal with incorrect sending/re-sending reppacements/etc. so how do they accomplish this?

Or are the storage terms there to prevent people from requesting all addresses in the platform and storing a copy of them all indefinitely (alleviating the need to use the platform) - more of a gotcha if needed?

I want to use this platform, it's the cheapest/least resteictive by far compared to Smarty, Loquate, Google (attribution), geoapify, USPS (mailing requirement) etc. but my address validation needs require storing the addresses a bit longer than 30 days (not indefinitely).",Unhappy_Trout,1h1vkzq,https://reddit.com/r/webdev/comments/1h1vkzq/address_validation_radarcom/,https://www.reddit.com/r/webdev/comments/1h1vkzq/address_validation_radarcom/,2024-11-28 13:08:11,1,1.0,1,0,3,0,0,False,False,True,False,False,,self,t3_1h1vkzq
webdev,[PHP/Laravel] Is Livewire polling a decent alternative to WebSocket/Laravel-Echo?,"I'm building a web app using Filament exclusively which uses Livewire. I have a simply Kanban board in my app that requires server polling to keep data up-to-date.

My initial thought was to use websocket with laravel-echo but then I realized it's an overkill for such a simple Kanban board and use-case of my app; the app will be used by small teams (10-15 users) internally only. So I implemented [Livewire polling](https://livewire.laravel.com/docs/wire-poll) and it was really easy and it worked, I've set it to 15s interval but I'm just worried about consuming too much server resources.

This is my setup:

    &lt;x-filament-panels::page wire:poll.visible.15s=""refreshTasks""&gt;",OkPoet9382,1h1vizx,https://reddit.com/r/webdev/comments/1h1vizx/phplaravel_is_livewire_polling_a_decent/,https://www.reddit.com/r/webdev/comments/1h1vizx/phplaravel_is_livewire_polling_a_decent/,2024-11-28 13:05:14,1,1.0,1,0,2,0,0,False,False,True,False,False,Question,self,t3_1h1vizx
webdev,Experienced devs: how do you manage different tools on the websites and the process of managing different accounts on different websites? How do share the information with the client? Including more information with examples below,"I have a question about account management for web developers.

I'm building a website for a friend and I need to implement Ahrefs for weekly site scan, Silktide for accessibility scan, Cookiebot for cookie management, and various Google accounts (Google Analytics,  Search Console, Tag Manager and reCAPTCHA) for general tracking and tackling bots.

I've created the Google accounts with my personal email but added my friend as an admin user to all those accounts. I created the Ahrefs account with a new dedicated email address like ahrefs@domain.com and the Silktide account with another dedicated email like silktide@domain.com. Cookiebot in a similar fashion.

Is this approach good? Is there any other way to do this?

Another question is that how do you track things like accounts passwords? I have created a Google Spreadsheet with all the account emails and passwords and private APIs (like reCAPTCHA) and shared it only with my friend. Is there a better way than this?

Thanks",ashkanahmadi,1h1v85l,https://reddit.com/r/webdev/comments/1h1v85l/experienced_devs_how_do_you_manage_different/,https://www.reddit.com/r/webdev/comments/1h1v85l/experienced_devs_how_do_you_manage_different/,2024-11-28 12:48:32,2,1.0,2,0,2,0,0,False,False,True,False,False,Discussion,self,t3_1h1v85l
webdev,What are things that really frustate or annoy you concerning web dev and the process ob developing services ?,"Cheers Everyone, i was wondering if there are things in your personal web dev everyday life that really annoy or frustate you ? Maybe something thats highly repetitive ? Would love to hear some of your complains :)",Floloppi,1h1v6t3,https://reddit.com/r/webdev/comments/1h1v6t3/what_are_things_that_really_frustate_or_annoy_you/,https://www.reddit.com/r/webdev/comments/1h1v6t3/what_are_things_that_really_frustate_or_annoy_you/,2024-11-28 12:46:22,11,0.93,11,0,19,0,0,False,False,True,False,False,Question,self,t3_1h1v6t3
webdev,Ideas and Suggestions for my Portfolio,"https://preview.redd.it/476c22u71n3e1.png?width=1567&amp;format=png&amp;auto=webp&amp;s=41128b6fcac1e687c53b6156d263165fed75984f

https://preview.redd.it/ir9aytf81n3e1.png?width=1567&amp;format=png&amp;auto=webp&amp;s=1d1880cd6ae5bd25dcd11e64796003470944db54

https://preview.redd.it/31rp7li91n3e1.png?width=1567&amp;format=png&amp;auto=webp&amp;s=159c59ad2790c68bdf794322af5a88e27fd8dba2

https://preview.redd.it/jfbl1gza1n3e1.png?width=1567&amp;format=png&amp;auto=webp&amp;s=4810c3834175a2164fd36241dc6f70491305360a

https://preview.redd.it/k5jjzgcc1n3e1.png?width=1567&amp;format=png&amp;auto=webp&amp;s=001cad0ef4bf5c9d3497d00aae1d382981976c46

What are the things that I should add in it. Also how can I optimize this ?  
Thank you for helping

",Baajjii,1h1v4lo,https://reddit.com/r/webdev/comments/1h1v4lo/ideas_and_suggestions_for_my_portfolio/,https://www.reddit.com/r/webdev/comments/1h1v4lo/ideas_and_suggestions_for_my_portfolio/,2024-11-28 12:42:51,2,1.0,2,0,1,0,0,False,False,True,False,False,Discussion,https://b.thumbs.redditmedia.com/2bG1jeB6sIjX76d3ChOtrszaofl99w5-gbX_XeVguSs.jpg,t3_1h1v4lo
webdev,[HELP] Registrant email issue,"Hello everyone, many years ago(2014) I developed a website for a law firm and I've used my email as ""registrant email"". 

I'm asking several times to the owners to change that to their own email, but they don't do that - they say ""we'll have a look"" but then nothing happens.

I've contacted the hosting provider but they say I need to resolve it with the law firm.

1) It's there a way to force this change? 
2) What do I possibly risk by having my email in that field?

Thanks!",caos2kcaos2k,1h1uv1j,https://reddit.com/r/webdev/comments/1h1uv1j/help_registrant_email_issue/,https://www.reddit.com/r/webdev/comments/1h1uv1j/help_registrant_email_issue/,2024-11-28 12:26:49,1,1.0,1,0,6,0,0,False,False,True,False,False,Question,self,t3_1h1uv1j
webdev,Should I use .com or my local tld for my portfolio?,"I got a good deal for a local tld domain (1euro/2years) and I was thinking of claiming a domain for a future portfolio.

Is .com better for the global market? I was thinking that maybe the local one will add a bit to my identity and to where I come from.

What are your thoughts?",NickN21,1h1ujt9,https://reddit.com/r/webdev/comments/1h1ujt9/should_i_use_com_or_my_local_tld_for_my_portfolio/,https://www.reddit.com/r/webdev/comments/1h1ujt9/should_i_use_com_or_my_local_tld_for_my_portfolio/,2024-11-28 12:07:32,7,0.67,7,0,14,0,0,False,False,True,False,False,Question,self,t3_1h1ujt9
webdev,React UI component for merging two objects?,"Think like in salesforce where you might want to merge two contacts and you get to choose which fields overwrite each other.

Is there anything prebuilt for this? Feels like a common case.

Otherwise, I’m planning to build something from scratch with react-data-grid but I’d really rather not reinvent the wheel.

I found https://github.com/UgnisSoftware/react-spreadsheet-import?tab=readme-ov-file for another case, which is an awesome library. Was hoping to find something similar for merging profiles/accounts/objects.


",poopbrainmane,1h1soqn,https://reddit.com/r/webdev/comments/1h1soqn/react_ui_component_for_merging_two_objects/,https://www.reddit.com/r/webdev/comments/1h1soqn/react_ui_component_for_merging_two_objects/,2024-11-28 09:59:04,1,0.67,1,0,0,0,0,False,False,True,False,False,,self,t3_1h1soqn
webdev,How hard would this website be to make?,"Hello! I really hope this is the right place to post this! I’m seeking some advice on a website/app/program I want to make, mostly for personal use. 

I simply am wondering how difficult this program would be to make and how to go about making it. I’m not at all sure where to start! 

For context, I have little experience with programming (but want to learn!) but I am very experienced with HTML, CSS and rapid prototype designing. I am a graphic design student and I have worked with Figma and Adobe XD.

This is my main website and the kind of experience I have in web development. https://ufochasing.neocities.org/

I am an amateur but excited to learn more about web development. 
Thanks so much for your help and for reading! I really appreciate any advice and comments!

Attached is the details of the site I want to make.",ufochasing,1h1s00s,https://reddit.com/r/webdev/comments/1h1s00s/how_hard_would_this_website_be_to_make/,https://www.reddit.com/gallery/1h1s00s,2024-11-28 09:06:51,0,0.35,0,0,30,0,0,False,False,False,False,False,Question,https://b.thumbs.redditmedia.com/P5IPnsO5MZQy3kzQljK1wE9fuOSecRkJKqN31jdHBYE.jpg,t3_1h1s00s
webdev,"What are the best programs or frameworks for building applications with number crunching, and what are any options for plug-ins to help with data visualization?","Hello, I'm new to app development, and I don't know some of the commonly used tools in it yet. However, I have to work on a school project that requires me to build an app that can handle large calculations and accurately visualize the data in a downloadable 2D or 3D format, depending on user input (it's an end-of-high school project). There also needs to be sliders or text input options to accept variable values given by the user to use in the calculations or visualization (i.e., color, width, length).

Any answers you may have would be a great help, so thank you in advance!",Neat-Discussion-2049,1h1rfbn,https://reddit.com/r/webdev/comments/1h1rfbn/what_are_the_best_programs_or_frameworks_for/,https://www.reddit.com/r/webdev/comments/1h1rfbn/what_are_the_best_programs_or_frameworks_for/,2024-11-28 08:23:18,1,0.6,1,0,3,0,0,False,False,True,False,False,Question,self,t3_1h1rfbn
webdev,Is this a good way of sorting domains for clients?,"1 Buy it on cloudflare
2 Pay for it and invoice the client
3 Whose details should I put for the registrant?
4 Getting DNS records from Netlify (my host), updating those records in cloudflare and then verifying that in Netlify
5 Is everything set up now? Anything I should watch out for?",Joyride0,1h1q8k0,https://reddit.com/r/webdev/comments/1h1q8k0/is_this_a_good_way_of_sorting_domains_for_clients/,https://www.reddit.com/r/webdev/comments/1h1q8k0/is_this_a_good_way_of_sorting_domains_for_clients/,2024-11-28 07:00:14,2,0.75,2,0,22,0,0,False,False,True,False,False,,self,t3_1h1q8k0
