subreddit,title,selftext,author,id,permalink,url,created_utc,score,upvote_ratio,ups,downs,num_comments,total_awards_received,gilded,is_video,is_original_content,is_self,over_18,spoiler,link_flair_text,thumbnail,name
webdev,Is This Login/Signup System Secure and Efficient? Looking for Feedback,"Hi, I’ve built a login/signup system for my website and would love your feedback. Here's a breakdown:

**1. Sign-Up Flow**

* User fills out name, email, password (validated for strength) and completes hCaptcha.
* Frontend sends a POST request to /api/auth/register with user data and hCaptcha token.
* Server validates data, verifies hCaptcha, and creates a ""pending user"" with:
   * Hashed password, 6-digit OTP (valid 5 mins), and expiration (30 mins).
* OTP is emailed to the user for verification.
* On valid OTP, a user account is created, and the pending entry is removed.

**2. Sign-In Flow**

* User enters email/password.
* Server verifies credentials and creates a session via NextAuth.
* On success, user is redirected to the dashboard.

**3. Additional Security**

* Passwords hashed with bcrypt.
* Failed logins tracked for account lockout.
* Background task clears expired pending users every 5 minutes.
* Password resets use the same OTP process as registration.

**4. Session Management**

* Handled by NextAuth with token storage in cookies.

**Questions:**

* Is this secure enough?
* Any improvements to the email verification or overall flow?
* Other tips for a better user experience or security?

Thanks for your input! ",DisastrousJuice1658,1h5bffm,https://reddit.com/r/webdev/comments/1h5bffm/is_this_loginsignup_system_secure_and_efficient/,https://www.reddit.com/r/webdev/comments/1h5bffm/is_this_loginsignup_system_secure_and_efficient/,2024-12-03 01:12:38,7,0.9,7,0,12,0,0,False,False,True,False,False,Question,self,t3_1h5bffm
webdev,Rate my first fullstack app,"Hello if you could please have a look at this project and give me any advice. Thanks

https://github.com/ledbajrami/login-register

",shangarepi,1h5avuv,https://reddit.com/r/webdev/comments/1h5avuv/rate_my_first_fullstack_app/,https://www.reddit.com/r/webdev/comments/1h5avuv/rate_my_first_fullstack_app/,2024-12-03 00:47:07,0,0.22,0,0,2,0,0,False,False,True,False,False,,self,t3_1h5avuv
webdev,News Article Content without JavaScript,"Curiosity question. I noticed this with Bloomberg but I've seen it with several others: the article content is unloaded if JavaScript is disabled, and not to be found in the HTML or DOM.

A lot of news websites (paywalled or otherwise) still load the article content, sometimes hidden, in the HTML with JavaScript disabled. I've noticed lots don't. 

Is this because Google has gotten better at loading the articles when it crawls so gating it behind a paywall doesn't matter anymore for SEO? Maybe there is some access token or element the crawler uses or they give search engines the article content from somewhere else (or don't care that much about losing out on search results if it gets them paid subs)?",KDLGates,1h5as5e,https://reddit.com/r/webdev/comments/1h5as5e/news_article_content_without_javascript/,https://www.reddit.com/r/webdev/comments/1h5as5e/news_article_content_without_javascript/,2024-12-03 00:42:16,2,0.67,2,0,4,0,0,False,False,True,False,False,,self,t3_1h5as5e
webdev,HONO Fullstack Series: Build real world Apps Overview,"Hey everyone! 👋

I’m super excited to share that I’m starting a **YouTube series** where I’ll be building real-world apps using **HONO** (a new and powerful web framework). The goal is to teach full-stack development by walking through backend APIs and frontend integrations – all using HONO as the core tool.

I’ve just released the first video, where I introduce the series and explain what we’ll be building together. I’d love to get your thoughts and feedback, especially if you’re interested in learning about HONO or full-stack development in general. As I progress, I’ll be posting more videos, so feel free to subscribe and follow along!

Here’s the link to the first video: [**HONO Fullstack Series: Build Real-World Apps Overview**](https://youtube.com/watch?v=wZpvqIvgwQw&amp;si=IaGrXfIB56OUdHpe) 🎥

If you have any suggestions, questions, or just want to chat about HONO or full-stack development, I’m all ears! 😄

Looking forward to hearing from you all!",RevolutionaryAd1557,1h5a651,https://reddit.com/r/webdev/comments/1h5a651/hono_fullstack_series_build_real_world_apps/,https://www.reddit.com/r/webdev/comments/1h5a651/hono_fullstack_series_build_real_world_apps/,2024-12-03 00:13:39,1,0.6,1,0,0,0,0,False,False,True,False,False,,self,t3_1h5a651
webdev,Anyone else consistently buy dope domains with big pipedreams then never do anything?,"Sometimes I doomscroll Namecheap like a maniac, putting in random words until I find something that seems too good to be available-- usually under $40 or else it's obviously not worth it.

I'll hang on to the domain for a year, do nothing; then I get an email to renew at twice the cost and usually bail. All this too soon before I'm able to actually come up with a good idea for something to put there.

The one's that come to mind are:
- hard.pizza
- atomic.gold (this one kills me because I originally got it for &lt;$30/yr on Namecheap and it's now it's  literally $25,000 on GoDaddy)

Currently, I have ""atomic.church"" and I need to renew or let it go. I can't stop. Ugh. I thought I could use it for sci-fi short stories or some kind of nerdy shop, but I definitely don't have enough prep for that...

Maybe if Reddit helps me come up with a good enough idea I'll keep it. 

EDIT: I did not expect or intend to make money off the domains, just wanted something cool for cheap that could spark a potential brand or project idea.",l00sed,1h58nj4,https://reddit.com/r/webdev/comments/1h58nj4/anyone_else_consistently_buy_dope_domains_with/,https://www.reddit.com/r/webdev/comments/1h58nj4/anyone_else_consistently_buy_dope_domains_with/,2024-12-02 23:05:52,37,0.91,37,0,51,0,0,False,False,True,False,False,Discussion,self,t3_1h58nj4
webdev,Do you code your own SVG icons?,It is surprisingly easy. You should give it a try!,jbrms,1h56zc3,https://reddit.com/r/webdev/comments/1h56zc3/do_you_code_your_own_svg_icons/,https://brems.dev/blog/why-not-make-your-own-svg-icons,2024-12-02 21:54:57,140,0.87,140,0,76,0,0,False,False,False,False,False,,https://b.thumbs.redditmedia.com/-EIKx3jE6MqbN7rTdFFcHzsgLZKK6pAAjeJKeMudvGY.jpg,t3_1h56zc3
webdev,Web-browser games/gaming website,"Hello - I work in special education, and I see kids via telehealth on Zoom.  There are a couple of different websites I use for virtual activities, but I have my own idea for a very unique platform that I would like to develop over the next couple of years.  The site would be primarily simple games with and graphics drawn cutely, but poorly by me in Procreate.

I have practically no experience in this arena so forgive if I ask a stupid question(s).

I've learned so far I can make a lot with HTML and CSS, and I've played around with Scratch. I think I will be able to figure out the game-making.  However, a feature of this website would be for the user to be able to draw a card/picture/.gif in between turns of a game, or there to be a stop point before you can continue with a game.  My goal is to have potentially hundreds of decks/libraries available for a user to select as their question set prior to playing the game (for example - a deck with R sounds, a deck with action .gifs for expressive language tasks, a short video clip, etc)

Would I be able to have a library within HTML/CSS, or should I look at using a different language?  Eventually, if it goes well, I would also want the option for people to create accounts and subscribe to the website, so I would need to be able to store that information too.  This is a years from now goal, but if I can get learning now it will only help me later.

Thanks for any input.  I'm aware of many free coding classes online, but if there is a web developing simple video games specific one, please link me!",shylittlepot,1h55ll3,https://reddit.com/r/webdev/comments/1h55ll3/webbrowser_gamesgaming_website/,https://www.reddit.com/r/webdev/comments/1h55ll3/webbrowser_gamesgaming_website/,2024-12-02 20:58:48,2,1.0,2,0,9,0,0,False,False,True,False,False,Question,self,t3_1h55ll3
webdev,Is it overkill to learn this tech stack for an MVP?,"I'm new to web dev, with a couple simple projects under my belt, but my next project is aiming to be more ambitious creating a social media / blogging platform.

I've done some research and the tech stack that seems to make most sense is:

Backend: Node.js (Express), Supabase (as includes auth)  
Frontend: React (+ React Query), Tailwind CSS  
Hosting: Railway (Backend), Vercel (Frontend), S3 (Images)

However I have no experience with React, Tailwind, Vercel or Supabase (just vanilla CSS + JS, HTML/EJS, PostrgreSQL, hosting on Railway)

So really I want some help understanding:

1. Over the next 3 months, am I likely to have saved more time by learning React + Tailwind + Supabase or is it better to stick with my vanilla stack if I'm aiming to maximise progress in 3 months?
2. If I were to create my MVP using my current ""vanilla"" stack and hire a software dev in 3 months, would there likely be lots of technical debt to overcome or would converting to the new stack be relatively easy?

React seems to be the really big one to learn, so I'm also considering just learning tailwind + supabase, and leaving React for later.

(Sorry, I know this question has probably been asked 1000 different times 1000 different ways but feeling a bit stuck)",lucaducca,1h54k3a,https://reddit.com/r/webdev/comments/1h54k3a/is_it_overkill_to_learn_this_tech_stack_for_an_mvp/,https://www.reddit.com/r/webdev/comments/1h54k3a/is_it_overkill_to_learn_this_tech_stack_for_an_mvp/,2024-12-02 20:16:12,12,0.7,12,0,44,0,0,False,False,True,False,False,Question,self,t3_1h54k3a
webdev,Does it really matter if you use * (asterisk) selector for resets?,"I've been studying the basics for a few months and my teacher stresses that using \* ever is very bad for load times and has instead taught me to make a snippet for a meyer's import to use as an alternative, though its annoying that it also resets some things that i want to keep default more often than not, such as the &lt;code&gt; styling. 

meanwhile i see websites, like [twitch.tv](http://twitch.tv) which do use the global selector for margin, padding, and boxsizing properties. 

and while im making a post i might as well ask, why isnt borderbox the default? it's extremely rare that i ever want contentbox set on my elements, and seeing that other websites also use a universal selector for changing this, why hasnt it become a default browser styling?",Smexy_Zarow,1h53zw9,https://reddit.com/r/webdev/comments/1h53zw9/does_it_really_matter_if_you_use_asterisk/,https://www.reddit.com/r/webdev/comments/1h53zw9/does_it_really_matter_if_you_use_asterisk/,2024-12-02 19:53:26,1,0.55,1,0,18,0,0,False,False,True,False,False,Question,self,t3_1h53zw9
webdev,Next-level frosted glass with backdrop-filter,,feross,1h53uk6,https://reddit.com/r/webdev/comments/1h53uk6/nextlevel_frosted_glass_with_backdropfilter/,https://www.joshwcomeau.com/css/backdrop-filter/,2024-12-02 19:47:15,76,0.94,76,0,6,0,0,False,False,False,False,False,,https://b.thumbs.redditmedia.com/nP2uUJEYahqxP7FXCNO8jj091FAuFuUTENdyglMuJJA.jpg,t3_1h53uk6
webdev,Laravel VueJS GitHub repo run help,"Hello. I am new to laravel/vueJs stuff. And trying to run GitHub repo on my pc. But it has some versions issues. Could you help me to run it? How should I change composer.json? Or I need to lower my php version? Or how to update versions of the project to the newest one? 

GitHub repo: https://github.com/lenard123/E-commerce-website-using-Laravel-and-VueJS/tree/master?tab=readme-ov-file",qassym,1h53mht,https://reddit.com/r/webdev/comments/1h53mht/laravel_vuejs_github_repo_run_help/,https://www.reddit.com/r/webdev/comments/1h53mht/laravel_vuejs_github_repo_run_help/,2024-12-02 19:38:07,0,0.5,0,0,0,0,0,False,False,True,False,False,Question,self,t3_1h53mht
webdev,"what tools are you using, commonly and uncommonly working for yourself?","* What software / tools are you using to build sites &amp; or applications? 
* what CMS's are you using for what purpose?
* what framework do you commonly use for what purpose?
* talk to me like i've never heard of any of it.

so looking to make a side gig and i want to put together my tool belt before heading to work. i know a decent bit of code and it dosnet take long usually to learn new things anymore, but regressing people often dont pick they fanciest most complicated tool for the job, they pick the easiest \*for most applications\*. I was wondering what real professionals are using, are you using stuff like wix / wordpress for basic static sites with a few whistles or are you throwing together a quick bit of js or react. what about when you get the once in a while application that has no other purpose than to create timers or something unusual. i'm not looking for the answer to every problem here, but a rough ballpark tool selection to get a concrete selection before adding some of my own personality to it if you know what i mean.",Active_Access_4850,1h53iu2,https://reddit.com/r/webdev/comments/1h53iu2/what_tools_are_you_using_commonly_and_uncommonly/,https://www.reddit.com/r/webdev/comments/1h53iu2/what_tools_are_you_using_commonly_and_uncommonly/,2024-12-02 19:33:58,10,0.81,10,0,25,0,0,False,False,True,False,False,,self,t3_1h53iu2
webdev,Recommended Architecture for Small Business Site,"I’ve been tasked with making a site with a reservation system for my family’s business. All the costumers are within the state and reservations will only occur 2 months of the year. 

Although a serverless architecture could be less expensive (probably free) I’m thinking of just getting a cheap vps instead. Idk tho. I was initially thinking about using next.js but the site needs very little reactivity. It’s basically just a form so using a frontend framework seems excessive. I could probably get away with using web components. 

I need a form with up-to-date info for making reservations and a basic CRUD admin dashboard (and therefore auth)

What are your thoughts on what technology and frameworks i should use? With so many products nowadays it seems impossible to decide. 

My current thoughts are:
Express + EJS + Web Components (when reactivity is needed) on a VPS and possibly SQLite on the VPS

Or

Next.js + Supabase + Edge function stuff I don’t really understand or Cloudflare worker/pages or whatever",Over-Distribution570,1h538ps,https://reddit.com/r/webdev/comments/1h538ps/recommended_architecture_for_small_business_site/,https://www.reddit.com/r/webdev/comments/1h538ps/recommended_architecture_for_small_business_site/,2024-12-02 19:22:36,1,0.67,1,0,3,0,0,False,False,True,False,False,Question,self,t3_1h538ps
webdev,"I can not gain traction, short shory","Hi, 

I just wanted to share my not-short but not-long journey. I have been doing freelancing on the side as a full-time developer for some time. I noticed that the competition is too high to get jobs on Upwork and make money. So, I slowly transitioned to indie hacker, solopreneur, entrepreneur, CEO, founder, or whatever you would like to call it because I wanted to scale. With the speed of AI, it is very easy to do small projects; with Vercel, it is very easy to deploy them. But that is it.

Building does not mean anything. If I were to build a website/app that does quantum calculations. It will remain as a hidden gem. It will be useless. Marketing is hard. It is much harder than software development. If I don’t stay active on social media and don’t comment on everything literally, everything. All the graphs goes to zero immediately. 

Like, I am not saying I built the quantum computer. That’s also the other thing. I am making these stupid projects. So that at some point  I would get the inspiration for the big thing, but that is also not happening. I don’t want to quit yet. But this is not just about just shipping it. It consumes more than a full-time job. It needs dedication, unfortunately, and most importantly, it needs luck. 

A thread of luck, an algorithm picking it up, and you are done for. You don’t need to try anymore, and I am very sorry about it. Because luck never strikes me. ",goldenking55,1h52yse,https://reddit.com/r/webdev/comments/1h52yse/i_can_not_gain_traction_short_shory/,https://www.reddit.com/r/webdev/comments/1h52yse/i_can_not_gain_traction_short_shory/,2024-12-02 19:11:36,1,0.54,1,0,12,0,0,False,False,True,False,False,,self,t3_1h52yse
webdev,Where to learn Front End System Design?,"Is there a good place to learn System Design (or the equivalent) to how Front Ends works and why they are built certain ways? I understand JS, React, C#, .NET, etc.. I've worked professionally for 4 years now, but don't have a solid background. No schooling. So I'm trying to learn how everything works together. Specifically Front End, but I guess System Design in general would be beneficial. Anyone know a good website, YouTube channel, or even a book worth using/buying? ",mister_peachmango,1h52x9e,https://reddit.com/r/webdev/comments/1h52x9e/where_to_learn_front_end_system_design/,https://www.reddit.com/r/webdev/comments/1h52x9e/where_to_learn_front_end_system_design/,2024-12-02 19:09:51,3,1.0,3,0,2,0,0,False,False,True,False,False,Question,self,t3_1h52x9e
webdev,I've created a sports competitions draw simulator,"Hey guys!

I'd like to introduce you to **DICEDRAW**, a web project that I've been developing with great pleasure recently. It's a website dedicated to **simulating draws for sports competitions**, currently focused on soccer. It already has draws for the Champions League, Europa League and, more recently, the new Club World Cup. The latter deserves a special mention because we're only a few days away from the official draw, and we can see how things might end up lining up.

The idea is that each draw respects the specific rules of each competition. In other words, nothing will be seen that goes against the rules of the entities. I've also included the new league stages of UEFA competitions, such as the Champions League, which has replaced the group stage.

If you have any suggestions or even ideas for other competitions you'd like to see there, let me know! I'm also accepting contributions to the project's repository, in case you want to get your hands on the code. And if you find it useful, leave a star there, it always gives you a boost of motivation.

I intend to continue evolving the project, and it would be great to have your feedback to make it even better!

I invite you to try it out below:

**Project link:** [https://dicedraw.vercel.app](https://dicedraw.vercel.app)

**Repository link:** [https://github.com/MarioPonte/DICEDRAW](https://github.com/MarioPonte/DICEDRAW)

I look forward to your feedback. All the best!",ZecaDiabo60,1h52x7t,https://reddit.com/r/webdev/comments/1h52x7t/ive_created_a_sports_competitions_draw_simulator/,https://www.reddit.com/r/webdev/comments/1h52x7t/ive_created_a_sports_competitions_draw_simulator/,2024-12-02 19:09:48,1,1.0,1,0,0,0,0,False,False,True,False,False,,self,t3_1h52x7t
webdev,Is it possible to see changes made to a website page?,"I need to see what this page looked like on Nov. 25, 2024, 9:00 am EST: https://www.warrentonva.gov/230/Leaf-Collection

I believe the disclaimer (""NOTE"") was added since last week but I need proof.",KleinsterGal,1h52mdy,https://reddit.com/r/webdev/comments/1h52mdy/is_it_possible_to_see_changes_made_to_a_website/,https://www.reddit.com/r/webdev/comments/1h52mdy/is_it_possible_to_see_changes_made_to_a_website/,2024-12-02 18:57:44,0,0.4,0,0,4,0,0,False,False,True,False,False,,self,t3_1h52mdy
webdev,Are remix loaders and actions secure enough?,"Hey, I'm creating an app that fetches data from an API that requires the API key (what a shock). I was wondering, since loaders in remix run on the backend, if using env processes and remix loaders is enough to keep the API key secure. Or at least relatively secure, it's not a massive project, it's more of a project for my portfolio, but I still want to make sure I don't just put my API key out there.",LeeSSm4N,1h52jkh,https://reddit.com/r/webdev/comments/1h52jkh/are_remix_loaders_and_actions_secure_enough/,https://www.reddit.com/r/webdev/comments/1h52jkh/are_remix_loaders_and_actions_secure_enough/,2024-12-02 18:54:27,1,1.0,1,0,5,0,0,False,False,True,False,False,,self,t3_1h52jkh
webdev,You Might As Well Use a Content Security Policy,,alexmacarthur,1h51xrv,https://reddit.com/r/webdev/comments/1h51xrv/you_might_as_well_use_a_content_security_policy/,https://macarthur.me/posts/csp,2024-12-02 18:29:50,5,0.73,5,0,0,0,0,False,False,False,False,False,Article,https://b.thumbs.redditmedia.com/fNj-Z5EARycfadrVhiNzCVePgsw9Mru0ZCQ3JNwitfY.jpg,t3_1h51xrv
webdev,How can I deploy my web app (django+react)? ,"For the past few months, I’ve been working on a web app—a Reddit clone—using Django for the backend and React for the frontend. The app focuses on stock market tickers, allowing users to post and discuss specific securities, similar to how Reddit functions.

This is my first time building something like this, and I don’t have a background in computer science. Now, I’m ready to take the next step and deploy my app, but I have no idea where to start.

I’ve heard about AWS, Azure, and other hosting platforms, but I’m not sure which one would be best for a beginner like me. I’d really appreciate any guidance, resources, or tutorials (e.g., YouTube videos, step-by-step guides) that can help me with deployment.

Thanks in advance for your help!

https://preview.redd.it/79mm15wu4h4e1.png?width=3014&amp;format=png&amp;auto=webp&amp;s=e676281a8c0e8b23515a573c5bb25c1b9bed50cc

https://preview.redd.it/mjqay3wu4h4e1.png?width=3018&amp;format=png&amp;auto=webp&amp;s=df0a450bd57ecfe705b28d6ec4f78ccd3aaf7a7a

https://preview.redd.it/wx849twu4h4e1.png?width=3014&amp;format=png&amp;auto=webp&amp;s=d308b2f51c97e8d1755c6bd8ac4252b983274d39

https://preview.redd.it/630pa4wu4h4e1.png?width=3022&amp;format=png&amp;auto=webp&amp;s=6725a184cba40323e957a0c06ff5f45c55fd9273

https://preview.redd.it/ybuvi4wu4h4e1.png?width=3016&amp;format=png&amp;auto=webp&amp;s=3533b390dc533d67bd19599896c39bb47e5f184d

",pussydestroyerSPY,1h513bc,https://reddit.com/r/webdev/comments/1h513bc/how_can_i_deploy_my_web_app_djangoreact/,https://www.reddit.com/r/webdev/comments/1h513bc/how_can_i_deploy_my_web_app_djangoreact/,2024-12-02 17:56:09,0,0.5,0,0,2,0,0,False,False,True,False,False,Question,https://b.thumbs.redditmedia.com/QADNtDOhDHRQDPHUJeU0h6NZWRLiYl99q4tdi9Gag_Y.jpg,t3_1h513bc
webdev,Seeking Guidance: Best Coding Language and Open APIs for E-Commerce Price History Tracker,"We’re in the process of developing a website that will provide users with **historical price data** for products across various e-commerce platforms like Amazon, Flipkart, etc..

As a team with limited experience in building such web applications, we’re looking for **guidance** on a few key aspects:

1. **Coding Language:** Which programming language or framework is best suited for developing a project of this scale and nature? We need something that’s efficient, scalable, and relatively beginner-friendly.
2. **Open APIs:** Are there any standard **open APIs** available that provide product price data for this kind of use case? If not, what are the recommended legal and ethical approaches for sourcing such data?
3. **Safe and Legal Methods:** We’re committed to building this project in a way that adheres to all legal and ethical standards. Any suggestions on how to proceed safely while ensuring we comply with terms of use and relevant regulations?

Additionally, if you have recommendations for the **tech stack** or any personal experiences with similar projects, we’d greatly appreciate your input.

Thanks in advance for helping us move forward with this project!",Ty_ler__,1h50v6t,https://reddit.com/r/webdev/comments/1h50v6t/seeking_guidance_best_coding_language_and_open/,https://www.reddit.com/r/webdev/comments/1h50v6t/seeking_guidance_best_coding_language_and_open/,2024-12-02 17:47:14,1,0.67,1,0,3,0,0,False,False,True,False,False,,self,t3_1h50v6t
webdev,"How to first load placeholders for all assets on a page, and only then start loading the actual assets?","I have a page with dozens of embedded JPGs, GIFs and a few videos. GIFs and videos take a while to load, leading to an awkard empty layout meanwhile.

I'd like to assign lightweight JPG placeholders for all of these GIFs and videos, and have them all load immediately. Only once all these placeholders are loaded, I want the page to start loading the heavier assets, replacing the placeholders as they become available. Is this possible?

I've tried lazy loading, however this doesn't really address the issue. I don't want the user to see the empty space before a GIF or video loads.

My knowledge of html/css is very basic. I'm ok using JS, as long as the solution is not too complicated.

Thanks!",D1g1talCreat1ve,1h508hk,https://reddit.com/r/webdev/comments/1h508hk/how_to_first_load_placeholders_for_all_assets_on/,https://www.reddit.com/r/webdev/comments/1h508hk/how_to_first_load_placeholders_for_all_assets_on/,2024-12-02 17:21:45,4,0.84,4,0,2,0,0,False,False,True,False,False,Question,self,t3_1h508hk
