subreddit,title,selftext,author,id,permalink,url,created_utc,score,upvote_ratio,ups,downs,num_comments,total_awards_received,gilded,is_video,is_original_content,is_self,over_18,spoiler,link_flair_text,thumbnail,name
webdev,Can one url/link/web-address go to different websites? ,"Read this in full:

I am not a programmer so I don’t know much on Computer Science.

I was wondering if when I enter a website address in the search bar, if I click enter I go to one website but if I type the same address on the same search bar on the same device, I would then go to a different website?


So much so that it is up to random chance as to which website I will go to? What if the websites that the URL goes to alternate on timed intervals? ",PuzzleheadedThroat84,1hbwjwh,https://reddit.com/r/webdev/comments/1hbwjwh/can_one_urllinkwebaddress_go_to_different_websites/,https://www.reddit.com/r/webdev/comments/1hbwjwh/can_one_urllinkwebaddress_go_to_different_websites/,2024-12-11 15:53:24,1,1.0,1,0,0,0,0,False,False,True,False,False,Question,self,t3_1hbwjwh
webdev,"Web technologies that were the ""future"", but instead burned bright for a bit and died rapidly?",,zovered,1hbwczu,https://reddit.com/r/webdev/comments/1hbwczu/web_technologies_that_were_the_future_but_instead/,https://i.redd.it/nt7n5xufp86e1.png,2024-12-11 15:45:02,0,0.5,0,0,9,0,0,False,False,False,False,False,,https://b.thumbs.redditmedia.com/pdpVRvk-dZ1LCNmKtnxO0b88bDa0HNSBBSOmJ2CZsZY.jpg,t3_1hbwczu
webdev,Attribute {%if is not allowed here? and Attribute filter_vak is not allowed here?,"Can somebody help me fix this error? When I run the code in [app.py](http://app.py) everything works just fine.

https://preview.redd.it/6d3zuh37n86e1.png?width=2940&amp;format=png&amp;auto=webp&amp;s=f074785ea728e4cc055227cc41f67142a4cefa92

",Available_Giraffe_36,1hbw1n6,https://reddit.com/r/webdev/comments/1hbw1n6/attribute_if_is_not_allowed_here_and_attribute/,https://www.reddit.com/r/webdev/comments/1hbw1n6/attribute_if_is_not_allowed_here_and_attribute/,2024-12-11 15:31:10,1,1.0,1,0,3,0,0,False,False,True,False,False,,https://b.thumbs.redditmedia.com/4ULs8RoKKI3yisS-WxeCp414XgLKRsgbzdyX1ukrY3o.jpg,t3_1hbw1n6
webdev,Trying to create animation of cursor clicking through UI flow,"I'm working on a landing page and want to create an animation that shows a cursor clicking and entering text into a search bar, clicking on results, and so on...

I would like it to be vector illustrated so it looks sharp. 

I'm not sure what tools are available to accomplish this. I was looking at Framer Motion, but it seems like I'll need to code the actual elements and animate them. Which is fine - since I'm a coder, I should be handle that. But I'm just wondering if there are easier ways.

TIA",bttf88,1hbvtt0,https://reddit.com/r/webdev/comments/1hbvtt0/trying_to_create_animation_of_cursor_clicking/,https://www.reddit.com/r/webdev/comments/1hbvtt0/trying_to_create_animation_of_cursor_clicking/,2024-12-11 15:21:26,1,1.0,1,0,2,0,0,False,False,True,False,False,,self,t3_1hbvtt0
webdev,"I’m afraid to open source the data for my website, should I be?","I have made a free price comparison website for SaaS dev tools. And as the different categories and all the providers keep growing it will reach a point where keeping this up to date stops scaling time wise for me alone.

The project is still small-ish, but its growing and the requests for adding and updating data is growing as well.

So I’m thinking of open sourcing the pricing data so others can contribute if they want to, to keep the data up to date, and letting people add new categories or providers themselves.

But my worries is that in the day of AI assistants like v0 and bolt, the data source will be used to copy my little site and that it will be overtaken by others.

Is this a legit worry, or is the potential upside of having the tool grow and be a good resource for the community too great?

The target audience is developers so most of them can copy this pretty easily, its not complicated code. It’s the gathering of data that stops the copies I think.

I’ve been thinking of adding APIs for adding data as well, but I dont really think people will use that, what do you think?

The last resort would be to set up scraping to keep the data updated, not really a path I want to take.",skorpioo,1hbvi13,https://reddit.com/r/webdev/comments/1hbvi13/im_afraid_to_open_source_the_data_for_my_website/,https://www.reddit.com/r/webdev/comments/1hbvi13/im_afraid_to_open_source_the_data_for_my_website/,2024-12-11 15:06:28,0,0.5,0,0,3,0,0,False,False,True,False,False,,self,t3_1hbvi13
webdev,Audio not playing in safari below ios 17,I am trying to play audio using the following function. But it is not working for safari mobile. Please help ,LancersGaeBulge,1hbuzzy,https://reddit.com/r/webdev/comments/1hbuzzy/audio_not_playing_in_safari_below_ios_17/,https://i.redd.it/f3i7uzkxe86e1.jpeg,2024-12-11 14:44:16,1,0.6,1,0,8,0,0,False,False,False,False,False,,https://b.thumbs.redditmedia.com/xmH1E9ktPs4smzIb_g0RtHIaDjVNe_EX_nSCIS3pN_M.jpg,t3_1hbuzzy
webdev,Heading tag space,"While adding CSS of margin to let 2 div elements touch at the vertices, it was only possible to do so using h1 tag. Tried to use h2 but there is some kind of ghost space with h2. 

Can any one tell me is that the case?

[with h1](https://preview.redd.it/qcdxopsq286e1.png?width=1223&amp;format=png&amp;auto=webp&amp;s=5511fb7449534fc3f32486bc0430686bfa7cd776)

[with h2](https://preview.redd.it/k226irsq286e1.png?width=1097&amp;format=png&amp;auto=webp&amp;s=e81c14e28d63049be12133b5130673173039f7c5)

",mallickaniket,1hbtltf,https://reddit.com/r/webdev/comments/1hbtltf/heading_tag_space/,https://www.reddit.com/r/webdev/comments/1hbtltf/heading_tag_space/,2024-12-11 13:36:19,3,0.81,3,0,2,0,0,False,False,True,False,False,,https://b.thumbs.redditmedia.com/FQVk_CJ2n-ShDOTklrQa6jEamj3XIYjoAvmNofUFk4k.jpg,t3_1hbtltf
webdev,How to achieve new test environemtn for every feature?,"Hi, I'd like to ask for help with how I can achieve different test environments for every feature. For example, if I have feature-1 and it is ready to be tested, I would like to have [feature-1.site.com](http://feature-1.site.com) as test environment, and so forth for every feature that is ready for testing.",LongjumpingLaugh8766,1hbtjmg,https://reddit.com/r/webdev/comments/1hbtjmg/how_to_achieve_new_test_environemtn_for_every/,https://www.reddit.com/r/webdev/comments/1hbtjmg/how_to_achieve_new_test_environemtn_for_every/,2024-12-11 13:33:07,0,0.5,0,0,5,0,0,False,False,True,False,False,,self,t3_1hbtjmg
webdev,I wrote 7 javascript based AI games in 7 days and learnt a lot about whats possible,,cokeandcode,1hbt1mc,https://reddit.com/r/webdev/comments/1hbt1mc/i_wrote_7_javascript_based_ai_games_in_7_days_and/,https://developers.rune.ai/blog/7-ai-games-in-7-days,2024-12-11 13:06:45,25,0.63,25,0,9,0,0,False,False,False,False,False,Article,https://b.thumbs.redditmedia.com/CUc1MI_O0e_djBV0kcq-_DaDCwc1F6BLhGNIGiRjf0Q.jpg,t3_1hbt1mc
webdev,Hosted email options,"Can anyone recommend a hosted email platform to use with a custom domain?

I’m currently using iCloud forwarding, which works, but I often find it frustrating having to use app-specific passwords etc.

The domain is hosted by Cloudflare which supports routing but I’d rather keep it separate from my personal email.

I don’t generally use Gmail to allow for Cloudflare routing",ConduciveMammal,1hbssyg,https://reddit.com/r/webdev/comments/1hbssyg/hosted_email_options/,https://www.reddit.com/r/webdev/comments/1hbssyg/hosted_email_options/,2024-12-11 12:54:09,1,1.0,1,0,5,0,0,False,False,True,False,False,Question,self,t3_1hbssyg
webdev,Domains,"A local small company that I know want me to build a website for them

Their old website is hosted by another small local business, and we want to keep the old domain name..

How would I go about retrieving the old domain name, so that I can use it to display the website that I build

Thanks in advance! 

Edit: I currently haven’t paid for a hosting domain, I assume it’s ok to build the website first, then buy one? (Thinking of Ionos)",Mnixon779,1hbsnb7,https://reddit.com/r/webdev/comments/1hbsnb7/domains/,https://www.reddit.com/r/webdev/comments/1hbsnb7/domains/,2024-12-11 12:45:05,0,0.5,0,0,2,0,0,False,False,True,False,False,,self,t3_1hbsnb7
webdev,Credit check API for B2B Shopify store,"Im creating a B2B store on Shopify and part of the sign up process, we're gonna perform a credit check on the company. Does anyone know of a good API that can perform soft credit checks? Or perhaps if anyone has a different suggestion? - Thanks",alexiky,1hbs8nl,https://reddit.com/r/webdev/comments/1hbs8nl/credit_check_api_for_b2b_shopify_store/,https://www.reddit.com/r/webdev/comments/1hbs8nl/credit_check_api_for_b2b_shopify_store/,2024-12-11 12:21:03,1,1.0,1,0,0,0,0,False,False,True,False,False,,self,t3_1hbs8nl
webdev,Custom domain name super weird bugs,"Hi,

I've setup custom domain today (fly.io hosting &amp; namecheap for domain).

And I see very strange behavior now:

\- Safari and Chrome on mobile work fine and connect to backend

\- Safari works fine on my latop

\- Chrome on my laptop does not load the site at all (ERR\_CONNECTION\_REFUSED).

\- Chrome on someone else's laptop loads the site, but the site cannot connect to backend due to CORS policy.

  
I have no idea what's going on, I have another website with exactly same configuration and it works smooth. ChatGPT is useless.

What's going on?

Thank you.",velinovae,1hbs0f3,https://reddit.com/r/webdev/comments/1hbs0f3/custom_domain_name_super_weird_bugs/,https://www.reddit.com/r/webdev/comments/1hbs0f3/custom_domain_name_super_weird_bugs/,2024-12-11 12:06:52,1,0.67,1,0,5,0,0,False,False,True,False,False,Question,self,t3_1hbs0f3
webdev,Anyone noticing the title sizes being off?,Seems like someone screwed up the CSS but I wonder how it got through to Prod. Do you think Reddit has e2e/unit tests for this sort of stuff?,TScottFitzgerald,1hbr95b,https://reddit.com/r/webdev/comments/1hbr95b/anyone_noticing_the_title_sizes_being_off/,https://www.reddit.com/r/webdev/comments/1hbr95b/anyone_noticing_the_title_sizes_being_off/,2024-12-11 11:17:17,0,0.33,0,0,3,0,0,False,False,True,False,False,,self,t3_1hbr95b
webdev,API for Games,"Can't find a PlayStation website api, that gives what game I'm playing, for how much, etc. but I don't want the website need to login into my account, I need this (if you can found) free,
Do y'all also have a Roblox, Xbox, and other APIs?

Please let me know",fiokoLy,1hbqvza,https://reddit.com/r/webdev/comments/1hbqvza/api_for_games/,https://www.reddit.com/r/webdev/comments/1hbqvza/api_for_games/,2024-12-11 10:51:48,0,0.2,0,0,1,0,0,False,False,True,False,False,Discussion,self,t3_1hbqvza
webdev,CMS for a non-profit?,"Consider the case. Imagine you have to pick a CMS to deploy and customise for a non-profit that publishes something semi-daily, including reports, press releases, and articles. It would be self-hosted. It would be great if it were built in Python on the backend. But it also has to be rather popular so that it's easy to find someone to help with upkeep, customisations and further development.

WordPress is out of the question, as customising is a pain and requires juggling loads of non-interoperable plugins.

What would you suggest?",jarekko,1hbql4x,https://reddit.com/r/webdev/comments/1hbql4x/cms_for_a_nonprofit/,https://www.reddit.com/r/webdev/comments/1hbql4x/cms_for_a_nonprofit/,2024-12-11 10:29:38,1,0.67,1,0,6,0,0,False,False,True,False,False,,self,t3_1hbql4x
webdev,Finally will no longer get charged if you go over your usage on netlify. ,,josephadam1,1hbq2gj,https://reddit.com/r/webdev/comments/1hbq2gj/finally_will_no_longer_get_charged_if_you_go_over/,https://www.netlify.com/blog/introducing-netlify-free-plan/?utm_medium=email&amp;_hsenc=p2ANqtz-8Uld1uCkVaoSg8h507NxrTFAWHuHMhORvZ6uuJfYFbf4L0HbnvFvkv5dFsq3EwQ8L7oLrJgR-UkXdcUdqa0VpoKnW7CCdNOLjidCpCb4n_kHmB1aA&amp;_hsmi=337928257&amp;utm_content=337928257&amp;utm_source=hs_email,2024-12-11 09:51:02,13,0.89,13,0,3,0,0,False,False,False,False,False,,https://b.thumbs.redditmedia.com/7va2OC01n-9cBICqaS5wtZ1emBeeu5RWOWUrmsGXfzY.jpg,t3_1hbq2gj
webdev,"Storing data per ""session""(?) on WordPress","Hi, working on a plugin that's meant to store the previous URL that a user was on. Headers didn't work for me as it would not persist if you say navigated straight to the login page rather than going to the home page -&gt; (optional) any other page -&gt; login.

Here is the part of the plugin: [https://gist.github.com/cyrus01337/3fb366f421a6fffad166879b057a14b1](https://gist.github.com/cyrus01337/3fb366f421a6fffad166879b057a14b1)

I've left my attempts at using cookies as comments, is there anything I could be missing?",TheWordBallsIsFunny,1hbpy4h,https://reddit.com/r/webdev/comments/1hbpy4h/storing_data_per_session_on_wordpress/,https://www.reddit.com/r/webdev/comments/1hbpy4h/storing_data_per_session_on_wordpress/,2024-12-11 09:41:49,2,1.0,2,0,5,0,0,False,False,True,False,False,Question,self,t3_1hbpy4h
webdev,How do i make a desktop website more compatible with mobile?,"I made a website for desktop where i have news, contact us and about the game the website is about. But now i have to make it for mobile aswell? How do i do that?",Quinxcuzwhynot,1hbpbcl,https://reddit.com/r/webdev/comments/1hbpbcl/how_do_i_make_a_desktop_website_more_compatible/,https://www.reddit.com/r/webdev/comments/1hbpbcl/how_do_i_make_a_desktop_website_more_compatible/,2024-12-11 08:51:38,0,0.4,0,0,33,0,0,False,False,True,False,False,Question,self,t3_1hbpbcl
webdev,Water animation,"I'm pretty new into the Three.js world and I'm curious as to what would be a good starting point in building this water animation from Gentlerain's Homepage.

URL: [https://www.gentlerain.ai/](https://www.gentlerain.ai/)

Any recommendations are highly appreciated!",Seoulites,1hbor2x,https://reddit.com/r/webdev/comments/1hbor2x/water_animation/,https://www.reddit.com/r/webdev/comments/1hbor2x/water_animation/,2024-12-11 08:06:56,6,1.0,6,0,8,0,0,False,False,True,False,False,,self,t3_1hbor2x
webdev,Looking for an api of batch translation in open ai,"There is an api for image to image translation in open ai but I couldn't find api for batch translation of image to image translation, if there is, please help me find it 🙏🙏",scott9830,1hbo8ph,https://reddit.com/r/webdev/comments/1hbo8ph/looking_for_an_api_of_batch_translation_in_open_ai/,https://www.reddit.com/r/webdev/comments/1hbo8ph/looking_for_an_api_of_batch_translation_in_open_ai/,2024-12-11 07:28:20,1,1.0,1,0,0,0,0,False,False,True,False,False,Question,self,t3_1hbo8ph
webdev,Suggestions for moving our forum from SimpleMachines?,"Hello everyone!

We've been running our community forum on SMF for almost twenty years (currently on 2.1.4). Unfortunately, although I have a soft spot for SMF, it's been falling behind times for a long time now... And god knows when v3 is going to be released.

Could someone suggest a modern forum platform to move to? The only (but biggest) caveat is there has to be a working importer from SMF, and this is what has stumbled me as I haven't found any decent forum software with a current importer.

Anyone has anything to suggest?

Thanks!",Themistocles_gr,1hbnx1h,https://reddit.com/r/webdev/comments/1hbnx1h/suggestions_for_moving_our_forum_from/,https://www.reddit.com/r/webdev/comments/1hbnx1h/suggestions_for_moving_our_forum_from/,2024-12-11 07:04:08,2,1.0,2,0,9,0,0,False,False,True,False,False,,self,t3_1hbnx1h
webdev,How to fix this weird selection are thing in safari?,"Hey, I am building a chat UI, and I absolutely hate how I can double-click on text to select it, and Safari shows a really weird selection area! Is there any chance there is a quick fix?



https://preview.redd.it/644b97u9166e1.png?width=1200&amp;format=png&amp;auto=webp&amp;s=7184a50bd4814b13a774ca1c1612563b9cb7f782

",Robert-treboR,1hbnn8l,https://reddit.com/r/webdev/comments/1hbnn8l/how_to_fix_this_weird_selection_are_thing_in/,https://www.reddit.com/r/webdev/comments/1hbnn8l/how_to_fix_this_weird_selection_are_thing_in/,2024-12-11 06:45:28,1,0.67,1,0,4,0,0,False,False,True,False,False,,https://b.thumbs.redditmedia.com/_cXK6Uw2qeTYZU1TEdK2xlpJLe_lyPLK5OvPYcMH7aQ.jpg,t3_1hbnn8l
webdev,m3u8 link work on VLC but not in online media players,"I have a .m3u8 link that plays in VLC player but it wont play in HLS player website like [HLS Player - Free M3U8,DASH Player - Livepush](https://livepush.io/hlsplayer/index.html). Whereas when I tried to play the link in HLS player it just shows black screen.

Why is this?

.m3u8 link: [https://streetcatpull.hellobike.com/live/4403564823711369745\_0.m3u8](https://streetcatpull.hellobike.com/live/4403564823711369745_0.m3u8)",Hexalogy,1hbnm61,https://reddit.com/r/webdev/comments/1hbnm61/m3u8_link_work_on_vlc_but_not_in_online_media/,https://www.reddit.com/r/webdev/comments/1hbnm61/m3u8_link_work_on_vlc_but_not_in_online_media/,2024-12-11 06:43:30,2,1.0,2,0,2,0,0,False,False,True,False,False,,self,t3_1hbnm61
webdev,A 5-min Guide to Fusor for React Devs,"Check out this library I'm developing. It's like React but operates at a lower level of abstraction.

Repository - [https://github.com/fusorjs/dom](https://github.com/fusorjs/dom)

https://preview.redd.it/ayhkyvn8x56e1.png?width=686&amp;format=png&amp;auto=webp&amp;s=042a5433af6af8e823df0f8d814660e90825a7a1

",isumix_,1hbnaz1,https://reddit.com/r/webdev/comments/1hbnaz1/a_5min_guide_to_fusor_for_react_devs/,https://www.reddit.com/r/webdev/comments/1hbnaz1/a_5min_guide_to_fusor_for_react_devs/,2024-12-11 06:21:51,0,0.5,0,0,0,0,0,False,False,True,False,False,,https://b.thumbs.redditmedia.com/26etVZOkWc3Cbr0kbPsy39evgER8TnrXRVGlO1vj9Jo.jpg,t3_1hbnaz1
webdev,Is there ever a reason for adding a feature to a legacy app written in framework X by writing it in framework Y?,"Let's say your client uses a legacy app like AngularJS or some crappy SAPUI5 and the codebase is a spaghetti hellhole with a lot of technical debt. He asks for a greenfield feature like a calculator or an AI chat bubble.

Is there ever a reason to build it in a more lightweight way using Vue or a web component, and make the legacy app just render it or route to it?",BigBootyBear,1hbn3kg,https://reddit.com/r/webdev/comments/1hbn3kg/is_there_ever_a_reason_for_adding_a_feature_to_a/,https://www.reddit.com/r/webdev/comments/1hbn3kg/is_there_ever_a_reason_for_adding_a_feature_to_a/,2024-12-11 06:07:52,0,0.4,0,0,15,0,0,False,False,True,False,False,Question,self,t3_1hbn3kg
webdev,Cognitive Load is what matters,,fagnerbrack,1hbm4f4,https://reddit.com/r/webdev/comments/1hbm4f4/cognitive_load_is_what_matters/,https://github.com/zakirullin/cognitive-load,2024-12-11 05:06:07,34,0.95,34,0,4,0,0,False,False,False,False,False,,https://b.thumbs.redditmedia.com/rNf3WcxHGMQeb9avziBSU4Rc5nv2HaOs20Hw3bDPt4s.jpg,t3_1hbm4f4
webdev,My website button / dropdown menu are being squished on mobile devices?,"Hi im new to making websites and Ive been making one to store my college work on (Right now its just a fake download button that sends you to a rickroll lol). It looks pretty nice on a desktop but when I load it on my phone the download button gets all squished. My download button fills up with liquid when hovered over and I do this by moving a water image background upwards when I hover over the button. On a mobile device though its in the wrong position and already showing a bit at the bottom of the button.

Also my navbar has a dropdown menu that opens when hovered over. I figured out each link in my dropdown menu is 46px tall. Theres 2 items in the dropdown menu so I set it to open to 92px with a transition effect. I cant set the max height in css to be 100% because my dropdown menu isnt a set height and the height depends on the items within it so the browser cant calculate 100%. But while it works on a pc just manually setting the height to 92px on a mobile device it doesnt fully open?

Ive attached an image of it using my pixel 7 and my pcs browser so you can see what I mean. Any help is appreciated thanks.

[On my PC](https://preview.redd.it/0uj3hx70756e1.png?width=672&amp;format=png&amp;auto=webp&amp;s=81c08b455350778cb1e73445e76b704dde981418)

[On my pixel 7](https://preview.redd.it/4q69cu8w756e1.png?width=689&amp;format=png&amp;auto=webp&amp;s=e664e55e06e04adbf98501bdac63fd7cb3f2c7c0)

[On my PC](https://preview.redd.it/6hsm9d4z756e1.png?width=437&amp;format=png&amp;auto=webp&amp;s=c4738dc0442f0f0d333f05b18d43693338616798)

[On my pixel 7](https://preview.redd.it/c83f2sz0856e1.png?width=402&amp;format=png&amp;auto=webp&amp;s=cb064e4a2419be1a9eef3c953404bd4c9433ee67)",No-Drawing-1508,1hbkyfq,https://reddit.com/r/webdev/comments/1hbkyfq/my_website_button_dropdown_menu_are_being/,https://www.reddit.com/r/webdev/comments/1hbkyfq/my_website_button_dropdown_menu_are_being/,2024-12-11 04:00:22,1,0.67,1,0,3,0,0,False,False,True,False,False,,https://b.thumbs.redditmedia.com/DkUbrlDRa44RwmrvtfRcRp2iPV-lApvniCI-Ic-euUI.jpg,t3_1hbkyfq
webdev,How do I save the code in the correct folders?,"I'm following along with this video and I don't know where to save the code.  I want to save it locally on my laptop.  The code is in the YouTube description, can anyone please help?
https://youtu.be/HY6nPFsADDo?si=QjPk13UM1Xw56b5o",AdamShed,1hbit64,https://reddit.com/r/webdev/comments/1hbit64/how_do_i_save_the_code_in_the_correct_folders/,https://www.reddit.com/r/webdev/comments/1hbit64/how_do_i_save_the_code_in_the_correct_folders/,2024-12-11 02:07:32,1,0.6,1,0,2,0,0,False,False,True,False,False,Question,self,t3_1hbit64
webdev,What is best way to limit what users can see/do?  Via cookies?  Recording IP address?  Something else?,"For example, when a news site like The Athletic lets you see, say, 5 articles for free and then tells you you've run out and it's time to pay.  

I imagine they don't do it by cookies since you could delete the cookies or use incognito browser to get around it.

So do they record the IP address you came from and restrict using that?  

Or is there another method I'm not aware of?",gabbysal,1hbioo5,https://reddit.com/r/webdev/comments/1hbioo5/what_is_best_way_to_limit_what_users_can_seedo/,https://www.reddit.com/r/webdev/comments/1hbioo5/what_is_best_way_to_limit_what_users_can_seedo/,2024-12-11 02:01:08,32,0.85,32,0,28,0,0,False,False,True,False,False,,self,t3_1hbioo5
webdev,Easy Automated Image Gen on the Web,"I have written some python code that generates a few .png using matplotlib with some data I get from an API. I want to regenerate these images daily, and share them with one or more people. Currently this involves me sending an email every day. I'd rather have it hosted on the web where it's easily accessible.   
  
Two questions: 1.) Is there a photo hosting site that has an API I can automatically upload them to? If so, I assume you can program a computer to automatically run some python code at a set time each day, what would I search to learn more about this?  
  
2.) Some of the parameters are customizable, so I'd rather have a little website that allows the other person be able to adjust some parameters and generate the images on the fly. Is Django the best way to get this done? If so, should I host it on a VPS or is there a simpler place to run this web app? Theoretically, these plots/data have monetary value, so I'd eventually want to lock it behind a login as well. I know this seems like I might be biting off more than my amateur self can chew. But I am happy to learn along the way of this process. I don't care if it takes me a few weeks to make all of this work.

  
If there is a better sub for these questions, please point me that way. I know question 1 isn't really webdev related. Thanks in advance.",Far_Kangaroo2550,1hbibip,https://reddit.com/r/webdev/comments/1hbibip/easy_automated_image_gen_on_the_web/,https://www.reddit.com/r/webdev/comments/1hbibip/easy_automated_image_gen_on_the_web/,2024-12-11 01:42:45,0,0.5,0,0,0,0,0,False,False,True,False,False,,self,t3_1hbibip
webdev,"Got approached to develop a webscraping and contacting system, need guidance","Someone approached me on LinkedIn, he wants me to develop a system to search info about companies on the web and people of interest in those companies, their phones and emails, via APIs and webscraping

He has a CSV info a bit of info on those companies, his idea is to scrape LinkedIn to find the people of interest in those companies and get their contact info

My main concern is defining how much time I need to deliver that. I never did any webscraping. I know his stuff is possible because a project of mine is similar, hence why he contacted me, but I didn't start implementing those features for contacting yet, and mine didn't even need webscraping

Any way, someone can help me figuring what else I need to know to measure how long this thing will take? Im a mid-level fullstack developer, my background is C# Dotnet React, I never did a serious project in Python (I can code on it tho), but this freelance I would be on my own pretty much. We will have a meeting in a day or two to define details and I'll have to estimate a time to deliver the project

Edit: doesn't HAVE to be LinkedIn, I can scrape or use the api of someone else. As long as I get the info, it's great. And I wonder if I can deliver it and how long",Blender-Fan,1hbhku9,https://reddit.com/r/webdev/comments/1hbhku9/got_approached_to_develop_a_webscraping_and/,https://www.reddit.com/r/webdev/comments/1hbhku9/got_approached_to_develop_a_webscraping_and/,2024-12-11 01:05:10,0,0.25,0,0,12,0,0,False,False,True,False,False,,self,t3_1hbhku9
