subreddit,title,selftext,author,id,permalink,url,created_utc,score,upvote_ratio,ups,downs,num_comments,total_awards_received,gilded,is_video,is_original_content,is_self,over_18,spoiler,link_flair_text,thumbnail,name
gaming,Ghost of Yotei pushback,"So, the latest anti-woke controversy is brewing, and it's giving me a lot of amusement, honestly.

Not gonna delve too far into Ghost of Tsushima because I haven't personally played it, so I'm not able to offer my own opinion on its gameplay or quality, but it was generally highly acclaimed.

Now, following the successful launch of a new IP, the obvious goal for gaming companies is to turn it into a franchise, so a sequel started getting discussed almost before the ink dried on the sales reports. 

Sony just had their - otherwise honestly lackluster - press event to announce upcoming products. 

One of those products was the intended sequel, Ghost of Yotei. As opposed to a direct sequel to the first game, continuing the story specifically of the male protagonist of the first game, Jin Sakai, Sony opted to turn the Ghost series into more of a related anthology apparently; Yotei follows a new character, a female samurai named Atsu.

And there was considerable backlash about that sequel, which Sony apparently didn't expect. 

That backlash has split into three slightly overlapping camps; I'll discuss two before zoning in on one specifically.

The first, and honestly the most reasonable and valid of them, is the gamers who were specifically looking for a continuation of Jin's story. Disappointment there is totally understandable; regardless of how complete a story is, if you are invested in the character, you want there to be more. More time with them, more insight into them, more story about them, more interaction with them, more. 

Since Yotei is still in development, we don't know how much of that there is. It's entirely possible that Sony is taking a page from Mad Max here and using the first game as an origin story for someone who then appears as a recurring character in other people's stories; we *do not know.*

But that viewpoint, that **""we wanted more Jin and this isn't that, wtf""** is the sane people objection to the announcement.

Second is objection to the voice actress. This is less reasonable but comprehensible, because Erika Ishii is a known and outspoken activist. This doesn't affect their voicework in the game one tiny bit - and the people who have discussed it so far have said it is absolutely top notch - but if you disagree with someone's personal stances, disapproving of their choice for your media is understandable.

For me, Erika is a fantastic choice; if you're not familiar, they are on Dimension 20 and a lot of other Dropout network stuff, and is a fairly prominent activist for LQBTQIA+ rights, but they're also immensely talented, creative, and funny. Especially on Dimension 20 you can see this; their characters are usually only second to Emily Axford's routinely game breaking creativity in terms of their impact, and despite their often super extra appearance on the show, they are very very good at submerging herself into the character, which is honestly literally the entire goal of voice acting for video games.

So, the people who are objecting to the game based on Erika have, you know, no taste and are also bigots, but at least it's a comprehensible sort of consistent bigotry.

The third group of objectors, however, is the one I think is funniest.

Now, I'm gonna reveal something totally unimportant that actually I promise will be sort of relevant: in video games, I almost always play a female character. *(In fact, one of my very few actual gaming regrets involves this; right after launch, I decided to play Genshin Impact with two accounts, one for each Traveler, and the account playing as Aether, the male Traveler, got so much luckier in the gacha that I ultimately ended up with that as my main account, and I'd frankly much rather be playing as Lumine.)*

My reasoning is, maybe silly, but very simple: I think girls are pretty. If I'm gonna be playing a game for hours on end and staring at a single character the whole time, I'd rather be looking at a girl. Not because I identify as a girl, but because I think looking at girls is a lot more fun than looking at other guys.

So, the third group of people who are objecting to Ghost of Yotei is entirely made up of guys, who are objecting on the exclusive grounds that they don't want to play a female character.

Unlike the other two reasons for objecting to the game, which while not necessarily reasonable are at least based on something that's a real thing, these guys are objecting based on the fact that a virtual avatar - an inherently unreal, sexless thing made of pixels - is shaped with slightly more curves. 

In other words, they're so utterly dedicated to staring at male bodies that the idea of looking at a female body makes them utterly revolted.

Now, as a guy who likes looking at girls, I gotta say, even as heterosexual as I am, I can't imagine being *offended* that I had to look at a guy; the most I can muster would be *disinterest.*

And that's what makes this so funny for me.

Can you even imagine *how* gay you have to be, to be willing to start a huge flame war online over the idea that you might have to *not* stare at a male for hours and hours on end for the entire duration of your gameplay?

That's way gayer than I am straight, man.

They keep saying it's ""woke"" or ""DEI"" as cover.

But y'all.

They're really saying that they *hunger* for those tasty man butts.

That's fucking funny.

*(Edited to fix Erika Ishii's pronouns because I didn't know they prefer they/them. Good catch!)*",WillDissolver,1h79gt4,https://reddit.com/r/gaming/comments/1h79gt4/ghost_of_yotei_pushback/,https://www.reddit.com/r/gaming/comments/1h79gt4/ghost_of_yotei_pushback/,2024-12-05 13:43:53,0,0.15,0,0,47,0,0,False,False,True,False,False,,self,t3_1h79gt4
gaming,Games that are good but you don’t vibe with ,Recently started playing horizon remastered I had the disc bought awhile ago used for 15 bucks and upgraded it thought no better time to play it after beating Metaphor on Monday. I think the gameplay and visuals are really good but just don’t feel the motivation to keep playing. Maybe I’m still burned out on open worlds idk just not feeling it. So what games do you just don’t vibe with ? ,iNuclearPickle,1h6trph,https://reddit.com/r/gaming/comments/1h6trph/games_that_are_good_but_you_dont_vibe_with/,https://www.reddit.com/r/gaming/comments/1h6trph/games_that_are_good_but_you_dont_vibe_with/,2024-12-04 22:52:22,0,0.47,0,0,160,0,0,False,False,True,False,False,,self,t3_1h6trph
gaming,A game from back than that you feel should have inspired more but didn't. ,I keep coming back to FTL and it bogs me that there aren't more games like it. What is a game that you feel should have spawned a whole sub-genre but didn't?,_demello,1h6w4qm,https://reddit.com/r/gaming/comments/1h6w4qm/a_game_from_back_than_that_you_feel_should_have/,https://www.reddit.com/r/gaming/comments/1h6w4qm/a_game_from_back_than_that_you_feel_should_have/,2024-12-05 00:37:16,0,0.36,0,0,35,0,0,False,False,True,False,False,,self,t3_1h6w4qm
gaming,Warren Spector about what makes Gaming unique,Stumbled upon this while searching for a quote from him and thought it was a neat little take on gaming.,Tetragrammator,1h6f92j,https://reddit.com/r/gaming/comments/1h6f92j/warren_spector_about_what_makes_gaming_unique/,https://youtu.be/55tQEaUjARU?si=3Wjgowi01R70V5hx,2024-12-04 12:52:07,0,0.5,0,0,5,0,0,False,False,False,False,False,,https://b.thumbs.redditmedia.com/Vg7S1ulKJwAqw22wNlujlOe7n38Q0yVfZ6GMGl4fLIE.jpg,t3_1h6f92j
gaming,Birthday/Black Friday shopping,,Vladabeast,1h6z3l7,https://reddit.com/r/gaming/comments/1h6z3l7/birthdayblack_friday_shopping/,https://i.redd.it/2u52vher3y4e1.jpeg,2024-12-05 02:59:43,0,0.34,0,0,35,0,0,False,False,False,False,False,,https://b.thumbs.redditmedia.com/BhXKJ-upV2k0xhlnodd5p4gDllC81X8BoZnaO1QGwIs.jpg,t3_1h6z3l7
gaming,I've become a demotivated gamer,"I often get into a new game that I've looked forward to, either at launch or because of discounts on Steam, but then I play for maybe 2-3 hours, a would-be normal session which I would naturally resume the next day or later in the week except... I don't.

I feel like in 2024 I've started so many games that I intended to play through but as soon as I get the first break from them the thought of booting them up again a day later, or the week after declines completely. FTR I don't actually ""game"". I never played League or CS or anything, and even my WoW days clocked in at lvl 50 during the Lich King stuff.

But I always had an affinity for single-player games that are anywhere between 12 hours or 100 hours long. I would get hooked on them, love them and obviously play them until the credits roll, especially RPGs. But now it's weird. I love it, I really have nothing negative to say but I just can't get myself to play it again. For example, I made it to Chapter 3 in Half Life Alyx, finally playing a VR game -- loving it. I don't feel like playing it at all right now. I made it almost to the end of Dragon Age: The Veilguard, and I'm like bruh... I don't even hate it like all the haters do, why am I suddenly not playing it anymore?

Do you find motivation to just keep playing your games?",linkenski,1h6rq80,https://reddit.com/r/gaming/comments/1h6rq80/ive_become_a_demotivated_gamer/,https://www.reddit.com/r/gaming/comments/1h6rq80/ive_become_a_demotivated_gamer/,2024-12-04 21:28:20,0,0.42,0,0,29,0,0,False,False,True,False,False,,self,t3_1h6rq80
gaming,"CD Projekt's switch to Unreal wasn't motivated by Cyberpunk 2077's rough launch or a 'This is so bad we need to switch' situation, says senior dev",,Roids-in-my-vains,1h4sucm,https://reddit.com/r/gaming/comments/1h4sucm/cd_projekts_switch_to_unreal_wasnt_motivated_by/,https://www.pcgamer.com/games/the-witcher/cd-projekts-switch-to-unreal-wasnt-motivated-by-cyberpunk-2077s-rough-launch-or-a-this-is-so-bad-we-need-to-switch-situation-says-senior-dev/,2024-12-02 11:26:18,5924,0.95,5924,0,661,0,0,False,False,False,False,False,,https://b.thumbs.redditmedia.com/ar3Jla0PnhmAIujlX2CimS8r1-95Sg34VyTW-aHeEaA.jpg,t3_1h4sucm
gaming,My childhood self would think this was the coolest thing ever. (Spyro the Dragon),"I finally 100% these games which I have cherished memories with. It only took me a few days, but I tried my best not to look up any videos and go purely from memory. I did have to look up a few vids for some pesky gem, dragon egg, and miscellaneous collectible placements in Spyro3, but I had a lot of fun going through this nostalgia ride. I also went ahead and did every achievement as well as every skill point on Xbox to polish off those 100%s.",andrewg702,1h57458,https://reddit.com/r/gaming/comments/1h57458/my_childhood_self_would_think_this_was_the/,https://i.redd.it/hp87k9ekci4e1.jpeg,2024-12-02 22:00:34,744,0.95,744,0,51,0,0,False,False,False,False,False,,https://a.thumbs.redditmedia.com/v2U4ec2OXrHlnxbYsikEokhp4cI1GRxwZ73KR2ZMB78.jpg,t3_1h57458
gaming,Help me find a game PLEASE!,"Guys, I’m currently off work for a few weeks and I’m struggling to find a game to play, I’ve bought quite a few games over the last few weeks but ultimately nothings really gripped me.

I’m looking for suggestions considering the following points.

1) I love RPG games with deep mechanics, especially turn based combat.

2) Graphics aren’t an issue.

3) Strategy games are a good shout if they aren’t overwhelming.

4) Need something I can pick up and put down as and when I’ve got 5 minutes.

5) Need to have a story behind them to some degree.

6) Love to grind levels/stats/materials anything but need to have a reason for the grind, grinding for the sake of grinding is a no go.

7) This may be controversial but I love open world/survival/crafting games

Games I’ve played and completed/got bored of recently and don’t want to go back to are as follows.

BG3
Elden Ring
Total war warhammer 3
Final Fantasy 7/9/10/7R
Satisfactory
Rimworld
Subnautica (survived 3hrs)
Graveyard keeper
Rust (might jump on for a few weeks)

Plenty of others but please recommend anything to me that even slightly fits into any of those.

Thanks guys!!",mdh89,1h6oj8u,https://reddit.com/r/gaming/comments/1h6oj8u/help_me_find_a_game_please/,https://www.reddit.com/r/gaming/comments/1h6oj8u/help_me_find_a_game_please/,2024-12-04 19:18:31,0,0.38,0,0,118,0,0,False,False,True,False,False,,self,t3_1h6oj8u
gaming,I have a Logitech G923 arriving today .. what racing/driving games should I buy before the Steam sale ends in 1 hour?,I subscribe to Game Pass on PC so I have access to anything in the GP / EA Play catalog.,ColdStoneCreamAustin,1h6kr7c,https://reddit.com/r/gaming/comments/1h6kr7c/i_have_a_logitech_g923_arriving_today_what/,https://www.reddit.com/r/gaming/comments/1h6kr7c/i_have_a_logitech_g923_arriving_today_what/,2024-12-04 16:50:05,0,0.27,0,0,15,0,0,False,False,True,False,False,,self,t3_1h6kr7c
gaming,Sony and Microsoft should have to show you the online player count for multiplayer focused games ,If a game relies on having a healthy player base then that information should be available so you can make an informed purchase ,ThisNameDoesntCount,1h4wizy,https://reddit.com/r/gaming/comments/1h4wizy/sony_and_microsoft_should_have_to_show_you_the/,https://www.reddit.com/r/gaming/comments/1h4wizy/sony_and_microsoft_should_have_to_show_you_the/,2024-12-02 14:44:57,1938,0.9,1938,0,212,0,0,False,False,True,False,False,,self,t3_1h4wizy
gaming,What are your favorite RPG's of all time?,"To me the PS2 era games hit hard, especially FFX and Kingdom Hearts, I loved how much there was to play in FFX, I was totally hooked as a kid. Playing it today I realize most of it was grinding the same enemies for tens of hours, so not my top RPG.

The original FFVII is probably my favorite, it has such memorable story, music and the materia system was fun. The remakes have been pretty good also!

Honorable mention to Skyrim, it's weird how at the same time it is such a mess and a masterpiece; spent +1000 hours playing/making mods for it.

So what are your favorites and why?",Routasoft,1h5jpzn,https://reddit.com/r/gaming/comments/1h5jpzn/what_are_your_favorite_rpgs_of_all_time/,https://www.reddit.com/r/gaming/comments/1h5jpzn/what_are_your_favorite_rpgs_of_all_time/,2024-12-03 09:33:30,52,0.73,52,0,221,0,0,False,False,True,False,False,,self,t3_1h5jpzn
gaming,made some wall art for my SO featuring games we've played together ,,thesweetsknees,1h59env,https://reddit.com/r/gaming/comments/1h59env/made_some_wall_art_for_my_so_featuring_games_weve/,https://i.redd.it/cs3jsag2ui4e1.png,2024-12-02 23:39:13,302,0.89,302,0,34,0,0,False,False,False,False,False,,https://b.thumbs.redditmedia.com/XsdK6JiPyoAV3Sew2uBF2pUoto16g3U4mH419ULjeqg.jpg,t3_1h59env
gaming,"Assuming everything Intel showed in their Arc preview is exactly how the cards perform in real life, will you buy a B580/B570 for the MSRP of 250 or 210 and what would you be upgrading from?","I currently own a 2070S and with my 1440p ultrawide it does start to show it's age.

So if third party reviews confirm the performance Intel showed at their preview event (and drivers seem to play nice this time), I'm considering giving Arc a shot this time around.

That's why I'm interested in other peoples opinion on the matter.",CurZZe,1h6jwr9,https://reddit.com/r/gaming/comments/1h6jwr9/assuming_everything_intel_showed_in_their_arc/,https://www.reddit.com/r/gaming/comments/1h6jwr9/assuming_everything_intel_showed_in_their_arc/,2024-12-04 16:16:21,0,0.38,0,0,11,0,0,False,False,True,False,False,,self,t3_1h6jwr9
gaming,Friend got me some sick Pokemon wood-burned magnets and I had to share,Succulent Bulbasaur in the background for vibes ,lookitskeith,1h51ktq,https://reddit.com/r/gaming/comments/1h51ktq/friend_got_me_some_sick_pokemon_woodburned/,https://i.redd.it/lor4c74f8h4e1.jpeg,2024-12-02 18:15:34,791,0.96,791,0,33,0,0,False,False,False,False,False,,https://b.thumbs.redditmedia.com/yuYT03prNNHPKvMIm8quW88A6RGt6c5L4TEgZ5wT8Fo.jpg,t3_1h51ktq
gaming,Got a PS5? Sony just put out a ‘feature update’ that adds the PS1 boot up sequence to it.,,Sonikku_a,1h4x5lr,https://reddit.com/r/gaming/comments/1h4x5lr/got_a_ps5_sony_just_put_out_a_feature_update_that/,https://youtu.be/--HpxXfnhTc?si=DHBBJz_4kEoURsZU,2024-12-02 15:12:49,1267,0.93,1267,0,151,0,0,False,False,False,False,False,,https://a.thumbs.redditmedia.com/cdP8rI2zZdBu68uEl4eEnoeNgLkNjeFnXwuK4b1ayX4.jpg,t3_1h4x5lr
gaming,Dragon Age: Inquisition first demo from behind closed doors. Very different to the final product! I would love to see a Dragon Age title more like this.,,Apprehensive_Day212,1h5gr4a,https://reddit.com/r/gaming/comments/1h5gr4a/dragon_age_inquisition_first_demo_from_behind/,https://youtu.be/AAAEUFjq2K4?si=DLHVGx1jkLDTMFp0,2024-12-03 05:58:37,84,0.64,84,0,65,0,0,False,False,False,False,False,,https://b.thumbs.redditmedia.com/coQIx_6Ak1lhILT-KS_c_AYi_r_3H22urYTt0cP3q5k.jpg,t3_1h5gr4a
gaming,A guy figured out how to land an asteroid on Kerbal Space Program...on Xbox.,"I just think the sheer dedication and work involved in this is insane.

Edit: Spelling. Also, it's clearly a comet...",mikethemaniac,1h4z2ev,https://reddit.com/r/gaming/comments/1h4z2ev/a_guy_figured_out_how_to_land_an_asteroid_on/,https://youtu.be/wLY7veemIow?si=0UFLQkTvTqFkZwm8,2024-12-02 16:33:48,937,0.93,937,0,47,0,0,False,False,False,False,False,,https://b.thumbs.redditmedia.com/4v5HRhRLsLOHvDhI0aB6LPtPtqM8lhGWJXBkRWe1pfY.jpg,t3_1h4z2ev
gaming,I Built a House with the new Resin Blocks in Minecraft,,dancsa222,1h4s2j2,https://reddit.com/r/gaming/comments/1h4s2j2/i_built_a_house_with_the_new_resin_blocks_in/,https://i.redd.it/s1gd0lelxe4e1.png,2024-12-02 10:32:31,2873,0.95,2873,0,73,0,0,False,False,False,False,False,,https://b.thumbs.redditmedia.com/WTK8KJTAgc-iOyrNuJUaW-HEZHyQ3XdhUMbYhArReuw.jpg,t3_1h4s2j2
gaming,Spider-Man (2002) dev talks seeing the Raimi script early,,TheSpectacularBagMan,1h6hn0k,https://reddit.com/r/gaming/comments/1h6hn0k/spiderman_2002_dev_talks_seeing_the_raimi_script/,https://youtube.com/shorts/K7voqhcNb6A?si=0U-wi7J5NtoYOfZG,2024-12-04 14:43:13,0,0.31,0,0,7,0,0,False,False,False,False,False,,default,t3_1h6hn0k
gaming,What do y'all think is the coolest glitch/bug/exploit in any game? Why?,"Personally, i find blls in The legend of Zelda: Breath of the wild to be cool. Going at such high speeds in games is rly fun for me.",Profaned_Goddes,1h6i0tb,https://reddit.com/r/gaming/comments/1h6i0tb/what_do_yall_think_is_the_coolest/,https://www.reddit.com/r/gaming/comments/1h6i0tb/what_do_yall_think_is_the_coolest/,2024-12-04 14:59:46,0,0.4,0,0,78,0,0,False,False,True,False,False,,self,t3_1h6i0tb
gaming,What games in your opinion have the most creative use of physics?,"Breath of the wild and Tears of the kingdom are obvious picks, they have really creative use of physics in puzzle solving and manipulating the environment. Especially TotK with the ability to rewind time on an object; in essence reverse physics.

If I had to pick another, I'd say Human Fall Flat since the whole game kinda revolves around the idea of controlling ragdoll physics.

What would be your picks?",Routasoft,1h6coj4,https://reddit.com/r/gaming/comments/1h6coj4/what_games_in_your_opinion_have_the_most_creative/,https://www.reddit.com/r/gaming/comments/1h6coj4/what_games_in_your_opinion_have_the_most_creative/,2024-12-04 10:05:18,0,0.48,0,0,113,0,0,False,False,True,False,False,,self,t3_1h6coj4
gaming,Is it true that Pro Evolution soccer used to be the better soccer game? ,"Like I hear people talk how Pro evolution soccer or ISS used to be the soccer game, I always thought Fifa was the best.",Ghaleon32,1h4wylo,https://reddit.com/r/gaming/comments/1h4wylo/is_it_true_that_pro_evolution_soccer_used_to_be/,https://www.reddit.com/r/gaming/comments/1h4wylo/is_it_true_that_pro_evolution_soccer_used_to_be/,2024-12-02 15:04:14,901,0.9,901,0,344,0,0,False,False,True,False,False,,self,t3_1h4wylo
gaming,"What are some good examples of single player games with ""modes"" or extended gameplay/endgame features?","A lot of single player games are just ""beat the campaign and repeat"" with the exception of maybe one mode, like Resident Evil's Mercenaries. I think Devil May Cry and Witcher 2 or 3 has a survival mode of such as well, but that's it. Aside from difficulties, there's no ""modes"" like it is in other genres. It don't have to be loot or anything, but even Mass Effect 3 has Armax Aresenal Arena just to have something to play, as the rest of the single player is mainly story and one-time missions.",NLK-3,1h629p3,https://reddit.com/r/gaming/comments/1h629p3/what_are_some_good_examples_of_single_player/,https://www.reddit.com/r/gaming/comments/1h629p3/what_are_some_good_examples_of_single_player/,2024-12-03 23:59:59,2,0.54,2,0,21,0,0,False,False,True,False,False,,self,t3_1h629p3
gaming,Is the Grand Theft Auto series redundant now that IRL America has out-parodied anything the games could send up?,"GTA's America was always an over the top pastiche, but lately it would seem real life is far weirder than anything in the games. Can the series still playfully mock the American Dream™, or have we gone too far and fallen off the edge of our flat earth for real?",macaronicheezy,1h6ie4w,https://reddit.com/r/gaming/comments/1h6ie4w/is_the_grand_theft_auto_series_redundant_now_that/,https://www.reddit.com/r/gaming/comments/1h6ie4w/is_the_grand_theft_auto_series_redundant_now_that/,2024-12-04 15:14:55,0,0.44,0,0,20,0,0,False,False,True,False,False,,self,t3_1h6ie4w
gaming,Kingdom Come: Deliverance 2 - First 43 minutes of gameplay (IGN First),,Paul_cz,1h59hrj,https://reddit.com/r/gaming/comments/1h59hrj/kingdom_come_deliverance_2_first_43_minutes_of/,https://www.youtube.com/watch?v=F6GXG1HD6bg,2024-12-02 23:43:06,157,0.8,157,0,107,0,0,False,False,False,False,False,,https://b.thumbs.redditmedia.com/Vu6QyAmgOxaceoXdB9nmwxcQTxPa12H7Vu9eWOJkOgI.jpg,t3_1h59hrj
gaming,"It might sound weird, but I really like when the corpses are done well and remain instead of magically disappearing","TES has probably my favorite approach to this. When you kill an NPC, their body and gore remain for a while before they disappear. You can not only loot their corpses but move them around. After a big battle you look around and see how many lives were lost, how terrible was the encounter, and it feels nice and realistic.

Games where enemies get Thanos snapped like in Elden Ring or turn into a puddle of blood and few random ribs Dragon Age: Origins style or turn into a lootable pouch like in Witcher 3 kind of lack that magical feeling of realism. And it's pretty much a dominant approach, so it makes me sad.",_0kk,1h50q6d,https://reddit.com/r/gaming/comments/1h50q6d/it_might_sound_weird_but_i_really_like_when_the/,https://www.reddit.com/r/gaming/comments/1h50q6d/it_might_sound_weird_but_i_really_like_when_the/,2024-12-02 17:41:31,485,0.94,485,0,105,0,0,False,False,True,False,False,,self,t3_1h50q6d
gaming,I just got a ps5! Looking for recs,"Let me preface this by saying I don't follow gaming news literally at all.

I don't like Assassin's Creed, Call of Duty, or God of War; I'm not into sports games, flight sims, or souls-likes that aren't actually Souls games. Fortnite is cancer.

How's Armored Core 6? The last AC game I played was on ps2 so not exactly recent.

Is Baldurs Gate 3 any good?

Finally, any recs for 2 player simultaneous couch co-op that AREN'T minecraft or LEGO games?

Thx!",bloodectomy,1h6lrr2,https://reddit.com/r/gaming/comments/1h6lrr2/i_just_got_a_ps5_looking_for_recs/,https://www.reddit.com/r/gaming/comments/1h6lrr2/i_just_got_a_ps5_looking_for_recs/,2024-12-04 17:30:00,0,0.21,0,0,23,0,0,False,False,True,False,False,,self,t3_1h6lrr2
gaming,Should I Buy Games on Sale or Wait for Freebies?,"Every Steam sale, I feel like buying games I haven’t played yet but know are amazing—either because they’re popular or part of a famous franchise. The big discounts, like 80-95% off, make it super tempting.

But then, I think, *“What if this game becomes free on Epic or Prime Gaming later?”* It’s happened to me before. I bought the **Bioshock Collection** during a sale for ₹300 (\~$3.54), and just a few months later, it was free on Epic. That feeling is awful, isn't it?

Do you guys also deal with this constant FOMO or regret about buying games in sales? How do you decide whether to buy during sales or just wait for the freebies?

Would love to hear your thoughts (or regrets) on this!

P.S.: Any hidden gems you grabbed this sale that you feel were totally worth it? 😊",KSuraj,1h6mtrb,https://reddit.com/r/gaming/comments/1h6mtrb/should_i_buy_games_on_sale_or_wait_for_freebies/,https://www.reddit.com/r/gaming/comments/1h6mtrb/should_i_buy_games_on_sale_or_wait_for_freebies/,2024-12-04 18:10:58,0,0.1,0,0,14,0,0,False,False,True,False,False,,self,t3_1h6mtrb
