subreddit,title,selftext,author,id,permalink,url,created_utc,score,upvote_ratio,ups,downs,num_comments,total_awards_received,gilded,is_video,is_original_content,is_self,over_18,spoiler,link_flair_text,thumbnail,name
gaming,"What would ""fair"" microtransactions look like?","We all know how greedy the game industry has become, especially most mobile games. It's insane that +$100 tiers even exist for virtual in-game currencies, but even more so that there are people actually buying them.

This all has made me wonder, can a ""fair"" microtransaction model even exist? If so, what would it look like? Limited purchases? No +$100 tiers? Giving the player something besides just virtual currency, such as DLC type content? Actually being ""micro"" only at 1 or 2 bucks?

What are your thoughts?",Routasoft,1h7l1ve,https://reddit.com/r/gaming/comments/1h7l1ve/what_would_fair_microtransactions_look_like/,https://www.reddit.com/r/gaming/comments/1h7l1ve/what_would_fair_microtransactions_look_like/,2024-12-05 21:57:01,0,0.28,0,0,65,0,0,False,False,True,False,False,,self,t3_1h7l1ve
gaming,Finally did the switch to PC! ,,Chilicarlos,1h5z0zr,https://reddit.com/r/gaming/comments/1h5z0zr/finally_did_the_switch_to_pc/,https://i.redd.it/lp7d9d22ep4e1.jpeg,2024-12-03 21:41:22,452,0.85,452,0,79,0,0,False,False,False,False,False,,https://b.thumbs.redditmedia.com/BzOmeed2pihvoDmol9JW_0yx5tY4PAvU37vper8Q0vc.jpg,t3_1h5z0zr
gaming,"What was that one final mission that you played and made you go ""HOLY SHIT""?","I just completed outlast and I had this thought on my head, so I gotta ask...which one?",adm_anonimo,1h7d2i1,https://reddit.com/r/gaming/comments/1h7d2i1/what_was_that_one_final_mission_that_you_played/,https://www.reddit.com/r/gaming/comments/1h7d2i1/what_was_that_one_final_mission_that_you_played/,2024-12-05 16:26:21,0,0.45,0,0,126,0,0,False,False,True,False,False,,self,t3_1h7d2i1
gaming,Is there any point in getting a PS5 Slim if I own a Desktop already?,"So for more context, Ive just ordered an LG C4 55 inch and im not sure if I should just move my desktop setup closer to it and plug my pc in or buy a PS5 and use that one. PC has 32 gb ram ddr5, 6700 xt, r5 7600 which im not exactly sure if it will be capable of pulling 4K resolution well enough. Another thing to note is that I live in a country that got hit by the Sony region block, so the only way to play their new releases on pc is by sailing the high seas which im not a big fan of if im honest. PC I was planning to use for older titles that arent well supported by PS5 or indies/live service games and movies since it pulls all of that with the tech it has atm, PS5 main use would be just Story games which is mostly what I play.

Feel free to ask any other questions for more info and thanks for checking the post out.",Nurosuki,1h7ikoo,https://reddit.com/r/gaming/comments/1h7ikoo/is_there_any_point_in_getting_a_ps5_slim_if_i_own/,https://www.reddit.com/r/gaming/comments/1h7ikoo/is_there_any_point_in_getting_a_ps5_slim_if_i_own/,2024-12-05 20:13:27,0,0.24,0,0,40,0,0,False,False,True,False,False,,self,t3_1h7ikoo
gaming,"Is a 16:10 the same width as a 16:9 monitor, only taller?","When I play a game the resolution is 2560x1600, I'm used to the 16:9 1920x1080, is it just as wide only taller on the screen? I feel like it's in 4:3 ration and I'm not getting as wide view as the the 16:9 would give me",KPeters93,1h7h3rl,https://reddit.com/r/gaming/comments/1h7h3rl/is_a_1610_the_same_width_as_a_169_monitor_only/,https://www.reddit.com/r/gaming/comments/1h7h3rl/is_a_1610_the_same_width_as_a_169_monitor_only/,2024-12-05 19:11:46,0,0.25,0,0,24,0,0,False,False,True,False,False,,self,t3_1h7h3rl
gaming,1v1 tournament,"I want to organize a gaming tournament for friends. I therefore look for games that are 1v1 versus. A match should not be longer than 20 min max. The games need to be local/couch games. Not online. Do you have any tips for this?

Some examples: -mortal combat - Tetris - all ea sports games - Nidhogg - tricky towers - brawhalla

The games are mainly played on PlayStation. Nintendo Switch is possible, but preferably not.

All ideas are welcome.

Footnote:I search a little bit on the subreddit. I see that a lot of people are looking for co op games. Cooperation is not what I am looking for.",boibetterknow444,1h7aien,https://reddit.com/r/gaming/comments/1h7aien/1v1_tournament/,https://www.reddit.com/r/gaming/comments/1h7aien/1v1_tournament/,2024-12-05 14:33:46,0,0.39,0,0,7,0,0,False,False,True,False,False,,self,t3_1h7aien
gaming,What games are you thankful for this year?,,tInteresting_Space,1h7arpy,https://reddit.com/r/gaming/comments/1h7arpy/what_games_are_you_thankful_for_this_year/,https://hardcoregamer.com/games-we-are-thankful-for-in-2024/,2024-12-05 14:46:00,0,0.36,0,0,28,0,0,False,False,False,False,False,,https://b.thumbs.redditmedia.com/ZtszBrfjQ7GDQmZTZAFWCQUSRWKVkmieOhVrOLQMxdA.jpg,t3_1h7arpy
gaming,What makes an esport good?,Why are some esports more fun to watch than others? Why would someone rather watch an esport than play it? What are the core elements of an esport compared to any competitive online game? ,CallSign_Fjor,1h7d6tx,https://reddit.com/r/gaming/comments/1h7d6tx/what_makes_an_esport_good/,https://www.reddit.com/r/gaming/comments/1h7d6tx/what_makes_an_esport_good/,2024-12-05 16:31:22,0,0.19,0,0,17,0,0,False,False,True,False,False,,self,t3_1h7d6tx
gaming,Games with a sense of long-term progression and goals?,"I love WoW and Tarkov and Runescape, but also Stardew Valley, Rimworld, and a whole bunch of others. 

Nothing makes me happier than having a game with a sense of long-term progress, like I’ve built something and have something to show for it. For example, I love the Player-Owned house in Runescape and showing off my pets and achievements. I love mounts and transmogs in wow because I love building my own aesthetic based around my greatest moments. I LOVE my hideout in Tarkov because I feel like I made it with my blood, sweat, and tears, and each mannequin with boss armor on it reminds me of those first kills. 

I’m burned out of most of the above, and while I’m obviously okay with grinding, I need a purpose for it (looking at you WoW) 

Any suggestions for someone looking for a long-term experience?",ArcadeRay,1h6bsax,https://reddit.com/r/gaming/comments/1h6bsax/games_with_a_sense_of_longterm_progression_and/,https://www.reddit.com/r/gaming/comments/1h6bsax/games_with_a_sense_of_longterm_progression_and/,2024-12-04 08:57:24,27,0.69,27,0,119,0,0,False,False,True,False,False,,self,t3_1h6bsax
gaming,When you are not feeling the beat,,unbalancedbreakfast,1h5u8al,https://reddit.com/r/gaming/comments/1h5u8al/when_you_are_not_feeling_the_beat/,https://i.redd.it/7tnjtzk6fo4e1.jpeg,2024-12-03 18:25:55,327,0.92,327,0,29,0,0,False,False,False,False,False,,https://b.thumbs.redditmedia.com/EvGZJvZ1CUNh4NbqwChzfdTre_sqhplkzErSE0glqHQ.jpg,t3_1h5u8al
gaming,Official launch trailer. Indiana Jones and the Great Circle.,,bestest_at_grammar,1h5o8ea,https://reddit.com/r/gaming/comments/1h5o8ea/official_launch_trailer_indiana_jones_and_the/,https://youtu.be/TQOJCrQq6hs?si=94knLxqsd5Hf4V5L,2024-12-03 14:10:09,611,0.84,611,0,298,0,0,False,False,False,False,False,,https://b.thumbs.redditmedia.com/kfDRMButHCKw2xq0mBA1_6lbvYGIA9RenJTMvgC5ctA.jpg,t3_1h5o8ea
gaming,"What's going on with ""Delta Force""?","It's weird. I keep seeing images of a Delta Force game which seems to be a follow-up to the older Novalogic games... But it's got ""tacticool"" characters who look like something from a hero shooter.

What's going on with it?

Last time I checked in with this series, they made the sequel-in-all-but-name *Joint Operations: Typhoon Rising*, which was an amazing game - but these have all been quite realistic shooters that kinda pitched their flag halfway between Battlefield and ARMA.

The images I'm seeing of the new one are jarring.",ByEthanFox,1h773b2,https://reddit.com/r/gaming/comments/1h773b2/whats_going_on_with_delta_force/,https://www.reddit.com/r/gaming/comments/1h773b2/whats_going_on_with_delta_force/,2024-12-05 11:30:31,0,0.32,0,0,34,0,0,False,False,True,False,False,,self,t3_1h773b2
gaming,What game gives you a strong feeling of nostalgia and makes you remember everything that happened to you at the time when you were actively playing this game?,"I was recently surfing net when, out of nowhere, I decided to open ***Super Mario 64***. No real reason, just a random decision

The second the title screen appeared, I felt like I was a kid again. That familiar music, Mario’s face, the vibrant world - it all came rushing back. After a few minutes of gameplay I was literally hooked. Running around, hearing the old sound effects and all that stuff - everything felt so nostalgic

Then suddenly memories started flooding in. I remembered where I was when I first played it - the old couch in my living room, the excitement of my first time exploring the game, the friends I used to play it with after school. I hadn’t realized how much I missed it until I was already lost in the game. It was like no time had passed at all

**Do you have games that make you feel like that?**",rockzxm,1h66dxl,https://reddit.com/r/gaming/comments/1h66dxl/what_game_gives_you_a_strong_feeling_of_nostalgia/,https://www.reddit.com/r/gaming/comments/1h66dxl/what_game_gives_you_a_strong_feeling_of_nostalgia/,2024-12-04 03:17:40,49,0.79,49,0,152,0,0,False,False,True,False,False,,self,t3_1h66dxl
gaming,Musings on Video Gaming,"I’m over 65 and have been playing video games (badly) since my Intellevision days. I’m now using a PS5.
I have loved games such as The Last of Us, Days Gone, Zelda and so many more and I played almost every day especially since the ps3 days.
Recently my hands and wrists have gotten a little painful so I haven’t played in a few weeks. The thing is I don’t miss it. Right now as it stands if I never played again it wouldn’t kill me.
It made me wonder how many of us are playing for the love of gaming or because it’s become an easy habit to fall into.
When was the last time any of us stopped playing for a week just to catch our breath so to speak?
This is a hobby that can consume thousands of hours.Maybe we should set aside some of those hours in levelling ourselves up rather than our avatars. 
",TemperatureTime1617,1h67phc,https://reddit.com/r/gaming/comments/1h67phc/musings_on_video_gaming/,https://www.reddit.com/r/gaming/comments/1h67phc/musings_on_video_gaming/,2024-12-04 04:27:58,33,0.63,33,0,39,0,0,False,False,True,False,False,,self,t3_1h67phc
gaming,What's the most significant or memorable gaming content that's also entirely missable?,"When playing games that bother to fully flesh out their worlds, there must be so much you could complete a game without seeing or being signposted towards or lead through. Rockstar in particular seem to have entire areas, characters and plot points that you could in theory never experience.

What's the most compelling part of a game that you've experienced that you realised could have easily been missed?",danielgmal,1h6v1gk,https://reddit.com/r/gaming/comments/1h6v1gk/whats_the_most_significant_or_memorable_gaming/,https://www.reddit.com/r/gaming/comments/1h6v1gk/whats_the_most_significant_or_memorable_gaming/,2024-12-04 23:48:21,0,0.48,0,0,62,0,0,False,False,True,False,False,,self,t3_1h6v1gk
gaming,"Blizzard is delisting the OG Warcrafts from GOG, but GOG says it's gonna preserve them forever anyway, hands out a discount, and announces new policy for its preservation program to boot",,Former-Fix4842,1h52r8c,https://reddit.com/r/gaming/comments/1h52r8c/blizzard_is_delisting_the_og_warcrafts_from_gog/,https://www.pcgamer.com/software/platforms/blizzard-is-delisting-the-og-warcrafts-from-gog-but-gog-says-its-gonna-preserve-them-forever-anyway-hands-out-a-discount-and-announces-new-policy-for-its-preservation-program-to-boot/,2024-12-02 19:02:58,31462,0.96,31462,0,1452,0,0,False,False,False,False,False,,https://b.thumbs.redditmedia.com/VQ4Ymc2U9pq5_CoH26xa1jPi7jEDt_HbbVxmGM9Fk5Y.jpg,t3_1h52r8c
gaming,What are you playing Wednesday!,"What game's got your attention this week? What's great about it? What sucks? Tell us all about it! 

&amp;#x200B;

 This thread is posted weekly on Wednesdays (adjustments made as needed).",AutoModerator,1h6a7ql,https://reddit.com/r/gaming/comments/1h6a7ql/what_are_you_playing_wednesday/,https://www.reddit.com/r/gaming/comments/1h6a7ql/what_are_you_playing_wednesday/,2024-12-04 07:00:10,15,0.69,15,0,130,0,0,False,False,True,False,False,Weekly Play Thread,self,t3_1h6a7ql
gaming,Nether Portal I made with the new Minecraft Resin Blocks,,dancsa222,1h5oiic,https://reddit.com/r/gaming/comments/1h5oiic/nether_portal_i_made_with_the_new_minecraft_resin/,https://i.redd.it/3gtugcxu7n4e1.png,2024-12-03 14:23:06,284,0.88,284,0,22,0,0,False,False,False,False,False,,https://a.thumbs.redditmedia.com/LMEBl8eZbtRWs5vnPGSecidtZ1Gg7udz8kcL7Btifm0.jpg,t3_1h5oiic
gaming,"Open World Games For PS4 That Feel Drenched In Melancholy Despite Not Necessarily Being A ""Sad Story""?","I know this sort of question has been asked many times, but this is my spin on it. As the title says, I'm not looking for a game with a ""sad story"", but rather an open world game where the world, music, overall atmosphere, and the protagonist just feel drenched in a deep sense of melancholy/sadness. I think a good example of what I'm looking for is Red Dead Redemption 1... despite what happens in the end, I wouldn't necessarily consider it a ""sad story"", but rather a story that gives this overwhelming sense that the world is changing, the old ways are dying, and you are powerless to stop it. Just simply stopping to stand somewhere in the middle of the desert plains, and hearing the haunting music in RDR1 gives this feeling, like the whole game just has this constant, overhanging thick layer of melancholy, no matter where you go. In other words, it's as if the world itself is sad. 

I hope you understand what I mean by all this. Any open world game suggestions like this on PS4 would be greatly appreciated!",701921225,1h6yro1,https://reddit.com/r/gaming/comments/1h6yro1/open_world_games_for_ps4_that_feel_drenched_in/,https://www.reddit.com/r/gaming/comments/1h6yro1/open_world_games_for_ps4_that_feel_drenched_in/,2024-12-05 02:43:27,0,0.48,0,0,58,0,0,False,False,True,False,False,,self,t3_1h6yro1
gaming,What are some irl games that exist inside other games,"Sometimes well playing a game you find other games left as easter eggs and sometimes they are even playable.

Off the top of my head here are some I can Think of:
Classic Doom in Doom Eternal: well in 2016 you can play a lot of the classic levels, they are all in a separate menu so out of universe but in Doom Eternal, you access them in universe in Doomguy’s computer inside his fortress

Crash in Uncharted: in the first few chapters of Uncharted 4 you get to a part where Elena tries to get Nate into a PS1 game she really likes and it happens to be Crash Bandicoot.

Classic Activition Games in Call of Duty Cold War: in Cold War there is a section where you go through a mock city used by the russians to train for a US ground invasion. In this mock city you can find arcades with classic activition games.

Those are the 3 I can think of, I also thought of the classic levels in Wolfenstein but those are see as nightmares so they don’t actually exist in universe but what are some others you guys can think of??",Plastic-Fly9455,1h5snb4,https://reddit.com/r/gaming/comments/1h5snb4/what_are_some_irl_games_that_exist_inside_other/,https://www.reddit.com/r/gaming/comments/1h5snb4/what_are_some_irl_games_that_exist_inside_other/,2024-12-03 17:20:51,146,0.88,146,0,220,0,0,False,False,True,False,False,,self,t3_1h5snb4
gaming,what are some video game sequels that would have been better off as a spinoff than a sequel.,i feel like Last of Us 2 would have been better as a anthology spinoff as I felt stories set in the Last of us universe for the perspective of other people's lives in the apocalypse sound more interesting tbh.,frogboss4020,1h737sz,https://reddit.com/r/gaming/comments/1h737sz/what_are_some_video_game_sequels_that_would_have/,https://www.reddit.com/r/gaming/comments/1h737sz/what_are_some_video_game_sequels_that_would_have/,2024-12-05 06:50:07,0,0.36,0,0,45,0,0,False,False,True,False,False,,self,t3_1h737sz
gaming,Am I crazy or did they just...,"They got no chill, going for two at once. Correct me if I am wrong but this moveset looks oddly familiar as well. 
(&gt;!Elden Ring - Falling Star Beast!&lt;)
I mean, taking inspiration is one thing, straight up copying is just maidenless behaviour at this point.

Video link: https://imgur.com/a/ICMXQo4
It's just clip snippet of their steam page trailer.

Edit: Ok guys, I got the point, I made this post way more dramatic than it is. I am just pointing it out...",Hammadforreal,1h791i2,https://reddit.com/r/gaming/comments/1h791i2/am_i_crazy_or_did_they_just/,https://www.reddit.com/r/gaming/comments/1h791i2/am_i_crazy_or_did_they_just/,2024-12-05 13:21:51,0,0.25,0,0,15,0,0,False,False,True,False,False,,self,t3_1h791i2
gaming,Sunright Boba is doing a collab with Omori,They make it seem so bright and bubbly when Omori is anything but! ,VinTheHuman,1h61gns,https://reddit.com/r/gaming/comments/1h61gns/sunright_boba_is_doing_a_collab_with_omori/,https://i.redd.it/cg3fti4ewp4e1.jpeg,2024-12-03 23:24:12,40,0.67,40,0,9,0,0,False,False,False,False,False,,https://b.thumbs.redditmedia.com/c29BExafhh6auLnmBcxRmljZEBMdcd_6JKBSOVA7rQY.jpg,t3_1h61gns
gaming,Which gaming community is suffering the most? 😭,"Is it:

1. The Hollow Knight Silk Song fans
2. Grand Theft Auto VI fans
3. The Bloodborne community

Feel free to debate in the comments as to why.",Afsan23,1h77s3b,https://reddit.com/r/gaming/comments/1h77s3b/which_gaming_community_is_suffering_the_most/,https://www.reddit.com/r/gaming/comments/1h77s3b/which_gaming_community_is_suffering_the_most/,2024-12-05 12:12:20,0,0.25,0,0,65,0,0,False,False,True,False,False,,self,t3_1h77s3b
gaming,"A Black Ops 6 player allegedly abused an AFK Zombies glitch and left his Xbox on for over a month to become the first Prestige level 1000 player
",,ChiefLeef22,1h4wacg,https://reddit.com/r/gaming/comments/1h4wacg/a_black_ops_6_player_allegedly_abused_an_afk/,https://www.ign.com/articles/row-over-call-of-duty-black-ops-6-player-who-used-zombies-exploits-to-become-first-to-hit-prestige-master-level-1000-and-reveal-rewards,2024-12-02 14:33:47,26568,0.95,26568,0,950,0,0,False,False,False,False,False,,https://b.thumbs.redditmedia.com/QpFoLEXv8gFpoWuVRdc5ZOZDu39SqnvYQW0MI21Xr0E.jpg,t3_1h4wacg
gaming,"October 2024 Worldwide Console Sales PS5 11.19M, Nintendo Switch 7.59M, Xbox Series X|S 3.25M",,Imaginary_Cause2216,1h5p32y,https://reddit.com/r/gaming/comments/1h5p32y/october_2024_worldwide_console_sales_ps5_1119m/,https://www.vgchartz.com/article/463156/ps5-vs-xbox-series-xs-vs-switch-2024-worldwide-sales-comparison-charts-through-october/,2024-12-03 14:49:31,116,0.76,116,0,143,0,0,False,False,False,False,False,,https://b.thumbs.redditmedia.com/IMwJgEj6l6W6E_xB4JCrV77opQFyH1pQXZ48PtJK9es.jpg,t3_1h5p32y
gaming,What are some video games that take place around Christmas,"I was talking to friend I came up with Bayonetta 2, Batman Arkham Origins, maybe Stardew",lotp22,1h6vt20,https://reddit.com/r/gaming/comments/1h6vt20/what_are_some_video_games_that_take_place_around/,https://www.reddit.com/r/gaming/comments/1h6vt20/what_are_some_video_games_that_take_place_around/,2024-12-05 00:22:38,0,0.42,0,0,40,0,0,False,False,True,False,False,,self,t3_1h6vt20
gaming,Got $100 Target Gift Card - What To Get,"This is a hard one for me because I just get PS+ Premium yearly with my Playstation. New games, I just borrow from the library. Also have a Switch where I borrow games from the library. Cannot buy gift cards with it...

Was thinking Silent Hill because its only 30 with price match... but idk. Also have a Quest 3s. The only item I can think of is save for GTA6 because that will never be on Plus and the library line will be 5 miles long.",Money_Tough,1h6zs1r,https://reddit.com/r/gaming/comments/1h6zs1r/got_100_target_gift_card_what_to_get/,https://www.reddit.com/r/gaming/comments/1h6zs1r/got_100_target_gift_card_what_to_get/,2024-12-05 03:33:19,0,0.2,0,0,14,0,0,False,False,True,False,False,,self,t3_1h6zs1r
gaming,Roblox tries to skirt app store fees by making Robux worth more on other platforms.,,SUPRVLLAN,1h54mjw,https://reddit.com/r/gaming/comments/1h54mjw/roblox_tries_to_skirt_app_store_fees_by_making/,https://www.theverge.com/2024/12/2/24311337/roblox-robux-app-store-fees-worth-more-party,2024-12-02 20:19:04,2717,0.96,2717,0,127,0,0,False,False,False,False,False,,https://b.thumbs.redditmedia.com/7p5GFhIFn0Oz8AV2Mu2CHbZqWcaBZHEisUXVp8Jr2Vs.jpg,t3_1h54mjw
