subreddit,title,selftext,author,id,permalink,url,created_utc,score,upvote_ratio,ups,downs,num_comments,total_awards_received,gilded,is_video,is_original_content,is_self,over_18,spoiler,link_flair_text,thumbnail,name
gaming,The most 2009 video game choice,,JustTrollingYou,1h634lo,https://reddit.com/r/gaming/comments/1h634lo/the_most_2009_video_game_choice/,https://i.imgur.com/6xKo70k.png,2024-12-04 00:38:17,6858,0.94,6858,0,418,0,0,False,False,False,False,False,,https://b.thumbs.redditmedia.com/4zajYl4iqlP4SZV4CckPDzq_8PTQwiUMOYfs4fkwsaw.jpg,t3_1h634lo
gaming,The most 2009 video game choice ,inFamous ,NoLastNameForNow,1h5xa7d,https://reddit.com/r/gaming/comments/1h5xa7d/the_most_2009_video_game_choice/,https://i.redd.it/i1sxq8f61p4e1.jpeg,2024-12-03 20:29:12,23740,0.95,23740,0,851,0,0,False,False,False,False,False,,https://a.thumbs.redditmedia.com/ZV7OwEK-PGhBvLreJb-CIULoDZsUOdiNp7csrb6-cb0.jpg,t3_1h5xa7d
gaming,What game has the biggest issue with money being worthles?,"Money makes the world go round, but in many video game worlds, it often ends up worthless, so monetary rewards can end up moot.

The Legend of Zelda series has a recurring problem, the worst cases I have seen are Breath of the Wild and Echoes of Wisdom (I haven't played Tears yet). Despite Breath of the Wild not having money you can find by cutting grass, you still end up with more than you'll ever need because you can sell virtually anything you come across. I often ended up netting a profit from shopping by selling a fraction of the stuff you collect. The are items for sale you can use in cooking, and I didn't buy most of them because the stuff I found worked fine.

The most annoying part for me was that shops did sell special arrows except they quit restocking them if you had enough in your inventory so I was better off find enemies to get more. Past the early game I didn't need money for anything besides upgrading armor and quests.

Echoes of Wisdom has health items for sale, that there isn't a ton of need for when you can use a bed to recover your health for free.

However, the worst case I have seen is Xenoblade 3. This is a JRPG where you don't buy weapons or armor. Like its predecessors, you also heal out of combat, KOed characters revive after a fight, and in this game, your healers can be revived KOed characters an unlimited number of times during a fight. As a result, a lot of commonly seen RPG items aren't in this game removing a lot you can spend money on.

There are items for sale you can use in quests and cooking, I got buy without needing to use the cooking mechanic and for the most you can find items for quests without spending any money. The accessories for sale have use on paper except exploring the map almost always let to better ones.

The Land of Challenge DLC was the final nail in the coffin since while it does require grinding resources there you can get better stuff for clearing its challenges than from shops.

None of this makes these games bad, it just feels weird to carry around so much cash and not have a use for it.",Sensitive-Hotel-9871,1h6g2sj,https://reddit.com/r/gaming/comments/1h6g2sj/what_game_has_the_biggest_issue_with_money_being/,https://www.reddit.com/r/gaming/comments/1h6g2sj/what_game_has_the_biggest_issue_with_money_being/,2024-12-04 13:32:56,479,0.86,479,0,605,0,0,False,False,True,False,False,,self,t3_1h6g2sj
gaming,"Kingdom Come: Deliverance 2 will offer 60fps on PS5/XSX, new release date February 4th",,Paul_cz,1h6lhv2,https://reddit.com/r/gaming/comments/1h6lhv2/kingdom_come_deliverance_2_will_offer_60fps_on/,https://x.com/WarhorseStudios/status/1864354217139314820,2024-12-04 17:19:08,234,0.93,234,0,54,0,0,False,False,False,False,False,,https://b.thumbs.redditmedia.com/Yqj1Xg20dPCWRxPupknxYwo9FH1Wfw25m7VSYolhdzM.jpg,t3_1h6lhv2
gaming,What's a habit that you have in multiple different games,My roommate has to unlock every fast travel location as soon as physically possible in every game he plays. When he played Tears of the Kingdom he spent 20 hours going around all of the map unlocking stuff. What's something you are compelled to do no matter what game it is?,lordlemming,1h6g8lr,https://reddit.com/r/gaming/comments/1h6g8lr/whats_a_habit_that_you_have_in_multiple_different/,https://www.reddit.com/r/gaming/comments/1h6g8lr/whats_a_habit_that_you_have_in_multiple_different/,2024-12-04 13:40:31,418,0.91,418,0,672,0,0,False,False,True,False,False,,self,t3_1h6g8lr
gaming,A map of my 1:1 fictional Minecraft City after nearly 5 years of work. 2024 update. ,,KanyeWaste69,1h679mu,https://reddit.com/r/gaming/comments/1h679mu/a_map_of_my_11_fictional_minecraft_city_after/,https://i.redd.it/fmzvjeqs9r4e1.png,2024-12-04 04:03:46,2155,0.95,2155,0,88,0,0,False,False,False,False,False,,https://b.thumbs.redditmedia.com/sX47EVVxir4Thn80U-mWvl_kcA_xvQt7VcJEcnJCpBk.jpg,t3_1h679mu
gaming,What are some good Christmasy games ?,"Currently replaying Arkham Origins, and it made me think that there aren't many games set around the holiday season. What do you play for the xmas vibes? World of warcraft always reminds me of Christmas, especially Wotlk. Also Skyrim. Anything with snow.",treefruit,1h6zmxz,https://reddit.com/r/gaming/comments/1h6zmxz/what_are_some_good_christmasy_games/,https://www.reddit.com/r/gaming/comments/1h6zmxz/what_are_some_good_christmasy_games/,2024-12-05 03:25:58,25,0.72,25,0,85,0,0,False,False,True,False,False,,self,t3_1h6zmxz
gaming,Ubisoft Now Allows Rewards Points to be used on Pre-Orders and New Release Titles,"Ubisoft Now Allows Rewards Points to be used on Pre-Orders and New Release Titles as of December 5th

Seems like a reaction to losing money?

https://preview.redd.it/13mekbeuz65e1.png?width=2377&amp;format=png&amp;auto=webp&amp;s=0ce433330727c96b9a6517301c2fce214dd4e3b4

",FOXYRAZER,1h7x62p,https://reddit.com/r/gaming/comments/1h7x62p/ubisoft_now_allows_rewards_points_to_be_used_on/,https://www.reddit.com/r/gaming/comments/1h7x62p/ubisoft_now_allows_rewards_points_to_be_used_on/,2024-12-06 08:53:32,0,0.38,0,0,9,0,0,False,False,True,False,False,,https://a.thumbs.redditmedia.com/4T6OkfhGdFnIRuEbgmn37pLKQ3Yvhr0Ig5GmjNPDe_8.jpg,t3_1h7x62p
gaming,How to deal with gaming FOMO?,"I can never focus on one game at a time. When I play one, i’m already thinking about others I want to play or replay, and because of that, i can’t really enjoy any of them… any tips?",Edu_Vivan,1h7xu7t,https://reddit.com/r/gaming/comments/1h7xu7t/how_to_deal_with_gaming_fomo/,https://www.reddit.com/r/gaming/comments/1h7xu7t/how_to_deal_with_gaming_fomo/,2024-12-06 09:44:37,0,0.39,0,0,43,0,0,False,False,True,False,False,,self,t3_1h7xu7t
gaming,This should be on the list of remakes ,,Essa_ea,1h6r84r,https://reddit.com/r/gaming/comments/1h6r84r/this_should_be_on_the_list_of_remakes/,https://i.redd.it/kcdrpwaycw4e1.jpeg,2024-12-04 21:07:41,78,0.73,78,0,57,0,0,False,False,False,False,False,,https://b.thumbs.redditmedia.com/nwYIz5021gZDECz8Rsmc0Vwh14tuV4t3zUOUWKOOzIE.jpg,t3_1h6r84r
gaming,"Currently sitting at 86/100, if this holds, Indiana Jones and the Great Circle will have a higher Metacritic score than all but FOUR Star Wars video game titles released in the past three decades","2003 (XBOX) Star Wars: Knights of the Old Republic -  94

1997 (PC) Star Wars Jedi Knight: Dark Forces II - 91

2001 (GC) Star Wars Rogue Leader: Rogue Squadron II - 90

2002 (PC) Star Wars Jedi Knight II: Jedi Outcast - 89

2024 (XSX) Indiana Jones and the Great Circle - 86

2004 (XBOX) Star Wars: Knights of the Old Republic II - The Sith Lords - 86

2023 (PS5) Star Wars Jedi Survivor - 85

2011 (PC) Star Wars The Old Republic - 85

1998 (N64) Star Wars Rogue Squadron 3D - 85

Per Metacritic - [https://www.metacritic.com/search/star%20wars/?page=1&amp;category=13&amp;sortBy=META\_SCORE](https://www.metacritic.com/search/star%20wars/?page=1&amp;category=13&amp;sortBy=META_SCORE)

",TheEmeraldRaven,1h7wv3w,https://reddit.com/r/gaming/comments/1h7wv3w/currently_sitting_at_86100_if_this_holds_indiana/,https://www.reddit.com/r/gaming/comments/1h7wv3w/currently_sitting_at_86100_if_this_holds_indiana/,2024-12-06 08:30:14,0,0.37,0,0,18,0,0,False,False,True,False,False,,self,t3_1h7wv3w
gaming,Purchased sonic 3D blast before it’s gone for good (or sm) ,"Sega can be sorta cool and release cool games, and then cruel and take shit away",ZenKoko,1h7ude8,https://reddit.com/r/gaming/comments/1h7ude8/purchased_sonic_3d_blast_before_its_gone_for_good/,https://www.reddit.com/r/gaming/comments/1h7ude8/purchased_sonic_3d_blast_before_its_gone_for_good/,2024-12-06 05:39:34,0,0.32,0,0,11,0,0,False,False,True,True,False,,nsfw,t3_1h7ude8
gaming,I gathered all my controllers! Pretty grateful for my gaming journey. (my mother sold my N64 when I was a kid :( ),,6Kaliba9,1h6vens,https://reddit.com/r/gaming/comments/1h6vens/i_gathered_all_my_controllers_pretty_grateful_for/,https://i.redd.it/ahn6xijh8x4e1.jpeg,2024-12-05 00:04:25,21,0.6,21,0,18,0,0,False,False,False,False,False,,https://a.thumbs.redditmedia.com/PFDnCn3Kv6UAsc9nPXCECmcAGWQpaAr8TB6b3t26eu4.jpg,t3_1h6vens
gaming,The Pokémon TCGP experience ,,TheSpectacularBagMan,1h6cswa,https://reddit.com/r/gaming/comments/1h6cswa/the_pokémon_tcgp_experience/,https://i.redd.it/xc54xzzd4t4e1.png,2024-12-04 10:14:19,285,0.85,285,0,104,0,0,False,False,False,False,False,,https://b.thumbs.redditmedia.com/jLldjrOoX_L-ffkll80ZDw0UUFqg-DZ3cYwC3yFg1eI.jpg,t3_1h6cswa
gaming,"Former PlayStation exec says there's a ""collapse of creativity"" in the industry","&gt;""Today, the entry costs for making a AAA game is in triple digit millions now,"" he continued. ""I think naturally, risk tolerance drops. And you're [looking] at sequels, you're looking at copycats, because the finance guys who draw the line say, 'Well, if Fortnite made this much money in this amount of time, my Fortnite knockoff can make this in that amount of time.' We're seeing a collapse of creativity in games today [with] studio consolidation and the high cost of production.""

Sequels and requels; the Disney™️ accountant model. ",rematar,1h5q5ib,https://reddit.com/r/gaming/comments/1h5q5ib/former_playstation_exec_says_theres_a_collapse_of/,https://www.eurogamer.net/former-playstation-exec-says-theres-a-collapse-of-creativity-in-the-industry,2024-12-03 15:35:00,11024,0.95,11024,0,1480,0,0,False,False,False,False,False,,https://b.thumbs.redditmedia.com/CnxzdyRaKnHUyz5JBPPI9MI7Jnj4kQhQTDwQCLcOj0Y.jpg,t3_1h5q5ib
gaming,How do I fill the hole that finishing Titanfall 2 left in me?,"After a lot of recommendations, I bought Titanfall 2 this steam sale. What I didn't know is how short this game is. As I started to become accustomed to it's gameplay and mechanics especially controlling the Titan, it ended and man i haven't been this disappointed in a while. I was really enjoying the mission design, the unique platforming, the dynamic between BT and pilot and ther overall badass feeling of controlling a giant mech.

Unfortunately for me though, I can really play online multiplayer as I don't think there are SEA servers for this game. 

Anyways I was hoping you guys could recommend me some games which offer the same unique gameplay as Titanfall 2.

Really appreciate your suggestions..",Top_Distribution_497,1h6ib47,https://reddit.com/r/gaming/comments/1h6ib47/how_do_i_fill_the_hole_that_finishing_titanfall_2/,https://www.reddit.com/r/gaming/comments/1h6ib47/how_do_i_fill_the_hole_that_finishing_titanfall_2/,2024-12-04 15:11:26,96,0.69,96,0,177,0,0,False,False,True,False,False,,self,t3_1h6ib47
gaming,What game to play while quarantined?,"For the first time, I’ve contracted COVID (and man does it suck). So I figured while I’m quarantining in my office/man cave, I might as well finish one of the games that I have put off for years. So, what would you guys recommend? The options are:

Death Stranding

Cyberpunk 2077

Returnal

Thanks for your suggestions!

Edit: fixed formatting. Realized the options I listed were in-line instead of on separate lines. ",slicklikeagato,1h7rcud,https://reddit.com/r/gaming/comments/1h7rcud/what_game_to_play_while_quarantined/,https://www.reddit.com/r/gaming/comments/1h7rcud/what_game_to_play_while_quarantined/,2024-12-06 02:54:05,0,0.3,0,0,26,0,0,False,False,True,False,False,,self,t3_1h7rcud
gaming,I'm tired of compiling shaders ,"Legit every game now. 

Stalker 2 takes 5+min to launch because of these damn shaders. Like, why tf wasn't this done already? I don't remember having to do this 5+ years ago, and I honestly don't feel like this shit makes me enjoy games more. ",dtv20,1h7r5bk,https://reddit.com/r/gaming/comments/1h7r5bk/im_tired_of_compiling_shaders/,https://www.reddit.com/r/gaming/comments/1h7r5bk/im_tired_of_compiling_shaders/,2024-12-06 02:43:10,0,0.41,0,0,35,0,0,False,False,True,False,False,,self,t3_1h7r5bk
gaming,PlayStation Has Had A GOTY Nominee Every Single Year In The Last Decade,,Imaginary_Cause2216,1h5mnet,https://reddit.com/r/gaming/comments/1h5mnet/playstation_has_had_a_goty_nominee_every_single/,https://i.redd.it/uwpze1q4rm4e1.jpeg,2024-12-03 12:49:23,14649,0.86,14649,0,1604,0,0,False,False,False,False,False,,https://a.thumbs.redditmedia.com/pFhLvEvse4VUnd0zApACJMuPEIzrzVimuhlnxdUE1U0.jpg,t3_1h5mnet
gaming,why in 2025 is asdw still the default keyboard binding for movement!?,This has literally been annoying me for more than 35 years! I understand back in the day keyboards didn't have arrow keys but for literal decades after we get the arrow keys it's lunacy to keep using asdw. I have to re-bind every damn game. I'll be doing it when I'm 90 I bet.,wizardyourlifeforce,1h83v57,https://reddit.com/r/gaming/comments/1h83v57/why_in_2025_is_asdw_still_the_default_keyboard/,https://www.reddit.com/r/gaming/comments/1h83v57/why_in_2025_is_asdw_still_the_default_keyboard/,2024-12-06 15:27:47,0,0.02,0,0,74,0,0,False,False,True,False,False,,self,t3_1h83v57
gaming,[RANT] I need a new open world pirate game!,"I want to catch the horizon. I want to feel lonely. I want to sail between wind and tide. And then I want action, islands to explore, treasure to loot. I want NMS on the water. Give me a near accurate map of the Caribbean and enough control without being a full on simulator; I don't need to know what every rope does. Maybe I'm a merchant, maybe I'm a pirate, privateer, navy sailor... Give me something! [END RANT]

fuck.... I'm about to play Black Flag again....",TiresOnFire,1h6yj7k,https://reddit.com/r/gaming/comments/1h6yj7k/rant_i_need_a_new_open_world_pirate_game/,https://www.reddit.com/r/gaming/comments/1h6yj7k/rant_i_need_a_new_open_world_pirate_game/,2024-12-05 02:32:05,9,0.55,9,0,43,0,0,False,False,True,False,False,,self,t3_1h6yj7k
gaming,"Indiana Jones and the Great Circle PC system requirements, these are some hefty specs....",,Lo_jak,1h5zljg,https://reddit.com/r/gaming/comments/1h5zljg/indiana_jones_and_the_great_circle_pc_system/,https://i.redd.it/j2ljxz4aip4e1.jpeg,2024-12-03 22:05:04,1297,0.91,1297,0,873,0,0,False,False,False,False,False,,https://b.thumbs.redditmedia.com/ZYwW7iVNuobHrcNPe7RzPEXR6s6mj89hDQJVptcL9Mw.jpg,t3_1h5zljg
gaming,Season 0: Dooms' Rise Official Trailer | Marvel Rivals,,critxcanuck88,1h7mnkz,https://reddit.com/r/gaming/comments/1h7mnkz/season_0_dooms_rise_official_trailer_marvel_rivals/,https://youtube.com/watch?v=jyCJbGUsUkc&amp;si=ZdRttYJB6Q4TLF1T,2024-12-05 23:06:49,0,0.44,0,0,9,0,0,False,False,False,False,False,,https://b.thumbs.redditmedia.com/4TxwPqnPimUZzibCIBw23AwYJ2VRoSuGoCp1NAG7o_I.jpg,t3_1h7mnkz
gaming,"For a game where most of it occurs well above 3,000 feet, the ground level of detail in Flight Simulator 2024 is insane.",,Alc2005,1h5pgcz,https://reddit.com/r/gaming/comments/1h5pgcz/for_a_game_where_most_of_it_occurs_well_above/,https://i.redd.it/m0lnvva0cn4e1.jpeg,2024-12-03 15:05:13,4090,0.97,4090,0,121,0,0,False,False,False,False,False,,https://b.thumbs.redditmedia.com/39nm9N8fQG6vRfSViESYIl-cHvsv3RO2t3DAcwWJIPI.jpg,t3_1h5pgcz
gaming,What's a game with really bad gameplay that you still liked and enjoyed?,"Name a game where the gameplay was awful but you still enjoyed it. What made you still like it in the end?

I just finished Alan Wake 2 which gave me the idea for this question. ""Liked"" might have been too strong  a word for it. ""Tolerable"" might be more accurate.",bustymcnutters,1h7l9xi,https://reddit.com/r/gaming/comments/1h7l9xi/whats_a_game_with_really_bad_gameplay_that_you/,https://www.reddit.com/r/gaming/comments/1h7l9xi/whats_a_game_with_really_bad_gameplay_that_you/,2024-12-05 22:06:36,0,0.39,0,0,80,0,0,False,False,True,False,False,,self,t3_1h7l9xi
gaming,"30 years, but it seems like yesterday",,Kvra,1h5pzgd,https://reddit.com/r/gaming/comments/1h5pzgd/30_years_but_it_seems_like_yesterday/,https://i.redd.it/dyr79zvbjn4e1.jpeg,2024-12-03 15:27:53,3434,0.96,3434,0,110,0,0,False,False,False,False,False,,https://b.thumbs.redditmedia.com/749PXMLVlaR9RArJQYBobGSxFpVjvR8h1BYvRvs_-gI.jpg,t3_1h5pzgd
gaming,This is wrong - Roblox,This is aimed at kids. Children. What child should be spending £199.99 on Robux? This is just predatory behaviour. There needs to be a change in the gaming industry. Suits shouldn’t have so much power that it will end up affecting people’s psyche in the future. I dread to think how kids will act in twenty years having grown up with this.,TheYokoDono,1h7pbuh,https://reddit.com/r/gaming/comments/1h7pbuh/this_is_wrong_roblox/,https://i.redd.it/78648fr7p45e1.jpeg,2024-12-06 01:10:39,0,0.34,0,0,12,0,0,False,False,False,False,False,,https://b.thumbs.redditmedia.com/T3I-Em2GwA_3XBN-VRMoOmnGALu_bIP4bALS1OhIwGU.jpg,t3_1h7pbuh
gaming,Quick review of (almost) all current mini bluetooth controllers!,"Images here: https://imgur.com/a/SZ3VbEy


I love local multiplayer and the easiest way to find people for it is on the go. Lugging around proper full size controllers* would be a chore, and with micro size I can always have even 4 without thinking.

So for starters: my use case is quick plays, 30-90 minutes. Using these regularly for long time would get uncomfortable (and carpal-tunnely I suppose).

The landscape of small controllers is pretty dire to be honest: 8BitDo (for a long time the only option) and rando chinese suppliers.



**8BitDo Lite 2**

It has every button from a classic PS/Xbox layout - including stick click/L3+R3. High quality plastics. Shoulder and trigger button placement is genius and usable. Joystick has a good movement area. Clicks and presses are exquisite. Size is great for the hand, and still light. This is the one controller I could imagine being usable in daily gaming even.

This would be my dream controller. IF it had XInput. Unrelated, but I'm mighty pissed at 8BitDo for not including this with newer models. Yes, these are all aimed for the Switch, but it would have costed next to nothing to add one more mode. Vibration also only works in Switch mode. Yes you can remap with XOutput and the like, but it's a hassle and strangely does not work in every game.

Modes: Switch, Android
Verdict: so close to be perfect, but not reaching it


**8BitDo Zero 2**

My current go-to mini controller. Has XInput. Sadly charges via micro usb (all other are usb-c). No vibration. Buttons feel right. The L/R button is clickable from all directions despite the length, but not really comfortable - which isn't a problem, this size is only used for simple layout games anyway. I wish it would have toggle for modes, there is no visible sign in which it is (toggle is via shortcut combinations).

There is now also a Micro with the same layout as the Q36 below - not ordered becaus missing XInput and I had enough of that after Lite 2)

Modes: Switch, Android, Windows
Verdict: ol' trusty working horse, shows it's age

**LinYuvo Meteor**

Now this is an interesting animal. You can order it for less than half the zero. It has bajillions of color options - I suggest ordering the covered ones, as the LEDs are so bright that you wouldn't want to use them on transparent versions, despite them looking cool as well. It has a circular dpad which I'm neutral about. For some it's easier to hit corners, but it's not as easy as eg. XBox controller's circular one. But it's really clicky, and a bit hard to press, as you can read in the few reviews it has. So dpad is certainly it's biggest drawback. Has vibration. It has a really interesting feature, you can replace keys - dpad with joystick directions and L/R buttons with trigger - without any software, just shortcuts! You can also toggle the light effects and colors, there are quite a few, as gimmick, or turn it off completely (will be remembered).

Verdict: price/features orders of magnitude better than the Zero 2, even Micro. Buttons just don't feel that good, but it's a close call.

**ShanWan Q37**

There exists a version with horizontal and cross (PS and XBox style) joystick placement. You can tell they used CADs from 8BitDo, the inputs have the same appearance - albeit with a very, very cheap plastic. The rounded off body is a bit smaller but thicker and overall harder to hold. But the presses feel ok. There is vibration - both sides even. It has a weird gyro mode in non-switch mode as well where gyro controls the joystick. Can be accidentally triggered and a useless gimmick. But a very welcomed feature is that every single key can be remapped (including this shortcut). It needs a seemingly unrelated mobile app (""GamepadSpace"") - connecting is hacky as you need to enter firmware upload mode - but once done, you are free to customize, even sensitivity, and everything is saved to the controller. This is great, especially since very stupidly in XInput mode the buttons match the switch layout (eg A is B) by default. Until now you would think this is in the endvery ok controller, but you'd be mistaken. Sadly it all falls apart by how incredibly bad quality this controller is. You will get constant disconnects, lag, ghost presses and stuck input. It's just bad, and generic QC issue. I had multiple controllers showing the same sign.

Verdict: It could be the ""good version"" rip-off of 8BitDo, but sadly it's just a mess, and costs the same as 8BitDo.


Modes: Windows/Android, Switch, Playstation

**ShanWan Q36**

The same as Q37, just with copying the 8BitDo Micro form and layout - which makes it even more sad that it's bad.

Modes: Windows/Android, Switch, Playstation


**Keychain controller**

Being available for 8+ years this is more like an afterthought rather than a serious contender, I included it only for fun. But it's by far the smallest you can go! It only has Android and keyboard function. The ""joystick"" is actually moving only on a 2D plane. Very practical and interesting, but a bit hard to move. Buttons are too mushy. But it is useful as a remote, eg. A is mapped to take a photo in Android.

Modes: IOS/Android, Keyboard",poisonborz,1h6svb8,https://reddit.com/r/gaming/comments/1h6svb8/quick_review_of_almost_all_current_mini_bluetooth/,https://www.reddit.com/r/gaming/comments/1h6svb8/quick_review_of_almost_all_current_mini_bluetooth/,2024-12-04 22:15:09,9,0.6,9,0,2,0,0,False,False,True,False,False,,self,t3_1h6svb8
gaming,What’s a small feature in a game that made it way more immersive for you?,"I’ve been playing a lot of games recently, and I’ve realized how small details can make or break immersion. For example, seeing wet footprints fade on a rainy sidewalk in Sleeping Dogs really stuck with me. What’s your favorite little detail that enhanced your experience?",m2104,1h6mvz7,https://reddit.com/r/gaming/comments/1h6mvz7/whats_a_small_feature_in_a_game_that_made_it_way/,https://www.reddit.com/r/gaming/comments/1h6mvz7/whats_a_small_feature_in_a_game_that_made_it_way/,2024-12-04 18:13:27,15,0.66,15,0,114,0,0,False,False,True,False,False,,self,t3_1h6mvz7
gaming,"Path of Exile 2, and a recent trend in gaming","It seems like Path of Exile 2 is shaping up to follow in the footsteps of Elden Ring and Baldur's Gate 3, a game in a more niche genre, that doubles down on the things people love about that genre, and finds mainstream success by virtue of it being really, really good. Even Metaphor: Re Fantazio sort of fits into that catagory, although I think it's a littke more refined than Persona. And it's got me thinking about how some of the bigger failures of the past few years were games that tried for the broadest appeal possible, and ended up being super bland and forgettable in doing so. Games like Suicide Squad and Star Wars Outlaws. There's nothing really wrong with those games, there's just nothing that makes them stand out.",thewalkindude,1h5vyez,https://reddit.com/r/gaming/comments/1h5vyez/path_of_exile_2_and_a_recent_trend_in_gaming/,https://www.reddit.com/r/gaming/comments/1h5vyez/path_of_exile_2_and_a_recent_trend_in_gaming/,2024-12-03 19:36:26,801,0.83,801,0,413,0,0,False,False,True,False,False,,self,t3_1h5vyez
gaming,T-45 Power Armor cosplay from Fallout ,,Zoidberrg,1h5vf9a,https://reddit.com/r/gaming/comments/1h5vf9a/t45_power_armor_cosplay_from_fallout/,https://i.redd.it/lumljw5xno4e1.jpeg,2024-12-03 19:15:10,821,0.84,821,0,44,0,0,False,False,False,False,False,,https://b.thumbs.redditmedia.com/iStyB_zCy9wUjr9OQ5pwCWMZ6dylHpIuejYjuY5Z2lM.jpg,t3_1h5vf9a
