subreddit,title,selftext,author,id,permalink,url,created_utc,score,upvote_ratio,ups,downs,num_comments,total_awards_received,gilded,is_video,is_original_content,is_self,over_18,spoiler,link_flair_text,thumbnail,name
gaming,Free Talk Friday!,"Use this post to discuss life, post memes, or just talk about whatever! 

This thread is posted weekly on Fridays (adjustments made as needed).",AutoModerator,1h7vmtl,https://reddit.com/r/gaming/comments/1h7vmtl/free_talk_friday/,https://www.reddit.com/r/gaming/comments/1h7vmtl/free_talk_friday/,2024-12-06 07:00:11,3,0.64,3,0,25,0,0,False,False,True,False,False,Weekly Free Talk Thread,self,t3_1h7vmtl
gaming,The Nostalgia,,Odd_Pirate_8756,1h7s0hs,https://reddit.com/r/gaming/comments/1h7s0hs/the_nostalgia/,https://i.redd.it/6geo54vid55e1.jpeg,2024-12-06 03:26:55,51817,0.9,51817,0,378,0,0,False,False,False,False,False,,https://a.thumbs.redditmedia.com/H95dn-HxIDTR74d3wqeeblBDk9tFviUIflN8q0ckeJ0.jpg,t3_1h7s0hs
gaming,Ex-Rockstar dev reveals truth about GTA 6 trailer “conspiracy theories”,,Healthy-Career7226,1h81bdi,https://reddit.com/r/gaming/comments/1h81bdi/exrockstar_dev_reveals_truth_about_gta_6_trailer/,https://www.dexerto.com/gta/ex-rockstar-dev-reveals-truth-about-gta-6-trailer-conspiracy-theories-2999820/,2024-12-06 13:26:59,791,0.88,791,0,173,0,0,False,False,False,False,False,,https://b.thumbs.redditmedia.com/tu35BIWUJyT4Pn2qh07SZyx8Ls4TwdInXi12JLif3qI.jpg,t3_1h81bdi
gaming,"Everyone talking about the Indiana Jones game lately, so I gave in and bought it. This is great!",,d0ggzilla,1h7y86n,https://reddit.com/r/gaming/comments/1h7y86n/everyone_talking_about_the_indiana_jones_game/,https://i.redd.it/9kdkpgxod75e1.jpeg,2024-12-06 10:13:17,1310,0.95,1310,0,114,0,0,False,False,False,False,False,,https://b.thumbs.redditmedia.com/P5YnZz3Zc_7NbaWIDlwWrXe8Zl9Z_BwxJc9XMPLZ5ko.jpg,t3_1h7y86n
gaming,Indiana Jones and The Great Circle releases with a 87/100 metascore ,,IcePopsicleDragon,1h7oc17,https://reddit.com/r/gaming/comments/1h7oc17/indiana_jones_and_the_great_circle_releases_with/,https://opencritic.com/game/17732/indiana-jones-and-the-great-circle,2024-12-06 00:23:34,6986,0.96,6986,0,688,0,0,False,False,False,False,False,,https://a.thumbs.redditmedia.com/TKH8Qi0fnody2Trm63y1Rxg6I7uikt77B6d_W3GQXm4.jpg,t3_1h7oc17
gaming,Oh it’s beautiful ,,Xenomorph_kills,1h7jvw1,https://reddit.com/r/gaming/comments/1h7jvw1/oh_its_beautiful/,https://i.redd.it/4wc92tuxh35e1.jpeg,2024-12-05 21:08:06,11712,0.91,11712,0,298,0,0,False,False,False,False,False,,https://b.thumbs.redditmedia.com/yDH5cMJYlQWPA2gE9Z3ANiw52XN3Ku73T3xIe0mXTnI.jpg,t3_1h7jvw1
gaming,It's out now!!,"I never thought this game would get a remaster. It is an amazing obscure sequel to one of the best movies. The game went from TBD to releasing today or yesterday. 30mins before work, here we go!",anonerble,1h81gov,https://reddit.com/r/gaming/comments/1h81gov/its_out_now/,https://i.redd.it/wv8jdnsxd85e1.jpeg,2024-12-06 13:34:34,339,0.93,339,0,42,0,0,False,False,False,False,False,,https://b.thumbs.redditmedia.com/iKT-5RDmdMgFEeO3bPg84h-uZJ9V-_SeHBNqV1YfMlk.jpg,t3_1h81gov
gaming,The Verge: 'Amazon’s Secret Level is a hollow anthology of video game cutscenes',,Real-Deal-Steel,1h7gur0,https://reddit.com/r/gaming/comments/1h7gur0/the_verge_amazons_secret_level_is_a_hollow/,https://www.theverge.com/24313309/secret-level-review-amazon-prime-video,2024-12-05 19:01:28,5641,0.95,5641,0,514,0,0,False,False,False,False,False,,https://b.thumbs.redditmedia.com/E1bOmvrz7NVB-kV2gnFRi_yaAJAuPe4wjXZySUMfO8M.jpg,t3_1h7gur0
gaming,Indiana Jones and The Great Circle review – a grand adventure brilliantly executed,,Ok-fine-man,1h7o7qt,https://reddit.com/r/gaming/comments/1h7o7qt/indiana_jones_and_the_great_circle_review_a_grand/,https://www.mirror.co.uk/gaming/indiana-jones-great-circle-review-34256689,2024-12-06 00:17:51,1698,0.94,1698,0,165,0,0,False,False,False,False,False,,https://b.thumbs.redditmedia.com/OwS325AwLG8gp4xfr0P2SZ9XgfBXB5V91gDvO512dUM.jpg,t3_1h7o7qt
gaming,Cosplay Bloodrayne ,,Lavenok,1h7kc1r,https://reddit.com/r/gaming/comments/1h7kc1r/cosplay_bloodrayne/,https://i.redd.it/j60s0sa7l35e1.jpeg,2024-12-05 21:26:22,1411,0.82,1411,0,72,0,0,False,False,False,False,False,,https://b.thumbs.redditmedia.com/nqXmEcHT2aINmj3EbzzsnKmNYS__uROSmBYk5vm06hk.jpg,t3_1h7kc1r
gaming,Made these pen holders for a work buddy,,raisedbytides,1h7b8po,https://reddit.com/r/gaming/comments/1h7b8po/made_these_pen_holders_for_a_work_buddy/,https://i.redd.it/co2i7t5jp15e1.jpeg,2024-12-05 15:07:07,4593,0.97,4593,0,199,0,0,False,False,False,False,False,,https://b.thumbs.redditmedia.com/H5RbqAU7wrSE36onMigyYSMs72eHfc6S27bmvHnZihc.jpg,t3_1h7b8po
gaming,"Shuhei Yoshida recreates ""This is how you share your games on PS4"" moment with Stellar Blade Director",,Imaginary_Cause2216,1h7cz6b,https://reddit.com/r/gaming/comments/1h7cz6b/shuhei_yoshida_recreates_this_is_how_you_share/,https://i.redd.it/c343jnxw225e1.jpeg,2024-12-05 16:22:21,3639,0.95,3639,0,149,0,0,False,False,False,False,False,,https://b.thumbs.redditmedia.com/P01NEodXVSaTYu_wjxxdcbdVyHvz18Zn9sAIH24vB4I.jpg,t3_1h7cz6b
gaming,TRIBES: The Most Influential FPS You Never Played,,FishStix1,1h7dxcx,https://reddit.com/r/gaming/comments/1h7dxcx/tribes_the_most_influential_fps_you_never_played/,https://www.youtube.com/watch?v=cgcXD0vZsrs,2024-12-05 17:01:45,2952,0.9,2952,0,1108,0,0,False,False,False,False,False,,https://b.thumbs.redditmedia.com/2x4aXmwkv6FO7VokdDqGgzVh1IexBx8nQvvNJVFqrUA.jpg,t3_1h7dxcx
gaming,No matter how much time passes I still want to play this again,,adm_anonimo,1h82b5e,https://reddit.com/r/gaming/comments/1h82b5e/no_matter_how_much_time_passes_i_still_want_to/,https://i.redd.it/g936gomel85e1.jpeg,2024-12-06 14:16:26,57,0.67,57,0,46,0,0,False,False,False,False,False,,https://b.thumbs.redditmedia.com/VWfISKNB735WTVZkqAk60yo8NIzMQVYnKHM0tfKt1Sg.jpg,t3_1h82b5e
gaming,Lego Star Wars: The SkyWalker Saga is free on the Epic Game Store until 12/12. ,,Jazzlike-Lunch5390,1h7k3o6,https://reddit.com/r/gaming/comments/1h7k3o6/lego_star_wars_the_skywalker_saga_is_free_on_the/,https://store.epicgames.com/en-US/p/lego-star-wars-the-skywalker-saga,2024-12-05 21:16:42,1097,0.9,1097,0,143,0,0,False,False,False,False,False,,default,t3_1h7k3o6
gaming,This Is Why Real Time Cutscenes Are Superior,,fusinaz,1h7hi7i,https://reddit.com/r/gaming/comments/1h7hi7i/this_is_why_real_time_cutscenes_are_superior/,https://youtu.be/2-Wj4-BCcME?si=onlIc1uPLQcUQKt0,2024-12-05 19:28:51,1409,0.91,1409,0,73,0,0,False,False,False,False,True,,spoiler,t3_1h7hi7i
gaming,What games can you play as hulk? My son wants a hulk video game. ,My 5 year old wrote “hulk video game” on his Santa list. They haven’t made a hulk specific game in awhile. I was thinking either Lego avengers or Lego super hero’s but I’m not clear which you can actually play as hulk or what’s better. He’s on the cover of both. We have a switch and an Xbox series x in terms of systems. Any advise is appreciated. ,Macsimus15,1h83411,https://reddit.com/r/gaming/comments/1h83411/what_games_can_you_play_as_hulk_my_son_wants_a/,https://www.reddit.com/r/gaming/comments/1h83411/what_games_can_you_play_as_hulk_my_son_wants_a/,2024-12-06 14:54:27,36,0.82,36,0,84,0,0,False,False,True,False,False,,self,t3_1h83411
gaming,I digged up a screen cap from 19 years ago,COD 1 - OG,Bounder1103,1h7ackk,https://reddit.com/r/gaming/comments/1h7ackk/i_digged_up_a_screen_cap_from_19_years_ago/,https://i.redd.it/ke122a49i15e1.jpeg,2024-12-05 14:26:16,1977,0.79,1977,0,316,0,0,False,False,False,False,False,,https://a.thumbs.redditmedia.com/noCmNEQWvqoHv6YOVAZHI-xa3SCm_5Pq1IshAUZU1q0.jpg,t3_1h7ackk
gaming,Been playing Skyrim for a long time and still find the music to be next level. Is it one of the best soundtracks of all time?,"Every single track works wonderfully, no matter where you are or what you are doing it just hits on many emotional levels.",Kinetic_Pen,1h7tpvy,https://reddit.com/r/gaming/comments/1h7tpvy/been_playing_skyrim_for_a_long_time_and_still/,https://www.reddit.com/r/gaming/comments/1h7tpvy/been_playing_skyrim_for_a_long_time_and_still/,2024-12-06 05:01:38,100,0.75,100,0,79,0,0,False,False,True,False,False,,self,t3_1h7tpvy
gaming,Indiana Jones and the Great Circle’s early access period won’t include full ray tracing,What on earth are they doing with this game ???,Lo_jak,1h7j43b,https://reddit.com/r/gaming/comments/1h7j43b/indiana_jones_and_the_great_circles_early_access/,https://www.theverge.com/2024/12/5/24314171/indiana-jones-and-the-great-circle-early-access-full-ray-tracing,2024-12-05 20:35:52,382,0.82,382,0,182,0,0,False,False,False,False,False,,https://b.thumbs.redditmedia.com/KTl2WAgZNCeMDipzI2Ns9P5OM5y2FKacwr2lnl3RPUg.jpg,t3_1h7j43b
gaming,My most prized possession ,So,HeartTreeHugger,1h7kndr,https://reddit.com/r/gaming/comments/1h7kndr/my_most_prized_possession/,https://i.redd.it/7byhabjkn35e1.jpeg,2024-12-05 21:39:38,246,0.85,246,0,34,0,0,False,False,False,False,False,,https://b.thumbs.redditmedia.com/4Cil6x7R7iRdDtlY0WsrI3nuFavkx4tfRBiDjThXlFQ.jpg,t3_1h7kndr
gaming,Kingdom Come: Deliverance II - Official Story Trailer,,Paul_cz,1h7llad,https://reddit.com/r/gaming/comments/1h7llad/kingdom_come_deliverance_ii_official_story_trailer/,https://www.youtube.com/watch?v=vPS-pgg3scE,2024-12-05 22:20:19,198,0.88,198,0,78,0,0,False,False,False,False,False,,https://a.thumbs.redditmedia.com/gQtJFZheylRxumblyCQgmq_jJvfWBRHTBm7b3oCSvm8.jpg,t3_1h7llad
gaming,Moonlighter 2: The Endless Vault | Announcement Trailer,,LiquifiedSpam,1h7ih4q,https://reddit.com/r/gaming/comments/1h7ih4q/moonlighter_2_the_endless_vault_announcement/,https://www.youtube.com/watch?v=uZW8MwekNHk,2024-12-05 20:09:10,297,0.94,297,0,47,0,0,False,False,False,False,False,,https://b.thumbs.redditmedia.com/28lYRuoJ5pC5plRN1Bim7G5TuS4DGwqf_scRcVOiVKQ.jpg,t3_1h7ih4q
gaming,Used to be a huge fan of MicroMachines back in the day ! This week I released my first ever game on Steam with heavy retro arcade inspirations :D,,Zyguliptu,1h7df3d,https://reddit.com/r/gaming/comments/1h7df3d/used_to_be_a_huge_fan_of_micromachines_back_in/,https://i.redd.it/8unfbvwy525e1.gif,2024-12-05 16:40:55,300,0.88,300,0,63,0,0,False,False,False,False,False,,https://b.thumbs.redditmedia.com/U4PRvN9TFo6XW0XGd16iBy6qAWYpEqOw5LP8uAxXRms.jpg,t3_1h7df3d
gaming,POV its 2000 and you're about to buy your first pokemon game.,,ZooterTheWooter,1h6ubk9,https://reddit.com/r/gaming/comments/1h6ubk9/pov_its_2000_and_youre_about_to_buy_your_first/,https://i.redd.it/v11twczxzw4e1.jpeg,2024-12-04 23:16:34,7759,0.97,7759,0,457,0,0,False,False,False,False,False,,https://a.thumbs.redditmedia.com/82yHORgObKeFk1T1ObF8VDMRhSkELoILtufsF6lnXk4.jpg,t3_1h6ubk9
gaming,Need some co-pp split screen recommendations for ps4,"I need some good 2 player recommendations for ps4. My fiance likes mostly surviva and RPG type games but will also play some more action type games. We've tried ARK but the games bugged and creates weird shadows on the bottom screen.   

She tried borderlands but it was a little too fast paced, she doesnt love FPS and trying to menu is weird. We've played some Minecraft but got bored of it. Any recommendations would be very helpful!",PM_ME_YOUR_ANT_FARMS,1h83sr1,https://reddit.com/r/gaming/comments/1h83sr1/need_some_copp_split_screen_recommendations_for/,https://www.reddit.com/r/gaming/comments/1h83sr1/need_some_copp_split_screen_recommendations_for/,2024-12-06 15:24:54,4,0.83,4,0,5,0,0,False,False,True,False,False,,self,t3_1h83sr1
gaming,Cyberpunk multiplayer mod is coming along nicely,,gattzu20,1h7ifkw,https://reddit.com/r/gaming/comments/1h7ifkw/cyberpunk_multiplayer_mod_is_coming_along_nicely/,https://www.youtube.com/watch?v=7aE7Es1Ow6E,2024-12-05 20:07:23,125,0.79,125,0,42,0,0,False,False,False,False,False,,https://b.thumbs.redditmedia.com/SsTn76UTCqAwQfn-0GEXcS49fqPmdWUxfbshn6Bhc4o.jpg,t3_1h7ifkw
gaming,Initial Marvel Rival Thoughts?,"I’ve only put about 3-4 hours into Marvel Rivals last night, so it’s still really early, and I don’t have any real definitive opinions yet.

But my initial thoughts are more so about how great of an initial “free to play, GaaS package” this game is starting out as.

These past few years have been pretty rough for new GaaS titles with the majority of them outright failing.

Now there’s different reasons for these failures, that are unique to the titles themselves. 

But I am really impressed that NetEase clearly “read the room” and ensured that a lot of quality of life aspects are in Rivials day one. Which is sadly far from the norm with GaaS titles. 

Not to mention this is probably one of the best performing GaaS titles to come out in a long time. I didn’t wait at all to get into matches, no lag, no replay in inputs. 

Overall I’m pretty positive on Rivals for now. ",Hungry-Sir6349,1h83h6i,https://reddit.com/r/gaming/comments/1h83h6i/initial_marvel_rival_thoughts/,https://www.reddit.com/r/gaming/comments/1h83h6i/initial_marvel_rival_thoughts/,2024-12-06 15:10:46,3,0.67,3,0,11,0,0,False,False,True,False,False,,self,t3_1h83h6i
gaming,The last time I seriously played and enjoyed COD,"Going through my old game storage found physical disks of oblivion, Morrowind, Aion, Diablo three and this old classic. ",MinervaMedica000,1h6ngkh,https://reddit.com/r/gaming/comments/1h6ngkh/the_last_time_i_seriously_played_and_enjoyed_cod/,https://i.redd.it/h2syc7rwlv4e1.jpeg,2024-12-04 18:36:05,7453,0.93,7453,0,620,0,0,False,False,False,False,False,,https://b.thumbs.redditmedia.com/bx7LzVfdg_HMOeqTL4_oGiYHyBm8ip8hTctCev6RgoQ.jpg,t3_1h6ngkh
gaming,"Sony was “lucky to survive” the PS3 era, says ex PlayStation boss Shawn Layden - “PS3 was Sony’s Icarus moment. We flew too close to the sun,”",,ChiefLeef22,1h6ih1y,https://reddit.com/r/gaming/comments/1h6ih1y/sony_was_lucky_to_survive_the_ps3_era_says_ex/,https://www.playstationlifestyle.net/2024/12/03/sony-felt-lucky-survived-ps3-struggles-says-shawn-layden/,2024-12-04 15:18:14,21275,0.95,21275,0,2132,0,0,False,False,False,False,False,,https://a.thumbs.redditmedia.com/VZIyjhiJRQlzDU2qNRQIa1QB6EHF5e_I0zMn8fmTVE0.jpg,t3_1h6ih1y
gaming,We are getting Anime GTA before GTA 6 - Ananta - Official Gameplay Trailer,,CryMoreFanboys,1h6zsnf,https://reddit.com/r/gaming/comments/1h6zsnf/we_are_getting_anime_gta_before_gta_6_ananta/,https://www.youtube.com/watch?v=Cq88FSVNJRE,2024-12-05 03:34:11,904,0.78,904,0,420,0,0,False,False,False,False,False,,https://b.thumbs.redditmedia.com/FFaaEQkFH7DuwstHYiHzh6DbqmG5eK30Gm1OErQ4M8w.jpg,t3_1h6zsnf
gaming,"Finally playing ""Friends of Ringo Ishikawa"" and it's really good! I was kinda lost at first and kept getting knocked out, but once I trained up a bit and started getting paid for my grades it got a lot easier. Highly recommend it. ",,YeahMarkYeah,1h7koh3,https://reddit.com/r/gaming/comments/1h7koh3/finally_playing_friends_of_ringo_ishikawa_and_its/,https://i.redd.it/d6tzwdcpn35e1.png,2024-12-05 21:40:55,29,0.68,29,0,14,0,0,False,False,False,False,False,,https://b.thumbs.redditmedia.com/4Gq6H8mb66pr9ACECNFufvY4LqljFib1clNQN1lKedA.jpg,t3_1h7koh3
gaming,Marvel Rivals Official Launch Trailer. 33 hero's. Destructible Environment and Team-ups.  Live 7pm EST.,,critxcanuck88,1h7937f,https://reddit.com/r/gaming/comments/1h7937f/marvel_rivals_official_launch_trailer_33_heros/,https://youtube.com/watch?v=6QtF-z25nIA&amp;si=PnwSTDrq8jKmnQfn,2024-12-05 13:24:23,112,0.67,112,0,187,0,0,False,False,False,False,False,,https://a.thumbs.redditmedia.com/rwmWlMT-AKZNsySJPoRgs8AqfPuSwU1ORNv863p_rW4.jpg,t3_1h7937f
gaming,Sly Cooper Trilogy to Return for sale on PS5 and PS4,,mucho-gusto,1h72ltw,https://reddit.com/r/gaming/comments/1h72ltw/sly_cooper_trilogy_to_return_for_sale_on_ps5_and/,https://comicbook.com/gaming/news/ps2-games-playstation-2-ps5-ps4-trilogy/,2024-12-05 06:09:56,387,0.94,387,0,54,0,0,False,False,False,False,False,,https://b.thumbs.redditmedia.com/xFezVc1P8GOVUYMGtNNtzwZt2isc9g9mHRjenvzQ-OY.jpg,t3_1h72ltw
gaming,Need advice for a christmas present,"I need some advice on which game to get my nephew.

I remember when I was a kid with my 8-bit NES and my family was always happy when they 'got a videa game' for me for Christmas. The problem is, they usually didn't know anything about games and had terrible taste. I don't want to be that guy.

So my nephew - 12, m - is getting a PS5 from his parents. He's historically gamed on the Switch, and he (and I) LOVES the Legend of Zelda series. We've played BoTW and ToTK together, and regularly share tips, tricks, and advice.

I want to get his something for his PS5 that he'll enjoy, I'm looking for: open-world, lots of content to explore, appropriate levels of violence and language (he'll be playing it in the same room as his mom/my sister; I don't want it to be over the top), and fun. Something that someone who loves Zelda will be into.

Problem is, I'm in my 40's now and not as up on these things as I used to be. So, Reddit, please help me out here. What should I wrap up under the tree?",Nwcray,1h827a7,https://reddit.com/r/gaming/comments/1h827a7/need_advice_for_a_christmas_present/,https://www.reddit.com/r/gaming/comments/1h827a7/need_advice_for_a_christmas_present/,2024-12-06 14:11:15,1,0.67,1,0,8,0,0,False,False,True,False,False,,self,t3_1h827a7
gaming,Another W for Marvel Rivals,,critxcanuck88,1h6pa76,https://reddit.com/r/gaming/comments/1h6pa76/another_w_for_marvel_rivals/,https://i.redd.it/dididwpuyv4e1.jpeg,2024-12-04 19:49:07,1553,0.85,1553,0,384,0,0,False,False,False,False,False,,https://b.thumbs.redditmedia.com/kFDcQH8PUn8O_TyRyjtgyRJ3YYqE-o9cpOmsj-ELnHc.jpg,t3_1h6pa76
gaming,Helldivers 2 weapon's realism is insane,,MakubeC,1h6iu7i,https://reddit.com/r/gaming/comments/1h6iu7i/helldivers_2_weapons_realism_is_insane/,https://www.youtube.com/watch?v=u2dxexfGf44,2024-12-04 15:33:09,3431,0.91,3431,0,175,0,0,False,False,False,False,False,,https://b.thumbs.redditmedia.com/udTCxFakcx546VWRV21xAB7RXA8NYWL9rH3zhdoEBiE.jpg,t3_1h6iu7i
gaming,"Name a game that seemed ""meh"" at first, but then hooked you on the first try.","To me that game was definitely Vampire Survivors. I was looking at the screenshots and thought it looked quite messy, uninteresting and I wasn't very impressed.

But hey, I gave it a try; could not put it down for hours until realizing I should've been in the bed long ago.

What's yours?",Routasoft,1h6v9em,https://reddit.com/r/gaming/comments/1h6v9em/name_a_game_that_seemed_meh_at_first_but_then/,https://www.reddit.com/r/gaming/comments/1h6v9em/name_a_game_that_seemed_meh_at_first_but_then/,2024-12-04 23:58:04,702,0.9,702,0,945,0,0,False,False,True,False,False,,self,t3_1h6v9em
gaming,Most underrated handheld game of all time. ,Dragon Ball Z Supersonic Warriors was one of the most memorable gameboy games I've played and I feel it wasn't widely known or appreciated. I spent hours on this. ,pur0drl0k0,1h70yv4,https://reddit.com/r/gaming/comments/1h70yv4/most_underrated_handheld_game_of_all_time/,https://i.redd.it/gh13fc5vky4e1.jpeg,2024-12-05 04:35:34,275,0.84,275,0,59,0,0,False,False,False,False,False,,https://b.thumbs.redditmedia.com/DHaax5VcLLgi9LyaHFaIVi3mbm2yxC4YJs4iu2TvTtU.jpg,t3_1h70yv4
gaming,I digged up a screen cap from 15 years ago.,,cheezburgapocalypse,1h6g7k9,https://reddit.com/r/gaming/comments/1h6g7k9/i_digged_up_a_screen_cap_from_15_years_ago/,https://i.redd.it/2zirk9dx4u4e1.jpeg,2024-12-04 13:39:09,4471,0.86,4471,0,373,0,0,False,False,False,False,False,,https://b.thumbs.redditmedia.com/8zEtHb72fiW6fRZT8HBmmt0p3k1GryfBAK7LxUVA7Us.jpg,t3_1h6g7k9
gaming,Looking for new games to play after finishing Divinity Original Sin 2 on Xbox one. ,"I just finished Divinity Original Sin 2, and loved it.  I'm looking for something else to play now.  Would love an Rpg suggestion, but anything will do.

I've played Torment: Tales of Numenora, and both Pillars of Eternity games, so leave them out

Edit: I don't have a series X or S so please limit suggestions to Xbox one, that's why I specifically said Xbox one in the title.",SavageTS1979,1h7opia,https://reddit.com/r/gaming/comments/1h7opia/looking_for_new_games_to_play_after_finishing/,https://www.reddit.com/r/gaming/comments/1h7opia/looking_for_new_games_to_play_after_finishing/,2024-12-06 00:41:16,8,0.62,8,0,67,0,0,False,False,True,False,False,,self,t3_1h7opia
gaming,"I still have my original copy of Half Life 2. Was a Christmas gift from my wife in 2004, though I think she gave it to me a little earlier.",,ecnerwal1234,1h6p3xg,https://reddit.com/r/gaming/comments/1h6p3xg/i_still_have_my_original_copy_of_half_life_2_was/,https://i.redd.it/i90iocwnxv4e1.jpeg,2024-12-04 19:41:58,990,0.95,990,0,112,0,0,False,False,False,False,False,,https://b.thumbs.redditmedia.com/uAWxExwbLakyeYoiIjJRDkBtOSJE59379qBVnYiXEns.jpg,t3_1h6p3xg
gaming,Kingmakers | Winter Games Expo Trailer - Early Access Release in Q1 2025 AD,,abcinng,1h6pvu2,https://reddit.com/r/gaming/comments/1h6pvu2/kingmakers_winter_games_expo_trailer_early_access/,https://www.youtube.com/watch?v=ZXujvsd9C58,2024-12-04 20:13:03,754,0.96,754,0,44,0,0,False,False,False,False,False,,https://b.thumbs.redditmedia.com/svrxWUTCM4_Szp4esiX7KXaExvNE_MZ_WcVyjbx_r9s.jpg,t3_1h6pvu2
gaming,I remember playing the first one on PlayStation but never beating it. (Soul Reaver 1+2 Remaster),,RL_CaptainMorgan,1h7dk5x,https://reddit.com/r/gaming/comments/1h7dk5x/i_remember_playing_the_first_one_on_playstation/,https://www.ign.com/videos/legacy-of-kain-soul-reaver-1-2-remastered-official-launch-trailer,2024-12-05 16:46:46,15,0.67,15,0,9,0,0,False,False,False,False,False,,https://b.thumbs.redditmedia.com/RobrjvrjdMWnUxaBGASJ3qRimdYYJYqmc3zJTy1IwFA.jpg,t3_1h7dk5x
gaming,What bands/ songs/ albums remind you of playing a game?,"For me- Pantera Far Beyond Driven: Ocarina of Time (Water Temple specifically), Bloodhound Gang Hooray For Boobies: GTA 2, early-to-mid '90's Guided By Voices; Civ  6",DarmiansMuttonChops,1h7el44,https://reddit.com/r/gaming/comments/1h7el44/what_bands_songs_albums_remind_you_of_playing_a/,https://www.reddit.com/r/gaming/comments/1h7el44/what_bands_songs_albums_remind_you_of_playing_a/,2024-12-05 17:29:00,10,0.6,10,0,68,0,0,False,False,True,False,False,,self,t3_1h7el44
gaming,Legacy of Kain: Soul Reaver 1 &amp; 2 Remastered - Launch Trailer,,Apprehensive_Day212,1h6y3ls,https://reddit.com/r/gaming/comments/1h6y3ls/legacy_of_kain_soul_reaver_1_2_remastered_launch/,https://youtu.be/LpKy31RzDBA?si=8oBG2TtggrGhV0k3,2024-12-05 02:10:43,166,0.92,166,0,65,0,0,False,False,False,False,False,,https://b.thumbs.redditmedia.com/HBLtgYAhAZoIz2nREeVZw5YCDt36evEfwxg1rxq1FUY.jpg,t3_1h6y3ls
gaming,"welp, there goes my weekend",,rsjpeckham,1h6gj4d,https://reddit.com/r/gaming/comments/1h6gj4d/welp_there_goes_my_weekend/,https://i.redd.it/jtyf6wno7u4e1.jpeg,2024-12-04 13:54:34,1425,0.93,1425,0,53,0,0,False,False,False,False,False,,https://b.thumbs.redditmedia.com/cbg78vUtsreP5YNZy2UMhuSy_ShJJEgoRslv4cm_vHM.jpg,t3_1h6gj4d
gaming,"After more than 20 years, I went back to Disney's Tarzan (1999) and finally took down Clayton. Watching him fall from that cliff was the most satisfying thing I've done all week. Childhood me can finally rest easy :) ",,mason_mte,1h6tfc7,https://reddit.com/r/gaming/comments/1h6tfc7/after_more_than_20_years_i_went_back_to_disneys/,https://i.redd.it/6jbbv0vxsw4e1.gif,2024-12-04 22:37:28,225,0.94,225,0,17,0,0,False,False,False,False,True,,spoiler,t3_1h6tfc7
gaming,What are some sleeper hit games that people should give more attention to?,"For me, it’s probably Teardown and Children of the Sun.

Teardown is a game where you can destroy anything and everything. It’s the perfect vandalism/heist game too. But I do not recommend the DLC’s. Most are hit or miss. But there is a modding community that frequently makes new content for others to play.

As for Children of the Sun. It’s a game where you have one single Sniper Rifle bullet, and you must make the bullet change trajectory to kill multiple enemies. 

Think of it like the Sniper Elite games, but it’s also a puzzle as well. You have to find out the best path and use shortcuts to your advantage.

Both of these games have amazing Indie devs and they deserve so much praise. You won’t regret getting these two. Pick them up on a sale.",Brungala,1h7ry8s,https://reddit.com/r/gaming/comments/1h7ry8s/what_are_some_sleeper_hit_games_that_people/,https://www.reddit.com/r/gaming/comments/1h7ry8s/what_are_some_sleeper_hit_games_that_people/,2024-12-06 03:23:36,1,0.51,1,0,89,0,0,False,False,True,False,False,,self,t3_1h7ry8s
gaming,Warning: GameStop sells open games as “New” and put them in these crappy plastic bag. ,,landofthebeez,1h830zm,https://reddit.com/r/gaming/comments/1h830zm/warning_gamestop_sells_open_games_as_new_and_put/,https://i.redd.it/3o1eagthr85e1.jpeg,2024-12-06 14:50:32,0,0.45,0,0,50,0,0,False,False,False,False,False,,https://b.thumbs.redditmedia.com/9jAI8n9-sK9lAMwMRIjyxL-4cH15i3YNEyYGU_U9bAs.jpg,t3_1h830zm
gaming,The hidden master,,DreadedDrMaybe,1h648xr,https://reddit.com/r/gaming/comments/1h648xr/the_hidden_master/,https://i.redd.it/vtenpyf0jq4e1.jpeg,2024-12-04 01:30:56,8539,0.96,8539,0,239,0,0,False,False,False,False,False,,https://b.thumbs.redditmedia.com/hQAR4cfSg1osdRKZPooyHQltkD11t0PDJhP-gQiYdfM.jpg,t3_1h648xr
gaming,XDefiant officially shutting down as Ubisoft announces FPS end date,,BigT232,1h62k12,https://reddit.com/r/gaming/comments/1h62k12/xdefiant_officially_shutting_down_as_ubisoft/,https://www.dexerto.com/gaming/xdefiant-officially-shutting-down-2997613/,2024-12-04 00:12:12,7987,0.97,7987,0,1217,0,0,False,False,False,False,False,,https://b.thumbs.redditmedia.com/tliIphH3VnjUdEC7SLpQDDxD0V3GCwPRokQg_ILUOuM.jpg,t3_1h62k12
