subreddit,title,selftext,author,id,permalink,url,created_utc,score,upvote_ratio,ups,downs,num_comments,total_awards_received,gilded,is_video,is_original_content,is_self,over_18,spoiler,link_flair_text,thumbnail,name
science,New study reveals who fakes orgasms and why they stop. 51% reported never having faked an orgasm (65.79% of men compared to 36.41% of women). More women reported stopping due to becoming comfortable without having an orgasm or exploring ways to achieve orgasms on their own.,,mvea,1h7cp8b,https://reddit.com/r/science/comments/1h7cp8b/new_study_reveals_who_fakes_orgasms_and_why_they/,https://www.psypost.org/huge-study-reveals-who-fakes-orgasms-and-why-they-stop/,2024-12-05 16:10:27,4744,0.94,4744,0,319,0,0,False,False,False,False,False,Psychology,https://b.thumbs.redditmedia.com/povSEoQ4BQ4NVBYwuQWdIRmF0Z7tvpOwdC-p_Mo9NaQ.jpg,t3_1h7cp8b
science,"Cleaning airport surfaces every 2 hours cuts norovirus infections by 83%. People make 26,000 touches in an airport a day. Airport restaurants had highest risk, with 4.6 out of 51,494 travellers being infected. Handwashing every 2 hours reduced risk by only 2%, and mask-wearing 50% of time by 48%.",,mvea,1h7l9wv,https://reddit.com/r/science/comments/1h7l9wv/cleaning_airport_surfaces_every_2_hours_cuts/,https://www.scimex.org/newsfeed/cleaning-airport-surfaces-every-2-hours-cuts-norovirus-infections-by-83-percent,2024-12-05 22:06:34,4779,0.98,4779,0,161,0,0,False,False,False,False,False,Medicine,https://b.thumbs.redditmedia.com/KKTq0mctDZh9MzuNiDGTNRKGwmAviG74ZKNdwQfjhUw.jpg,t3_1h7l9wv
science,Texas researchers detect fentanyl in Gulf of Mexico dolphins,,Honest_Reach_1760,1h7o3or,https://reddit.com/r/science/comments/1h7o3or/texas_researchers_detect_fentanyl_in_gulf_of/,https://www.chron.com/life/wildlife/article/dolphins-gulf-fentanyl-19962294.php,2024-12-06 00:12:28,2731,0.98,2731,0,132,0,0,False,False,False,False,False,Animal Science,https://a.thumbs.redditmedia.com/5UVU7OQtLnNACchQjKUyR082iB-dD5nS3fc7FtjbRD4.jpg,t3_1h7o3or
science,"Adults do create new brain cells, and faster production of new neurons is linked to reduced cognitive decline, especially related to verbal learning, in a study of tissue taken from human brains during surgery to treat drug-resistant epilepsy ",,The_Conversation,1h7df8k,https://reddit.com/r/science/comments/1h7df8k/adults_do_create_new_brain_cells_and_faster/,https://theconversation.com/adults-grow-new-brain-cells-and-these-neurons-are-key-to-learning-by-listening-245249,2024-12-05 16:41:05,2418,0.99,2418,0,19,0,0,False,False,False,False,False,Neuroscience,https://b.thumbs.redditmedia.com/Ejblr4ws35WV4zr6x4g7RRkFnAiTigjqk4QypMIAx2Q.jpg,t3_1h7df8k
science,A single mutation in avian influenza in cows could enable human-to-human transmission,,Logibenq,1h7iog6,https://reddit.com/r/science/comments/1h7iog6/a_single_mutation_in_avian_influenza_in_cows/,https://english.elpais.com/science-tech/2024-12-05/a-single-mutation-in-avian-influenza-in-cows-could-enable-human-to-human-transmission.html,2024-12-05 20:17:33,1507,0.96,1507,0,152,0,0,False,False,False,False,False,Biology,https://b.thumbs.redditmedia.com/EdbOCQOMK_mSWfvqMV9hZUoz0jTNt3nzPs4Pfcn6ZpM.jpg,t3_1h7iog6
science,"Peer-brokered sales, in which people buy drugs for others within their social circles and take a cut—either as a share of the drugs or money by inflating the price—play a widespread and vital role in the distribution of illegal substances, according to the new study",,giuliomagnifico,1h7dl0m,https://reddit.com/r/science/comments/1h7dl0m/peerbrokered_sales_in_which_people_buy_drugs_for/,https://thedaily.case.edu/new-study-peer-brokered-sales-central-to-illegal-drug-trade/,2024-12-05 16:47:45,1142,0.93,1142,0,206,0,0,False,False,False,False,False,Social Science,https://b.thumbs.redditmedia.com/_F7KU8ojkw4oRwTNYv8ZJfJojtzd1odmr83A5i3yZ-I.jpg,t3_1h7dl0m
science,"Researchers fed mealworms ground-up face masks mixed with bran and found that the bugs excreted a small fraction of the microplastics consumed. After 30 days, the research team found the mealworms ate about half the microplastics available, about 150 particles per insect, and gained weight.",,mvea,1h7yqzu,https://reddit.com/r/science/comments/1h7yqzu/researchers_fed_mealworms_groundup_face_masks/,https://news.ubc.ca/2024/12/can-plastic-eating-bugs-help-with-our-microplastic-problem/,2024-12-06 10:51:14,1140,0.96,1140,0,78,0,0,False,False,False,False,False,Biology,https://b.thumbs.redditmedia.com/i_cGFSvyV-qFrZQDTE73uRwbwp_4SJiUQTFSDQnqTaA.jpg,t3_1h7yqzu
science,"Stress can dull our capacity for joy: mouse brain patterns hint at why. Scientists pinpoint brain circuits linked to either resilience or vulnerability to adversity, which affect a stressed animal’s pursuit of pleasure.",,maxkozlov,1h7mde5,https://reddit.com/r/science/comments/1h7mde5/stress_can_dull_our_capacity_for_joy_mouse_brain/,https://www.nature.com/articles/d41586-024-03958-2,2024-12-05 22:54:27,640,0.97,640,0,12,0,0,False,False,False,False,False,Neuroscience,https://a.thumbs.redditmedia.com/curBJtV5TRdffHcJ5KkjnKQ3AtZCE34jjPnmIjk3xP0.jpg,t3_1h7mde5
science,"Modelling study based on almost 250,000 positive COVID-19 tests in the United Kingdom shows that universal masking could have cut transmission markedly.",,MistWeaver80,1h7cnja,https://reddit.com/r/science/comments/1h7cnja/modelling_study_based_on_almost_250000_positive/,https://journals.aps.org/pre/abstract/10.1103/PhysRevE.110.064302,2024-12-05 16:08:23,627,0.92,627,0,51,0,0,False,False,False,False,False,Medicine,default,t3_1h7cnja
science,"Micronutrients are a safe and effective treatment for kids struggling with severe irritability, anger. After four weeks, 67% of the children who took a powder blend of 36 micronutrients showed 'much' or 'very much' improved emotional regulation, compared with just 8% of those who did not. ",,Wagamaga,1h7wbo9,https://reddit.com/r/science/comments/1h7wbo9/micronutrients_are_a_safe_and_effective_treatment/,https://journals.plos.org/plosone/article?id=10.1371/journal.pone.0311794,2024-12-06 07:49:29,549,0.83,549,0,38,0,0,False,False,False,False,False,Health,https://b.thumbs.redditmedia.com/TgY6ONjYm5EXuQ_-eoX8Uvc9wwrKnOuOEbihO1_0BGU.jpg,t3_1h7wbo9
science,Scientists discover way to 3D print from thin air: Transforming CO2 into advanced 3D printed carbon nanocomposites,,SoyKing_,1h7jcwl,https://reddit.com/r/science/comments/1h7jcwl/scientists_discover_way_to_3d_print_from_thin_air/,https://idp.nature.com/transit?redirect_uri=https%3A%2F%2Fwww.nature.com%2Farticles%2Fs41467-024-54957-w&amp;code=172d3200-8ca8-49cc-9714-eb3fd5194bf5,2024-12-05 20:46:05,372,0.96,372,0,35,0,0,False,False,False,False,False,Chemistry,https://b.thumbs.redditmedia.com/KEctw7Klw8h1dxvQPXW1sM_l-doXmBFmpqkKMWimiJw.jpg,t3_1h7jcwl
science,"Study: Warming has accelerated due to the Earth absorbing more sunlight | If it's a trend, then future warming will be at the high end of estimates.",,chrisdh79,1h80lcv,https://reddit.com/r/science/comments/1h80lcv/study_warming_has_accelerated_due_to_the_earth/,https://arstechnica.com/science/2024/12/new-study-blames-recent-spike-in-global-warming-on-lack-of-low-clouds/,2024-12-06 12:48:23,471,0.95,471,0,37,0,0,False,False,False,False,False,Earth Science,https://b.thumbs.redditmedia.com/3o2ojJa3nGvHjJutA5tSDJHhC_PfMbz2_F_UIP97qqY.jpg,t3_1h80lcv
science,Clouds may be the reason the world is warming faster than expected • The rapid surge in warming was supercharged by a dearth of low-lying clouds over the oceans,,Naurgul,1h7rq45,https://reddit.com/r/science/comments/1h7rq45/clouds_may_be_the_reason_the_world_is_warming/,https://edition.cnn.com/2024/12/05/climate/global-warming-clouds/index.html,2024-12-06 03:13:00,224,0.9,224,0,48,0,0,False,False,False,False,False,Environment,https://b.thumbs.redditmedia.com/HkNIxqvSQ4K1q5RnQ0cVt-CZ9FGjcX6xUAVNWGxWbVw.jpg,t3_1h7rq45
science,Oldest-known remnants of archery in Europe discovered in Spain’s Bat Cave,,Logibenq,1h7bd28,https://reddit.com/r/science/comments/1h7bd28/oldestknown_remnants_of_archery_in_europe/,https://english.elpais.com/science-tech/2024-12-05/oldest-known-remnants-of-archery-in-europe-discovered-in-spains-bat-cave.html,2024-12-05 15:12:54,199,0.96,199,0,24,0,0,False,False,False,False,False,Anthropology,https://b.thumbs.redditmedia.com/Hg3A29z3yiktE5q94-grM9p_GMN0y06SkB6hYvVs0bw.jpg,t3_1h7bd28
science,"A review concluded that oral fluid tests ""are not valid to detect cannabis impairment.""",,OregonTripleBeam,1h7n9ga,https://reddit.com/r/science/comments/1h7n9ga/a_review_concluded_that_oral_fluid_tests_are_not/,https://www.cell.com/heliyon/fulltext/S2405-8440(24)15904-X,2024-12-05 23:34:50,177,0.96,177,0,6,0,0,False,False,False,False,False,Biology,default,t3_1h7n9ga
science,Study shows that chimpanzees perform the same complex behaviors that have brought humans success | Study suggests that the fundamental abilities underlying human language and technological culture may have evolved before humans and apes diverged millions of years ago.,,chrisdh79,1h7zrty,https://reddit.com/r/science/comments/1h7zrty/study_shows_that_chimpanzees_perform_the_same/,https://www.ox.ac.uk/news/2024-12-06-study-shows-chimpanzees-perform-same-complex-behaviours-have-brought-humans-success,2024-12-06 11:59:41,208,0.95,208,0,5,0,0,False,False,False,False,False,Anthropology,https://b.thumbs.redditmedia.com/BDGpp-hX-Hg2teAXy6pK6CAUm1gX_JzzipimM4qrJvM.jpg,t3_1h7zrty
science,A new study in Scientific Reports reveals that microplastic particles (MPs) are present in 88.9% of human blood samples,,calliope_kekule,1h7yvby,https://reddit.com/r/science/comments/1h7yvby/a_new_study_in_scientific_reports_reveals_that/,https://www.nature.com/articles/s41598-024-81931-9,2024-12-06 10:59:48,207,0.94,207,0,12,0,0,False,False,False,False,False,Health,https://a.thumbs.redditmedia.com/qlytfoRF7RAnAbq5KXc85s6MOlVZD3F94zkJS2neWc4.jpg,t3_1h7yvby
science,"Increases in US life expectancy forecasted to stall by 2050, poorer health expected to cause nation’s global ranking to drop",,calliope_kekule,1h7utjo,https://reddit.com/r/science/comments/1h7utjo/increases_in_us_life_expectancy_forecasted_to/,https://www.thelancet.com/journals/lancet/article/PIIS0140-6736(24)02246-3/abstract,2024-12-06 06:07:13,137,0.93,137,0,21,0,0,False,False,False,False,False,Health,default,t3_1h7utjo
science,"Study reveals a positive correlation between people accused of wrongdoing who use Darvo (deny, attack, reverse victim &amp; offender) defense tactics &amp; sexual harassment perpetration, suggesting this defensive response is part of a larger worldview that justifies sexual violence &amp; victim blaming. N=927",,MistWeaver80,1h7dp4r,https://reddit.com/r/science/comments/1h7dp4r/study_reveals_a_positive_correlation_between/,https://journals.plos.org/plosone/article?id=10.1371/journal.pone.0313642,2024-12-05 16:52:30,133,0.88,133,0,11,0,0,False,False,False,False,False,Anthropology,https://b.thumbs.redditmedia.com/9hjKXvK05_1aecdUgdrxfcId-eYBo4zilGx7FzXvmYw.jpg,t3_1h7dp4r
science,"Scientists have developed an innovative process using engineered bacteria to convert complex mixed waste into sustainable biopolymers, including human therapeutics like insulin and bioplastics. This new method could also reduce costs by up to 37% compared to current waste treatments",,giuliomagnifico,1h7d6xk,https://reddit.com/r/science/comments/1h7d6xk/scientists_have_developed_an_innovative_process/,https://www.manchester.ac.uk/about/news/researchers-use-bacteria-to-convert-plastic-waste-into-human-therapeutics/,2024-12-05 16:31:28,105,0.96,105,0,2,0,0,False,False,False,False,False,Biology,https://b.thumbs.redditmedia.com/Mx2i1ZSmRTQuR5Fhs_NPk7_iTpFx2x5FPAkfjD_aNNg.jpg,t3_1h7d6xk
science,"A simpler, more efficient device for harvesting water from the air: « Study finds new method to provide drinking water using half the energy. »",,fchung,1h7id5k,https://reddit.com/r/science/comments/1h7id5k/a_simpler_more_efficient_device_for_harvesting/,https://news.osu.edu/a-simpler-more-efficient-device-for-harvesting-water-from-the-air/,2024-12-05 20:04:38,104,0.95,104,0,14,0,0,False,False,False,False,False,Chemistry,https://a.thumbs.redditmedia.com/gcRk4_VoBOysnL-r-SUduZKalyCZeQAen5xUeAT7G58.jpg,t3_1h7id5k
science,"UK research found most young people who were confirmed to have long Covid three months after a positive PCR test had recovered within 24 months. Females were almost twice as likely to still meet the research definition of long Covid at 24 months, compared to males.  ",,Wagamaga,1h7lck3,https://reddit.com/r/science/comments/1h7lck3/uk_research_found_most_young_people_who_were/,https://www.ucl.ac.uk/news/2024/dec/70-young-people-long-covid-recover-within-two-years,2024-12-05 22:09:57,99,0.9,99,0,6,0,0,False,False,False,False,False,Health,https://b.thumbs.redditmedia.com/WjL-ktUWGjLEgQBRN2QUL4PNs4f5T5zb3mRDj0nBrjo.jpg,t3_1h7lck3
science,"Kumamoto University researchers discover effective antidiabetic compound: HPH-15 has dual effects of reducing blood glucose levels and combating fat accumulation, and promoted glucose uptake at concentrations 200 times lower than metformin.",,FunnyGamer97,1h7t9hq,https://reddit.com/r/science/comments/1h7t9hq/kumamoto_university_researchers_discover/,https://www.eurekalert.org/news-releases/1067327,2024-12-06 04:35:24,83,0.94,83,0,5,0,0,False,False,False,False,False,Medicine,https://b.thumbs.redditmedia.com/h5aXE35lKa3_sbz-Lp9pQ_YumZ9WVjnQ_OeP0j-wfVE.jpg,t3_1h7t9hq
science,"More than 400 chemicals in plastic products linked to breast cancer. Exposure to these toxic compounds, found in everyday items, could be elevating cancer risk in young women. PFAS, phthalates, parabens and aromatic amines are added to food packaging, personal care products and single-use plastics.",,mvea,1h81kz6,https://reddit.com/r/science/comments/1h81kz6/more_than_400_chemicals_in_plastic_products/,https://www.theguardian.com/environment/2024/dec/06/plastic-chemicals-breast-cancer,2024-12-06 13:40:52,113,0.96,113,0,6,0,0,False,False,False,False,False,Cancer,https://b.thumbs.redditmedia.com/2zAGHKE5s62cU4fENEhf5YAHQzMRkVhbfKQctevjf7E.jpg,t3_1h81kz6
science,Wearable devices can help predict five year risk of falls for people with Parkinson’s Disease. Analysis revealed significant differences in features related to walking and posture between those who went on to have falls and those who did not.,,Wagamaga,1h7dtly,https://reddit.com/r/science/comments/1h7dtly/wearable_devices_can_help_predict_five_year_risk/,https://www.ox.ac.uk/news/2024-12-05-wearable-devices-can-help-predict-five-year-risk-falls-people-parkinson-s-disease,2024-12-05 16:57:38,40,0.87,40,0,3,0,0,False,False,False,False,False,Health,https://b.thumbs.redditmedia.com/K5TMXuHY9gkjDb4e7JPDJfILP_uT4Jx6FfyOZ6Fmogg.jpg,t3_1h7dtly
science,"Climate change is driving global extinction risks, with 1.6% of species threatened at 1.3°C of warming and risks escalating to 29.7% at 5.4°C, according to a new meta-analysis encompassing more than 30 years of research",,calliope_kekule,1h7jchp,https://reddit.com/r/science/comments/1h7jchp/climate_change_is_driving_global_extinction_risks/,https://www.science.org/doi/10.1126/science.adp4461,2024-12-05 20:45:38,35,0.74,35,0,1,0,0,False,False,False,False,False,Earth Science,default,t3_1h7jchp
science,"The costs of competition in distributing scarce research funds. (a) if peer review were a drug, it wouldn't be allowed on the market; (b) in some funding systems, as much is spent on writing, evaluating, and managing proposals as is awarded in funding; (c) bias against high-risk research.",,Gerald_Schweiger,1h7vlvt,https://reddit.com/r/science/comments/1h7vlvt/the_costs_of_competition_in_distributing_scarce/,https://www.pnas.org/doi/10.1073/pnas.2407644121,2024-12-06 06:58:20,31,0.78,31,0,5,0,0,False,False,False,False,False,Economics,default,t3_1h7vlvt
science,Research has shown that genetic load for schizophrenia and frequent use of cannabis have independent links to the likelihood of developing clinical psychosis. ,,Wagamaga,1h8224b,https://reddit.com/r/science/comments/1h8224b/research_has_shown_that_genetic_load_for/,https://www.kcl.ac.uk/news/cannabis-use-increases-risk-of-psychosis-independently-from-genetic-predisposition,2024-12-06 14:04:12,46,0.87,46,0,12,0,0,False,False,False,False,False,Neuroscience,https://b.thumbs.redditmedia.com/EtgPn4nid9pCz7IPthFzqkIOqlUud71cWc8ehV43d0c.jpg,t3_1h8224b
science,Developer perceptions of modern code review processes in practice: Insights from a case study in a mid-sized company,,davidshepherd,1h7cf7r,https://reddit.com/r/science/comments/1h7cf7r/developer_perceptions_of_modern_code_review/,https://www.sciencedirect.com/science/article/pii/S0164121224003327,2024-12-05 15:58:42,16,0.65,16,0,6,0,0,False,False,False,False,False,Computer Science,default,t3_1h7cf7r
science,NHANES 2011–2014: Objective Physical Activity Is the Strongest Predictor of All-Cause Mortality,,Hrmbee,1h7due8,https://reddit.com/r/science/comments/1h7due8/nhanes_20112014_objective_physical_activity_is/,https://journals.lww.com/acsm-msse/fulltext/2024/10000/nhanes_2011_2014__objective_physical_activity_is.7.aspx,2024-12-05 16:58:36,17,0.78,17,0,6,0,0,False,False,False,False,False,Health,default,t3_1h7due8
science,How Statistical Challenges and Misreadings of the Literature Combine to Produce Unreplicable Science: An Example From Psychology,,haroldship,1h7xn2u,https://reddit.com/r/science/comments/1h7xn2u/how_statistical_challenges_and_misreadings_of_the/,https://journals.sagepub.com/doi/full/10.1177/25152459241276398,2024-12-06 09:29:04,20,0.84,20,0,2,0,0,False,False,False,False,False,Psychology,default,t3_1h7xn2u
science,"The same factors (infrastructural, social capital, etc.) that make cities resilient to shocks and disasters make them happier places to live",,batman613,1h7umlt,https://reddit.com/r/science/comments/1h7umlt/the_same_factors_infrastructural_social_capital/,https://www.tandfonline.com/doi/full/10.1080/19463138.2024.2412664#d1e186,2024-12-06 05:55:37,12,0.81,12,0,2,0,0,False,False,False,False,False,Social Science,default,t3_1h7umlt
science,"Researchers found pregnancy apps can impact pregnancy experiences, either positively or negatively, based on their design features. These trackers, however, don’t necessarily prepare users for different pregnancy outcomes, researchers also learned.",,ChallengeAdept8759,1h7bbxd,https://reddit.com/r/science/comments/1h7bbxd/researchers_found_pregnancy_apps_can_impact/,https://news.northeastern.edu/2024/12/04/pregnancy-tracking-apps-research/,2024-12-05 15:10:59,12,0.65,12,0,1,0,0,False,False,False,False,False,Health,https://a.thumbs.redditmedia.com/gmuOKFiUZiM7RODnredFqJiTt0i1ct6sXRNZJn5XOW4.jpg,t3_1h7bbxd
science,"""The 24 DNA letters linked to autism"" -- A 24 nucleotide RNA mis-splicing (microexon in the CPEB4 RNA-binding regulatory protein) could be a major factor in autism.",,IntrepidTraveler888,1h82p2y,https://reddit.com/r/science/comments/1h82p2y/the_24_dna_letters_linked_to_autism_a_24/,https://english.elpais.com/science-tech/2024-12-04/the-24-dna-letters-linked-to-autism-gcaaggacatatgggcgaaggaga.html,2024-12-06 14:35:18,32,0.89,32,0,5,0,0,False,False,False,False,False,Neuroscience,https://b.thumbs.redditmedia.com/JilU5oYersOipJYOKjD7I9GChPjPY4X-539emvcuBjU.jpg,t3_1h82p2y
science,Information needs in bug reports for web applications,,davidshepherd,1h7cpwd,https://reddit.com/r/science/comments/1h7cpwd/information_needs_in_bug_reports_for_web/,https://www.sciencedirect.com/science/article/pii/S0164121224002747,2024-12-05 16:11:15,4,0.61,4,0,1,0,0,False,False,False,False,False,Computer Science,default,t3_1h7cpwd
science,Molecular Zip Code Draws Killer T Cells to Brain Tumors | Researchers programmed immune cells to attack glioblastoma and treat inflammation from multiple sclerosis in mice. The glioblastoma technology will soon be tested in a clinical trial.,,chrisdh79,1h839kc,https://reddit.com/r/science/comments/1h839kc/molecular_zip_code_draws_killer_t_cells_to_brain/,https://www.ucsf.edu/news/2024/12/429011/molecular-zip-code-draws-killer-t-cells-brain-tumors,2024-12-06 15:01:19,3,0.81,3,0,2,0,0,False,False,False,False,False,Cancer,https://b.thumbs.redditmedia.com/nYbBNKenBKejwu7rlNjfWUzFs2eBHJfMJhim6HMIgEY.jpg,t3_1h839kc
science,Assessing gender bias in the software used in computer science and software engineering education,,davidshepherd,1h7cmt3,https://reddit.com/r/science/comments/1h7cmt3/assessing_gender_bias_in_the_software_used_in/,https://www.sciencedirect.com/science/article/pii/S0164121224002693,2024-12-05 16:07:30,0,0.33,0,0,5,0,0,False,False,False,False,False,Computer Science,default,t3_1h7cmt3
science,Uncovering gender gap in academia: A comprehensive analysis within the software engineering community,,davidshepherd,1h7cvan,https://reddit.com/r/science/comments/1h7cvan/uncovering_gender_gap_in_academia_a_comprehensive/,https://www.sciencedirect.com/science/article/pii/S0164121224002073,2024-12-05 16:17:43,0,0.37,0,0,1,0,0,False,False,False,False,False,Computer Science,default,t3_1h7cvan
