subreddit,title,selftext,author,id,permalink,url,created_utc,score,upvote_ratio,ups,downs,num_comments,total_awards_received,gilded,is_video,is_original_content,is_self,over_18,spoiler,link_flair_text,thumbnail,name
gaming,Making Friends Monday! Share your game tags here!,"Use this post to look for new friends to game with! Share your gamer tag &amp; platform, and meet new people! 

This thread is posted weekly on Mondays (adjustments made as needed).",AutoModerator,1h4p86t,https://reddit.com/r/gaming/comments/1h4p86t/making_friends_monday_share_your_game_tags_here/,https://www.reddit.com/r/gaming/comments/1h4p86t/making_friends_monday_share_your_game_tags_here/,2024-12-02 07:00:13,0,0.41,0,0,2,0,0,False,False,True,False,False,Weekly Friends Thread,self,t3_1h4p86t
gaming,"A Black Ops 6 player allegedly abused an AFK Zombies glitch and left his Xbox on for over a month to become the first Prestige level 1000 player
",,ChiefLeef22,1h4wacg,https://reddit.com/r/gaming/comments/1h4wacg/a_black_ops_6_player_allegedly_abused_an_afk/,https://www.ign.com/articles/row-over-call-of-duty-black-ops-6-player-who-used-zombies-exploits-to-become-first-to-hit-prestige-master-level-1000-and-reveal-rewards,2024-12-02 14:33:47,3210,0.97,3210,0,142,0,0,False,False,False,False,False,,https://b.thumbs.redditmedia.com/QpFoLEXv8gFpoWuVRdc5ZOZDu39SqnvYQW0MI21Xr0E.jpg,t3_1h4wacg
gaming,"CD Projekt's switch to Unreal wasn't motivated by Cyberpunk 2077's rough launch or a 'This is so bad we need to switch' situation, says senior dev",,Roids-in-my-vains,1h4sucm,https://reddit.com/r/gaming/comments/1h4sucm/cd_projekts_switch_to_unreal_wasnt_motivated_by/,https://www.pcgamer.com/games/the-witcher/cd-projekts-switch-to-unreal-wasnt-motivated-by-cyberpunk-2077s-rough-launch-or-a-this-is-so-bad-we-need-to-switch-situation-says-senior-dev/,2024-12-02 11:26:18,2222,0.93,2222,0,404,0,0,False,False,False,False,False,,https://b.thumbs.redditmedia.com/ar3Jla0PnhmAIujlX2CimS8r1-95Sg34VyTW-aHeEaA.jpg,t3_1h4sucm
gaming,Australia bans upcoming anime fighter Hunter x Hunter: Nen Impact,,komodo_dragonzord,1h4jw9b,https://reddit.com/r/gaming/comments/1h4jw9b/australia_bans_upcoming_anime_fighter_hunter_x/,https://www.eventhubs.com/news/2024/dec/01/australia-ban-hunter-game/,2024-12-02 01:56:44,5767,0.95,5767,0,620,0,0,False,False,False,False,False,,https://a.thumbs.redditmedia.com/sQLHp7T0B2eKpwkny1ILFYr_qS6LU4jaLq_-m500l70.jpg,t3_1h4jw9b
gaming,I Built a House with the new Resin Blocks in Minecraft,,dancsa222,1h4s2j2,https://reddit.com/r/gaming/comments/1h4s2j2/i_built_a_house_with_the_new_resin_blocks_in/,https://i.redd.it/s1gd0lelxe4e1.png,2024-12-02 10:32:31,970,0.94,970,0,25,0,0,False,False,False,False,False,,https://b.thumbs.redditmedia.com/WTK8KJTAgc-iOyrNuJUaW-HEZHyQ3XdhUMbYhArReuw.jpg,t3_1h4s2j2
gaming,What game started great but got worse as updates got? ,Let me know which you think was a turnoff.,Majestic_Snow7613,1h4lwrh,https://reddit.com/r/gaming/comments/1h4lwrh/what_game_started_great_but_got_worse_as_updates/,https://www.reddit.com/r/gaming/comments/1h4lwrh/what_game_started_great_but_got_worse_as_updates/,2024-12-02 03:41:52,1798,0.91,1798,0,1477,0,0,False,False,True,False,False,,self,t3_1h4lwrh
gaming,Batman: Arkham Asylum. One of the most memorable intros I’ve ever played ,,metalhead0217,1h4p7dy,https://reddit.com/r/gaming/comments/1h4p7dy/batman_arkham_asylum_one_of_the_most_memorable/,https://i.redd.it/yaxvviaovd4e1.jpeg,2024-12-02 06:58:46,836,0.96,836,0,80,0,0,False,False,False,False,False,,https://b.thumbs.redditmedia.com/moOkyZdd5nDznyEgmI6Gmdu5FuqpDy-SczHFxuK6XJo.jpg,t3_1h4p7dy
gaming,"It's 1999 , you only have 60 USD and two FPS titans have launched just days apart, which one will you buy ?",,Johnny-silver-hand,1h4xisp,https://reddit.com/r/gaming/comments/1h4xisp/its_1999_you_only_have_60_usd_and_two_fps_titans/,https://i.redd.it/u8b6plmneg4e1.jpeg,2024-12-02 15:28:43,139,0.87,139,0,178,0,0,False,False,False,False,False,,https://b.thumbs.redditmedia.com/2oebS8RBe-uO5XkEmyo45l0FbX-XjeOWZOVAz31zOBw.jpg,t3_1h4xisp
gaming,What's a dropped game you still wish was made?,For me it's Scalebound. I still think about this,MuscleWarlock,1h4x3nt,https://reddit.com/r/gaming/comments/1h4x3nt/whats_a_dropped_game_you_still_wish_was_made/,https://i.redd.it/ssn6a9kebg4e1.jpeg,2024-12-02 15:10:28,104,0.9,104,0,139,0,0,False,False,False,False,False,,https://b.thumbs.redditmedia.com/aIUcJoYdDvqbewZ58mV0-OJMfAbd4wvyRpnVvGKKzxM.jpg,t3_1h4x3nt
gaming,"Xbox bus stop in Sydney, Australia",,deathbatdrummer,1h4hv5e,https://reddit.com/r/gaming/comments/1h4hv5e/xbox_bus_stop_in_sydney_australia/,https://i.redd.it/4urujnn0wb4e1.png,2024-12-02 00:17:20,1528,0.95,1528,0,186,0,0,False,False,False,False,False,,https://b.thumbs.redditmedia.com/3ij-f3WLUEt3s0_HPNKVi7Cqdi0DjkOBrSzqyjrLR1s.jpg,t3_1h4hv5e
gaming,Got a PS5? Sony just put out a ‘feature update’ that adds the PS1 boot up sequence to it.,,Sonikku_a,1h4x5lr,https://reddit.com/r/gaming/comments/1h4x5lr/got_a_ps5_sony_just_put_out_a_feature_update_that/,https://youtu.be/--HpxXfnhTc?si=DHBBJz_4kEoURsZU,2024-12-02 15:12:49,66,0.95,66,0,15,0,0,False,False,False,False,False,,https://a.thumbs.redditmedia.com/cdP8rI2zZdBu68uEl4eEnoeNgLkNjeFnXwuK4b1ayX4.jpg,t3_1h4x5lr
gaming,Sony and Microsoft should have to show you the online player count for multiplayer focused games ,If a game relies on having a healthy player base then that information should be available so you can make an informed purchase ,ThisNameDoesntCount,1h4wizy,https://reddit.com/r/gaming/comments/1h4wizy/sony_and_microsoft_should_have_to_show_you_the/,https://www.reddit.com/r/gaming/comments/1h4wizy/sony_and_microsoft_should_have_to_show_you_the/,2024-12-02 14:44:57,67,0.68,67,0,41,0,0,False,False,True,False,False,,self,t3_1h4wizy
gaming,Avowed dev with credits on RPGs dating back 25 years says this is the most confident he's ever been in a game at this point,,ReasonableAdvert,1h43rq7,https://reddit.com/r/gaming/comments/1h43rq7/avowed_dev_with_credits_on_rpgs_dating_back_25/,https://www.gamesradar.com/games/rpg/avowed-dev-with-credits-on-rpgs-dating-back-25-years-says-this-is-the-most-confident-hes-ever-been-in-a-game-at-this-point/,2024-12-01 13:55:09,8864,0.83,8864,0,1280,0,0,False,False,False,False,False,,https://b.thumbs.redditmedia.com/8Vac62LdtRr1Rho2_6bOKzQYDr5eIinzMhHCJAV6SDw.jpg,t3_1h43rq7
gaming,"CD Projekt wants to be more careful about marketing after, you know, everything that happened with Cyberpunk 2077 - ""We want to drop crumbs here and there so that people can pick up on it""",,ChiefLeef22,1h44k6v,https://reddit.com/r/gaming/comments/1h44k6v/cd_projekt_wants_to_be_more_careful_about/,https://www.pcgamer.com/games/rpg/cd-projekt-wants-to-be-more-careful-about-marketing-after-you-know-everything-that-happened-with-cyberpunk-2077/,2024-12-01 14:34:58,4807,0.94,4807,0,459,0,0,False,False,False,False,False,,https://b.thumbs.redditmedia.com/wf5x5Rs-a4hgWfDWIqTDCx6b2Rn3l5XsXbs1auAcYQY.jpg,t3_1h44k6v
gaming,"Best Racing Game &amp; Car Never Get Old. They Made Real BMW M3 GTR in Munich, Germany. You Can Visit it.",,Xtreme_Shoot20042012,1h4vsir,https://reddit.com/r/gaming/comments/1h4vsir/best_racing_game_car_never_get_old_they_made_real/,https://i.redd.it/tz5j3i380g4e1.png,2024-12-02 14:10:05,53,0.88,53,0,2,0,0,False,False,False,False,False,,https://b.thumbs.redditmedia.com/FaoQSi6AX9JZ4r-bVYz7vg5s1891yH1RGQ9ISTSaRuk.jpg,t3_1h4vsir
gaming,Couldn't pass this up. Halo/Master Chief controller holder. ,Walking thru Home Goods found all kinds of these from gaming to movie characters. Pretty cool,theJester63,1h4e16c,https://reddit.com/r/gaming/comments/1h4e16c/couldnt_pass_this_up_halomaster_chief_controller/,https://i.redd.it/fxm2rmeo1b4e1.jpeg,2024-12-01 21:27:04,1038,0.93,1038,0,39,0,0,False,False,False,False,False,,https://b.thumbs.redditmedia.com/gjAxKSCOkeBljBKbJkZWWupXYNmfswkXl-IYqpeDFuQ.jpg,t3_1h4e16c
gaming,Games should have a seperate download option with non-4k textures and compressed Audio,"I was looking for some Games that I might want to get only to find that all of those Games are INSANELY large for the content they offer

After looking into it I found that 90% of that is just from high resolution textures and wav audio files... I'm sorry but I don't want that

As a Person that couldn't care less about Graphics I really don't want that a Game fills up so much space with some stupid images plastered onto a wall (And I say that with 8TB of storage).

Games already have multiple Download options, why not allow Me to choose between the Game with full resolution textures and wav audio, and another version that uses 2K **(2048x2048)** textures with FLAC Audio while keeping everything else the same

Sure it would be extra work, but batch scaling down textures and changing out WAV files with FLAC files isn't that difficult (Since I already did that with multiple Games. Problem is just that tons of Games don't allow it).

And I also think it would make sense from a business standpoint as I personally just don't buy some Games when I see how much storage they take up for the content they give Me.

A major reason why I don't buy Call Of Duty games anymore is because the Game size is insane for the short campaign and the repetitive multiplayer

Yes games can look great without having 4K **(4096x4096)** textures and because People will disagree on that I think we should give People both and just allow People to choose what they want to use

  
**Edit:When I say ""4K, 2K and Full HD textures"" I mean 4K=4096, 2K=2048, and Full HD=1080 or 1440. Yes I know it doesn't make complete sense but it was late when I made thi spost and I was tired. Should have worded it more clearly in retrospective**",TheGoodSatan666,1h4hwgr,https://reddit.com/r/gaming/comments/1h4hwgr/games_should_have_a_seperate_download_option_with/,https://www.reddit.com/r/gaming/comments/1h4hwgr/games_should_have_a_seperate_download_option_with/,2024-12-02 00:19:05,474,0.84,474,0,139,0,0,False,False,True,False,False,,self,t3_1h4hwgr
gaming,Very popular games you yourself have never played or had any interest in?,"I get people being surprised I have never played Minecraft once in my life. This is of course a question for more avid gamers, however most people have played something at least once. I love simulation games too which is the most surprising thing. I grew up playing all the sim cities, and tons of other build it yourself games. I was the prime age for Minecraft when it came out, just never wanted to play it.

What have you not played or tried? Almost avoiding it even?",NewsInside8464,1h4klpc,https://reddit.com/r/gaming/comments/1h4klpc/very_popular_games_you_yourself_have_never_played/,https://www.reddit.com/r/gaming/comments/1h4klpc/very_popular_games_you_yourself_have_never_played/,2024-12-02 02:32:58,295,0.84,295,0,968,0,0,False,False,True,False,False,,self,t3_1h4klpc
gaming,What REGULAR enemies have the best design?,"Unlike bosses, who are usually meticulously planned out, with multiple phases, forms etc. 

Personally, I always liked the wasps from Donkey Kong Country. Their design and functionality is just somehow spot on. ",Worth-Primary-9884,1h4qihj,https://reddit.com/r/gaming/comments/1h4qihj/what_regular_enemies_have_the_best_design/,https://www.reddit.com/r/gaming/comments/1h4qihj/what_regular_enemies_have_the_best_design/,2024-12-02 08:34:20,93,0.85,93,0,149,0,0,False,False,True,False,False,,self,t3_1h4qihj
gaming,Do y'all ever get game choice paralysis?,"For lack of a better word deal ever get game choice paralysis. 

Like you complete a game that you've been playing for however long and you have a whole bunch of games in your backlog. Then spend the next few weeks struggling to decide which game to play. ",zildux,1h4fwqe,https://reddit.com/r/gaming/comments/1h4fwqe/do_yall_ever_get_game_choice_paralysis/,https://www.reddit.com/r/gaming/comments/1h4fwqe/do_yall_ever_get_game_choice_paralysis/,2024-12-01 22:48:10,470,0.92,470,0,217,0,0,False,False,True,False,False,,self,t3_1h4fwqe
gaming,Is it true that Pro Evolution soccer used to be the better soccer game? ,"Like I hear people talk how Pro evolution soccer or ISS used to be the soccer game, I always thought Fifa was the best.",Ghaleon32,1h4wylo,https://reddit.com/r/gaming/comments/1h4wylo/is_it_true_that_pro_evolution_soccer_used_to_be/,https://www.reddit.com/r/gaming/comments/1h4wylo/is_it_true_that_pro_evolution_soccer_used_to_be/,2024-12-02 15:04:14,23,0.83,23,0,27,0,0,False,False,True,False,False,,self,t3_1h4wylo
gaming,Friendly reminder: you have 2 weeks left to get Forza Horizon 4,"The game gets delisted on December 14th. There’s currently a sale for all editions on Xbox and Steam, ending in 1 day and 3 days respectively.",dinofreak6301,1h4b9fa,https://reddit.com/r/gaming/comments/1h4b9fa/friendly_reminder_you_have_2_weeks_left_to_get/,https://www.reddit.com/r/gaming/comments/1h4b9fa/friendly_reminder_you_have_2_weeks_left_to_get/,2024-12-01 19:29:35,743,0.88,743,0,175,0,0,False,False,True,False,False,,self,t3_1h4b9fa
gaming,Ubisoft gets a lot of hate but the accessibility options in their games are just next level,"I was playing ghost recon breakpoint and I was seriously pleased with how far you can go to customize everything to your liking. You can customize the controls to whatever you like. If you want to hold down a button, tap it, or just press it to do a certain action for instance.  In other games changing the controls can be more difficult than it needs to be but Ubisoft just gives you the power to do what works best for you.

I noticed Ubisoft really puts a lot of controls in the players hands when it comes to the gameplay as well.

In star wars outlaws you can change little things like turning on or off the mini puzzles when working on terminals or unlocking doors. You can change the text on the cards in the card games so it's easier to read among other things. I love this especially as you can turn off whatever you want so it doesn't hurt the flow of the game.

These are just a few options of course. Ubisoft gets a lot of hate but honestly their accessibility options are just next level and it's really impressive how far they go.",Ghostspider1989,1h4g6n6,https://reddit.com/r/gaming/comments/1h4g6n6/ubisoft_gets_a_lot_of_hate_but_the_accessibility/,https://www.reddit.com/r/gaming/comments/1h4g6n6/ubisoft_gets_a_lot_of_hate_but_the_accessibility/,2024-12-01 23:00:05,320,0.65,320,0,193,0,0,False,False,True,False,False,,self,t3_1h4g6n6
gaming,"Official Dragon Ball: Sparking Zero tournament ends in disaster as finalists fly up and down for 10 minutes straight, which some fans insist is peak performance",,komodo_dragonzord,1h3qxhq,https://reddit.com/r/gaming/comments/1h3qxhq/official_dragon_ball_sparking_zero_tournament/,https://www.gamesradar.com/games/fighting/official-dragon-ball-sparking-zero-tournament-ends-in-disaster-as-finalists-fly-up-and-down-for-10-minutes-straight-which-some-fans-insist-is-peak-performance/,2024-12-01 00:42:13,19673,0.95,19673,0,1001,0,0,False,False,False,False,False,,https://a.thumbs.redditmedia.com/FdSTFLLJFkCnfGF8KHDrHS650RF5E2KVLqr6Uj8GYq4.jpg,t3_1h3qxhq
gaming,What hidden gems are you guys buying during this Steam sale?,"I'm not much of AAA type of gamer so I'm curious to know what hidden gems people have been grabbing during this sale.

I currently have my eyes set on Archvale, which looks and feels very juicy and polished. Also Steam Deck verified.",teinimon,1h43lmg,https://reddit.com/r/gaming/comments/1h43lmg/what_hidden_gems_are_you_guys_buying_during_this/,https://www.reddit.com/r/gaming/comments/1h43lmg/what_hidden_gems_are_you_guys_buying_during_this/,2024-12-01 13:45:53,744,0.89,744,0,672,0,0,False,False,True,False,False,,self,t3_1h43lmg
gaming,Over twenty years later and nothing beats the experience of riding around in a warthog with your best friend. Halo: CE,"Finally got around to buying the Master Chief Collection. Playing through Halo: CE today and I again become amazed with how well Halo did vehicle combat. It’s not realistic in any way. It’s more like driving a Sea Do than a truck, but over twenty years later, it hasn’t been beaten. IMO, of course

Even Halo 2, which had amazing vehicle combat, lost something with destructible vehicles. There’s something pure about the indestructible warthog that goes soaring through the sky when it gets struck by a perfectly timed rocket/grenade. Hoping beyond hope that you’re able to pull off the landing and make it back to base with your flag

What happened? Why have game developers leaned so much more towards realism when it comes to vehicles? If they include them at all? 

Am I just alone here? Are there great vehicles in other FPSeseses that put the Warthog to shame? ",theoutlet,1h4e0e0,https://reddit.com/r/gaming/comments/1h4e0e0/over_twenty_years_later_and_nothing_beats_the/,https://www.reddit.com/r/gaming/comments/1h4e0e0/over_twenty_years_later_and_nothing_beats_the/,2024-12-01 21:26:06,178,0.79,178,0,56,0,0,False,False,True,False,False,,self,t3_1h4e0e0
gaming,"What's your most shameful backlog game?
","I recently finished Silent Hill 2 after two decades of being told its one of the best horror games ever made, I can finally confim that statment.



Whats that game you still havnt played but really should?",Dark_Pages,1h4mhzm,https://reddit.com/r/gaming/comments/1h4mhzm/whats_your_most_shameful_backlog_game/,https://www.reddit.com/r/gaming/comments/1h4mhzm/whats_your_most_shameful_backlog_game/,2024-12-02 04:13:37,40,0.73,40,0,190,0,0,False,False,True,False,False,,self,t3_1h4mhzm
gaming,"In the game Diplomacy is Not an Option, diplomacy is not an option.",,off-and-on,1h3m7wm,https://reddit.com/r/gaming/comments/1h3m7wm/in_the_game_diplomacy_is_not_an_option_diplomacy/,https://i.redd.it/nja2jf8qr34e1.jpeg,2024-11-30 20:58:54,14659,0.96,14659,0,148,0,0,False,False,False,False,False,,https://b.thumbs.redditmedia.com/T0mR7w2Q82TbbHL5orlfaVAtTIXhI-kLwVPUiRxCSzY.jpg,t3_1h3m7wm
gaming,Crash 4 randomly appeared on my Firestick as Gamepass compatible. Maybe is coming soon?,When i try to open it It goes to the Nsane Trilogy page. Weird.,sonicfonico,1h47xnd,https://reddit.com/r/gaming/comments/1h47xnd/crash_4_randomly_appeared_on_my_firestick_as/,https://i.redd.it/d9ppsiwhr94e1.jpeg,2024-12-01 17:08:16,175,0.78,175,0,31,0,0,False,False,False,False,False,,https://b.thumbs.redditmedia.com/38BfNva_t11ZJqu0tJkLoqe1OjFD6LzkyPIB6UKfpzY.jpg,t3_1h47xnd
gaming,Which kids in games did you genuinely care for?,"Everybody I know got really attached to protecting Clementine in the Walking Dead. Which kids were made well enough that you wanted to fight for? My list so far is

Haruka in the Yakuza/Like A Dragon series

The rest of the orphans in Yakuza/LAD

Nanako in Persona 4

Ciri in the Witcher

AJ in the Walking Dead",StMcAwesome,1h4eq2p,https://reddit.com/r/gaming/comments/1h4eq2p/which_kids_in_games_did_you_genuinely_care_for/,https://www.reddit.com/r/gaming/comments/1h4eq2p/which_kids_in_games_did_you_genuinely_care_for/,2024-12-01 21:56:39,50,0.7,50,0,114,0,0,False,False,True,False,False,,self,t3_1h4eq2p
gaming,Max Payne 3 multiplayer on PC,"How many of you are still playing it?

If you haven't tried it yet, I highly recommend it, it's super fun and still being played.",Unomas1745,1h4x62l,https://reddit.com/r/gaming/comments/1h4x62l/max_payne_3_multiplayer_on_pc/,https://www.reddit.com/r/gaming/comments/1h4x62l/max_payne_3_multiplayer_on_pc/,2024-12-02 15:13:21,2,1.0,2,0,2,0,0,False,False,True,False,False,,self,t3_1h4x62l
gaming,I did not realize they put Aero the Acrobat on modern consoles. ,"Back in the day Areo was one of my favorite Blockbuster rentals. With all this talk about the Retro Engine and Sunsoft license holders interested in bringing their old games to current day platforms, I was eagerly awaiting an announcement, but I guess it flew by me. Much to my surprise when I was browsing the PS5 store a few minures ago, I saw it listed. It was apparently released last month and it's a port of the GBA remake. This makes me so happy. 

Edit: Apparently in addition to the GBA version, there's also ports of the Sega Genesis/SNES version as well. In addition Aero 2 is also available. ",virtualpig,1h4jol3,https://reddit.com/r/gaming/comments/1h4jol3/i_did_not_realize_they_put_aero_the_acrobat_on/,https://www.reddit.com/r/gaming/comments/1h4jol3/i_did_not_realize_they_put_aero_the_acrobat_on/,2024-12-02 01:45:50,22,0.73,22,0,4,0,0,False,False,True,False,False,,self,t3_1h4jol3
gaming,Any game that has a SAVE button should also have a LOAD button,,WineYoda,1h3ps18,https://reddit.com/r/gaming/comments/1h3ps18/any_game_that_has_a_save_button_should_also_have/,https://i.redd.it/w02wkemml44e1.png,2024-11-30 23:46:54,2409,0.95,2409,0,105,0,0,False,False,False,False,False,,https://b.thumbs.redditmedia.com/OyXtOePSlN3F-vgmccS8SuP6efKAJKIXVi5vRgSm7TM.jpg,t3_1h3ps18
gaming,Fable 1-choose evil commercial,,bomb5000,1h48y6r,https://reddit.com/r/gaming/comments/1h48y6r/fable_1choose_evil_commercial/,https://youtu.be/I4NwC3GBIDk,2024-12-01 17:51:34,75,0.8,75,0,24,0,0,False,False,False,False,False,,https://b.thumbs.redditmedia.com/DKX7RBjP5X1thwZ-3HLifGlOmFwhmL3Rmid_JxwFBqU.jpg,t3_1h48y6r
gaming,"If you could only play one numbered entry in a game series (e.g., only the first game, only the second, etc.), which number would you pick and why?","I find reasons for go for anything 1, 2, and 3, but i think 2 might be my pick. Resident Evil 2, Black Ops 2, LittleBigPlanet 2, Hot Pursuit 2, list is probably longer but that's all I can remember that'd I actually play. 

Yes remakes count, and it doesn't necessarily have to be the second game in the series, just needs to be a sequel/have 2 in the title. Figured this would be more different than the usual ""only one game to play forever"" question. ",Fitz_01,1h4hgoc,https://reddit.com/r/gaming/comments/1h4hgoc/if_you_could_only_play_one_numbered_entry_in_a/,https://www.reddit.com/r/gaming/comments/1h4hgoc/if_you_could_only_play_one_numbered_entry_in_a/,2024-12-01 23:58:56,21,0.6,21,0,104,0,0,False,False,True,False,False,,self,t3_1h4hgoc
gaming,Is a PS5 or a higher refresh rate monitor worth it? (Maybe OLED),"Let’s say for example I have a 165hz 1440p monitor, but can push well over 200fps and then some as it is. Is it truly worth investing in a monitor that can handle that and then some? Potentially OLED too?

Or would it make more sense to invest in a PS5 to have as a system to play older games that are basically dead on PC, but very much alive on Series X/PS5. I know gamepass exists, but I’m not exactly interested in that. 

Kinda curious on feedback of what everyone thinks. I’ve only experienced an OLED TV, and it was incredible, and I don’t necessarily need a console but….i really only prefer the PC for things like MMOs where it really shines. Yes COD can shine too, but older games are usually hacked and not worth messing with, and there’s still PS5 exclusives that I can’t get (though many do come over for sure). ",Icy-Computer7556,1h4y1vi,https://reddit.com/r/gaming/comments/1h4y1vi/is_a_ps5_or_a_higher_refresh_rate_monitor_worth/,https://www.reddit.com/r/gaming/comments/1h4y1vi/is_a_ps5_or_a_higher_refresh_rate_monitor_worth/,2024-12-02 15:51:41,1,1.0,1,0,0,0,0,False,False,True,False,False,,self,t3_1h4y1vi
gaming,"What games have you played several times, enjoyed, but have never beaten?","I'll start with Hollow Knight and Kung-Fu for NES. Just can't beat those games no matter how hard I try. Honorable mention goes to Mertoid Prime but I finally just beat it after 3 full runs through that game.


Edit I meant Metroid Dread not Prime. Prime was very fun and beatable",dunkan799,1h425l8,https://reddit.com/r/gaming/comments/1h425l8/what_games_have_you_played_several_times_enjoyed/,https://www.reddit.com/r/gaming/comments/1h425l8/what_games_have_you_played_several_times_enjoyed/,2024-12-01 12:23:07,116,0.89,116,0,306,0,0,False,False,True,False,False,,self,t3_1h425l8
gaming,What's the best Easter egg you have ever found in a game?,I always love finding hidden Easter eggs. Especially by accident with no clue of their existence. I'm just curious to know what the best one is other have found?,TheHottestEmber,1h480no,https://reddit.com/r/gaming/comments/1h480no/whats_the_best_easter_egg_you_have_ever_found_in/,https://www.reddit.com/r/gaming/comments/1h480no/whats_the_best_easter_egg_you_have_ever_found_in/,2024-12-01 17:12:00,45,0.71,45,0,142,0,0,False,False,True,False,False,,self,t3_1h480no
gaming,"Arcane producer has the final say on explaining the Netflix show's $250 million budget: ""We are a game company… We didn't lease out the work""",,Roids-in-my-vains,1h38mzs,https://reddit.com/r/gaming/comments/1h38mzs/arcane_producer_has_the_final_say_on_explaining/,https://www.gamesradar.com/entertainment/animation-shows/arcane-producer-has-the-final-say-on-explaining-the-netflix-shows-usd250-million-budget-we-are-a-game-company-we-didnt-lease-out-the-work/,2024-11-30 08:59:08,23626,0.93,23626,0,1322,0,0,False,False,False,False,False,,https://b.thumbs.redditmedia.com/fV9fflZnOdMPzIArwZyA3nflBZlEa_qNni6DgbOOdEI.jpg,t3_1h38mzs
gaming,What game would be amazing with a time loop perspective on another/new game+ playthrough?,"For example, I finished cyberpunk 2077 and immediately started a new game. I get to the Peralez side mission with Johnny warning me away, and I wanted to tell him it's way more interesting than he knows. I got to thinking, what if games had different dialogue options for multiple playthroughs in the style of a time-loop scenario?
",pauciradiatus,1h4azvd,https://reddit.com/r/gaming/comments/1h4azvd/what_game_would_be_amazing_with_a_time_loop/,https://www.reddit.com/r/gaming/comments/1h4azvd/what_game_would_be_amazing_with_a_time_loop/,2024-12-01 19:18:22,20,0.68,20,0,22,0,0,False,False,True,False,False,,self,t3_1h4azvd
