subreddit,title,selftext,author,id,permalink,url,created_utc,score,upvote_ratio,ups,downs,num_comments,total_awards_received,gilded,is_video,is_original_content,is_self,over_18,spoiler,link_flair_text,thumbnail,name
gaming,Visual clarity and performance,"Am I the only one who feels like so many games are now forcing you to choose between the two nowadays? Especially with UE5? 

Feels like we've just regressed so far. Arkham Knight was capable of looking as good as it does without huge performance sacrifices. Why is that not a thing nowadays?",N1ghtBlade15,1h4cmop,https://reddit.com/r/gaming/comments/1h4cmop/visual_clarity_and_performance/,https://www.reddit.com/r/gaming/comments/1h4cmop/visual_clarity_and_performance/,2024-12-01 20:27:18,0,0.29,0,0,17,0,0,False,False,True,False,False,,self,t3_1h4cmop
gaming,If we the players hear boss music (when fighting a boss) what does said boss hear?,Would they hear their own theme or something else entirely? ,Scared-Gamer,1h36aks,https://reddit.com/r/gaming/comments/1h36aks/if_we_the_players_hear_boss_music_when_fighting_a/,https://www.reddit.com/r/gaming/comments/1h36aks/if_we_the_players_hear_boss_music_when_fighting_a/,2024-11-30 06:14:22,144,0.8,144,0,139,0,0,False,False,True,False,False,,self,t3_1h36aks
gaming,"what are some Games that you can tell it was rushed as hell.
","Spyro: Enter the Dragonfly is a good example as the game is filled with glitches and very long loading times as Universal wanted the game to released by Christmas 2002.

*Superman 64 is another example of a rushed game as it has a lot of glitches and bugs.*",bomb5000,1h352y8,https://reddit.com/r/gaming/comments/1h352y8/what_are_some_games_that_you_can_tell_it_was/,https://www.reddit.com/r/gaming/comments/1h352y8/what_are_some_games_that_you_can_tell_it_was/,2024-11-30 05:00:59,155,0.74,155,0,335,0,0,False,False,True,False,False,,self,t3_1h352y8
gaming,"Getting stuff from steam, how forgiving are the minimum specs for most games?","Looking at some games and only spec I don't hit due to PC age is the CPU.  Most of the ones I'm looking at have Intel i5 3570 as their min CPU speed but my PC has a amd fx 6300 so not sure if it would run.  

Would you suggest getting them in hope and maybe if I get a new PC in a few years?",crazy-carebear,1h474vn,https://reddit.com/r/gaming/comments/1h474vn/getting_stuff_from_steam_how_forgiving_are_the/,https://www.reddit.com/r/gaming/comments/1h474vn/getting_stuff_from_steam_how_forgiving_are_the/,2024-12-01 16:33:43,0,0.46,0,0,30,0,0,False,False,True,False,False,,self,t3_1h474vn
gaming,What’s a game you know like the back of your hand?,"Maybe one of your favorite games ever or one you’ve simply played enough to know in and out?

Mine would probably be Demon’s Souls, played through it so many times I purposely make it hard for myself, going fists or crippling myself with poison or something.

Sometimes games you enjoy but don’t necessarily don’t have anything more to do in become enjoyable when you throw some extra difficulty in for shits and giggles.",CynicalRaps,1h2wx1r,https://reddit.com/r/gaming/comments/1h2wx1r/whats_a_game_you_know_like_the_back_of_your_hand/,https://www.reddit.com/r/gaming/comments/1h2wx1r/whats_a_game_you_know_like_the_back_of_your_hand/,2024-11-29 21:55:12,480,0.92,480,0,1235,0,0,False,False,True,False,False,,self,t3_1h2wx1r
gaming,She presents a convincing case...,,Trickytori84,1h2ff3z,https://reddit.com/r/gaming/comments/1h2ff3z/she_presents_a_convincing_case/,https://i.redd.it/l6e3egdi9s3e1.jpeg,2024-11-29 06:17:07,10548,0.94,10548,0,869,0,0,False,False,False,False,False,,https://b.thumbs.redditmedia.com/Axks1dHDW7ALrQ2I4voVgA2jCuS5uPRCo-PzYsQp_iE.jpg,t3_1h2ff3z
gaming,Looking for a particular tittle,"There was someone who posted about a steam game where you were a fixer upper and trying to fix things as cheap as possible. 

I remember you could even drink in the video they showed? Idk",relaps101,1h46api,https://reddit.com/r/gaming/comments/1h46api/looking_for_a_particular_tittle/,https://www.reddit.com/r/gaming/comments/1h46api/looking_for_a_particular_tittle/,2024-12-01 15:56:09,0,0.33,0,0,9,0,0,False,False,True,False,False,,self,t3_1h46api
gaming,Got SW Jedi Surviror during this steam sale and absolutely loving it!! I was worried about performance issues cuz I heard its launch was pretty rough but till now its running smoothly at 1440p Ultra settings,,GrinningAxe9,1h2qtnc,https://reddit.com/r/gaming/comments/1h2qtnc/got_sw_jedi_surviror_during_this_steam_sale_and/,https://i.redd.it/noog4dyckv3e1.png,2024-11-29 17:24:16,956,0.81,956,0,195,0,0,False,False,False,False,False,,https://b.thumbs.redditmedia.com/qd6Z-WeTJFbCqwgNfrYQBryvpbzH34aMrpVqwoWRL1I.jpg,t3_1h2qtnc
gaming,Is Resident Evil 4 Remake worth buying for 20$ from the PS store? ,"I haven’t played the previous games but was thinking on starting with RE2 remake and than play RE4 remake
With which one should I start? ",Lost-Leading,1h48t7a,https://reddit.com/r/gaming/comments/1h48t7a/is_resident_evil_4_remake_worth_buying_for_20/,https://www.reddit.com/r/gaming/comments/1h48t7a/is_resident_evil_4_remake_worth_buying_for_20/,2024-12-01 17:45:42,0,0.38,0,0,40,0,0,False,False,True,False,False,,self,t3_1h48t7a
gaming,"Gamers that have played Cuphead, Hollow Knight and Elden Ring; which did you find more challenging?","I've completed Cuphead and Hollow Knight myself, yet to try Elden Ring, trying to gauge just how rough a ride I'd be in for!",digiBeLow,1h47jkz,https://reddit.com/r/gaming/comments/1h47jkz/gamers_that_have_played_cuphead_hollow_knight_and/,https://www.reddit.com/r/gaming/comments/1h47jkz/gamers_that_have_played_cuphead_hollow_knight_and/,2024-12-01 16:51:45,0,0.44,0,0,122,0,0,False,False,True,False,False,,self,t3_1h47jkz
gaming,Any good hidden coop gems out there that us also available on ps5?,I'm looking for a good coop game that can be played with 2 or more friends. If any of you guys know of some good games please tell me about them.,dontbeserious_18,1h44f2o,https://reddit.com/r/gaming/comments/1h44f2o/any_good_hidden_coop_gems_out_there_that_us_also/,https://www.reddit.com/r/gaming/comments/1h44f2o/any_good_hidden_coop_gems_out_there_that_us_also/,2024-12-01 14:28:03,0,0.38,0,0,15,0,0,False,False,True,False,False,,self,t3_1h44f2o
gaming,Deep Rock Galactic made me appreciate Indie games more,"Now to be honest, I'm still not that much of an Indie fan. I prefer my games to have a realistic artstyle, to have high visual fidelity, to have hollywood like moments and real time cutscenes and overall the polish only a AAA game can provide. Really, you couldn't bring me to touch an Indie game, because I got burned badly by some and after those experiences, they all looked so cheap and not worth the money.

That said, after a friend finally persuaded me to give DRG a chance and after I played it for a while, both with him and alone, I realized that indie games do can be fun and that stylized graphics can look good. I was really surprised at how fun the game is and over time, my mindset changed to:"" If this Indie game is fun, maybe others are as well."". 

And so I did try them and while most of them still aren't to my liking, I did find a few that I enjoyed (Ready or Not, Executive Assault 2, Cavern of Dreams or Eternal Evil to name a few). It also helps that Indie games become better and better and can reach AA quality levels nowadays, while also having a realistic artstyle.

That said, my tolerance still has limits. If I see any pixelart or cell shading in a game, I still instantly lose any interest, same with obvious pre made assets. And for stylized graphics, it really is a case by case situation. While I tolerate Running with Rifles for example, you can hunt me to the end of the world with Battle Bits Remastered or anything made with Synthy.

However, when you have a game like Ready or Not or SCP 5K, where you can show me ""Here, look. This game looks realistic, this game is dark and gritty and looks like a AAA title on the surface"", then you have my interest and usually a buy as well, if the end product is well made.",Nino_Chaosdrache,1h4elho,https://reddit.com/r/gaming/comments/1h4elho/deep_rock_galactic_made_me_appreciate_indie_games/,https://www.reddit.com/r/gaming/comments/1h4elho/deep_rock_galactic_made_me_appreciate_indie_games/,2024-12-01 21:51:06,0,0.21,0,0,12,0,0,False,False,True,False,False,,self,t3_1h4elho
gaming,"I'm looking for Grim, Dark, Dystopian, Sombre, Solemn,  even Lovecraftian Atmospheric games. ","This is 1 of my favourite genres of all time. I love being taken on a journey by a game. 

Games like this that I already own, for anyone else looking to try some:

Chromosome Evil

Inside

A plague tale: Requiem

A plague tale: Innosence

Darkwood

Bramble: the mountain king

Sunless Sea

Frostpunk

This war of mine

All Metro games

DARQ

LIMBO

",Askin_Real_Questions,1h3yzea,https://reddit.com/r/gaming/comments/1h3yzea/im_looking_for_grim_dark_dystopian_sombre_solemn/,https://www.reddit.com/r/gaming/comments/1h3yzea/im_looking_for_grim_dark_dystopian_sombre_solemn/,2024-12-01 08:37:01,0,0.48,0,0,210,0,0,False,False,True,False,False,,self,t3_1h3yzea
gaming,"Death in RDR2, phew!","I just bought RDR and RDR2 on sale, finally. 
They're so much fun. I started with RDR, and then thought I'd just look at RDR2, to see it... I've made it 20% of the way... oops. Need to get back to RDR! 
I die quite a few times :-D. I like that I'm not back at the beginning! It got me wondering what happened to others. Have you died a lot out in the open world? Have you gone into encounters cautiously? ",polylusion-games,1h4dp2f,https://reddit.com/r/gaming/comments/1h4dp2f/death_in_rdr2_phew/,https://www.reddit.com/r/gaming/comments/1h4dp2f/death_in_rdr2_phew/,2024-12-01 21:12:49,0,0.2,0,0,26,0,0,False,False,True,False,False,,self,t3_1h4dp2f
gaming,Vicar Amelia fro Bloodborne done by me,,artcore6666,1h2lljx,https://reddit.com/r/gaming/comments/1h2lljx/vicar_amelia_fro_bloodborne_done_by_me/,https://i.redd.it/53xe7qfmcu3e1.png,2024-11-29 13:18:19,1076,0.96,1076,0,44,0,0,False,False,False,False,False,,https://a.thumbs.redditmedia.com/Q6O8CzwqvtVl34pfp1QVun5v2_riyEHwKLxtHz4gsN4.jpg,t3_1h2lljx
gaming,Man's back with another Tank Simulator,,reckless150681,1h2ztub,https://reddit.com/r/gaming/comments/1h2ztub/mans_back_with_another_tank_simulator/,https://www.youtube.com/watch?v=GaONAsMISRA,2024-11-30 00:13:44,91,0.76,91,0,16,0,0,False,False,False,False,False,,https://b.thumbs.redditmedia.com/18ehrfAeq0nHcr4cZn5n-GXkYE6HXhghaM-3VKngg_M.jpg,t3_1h2ztub
gaming,Viscera Cleanup + Arena Shooter: Is this a thing?,"As title suggests I'm looking for a game similar to Viscera Cleanup, powerwash etc etc BUT is also a nice FPS. Go through killing everyone in level, then run it back cleaning it up. Every time I make a huge pool of blood or splatter a guy on a wall my satisfying cleaner part of me wants to well just clean it up, so a game like that would be really a dream come true. To my knowledge I don't think there is a game like that, just one or the other, but surely there's something out there atleast a bit like that. I humbly ask reddit to help me in my search of more niche games to play.",FlashyBackies,1h3zn7s,https://reddit.com/r/gaming/comments/1h3zn7s/viscera_cleanup_arena_shooter_is_this_a_thing/,https://www.reddit.com/r/gaming/comments/1h3zn7s/viscera_cleanup_arena_shooter_is_this_a_thing/,2024-12-01 09:25:51,0,0.35,0,0,4,0,0,False,False,True,False,False,,self,t3_1h3zn7s
gaming,Any Chinese gamers wanna give some insight?,"So when people talk about popular PC games in China, they often refer to either [wegame rankings](https://www.wegame.com.cn/rail/rank_detail.html?ranktype=popular_this_week) or [17173 rankings](https://top.17173.com/list-2-0-0-0-0-0-0-0-0-0-1.html)

However, those 2 lists are very different, so wondering why that is and which is a better barometer.",Tazdingoooo,1h4225m,https://reddit.com/r/gaming/comments/1h4225m/any_chinese_gamers_wanna_give_some_insight/,https://www.reddit.com/r/gaming/comments/1h4225m/any_chinese_gamers_wanna_give_some_insight/,2024-12-01 12:17:02,0,0.36,0,0,3,0,0,False,False,True,False,False,,self,t3_1h4225m
gaming,OPEN TTD vs Voxel Tycoon,"I really like playing OPEN TTD, but the age shows and ui could be better.   
is voxel tycoon any similar? ",TheNoxxin,1h3f990,https://reddit.com/r/gaming/comments/1h3f990/open_ttd_vs_voxel_tycoon/,https://www.reddit.com/r/gaming/comments/1h3f990/open_ttd_vs_voxel_tycoon/,2024-11-30 15:44:42,4,0.59,4,0,7,0,0,False,False,True,False,False,,self,t3_1h3f990
gaming,Childhood flashback for turkey day,"Found a bunch of Xbox Mag demo discs and my OG Project Gotham in a Halo 2 case at my parents house, while grabbing my old box of Legos for my kid to play with.

",BreakfastShart,1h2yses,https://reddit.com/r/gaming/comments/1h2yses/childhood_flashback_for_turkey_day/,https://i.redd.it/rqxrdnmkcx3e1.jpeg,2024-11-29 23:23:12,82,0.82,82,0,7,0,0,False,False,False,False,False,,https://b.thumbs.redditmedia.com/dWr4qC4qWL6QsLyoisHficSKGM6rqjoRLeT1q0ScCcc.jpg,t3_1h2yses
gaming,Which game purchase is your biggest regret?,"As the title says. Which game that you purchased do you regret the most?

I was one of the guys that preordered The GTA Trilogy digitally on the PSN store, like half an hour before release, because I wanted to play VC. Jesus christ, I was so pissed.",FalscherKim,1h2i2dn,https://reddit.com/r/gaming/comments/1h2i2dn/which_game_purchase_is_your_biggest_regret/,https://www.reddit.com/r/gaming/comments/1h2i2dn/which_game_purchase_is_your_biggest_regret/,2024-11-29 09:23:58,978,0.9,978,0,3250,0,0,False,False,True,False,False,,self,t3_1h2i2dn
gaming,What's with the reluctance to use hall effect sticks in all new controllers?,"A lot of complaints about drift. Hall effect seems to be a simple solution to a widely known problem but it isn't being used as standard. What actual advantage is there in the standard controllers for gaming?

Would I be correct in assuming earlier controllers such as the PS2 and Gamecube controllers used hall effect sticks? My Gamecube controllers still work to this day. Something has been changed and not for the better.",Round-Excitement5017,1h2gaw0,https://reddit.com/r/gaming/comments/1h2gaw0/whats_with_the_reluctance_to_use_hall_effect/,https://www.reddit.com/r/gaming/comments/1h2gaw0/whats_with_the_reluctance_to_use_hall_effect/,2024-11-29 07:16:14,1165,0.92,1165,0,203,0,0,False,False,True,False,False,,self,t3_1h2gaw0
gaming,"Owners of Xbox Elite Controllers, How long did it last/has it lasted?","Is the poor quality perception true or a result of loudness bias?

I recently bought the Elite 2 and love the back peddles. I recommended controllers w/ back buttons in r/MHWilds and got a lot of messages about the poor quality control for the Elites.

What is your experience? Do they last longer than a year? Arrive broken? What broke first?

**EDIT:**

F\*ck my inbox. Thanks for the replies!

**EDIT 2:**

Will the haters please stop down-voting any neutral/positive comments? This kinda shit is just going to make me &amp; others think it's loudness bias instead of objective truth.

**EDIT 3:**   
  
Thank you all for giving your input. But f'real, fuck my inbox. I'll read all this in my free time over the next week.   
",Confused_Noodle,1h2q9zu,https://reddit.com/r/gaming/comments/1h2q9zu/owners_of_xbox_elite_controllers_how_long_did_it/,https://www.reddit.com/r/gaming/comments/1h2q9zu/owners_of_xbox_elite_controllers_how_long_did_it/,2024-11-29 17:00:54,176,0.83,176,0,525,0,0,False,False,True,False,False,,self,t3_1h2q9zu
gaming,Are you a sore loser (like me)?,"I really like modern fighting games like **Smash Bros**, **Street Fighter 6**, and **Guilty Gear Strive** \- and I'm quite good. We often play for hours with me winning most games.

Now, when someone comes around who is just a little bit better than me, or my friends practiced a bit more and turned the tables - I lose interest quickly and go ""Wanna play something else?"". I was also told I get so visibly annoyed while I'm on a losing streak, that it's not even fun winning against me.

Obviously, I'd like to chasnge this and build some resilience to take losses in stride and allow my opponents to enjoy their victories. Anyone got any advice on how to do this? 

I know it sounds trivial, but I'm struggling here... : )",Harkonnen985,1h41gip,https://reddit.com/r/gaming/comments/1h41gip/are_you_a_sore_loser_like_me/,https://www.reddit.com/r/gaming/comments/1h41gip/are_you_a_sore_loser_like_me/,2024-12-01 11:37:10,0,0.25,0,0,28,0,0,False,False,True,False,False,,self,t3_1h41gip
gaming,Sega genesis on switch?,Seems like I haven’t seen this mentioned anywhere that sega cónsules were on Nintendo switch,Natedogg5693,1h3x4m3,https://reddit.com/r/gaming/comments/1h3x4m3/sega_genesis_on_switch/,https://www.reddit.com/r/gaming/comments/1h3x4m3/sega_genesis_on_switch/,2024-12-01 06:27:13,0,0.28,0,0,8,0,0,False,False,True,False,False,,self,t3_1h3x4m3
gaming,Which Tekken 8 edition is the best to get? ,"I'm on the fence on which Tekken edition to get as they are on sale but some people on Steam are suggesting to just get the base game and get the characters separately as it is cheaper that way?

I'm a bit confused on what I should do, I do love Tekken but I'd never purchase the ultimate so I'm just stuck between deluxe or just base game? ",AirDrifter,1h3t7qa,https://reddit.com/r/gaming/comments/1h3t7qa/which_tekken_8_edition_is_the_best_to_get/,https://www.reddit.com/r/gaming/comments/1h3t7qa/which_tekken_8_edition_is_the_best_to_get/,2024-12-01 02:41:44,0,0.37,0,0,9,0,0,False,False,True,False,False,,self,t3_1h3t7qa
gaming,Can the PS3 be considered to be superior to the PS2?,"The PS3 was by far the best console of all time. Its rich and unparalled games library, including titles like Uncharted 1, 2, 3, the Last of Us, or Sports Champions, continues to stun future generations.

To further explain how good the PS3 was, let's just mention that Microsoft's competing console never even came close to matching the popularity and acclaim of the PS3, having no good exclusive games and lacking high quality online services.

As such, do you think the PS3 can be considered to be better than the PS2? Or does the PS2 reign supreme?",RaidersLostArk1981,1h46hfy,https://reddit.com/r/gaming/comments/1h46hfy/can_the_ps3_be_considered_to_be_superior_to_the/,https://www.reddit.com/r/gaming/comments/1h46hfy/can_the_ps3_be_considered_to_be_superior_to_the/,2024-12-01 16:04:18,0,0.07,0,0,62,0,0,False,False,True,False,False,,self,t3_1h46hfy
gaming,Elon Musk says too many game studios are owned by giant corporations so his giant corporation is going to start a studio to 'make games great again',,BigT232,1h1vgsm,https://reddit.com/r/gaming/comments/1h1vgsm/elon_musk_says_too_many_game_studios_are_owned_by/,https://www.pcgamer.com/gaming-industry/elon-musk-says-too-many-game-studios-are-owned-by-giant-corporations-so-his-giant-corporation-is-going-to-start-a-studio-to-make-games-great-again/,2024-11-28 13:01:47,53440,0.79,53440,0,3302,0,0,False,False,False,False,False,,https://b.thumbs.redditmedia.com/nKl4l4ehNSPm_9fIyN5bN-xarIoyXZlb8CWj3MSt2Ms.jpg,t3_1h1vgsm
gaming,"what games have you given up on and plan to go back to(MAYBE)?  but in reality, never do","what games have you played for a few hours, stopped or gave up, and said, ""eh, I'll get back to it in a few days (in reality: weeks, months, years)"".  But in reality, never do. because you'd rather play something else, or real-life stuff happens, and you never will.  Or your backlog is too big, and you NEVER get back to it, even if you in the back of your mind, you think you will.  Me:   Persona 5 Royal(I platinum'd the PS4 vanilla version), Armored Core 6(too frikin' hard), Witcher 3 Complete Edition(finished the vanilla story on the PS4), Baldur's Gate 3(too complicated and I HATE inventory management), Ghost of Tsushima (tired of open world stuff).  Be honest, what games you think you will play and finish but in reality, never will.  I'll add in the Yakuza series.  I have all of it on my HD, but only played and completed Yakuza 0  and a bit of Yakuza 3.  I want to play the whole series, but I get drawn back to The First Descendant, Zenless Zone Zero, or Throne and Liberty.  Kiryu is there waiting for me, but I'll just let him wait.  And wait...",mastrofdizastr,1h30znd,https://reddit.com/r/gaming/comments/1h30znd/what_games_have_you_given_up_on_and_plan_to_go/,https://www.reddit.com/r/gaming/comments/1h30znd/what_games_have_you_given_up_on_and_plan_to_go/,2024-11-30 01:12:12,14,0.61,14,0,162,0,0,False,False,True,False,False,,self,t3_1h30znd
gaming,Gearbox Flew Terminally-Ill Fan to Its Studio to Play Borderlands 4 Early — “I Am Praying He Makes to When We Are Done” ,,ChiefLeef22,1h21ch6,https://reddit.com/r/gaming/comments/1h21ch6/gearbox_flew_terminallyill_fan_to_its_studio_to/,https://www.ign.com/articles/gearbox-flew-terminally-ill-fan-to-its-studio-to-play-borderlands-4-early-i-am-praying-he-makes-to-when-we-are-done,2024-11-28 17:40:31,3829,0.97,3829,0,182,0,0,False,False,False,False,False,,https://b.thumbs.redditmedia.com/gWTdEx8ZDOfQjXGVBpudsZaKynmpFaWP4AhcBMQOj3Q.jpg,t3_1h21ch6
gaming,Whats a videogame genre or idea you feel should have more attention or titles?,"Ive been an aspiring gamedev for a while now and ive played videogames for longer, and i reached a conclussion that trends in gaming are really common, roguelikes or soulsborne games for indie studios, open world games or shooters for AAA games. some of these games are good but it can get stale for a while since it feels that these trends have reached they full potential by now, and im sure some of you guys would have other examples, i wanted to know some of the genres you guys think arent as aprecciated by the general public or should get more focus by indie devs or AAA companies",rutastic1,1h30vi5,https://reddit.com/r/gaming/comments/1h30vi5/whats_a_videogame_genre_or_idea_you_feel_should/,https://www.reddit.com/r/gaming/comments/1h30vi5/whats_a_videogame_genre_or_idea_you_feel_should/,2024-11-30 01:06:24,10,0.59,10,0,127,0,0,False,False,True,False,False,,self,t3_1h30vi5
gaming,"Witcher 3 HD mod reaches final version for next-gen, and you'll need an RTX 4090 to hit max settings for 4K 60 FPS",,Tiny-Independent273,1h200mv,https://reddit.com/r/gaming/comments/1h200mv/witcher_3_hd_mod_reaches_final_version_for/,https://www.pcguide.com/news/witcher-3-hd-mod-reaches-final-version-for-next-gen-and-youll-need-an-rtx-4090-to-hit-max-settings-at-4k-60-fps/,2024-11-28 16:42:08,3131,0.95,3131,0,143,0,0,False,False,False,False,False,,https://b.thumbs.redditmedia.com/pIpqeRCfByqnCiBKoc2r-JZ1_aGsNBijcyhMngy8oVI.jpg,t3_1h200mv
gaming,Some old(-ish) nostalgia during Thanksgiving.,,BeardedRiker,1h2f8xi,https://reddit.com/r/gaming/comments/1h2f8xi/some_oldish_nostalgia_during_thanksgiving/,https://i.redd.it/mseh0lnj7s3e1.jpeg,2024-11-29 06:06:08,211,0.9,211,0,35,0,0,False,False,False,False,False,,https://b.thumbs.redditmedia.com/jtaf73KyQ88S4OGCNVZbexJejhbzeGlHglIGYZfJEPA.jpg,t3_1h2f8xi
gaming,Tencent announced Light of Motiram and it looks pretty familiar....,,Iggy_Slayer,1h1w4rv,https://reddit.com/r/gaming/comments/1h1w4rv/tencent_announced_light_of_motiram_and_it_looks/,https://www.gematsu.com/2024/11/mechanimal-open-world-survival-crafting-game-light-of-motiram-announced-for-pc,2024-11-28 13:38:20,4658,0.96,4658,0,660,0,0,False,False,False,False,False,,https://b.thumbs.redditmedia.com/6WhYJRwlWHsemtoOl9WJIThqT90U4Qit2Qdhr3k6fHE.jpg,t3_1h1w4rv
gaming,Blast from the past at my parents house for Thanksgiving. ,"Contemplating bringing Dad's/my old PS3 home to break out Bad Company 2 again.

Call of Duty 4 Modern Warfare, Modern Warfare 2, PGATour 12 Masters Edition, PGATour 13 Masters Edition, Battlefield 3, Battlefield Bad Company 2, FIFA 13, LA Noir, and Grand Theft Auto IV. (Bonus Wii Sports).",wonder_bread,1h2b79l,https://reddit.com/r/gaming/comments/1h2b79l/blast_from_the_past_at_my_parents_house_for/,https://i.redd.it/xzf7kmk00r3e1.jpeg,2024-11-29 02:02:09,433,0.88,433,0,67,0,0,False,False,False,False,False,,https://a.thumbs.redditmedia.com/Rspfx6dLmv8Pc6wZObwmCFHx4so9RYzJ3jdxsMWod_8.jpg,t3_1h2b79l
gaming,Battle of the 2006 scifi shooers: Resitance: Fall of Man vs Gears of War vs Prey 2006?,"Question in title. What was the best scifi shooter of 2006? I think I got all the big ones covered, but if you can think of anymore to add I'd love to hear it. ",virtualpig,1h3lj1r,https://reddit.com/r/gaming/comments/1h3lj1r/battle_of_the_2006_scifi_shooers_resitance_fall/,https://www.reddit.com/r/gaming/comments/1h3lj1r/battle_of_the_2006_scifi_shooers_resitance_fall/,2024-11-30 20:27:00,0,0.41,0,0,33,0,0,False,False,True,False,False,,self,t3_1h3lj1r
