subreddit,title,selftext,author,id,permalink,url,created_utc,score,upvote_ratio,ups,downs,num_comments,total_awards_received,gilded,is_video,is_original_content,is_self,over_18,spoiler,link_flair_text,thumbnail,name
gaming,Which hardest difficulty was the most fun to play in a game for you?,"I use to play games on normal or easy difficulty almost exclusively, as i found more joy in the world/story/lore than the gameplay in most single player games. However ever since I started playing games on the highest difficulty it made me realize how much better of an experience it can be if done right. The hardest difficulty was the way most games were meant to be played, forcing you to use strategy and actually think about the build of your character. It's also more immersive, adding the feeling of fear and suspense in tense situations. 

Grounded difficulty in The Last of Us Part 1 is the best example in my opinion. It was the most incredible/unforgiving experience I've ever had in a game and something I recommend to everybody who's played the game to give a shot",Bowiescorvat2,1h2iwrw,https://reddit.com/r/gaming/comments/1h2iwrw/which_hardest_difficulty_was_the_most_fun_to_play/,https://www.reddit.com/r/gaming/comments/1h2iwrw/which_hardest_difficulty_was_the_most_fun_to_play/,2024-11-29 10:25:47,86,0.78,86,0,262,0,0,False,False,True,False,False,,self,t3_1h2iwrw
gaming,The “inverse” game awards of 2024,"I got bored and decided to draft up some categories for the inverse of game awards.

- Worst Game of the Year 
- biggest disappointment 
- worst voice acting performance 
- worst technical launch 
- biggest gaming controversy 
- worst gaming content creator 
- worst update  
- worst micro transaction
- worst game studio PR department 
- worst community
- worst writing/narrative
- worst art-style

Keep in mind this is for the year, not of all time. What you guys thinking ",LukeH118,1h2cepg,https://reddit.com/r/gaming/comments/1h2cepg/the_inverse_game_awards_of_2024/,https://www.reddit.com/r/gaming/comments/1h2cepg/the_inverse_game_awards_of_2024/,2024-11-29 03:12:50,318,0.78,318,0,204,0,0,False,False,True,False,False,,self,t3_1h2cepg
gaming,EA launcher is the worst launcher ive every used. ,"Every single game, with no exception, that ive ever tried to use from that, doesnt work. I have no idea why. Need for speed : 2015, I just finished downloading it, try and boot it up, get stuck with an error, search up what to do for like 30 minutes, cant figure it out, other have my issue, no solution. OK just one game, must be a fluke right? Well tried playing battlefield 4, downloaded it, booted it up, stuck with ANOTHER issue due to the anti cheat not being installed?? I installed it myself, still continued to get errors. Others have my issues, litterally no fix I can find. Well two isnt proof? Well when I try to play battlefield 2042, I get a crash within the first 30-60 seconds into the game. No explanation, cant get through the inital settings, no crash error either, just straight back to launcher. Looked it up, found somebody with my exact same computer with the SAME issue? No solutions found. Mind you, this is my SECOND time installing the same game, on different SSD, with a whole ass new windows install. 

TLDR: EA launcher sucks balls and targets my personally. ",InitialDay6670,1h2f3ry,https://reddit.com/r/gaming/comments/1h2f3ry/ea_launcher_is_the_worst_launcher_ive_every_used/,https://www.reddit.com/r/gaming/comments/1h2f3ry/ea_launcher_is_the_worst_launcher_ive_every_used/,2024-11-29 05:57:21,175,0.81,175,0,75,0,0,False,False,True,False,False,,self,t3_1h2f3ry
gaming,"I like weird games, can you recommend weird games?","if possible, no horror games.",RoniFoxcoon,1h2fvc2,https://reddit.com/r/gaming/comments/1h2fvc2/i_like_weird_games_can_you_recommend_weird_games/,https://www.reddit.com/r/gaming/comments/1h2fvc2/i_like_weird_games_can_you_recommend_weird_games/,2024-11-29 06:47:06,132,0.8,132,0,573,0,0,False,False,True,False,False,,self,t3_1h2fvc2
gaming,Mad Max,"I just picked up the Mad Max game for $3aud, and I'm annoyed I slept on this game until now. 

So far I'm around 4-5 hours in and whilst the combat is a bit clunky, I'm having a great time playing it.

Visually i think they did a great job capturing the aesthetic of the Mad Max world.",mpchild,1h2coju,https://reddit.com/r/gaming/comments/1h2coju/mad_max/,https://www.reddit.com/r/gaming/comments/1h2coju/mad_max/,2024-11-29 03:29:43,222,0.89,222,0,100,0,0,False,False,True,False,False,,self,t3_1h2coju
gaming,NFS: Unbound on Steam doesn't launch.,"As soon as I saw that this game required the EA app I hesitated, but I just couldn't resist the Steam sale, so I bought it anyway. 

Well, after downloading and installing the EA, signing up for that, and linking it to my Steam, the game still won't launch. It just does the validation, and then nothing.

I've repaired the EA app, I reinstalled it, I manually validated the game files, I tried running it as administrator, I added the game to my firewall to allow it through, and still the game just doesn't launch. Oh, I also updated my graphics drivers and rebooted the PC.

Does anyone have any suggestions for what else I could try, or should I just refund it?

I just wanna play the damn game, but apparently that's too much to ask for as a paying customer in 2024. This is Need for Speed Unbound btw.",FaceTransplant,1h3izxh,https://reddit.com/r/gaming/comments/1h3izxh/nfs_unbound_on_steam_doesnt_launch/,https://www.reddit.com/r/gaming/comments/1h3izxh/nfs_unbound_on_steam_doesnt_launch/,2024-11-30 18:32:11,0,0.37,0,0,14,0,0,False,False,True,False,False,,self,t3_1h3izxh
gaming,"What's your opinions about ""Protagonist dying at the end"" in any video games for you ?","It's make you feel depressed or feel losing or hate the game or make the game less replay value... or other reason ?

&gt;!I just finished Resident Evil 8 hour ago and i feed pissed off so much on ending because Ethan Winters was my most fav protag in RE series!&lt; mad like want to smash laptop screen

It's also happened with &gt;!Outlast 1, both Red Dead game, House Of The Dead 4, or any choice and consequences base game!&lt;",FightFromApocal,1h3k40k,https://reddit.com/r/gaming/comments/1h3k40k/whats_your_opinions_about_protagonist_dying_at/,https://www.reddit.com/r/gaming/comments/1h3k40k/whats_your_opinions_about_protagonist_dying_at/,2024-11-30 19:22:17,0,0.25,0,0,37,0,0,False,False,True,False,False,,self,t3_1h3k40k
gaming,New Kaiserpunk playtest is a “true window” into the ambitious strategy game,,Nemecator,1h28mp3,https://reddit.com/r/gaming/comments/1h28mp3/new_kaiserpunk_playtest_is_a_true_window_into_the/,https://www.pcgamesn.com/kaiserpunk/november-playtest-strategy-game-city-builder,2024-11-28 23:34:47,234,0.91,234,0,10,0,0,False,False,False,False,False,,default,t3_1h28mp3
gaming,Hot take: the amount of spinning/pulsing/rotating going on in ReFantazio is over the top,"First, it's a high quality game and I like it. 

But all the moving shit, it's kind of overwhelming. Why are so many things trying to draw my attention for no reason? I don't see any way to tune this down.

https://i.imgur.com/rpca06i.jpeg 

1. spinning thing around the mini map
1. particles being drawn in to the horns
1. spinning street light
1. PSST letters dance
1. speech bubbles dance
1. this thing spins for some reason
1. also rotates for some reason 
1. this part is actually not moving, which is surprising
1. map icons pulse

Anyone know of a way to just make it more static? Maybe a mod? ",ryhaltswhiskey,1h3j2b2,https://reddit.com/r/gaming/comments/1h3j2b2/hot_take_the_amount_of_spinningpulsingrotating/,https://www.reddit.com/r/gaming/comments/1h3j2b2/hot_take_the_amount_of_spinningpulsingrotating/,2024-11-30 18:35:09,0,0.22,0,0,5,0,0,False,False,True,False,False,,self,t3_1h3j2b2
gaming,What game series has been nothing but bangers? ,"I was thinking about how many game series are left that have yet to release a single dud. 

My first thought would be that every single Main line Mario game has been a success. Would about you?",Nincruel,1h1zt8f,https://reddit.com/r/gaming/comments/1h1zt8f/what_game_series_has_been_nothing_but_bangers/,https://www.reddit.com/r/gaming/comments/1h1zt8f/what_game_series_has_been_nothing_but_bangers/,2024-11-28 16:33:00,769,0.88,769,0,1593,0,0,False,False,True,False,False,,self,t3_1h1zt8f
gaming,who else hates skill trees or being locked into class specific builds? be average at everything and a master of none,"I miss the old days of having a knight, a mage, a healer, a rogue, an archer, etc.  Nowadays it seems like you can do it all but be a master of none.  Also, I hate it when you build a character so far into a certain class and can't back out of it(looking at you Throne and Liberty) without starting over.  Or if you mess up from the beginning and spec a certain character for a certain thing and can't change it later without massive penalties.  Sometimes I wish classes a were locked in form the beginning.  Even FF7 Rebirth can be guilty of this.  Why can't they just lock certain characters to certain builds?  I don't want to play a knight/healer/mage/rogue all in one and end up being not very good at any of them.  Anyone know of any modern games with the old school mentality where a certain character is locked into a certain class/build?",mastrofdizastr,1h3ku9g,https://reddit.com/r/gaming/comments/1h3ku9g/who_else_hates_skill_trees_or_being_locked_into/,https://www.reddit.com/r/gaming/comments/1h3ku9g/who_else_hates_skill_trees_or_being_locked_into/,2024-11-30 19:55:47,0,0.25,0,0,24,0,0,False,False,True,False,False,,self,t3_1h3ku9g
gaming,Watch Dogs: Legion sequel is a choose your own adventure Audible series,,TylerFortier_Photo,1h3elgy,https://reddit.com/r/gaming/comments/1h3elgy/watch_dogs_legion_sequel_is_a_choose_your_own/,https://www.eurogamer.net/watch-dogs-legion-sequel-is-a-choose-your-own-adventure-audible-series,2024-11-30 15:12:40,0,0.29,0,0,14,0,0,False,False,False,False,False,,https://b.thumbs.redditmedia.com/GqZeqQcZ2KzjFNDFIh-n5UVvSEIsdY_LVlf5OQgN8NU.jpg,t3_1h3elgy
gaming,Which franchise starter was the most influential?,"- Battlefield 1942
- Call of Duty 1
- Counter-Strike 1.#
- Halo 1

Which one of the games above was the most influential on gaming as a whole? ",eternalcasuals7,1h3bxxs,https://reddit.com/r/gaming/comments/1h3bxxs/which_franchise_starter_was_the_most_influential/,https://www.reddit.com/r/gaming/comments/1h3bxxs/which_franchise_starter_was_the_most_influential/,2024-11-30 12:51:52,0,0.42,0,0,38,0,0,False,False,True,False,False,,self,t3_1h3bxxs
gaming,The War of the Worlds: Siberia — Premiere Trailer (From the team behind IL-2 Sturmovik series),,TussalDimon,1h3a7pn,https://reddit.com/r/gaming/comments/1h3a7pn/the_war_of_the_worlds_siberia_premiere_trailer/,https://www.youtube.com/watch?v=63r65WiQoww,2024-11-30 10:55:58,0,0.49,0,0,18,0,0,False,False,False,False,False,,https://b.thumbs.redditmedia.com/0MgDivM8OcS89ErSAcLnVWSGYburzF9-R_EhIKV05Mk.jpg,t3_1h3a7pn
gaming,"Ghost of Tsushima Directors Cut, or Sekiro: Shadows Never Die Twice? ","Both of them are in the steam sale. What do people think of either or both of them? I want something quite stealth assassin focused I think,do either of them fit that description?",Wearytraveller_,1h39jqb,https://reddit.com/r/gaming/comments/1h39jqb/ghost_of_tsushima_directors_cut_or_sekiro_shadows/,https://www.reddit.com/r/gaming/comments/1h39jqb/ghost_of_tsushima_directors_cut_or_sekiro_shadows/,2024-11-30 10:06:12,0,0.41,0,0,50,0,0,False,False,True,False,False,,self,t3_1h39jqb
gaming,I finished Dragon Age: Veilguard on Xbox without hitting a single bug. Kudos to BioWare!,"For such a big game, especially one with reportedly troubled development, that's impressive. 

We shit a lot on games when they launch broken, but we rarely realize, let alone appreciate, when a game ships in a super polished state.",Nemarus,1h3iy8u,https://reddit.com/r/gaming/comments/1h3iy8u/i_finished_dragon_age_veilguard_on_xbox_without/,https://www.reddit.com/r/gaming/comments/1h3iy8u/i_finished_dragon_age_veilguard_on_xbox_without/,2024-11-30 18:30:10,0,0.35,0,0,47,0,0,False,False,True,False,False,,self,t3_1h3iy8u
gaming,Any really good 3rd person shooters lately?,"I tried playing First Descendant and while it wasn't bad... It was very meh. I know Helldivers 2 is pretty good but other than those two I don't know of any other good 3rd Person Shooters out right now. 

EDIT: Should mention all I have is a PS5",Stock_Sun7390,1h2evdu,https://reddit.com/r/gaming/comments/1h2evdu/any_really_good_3rd_person_shooters_lately/,https://www.reddit.com/r/gaming/comments/1h2evdu/any_really_good_3rd_person_shooters_lately/,2024-11-29 05:42:19,24,0.6,24,0,183,0,0,False,False,True,False,False,,self,t3_1h2evdu
gaming,helldivers 2 short story,,Eric_Senpai,1h1mucy,https://reddit.com/r/gaming/comments/1h1mucy/helldivers_2_short_story/,https://i.redd.it/k24eastaak3e1.jpeg,2024-11-28 03:32:21,3191,0.96,3191,0,87,0,0,False,False,False,False,False,,https://a.thumbs.redditmedia.com/AOWqmWQW7z9ioWUvbgR5kqTuB6HO9bVRPehqAuvqw74.jpg,t3_1h1mucy
gaming,Can't log into EA,"Can anyone help out with this? I'm trying to log into EA but I can't and of course to get to customer service you need too log in.. I'm not getting the verification codes when I request them, I have an account just not able to access it. Thanks ",LaxG64,1h3cuxi,https://reddit.com/r/gaming/comments/1h3cuxi/cant_log_into_ea/,https://www.reddit.com/r/gaming/comments/1h3cuxi/cant_log_into_ea/,2024-11-30 13:43:49,0,0.17,0,0,15,0,0,False,False,True,False,False,,self,t3_1h3cuxi
gaming,Is heroes of might snd magic 7 worth it?,"I'm a huge fan of 5, never really played the old games and I'm not interested in them either. I'm currently playing dark messiah and it reminded me how I love this world and wanna see more of it. The problem is that people say both homm6 and 7 are ass. 6 I could give a pass but 7 intrigues me. I kinda wanna play but I'm afraid I'll be disappointed by bad gameplay.",WorthSleep69,1h372e0,https://reddit.com/r/gaming/comments/1h372e0/is_heroes_of_might_snd_magic_7_worth_it/,https://www.reddit.com/r/gaming/comments/1h372e0/is_heroes_of_might_snd_magic_7_worth_it/,2024-11-30 07:05:41,0,0.41,0,0,26,0,0,False,False,True,False,False,,self,t3_1h372e0
gaming,Self Promotion Saturday! Small streamer? Just getting started? Tell us about it here!,"Use this post to tell us about your YouTube Channel or Twitch stream! Show us your creativity and tell us why we should subscribe. What makes you unique?

Please note that this thread is NOT for selling or advertising stores. Report any such posts and we'll deal with them. Thanks!

This thread is posted weekly on Saturdays (adjustments made as needed).

Reminder that you must follow our [rules of promotion.](https://www.reddit.com/r/gaming/wiki/index?utm_source=reddit&amp;utm_medium=usertext&amp;utm_name=gaming&amp;utm_content=t5_2qh03#wiki_rule_7.3A_self-promotion)",AutoModerator,1h36zef,https://reddit.com/r/gaming/comments/1h36zef/self_promotion_saturday_small_streamer_just/,https://www.reddit.com/r/gaming/comments/1h36zef/self_promotion_saturday_small_streamer_just/,2024-11-30 07:00:09,0,0.46,0,0,30,0,0,False,False,True,False,False,Weekly Self Promotion Thread,self,t3_1h36zef
gaming,Something weird is going on…,Many gaming networks having trouble at same time,SuperWeeble,1h3kmbk,https://reddit.com/r/gaming/comments/1h3kmbk/something_weird_is_going_on/,https://i.redd.it/8wevjbome34e1.jpeg,2024-11-30 19:45:24,0,0.26,0,0,42,0,0,False,False,False,False,False,,https://a.thumbs.redditmedia.com/QSQzXeJMS9Sgt1qKY6eV3uVOSeCoL_Y6qeIQdwbaay8.jpg,t3_1h3kmbk
gaming,SEGA Delisting Genesis/Dreamcast Games From Steam December 6,,MrDirt,1h1xoll,https://reddit.com/r/gaming/comments/1h1xoll/sega_delisting_genesisdreamcast_games_from_steam/,https://steamdeckhq.com/news/sega-delisting-genesis-dreamcast-games-from-steam/,2024-11-28 14:55:47,310,0.94,310,0,71,0,0,False,False,False,False,False,,https://b.thumbs.redditmedia.com/p5CU4fOYY7xvwldKKfj5CU6jAMBDsm6hWxA-m1ziRbI.jpg,t3_1h1xoll
gaming,Vegans and Vegetarians.,"When playing a game with a hunger mechanic, you're often faced with the choice of eating greens or meats.   
  
Do you tend to stick exclusively to one or the other, or do you mix it up? And also what influences your decision?",CYKA-BLYAT69,1h3dfc2,https://reddit.com/r/gaming/comments/1h3dfc2/vegans_and_vegetarians/,https://www.reddit.com/r/gaming/comments/1h3dfc2/vegans_and_vegetarians/,2024-11-30 14:14:33,0,0.13,0,0,39,0,0,False,False,True,False,False,,self,t3_1h3dfc2
gaming,"Baldur’s Gate 3 Patch 8, Due Out in 2025, Adding 12 New Subclasses, Cross-Play ,Photo Mode and More",,IcePopsicleDragon,1h1bit6,https://reddit.com/r/gaming/comments/1h1bit6/baldurs_gate_3_patch_8_due_out_in_2025_adding_12/,https://www.ign.com/articles/baldurs-gate-3-patch-8-due-out-in-2025-adds-12-new-subclasses-and-loads-more,2024-11-27 18:41:49,8529,0.98,8529,0,608,0,0,False,False,False,False,False,,https://b.thumbs.redditmedia.com/dUwOQEwbaLOiEYXvzS5tsTakm11DN4m9yEkGWp4n1jQ.jpg,t3_1h1bit6
gaming,"This is from Max0r’s Doom Eternal Review, I’ll just leave this here.",He’s right.,KadeWad3,1h1a91x,https://reddit.com/r/gaming/comments/1h1a91x/this_is_from_max0rs_doom_eternal_review_ill_just/,https://i.redd.it/u6om0u6afh3e1.jpeg,2024-11-27 17:49:52,8616,0.94,8616,0,771,0,0,False,False,False,False,False,,https://b.thumbs.redditmedia.com/aawwkHPT0nUc8Np2xA1h-x8ZT8tbwsYovkbXbQfYiyc.jpg,t3_1h1a91x
gaming,Former BioWare boss Casey Hudson is closing the studio he launched in 2021 without releasing a single game,,Roids-in-my-vains,1h185b1,https://reddit.com/r/gaming/comments/1h185b1/former_bioware_boss_casey_hudson_is_closing_the/,https://www.pcgamer.com/gaming-industry/former-bioware-boss-casey-hudson-is-closing-the-studio-he-launched-in-2021-without-releasing-a-single-game/,2024-11-27 16:21:58,13289,0.96,13289,0,888,0,0,False,False,False,False,False,,https://b.thumbs.redditmedia.com/6eUMqy5Qs3vzgBJ9FqCjkF756Y4XiPlyWFErT8tumaA.jpg,t3_1h185b1
gaming,"STALKER 2 suffers from something far worse than glitches, crashes, &amp; bugs - it suffers from consolification.","Where any concept of depth, strategy, or complexity is stripped away for the sake of someone being able to play with a controller.

I was expecting Escape from Tarkov with scifi / wasteland elements, instead we got Fallout 4 with a Russian language pack, yet it even feels like it falls short of that comparison. ",flaagan,1h3ku3f,https://reddit.com/r/gaming/comments/1h3ku3f/stalker_2_suffers_from_something_far_worse_than/,https://www.reddit.com/r/gaming/comments/1h3ku3f/stalker_2_suffers_from_something_far_worse_than/,2024-11-30 19:55:35,0,0.1,0,0,43,0,0,False,False,True,False,False,,self,t3_1h3ku3f
gaming,Which game you initially werent interested in surprised you in how fun it was?,"Rage 2 came out in 2019 i think. Always ignored it. It was always on sale, still ignored it. Then in 2023, i eventually picked it up for 10€. And daaamn...this game has some fun gameplay! Like some of the most fun combat mechanics ever.

What are your picks?",FalscherKim,1h1uh7f,https://reddit.com/r/gaming/comments/1h1uh7f/which_game_you_initially_werent_interested_in/,https://www.reddit.com/r/gaming/comments/1h1uh7f/which_game_you_initially_werent_interested_in/,2024-11-28 12:02:51,223,0.87,223,0,479,0,0,False,False,True,False,False,,self,t3_1h1uh7f
gaming,I said super smash bros is a fighting game and my friend said that it’s not because it doesn’t have coherent combos.,The title. My friend plays Mortal Kombat and Tekken 8 and believes that Smash isn't a fighting game just because it doesn't have overly complicated combos.,GrimReap_07,1h30sji,https://reddit.com/r/gaming/comments/1h30sji/i_said_super_smash_bros_is_a_fighting_game_and_my/,https://www.reddit.com/r/gaming/comments/1h30sji/i_said_super_smash_bros_is_a_fighting_game_and_my/,2024-11-30 01:02:08,0,0.46,0,0,61,0,0,False,False,True,False,False,,self,t3_1h30sji
gaming,N o s t a l g i a,,AutomatadeSaturno,1h1skk9,https://reddit.com/r/gaming/comments/1h1skk9/n_o_s_t_a_l_g_i_a/,https://i.redd.it/ixye8ian6m3e1.jpeg,2024-11-28 09:50:21,199,0.85,199,0,20,0,0,False,False,False,False,False,,https://b.thumbs.redditmedia.com/8lQCWlRc8XHHjT46nGIaKkZOc4M96pTBBHVOUc_T5hI.jpg,t3_1h1skk9
gaming,What are you thankful for in the gaming world?,"Let's all give thanks for things we actually like in this space instead of just complaining all the time.  

I'll go first.  Today I am thankful for the guy who shot me in the ass with a shotgun after sticking a semtex to the back of my head.  Honestly, that was less humiliation and I appreciate it.",Papaofmonsters,1h1z8h5,https://reddit.com/r/gaming/comments/1h1z8h5/what_are_you_thankful_for_in_the_gaming_world/,https://www.reddit.com/r/gaming/comments/1h1z8h5/what_are_you_thankful_for_in_the_gaming_world/,2024-11-28 16:07:26,64,0.73,64,0,165,0,0,False,False,True,False,False,,self,t3_1h1z8h5
gaming,(Watch Dogs) Some of the most unique and varied side content I've ever seen in a game,These are in the same game,hailthecrowbar,1h1gzf3,https://reddit.com/r/gaming/comments/1h1gzf3/watch_dogs_some_of_the_most_unique_and_varied/,https://i.redd.it/xuq4v8q8ui3e1.jpeg,2024-11-27 22:35:31,1578,0.9,1578,0,138,0,0,False,False,False,False,False,,https://b.thumbs.redditmedia.com/U2uvMT6w_zn-QbhFwpfvU7Rm97Z1vC6P8mwJdxiOHjM.jpg,t3_1h1gzf3
gaming,Buying games on PS5 Pro vs Series X?,"So, one of the main difference of this generation (PS5 Pro apart) was the PS5 controller, and a few games use the specificities of its controller.

A couple of Qs from that:
- Which games use the dual sense feature?
- Do you know any reviewer at least touching on that? Nowadays it’s never really mentioned when a game is available on both platforms for there’s anything specific for the PS controller
- For those of you having the luxury to have both consoles, where do you decide where to buy your games? I’m looking at The Plucky Squire for example, I want to buy it but no idea of the PS5 dualsense adds something to the experience or not, it’s kind of weird really developers don’t really take the time to mention it. Given Xbox tends to be better with back compat and allows for Play Anywhere (thus PC or handheld) it seems safer to buy on that platform, unless I’m missing something. 

Thanks!",Maralitabambolo,1h31y80,https://reddit.com/r/gaming/comments/1h31y80/buying_games_on_ps5_pro_vs_series_x/,https://www.reddit.com/r/gaming/comments/1h31y80/buying_games_on_ps5_pro_vs_series_x/,2024-11-30 02:03:00,0,0.26,0,0,13,0,0,False,False,True,False,False,,self,t3_1h31y80
gaming,The very first look at The Witcher 4 from CDPROJEKTRED,,Mantas0,1h12jw8,https://reddit.com/r/gaming/comments/1h12jw8/the_very_first_look_at_the_witcher_4_from/,https://i.redd.it/ri0mi29umf3e1.jpeg,2024-11-27 11:52:30,13393,0.88,13393,0,926,0,0,False,False,False,False,False,,https://b.thumbs.redditmedia.com/2qlG-PxmPaXzq1zTi8j_nduJkMcYeXKTLqjsKRtv0Ig.jpg,t3_1h12jw8
gaming,"As of November 29th, 2024, any upcoming anime action RPG games, based on an actual anime/manga?","Like, Edens Zero per say.",Lunny1767,1h3011l,https://reddit.com/r/gaming/comments/1h3011l/as_of_november_29th_2024_any_upcoming_anime/,https://www.reddit.com/r/gaming/comments/1h3011l/as_of_november_29th_2024_any_upcoming_anime/,2024-11-30 00:23:44,0,0.28,0,0,19,0,0,False,False,True,False,False,,self,t3_1h3011l
gaming,Two kinds of maxed rpg players,Game name is Habitica (productivity game),PlusVE,1h2vlo0,https://reddit.com/r/gaming/comments/1h2vlo0/two_kinds_of_maxed_rpg_players/,https://i.redd.it/o8i1d833mw3e1.jpeg,2024-11-29 20:54:43,0,0.45,0,0,5,0,0,False,False,False,False,False,,https://a.thumbs.redditmedia.com/Gpl4NlFLLqeyturryOe9VES2F5eZhAc3GxXOZS6Cx04.jpg,t3_1h2vlo0
gaming,Horses no longer gallop in Red Dead Redemption 2,"
Just as the title says, my horses will no longer gallop or even stride at a decent pace.  My horses only trot at the slowest speed, just happened out of nowhere today while playing on my Xbox Series X.  Even horses I steal from NPCs will stop and just walk.  I only just got the game a couple weeks ago, too.  I have tried every possible solution I could come across:

* I fed the horse
* groomed it over and over
* patted the horse
* removed the saddle and put it back on
* rode without a saddle
* switched to different horses at stables
* reloaded the most previous save
* reloaded old saves
* changed controllers
* closed the game and removed it from Quick Resume, waited a minute to relaunch
* did a hard restart on the XSX console
* I even uninstalled the game and redownloaded it

All those things and my horse(s) will not move any faster than a walking stride.  This has affected every single horse across all my saves.  I have already put plenty of progress into the game, but now I either have to go without a horse or play at a snail’s pace

Is there any solution to this?",riegspsych325,1h2xh6t,https://reddit.com/r/gaming/comments/1h2xh6t/horses_no_longer_gallop_in_red_dead_redemption_2/,https://www.reddit.com/r/gaming/comments/1h2xh6t/horses_no_longer_gallop_in_red_dead_redemption_2/,2024-11-29 22:21:01,0,0.35,0,0,34,0,0,False,False,True,False,False,,self,t3_1h2xh6t
gaming,"Recent, in-depth video on F-Zero GX on youtube (video description in comments)",,Random_Violins,1h2v5bc,https://reddit.com/r/gaming/comments/1h2v5bc/recent_indepth_video_on_fzero_gx_on_youtube_video/,https://youtu.be/aiJSpwzF0Cg?si=0580_LPR8yIgpzyq,2024-11-29 20:33:41,0,0.28,0,0,2,0,0,False,False,False,False,False,,https://a.thumbs.redditmedia.com/1bpCgBPlxZmNMDzPDpjDeqiGb1QvNJiijINU9Arm-44.jpg,t3_1h2v5bc
