subreddit,title,selftext,author,id,permalink,url,created_utc,score,upvote_ratio,ups,downs,num_comments,total_awards_received,gilded,is_video,is_original_content,is_self,over_18,spoiler,link_flair_text,thumbnail,name
gaming,"Best ""I don't need a life"" Game during Steam's Autumn Sale?","I'm trying to stay under $20, but can go up to $30 if I skip a few meals this week.

(thanks in advance!!!)

EDIT: Thank you for your concern (those of you who said something).  I will not be skipping meals due to my gaming addiction.  I'm a little high on cannabis and thought my ""post desperation"" would help to show how much a retired old man appreciates every dollar (and some of the cheaper games have the best stories or are crazy challenging/interesting).

EDIT 2:  To everyone who contributed, thank you!  So far I pulled the trigger on....

Kingdom Come : Deliverance (with all DLC) for $3.99

&amp;

Cities for $2.99

(...and again... thank you!)

  
EDIT 3:  I'm blown away at the responses.  You people are awesome!!!  I'm in the middle of playing Kingdom Come, but will likely purchase one or two more (Mad Max for sure), then wait til the Winter Sale for some of the other suggestions (like Satisfactory or Rimworld) and THEN in 6 months I'll be playing the FREE version of....

Path of Exile 2

Again, I'm very thankful for the responses.  You guys rock!",MonkeySpittle,1h3haec,https://reddit.com/r/gaming/comments/1h3haec/best_i_dont_need_a_life_game_during_steams_autumn/,https://www.reddit.com/r/gaming/comments/1h3haec/best_i_dont_need_a_life_game_during_steams_autumn/,2024-11-30 17:14:56,2144,0.95,2144,0,675,0,0,False,False,True,False,False,,self,t3_1h3haec
gaming,"There should be a Sims but like, medieval. That'd be dope as hell.","Like imagine that, it'd be amazing ",WhiteWolf101043,1h3hv4f,https://reddit.com/r/gaming/comments/1h3hv4f/there_should_be_a_sims_but_like_medieval_thatd_be/,https://www.reddit.com/r/gaming/comments/1h3hv4f/there_should_be_a_sims_but_like_medieval_thatd_be/,2024-11-30 17:40:35,1945,0.92,1945,0,234,0,0,False,False,True,False,False,,self,t3_1h3hv4f
gaming,Is anyone know the game Cell of empireo or familiar to games? ,"
This was an rpgmaker2003 also know as Cell divine commedia in Japanese by Sharktale Factory Im hoping someone know this game if you know. I wanna talk to you talked about the game also give information to game including the dlc! Honestly this was absolutely intriguing game I ever read through on translation if you know please replay to me!!",TieObjective8227,1h4qpna,https://reddit.com/r/gaming/comments/1h4qpna/is_anyone_know_the_game_cell_of_empireo_or/,https://www.reddit.com/r/gaming/comments/1h4qpna/is_anyone_know_the_game_cell_of_empireo_or/,2024-12-02 08:49:54,2,0.58,2,0,0,0,0,False,False,True,False,False,,self,t3_1h4qpna
gaming,Which games did you finish multiple times?,"One of my most played games, The Last Of Us, i think i finished like 11 times",FalscherKim,1h3pe6s,https://reddit.com/r/gaming/comments/1h3pe6s/which_games_did_you_finish_multiple_times/,https://www.reddit.com/r/gaming/comments/1h3pe6s/which_games_did_you_finish_multiple_times/,2024-11-30 23:28:10,202,0.89,202,0,815,0,0,False,False,True,False,False,,self,t3_1h3pe6s
gaming,Did Disney make outlaws into lilo and stitch in space? ,"So I was playing the game and enjoying it mostly when it hit me. This is a Disney princess in space, complete with her animal sidekick. ",BodySurfDan,1h4xr08,https://reddit.com/r/gaming/comments/1h4xr08/did_disney_make_outlaws_into_lilo_and_stitch_in/,https://www.reddit.com/r/gaming/comments/1h4xr08/did_disney_make_outlaws_into_lilo_and_stitch_in/,2024-12-02 15:38:39,0,0.19,0,0,6,0,0,False,False,True,False,False,,self,t3_1h4xr08
gaming,What other Serious Sam-likes are there?,"Feel free to give some recommendations. 

I have tried some so called Boomer Shooters, but they aren't usually doing anything for me. I don't know what it is, but Serious Sam has it's own vibes going on, what with all the ancient, imposing architecture, wide open plains, and so on. I seem to be unable to find this vibe in other games.",Worth-Primary-9884,1h43f1w,https://reddit.com/r/gaming/comments/1h43f1w/what_other_serious_samlikes_are_there/,https://www.reddit.com/r/gaming/comments/1h43f1w/what_other_serious_samlikes_are_there/,2024-12-01 13:35:56,10,0.62,10,0,33,0,0,False,False,True,False,False,,self,t3_1h43f1w
gaming,"When you want to grab another set of expensive armor and must make sacrifices. Rest in peace, dear bread and vodka...",,0-0-0-0-0-0-0-3,1h3ddov,https://reddit.com/r/gaming/comments/1h3ddov/when_you_want_to_grab_another_set_of_expensive/,https://i.redd.it/yyyxkoefq14e1.png,2024-11-30 14:12:11,881,0.94,881,0,69,0,0,False,False,False,False,False,,https://b.thumbs.redditmedia.com/zd09xyPJtfvJ9LFozXGxsz2Gi6LREA8L85Ix_mJ-1QA.jpg,t3_1h3ddov
gaming,Having trouble playing Mass Effect,"Grabbed Mass Effect as it was on sale on steam, and enjoyed the initial premise, roughly an hour in, but the game keeps crashing every now and then. I have heard a lot about this game and would love to play it, but the crashes require me to restart my laptop every time the game crashes. I don't think the lap is the issue, as it can run heavier games like the Witcher 3.",Deviant_Automata,1h4rka0,https://reddit.com/r/gaming/comments/1h4rka0/having_trouble_playing_mass_effect/,https://www.reddit.com/r/gaming/comments/1h4rka0/having_trouble_playing_mass_effect/,2024-12-02 09:55:33,0,0.46,0,0,17,0,0,False,False,True,False,False,,self,t3_1h4rka0
gaming,Which game did you spend a dozen hours into and never finished it?,"Obviously only applies to games that have an end that can be reached, so multiplayer and endless games dont really count.

Prominent example would be Skyrim, where people often state that they played it a thousand hours and never finished the story once.

I can tell that i loved to drive around and do stuff in GTA VC - never got to the end of the game a single time.",FalscherKim,1h3j1bg,https://reddit.com/r/gaming/comments/1h3j1bg/which_game_did_you_spend_a_dozen_hours_into_and/,https://www.reddit.com/r/gaming/comments/1h3j1bg/which_game_did_you_spend_a_dozen_hours_into_and/,2024-11-30 18:33:57,326,0.9,326,0,736,0,0,False,False,True,False,False,,self,t3_1h3j1bg
gaming,Childhood NES collection,"An obligatory “visiting family for the holidays, here are my nostalgic games” post

Pictured:
Mega Man 5, Dr. Mario, RC Pro AM II, Superspike v’ball, Metroid, Super Mario Bros 3, Kirby’s Adventure, Zelda, Punchout, Burgertime, TMNT, Super Mario Bros, Tetris, M.C. Kids, Back to the Future, Master Blaster, Dragon Warrior, Friday the 13th, Bases Loaded 3, Tetris 2, Bart vs the World, Super Contra, NES play action Football, Yoshi’s Cookie, Wayne’s World, Super Mario Bros 2, Felix the Cat.

Missing but around here somewhere:
The Adventure of Link 
Zoda’s Revenge
Silent Service ",Direct-Competition34,1h3i8u1,https://reddit.com/r/gaming/comments/1h3i8u1/childhood_nes_collection/,https://i.redd.it/qn4lnttev24e1.jpeg,2024-11-30 17:57:49,245,0.92,245,0,59,0,0,False,False,False,False,False,,https://b.thumbs.redditmedia.com/gr5xmv0xUMJKap3lAL2pz76DixBiV5f8gD9U2nWV-GQ.jpg,t3_1h3i8u1
gaming,Unrecord,"What happened to that fake game? Did they ever release any new footage, or a game? Any news? (I always suspected it was never game footage, it was real footage with digital terrorists inserted later). I saw two terrible looking games that released in November that looked a lot like it, was one of them actually unrecord? They’re both bodycam games that looked like ass",Maleficent-Tie-6773,1h4unvw,https://reddit.com/r/gaming/comments/1h4unvw/unrecord/,https://www.reddit.com/r/gaming/comments/1h4unvw/unrecord/,2024-12-02 13:13:11,0,0.11,0,0,14,0,0,False,False,True,False,False,,self,t3_1h4unvw
gaming,Any Christmas game traditions? ,Hello fellow gamers with it being december 1st i was wondering if there's a game or a series of games you play every year for the holidays? I would play through kingdom hearts 1 the week before Christmas. It's when I received it for the 1st time. I kinda dropped it a few years back was thinking of bringing it back maybe with a new game or series. I wanna know your gaming traditions.,Pr0xy001,1h4bsb6,https://reddit.com/r/gaming/comments/1h4bsb6/any_christmas_game_traditions/,https://www.reddit.com/r/gaming/comments/1h4bsb6/any_christmas_game_traditions/,2024-12-01 19:51:31,4,0.57,4,0,54,0,0,False,False,True,False,False,,self,t3_1h4bsb6
gaming,"One of the few ""Nintendo hard"" games I beat as a child. I wonder if I could still do it today.",,BaronVonBroccoli,1h3eqf9,https://reddit.com/r/gaming/comments/1h3eqf9/one_of_the_few_nintendo_hard_games_i_beat_as_a/,https://i.redd.it/dhfio8ln224e1.jpeg,2024-11-30 15:19:31,377,0.89,377,0,150,0,0,False,False,False,False,False,,https://b.thumbs.redditmedia.com/Do8nxqU9gx2LjFQ9kZcsuVGPqhHB9Hopf0hY1EO9SvA.jpg,t3_1h3eqf9
gaming,Spaceship building sandbox?,"Hi! Recommendations requested! I'm looking for a game where I can build spaceships. More specifically, I want something sandboxy enough where I can just open it up and start designing custom ships (not like linear earning parts and upgrades) and nothing so technical that it cares whether my ship would work or not.

Basically I want to re-create ships from TV shows just for fun and enjoyment.

I don't know if this exists, but ideally, a virtual model builder that's accessible to someone like me who has no 3D rendering skills. Kinda like the builder in Spore.

Thank you in advance!",GrandmaSlappy,1h4foox,https://reddit.com/r/gaming/comments/1h4foox/spaceship_building_sandbox/,https://www.reddit.com/r/gaming/comments/1h4foox/spaceship_building_sandbox/,2024-12-01 22:38:20,1,0.52,1,0,34,0,0,False,False,True,False,False,,self,t3_1h4foox
gaming,Looking for Turn-Based Ideas for 80 y/o Father-in-law,"Chatting with my father-in-law today, he (80 years old) was looking to get into a new turn-based game. He enjoys games like Zork, Civ series, Planescape Torment, and prefers games that allow you to take your time when making your decision. I'm not sure how much of an RPG turn based experience he would enjoy, but I'd like to get a small list of some titles that might spark his interest.",whywantyoubuddy,1h3umyn,https://reddit.com/r/gaming/comments/1h3umyn/looking_for_turnbased_ideas_for_80_yo_fatherinlaw/,https://www.reddit.com/r/gaming/comments/1h3umyn/looking_for_turnbased_ideas_for_80_yo_fatherinlaw/,2024-12-01 03:59:41,31,0.76,31,0,76,0,0,False,False,True,False,False,,self,t3_1h3umyn
gaming,Dead or Alive 3-She Kicks High commercial,,bomb5000,1h3dtpx,https://reddit.com/r/gaming/comments/1h3dtpx/dead_or_alive_3she_kicks_high_commercial/,https://www.youtube.com/watch?v=l0Fie-Od82w,2024-11-30 14:35:24,239,0.85,239,0,62,0,0,False,False,False,False,False,,https://b.thumbs.redditmedia.com/rqfwrTOKYmlpcqTq2xtQSac0k2kYCInf5qsFKmAj7Go.jpg,t3_1h3dtpx
gaming,Site that reminds you of controls and story after you’ve put a game down?,"So I’ve been away from certain games for a while. I never finished games like Hogwarts legacy, Red Dead 2, and Cyber punk. But put too much time into them originally to want to start over. Is there some site or service that catches you up on the controls and where the story is at the point you paused it?? If not exactly, just a summary or something. 

This may be wishful thinking but just wanted to see. ",ManWithAPlan808,1h3s2q0,https://reddit.com/r/gaming/comments/1h3s2q0/site_that_reminds_you_of_controls_and_story_after/,https://www.reddit.com/r/gaming/comments/1h3s2q0/site_that_reminds_you_of_controls_and_story_after/,2024-12-01 01:40:55,31,0.62,31,0,36,0,0,False,False,True,False,False,,self,t3_1h3s2q0
gaming,Mortal Kombat Mileena tattoo. Artist Andy Noir.,,_Badlands_,1h2vc39,https://reddit.com/r/gaming/comments/1h2vc39/mortal_kombat_mileena_tattoo_artist_andy_noir/,https://i.redd.it/1sazokrjjw3e1.jpeg,2024-11-29 20:42:16,6245,0.93,6245,0,157,0,0,False,False,False,False,False,,https://b.thumbs.redditmedia.com/UrXXzgSh3qPmLA0w_U0o5juB6LMBCZdIOePzfIfFYxQ.jpg,t3_1h2vc39
gaming,"CDPR says The Witcher 4 Will Be ""Better, Bigger, Greater"" Than The Witcher 3 or Cyberpunk 2077 - ""For us, it's unacceptable to launch (like Cyberpunk). We don't want to go back.""",,ChiefLeef22,1h2owcu,https://reddit.com/r/gaming/comments/1h2owcu/cdpr_says_the_witcher_4_will_be_better_bigger/,https://www.thegamer.com/the-witcher-4-bigger-better-than-witcher-3-wild-hunt-cyberpunk-2077/,2024-11-29 15:59:49,31114,0.91,31114,0,2328,0,0,False,False,False,False,False,,https://b.thumbs.redditmedia.com/jFctacLRHT6yURClFrsHiAj6wk78i3MpF4AZVTT1rlg.jpg,t3_1h2owcu
gaming,Oh yeah! it's time to Rick-Roll,,Evilesthook,1h3augt,https://reddit.com/r/gaming/comments/1h3augt/oh_yeah_its_time_to_rickroll/,https://i.redd.it/g4aqh6bnz04e1.png,2024-11-30 11:40:52,308,0.87,308,0,33,0,0,False,False,False,False,False,,https://b.thumbs.redditmedia.com/ZPS1upS_KT9HXcEUoMozgY1beZmwRk2H5wKkprC5kLc.jpg,t3_1h3augt
gaming,Recommendations for the easily motion sick?,"My wife wants to get more into playing games, but she gets motion sick easily, especially in first person games, games with a lot of camera movement, or on a large screen. She can, however, play games where the camera is more fixed or further away in 3rd person (like WoW) on a smaller screen. I'm getting a new laptop so she is going to use my old one and try to find some new games she can play without getting sick.

What are some games that are good for people who get motion sickness? She likes RPGs, magic and fantasy, adventure games. Not much for shooters, racing, or sports games. She plays a bit of WoW, but I'd like to find some things that aren't subscription based since she refuses to pay for that. I have Game Pass, so that would be ideal, but going through Steam or GoG is fine too. Nothing super graphic intensive since she'll be playing on a 4 year old Alienware laptop with a RTX 2060. My initial thoughts are things like Dragon Age, maybe Lego or Telltale games, but I'd love to get other suggestions.",scruffalo_,1h3w6wp,https://reddit.com/r/gaming/comments/1h3w6wp/recommendations_for_the_easily_motion_sick/,https://www.reddit.com/r/gaming/comments/1h3w6wp/recommendations_for_the_easily_motion_sick/,2024-12-01 05:28:39,12,0.65,12,0,51,0,0,False,False,True,False,False,,self,t3_1h3w6wp
gaming,Long Pork Grill,,TemptingPi,1h34xsu,https://reddit.com/r/gaming/comments/1h34xsu/long_pork_grill/,https://i.redd.it/qe2bco88zy3e1.jpeg,2024-11-30 04:52:28,921,0.89,921,0,62,0,0,False,False,False,False,False,,https://b.thumbs.redditmedia.com/8TErHk79UfQpX5bTw1tp3oIu4YB7uSsNCYBjfVvbyQo.jpg,t3_1h34xsu
gaming,Dying Light 2 vs GTA 5 in player count on PS Plus...who wins? ,,GamerMom1969,1h4tpl1,https://reddit.com/r/gaming/comments/1h4tpl1/dying_light_2_vs_gta_5_in_player_count_on_ps/,https://gamerant.com/dying-light-2-gta-5-player-count-ps-plus-extra/,2024-12-02 12:20:49,0,0.19,0,0,3,0,0,False,False,False,False,False,,https://b.thumbs.redditmedia.com/dLGYzOV5G1hgYM0Fy1Xph5eLphecSFeJpaFBKuvquRM.jpg,t3_1h4tpl1
gaming,Answer quickly : Should I purchase Cyberpunk 2077 for PS4 Pro right now or not?,It’s on sale for a few hours more. Should I get it for PS4 Pro or not? I do not have a PS5 and won’t get one any time soon.,StarkAndRobotic,1h4t5wi,https://reddit.com/r/gaming/comments/1h4t5wi/answer_quickly_should_i_purchase_cyberpunk_2077/,https://www.reddit.com/r/gaming/comments/1h4t5wi/answer_quickly_should_i_purchase_cyberpunk_2077/,2024-12-02 11:47:07,0,0.15,0,0,56,0,0,False,False,True,False,False,,self,t3_1h4t5wi
gaming,"what's a game that started out differently during early development
","Goldeneye n64 was going to be a rail-gun shooter before turning into an FPS.

another example would be Devil May Cry as it started out as an resident evil title before changing it to the game we all know.",bomb5000,1h32hyq,https://reddit.com/r/gaming/comments/1h32hyq/whats_a_game_that_started_out_differently_during/,https://www.reddit.com/r/gaming/comments/1h32hyq/whats_a_game_that_started_out_differently_during/,2024-11-30 02:32:57,979,0.95,979,0,363,0,0,False,False,True,False,False,,self,t3_1h32hyq
gaming,Is Neverwinter Night 2 anything like Baulders Gate? ,"I'm not into classic style BG games, so is NWN2 like Classic BG?",soulwolf1,1h4icku,https://reddit.com/r/gaming/comments/1h4icku/is_neverwinter_night_2_anything_like_baulders_gate/,https://www.reddit.com/r/gaming/comments/1h4icku/is_neverwinter_night_2_anything_like_baulders_gate/,2024-12-02 00:40:34,0,0.44,0,0,30,0,0,False,False,True,False,False,,self,t3_1h4icku
gaming,Steam sale opinions,"Looking for opinions on which game to grab that’s on sale right now on my wishlist.  Also if I’m missing anything that you think I’d like based on these options let me know!

1. Spiderman remastered ($30)
2. Horizon Forbidden West ($40)
3. Sekiro ($30)
4. Ghost of Tsushima ($48)

Money is not really an issue it’s more of a time constraint that I only want to get one or maybe two.  Waiting on hades 2 for release on switch.",Protomau5,1h4h8tv,https://reddit.com/r/gaming/comments/1h4h8tv/steam_sale_opinions/,https://www.reddit.com/r/gaming/comments/1h4h8tv/steam_sale_opinions/,2024-12-01 23:49:02,0,0.41,0,0,32,0,0,False,False,True,False,False,,self,t3_1h4h8tv
gaming,"We played Project IGI with my friends when we were young, trying to come to the edge of the map but got bored after 5 minutes of walking towards ""textured nothingness"". Decades after, i finally found the edge exists. ",,mason_mte,1h2zeni,https://reddit.com/r/gaming/comments/1h2zeni/we_played_project_igi_with_my_friends_when_we/,https://i.redd.it/d4i2s30whx3e1.gif,2024-11-29 23:53:15,1300,0.97,1300,0,78,0,0,False,False,False,False,False,,https://a.thumbs.redditmedia.com/N5f8p8mCDJ_SQl2VJucXrpjtNaLhpXmQN2DS7341Q30.jpg,t3_1h2zeni
gaming,Simple Questions Sunday!,"For those questions that don't feel worthy of a whole new post.

This thread is posted weekly on Sundays (adjustments made as needed).",AutoModerator,1h3xlyf,https://reddit.com/r/gaming/comments/1h3xlyf/simple_questions_sunday/,https://www.reddit.com/r/gaming/comments/1h3xlyf/simple_questions_sunday/,2024-12-01 07:00:12,5,0.62,5,0,27,0,0,False,False,True,False,False,Weekly Simple Questions Thread,self,t3_1h3xlyf
gaming,I think we threated Suicide Squad Kill the Justice League too harshly,Just grabbed it on Steam for 3 freaking dollars and I cant stop playing... wanna see Superman catch a nuke? Flash losing his finger? And much more... wait why are we hating this game in the first place? Battle pass? Just ignore it... Initial price? It would be discounted as any other game after some time.,Matijas129,1h4wwm9,https://reddit.com/r/gaming/comments/1h4wwm9/i_think_we_threated_suicide_squad_kill_the/,https://www.reddit.com/r/gaming/comments/1h4wwm9/i_think_we_threated_suicide_squad_kill_the/,2024-12-02 15:02:01,0,0.05,0,0,36,0,0,False,False,True,False,False,,self,t3_1h4wwm9
gaming,Nine Sols doing it right. Amazed at how many games don't do this. ,,ryhaltswhiskey,1h2us5m,https://reddit.com/r/gaming/comments/1h2us5m/nine_sols_doing_it_right_amazed_at_how_many_games/,https://i.imgur.com/LcbE5Zk.jpeg,2024-11-29 20:17:08,1867,0.9,1867,0,99,0,0,False,False,False,False,False,,https://b.thumbs.redditmedia.com/06VfVkC_MtZKH7uxYQ6k1j_FMlPj6vALAiVbOiGqCks.jpg,t3_1h2us5m
gaming,Stalker question,Heyos i was wondering how similar is stalker 2 compared to the original games?,imshoopdawoop001,1h4egua,https://reddit.com/r/gaming/comments/1h4egua/stalker_question/,https://www.reddit.com/r/gaming/comments/1h4egua/stalker_question/,2024-12-01 21:45:27,0,0.29,0,0,4,0,0,False,False,True,False,False,,self,t3_1h4egua
gaming,Should I get Star Wars Jedi Survivor or Resident Evil 4 Remake?,I saw on Xbox they were both on sale for Black Friday and I couldn’t decide. ,Tdog679,1h4gkh6,https://reddit.com/r/gaming/comments/1h4gkh6/should_i_get_star_wars_jedi_survivor_or_resident/,https://www.reddit.com/r/gaming/comments/1h4gkh6/should_i_get_star_wars_jedi_survivor_or_resident/,2024-12-01 23:17:02,0,0.39,0,0,31,0,0,False,False,True,False,False,,self,t3_1h4gkh6
gaming,"Witcher 3 is almost a decade old, RDR2 is 6 years old. How are these still just about the best graphics? Are there no graphically stunning “show stopper” titles in the last 6 years to compete with them? Have video game graphic advances slowed to a crawl now?","**EDIT** I thought this was clear in my post, but maybe not. I am not saying there aren't better graphics to be found into today's games. I am saying they don't look a Decade better, they don't look 6 years better. For example, Legend of Zelda OOO came out in 1998, Crysis came out in 2007, that's the same gap between the release of Wild Hunt 3 and now. Skyrim came out in 2011, and 6 years prior to that, same gap as between RDR2 and now, the most graphically amazing game just released was the King King movie tie game. There is an ocean of difference, graphically, between Ocarina of Time and Crysis, between King Kong and Skyrim. You could show your grandma a picture of the two and she'd be able to easily point to the one with better graphics. But if you showed Wild Hunt 3 or RDR2 or Battlefield One next to many or even most big budget graphically cutting edge titles of the day, your gran probably couldn't say which have better graphics. The gulf is REALLY narrow compared to the same time span in the past. And if you look up just about any listing of the most graphically impressive games, RDR2, a 6 year old game, is still near the top of basically every list.

Was recently doing an RDR2 play though and was blown away coming back to it, just how damn good it looks. I remember it looked good, but I mean it looks GOOD. And I remember thinking the same about a year ago when I picked Witcher 3 back up. 

Hell star wars battlefront 2 was released in 2017, battlefield 1 was released in 2016, and you’d be hard pressed to find games in their genres released this year that look any better. 

I’m not saying games now look bad, they just don’t look a decade better than Witcher 3. I feel like for most of my life video game graphics have been making continuous leaps. I can’t think of any other time since, hell, the N64, when you’d go damn near a decade with the top tier most graphically impressive cutting edge game not really looking much better than those from 6, 7, 9 years prior. 

Are there graphical powerhouses out there I’m just not aware of?

Control is the only one I can really think of, and control looks great, I just don’t think it looks that much better than say rdr2, maybe slightly better lighting system? But it’s hard to compare since almost all of control takes place indoors. ",Jimithyashford,1h4ofvr,https://reddit.com/r/gaming/comments/1h4ofvr/witcher_3_is_almost_a_decade_old_rdr2_is_6_years/,https://www.reddit.com/r/gaming/comments/1h4ofvr/witcher_3_is_almost_a_decade_old_rdr2_is_6_years/,2024-12-02 06:08:23,0,0.2,0,0,48,0,0,False,False,True,False,False,,self,t3_1h4ofvr
gaming,How deep does it go for Shin Megami?,"I have been recently playing persona 5, and found out about halfway through my playthrough, that it's connected to persona 4, and 3. So I went back cause I wanted to play those first. I then saw that they were spinoffs to a game series called Shin Megami Tensei. So I planned to play those. And they're tied to a book?

If I were to follow this string to the genesis of what shin megami were to eventually become, where should I start, I really want to go to the very beggining.",Exciting-Click6420,1h4cbl2,https://reddit.com/r/gaming/comments/1h4cbl2/how_deep_does_it_go_for_shin_megami/,https://www.reddit.com/r/gaming/comments/1h4cbl2/how_deep_does_it_go_for_shin_megami/,2024-12-01 20:14:04,0,0.4,0,0,32,0,0,False,False,True,False,False,,self,t3_1h4cbl2
gaming,"Are there any alternate online servers for Unreal Tournament 3, or a similar active game for multiplayer?  I know Xonotic exists, but it seems it's not very active","I used to like to play online multiplayer Unreal Tournament, with the last being Unreal Tournament 3.  There used to be a lot of great online game servers with different game types, and some with mods, and I used to play those quite a bit.  I always liked the game and the genre, but recently, I've tried playing and noticed the servers seem to be shut down.  And today I noticed I can't even log in anymore.  Indeed, it sounds like [Epic turned off online services for some games](https://www.epicgames.com/site/en-US/news/epic-is-turning-off-online-services-and-servers-for-some-older-games), including Unreal Tournament 3.

I installed [Xonotic](https://xonotic.org) several years ago, as it's a similar 3D shooter game, but I've noticed it doesn't seem to be very active - Whenever I go into multiplayer with Xonotic, there are few games, and what games there are usually only have 1 or 2 players.

I have to think people still enjoy playing multiplayer 3D shooters online?  Or have most people stopped playing them?  I'm curious if there are any similar active multiplayer games?  Also, if people do still like to play Unreal Tournament 3 online, might there be any alternate online servers?",RolandMT32,1h3qz7g,https://reddit.com/r/gaming/comments/1h3qz7g/are_there_any_alternate_online_servers_for_unreal/,https://www.reddit.com/r/gaming/comments/1h3qz7g/are_there_any_alternate_online_servers_for_unreal/,2024-12-01 00:44:36,4,0.56,4,0,15,0,0,False,False,True,False,False,,self,t3_1h3qz7g
gaming,Cloud Imperium Games Reportedly Lays Off Employees,,l30,1h2wa6w,https://reddit.com/r/gaming/comments/1h2wa6w/cloud_imperium_games_reportedly_lays_off_employees/,https://80.lv/articles/star-citizen-studio-reportedly-let-go-of-employees/,2024-11-29 21:25:57,886,0.79,886,0,261,0,0,False,False,False,False,False,,https://a.thumbs.redditmedia.com/JmgbhupdSHfkq6_IWLQkdVKWIBejU1ZlSFHb3DpcSB4.jpg,t3_1h2wa6w
