subreddit,title,selftext,author,id,permalink,url,created_utc,score,upvote_ratio,ups,downs,num_comments,total_awards_received,gilded,is_video,is_original_content,is_self,over_18,spoiler,link_flair_text,thumbnail,name
movies,"Hi, /r/movies! I am Malcolm Washington, director and co-writer of 'THE PIANO LESSON', starring Samuel L. Jackson, John David Washington &amp; Danielle Deadwyler. It will be released on Netflix tomorrow— Ask me anything!",,ThePianoLessonAMA,1gwj4n3,https://reddit.com/r/movies/comments/1gwj4n3/hi_rmovies_i_am_malcolm_washington_director_and/,https://i.redd.it/ggeqp7uu5a2e1.jpeg,2024-11-21 16:20:46,203,0.87,203,0,80,0,0,False,False,False,False,False,AMA,https://b.thumbs.redditmedia.com/tf714cQHJ-7SUamGXn37g8Df03K_tGe4gYClxy7feiw.jpg,t3_1gwj4n3
movies,Official Discussion Megathread (Gladiator II / Wicked: Part I / Moana 2),"[Gladiator II](https://old.reddit.com/r/movies/comments/1gwxxwd/official_discussion_gladiator_ii_spoilers/?)

[Wicked: Part I](https://old.reddit.com/r/movies/comments/1gwxxy1/official_discussion_wicked_part_i_spoilers/?)

[Moana 2](https://old.reddit.com/r/movies/comments/1h0uevk/official_discussion_moana_2_spoilers/?)",LiteraryBoner,1h0uf7h,https://reddit.com/r/movies/comments/1h0uf7h/official_discussion_megathread_gladiator_ii/,https://www.reddit.com/r/movies/comments/1h0uf7h/official_discussion_megathread_gladiator_ii/,2024-11-27 03:00:46,82,0.84,82,0,0,0,0,False,False,True,False,False,Official Discussion,self,t3_1h0uf7h
movies,Margot Robbie Reveals ‘Wolf of Wall Street’ Full-Frontal Nude Scene Was Her Idea,,Naweezy,1h4lazw,https://reddit.com/r/movies/comments/1h4lazw/margot_robbie_reveals_wolf_of_wall_street/,https://deadline.com/2024/12/margot-robbie-wolf-of-wall-street-full-frontal-nude-scene-her-idea-1236190492/,2024-12-02 03:09:37,9601,0.82,9601,0,710,0,0,False,False,False,False,False,News,https://b.thumbs.redditmedia.com/RVfyPmDfxcG-LySnilrp9TRFy3LGoVs0617rrRVNavc.jpg,t3_1h4lazw
movies,Will Ferrell Reflects On ‘Elf’ Legacy,,MarvelsGrantMan136,1h4j4dk,https://reddit.com/r/movies/comments/1h4j4dk/will_ferrell_reflects_on_elf_legacy/,https://deadline.com/2024/12/will-ferrell-elf-legacy-holiday-christmas-movie-1236190674/,2024-12-02 01:17:38,1576,0.9,1576,0,262,0,0,False,False,False,False,False,Article,https://b.thumbs.redditmedia.com/bppV_IPRl1ri2kkGvyCDEZLFXpFQW7cZeB2Ghilduyo.jpg,t3_1h4j4dk
movies,Nutcrackers (2024) starring Ben Stiller ruined my day,"https://www.imdb.com/title/tt30144381/?ref_=ext_shr_lnk  
  
Nutcrackers is, without a doubt, the worst movie I’ve seen in years. From the psychotic children to the dull, meandering plot, to the blandest cinematography, this film does nothing but waste your time. I already can’t stand David Gordon Green for what he did to the Halloween franchise, and now I can add this to the list of things he’s ruined.
  
It’s rare for me to finish a movie and genuinely wish it didn’t exist. This is one of those times. The movie’s not entertaining, it’s not dramatic, it’s just pointless. I honestly can’t believe this thing was greenlit.  
  
Ben Stiller returns to the screen after seven years… and this is what he came back to? Either he owed someone a huge favor or needed money because this is a complete disaster. I watched it with friends and at one point, I thought it’s probably almost over. There was still an hour left. I honestly thought I might scream. But we were too deep in at that point, so we kept watching. Spoiler: none of us enjoyed it.
  
This movie feels like you’re stuck in a never-ending loop, with the same boring shots, the same settings, and the same tired characters repeating over and over again for 1 hour and 45 minutes. I’ve never regretted spending time on a movie more. I’m actually angry it exists.
  
Do yourself a favor and don’t waste your time. You’ll probably tap out after 45 minutes anyway, so save yourself the trouble. Avoid it at all costs. ",omgyoucunt,1h4licu,https://reddit.com/r/movies/comments/1h4licu/nutcrackers_2024_starring_ben_stiller_ruined_my/,https://www.reddit.com/r/movies/comments/1h4licu/nutcrackers_2024_starring_ben_stiller_ruined_my/,2024-12-02 03:20:35,951,0.85,951,0,238,0,0,False,False,True,False,False,Discussion,self,t3_1h4licu
movies,'Moana' is the most streamed movie of the last 5 years with more than 44 billion minutes of stream time,,TerryBouchon,1h4xny7,https://reddit.com/r/movies/comments/1h4xny7/moana_is_the_most_streamed_movie_of_the_last_5/,https://streamingmoviesright.com/news/moana-most-streamed-movie-of-the-last-5-years-across-all-platforms/,2024-12-02 15:34:52,87,0.91,87,0,21,0,0,False,False,False,False,False,News,https://b.thumbs.redditmedia.com/B0gXfq5PbrvNri8XWmk3iXs1yJatU7iQ4co7msYOjyc.jpg,t3_1h4xny7
movies,From Roger Moore With Love (2024) | Official Trailer,,Bennett1984,1h4w7lg,https://reddit.com/r/movies/comments/1h4w7lg/from_roger_moore_with_love_2024_official_trailer/,https://www.youtube.com/watch?v=KPJ33hx7DAI,2024-12-02 14:30:11,80,0.93,80,0,29,0,0,False,False,False,False,False,Trailer,https://b.thumbs.redditmedia.com/exBkCYaLRp6jvis4gsTZLHn4uNrpS9s2zamKiLAeS3c.jpg,t3_1h4w7lg
movies,In Bruges. Wow.,"So I watched In Bruges and this is really a reddit movie, in a positive way, because it's one of these movies that you can find quoted around here, mainly in big threads, without loads of context, 'cause everyone and their mum but the reader knows where the damn quote originates from.

That being said: I absolutely loved it. It's a full circle feature film and made me realize how rare those are.

Why ""full circle""? Because in my eyes, everything it does, it does right. 

The setting itself is pretty rich, very interesting and fresh, not used many times before if I recall right.

The characters are, in my opinion, the closest someone has ever come to Quentin Tarantino.

The dialogue is vulgar and sometimes pretty deep at the same time. 

And all in all, the story, centering around three main characters in their small bubble, is a quick but sweet and simple but very interesting affair I loved seeing develop infront of me. There are not a lot of twists and turns, it does not need that, it just needs what it has to entertain all the way through.

It's darkly comedic and sometimes tragic and it manages both emotions with ease. 

All in all: a fantastic piece of cinema and my personal introduction to the great mind of Martin McDonagh.",Phyliinx,1h4mh25,https://reddit.com/r/movies/comments/1h4mh25/in_bruges_wow/,https://www.reddit.com/r/movies/comments/1h4mh25/in_bruges_wow/,2024-12-02 04:12:22,496,0.87,496,0,145,0,0,False,False,True,False,False,Discussion,self,t3_1h4mh25
movies,"""Pleasantville"" was unexpected. What started out as a seemingly conventional comedy became a social commentary about conventional vs modernism","Tobey Maguire's character yearning for the conventional world of the B&amp;W traditionl family values, he comes off as a Ben Shapiro-type without the bigotry, yet when he enters the world, he realizes his vision of the cookie cutter dimension isn't what he assumed to be. 

Oddly enough, the bigger transformation happens with his vapid sister, played by Reese Witherspoon, who manages to have the biggest growth in the story as she realizes she has goals she wishes to accomplish and ends up embracing the B&amp;W universe she previously rejected. 

Joan Allen is fantastic, though. The scene of her character discovering what an orgasm is and how it ends up changing her skin color? Superb directing.",Peter_Omun,1h4rynx,https://reddit.com/r/movies/comments/1h4rynx/pleasantville_was_unexpected_what_started_out_as/,https://www.reddit.com/r/movies/comments/1h4rynx/pleasantville_was_unexpected_what_started_out_as/,2024-12-02 10:24:35,140,0.88,140,0,27,0,0,False,False,True,False,False,Discussion,self,t3_1h4rynx
movies,What is the strangest movie fan theory you have ever heard?,"I would have to say that Ferris Bueller's Day Off is a prequel to Fight Club and that the Narrator is a grown up version of Cameron Fye. No it never made much sense to me because Ferris Bueller's Day Off and Fight Club are completely different stories. 

Another fan theory that I have heard is James Bond is not the man's real name but a codename that gets passed down from one man to another. No, James Bond is the man's actual name and in fact, the events of OHMSS are referenced throughout the Moore, Dalton, and Brosnan Bond movies.",TheShadowOperator007,1h4cvju,https://reddit.com/r/movies/comments/1h4cvju/what_is_the_strangest_movie_fan_theory_you_have/,https://www.reddit.com/r/movies/comments/1h4cvju/what_is_the_strangest_movie_fan_theory_you_have/,2024-12-01 20:37:45,1217,0.88,1217,0,1356,0,0,False,False,True,False,False,Discussion,self,t3_1h4cvju
movies,"Director Megan Park Discusses Her Coming-of-Age Comedy Film 'My Old Ass' (Starring Maisy Stella and Aubrey Plaza), One of 2024's Most Pleasant Surprises",,BunyipPouch,1h4g9pt,https://reddit.com/r/movies/comments/1h4g9pt/director_megan_park_discusses_her_comingofage/,https://www.hollywoodreporter.com/movies/movie-features/my-old-ass-title-joke-megan-park-interview-1236070115/,2024-12-01 23:03:38,618,0.87,618,0,70,0,0,False,False,False,False,False,Article,https://b.thumbs.redditmedia.com/4cK31bkXAQVlmt9rMbMs6bdwtvOrAFcz9SPVYIAwVmA.jpg,t3_1h4g9pt
movies,"In ""The Ninth Gate"" when we meet Green Eyes for the 1st time, Polanski pans to show the space beneath her chair. Why?","It's when Corso goes to see Balkan but he's giving a lecture. Corso sits at the back of the hall and notices Green Eyes there as well. Then the camera pans down to show her outstretched legs and the floor under her chair. I've tried to make out a shape in her shadow but am unsuccessful. The space must mean or indicate something, why else would Polanski focus on it, but what?

[update] It's to show her shoes. Also it provides some hints about the character. Thanks everyone.",BlackJacquesLeblanc,1h4jdii,https://reddit.com/r/movies/comments/1h4jdii/in_the_ninth_gate_when_we_meet_green_eyes_for_the/,https://www.reddit.com/r/movies/comments/1h4jdii/in_the_ninth_gate_when_we_meet_green_eyes_for_the/,2024-12-02 01:30:35,350,0.85,350,0,55,0,0,False,False,True,False,False,Question,self,t3_1h4jdii
movies,Movies to NOT go into blind,"Most of the time going into movies with no idea of the plot is fun, and there are a million posts here recommending the best to watch blind, but what are some you went into blind and regretted it? For me it's Martyrs. I had no idea what it was about, and I wish I had some warning (by the way, this movie is not included on enough lists of ""movies you'd never watch again""). What are some you recommend not watching blind and why?

",Outside-Pear9429,1h4d9uf,https://reddit.com/r/movies/comments/1h4d9uf/movies_to_not_go_into_blind/,https://www.reddit.com/r/movies/comments/1h4d9uf/movies_to_not_go_into_blind/,2024-12-01 20:55:07,613,0.85,613,0,989,0,0,False,False,True,False,False,Discussion,self,t3_1h4d9uf
movies,Mohammad Rasoulof Talks Making ‘The Seed of the Sacred Fig’ in Secret,,CosmosBazaar,1h4w4bt,https://reddit.com/r/movies/comments/1h4w4bt/mohammad_rasoulof_talks_making_the_seed_of_the/,https://www.indiewire.com/news/general-news/mohammad-rasoulof-making-the-seed-of-the-sacred-fig-secret-1235071057/,2024-12-02 14:25:59,21,0.9,21,0,0,0,0,False,False,False,False,False,Article,https://a.thumbs.redditmedia.com/zYjzEAih3C2yMT4OD7uRD8QNxEgPHwCdsCk0sXGE7y0.jpg,t3_1h4w4bt
movies,"Contact is one of the best movies I've ever seen, but I absolutely hate some of the ending","Major spoilers for the ending of Contact throughout the post, beware. 

Contact is an absolutely amazing film in almost every way. The ending is also amazing in a lot of ways. Ellie's character development, from a die-hard skeptic in religion to having had an almost religious experience herself, is extremely moving, and the entire scene where she is in the Machine is spectacular in every way. However. \[the scene where she is being interrogated by Kitz\](https://www.youtube.com/watch?v=8CiG9Wgvyj0) and what comes after is extremely out of character and full of plot holes. 

One of the things that makes Ellie's character so compelling is that she is a badass who stands up for herself, and she needs to be. Misogyny isn't talked about as explicitly in the film, but it isn't hard to read between the lines and see the way Drumlin constantly interrupts her and takes credit for her findings (even claiming to be the leader of the project he tried to kill) as a representation of sexism in the science field. This has happened to many, many female scientists throughout history (and is stated explicitly in the book). In order to get by with the cards stacked against her, \[Ellie learns to stand up for herself\](https://www.youtube.com/watch?v=wnkEace3rb4) and is very contrary to the typical ""damsel in distress"" story. At the end, they completely betray that. Ellie lets Kitz, a minor antagonist throughout, yell at her and call her crazy. Then, just to twist the knife, Joss defends her where she didn't defend herself, and they ride off into the sunset.

I have issues with the romantic arc between Joss and Ellie in general. Ellie is a genius who is passionate about astronomy; It's abundantly clear that she is very passionate about SETI. Being able to find and meet aliens is her life goal that she worked for all her life. Then Joss intentionally sabotages that goal by asking her an extremely loaded question that leads to her not getting chosen to meet the Vegans because he doesn't want her to die, and she's fine with that? Really? This man she slept with once and then saw again years later completely sabotages her life goal, and she doesn't even get mad? Personally, I don't care how madly in love I am, I would lose my shit if that happened. Most people would. Her reaction to that scene is incredibly out of character for her, but also out of character for pretty much anyone. 

Back to the ending: the plot holes. 

1. The chair was crushed during her trip, and Ellie only survived because she happened to have left the chair then (although I like to interpret it as her intuition saving her more than chance). If the pod fell through immediately as everyone else saw, either Ellie would have still been in the chair, safe and sound, or she would've been a pancake on the ceiling. It would've been impossible for her to have escaped the chair that quickly. This isn't mentioned at all, but would raise questions to anyone who saw the pod.

2. As previously stated, Ellie isn't the type to let them walk over her like they do in the trial, and she's extremely smart. She absolutely would've asked to see the static that was recorded, and they wouldn't have been able to hide it without being *extremely* suspicious. They could have lied or edited it, and the ending with Ellie not being believed would've remained (and I do really like that part) without making her look spineless. 

3. They still have the Machine. They could've sent someone else, or hell, they could've sent a stopwatch if nothing else. Or a plant, or some poor canary. You get the idea. It really just isn't a ""we'll never know"" thing. IMO, if one wanted to preserve the movie's ending as much as possible while fixing the plot holes, the Machine should've been damaged in some way. I doubt the government could've justified building a third one.

Those are my issues with the ending, but as I said, it is still an amazing movie. I just wish the ending had Ellie stay as the badass character she was. Having her lose her spine and become another damsel in distress just seems like a massive betrayal of her character.",PresentRevenue1347,1h4lwrm,https://reddit.com/r/movies/comments/1h4lwrm/contact_is_one_of_the_best_movies_ive_ever_seen/,https://www.reddit.com/r/movies/comments/1h4lwrm/contact_is_one_of_the_best_movies_ive_ever_seen/,2024-12-02 03:41:52,121,0.77,121,0,77,0,0,False,False,True,False,True,Discussion,spoiler,t3_1h4lwrm
movies,What are the movies in your watchlist that you still haven’t watched?,"We all have that never-ending watchlist filled with movies we keep adding but never actually watch. Whether it’s because of lack of time, the right mood, or just forgetting about them, some movies just sit there forever.

What’s been sitting in your watchlist for ages, and why haven’t you watched it yet? Let’s share and maybe motivate each other to finally hit play!

",iakgk,1h4snrx,https://reddit.com/r/movies/comments/1h4snrx/what_are_the_movies_in_your_watchlist_that_you/,https://www.reddit.com/r/movies/comments/1h4snrx/what_are_the_movies_in_your_watchlist_that_you/,2024-12-02 11:13:58,21,0.71,21,0,112,0,0,False,False,True,False,False,Question,self,t3_1h4snrx
movies,What are your favorite uncommon Christmas movies?,"Everyone watches Home Alone 1-2, Die Hard, Love Actually, The Holiday, Gremlins, Elf, The Grinch, Nightmare before Christmas, Christmas Vacation...., but what are some movies you started watching as a new tradition? For me its The Hateful Eight. The location together with the snow storm always puts me in a good Christmas mood.",Scoreback,1h45pqs,https://reddit.com/r/movies/comments/1h45pqs/what_are_your_favorite_uncommon_christmas_movies/,https://www.reddit.com/r/movies/comments/1h45pqs/what_are_your_favorite_uncommon_christmas_movies/,2024-12-01 15:29:46,857,0.91,857,0,2392,0,0,False,False,True,False,False,Discussion,self,t3_1h45pqs
movies,Christmas Vacation is 35! Where’s the Tylenol?,,johntentaquake,1h4xlq1,https://reddit.com/r/movies/comments/1h4xlq1/christmas_vacation_is_35_wheres_the_tylenol/,https://www.pastemagazine.com/movies/christmas-vacation/christmas-vacation-is-30-wheres-the-tylenol,2024-12-02 15:32:12,8,0.64,8,0,15,0,0,False,False,False,False,False,Article,https://b.thumbs.redditmedia.com/x3eUMPNWQchVxcjkDH8mGUf04pJpGXPRTaVHEVDGLiw.jpg,t3_1h4xlq1
movies,"Non-american parody movies
","Hi, have you guys seen any good parody movies that aren't from mainstream Hollywood? My student group would like to have special screenings in our local theater for ten evenings and we are running low on options. We got mostly american ones, but we are looking for some parodies that are not so famous/commonly known.",Myslivir,1h4x8gq,https://reddit.com/r/movies/comments/1h4x8gq/nonamerican_parody_movies/,https://www.reddit.com/r/movies/comments/1h4x8gq/nonamerican_parody_movies/,2024-12-02 15:16:12,11,0.74,11,0,45,0,0,False,False,True,False,False,Discussion,self,t3_1h4x8gq
movies,"Marshall Brickman, Oscar-Winning Screenwriter on ‘Annie Hall,’ Dies at 85",,MarvelsGrantMan136,1h468gb,https://reddit.com/r/movies/comments/1h468gb/marshall_brickman_oscarwinning_screenwriter_on/,https://www.hollywoodreporter.com/movies/movie-news/marshall-brickman-dead-annie-hall-screenwriter-1236074246/,2024-12-01 15:53:14,543,0.91,543,0,12,0,0,False,False,False,False,False,News,https://b.thumbs.redditmedia.com/jZI3orHhr87mdwJkI1Vs2JkZk4tBt8aOHyhgwFaGpfs.jpg,t3_1h468gb
movies,You Favourite Movies of 2024 so far ,"We've almost reached the end of 2024 and it's been a subtle ""fresh breeze of air "" kind of a year , with low quantity but high quality of movies coming out .

What are your Top 5 favourite movies of this year so far ?

Mine are                       -

1. Dune Part 2  - No doubt the greatest movie of the year and a perfect balance between  spectacle and detailed world building .


2. The Wild Robot   - Dramwork's best in years and one of the most hard hitting movies of the decade.



3. Kill     - An Indian movie which surpasses the level of modern Hollywood Action movies with ease imo . Non Stop insane ride of high octane realistic action sequences . ( Chad Stahelski is going to remake this movie in English )



4. The Substance    - The craziest a movie can get .



5. Smile 2      - A fresh engaging horror flick which lives up to the hype.
",Beefyvalkyrie,1h45fx3,https://reddit.com/r/movies/comments/1h45fx3/you_favourite_movies_of_2024_so_far/,https://www.reddit.com/r/movies/comments/1h45fx3/you_favourite_movies_of_2024_so_far/,2024-12-01 15:17:06,569,0.85,569,0,666,0,0,False,False,True,False,False,Discussion,self,t3_1h45fx3
movies,"What is the movie you have heard referenced the most, but never seen your self? if allowed, add your general age range","I (36M) have never seen My dinner with Andre. Im downloading it tonight and watching it because I feel like I have been missing out on a ton of references in popular TV/movies, and probably a good movie!

Full disclosure I just rewatched 'Communitiy's Critical film Studies and now I need to watch My Dinner With Andre",OutOfPlaceArtifact,1h4h1lz,https://reddit.com/r/movies/comments/1h4h1lz/what_is_the_movie_you_have_heard_referenced_the/,https://www.reddit.com/r/movies/comments/1h4h1lz/what_is_the_movie_you_have_heard_referenced_the/,2024-12-01 23:39:17,97,0.81,97,0,412,0,0,False,False,True,False,False,Discussion,self,t3_1h4h1lz
movies,"Tim Burton Rules Out ‘Edward Scissorhands,’ ‘Nightmare Before Christmas’ Sequels: ""Certain things are best left on their own""",,Gato1980,1h4xz5d,https://reddit.com/r/movies/comments/1h4xz5d/tim_burton_rules_out_edward_scissorhands/,https://www.indiewire.com/features/interviews/tim-burton-another-johnny-depp-collaboration-1235071255/,2024-12-02 15:48:27,5,0.86,5,0,1,0,0,False,False,False,False,False,Article,https://b.thumbs.redditmedia.com/HqLLw38f8SgFVPWbv_Vn4k9t8Hx6ZJDBUTQmJ1jHuto.jpg,t3_1h4xz5d
movies,"""Slowly spiraling downward into destruction"" films","I love films where we watch people's lives fall apart at the seams as their inner flaws and bad choices gradually bear fruit. Done best when a small group of family members or friends dip their toes into crime and are unable to handle the consequences. Call it schadenfreude or just the pleasure of watching someone else's life go worse than mine.

Classics of the genre:

Before the Devil Knows You're Dead - One of Philip Seymour Hoffman's* masterclasses with a stunning Marisa Tomei and desperate Ethan Hawke. Great soundtrack and vibes reminiscent of David Mamet films.

A Simple Plan - The story flows flawlessly from beginning to end. Bill Paxton and Billy Bob Thornton are perfect casting. One of the few films I loved so much that I read the book (the first 80% is beat for beat the same as the film, but that last 20%, damn).

The Way of the Gun - Brilliant film by Christopher McQuarrie before he became tied at the hip with Tom Cruise. Benicio del Toro's best performance IMHO.

Honorable mention - Bloodline (season 1 especially), Full Circle on Max has a lot of these vibes.

What others?",salaryboy,1h46m27,https://reddit.com/r/movies/comments/1h46m27/slowly_spiraling_downward_into_destruction_films/,https://www.reddit.com/r/movies/comments/1h46m27/slowly_spiraling_downward_into_destruction_films/,2024-12-01 16:10:08,382,0.87,382,0,450,0,0,False,False,True,False,False,Discussion,self,t3_1h46m27
movies,"Kate Winslet's emotional ""Titanic"" reunion",,outremer_empire,1h4m1h9,https://reddit.com/r/movies/comments/1h4m1h9/kate_winslets_emotional_titanic_reunion/,https://youtu.be/tOw8vRnw85o?si=q5kLSh-fMzdiH6Cx,2024-12-02 03:49:06,43,0.64,43,0,14,0,0,False,False,False,False,False,Media,https://b.thumbs.redditmedia.com/NjZTSlAWmMRI5UpmcSIqzd3e3-D0NtKJO0z9awzocoI.jpg,t3_1h4m1h9
movies,Cannes: 17 Unsimulated Sex Scenes in the Festival's History,,indiewire,1h3owte,https://reddit.com/r/movies/comments/1h3owte/cannes_17_unsimulated_sex_scenes_in_the_festivals/,https://www.indiewire.com/gallery/mektoub-cannes-unsimulated-sex-scenes-history/,2024-11-30 23:04:34,8126,0.9,8126,0,896,0,0,False,False,False,False,False,Discussion,https://b.thumbs.redditmedia.com/pFcpBe0fMz6K6EIWu4Xr-hzfwU5oCZ2DdkWXXWp73ps.jpg,t3_1h3owte
movies,Great Opening Movie Scenes that set the tone for the rest of the movie,"I will go first, I have two particular scenes that come to mind. The first is the shadow boxing scene in Raging Bull (1980). The second movie is the scene in the Thing 1982, which involves a guy in the helicopter trying to kill a dog.

Please feel free to share your favourite opening movie scenes that sets the tone for the rest of the movie.",Tyrionthedwarf1,1h4a87h,https://reddit.com/r/movies/comments/1h4a87h/great_opening_movie_scenes_that_set_the_tone_for/,https://www.reddit.com/r/movies/comments/1h4a87h/great_opening_movie_scenes_that_set_the_tone_for/,2024-12-01 18:45:52,110,0.83,110,0,364,0,0,False,False,True,False,False,Discussion,self,t3_1h4a87h
movies,Who is your favorite movie villain where the actor was a delight and lovely human being in real life?,"My gold standard is Louise Fletcher as Nurse Ratched (and for the trekkies here, as Kai Winn in Deep Space Nine... another ""God I hate that character"" role). 

In real life, I heard nothing but praise about how kind and pleasant and unbothered she was before she sadly passed away.

Another candidate is Alan Rickman who is my favorite Christmas villain (Die Hard and Love Actually) who was loved by nearly everyone who knew him.
",TravellingBeard,1h4xxa3,https://reddit.com/r/movies/comments/1h4xxa3/who_is_your_favorite_movie_villain_where_the/,https://www.reddit.com/r/movies/comments/1h4xxa3/who_is_your_favorite_movie_villain_where_the/,2024-12-02 15:46:10,2,0.67,2,0,4,0,0,False,False,True,False,False,Discussion,self,t3_1h4xxa3
