subreddit,title,selftext,author,id,permalink,url,created_utc,score,upvote_ratio,ups,downs,num_comments,total_awards_received,gilded,is_video,is_original_content,is_self,over_18,spoiler,link_flair_text,thumbnail,name
movies,Comic strips into movies,"I’ve just started reading Doonesbury from the beginning. In all the years I’ve been reading comic strips I never got into Doonesbury so it’s a totally new experience for me. As I’m reading it I thought to myself more than once that it’s would have translated to film pretty well. 

So I started thinking about all the comic strips I’ve been reading over the years and how few of them have actually become film projects. 

Does anyone know why we haven’t had a few more comic strips turned into movies?

I know Bill Watterson has always been against the commercializations of Calvin and Hobbes but that’s the only one I’ve kind of heard about. 

Also a special shout out to Dick Tracy which was a comic strip turned into a movie and should receive a little more love around here because I don’t see it mentioned around here ever ",drjudgedredd1,1h2unqa,https://reddit.com/r/movies/comments/1h2unqa/comic_strips_into_movies/,https://www.reddit.com/r/movies/comments/1h2unqa/comic_strips_into_movies/,2024-11-29 20:11:27,5,0.63,5,0,33,0,0,False,False,True,False,False,Discussion,self,t3_1h2unqa
movies,We don’t support good movies: Anurag Kashyap,,sidroy81,1h2udae,https://reddit.com/r/movies/comments/1h2udae/we_dont_support_good_movies_anurag_kashyap/,https://www.mansworldindia.com/lifestyle/entertainment/hindi-cinema-today-doesn-t-feel-honest-anurag-kashyap,2024-11-29 19:58:34,0,0.34,0,0,0,0,0,False,False,False,False,False,News,https://b.thumbs.redditmedia.com/-tGgnlHNkmuQyB2sNWTzWgF9WFQqTMRu5R9N1dVQdlM.jpg,t3_1h2udae
movies,"Benji ""A Real Pain"" (2024) ","While seeing this film I noticed small bits of things I tend to do that correlated with Benji (Kieran Culkin's) behavior. Just like Benji I am very extroverted and a happy person in general, but there are moments when certain things or situations just get to me very deeply and I get very emotional. I'm hypersensitive which means I enjoy life to the fullest and is grateful for the little things in life but I can also get sad for the littlest things which makes me suffer unconditionally. I've never met or seen anyone like me until I saw this movie. I was evaluating every single person's reaction to Benji's way of being, non of them wanted to be near him since the risk of him having a tantrum or having an emotional burst...This made me realize why I don't have any close friends or people around me, seeing the movie made me realize that if I had a benji I wouldn't wanna be near him or myself with the fear that they could hurt me in emotional and mental ways; being there for those types of people is very draining. They tend to be very negative towards themselves and feel like they don't deserve certain things. These negative feelings toward themselves makes them jealous of everyone since they feel like they aren't capable of deserving true love and real happiness. I am writing this description based on the things I saw he does in the movie as well as what correlates with me. I've been reading reviews like crazy to find a diagnoses because he has the same issues as me. He was diagnosed with bipolar disease and took medications but I've been told I don't have bipolar and would never take meds to solve a mental or emotional issue. I've been in a personal journey to help myself since my mother told me she prefers to protect herself from me since it's very tiring to be near me. The good times are amazing but she says she senses evil and negativity just as if I wanted to ruin a good time and have everyone focus on myself. I struggle with self-destruction tendencies since I was a kid and a part of me  thinks I do this because I feel like I'm not good enough and all the overthinking gets together and makes me burst with emotions or doing something to hurt myself or others just so I could stay alone and suffer. I think benji and I just both struggle with self-destruction tendencies. My psychologist told me that my personal self-love journey is going to help a lot and I won't be able to let other people love me until I learn to love myself. Personally I'm very happy that I've become self aware of all the people i've hurt in my life but most importantly myself, I'm glad I finally made the choice to help myself and stop being the victim. I'm a bit nervous because I've never been to truly love myself even after 22 years, I've always been quite negative about my body and even if I fix something it's never good enough, I just need to love who I am and I'm sure I can get through it with the right professional help.",Intrepid_Computer_68,1h2tzux,https://reddit.com/r/movies/comments/1h2tzux/benji_a_real_pain_2024/,https://www.reddit.com/r/movies/comments/1h2tzux/benji_a_real_pain_2024/,2024-11-29 19:41:26,0,0.44,0,0,1,0,0,False,False,True,False,True,Discussion,spoiler,t3_1h2tzux
movies,Quotables,"Continuing a discussion from last night's Thanksgiving dinner, do you think movies have gone down in quality and quantity of Quotables?

I think the single most quotable film of all time is The Big Lebowski.  Pretty much every line in that film is God-Tier quotable.

Some films only have a few Quotables but they're just as epic. Aliens for example has ""they mostly come out at night"" and ""game over, man!"" which are both gold.

The great comedies are masterpieces of Quotables.  Airplane! and Hot Fuzz in particular (along with the already-mentioned Lebowski) are packed with incredibly awesome Quotables.

But what happened to cinema?  These days you barely even get a single great Quotable even in good movies.  I loved both the new Dune films, but I can't think of a single good quotable in either one.  ""I love you 3000"" is an ass-tier quotable.  ""On your left"" like that's not even fun, what else has Marvel even got?  ""I am Iron Man"" I guess but that movie is now 14 years old and the first one they made, and back when films still came with quotables.

I think we need to do something, write letters to the studios maybe or holler at James Gunn on twitterX.  Great one-liners are an important part of the moviegoing experience but nobody drops them anymore it seems.

Does this even make sense to anyone else?l or dod I just eat too much turkey yesterday and the tryptophan is still messing with my mind?  ",sfweedman,1h2tlgb,https://reddit.com/r/movies/comments/1h2tlgb/quotables/,https://www.reddit.com/r/movies/comments/1h2tlgb/quotables/,2024-11-29 19:23:45,0,0.33,0,0,8,0,0,False,False,True,False,False,Discussion,self,t3_1h2tlgb
movies,The Night Before 2015,"This is the perfect Christmas movie for adults. 

Doesn’t take the crude humour too far while maintaining a wholesome message the whole runtime. The main trios chemistry rocks. Also adding a few hilarious side characters. It’s the ideal watch with a couple of friends over the holidays, highly recommend. ",Vista____,1h2tcvi,https://reddit.com/r/movies/comments/1h2tcvi/the_night_before_2015/,https://www.reddit.com/r/movies/comments/1h2tcvi/the_night_before_2015/,2024-11-29 19:13:27,32,0.76,32,0,9,0,0,False,False,True,False,False,Recommendation,self,t3_1h2tcvi
movies,Clichés you want to be rid of,"Clichés are everywhere in film. Some good, some bad, some so annoying and overdone that they are a groaner. 

+ Bad guys are r*pists - there are other ways to show people are bad or evil
+ ""You wouldn't understand"" - just say it. Either they do or don't and clarification can happen
+ Characters constantly asking ""what do you mean"" or ""then what"" when another is explaining something. Like bro, chill. They're explaining it, hold your questions until the end
",Twistybananana,1h2tb42,https://reddit.com/r/movies/comments/1h2tb42/clichés_you_want_to_be_rid_of/,https://www.reddit.com/r/movies/comments/1h2tb42/clichés_you_want_to_be_rid_of/,2024-11-29 19:11:20,0,0.29,0,0,23,0,0,False,False,True,False,False,Discussion,self,t3_1h2tb42
movies,Sisters (1972),"The film is directed by Brian De Palma and is about Danielle Breton (Margot Kidder) who is a French Canadian model and aspiring actress that was separated by her conjoined twin Dominique also played by Kidder. A ad salesman Philip Woode (Lisle Wilson) wins a dinner for two on this tv show and Danielle meets him and they start to date. Everything goes wrong the next day as Danielle says to Philip it’s her and her twin sister Dominique’s birthday so he goes out to pick up Danielle’s meds and also a cake, when he gets back to the apartment he is stabbed to death by Dominique. This catches the eye of Grace Collier (Jennifer Salt) who is a reporter that lives in the building next door that saw Phillip getting stabbed. She calls the police and the detective doesn’t believe her and things start to get suspenseful. I really liked the film and I liked how De Palma paid homage to Hitchcock’s style of filmmaking.",Mikeyboy101591,1h2t7x0,https://reddit.com/r/movies/comments/1h2t7x0/sisters_1972/,https://www.reddit.com/r/movies/comments/1h2t7x0/sisters_1972/,2024-11-29 19:07:23,6,0.69,6,0,1,0,0,False,False,True,False,False,Review,self,t3_1h2t7x0
movies,Most Anticipated movies of 2025,"What are your Top 5 most anticipated movies of 2025 ?


Mine are          -

1. Superman   - Ofcourse the most awaited movie. It can make or break the opportunity for DC to stage a comeback like never before.


2. F1  - Hoping a career reviving Blockbuster for Brad Pitt ( my all time fav. ) which will also be an objectively great and fresh movie just like Kosinski's previous Top Gun Maverick 


3. The Fantastic Four  - Not expecting it to be objectively well made film but surely am ready for a big RDJ return and hopefully a very enjoyable MCU movies after a long time. 


4. Mickey 17 - The most fresh and unique movie of next year.


5. The Battle of The Baktan Cross-
LDC + PTA absolute cinema , hope it'll be even better than Killers of the Flower Moon.",Beefyvalkyrie,1h2t6cw,https://reddit.com/r/movies/comments/1h2t6cw/most_anticipated_movies_of_2025/,https://www.reddit.com/r/movies/comments/1h2t6cw/most_anticipated_movies_of_2025/,2024-11-29 19:05:32,0,0.32,0,0,27,0,0,False,False,True,False,False,Discussion,self,t3_1h2t6cw
movies,Twister (1996) alternative ending or deleted scene? ,"help me out here pls :) 

I clearly remember a scene in Twister in the end where Jo (Helen Hunt) is sitting by the window with a baby. There is a bright blue sky and there are these metallic wind chimes right by the window. And she is watching a TV where Bill (Paxton) is doing a weather review or something along these lines.

Me and my husband have seen Twister multiple times and he says he never saw even anything remotely like this. While I have this clear picture...

Was it a deleted scene? a post credit scene? or am I mixing it up with some other movie? 
",KMystera,1h2t0ps,https://reddit.com/r/movies/comments/1h2t0ps/twister_1996_alternative_ending_or_deleted_scene/,https://www.reddit.com/r/movies/comments/1h2t0ps/twister_1996_alternative_ending_or_deleted_scene/,2024-11-29 18:59:06,0,0.39,0,0,12,0,0,False,False,True,False,False,Question,self,t3_1h2t0ps
movies,Lupin The IIIrd The Movie | Special Teaser Trailer,,MiserableSnow,1h2sxjf,https://reddit.com/r/movies/comments/1h2sxjf/lupin_the_iiird_the_movie_special_teaser_trailer/,https://youtu.be/KopjWLIz59k?si=QXvJ3-PV5s8T6OzG,2024-11-29 18:55:17,451,0.89,451,0,59,0,0,False,False,False,False,False,Trailer,https://b.thumbs.redditmedia.com/cQ0tZD0jtid4KUWkh9T3sUmrcoC7A1Z6_WwDnp0cDQg.jpg,t3_1h2sxjf
movies,What's the funniest movie ever? ,"Recently, being quite young, I have been catching up on as many old films as possible and lately in particular I have been watching old comedy films. I would be curious to know what for you is the funniest comedy film of all time, because lately some comedy films I've seen haven't made me laugh much and I would like something REALLY funny, that will make me cry laughing and slap my knees. Please tell me yours. Thank for the answer.

EDIT: If I have already seen or if I will see the film you recommended, I will tell you what I honestly think about it",DAVIDE-CIM,1h2swvq,https://reddit.com/r/movies/comments/1h2swvq/whats_the_funniest_movie_ever/,https://www.reddit.com/r/movies/comments/1h2swvq/whats_the_funniest_movie_ever/,2024-11-29 18:54:29,0,0.27,0,0,119,0,0,False,False,True,False,False,Discussion,self,t3_1h2swvq
movies,Ending of Whiplash (2014) and what could’ve happened after.,"I have 2 theories for what happened after,
(Also its been a minute since i did a deep watch so i probably have some things wrong but you can get the simple idea)


Andrew goes back to Fletcher and although getting his respect, he still gets treated like crap. (Just not as much as before). I say he gets stuck into Fletchers band but gets out and goes to a better place but then everything goes down from there for his mental health (bad ending)


Andrew says thank you but still Fu to fletcher and someone in the audience gets Andrew a deal with higher ups and his drumming career goes up hill (good ending)


Although it sucks, i think first ending is happening 7 out of 10 times.",N1cky_65,1h2srxg,https://reddit.com/r/movies/comments/1h2srxg/ending_of_whiplash_2014_and_what_couldve_happened/,https://www.reddit.com/r/movies/comments/1h2srxg/ending_of_whiplash_2014_and_what_couldve_happened/,2024-11-29 18:48:38,0,0.18,0,0,4,0,0,False,False,True,False,True,Discussion,spoiler,t3_1h2srxg
movies,Good for Francis Ford Coppola,"Any director’s (potential) last film should be as challenging as Megalopolis. I think it’s gonna age well. Unlike what he almost left us with as his last flick, Twixt. A bizarre meditation on loss and love. Megalopolis is everything plus the kitchen sink. It’d  be one of those films that when it’s on TV I’d have to stop and watch it. For a director (and writer) in his mid-80s, Francis has accomplished something his contemporaries can’t. That’s continue to take big, experimental risks on himself and his films. He’s done what George Lucas always said he’d do, but hasn’t. I haven’t enjoyed a Spielberg film in decades. DePalma can’t seem to get it together (and I root for him). In the end, Coppola should be crowned king of independent movie making (and a royal mercurial force behind a few big budget masterpieces).",tangledapart,1h2ryfs,https://reddit.com/r/movies/comments/1h2ryfs/good_for_francis_ford_coppola/,https://www.reddit.com/r/movies/comments/1h2ryfs/good_for_francis_ford_coppola/,2024-11-29 18:13:19,0,0.42,0,0,60,0,0,False,False,True,False,False,Discussion,self,t3_1h2ryfs
movies,20th Century Wins Pre-Holiday Bidding War For Edward Berger &amp; Austin Butler’s Time Travel Film ‘The Barrier’ Based On MacMillan Hedges Short Story,,KillerCroc1234567,1h2ro5p,https://reddit.com/r/movies/comments/1h2ro5p/20th_century_wins_preholiday_bidding_war_for/,https://deadline.com/2024/11/the-barrier-20th-century-edward-berger-austin-butler-film-1236187124/,2024-11-29 18:01:06,26,0.7,26,0,0,0,0,False,False,False,False,False,News,https://a.thumbs.redditmedia.com/_jzc5BA93rODiTG1aBS4RWrhLGuap7FJggFQg-CgPU8.jpg,t3_1h2ro5p
movies,"American Beauty, Powder, Chinatown, and X-Men are all examples of tainted movies due to their Director or Actors private/public lives. What's your stance on ""Blacklisted"" movies?","I love movies for the movie not for the actor or director. It's my stance that the art is separate from the person. But all my life I've seen people be vilified for liking something just because a person involved in the project did something heinous.

For me this goes back to Paul Reubens and Pee-Wee Herman. I'm sure the list is as long as motion pictures are old. And everyone has liked someone's work that has since fallen from grace. From Mel Gibson to Jeffery Jones.

Do you stop loving a movie due to their directors, actors, and/or producers public image being tarnished? Do you feel pressured not to like a movie for that reason?",sergemeister,1h2rhj3,https://reddit.com/r/movies/comments/1h2rhj3/american_beauty_powder_chinatown_and_xmen_are_all/,https://www.reddit.com/r/movies/comments/1h2rhj3/american_beauty_powder_chinatown_and_xmen_are_all/,2024-11-29 17:53:02,0,0.21,0,0,57,0,0,False,False,True,False,False,Discussion,self,t3_1h2rhj3
movies,What great classic films should definitely never have a sequel?,"
Which classic films would genuinely NOT benefit from a sequel, and WHY?   (Unless it’s obvious to all, might you tell us WHY you offer your answer?) 

These days, many (almost all) movies are made with a sequel or trilogy in mind. Even if the story ends with the destruction of the galaxy, there’s always room for that follow-up (and the potential for additional ca$h). 

In the past, movies were not created with this mindset.  Which movies are notably Not sequel ready?  In other words and in a roundabout way, how have sequels affected the quality of the movies being made today?

In my thinking, _Groundhog Day_ is a good example.  The story is completely wrapped up by the end.  No sequel necessary or wanted.  ",airpipeline,1h2r1cn,https://reddit.com/r/movies/comments/1h2r1cn/what_great_classic_films_should_definitely_never/,https://www.reddit.com/r/movies/comments/1h2r1cn/what_great_classic_films_should_definitely_never/,2024-11-29 17:33:29,119,0.78,119,0,532,0,0,False,False,True,False,False,Discussion,self,t3_1h2r1cn
movies,Favorite movie by european country: Portugal,"Hello there,

yesterday, I've asked you for your favorite movie set in Poland - and I really would like to thank all the participants: We got around 50 comments and almost as many movie suggestions. Especially with this in mind, the final result is very close: ***Krótki film o zabijaniu*** (engl.: *A Short Film About Killing*) has won the race with just 12 upvotes (minus the given downvotes).

Today, I'm asking you for your favorite movie set in Portugal. As always, the winner  will soon take its place in [our official letterboxd list](https://letterboxd.com/lalunallena/list/reddits-favourite-movie-by-european-country/share/N58XneSCnjHwwiJw/detail/). And as always, there are only two rules:

* It's about where the movie is set plot-wise and not about where the movie was filmed. In case of historical movies, it's important that the bigger part of the movie takes place in a geogprahical territory, that is part of the given country today. Sometimes, especially when it's really hard to find any movie, it is also fine if only a certain part of the film is set in the respective country - but it has to be a large part.
* Winner movie is the movie with the most upvotes (minus the given downvotes) after 24 hours. Therefore, it's important that you only mention one movie per comment and that you check up if you're movie was mentioned in an earlier comment before you suggest it.

I'm really looking forward to your film suggestions!

&gt;Day 36: Poland - Krótki film o zabijaniu (engl.: A Short Film About Killing)

&gt;Day 35: Norway - Flåklypa Grand Prix (engl.: Pinchcliffe Grand Prix)

&gt;Day 34: North Macedonia - Нема да бидеш сама (engl.: You Won’t Be Alone)

&gt;Day 33: Netherlands - Zwartboek (engl.: Black Book)

&gt;Day 32: Montenegro - Igla Ispod Praga (engl.: The Black Pin)

&gt;Day 31: Monaco - La fille de Monaco (engl.: The Girl from Monaco)

&gt;Day 30: Moldova - Carbon

&gt;Day 29: Malta - Luzzu

&gt;Day 28: Luxembourg - Läif a Séil (engl.: The Last Ashes)

&gt;Day 27: Lithuania -Vaikai iš Amerikos viešbučio (engl.: The Children from the Hotel America)

&gt;Day 26: Liechtenstein - Kinder der Berge

&gt;Day 25: Latvia - Kriminālās ekselences fonds (engl.: The Foundation of Criminal Excellence)

&gt;Day 24: Kosovo - Zgjoi (engl.: Hive)

&gt;Day 23: Italy - Nuovo Cinema Paradiso (engl.: Cinema Paradiso)

&gt;Day 22: Ireland - The Wind That Shakes the Barley

&gt;Day 21: Iceland - Englar Alheimsins (engl.: Angels of the Universe)

&gt;Day 20: Hungary - Sátántangó

&gt;Day 19: Greece - Κυνόδοντας (engl.: Dogtooth)

&gt;Day 18: Germany - Das Leben der Anderen (engl.: The Lives of Others)

&gt;Day 17: Georgia - ცისფერი მთები ანუ დაუჯერებელი ამბავი (engl.: Blue Mountains)

&gt;Day 16: France - La Haine

&gt;Day 15: Finland - Mies vailla menneisyyttä (engl.: The Man Without a Past)

&gt;Day 14: Estonia - Vehkleja (engl.: The Fencer)

&gt;Day 13: Denmark - Jagten (engl.: The Hunt)

&gt;Day 12: Czechia - Spalovač mrtvol (engl.: The Cremator)

&gt;Day 11: Cyprus - Smuggling Hendrix

&gt;Day 10: Croatia - Kako je počeo rat na mome otoku (engl.: How the War Started on My Island)

&gt;Day 9: Bulgaria - Източни пиесиИзточни пиеси (engl.: Eastern Plays)

&gt;Day 8: Bosnia and Herzegovina - Ničija zemlja (engl.: No Man's Land)

&gt;Day 7: Belgium - In Bruges

&gt;Day 6: Belarus - Иди и смотри (engl.: Come and See)

&gt;Day 5: Azerbaijan - Yuxu (engl.: The Dream)

&gt;Day 4: Austria - Funny Games

&gt;Day 3: Armenia - Նռան գույնը (engl.: The Color of Pomegranates)

&gt;Day 2: Andorra - El fred que crema (engl.: The Burning Cold)

&gt;Day 1: Albania - Lulekuqët mbi Mure (engl.: Red Poppies on Walls)5",Impossible_Werewolf8,1h2qz8b,https://reddit.com/r/movies/comments/1h2qz8b/favorite_movie_by_european_country_portugal/,https://www.reddit.com/r/movies/comments/1h2qz8b/favorite_movie_by_european_country_portugal/,2024-11-29 17:30:59,40,0.69,40,0,67,0,0,False,False,True,False,False,Discussion,self,t3_1h2qz8b
movies,Brave Movie 2025,"Hi all, I wanted to share a project with you that I’m deeply involved in and very proud of! The article just dropped today and shooting starts next summer. ‘Brave’ will be the first feature film shot on Choctaw nation land and the tribe are deeply involved with the production. Cannot wait to be able to help bring this fantastic story to the screen 😊 

https://www.hollywoodreporter.com/movies/movie-features/brave-choctaw-nation-film-amber-midthunder-dallas-goldtooth-1236071582/",OutlandishnessNice82,1h2qg7w,https://reddit.com/r/movies/comments/1h2qg7w/brave_movie_2025/,https://www.reddit.com/r/movies/comments/1h2qg7w/brave_movie_2025/,2024-11-29 17:08:13,216,0.83,216,0,20,0,0,False,False,True,False,False,Article,self,t3_1h2qg7w
movies,Cities as Side Characters: A Cinematic Love Letter to Urban Landscapes,"Ever noticed how some movies make a city more than just a backdrop? Some directors go beyond showing a skyline or a monument. They dive deep into the city’s culture, spirit, and unique character to weave it into the story.

Bollywood has some brilliant examples of cities playing side characters:

Wake Up Sid gives us a heartfelt glimpse into Mumbai’s monsoons and its never-ending life.

Kahaani celebrates Kolkata’s festive chaos and mysteries.

8 AM Metro dives into Hyderabad’s beauty while exploring human emotions.


Even Hollywood embraces this concept:

Before Sunrise romanticizes Vienna’s quiet charm.

Midnight in Paris takes us through the dreamy streets of the city of love.

La La Land reflects LA’s bittersweet relationship with dreams.


From the ghats of Varanasi in Masaan to the neon-lit streets of Tokyo in Lost in Translation, cities have so much to say without uttering a single word.

What are your favorite movies where cities have their own stories to tell? ",tousif_001,1h2q1uk,https://reddit.com/r/movies/comments/1h2q1uk/cities_as_side_characters_a_cinematic_love_letter/,https://www.reddit.com/r/movies/comments/1h2q1uk/cities_as_side_characters_a_cinematic_love_letter/,2024-11-29 16:50:59,0,0.45,0,0,13,0,0,False,False,True,False,False,Article,self,t3_1h2q1uk
movies,"🎬 If You Could Remake a Movie, What Would You Change?

","Imagine having the power to take a movie you love, handpick your dream cast, and make it even better. Would you flip the genre, add unexpected plot twists, or give the characters deeper backstories? Maybe you'd reinvent the soundtrack or add stunning visuals that leave audiences in awe. Let your imagination run wild—how would you turn a good movie into a masterpiece? Share your vision and let’s reimagine cinema together! 🎥🍿",iakgk,1h2pmvf,https://reddit.com/r/movies/comments/1h2pmvf/if_you_could_remake_a_movie_what_would_you_change/,https://www.reddit.com/r/movies/comments/1h2pmvf/if_you_could_remake_a_movie_what_would_you_change/,2024-11-29 16:32:19,0,0.25,0,0,43,0,0,False,False,True,False,False,Question,self,t3_1h2pmvf
