subreddit,title,selftext,author,id,permalink,url,created_utc,score,upvote_ratio,ups,downs,num_comments,total_awards_received,gilded,is_video,is_original_content,is_self,over_18,spoiler,link_flair_text,thumbnail,name
movies, Who are the most versatile Actors of current generation?,"I think versatility (and range) can inform you so much about an actor and their ability to evoke characters of great complexity and distinction. Who do you think are some of the most versatile actors working today? who picks lot of interesting variety of characters and disappears into it.

Lets say till 80s born Actors not going older cuz those are popular names which we all talk about and knew very much, U can name someone underrated also   ",Upbeat-Sir-2288,1h3ldvi,https://reddit.com/r/movies/comments/1h3ldvi/who_are_the_most_versatile_actors_of_current/,https://www.reddit.com/r/movies/comments/1h3ldvi/who_are_the_most_versatile_actors_of_current/,2024-11-30 20:20:27,0,0.44,0,0,100,0,0,False,False,True,False,False,Discussion,self,t3_1h3ldvi
movies,"Mission: Impossible — The Final Reckoning Popcorn Buckets Are Personally Developed by Tom Cruise
",,Puzzled-Tap8042,1h3pczy,https://reddit.com/r/movies/comments/1h3pczy/mission_impossible_the_final_reckoning_popcorn/,https://www.yahoo.com/entertainment/just-found-tom-cruise-accepted-164305460.html,2024-11-30 23:26:33,0,0.38,0,0,37,0,0,False,False,False,False,False,News,https://a.thumbs.redditmedia.com/CySjyMn9hihHRh7McgVDml9OMPeX8aTEY3MSsQBMfn4.jpg,t3_1h3pczy
movies,Maleficent took over $750m worldwide. Why has Robert Stromberg never directed another theatrical feature?,"Was just rewatching Maleficent, and surprised to discover, despite its commercial success, Robert Stromberg has only directed TV stuff since. Can't think of another movie, taking in over three-quarters of a billion. whose director was one and done. 

You'd think its success would have merited further work. Does anyone know why not? I couldn't immediately find any recent interviews with him where it might be discussed. ",AZSnakepit1,1h23ocm,https://reddit.com/r/movies/comments/1h23ocm/maleficent_took_over_750m_worldwide_why_has/,https://www.reddit.com/r/movies/comments/1h23ocm/maleficent_took_over_750m_worldwide_why_has/,2024-11-28 19:25:41,1180,0.92,1180,0,100,0,0,False,False,True,False,False,Discussion,self,t3_1h23ocm
movies,A Different Take on The Notebook's Ending,"

Hi Everyone, 

I recently watched *The Notebook* and found myself grappling with some discomfort about the ending. So, I decided to write my own version, one that feels more poignant and bittersweet, yet complete. Here’s my version:

Instead of Noah reading the story, it would be Lon. In my version, Allie chooses Lon, but her life with him isn’t entirely fulfilling—at least, not in her heart. She keeps a diary where she writes about how things could have been if she had chosen Noah instead. Her imagined life, where she paints, with Noah becomes her escape, a parallel world where her heart resides.

Years later, as Allie begins to suffer from her illness, Lon finds the diary. Understanding how deeply she lived in her imagination, he decides to read her the diary—not as the story of their life, but as the life she dreamed of. Lon does this out of love, knowing it might bring her comfort and help her remember.

One day, as Lon reads, something shifts in Allie. She remembers her real life with Lon—their marriage, their children, and the life they built together. Overcome with guilt, she apologizes to him, admitting that while she always wanted to love him completely, part of her heart was always with Noah. Lon, being the loving and compassionate man he is, forgives her without hesitation.

Then, Allie asks Lon about Noah. Lon tells her that Noah built a successful life, never married, and now owns a large mill, but is gravely ill. Touched by her lingering feelings, Lon promises to take her to see Noah the next day.

But fate intervenes. The next morning, they hear that Noah passed away during the night. When Allie and Lon visit his home, she is overcome with memories of their time there. The weight of her emotions becomes too much, and she quietly passes away, never to wake again.",Chahes03,1h3laak,https://reddit.com/r/movies/comments/1h3laak/a_different_take_on_the_notebooks_ending/,https://www.reddit.com/r/movies/comments/1h3laak/a_different_take_on_the_notebooks_ending/,2024-11-30 20:16:01,0,0.15,0,0,0,0,0,False,False,True,False,True,Discussion,spoiler,t3_1h3laak
movies,A prequel to The Incredibles maybe?,"Was re-watching The Incredibles. Really wish they make a prequel to it with some interesting villains especially Bomb Voyage (found him really interesting)and also the superheroes who didn't have much screen time in the first movie. What are your thoughts? (Also, is a sequel to The Incredibles 2 in the works?)  ",usernamesRweird-here,1h3h15p,https://reddit.com/r/movies/comments/1h3h15p/a_prequel_to_the_incredibles_maybe/,https://www.reddit.com/r/movies/comments/1h3h15p/a_prequel_to_the_incredibles_maybe/,2024-11-30 17:03:39,0,0.44,0,0,24,0,0,False,False,True,False,False,Discussion,self,t3_1h3h15p
movies,Question about Flowers in the Attic 2014.,"Recently I watched the 2014 version of Flowers in the Attic, and I have a question about the grandma.

Why did she freak out when the kids lead her into the stairs going up to the attic? She freaks out even more when they turn the lights off. 

Does this mean she was almost blind the whole time, and without light she is totally blind?

Or 

We all know she is insane, I mean look what she did to her grandkids, but she has the key so it didn’t make sense she that believed she was stuck there. 

Or

Has she been locked up before? I’ve only seen the first movie and have never read the books so I’m not sure if this happened to her at one point before.",HeyWeasel101,1h31pwu,https://reddit.com/r/movies/comments/1h31pwu/question_about_flowers_in_the_attic_2014/,https://www.reddit.com/r/movies/comments/1h31pwu/question_about_flowers_in_the_attic_2014/,2024-11-30 01:50:55,3,0.64,3,0,2,0,0,False,False,True,False,False,Question,self,t3_1h31pwu
movies,Greatest comedy movies of all time,"If you were to create a Mount Rushmore of comedy movies, which movies would you put up there? However, if you do want to suggest more than 4 please do so as me and my gf are always looking for comedy movie recommendations. The only exception would be any horror comedies with jumpscares as she doesn’t like them. Thank you!",Responsible_Trust529,1h3hone,https://reddit.com/r/movies/comments/1h3hone/greatest_comedy_movies_of_all_time/,https://www.reddit.com/r/movies/comments/1h3hone/greatest_comedy_movies_of_all_time/,2024-11-30 17:32:31,0,0.45,0,0,142,0,0,False,False,True,False,False,Question,self,t3_1h3hone
movies,What were Flea and Paulie Shore talking about in Son in Law?,"Surely a few people have watched Son in Law this week, so help me out. 

In the tattoo parlour, the tattooist (Flea) has a brief convo with Crawl that has confused me for 30 years. 

Roughly:
RW: I want something feminine.
TF: He's standing right next to me.
C: You see what happens. The ink soaks into the system and the guy's freak out. What are you ya freak?
TF: It's a good point.

Can someone please tell me what on earth they both meant?",CosmoRomano,1h2jf57,https://reddit.com/r/movies/comments/1h2jf57/what_were_flea_and_paulie_shore_talking_about_in/,https://www.reddit.com/r/movies/comments/1h2jf57/what_were_flea_and_paulie_shore_talking_about_in/,2024-11-29 11:02:08,51,0.65,51,0,34,0,0,False,False,True,False,False,Discussion,self,t3_1h2jf57
movies,"With today’s appetite for legacy sequels and expanded universes, a Seth Gecko film would resonate with both longtime fans and a new generation eager to see Rodriguez revisit his gritty, blood-soaked roots.","It’s a real shame that Robert Rodriguez has mostly shifted to making kid-friendly movies lately. While Spy Kids and We Can Be Heroes are fun in their own way, they don’t really tap into the raw, edgy filmmaking talent that made Rodriguez stand out in the first place. He built his career on gritty, intense films like Desperado and From Dusk Till Dawn, which pushed boundaries and brought something fresh to action and horror. A movie about Seth Gecko would be the perfect chance for him to return to those roots, creating a film that’s dark, thrilling, and full of that unique Rodriguez style that made his earlier work so unforgettable. It’s also undoubtedly George Clooney’s best work and he’s become so boring lately—a return to the character would be amazing . 


Title it “Gecko”, and the story follows Seth, who has spent the last 30 years living a quiet, low-profile life in a small seaside town in Mexico. His peace is shattered when Kate Fuller—channeling a Sarah Connor-like intensity—shows up at his door. She reveals that she’s planning to attack the labyrinth beneath the Titty Twister, connecting it to a series of mysterious child disappearances across the country.",Muted-Field4072,1h3ir0l,https://reddit.com/r/movies/comments/1h3ir0l/with_todays_appetite_for_legacy_sequels_and/,https://www.reddit.com/r/movies/comments/1h3ir0l/with_todays_appetite_for_legacy_sequels_and/,2024-11-30 18:20:55,0,0.32,0,0,4,0,0,False,False,True,False,False,Discussion,self,t3_1h3ir0l
movies,"Predicting it right now, let me know what you Redditors think:","Best Adapted Screenplay: Wicked

Best Original Song: tie for either Moana 2 or Wicked — Wicked might win, first for Idina Menzel and crew.

Best Supporting Actress: Ariana Grande or Cynthia Erivo

Best Actress: Ariana Grande or Cynthia Erivo. 

Best Costume Design 

Best Makeup *but* could lose to Herta with Waltzing with Brando or The Substance. 

..and *nominated* Best Picture but might lose to something different, maybe Dune?",fadedmemento,1h3mos7,https://reddit.com/r/movies/comments/1h3mos7/predicting_it_right_now_let_me_know_what_you/,https://www.reddit.com/r/movies/comments/1h3mos7/predicting_it_right_now_let_me_know_what_you/,2024-11-30 21:20:41,0,0.24,0,0,33,0,0,False,False,True,False,False,Discussion,self,t3_1h3mos7
movies,Ready or not,"I have just finished watching Ready or not m Netflix. Overall I have really enjoyed it as it reminded a quite bit of Glass Onion.
The part of when one of the babysitters get killed, I didn’t like because I thought it seemed rather fake. 
And I really really hoped that Grace would give Alex a spa at the end for even daring to suggest they stay together. 
What did everyone else think of this film?
Also sorry for the spoilers, no idea how to do those. ",Snoopyorange,1h3issr,https://reddit.com/r/movies/comments/1h3issr/ready_or_not/,https://www.reddit.com/r/movies/comments/1h3issr/ready_or_not/,2024-11-30 18:23:16,0,0.17,0,0,6,0,0,False,False,True,False,False,Discussion,self,t3_1h3issr
movies,Why do people dislike Lars Von Trier?,"Ive just watched Antichrist and i loved the movie i really didn't think much about the meaning of it.
When i read some post on here i was surprised how many people actually dislike the movie, everyone had their own meaning for it and most of them were very surprising,either that or they love the movie,so im curious if there's something i dont know or notice that other people did,and if so what is it? ",Frequent_Midnight_96,1h3lo30,https://reddit.com/r/movies/comments/1h3lo30/why_do_people_dislike_lars_von_trier/,https://www.reddit.com/r/movies/comments/1h3lo30/why_do_people_dislike_lars_von_trier/,2024-11-30 20:33:29,0,0.38,0,0,50,0,0,False,False,True,False,False,Question,self,t3_1h3lo30
movies,Picture movie recommendations,"Hi, First let me paint what I like. I recently watched a movie named ""Memories of Murder""/""Nostalgia of Murder"". Going through its story telling through its fuking colours blew my mid, I'm new to these things and I like finding out how little details show/insinuate deeper meaning into movies. Nowadays this kind of picture story telling is scarce, can you guys/gals recommend some movies (Doesn't matter the genre or language). 

Thank you.",Esclipse,1h3dndq,https://reddit.com/r/movies/comments/1h3dndq/picture_movie_recommendations/,https://www.reddit.com/r/movies/comments/1h3dndq/picture_movie_recommendations/,2024-11-30 14:26:16,0,0.4,0,0,5,0,0,False,False,True,False,False,Recommendation,self,t3_1h3dndq
movies,My Fascination with Alfred Hitchcock and My Top 5 Hitchcock Films,"It was in the 1990s when I got my first VCR. I was beyond excited - just imagine, no more waiting for the cable guy to show you something good. Back then, there was no internet to help me figure out what to watch, so I headed to the local video store. I asked a friend who worked there that I wanted to watch an interesting mystery thriller and asked for suggestions. He told me to pick any Hitchcock movie - I couldnt go wrong. Thats when I was introduced to Alfred Hitchcock.

Since that day, Hitchcock has been one of my favorite directors. His mastery of suspense, mystery, and thriller genres is what makes him stand out. I think I’ve watched almost every Hitchcock film (at least the ones released after 1940), and each one has been a joy to revisit. Whats even more impressive is how well his movies have aged - something I can't say about a lot of films from that era. Hitchcock’s films have been remade and adapted countless times. Directors and writers still draw inspiration from his work. Even today!

Here’s a list of my top 5 Hitchcock films. If you haven’t seen them, I highly recommend you do. It wasn’t an easy task narrowing it down because I love so many of his films, but these are my absolute favs.

1. Psycho Psycho was the first Hitchcock movie I ever saw. It was the first movie I saw on my new VCR. I’m not exaggerating when I say I got goosebumps during the final reveal. I literally jumped out of my chair, wondering what just happened. A fun fact: Psycho was the first movie ever made in the US to show a toilet flushing. Yep, you read that right - something as simple as a toilet became a big deal back then.
2. Rebecca I’ve always loved the book by Daphne du Maurier, so when I heard Hitchcock adapted it into a film, I was both excited and a little skeptical. Typically, I’m not a fan of book-to-movie adaptations, but Hitchcock did an amazing job. The movie brings the eerie atmosphere of the novel to life, with strong performances and a perfect blend of tension and mystery. Highly recommend it.
3. Rear Window Rear Window is an absolute masterpiece. Stewart and Kelly lead a stellar cast in this film, where Stewart plays a man stuck in a wheelchair, spying on his neighbors through the rear window. What he sees gets him tangled up in something far more sinister than he bargained for. The suspense is built slowly but steadily. What unfolds after is such a treat to watch. It’s been adapted and remade several times, with one of the most famous being Disturbia - not a bad film in itself but the original is much much better.
4. Strangers on a Train This one really kept me guessing. The premise was intriguing - two men meet on a train, and one proposes a strange idea: if they each commit a murder for the other, they’ll be in the clear. It’s one of those thrillers that makes you sit on the edge of your seat, wondering how it’ll all unfold. The film does a great job of playing with psychological tension and moral dilemmas.
5. Dial M for Murder I saw Dial M for Murder a little later in my Hitchcock journey. Actually, I watched The Perfect Murder, a remake starring Michael Douglas, before I saw this. While I thought the remake had a decent plot, it didn’t quite measure up. Then, I read somewhere that it was copied from a Hitchcock movie - Dial M for Murder. I saw it and absolutely loved it. The plot was similar with some differences, but the execution was so much better. It was a fun, thrilling watch that had me hooked from start to finish.

It would be remiss of me not to mention some of my other favorite Hitchcock films, like Birds, Rope, Notorious, Spellbound, Vertigo, and North by Northwest. These could easily make a top-five list on another day.

If you haven’t seen his work and like watching movies, I suggest you watch his work. You won’t regret it.

https://preview.redd.it/ig64435udz3e1.jpg?width=1170&amp;format=pjpg&amp;auto=webp&amp;s=d96e3d48d789f66746fef3ad681b4a11a975a669

",Akki_Mukri_Keswani,1h36aea,https://reddit.com/r/movies/comments/1h36aea/my_fascination_with_alfred_hitchcock_and_my_top_5/,https://www.reddit.com/r/movies/comments/1h36aea/my_fascination_with_alfred_hitchcock_and_my_top_5/,2024-11-30 06:14:01,0,0.47,0,0,13,0,0,False,False,True,False,False,Discussion,https://b.thumbs.redditmedia.com/QrRjgU0Y79ia_GnRWRUPdldUCKBlzAALgJoGn8Clh3s.jpg,t3_1h36aea
movies,"First Poster for Comedy 'Operation Taco Gary's' - Starring Simon Rex, Dustin Milligan, Brenda Song, Jason Biggs, and Doug Jones - Two brothers embark on a cross country road trip that quickly devolves when they become involved in a global conspiracy.",,BunyipPouch,1h20ob8,https://reddit.com/r/movies/comments/1h20ob8/first_poster_for_comedy_operation_taco_garys/,https://i.redd.it/k0i85zh4do3e1.png,2024-11-28 17:11:15,797,0.86,797,0,158,0,0,False,False,False,False,False,Poster,https://b.thumbs.redditmedia.com/ggSqaPddnQJaN0A8k2Lite77oWjebnGfpobVImfjDJE.jpg,t3_1h20ob8
movies,Could be the silent scream of the Godfather one of the best scenes in film history? ,"I barely can remember what was my reaction to this scene when I watched for first time. I really enjoyed the film at that time but didn’t give special attention to it.

Now with 40 and a 3 years old daughter I realized the greatness of this scene, and how it could be unnoticed or even perceived as ridiculous for some part of the audience. But for some of us this is possible one of the greatest scenes in film history ",DrPopitas,1h3jfq5,https://reddit.com/r/movies/comments/1h3jfq5/could_be_the_silent_scream_of_the_godfather_one/,https://www.reddit.com/r/movies/comments/1h3jfq5/could_be_the_silent_scream_of_the_godfather_one/,2024-11-30 18:51:58,0,0.28,0,0,3,0,0,False,False,True,False,False,Discussion,self,t3_1h3jfq5
movies,Worst spoiling movies DVD/BR covers ?,"Hello everyone, I just got Deadpool and Wolverine steelbook édition, and so much is spoiled with the steelbook case or the paper slipcase....
(Spoilers for Deadpool and Wolverine of course, don't read further if you want to avoid it) :
- Wolverine with his Mask,
- Dogpool,
- Cassandra Nova
- All the Deadpools
-All the Wolverine variant (inside the case), except for the one not played by Jackman.
I already saw the movie so I'm safe, but I was wondering what covers are the most spoiling ? (Maybe use the spoilers tags in your answers 😅).

And for the record, another one that I saw and was also one of the worst : the DVD cover for ""La soupe aux choux"" (old french De Funès cheesy movie) described all the movie, ending included, in the short summary behind !!
",ChrisCool99,1h3e4pu,https://reddit.com/r/movies/comments/1h3e4pu/worst_spoiling_movies_dvdbr_covers/,https://www.reddit.com/r/movies/comments/1h3e4pu/worst_spoiling_movies_dvdbr_covers/,2024-11-30 14:50:04,0,0.42,0,0,28,0,0,False,False,True,False,False,Spoilers,self,t3_1h3e4pu
movies,Comic strips into movies,"I’ve just started reading Doonesbury from the beginning. In all the years I’ve been reading comic strips I never got into Doonesbury so it’s a totally new experience for me. As I’m reading it I thought to myself more than once that it’s would have translated to film pretty well. 

So I started thinking about all the comic strips I’ve been reading over the years and how few of them have actually become film projects. 

Does anyone know why we haven’t had a few more comic strips turned into movies?

I know Bill Watterson has always been against the commercializations of Calvin and Hobbes but that’s the only one I’ve kind of heard about. 

Also a special shout out to Dick Tracy which was a comic strip turned into a movie and should receive a little more love around here because I don’t see it mentioned around here ever ",drjudgedredd1,1h2unqa,https://reddit.com/r/movies/comments/1h2unqa/comic_strips_into_movies/,https://www.reddit.com/r/movies/comments/1h2unqa/comic_strips_into_movies/,2024-11-29 20:11:27,5,0.63,5,0,33,0,0,False,False,True,False,False,Discussion,self,t3_1h2unqa
movies,Sisters (1972),"The film is directed by Brian De Palma and is about Danielle Breton (Margot Kidder) who is a French Canadian model and aspiring actress that was separated by her conjoined twin Dominique also played by Kidder. A ad salesman Philip Woode (Lisle Wilson) wins a dinner for two on this tv show and Danielle meets him and they start to date. Everything goes wrong the next day as Danielle says to Philip it’s her and her twin sister Dominique’s birthday so he goes out to pick up Danielle’s meds and also a cake, when he gets back to the apartment he is stabbed to death by Dominique. This catches the eye of Grace Collier (Jennifer Salt) who is a reporter that lives in the building next door that saw Phillip getting stabbed. She calls the police and the detective doesn’t believe her and things start to get suspenseful. I really liked the film and I liked how De Palma paid homage to Hitchcock’s style of filmmaking.",Mikeyboy101591,1h2t7x0,https://reddit.com/r/movies/comments/1h2t7x0/sisters_1972/,https://www.reddit.com/r/movies/comments/1h2t7x0/sisters_1972/,2024-11-29 19:07:23,6,0.67,6,0,1,0,0,False,False,True,False,False,Review,self,t3_1h2t7x0
movies,Sunray: Fallen Soldier | Official Trailer,,Bennett1984,1h3eeeb,https://reddit.com/r/movies/comments/1h3eeeb/sunray_fallen_soldier_official_trailer/,https://www.youtube.com/watch?v=o5Tsb2jUIdo,2024-11-30 15:03:08,0,0.41,0,0,6,0,0,False,False,False,False,False,Trailer,https://a.thumbs.redditmedia.com/5jJoAYiqnhR0igq8XrAA_h15-TWjc2MTWjQd4NLIuO8.jpg,t3_1h3eeeb
movies,What's this sub's opinion on Rambo number 4? And Rambo in general.,"In january of 2025, Rambo 4 will be released in germany after being banned in 2008. To celebrate and profit on that, the distributor chose to release the movie with a special edition, that includes the theatrical cut, the extended cut, special features and 44 booklet pages of information about the creation of the movie. 

So I wanted to know from you: how is this sub's opinion on Rambo 4? And would you say Rambo 1-3 are worth it? Do I need them to understand Rambo 4 or the Rambo character in general? 

What gets me interested in Rambo 4 is: Stallone wrote, directed and lead it. It's a project full of his passion. 

Edit: so many helpful answers and interesting discussions have spawned here over the past hours. Thank you to all of you!",Phyliinx,1h2bygb,https://reddit.com/r/movies/comments/1h2bygb/whats_this_subs_opinion_on_rambo_number_4_and/,https://www.reddit.com/r/movies/comments/1h2bygb/whats_this_subs_opinion_on_rambo_number_4_and/,2024-11-29 02:46:06,110,0.73,110,0,231,0,0,False,False,True,False,False,Discussion,self,t3_1h2bygb
movies,"If you could only ever recommend one film for the rest of your life, what would it be?","I'm looking to make a must-watch list that's not just all the standard ""classics"". I'd love to see what people's all time personal favorites are, especially if they are not the usual ""top 100 films of all time"" type lists. If you could only recommend one film to folks ever again, I feel like it would be more interesting to recommend a personal best that's not obvious! All genres welcome, I'm trying to branch out!",SingSongSalamander,1h22vbb,https://reddit.com/r/movies/comments/1h22vbb/if_you_could_only_ever_recommend_one_film_for_the/,https://www.reddit.com/r/movies/comments/1h22vbb/if_you_could_only_ever_recommend_one_film_for_the/,2024-11-28 18:49:05,397,0.87,397,0,1562,0,0,False,False,True,False,False,Discussion,self,t3_1h22vbb
movies,Best movies made from TV shows? ,"For example, The Simpson’s Movie from 
The Simpsons, or El Camino from
Breaking Bad. 

They’re my two personal favourites. While
El Camino was somewhat of a step down from Breaking Bad, it was still a pretty amazing movie, and could’ve been pretty successful as a stand-alone movie, the plot definitely would’ve worked. Was also just a beautiful conclusion to Jesse’s story. 

The Simpson’s Movie was probably my second favourite. The Simpsons is probably one of my favourite TV shows of all time, and my favourite cartoon/animation by far. The movie wasn’t much of a step down from the series and episodes themselves. It was just as funny as most episodes are, but had a lot more emotions in it. I also much preferred the animation style it had than what the series turned into a couple years later. ",Silly_Wrongdoer3709,1h29wuf,https://reddit.com/r/movies/comments/1h29wuf/best_movies_made_from_tv_shows/,https://www.reddit.com/r/movies/comments/1h29wuf/best_movies_made_from_tv_shows/,2024-11-29 00:47:22,108,0.81,108,0,255,0,0,False,False,True,False,False,Discussion,self,t3_1h29wuf
