subreddit,title,selftext,author,id,permalink,url,created_utc,score,upvote_ratio,ups,downs,num_comments,total_awards_received,gilded,is_video,is_original_content,is_self,over_18,spoiler,link_flair_text,thumbnail,name
movies,Sharon Stone Talks Difference Between Martin Scorsese and Sam Raimi,,Britneyfan123,1h4y6hc,https://reddit.com/r/movies/comments/1h4y6hc/sharon_stone_talks_difference_between_martin/,https://www.indiewire.com/news/general-news/sharon-stone-difference-between-martin-scorsese-sam-raimi-1235071290/,2024-12-02 15:57:10,1,1.0,1,0,0,0,0,False,False,False,False,False,Article,https://a.thumbs.redditmedia.com/AEQauoKke4wbJEs8F940fuJ07KCwc5PO7yxaU7u5_L4.jpg,t3_1h4y6hc
movies,I don't know how many of you are into gaming but what do you think if you are aware of the Fallout franchise?,,Ghost-Writer-1996,1h4xz5z,https://reddit.com/r/movies/comments/1h4xz5z/i_dont_know_how_many_of_you_are_into_gaming_but/,https://thethumbwars.com/fallout-season-two-new-vegas-ella-purnell/,2024-12-02 15:48:28,0,0.04,0,0,4,0,0,False,False,False,False,False,Discussion,https://b.thumbs.redditmedia.com/lSmk22hAimQxz02IumpDMdoksy9aGrzf1kC4TFgmQoA.jpg,t3_1h4xz5z
movies,"Tim Burton Rules Out ‘Edward Scissorhands,’ ‘Nightmare Before Christmas’ Sequels: ""Certain things are best left on their own""",,Gato1980,1h4xz5d,https://reddit.com/r/movies/comments/1h4xz5d/tim_burton_rules_out_edward_scissorhands/,https://www.indiewire.com/features/interviews/tim-burton-another-johnny-depp-collaboration-1235071255/,2024-12-02 15:48:27,9,0.91,9,0,1,0,0,False,False,False,False,False,Article,https://b.thumbs.redditmedia.com/HqLLw38f8SgFVPWbv_Vn4k9t8Hx6ZJDBUTQmJ1jHuto.jpg,t3_1h4xz5d
movies,Wicked’s Production Designer on Building Real Sets &amp; Using Practical Effects (From Interstellar’s Cornfields to 9 Million Tulips Planted for Munchkinland) ,I hope this earns him the Oscar for Production Design! Really interesting breakdown of the sets his team built! ,Brucewayne1818,1h4xxtj,https://reddit.com/r/movies/comments/1h4xxtj/wickeds_production_designer_on_building_real_sets/,https://youtu.be/4Qp4tLTrX6A?si=o3sg9EpfNAFSadt0,2024-12-02 15:46:49,0,0.5,0,0,1,0,0,False,False,False,False,False,Media,https://b.thumbs.redditmedia.com/grNnpd5DI0wDX82dQfzKa78VavFjVGDG8aViZFVZRQs.jpg,t3_1h4xxtj
movies,Who is your favorite movie villain where the actor was a delight and lovely human being in real life?,"My gold standard is Louise Fletcher as Nurse Ratched (and for the trekkies here, as Kai Winn in Deep Space Nine... another ""God I hate that character"" role). 

In real life, I heard nothing but praise about how kind and pleasant and unbothered she was before she sadly passed away.

Another candidate is Alan Rickman who is my favorite Christmas villain (Die Hard and Love Actually) who was loved by nearly everyone who knew him.
",TravellingBeard,1h4xxa3,https://reddit.com/r/movies/comments/1h4xxa3/who_is_your_favorite_movie_villain_where_the/,https://www.reddit.com/r/movies/comments/1h4xxa3/who_is_your_favorite_movie_villain_where_the/,2024-12-02 15:46:10,3,0.71,3,0,4,0,0,False,False,True,False,False,Discussion,self,t3_1h4xxa3
movies,'Moana' is the most streamed movie of the last 5 years with more than 44 billion minutes of stream time,,TerryBouchon,1h4xny7,https://reddit.com/r/movies/comments/1h4xny7/moana_is_the_most_streamed_movie_of_the_last_5/,https://streamingmoviesright.com/news/moana-most-streamed-movie-of-the-last-5-years-across-all-platforms/,2024-12-02 15:34:52,130,0.92,130,0,25,0,0,False,False,False,False,False,News,https://b.thumbs.redditmedia.com/B0gXfq5PbrvNri8XWmk3iXs1yJatU7iQ4co7msYOjyc.jpg,t3_1h4xny7
movies,Christmas Vacation is 35! Where’s the Tylenol?,,johntentaquake,1h4xlq1,https://reddit.com/r/movies/comments/1h4xlq1/christmas_vacation_is_35_wheres_the_tylenol/,https://www.pastemagazine.com/movies/christmas-vacation/christmas-vacation-is-30-wheres-the-tylenol,2024-12-02 15:32:12,12,0.69,12,0,15,0,0,False,False,False,False,False,Article,https://b.thumbs.redditmedia.com/x3eUMPNWQchVxcjkDH8mGUf04pJpGXPRTaVHEVDGLiw.jpg,t3_1h4xlq1
movies,"Non-american parody movies
","Hi, have you guys seen any good parody movies that aren't from mainstream Hollywood? My student group would like to have special screenings in our local theater for ten evenings and we are running low on options. We got mostly american ones, but we are looking for some parodies that are not so famous/commonly known.",Myslivir,1h4x8gq,https://reddit.com/r/movies/comments/1h4x8gq/nonamerican_parody_movies/,https://www.reddit.com/r/movies/comments/1h4x8gq/nonamerican_parody_movies/,2024-12-02 15:16:12,12,0.75,12,0,46,0,0,False,False,True,False,False,Discussion,self,t3_1h4x8gq
movies,Seeking animated movie recommendations. ,"I'm sick, and while sick I love me some animated movies. 

I am hoping some of you fine folks can't point me in the direction of some ones I might have missed. 

I've gone through the lists of Pixar, Disney and DreamWorks. Now I'm looking at ones I might have missed outside of their umbrella. 

Anime is welcome too, I just prefer something easier on the brain and eyes while I'm sick. Akira would be a little too much for me right now while Spirited away would be fine. 

Thank you for taking the time to send some suggestions my way. ",Nobanob,1h4x5df,https://reddit.com/r/movies/comments/1h4x5df/seeking_animated_movie_recommendations/,https://www.reddit.com/r/movies/comments/1h4x5df/seeking_animated_movie_recommendations/,2024-12-02 15:12:31,3,0.64,3,0,64,0,0,False,False,True,False,False,Recommendation,self,t3_1h4x5df
movies,From Roger Moore With Love (2024) | Official Trailer,,Bennett1984,1h4w7lg,https://reddit.com/r/movies/comments/1h4w7lg/from_roger_moore_with_love_2024_official_trailer/,https://www.youtube.com/watch?v=KPJ33hx7DAI,2024-12-02 14:30:11,83,0.93,83,0,32,0,0,False,False,False,False,False,Trailer,https://b.thumbs.redditmedia.com/exBkCYaLRp6jvis4gsTZLHn4uNrpS9s2zamKiLAeS3c.jpg,t3_1h4w7lg
movies,Mohammad Rasoulof Talks Making ‘The Seed of the Sacred Fig’ in Secret,,CosmosBazaar,1h4w4bt,https://reddit.com/r/movies/comments/1h4w4bt/mohammad_rasoulof_talks_making_the_seed_of_the/,https://www.indiewire.com/news/general-news/mohammad-rasoulof-making-the-seed-of-the-sacred-fig-secret-1235071057/,2024-12-02 14:25:59,22,0.9,22,0,0,0,0,False,False,False,False,False,Article,https://a.thumbs.redditmedia.com/zYjzEAih3C2yMT4OD7uRD8QNxEgPHwCdsCk0sXGE7y0.jpg,t3_1h4w4bt
movies,Director Luca Guadagnino and screenwriter Justin Kuritzkes Break Down the Ending of 'Queer',,indiewire,1h4w1pz,https://reddit.com/r/movies/comments/1h4w1pz/director_luca_guadagnino_and_screenwriter_justin/,https://www.indiewire.com/features/interviews/queer-ending-explained-how-william-s-burroughs-killed-his-wife-1235071287/?utm_campaign=trueanthem&amp;utm_medium=social&amp;utm_source=twitter,2024-12-02 14:22:32,0,0.17,0,0,0,0,0,False,False,False,False,True,Discussion,spoiler,t3_1h4w1pz
movies,KRAVEN THE HUNTER - Opening 8 Minutes,,Comic_Book_Reader,1h4vx3w,https://reddit.com/r/movies/comments/1h4vx3w/kraven_the_hunter_opening_8_minutes/,https://youtu.be/i-nAetWvYa8?si=LiCl0Mu_u1MOitRB,2024-12-02 14:16:22,0,0.43,0,0,26,0,0,False,False,False,False,False,Media,https://b.thumbs.redditmedia.com/n-4cPntrpAI6iyU-X3y1JobAjLBc489T8L7ESMhB8Ps.jpg,t3_1h4vx3w
movies,Dune and Dune part two,"I finally came to watch both movies and they're audio-visually masterclass. The sound mixing of the first was a bit too much Nolan but still good. What I didn't like was that for some reason only stars where casted that are the ""hot stuff"" right now and not for talent. I really liked the performances of Chalamet, Ferguson and Skarsgard but Zendaya, Bautista and even Brolin were run-of-the-mine. Imo much potential was lost in the casting and other actors would have been better.",tmoe1991,1h4vwgx,https://reddit.com/r/movies/comments/1h4vwgx/dune_and_dune_part_two/,https://www.reddit.com/r/movies/comments/1h4vwgx/dune_and_dune_part_two/,2024-12-02 14:15:31,0,0.28,0,0,17,0,0,False,False,True,False,False,Discussion,self,t3_1h4vwgx
movies,Help,"I'm looking for a movie that I mostly remember the main points of, but I can't seem to figure it out.

The main character and a female character become intertwined after the bad guy proceeds to seemingly target him directly. After a lot of running and fleeing and trying to fins the bad guy, the main character comes to the realization that both the female and the bad guy are actually him and he has been planting the bombs and such.",Ok_Caterpillar3655,1h4vv9u,https://reddit.com/r/movies/comments/1h4vv9u/help/,https://www.reddit.com/r/movies/comments/1h4vv9u/help/,2024-12-02 14:13:50,0,0.44,0,0,8,0,0,False,False,True,False,True,Question,spoiler,t3_1h4vv9u
movies,the mom's initial response to cujo is very puzzling.,"in cujo, the trentons arrive at the camber house to have their car repaired. eventually, cujo shows up. the mom, seeing cujo coming, instantly picks up her child.

now, i find this reaction very puzzling. keep in mind that this is before cujo's rampage. at this point, no one knows about the rabies and cujo is still very much a normal dog. 

this is made stranger to me since saint bernards are notorious for being among the most gentle dog breeds. they are often considered to be the best example of a gentle giant in the dog world. and they are noted to especially good with children. 

you may be inclined to say that she just saw a rather large dog and feared the worst. fair enough. however, after the son assures her that cujo won't hurt her son and that he likes kids, she is still looking at cujo with fear on her face. even trent's father and her own husband assures her that everything is alright but she's still worried. ",herequeerandgreat,1h4v8o4,https://reddit.com/r/movies/comments/1h4v8o4/the_moms_initial_response_to_cujo_is_very_puzzling/,https://www.reddit.com/r/movies/comments/1h4v8o4/the_moms_initial_response_to_cujo_is_very_puzzling/,2024-12-02 13:43:14,0,0.14,0,0,14,0,0,False,False,True,False,False,Discussion,self,t3_1h4v8o4
movies,I’m bored,"I’m looking for movie recommendations — preferably something not too popular. I’d love to explore films from your country as a way to learn more about its culture and stories. If the movie you recommend is interesting enough, please provide a brief description about it, including what makes it special or unique. The movie that gets recommended twice is the one I’ll watch tonight, so make your suggestion count!",vampjana,1h4uvqc,https://reddit.com/r/movies/comments/1h4uvqc/im_bored/,https://www.reddit.com/r/movies/comments/1h4uvqc/im_bored/,2024-12-02 13:24:55,0,0.31,0,0,9,0,0,False,False,True,False,False,Recommendation,self,t3_1h4uvqc
movies,Harmful stereotypes or misconceptions often reinforced by movies,"I'll start: couples counseling / therapy. In comedies especially, the therapist is almost always either A) secretly seeking to break up the couple, B) in love with one of the clients, C) hired by one of the clients to make the other one look bad or some combination of these. I feel that this type portrayal has caused a lot of folks to have a negative attitude towards couples counseling or therapy.    ",Teenage_dirtnap,1h4ul1s,https://reddit.com/r/movies/comments/1h4ul1s/harmful_stereotypes_or_misconceptions_often/,https://www.reddit.com/r/movies/comments/1h4ul1s/harmful_stereotypes_or_misconceptions_often/,2024-12-02 13:09:02,0,0.46,0,0,79,0,0,False,False,True,False,False,Discussion,self,t3_1h4ul1s
movies,What are your favourite bits of “My Little Secret” Lindsay Lohan ,"My favourite bits are when everyone pretends Logan's coloured-in drawings of a swimming pool and trees is a brilliant business plan and when they couldn't be bothered to pay for a wedding scene so did a 10 second animation. I also liked it when Erica, the mum, explained secret Santa like it was their own family tradition that no-one else had ever heard of",Sure_Acanthaceae_277,1h4tjci,https://reddit.com/r/movies/comments/1h4tjci/what_are_your_favourite_bits_of_my_little_secret/,https://www.reddit.com/r/movies/comments/1h4tjci/what_are_your_favourite_bits_of_my_little_secret/,2024-12-02 12:09:43,0,0.38,0,0,3,0,0,False,False,True,False,False,Discussion,self,t3_1h4tjci
movies,What do you think of the women characters in John McTiernan's films?,"Hi everyone,

John McTiernan is one of the legends of action cinema, known for iconic movies like *Die Hard*, *Predator*, and *Last action Hero*. His movies are packed with high-stakes tension, larger-than-life heroes, and explosive action, but what about the women in these stories? I’d love to hear your thoughts on how they’re portrayed!

Here are a few women in his films that stand out to me:

* **Holly Gennaro McClane (*****Die Hard*****)**: She’s a career-driven, no-nonsense woman who also happens to be at the heart of John McClane’s emotional journey. Her strength comes across in the way she handles Hans Gruber and leads the hostages, but do you think she’s given enough agency beyond being someone for John to save?
* **Anna (*****Predator*****)**: At first, Anna seems like a typical prisoner-of-war character, but she becomes a key figure in unraveling the Predator’s backstory. She provides a voice for her people and their legends. Does her role feel substantial, or does it fall into the trope of the ""exotic other""?
* **Virginia Baker (*****The Thomas Crown Affair*****)**: Rene Russo’s character is sharp, confident, and undeniably one of McTiernan’s most complex women. She’s Thomas Crown’s equal, which is rare in movies like this. Does she break the mold of how women are portrayed in action/thrillers?
* **Whitney and Irene (*****Last Action Hero*****)**: This movie pokes fun at action clichés, and it’s fun to see the ""screaming damsel"" and ""grounded working-class mom"" tropes being played for laughs. What do you think McTiernan was trying to say about female characters in action films here?

I know McTiernan’s films are heavily focused on their male leads, but I’m curious—do you think the women in his movies hold their own? Which characters stand out to you, and which feel underdeveloped?

Would love to hear your thoughts and insights! 😊",Fennel_Zealousideal,1h4th9d,https://reddit.com/r/movies/comments/1h4th9d/what_do_you_think_of_the_women_characters_in_john/,https://www.reddit.com/r/movies/comments/1h4th9d/what_do_you_think_of_the_women_characters_in_john/,2024-12-02 12:06:22,0,0.44,0,0,15,0,0,False,False,True,False,False,Discussion,self,t3_1h4th9d
movies,Was Sebastian a RedFlag and an asshole in LaLaLand?,"Recently, I had just seen a tiktok about a guy stating that LaLaLand doesn't have the emotional gut wrench it went for because he just wanted to see Mia break up with Seb because of the way Seb mistreats her. He lists several reasons such as him being an asshole to her at the start of the movie during traffic and at the bar. After he explains, how Seb still pursued the girl despite her having a relationship. He also states how Seb is very self centered and insecure. If you want to get more context, it's Reel Takes on tiktok. However, the comments all seem to agree with the guy, but I just wanted everyone's opinion on it.",Kaizen1-0721,1h4ss10,https://reddit.com/r/movies/comments/1h4ss10/was_sebastian_a_redflag_and_an_asshole_in_lalaland/,https://www.reddit.com/r/movies/comments/1h4ss10/was_sebastian_a_redflag_and_an_asshole_in_lalaland/,2024-12-02 11:22:04,0,0.22,0,0,5,0,0,False,False,True,False,False,Discussion,self,t3_1h4ss10
movies,What are the movies in your watchlist that you still haven’t watched?,"We all have that never-ending watchlist filled with movies we keep adding but never actually watch. Whether it’s because of lack of time, the right mood, or just forgetting about them, some movies just sit there forever.

What’s been sitting in your watchlist for ages, and why haven’t you watched it yet? Let’s share and maybe motivate each other to finally hit play!

",iakgk,1h4snrx,https://reddit.com/r/movies/comments/1h4snrx/what_are_the_movies_in_your_watchlist_that_you/,https://www.reddit.com/r/movies/comments/1h4snrx/what_are_the_movies_in_your_watchlist_that_you/,2024-12-02 11:13:58,25,0.74,25,0,112,0,0,False,False,True,False,False,Question,self,t3_1h4snrx
movies,"""Pleasantville"" was unexpected. What started out as a seemingly conventional comedy became a social commentary about conventional vs modernism","Tobey Maguire's character yearning for the conventional world of the B&amp;W traditionl family values, he comes off as a Ben Shapiro-type without the bigotry, yet when he enters the world, he realizes his vision of the cookie cutter dimension isn't what he assumed to be. 

Oddly enough, the bigger transformation happens with his vapid sister, played by Reese Witherspoon, who manages to have the biggest growth in the story as she realizes she has goals she wishes to accomplish and ends up embracing the B&amp;W universe she previously rejected. 

Joan Allen is fantastic, though. The scene of her character discovering what an orgasm is and how it ends up changing her skin color? Superb directing.",Peter_Omun,1h4rynx,https://reddit.com/r/movies/comments/1h4rynx/pleasantville_was_unexpected_what_started_out_as/,https://www.reddit.com/r/movies/comments/1h4rynx/pleasantville_was_unexpected_what_started_out_as/,2024-12-02 10:24:35,141,0.88,141,0,27,0,0,False,False,True,False,False,Discussion,self,t3_1h4rynx
movies,Christmas (and adjacent) Movie Recs,"Instead of a classic advent calendar I wanna watch one Xmas movie or special a day in the lead up to Christmas. 

I might do a ranking of what I watch if people are interested 🤣

I started with Muppets Christmas Carol yesterday, and instead of just doing all my old favourites I thought I’d reach out and see what the people recommend! ",SmilesRawesome,1h4q4tx,https://reddit.com/r/movies/comments/1h4q4tx/christmas_and_adjacent_movie_recs/,https://www.reddit.com/r/movies/comments/1h4q4tx/christmas_and_adjacent_movie_recs/,2024-12-02 08:05:30,2,0.6,2,0,7,0,0,False,False,True,False,False,Recommendation,self,t3_1h4q4tx
movies,Where is the Polar Express' (release date 2004) North Pole based on?,"Hey guys. I've been to both germany and the Czech Republic and they both reminded me of the North Pole from the Polar Express.... Though I am wondering if there was a legitimate answer for where their North Pole was based on, or if anyone else has any better ideas than me on where it could have derived structural inspiration from.",Popular-Parsley-6197,1h4py1f,https://reddit.com/r/movies/comments/1h4py1f/where_is_the_polar_express_release_date_2004/,https://www.reddit.com/r/movies/comments/1h4py1f/where_is_the_polar_express_release_date_2004/,2024-12-02 07:51:34,0,0.31,0,0,6,0,0,False,False,True,False,False,Discussion,self,t3_1h4py1f
movies,Nutcrackers,"I don't understand the hate for this movie. I see it as a hallmark christmas movie without 10,000lbs of shitty, cheap ornaments sprayed everywhere. It feels like older, indie movie, David Gordon Green. Ben Stiller perfectly matches the energy of the 4 kids who were the impetus for the whole project. If you were someone who was turned off by it I want to know what you were expecting going in.",Kikuchiy0,1h4nmk4,https://reddit.com/r/movies/comments/1h4nmk4/nutcrackers/,https://www.reddit.com/r/movies/comments/1h4nmk4/nutcrackers/,2024-12-02 05:17:55,0,0.42,0,0,2,0,0,False,False,True,False,True,Discussion,spoiler,t3_1h4nmk4
movies,Most Fitting Movie for Each Month,"Haven’t seen a post like this, so I figured I’d make one.

What are the most fitting movies for each of the 12 months of the year? Which movies best fit the vibes and aesthetics of each month? Thought this might be an interesting discussion.

January: Something grim and desolate like Fargo would fit pretty good, wintery and cold and all

February: Equally as cold and miserable, but with the added benefit of Valentines Day. Some sort of romance movie with a wintery theme would fit here, especially if set on Valentines Day. Groundhog Day is also a strong contender.

March-April: No specific ideas, these blend together for me. Movies about spring would fit for all of both.

May: Still springtime, but also end-of-school and graduation, so any moviess about graduating or school letting out would fit.

June-Aug: These blend together for me. Plenty of summer movies, but not necessarily specific to a month. I will say, August also has back to school as a potential setting or theme, and I personally associate that month with dreary, overbearing heat and fatigue, the kind of visuals heavily present in the film Falling Down

September: School is fully back in swing, and I would lean towards placing a High School movie or something here.

October: There’s plenty of Halloween movies, but it would have to be one that celebrates fall and the month of October more so than just being scary. The miniseries Over the Garden Wall Would Fit, not sure of other examples 

November: Planes, Trains and Automobiles would be the easy choice for Thanksgiving, but I do wonder if there are any other films that would fire better.

December: There’s a litany of holiday movies of course, but out of all of them there’s have to be one that embodies the month as a whole and not just Christmas time. A plot incorporating the advent season might work, like Christmas Vacation, or a film that incorporates New Years.

I’m struggling with examples here, so I’d be excited to hear what others think",Bonobowl,1h4nfj0,https://reddit.com/r/movies/comments/1h4nfj0/most_fitting_movie_for_each_month/,https://www.reddit.com/r/movies/comments/1h4nfj0/most_fitting_movie_for_each_month/,2024-12-02 05:05:55,0,0.5,0,0,4,0,0,False,False,True,False,False,Discussion,self,t3_1h4nfj0
movies,3 Body Problem Problem Spoiler Warning,"Ok, so 3 body problem is a hella fun ride. Interesting story. 

The over all jist is that an alien species is traveling here in hopes of having a new home. They are vastly older than us an unimaginably more advanced. Thing is we develop way faster than they do. What took them eons to achieve took us generations. By the time they arrive we will have outpaced them.

It's a fun idea. 

My problem is at one point the species decides to show their power and prove to the world they are real. They do this by turning off the lights. Sun, stars, all poof. No light for humanity.   
  
So why not turn the lights off for a couple years and call it good when they get here? Plantlife would be gone, animals dependent on it, us included would be gone. Most species would not last years in darkness. 

They'd arrive to a thriving ecosystem ripe to be rebuilt as they choose. Not an exciting conclusion to a story but a checkmate for invading another species planet.

$0.02",desepchun,1h4nbt2,https://reddit.com/r/movies/comments/1h4nbt2/3_body_problem_problem_spoiler_warning/,https://www.reddit.com/r/movies/comments/1h4nbt2/3_body_problem_problem_spoiler_warning/,2024-12-02 05:00:25,0,0.17,0,0,9,0,0,False,False,True,False,True,Spoilers,spoiler,t3_1h4nbt2
movies,Do you know any movies entirely made/filmed/edited by 1 person?,"Edit: Inside by Bo Burnham works perfectly, thanks y'all. I argue with my friend for like 3h and I won because of you all. You are the heros of my night \^\^  
  
My friend demands a proof to admit that a movie can be made alone and successful. It needs to have made at least like 1 dollars of profit over the money taken to produce it (equipment aquired by other means than buying/already owned doesn't count) and it needs to have been officially critique by some official cinema sources (cause he thinks that a movie isn't successful if it isn't criticised officially for some reason). It can have been published on youtube or anything but needs to be at least an hour long, tho if it's not 1 hour long pls tell me anyways. Thanks, ask me if I forgot some important details to explain.

Edit: He also needs to be the sole actor in the movie (animals count as actor but sounds out cam are fine)",Dense_Ad_44,1h4n7uk,https://reddit.com/r/movies/comments/1h4n7uk/do_you_know_any_movies_entirely_madefilmededited/,https://www.reddit.com/r/movies/comments/1h4n7uk/do_you_know_any_movies_entirely_madefilmededited/,2024-12-02 04:54:00,12,0.61,12,0,61,0,0,False,False,True,False,False,Discussion,self,t3_1h4n7uk
movies,Actors Battle: Leonardo DiCaprio vs his male costars: Part 1 The Man In The Iron Mask.,"Who gave the best performance in The Man In The Iron Mask ? It's Leonardo DiCaprio vs three thespians.
Leonardo DiCaprio vs Jeremy Irons
Leonardo DiCaprio vs John Malkovich
Leonardo DiCaprio vs Gabriel Byrne

Who won on each battle and who ultimately gave the best performance in The Man In The Iron Mask ?",MajorSecret5846,1h4n7cf,https://reddit.com/r/movies/comments/1h4n7cf/actors_battle_leonardo_dicaprio_vs_his_male/,https://www.reddit.com/r/movies/comments/1h4n7cf/actors_battle_leonardo_dicaprio_vs_his_male/,2024-12-02 04:53:09,0,0.37,0,0,5,0,0,False,False,True,False,False,Discussion,self,t3_1h4n7cf
