subreddit,title,selftext,author,id,permalink,url,created_utc,score,upvote_ratio,ups,downs,num_comments,total_awards_received,gilded,is_video,is_original_content,is_self,over_18,spoiler,link_flair_text,thumbnail,name
movies,"Which 90s Stallone movie do you prefer? (Rocky V, Oscar, Stop! Or My Mom Will Shoot, Cliffhanger, Demolition Man, The Specialist, Judge Dredd, Assassins, Daylight, or Cop Land)","Your choices:

* [Rocky V](https://letterboxd.com/film/rocky-v/) (1990): Reluctantly retired from fighting, Rocky takes charge of Mickey's gym and agrees to train a young protégé who's hungry for success.
* [Oscar](https://letterboxd.com/film/oscar-1991/) (1991): A gangster attempts to keep the promise he made to his dying father: that he would give up his life of crime and ""go straight"".
* [Stop! Or My Mom Will Shoot](https://letterboxd.com/film/stop-or-my-mom-will-shoot/) (1992): A tough police sergeant's overbearing mother comes to visit him and begins to meddle in his life and career.
* [Cliffhanger](https://letterboxd.com/film/cliffhanger/) (1993): A botched mid-air heist results in suitcases full of cash being searched for by various groups throughout the Rocky Mountains.
* [Demolition Man](https://letterboxd.com/film/demolition-man/) (1993): A police officer is brought out of suspended animation in prison to pursue an old ultra-violent nemesis who is loose in a non-violent future society.
* [The Specialist](https://letterboxd.com/film/the-specialist/) (1994): A woman entices a bomb expert she's involved with into destroying the mafia that killed her family.
* [Judge Dredd](https://letterboxd.com/film/judge-dredd/) (1995): In a dystopian future, Joseph Dredd, the most famous Judge (a police officer with instant field judiciary powers), is convicted for a crime he did not commit and must face his murderous counterpart.
* [Assassins](https://letterboxd.com/film/assassins/) (1995): Professional hit-man Robert Rath wants to fulfill a few more contracts before retiring but unscrupulous ambitious newcomer hit-man Miguel Bain keeps killing Rath's targets.
* [Daylight](https://letterboxd.com/film/daylight/) (1996): Disaster in a New York tunnel as explosions collapse both ends of it. One hero tries to help the people inside find their way to safety.
* [Cop Land](https://letterboxd.com/film/cop-land/) (1997): The Sheriff of a suburban New Jersey community, populated by New York City police officers, slowly discovers the town is a front for mob connections and corruption.",ggroover97,1h0u0sn,https://reddit.com/r/movies/comments/1h0u0sn/which_90s_stallone_movie_do_you_prefer_rocky_v/,https://www.reddit.com/r/movies/comments/1h0u0sn/which_90s_stallone_movie_do_you_prefer_rocky_v/,2024-11-27 02:39:42,126,0.75,126,0,421,0,0,False,False,True,False,False,Discussion,self,t3_1h0u0sn
movies,Help! Movie line!,"
Help! Mr sister and I are trying to remember a movie line. I am not sure it’s from an 80s slasher, but our friend swears it is a horror. 

I don’t even remember the scene, but one character (who reminds me of Nick from Family Ties, played by Scott Valentine), says to another “Nice purse Uncle Frank”. And I believe Frank replies with “it’s a handbag” or something…
Heeeeelllp! It’s driving me crazy! 😫",Stephanie_Ellen,1h0txv3,https://reddit.com/r/movies/comments/1h0txv3/help_movie_line/,https://www.reddit.com/r/movies/comments/1h0txv3/help_movie_line/,2024-11-27 02:35:24,0,0.27,0,0,4,0,0,False,False,True,False,False,Question,self,t3_1h0txv3
movies,Looking for movies,"Recently watched What You Wish For and it was pretty good and I searched for movies similar to it and found Fresh 2022 which I had seen before but remembered bits and pieces of it. I'm currently watching A Different Man and it's good too. 

Anyone know anything similar? 

Also, does anyone know when the movie Last Known Location came out or if it's released yet? 

And has anyone watched Strange Darling? Is it good? ",PrettyGirlChaz431,1h0tqe7,https://reddit.com/r/movies/comments/1h0tqe7/looking_for_movies/,https://www.reddit.com/r/movies/comments/1h0tqe7/looking_for_movies/,2024-11-27 02:24:55,0,0.25,0,0,6,0,0,False,False,True,False,False,Discussion,self,t3_1h0tqe7
movies,Movies whose cinematography/visual style went hard for no reason,"Sometimes a movie comes out with low expectations and absolutely blows everyone away with how visually striking it is. An example of this is Game Night (2018) which very easily could've been shot like a standard R-rated Hollywood comedy à la Judd Apatow films, but has some of the best cinematography I've seen from a comedy outside of Edgar Wright movies. Another example I can think of is The Secret Life Of Walter Mitty (2013), unfairly maligned by critics but everyone agrees that it's cinematography is spellbinding. Are there other movies like these, where even if the story or acting is average, it's an overall visual feast?",letsgopablo,1h0ta4k,https://reddit.com/r/movies/comments/1h0ta4k/movies_whose_cinematographyvisual_style_went_hard/,https://www.reddit.com/r/movies/comments/1h0ta4k/movies_whose_cinematographyvisual_style_went_hard/,2024-11-27 02:01:54,0,0.5,0,0,32,0,0,False,False,True,False,False,Discussion,self,t3_1h0ta4k
movies,"First Poster for Historical-Epic 'William Tell' - William Tell defends his family and homeland Switzerland when it comes under attack from the Austrian king. - Starring Claes Bang, Ben Kingsley, Jonathan Pryce, Golshifteh Farahani, Rafe Spall, and Ellie Bamber",,BunyipPouch,1h0t7gu,https://reddit.com/r/movies/comments/1h0t7gu/first_poster_for_historicalepic_william_tell/,https://i.redd.it/r99okzt7pc3e1.jpeg,2024-11-27 01:58:21,53,0.71,53,0,35,0,0,False,False,False,False,False,Poster,https://b.thumbs.redditmedia.com/3YU-XhecyxKmJP8ONXeGjSXha9Xvlyw-HNwQMscX9hg.jpg,t3_1h0t7gu
movies,Home Alone: Kevin’s family never knew,"Home Alone is renowned for covering plot holes: the ticket being thrown away, the power going out. However, watching Home Alone 2: Lost in New York, Kevin never told his family that he fought Harry and Marv in the events covered by the first movie. 

All throughout the second film, his family only ever describes him as being left alone during Christmas—never once do they refer to the fact that he fought off two thieves while he was home alone. The only witness to Kevin fighting the thieves was the old man with the snow shovel. One would think that he would have discussed the ordeal with Kevin’s parents. 

It begs the question why Kevin and the neighbor withheld this information from Kevin’s family. A plot hole? Or, alternatively, is there a possibility that Kevin hallucinated the entire events of the first and second films? 

Edit: Thanks for all the responses. I am going to be more careful about labeling things as plot holes in the future. Merry Christmas ya’ filthy animals. ",sirpico,1h0stm5,https://reddit.com/r/movies/comments/1h0stm5/home_alone_kevins_family_never_knew/,https://www.reddit.com/r/movies/comments/1h0stm5/home_alone_kevins_family_never_knew/,2024-11-27 01:38:23,1566,0.87,1566,0,359,0,0,False,False,True,False,False,Discussion,self,t3_1h0stm5
movies,Dear Santa ,"**Warning Spoiler Alert**
-
I just watched “Dear Santa” with Jack Black.  The movie was so so.  It hinges on Jack Blacks character not actually being Satan so he doesn’t get Liam’s soul.   Black’s character, as it turns out, is a mere Demi gorgon that screws up the process.  He is told this near the end of the film by the actual Satan.  Here is my question (since it appears to be uncredited). Was the actual Satan played by Ben Stiller?  The make up was heavy. There appears to be no mention of him in the credits.

Thanks. ",gnew18,1h0spaz,https://reddit.com/r/movies/comments/1h0spaz/dear_santa/,https://www.reddit.com/r/movies/comments/1h0spaz/dear_santa/,2024-11-27 01:32:16,0,0.5,0,0,18,0,0,False,False,True,False,True,Question,spoiler,t3_1h0spaz
movies,Earl holliman passed away yesterday at 96,"While at the Pasadena Playhouse, Holliman entered the Paramount lot by claiming he had an appointment with a studio barber. Eventually he became friendly with studio executives. Holliman first got a small bit part opposite Dean Martin and Jerry Lewis in Scared Stiff (1953). Next he was cast as a marine in The Girls of Pleasure Island (1953), for which he needed a G.I. haircut. Finally he saw the barber and ended up with a haircut (and bangs) that changed his life.

After he gained popularity in his image following a change in hairstyle, he then followed with three more films released in 1953.His many credits include: Broken Lance (1954), The Bridges at Toko-Ri (1954), The Big Combo (1955), I Died a Thousand Times (1955), Forbidden Planet (1956), Giant (1956), The Rainmaker (1956), Gunfight at the O.K. Corral (1957), Don't Go Near the Water (1957), Hot Spell (1958), The Trap (1959), Last Train from Gun Hill (1959), Visit to a Small Planet (1960), Armored Command (1961), The Sons of Katie Elder (1965), Anzio (1968), The Desperate Mission (1969), Smoke (1970), The Biscuit Eater (1972), The Solitary Man (1979), Sharky's Machine (1981) and Gunsmoke: Return to Dodge (1987).

Holliman played a doomed helicopter crewman in the William Holden war drama The Bridges at Toko-Ri and a gangster's double-crossed thug in The Big Combo. He co-starred with Jack Palance in the crime drama I Died a Thousand Times (1955), a remake of High Sierra. He starred in The Rainmaker (1956), opposite Katharine Hepburn and Burt Lancaster, playing a rancher's timid son, who finally must defy his brother to gain self-respect, for which he won the Golden Globe Award for Best Supporting Actor – Motion Picture; he was cast in the role instead of Elvis Presley. His role in Rainmaker brought him such praise that columnist Louella Parsons cited him being ""as dedicated as though he were Marlon Brando and Anthony Perkins combined"".",PatientCalendar1000,1h0slet,https://reddit.com/r/movies/comments/1h0slet/earl_holliman_passed_away_yesterday_at_96/,https://www.reddit.com/r/movies/comments/1h0slet/earl_holliman_passed_away_yesterday_at_96/,2024-11-27 01:27:05,11,0.63,11,0,4,0,0,False,False,True,False,False,News,self,t3_1h0slet
movies,La La Land's Ending: Intended Morals &amp; The Journey to the Destination,"Maybe my memory is hazy for not seeing the film for years, but I didn’t 100% like the ending.

Don't get me wrong; it's NOT for the sole reason of Mia &amp; Sebastian not staying together. I am not a hopeless romantic who thinks love overcomes all by any means. I do think it would have been less impactful of an ending (&amp; less unique) if they stayed together.

My problem is HOW they got to the point where they didn't stay together.

A common complaint I've seen about endings to anything in the last decade is ""It's not that it ended this way by default, it's how they got there."" Many people who hated how Daenerys' character arc ended in Game of Thrones (no spoilers) would have been fine with it ending that way had there been more development. Instead it only came not just in the last season, but the last 2 episodes.

If Mia got her big break, Sebastian landed a gig on his own doing the music he wants - but their schedules get so hectic that they can’t see each other as much anymore despite their efforts &amp; communications - then I wouldn’t have any issues (&amp; the ending would have been less divisive).

Instead (as far as I recall): it seems like they just had 1 fight, Sebastian says “you’re just an actress” &amp; immediately regrets it, he misses her play because of a band photoshoot he somehow forgot about (which I guess they didn’t communicate about to make sure their schedules didn’t get messy), &amp; she refuses to forgive him thus ending their relationship. It seems that one fight was enough to tank their relationship because Sebastian suddenly made a total dick move. Not communicating with her about their schedules, somehow not asking the band if anything was going on the same day as the play when they had a long time to prepare (photoshoots are planned 4-6 weeks in advance, I heard), etc. It seems like basic healthy communication skills that went out the window. &amp; this all happened in a year!

So if the film’s point is “you have to make sacrifices to achieve your dreams, &amp; that includes a person you love sometimes,” it falls flat if there wasn’t any in-character effort to keep the relationship afloat despite their schedules. If anything, I’d say the moral of the film seems to send is “find a partner who is compatible with your dreams &amp; schedules &amp; who will have a healthy communicative relationship with you.” Thus it's for THAT reason why Mia &amp; Sebastian weren’t meant to stay together, thus Mia seems to find a much healthier relationship with David who did have a compatible schedule with her &amp; put in effort to keep their relationship afloat.

Maybe that was the message all along, but I got the impression it was more about “you have to give up love for your career” (even though she has a husband &amp; a baby). Because in real life, you CAN have a career &amp; a love life &amp; family. You just have to find the right person to be compatible with in terms of careers &amp; schedules + you both making effort to make time for each other &amp; your family.  Sometimes that just doesn't happen no matter how much you love each other, but it's obviously not impossible since Mia has a family in the end &amp; seems to have no issues

Tl;dr: I think the ending would have been more satisfying if they had Mia &amp; Sebastian actively trying their best to stay together despite their growing success &amp; failing, so they break up (if the point of the film was about love not always overcoming if you want to follow your dreams).

There is going to be a Broadway musical adaptation at some point, so I hope they do something like that.",BasicBystander,1h0sk5l,https://reddit.com/r/movies/comments/1h0sk5l/la_la_lands_ending_intended_morals_the_journey_to/,https://www.reddit.com/r/movies/comments/1h0sk5l/la_la_lands_ending_intended_morals_the_journey_to/,2024-11-27 01:25:23,0,0.22,0,0,11,0,0,False,False,True,False,False,Discussion,self,t3_1h0sk5l
movies,Are there any movies/genres you used to love but have now grown out of?,"I've always enjoyed all genres, but I my obsession with horror used to run deep. It was my fave for most of my teens and all through my 20s. I'm in my 30s now, and I rarely watch horror flicks. I still enjoy horror when I do watch it, but my love for the genre has been overtaken by westerns, crime thrillers, comedies, and action movies. I understand that tastes change over time, but if you told 20-year-old me that I'd fall out of love with horror, he wouldn't have believed you. Have any of you had a similar experience with something you used to love?",WorldsBestWrestling,1h0sjd3,https://reddit.com/r/movies/comments/1h0sjd3/are_there_any_moviesgenres_you_used_to_love_but/,https://www.reddit.com/r/movies/comments/1h0sjd3/are_there_any_moviesgenres_you_used_to_love_but/,2024-11-27 01:24:17,5,0.63,5,0,27,0,0,False,False,True,False,False,Discussion,self,t3_1h0sjd3
movies,"Watch footage I shot of composer Alan Menken talking about his career (The Little Mermaid, Aladdin, Beauty and the Beast, Newsies, Little Shop of Horrors, Tangled)",,howardshum,1h0rkhg,https://reddit.com/r/movies/comments/1h0rkhg/watch_footage_i_shot_of_composer_alan_menken/,https://youtu.be/4lLfI4xcBUE,2024-11-27 00:36:43,25,0.71,25,0,2,0,0,False,False,False,False,False,Media,https://a.thumbs.redditmedia.com/7gzOr5JRyHmlhcYCIibMs61RL-fq_7IiIowilrFOYH4.jpg,t3_1h0rkhg
movies,Prequel shows,"Specifically comedies, I’ve found that if there’s any comedy show that has a prequel the prequel somehow manages to out do the original, so much so that by the time the prequel show ends it leaves a sour taste in your mouth

My main 2 examples are Ted and Young Sheldon/ The new Georgie show, in Ted’s case there are a lot of references made by Blair to how John can make something of himself and for me at least it’s kind of demoralizing how John ended up turning out in the movies, sure he’s not that bad in the movies, stable job, Girlfriend, apartment but his life didn’t turn as planned yk and I think it’s always a victim or comedy set up in general 

Kinda how in Big Bang Theory (BBT) it used Sheldon’s family as a way to get a quick laugh out of the audience and somewhat explain why Sheldon is the way he is, but once we see how his life truly was as a child and how his family was you get to see a whole other side to them and you somewhat can’t believe how they turned out, if young Sheldon writers had their way then George would never have cheated on Mary and Georgie and Mandy would probably have been endgame. 

Instead we had to deal with the inevitable notion that this is doomed to fail someway or another, and as the Ted show progresses it’ll reach that point as well where John’s character will probably change for the worse over the course of the show",Flash_SA,1h0reqw,https://reddit.com/r/movies/comments/1h0reqw/prequel_shows/,https://www.reddit.com/r/movies/comments/1h0reqw/prequel_shows/,2024-11-27 00:29:17,0,0.17,0,0,2,0,0,False,False,True,False,True,Discussion,spoiler,t3_1h0reqw
movies,"Oscars Predictions 2025: Pre-Thanksgiving Updates With Projections for Gothams, New York Film Critics and National Board of Review Awards",,Professional-Trip-08,1h0rcpq,https://reddit.com/r/movies/comments/1h0rcpq/oscars_predictions_2025_prethanksgiving_updates/,https://variety.com/lists/2025-oscars-predictions/,2024-11-27 00:26:35,0,0.46,0,0,0,0,0,False,False,False,False,False,Article,https://b.thumbs.redditmedia.com/rPArpNpqCeyyHynJUV3HIw8ew7yQ0YkmqmfQ7lraleQ.jpg,t3_1h0rcpq
movies,What are some good 80s/90s movie catchy/fun songs?,"So I got done watching Beverly Hills Cop and am currently loving the song Stir It Up (https://m.youtube.com/watch?v=CLfnwEV6uAg) just because it’s fun, puts you in a joyful mood and is tied to the warmth of the movie. I know there’s other 80s/90s movies with the use of songs like this, what are some that come to mind?",mdafidel1,1h0r6cp,https://reddit.com/r/movies/comments/1h0r6cp/what_are_some_good_80s90s_movie_catchyfun_songs/,https://www.reddit.com/r/movies/comments/1h0r6cp/what_are_some_good_80s90s_movie_catchyfun_songs/,2024-11-27 00:18:05,0,0.45,0,0,15,0,0,False,False,True,False,False,Discussion,self,t3_1h0r6cp
movies,Is it even possible to use sound as an energy source? (Monsters Inc),"After rewatching Monsters Inc, which is an amazing movie btw, something always confused me. So if you don't the main plot of the movie is that Monsters have a whole society the where everything electrical runs off of screams from kids. In Monsters Inc we see how it's the monsters job who are professional 'scarers' to use a weird magical door that does into the homes of children's closets so that they can scare them to get to scream. And we see that when they scream it fuels up a device called a scream tank, which allows it to be used as energy. We even at one point see a child screaming out in the open and it basically overpowers all the electrical appliances around her and short circuiting them.

So I'm wondering is it even possible in real life to use sound as an energy source? Or is this just something that exists in this weird world Monsters Inc?",gettinfitguy007,1h0q0y1,https://reddit.com/r/movies/comments/1h0q0y1/is_it_even_possible_to_use_sound_as_an_energy/,https://www.reddit.com/r/movies/comments/1h0q0y1/is_it_even_possible_to_use_sound_as_an_energy/,2024-11-26 23:24:00,0,0.37,0,0,6,0,0,False,False,True,False,False,Question,self,t3_1h0q0y1
movies,SEPTEMBER 5 | Official Trailer (2024 Movie),,Darshan_brahmbhatt,1h0pll1,https://reddit.com/r/movies/comments/1h0pll1/september_5_official_trailer_2024_movie/,https://youtu.be/Azud40CQ3IE?si=vlQW6NfUvr3xWJM0,2024-11-26 23:04:30,44,0.67,44,0,17,0,0,False,False,False,False,False,Trailer,https://b.thumbs.redditmedia.com/ioftW3o4onpgnwxrH_yJl1c6UxJ66ezqBrFwQgE-Ftw.jpg,t3_1h0pll1
movies,Need a cathartic release....give me your saddest movies. ," Anyone have some real need a box of kleenex type movies? I listed some of my favorites below but looking for some to maybe rewatch or watch something new. Thank you.

TW: If it is a movie with or about suicide,  bonus points. 

Where the red fern grows

Manchester by the sea

Green mile

Good Will Hunting

Dead poets sosociety 

A long way down

What dreams may come

Stay


",504Adonis,1h0pecu,https://reddit.com/r/movies/comments/1h0pecu/need_a_cathartic_releasegive_me_your_saddest/,https://www.reddit.com/r/movies/comments/1h0pecu/need_a_cathartic_releasegive_me_your_saddest/,2024-11-26 22:55:57,0,0.37,0,0,42,0,0,False,False,True,False,False,Discussion,self,t3_1h0pecu
movies,Fear Cabin: The Last Weekend of Summer - Trailer,,Bennett1984,1h0pc8v,https://reddit.com/r/movies/comments/1h0pc8v/fear_cabin_the_last_weekend_of_summer_trailer/,https://www.youtube.com/watch?v=fEAFxKoGx-w,2024-11-26 22:53:16,0,0.45,0,0,0,0,0,False,False,False,False,False,Trailer,https://b.thumbs.redditmedia.com/TsJm-CnZomhgJSwwsQPN7xn_Ue_SKWCAEwYtSktwD2k.jpg,t3_1h0pc8v
movies,"Nobody's Fool, 1994","Just re-watched Nobody's Fool,  based on the novel by Richard Russo. It's a low key, sweet, funny movie spanning both Thanksgiving and Christmas. It stars Paul Newman, Bruce Willis, Jessica Tandy and Melanie Griffith. Newman plays a crotchety, dead beat dad who gets a chance to redeem himself when his adult son and grandchildren return to his small town in New York State. It's a holiday two for one, check it out!",Ok-Comment3169,1h0om7m,https://reddit.com/r/movies/comments/1h0om7m/nobodys_fool_1994/,https://www.reddit.com/r/movies/comments/1h0om7m/nobodys_fool_1994/,2024-11-26 22:21:31,42,0.81,42,0,17,0,0,False,False,True,False,False,Recommendation,self,t3_1h0om7m
movies,"Join us tomorrow (Wednesday 11/27) at 5:00 PM ET for a live AMA/Q&amp;A with Chandler Levack &amp; Isaiah Lehtinen, the director &amp; lead actor of 'I Like Movies', a Canadian coming-of-age comedy-drama about a socially inept 17-year-old cinephile who gets a job at a video store.",,BunyipPouch,1h0ntq7,https://reddit.com/r/movies/comments/1h0ntq7/join_us_tomorrow_wednesday_1127_at_500_pm_et_for/,https://i.redd.it/zc600r4vgb3e1.jpeg,2024-11-26 21:48:32,115,0.81,115,0,32,0,0,False,False,False,False,False,News,https://b.thumbs.redditmedia.com/Uifw9ADnokZuj6k5cK-T3OjT4CliKOXc_Okq1xKrQSQ.jpg,t3_1h0ntq7
movies,Giants,"So today I had a flashback to the time I was a kid, I remember watching a movie on TV where some guy/gal was investigating on a giant human skeleton found buried in a property. I have been fixed on this all day but I haven't been able to find the movie... now I need to watch it for some reason. Does anyone recall the name of a movie like that?",senzho,1h0nps5,https://reddit.com/r/movies/comments/1h0nps5/giants/,https://www.reddit.com/r/movies/comments/1h0nps5/giants/,2024-11-26 21:43:53,0,0.25,0,0,4,0,0,False,False,True,False,False,Question,self,t3_1h0nps5
movies,Is there anybody who has watched Paradise Beach (2018)?,"If so, did you understand this movie?
The first half was pretty okay but all of a sudden the movie went head first into the meat grinder after that. 
Everyone starts to die and those who don't turn against each other and... eventually die as well. I understood nothing about it anymore, especially the ending. What the fuck was going on?
The movie seemed interesting and cool at first, thus why I'm so disappointed it did this kind of a shitty ""twist"". Or maybe I'm just too stupid to understand its complexity?

I'm only doing this post because after searching on the net about this myself, I found out that nobody knows this movie. The trailer has like 200k views on YouTube, and barely any footage besides of that exists about the movie, even though it's a Netflix Original. This is why I hope I'm able to find someone who has watched it as well and can share their experience with me.",shotgunbullet74,1h0n7by,https://reddit.com/r/movies/comments/1h0n7by/is_there_anybody_who_has_watched_paradise_beach/,https://www.reddit.com/r/movies/comments/1h0n7by/is_there_anybody_who_has_watched_paradise_beach/,2024-11-26 21:22:21,0,0.45,0,0,0,0,0,False,False,True,False,False,Question,self,t3_1h0n7by
movies,"Don Cheadle Starring, Derek Kolstad Scripted Jazz Musician-Killer ‘Canyon’ Feature In The Works From Alcon Entertainment",,KillerCroc1234567,1h0n1lc,https://reddit.com/r/movies/comments/1h0n1lc/don_cheadle_starring_derek_kolstad_scripted_jazz/,https://deadline.com/2024/11/don-cheadle-canyon-derek-kolstad-1236188089/,2024-11-26 21:15:38,12,0.71,12,0,2,0,0,False,False,False,False,False,News,https://b.thumbs.redditmedia.com/932j80ekBWvaY5hq23aWB39uB8Q1oKUbUdKtP-eMg_I.jpg,t3_1h0n1lc
movies,Edge of Tomorrow at 10: Tom Cruise’s sci-fi spectacle gets better every time,,Stonewalled89,1h0msom,https://reddit.com/r/movies/comments/1h0msom/edge_of_tomorrow_at_10_tom_cruises_scifi/,https://www.theguardian.com/film/2024/nov/27/edge-of-tomorrow-at-10-stream-team-tom-cruise-sci-fi-spectacle,2024-11-26 21:05:14,17237,0.91,17237,0,1386,0,0,False,False,False,False,False,Article,https://b.thumbs.redditmedia.com/LX2Jgb2Hna5EGDeRpISSUVWb_kKqRW1vtgIjy1M9rGg.jpg,t3_1h0msom
