subreddit,title,selftext,author,id,permalink,url,created_utc,score,upvote_ratio,ups,downs,num_comments,total_awards_received,gilded,is_video,is_original_content,is_self,over_18,spoiler,link_flair_text,thumbnail,name
learnprogramming,I really want to be a developer ,Just venting also need advice I so badly want to be a developer like so badly I took a front-end web dev bootcamp two years ago I didn't build any projects I couldn't focus it was hard to grasp I didn't give it my all but I really want a fresh start to my journey and start over I don't have a degree imposter syndrome is kicking my butt where do I even start what platforms should I learn from I have ADHD I feel so stupid all the time like uggghhh I know it's possible with hard work I can get my foot in the door I just need some encouragement or advice anything helps thank you for listening.,hotpersonatwork,1h8z2q1,https://reddit.com/r/learnprogramming/comments/1h8z2q1/i_really_want_to_be_a_developer/,https://www.reddit.com/r/learnprogramming/comments/1h8z2q1/i_really_want_to_be_a_developer/,2024-12-07 18:41:21,60,0.75,60,0,48,0,0,False,False,True,False,False,,,t3_1h8z2q1
learnprogramming,Is the programming dream a harsher reality?,"TLDR: did your enthusiasm for coding die or fade once you got employment, or did you find the same joy as when you were doing more independent learning challenges?

I started doing the Angela Yu’s 100 Days of Python course. And I absolutely love it. I made the blackjack challenge without searching for any of my code just of what I learnt previously and it was such a cool feeling. (First small project in that course)

I’m trying to get back into it, now with a more focused approach of getting a job as a goal and learning enough to do some pretty cool projects ideas I have. But I’m scared what if I spend this 1-2 years of the young part of my life (I’m 23). What if it’s not at all like what I’ve been enjoying, to actually work as a developer. What if I just hate the actual corporate job side of it. 

Right now I love the challenge of coding and visualizing how everything works. The building blocks you need to place to connect it all in your head. I love the thought process of this. I’m just scared that it’s not going to be all that in terms of work. And that I’ll be left thinking “oh well now I learnt all this and now I’m getting a good salary I can’t just leave this”.

I guess what I’m hoping for is that I keep thinking it’s a fun puzzle and that I keep enjoying it. What I’m scared of is becoming miserable and hating my job. Should I just try my entrepreneurial ideas instead? Or should I pursue this which I feel is more tangible. I’m just at a crossroad and I want to feel drive towards something “certain” but instead I’m left feeling lost.",0hleg,1h95yzb,https://reddit.com/r/learnprogramming/comments/1h95yzb/is_the_programming_dream_a_harsher_reality/,https://www.reddit.com/r/learnprogramming/comments/1h95yzb/is_the_programming_dream_a_harsher_reality/,2024-12-08 00:05:00,52,0.86,52,0,35,0,0,False,False,True,False,False,Topic,,t3_1h95yzb
learnprogramming,How to study / learn if you have limited time daily ,"What would you recommend doing for someone who wants to get into programming and learning coding etc.. but also works full time job with only 1-2 hours of free time daily.

How he should use those precious time of his to learn and study programming? ",vieps,1h9ehcp,https://reddit.com/r/learnprogramming/comments/1h9ehcp/how_to_study_learn_if_you_have_limited_time_daily/,https://www.reddit.com/r/learnprogramming/comments/1h9ehcp/how_to_study_learn_if_you_have_limited_time_daily/,2024-12-08 08:32:10,18,0.75,18,0,14,0,0,False,False,True,False,False,,,t3_1h9ehcp
learnprogramming,What should I learn first: React or Bootstrap?,"I'm almost done learning the basics of JS (already have a good understanding of HTML/CSS) and now I want to move on to a framework, but I don't know which one learn first. Any thoughts?",SatisfactionKooky414,1h8ykfw,https://reddit.com/r/learnprogramming/comments/1h8ykfw/what_should_i_learn_first_react_or_bootstrap/,https://www.reddit.com/r/learnprogramming/comments/1h8ykfw/what_should_i_learn_first_react_or_bootstrap/,2024-12-07 18:19:03,15,0.9,15,0,10,0,0,False,False,True,False,False,,,t3_1h8ykfw
learnprogramming,Serious question😩,"TL:DR: What do you do as a programmer when you are on hourly pay but nothing will solve your problem?!

I am both new to Reddit and programming (3 months), so if this is the wrong subreddit for this please let me know about other subreddits!

I work for a small e-commerce/ store and we have always been innovative and developing/becoming more efficient. So I told my boss that I want to learn programming, and that with some recourses from the company and a couple hours paid every week (+a lot of free time) I could learn to build simple JavaScript applications for things like customer service, stock keeping etc. 

1 month ago we decided it would be awesome to control the in-store music using an automatic app, simple enough I thought! For 1 week now I have been unable to connect to the Spotify API because localhost just gets denied. I have tried everything from disabling firewalls to changing ports but nothing works. After 7 long days and nights I don’t know what to tell my boss?!

My question is really what do you do in these situations? Since I really like what my boss is doing and I want to help the company with this, plus I’m paid, I just feel really bad! Please give me some guidance here🙌 ",GrowingUtopia,1h8yvkk,https://reddit.com/r/learnprogramming/comments/1h8yvkk/serious_question/,https://www.reddit.com/r/learnprogramming/comments/1h8yvkk/serious_question/,2024-12-07 18:32:36,6,0.65,6,0,18,0,0,False,False,True,False,False,Debugging,,t3_1h8yvkk
learnprogramming,How do you do it?,"genuine question, there are people mastering this shit in 6 months. ive given up and forgotten and came back to repeat it all much more times than i care to count. how the hell do you guys do it?",Careful_Biscotti_879,1h9c8h9,https://reddit.com/r/learnprogramming/comments/1h9c8h9/how_do_you_do_it/,https://www.reddit.com/r/learnprogramming/comments/1h9c8h9/how_do_you_do_it/,2024-12-08 05:53:50,6,0.67,6,0,16,0,0,False,False,True,False,False,,,t3_1h9c8h9
learnprogramming,Why isn't my code unzipping the file given by the user? ,"I am writing a batch file that encrypts/compresses and unencrypts/decompresses a file. When the user chooses to unencrypt/decompress, the program does unencrypt it, but it does not decompress it, and I cannot figure out why.

Here is the section in question:

    SET /P FILEPATH=Please enter entire filepath of the file you wish to decompress and unencrypt: 
    ECHO 
    SET /P UNENCRYPTED=Please enter filepath of the file you wish to decompress and unencrypt, but without the final extension. For example, filepath.backup.zip.aes becomes filepath.backup.zip:
    
    aescrypt.exe -d %FILEPATH%
    FOR %%F IN (%UNENCRYPTED%) DO SET FILE_PATH=%%~dpF
    FOR %%F IN (%UNENCRYPTED%) DO SET FILENAME=%%~nxF
    cd %FILE_PATH%
    TAR -xf %FILENAME%
    

I tried first to strip filename.backup.zip.aes of its last extension so I could unzip that by doing this:

    FOR %%F IN (%FILENAME%) DO SET UNENCRYPTED=%%~dpnF
    TAR -xf %UNENCRYPTED%
    

Then I tried to unzip that, but it didn't work.

After that I tried taking the .zip extension off of UNENCRYPTED and putting it back on in the tar command like this:

    FOR %%F IN (%FILENAME%) DO SET UNENCRYPTED=%%~dpnF
    FOR %%F IN (%UNENCRYPTED%) DO SET NOEXTENSION=%%~dpnF
    TAR -xf %NOEXTENSION%.zip
    
    

but I got the same result.

Finally I decided to prompt the user a second time for the filepath without the last extension, as shown in the current code, but it doesn't work either. If anyone can point me to the problem I would be beyond grateful.",MagesticTortoise,1h99sxj,https://reddit.com/r/learnprogramming/comments/1h99sxj/why_isnt_my_code_unzipping_the_file_given_by_the/,https://www.reddit.com/r/learnprogramming/comments/1h99sxj/why_isnt_my_code_unzipping_the_file_given_by_the/,2024-12-08 03:28:59,8,0.9,8,0,5,0,0,False,False,True,False,False,Debugging,,t3_1h99sxj
learnprogramming,"To all young (15-19), driven and self-taught solo developers who want to build a software project - how has the journey been so far?","How has your software development journey been so far? How much experience in years or months do you have? What has been difficult so far?

All of your responses would be greatly appreciated.",Rajan-Thakur01,1h981p2,https://reddit.com/r/learnprogramming/comments/1h981p2/to_all_young_1519_driven_and_selftaught_solo/,https://www.reddit.com/r/learnprogramming/comments/1h981p2/to_all_young_1519_driven_and_selftaught_solo/,2024-12-08 01:51:16,3,0.58,3,0,6,0,0,False,False,True,False,False,,,t3_1h981p2
learnprogramming,How do i troubleshoot this?,"The command ""echo | set /p dummyName=#define GIT\_CUR\_COMMIT &gt;  gitparams.h

git rev-parse --verify HEAD &gt;&gt;  gitparams.h



echo | set /p dummyName=#define GIT\_BRANCH &gt;&gt;  gitparams.h

git rev-parse --abbrev-ref HEAD &gt;&gt;  gitparams.h

It says its in the Microsoft.CppCommon.targets",NoLetterhead2303,1h95eh4,https://reddit.com/r/learnprogramming/comments/1h95eh4/how_do_i_troubleshoot_this/,https://www.reddit.com/r/learnprogramming/comments/1h95eh4/how_do_i_troubleshoot_this/,2024-12-07 23:36:56,4,0.83,4,0,14,0,0,False,False,True,False,False,,,t3_1h95eh4
learnprogramming,How do I learn C,"Hi, I am a relatively experienced Java programmer and I am wondering the best way to learn C because I have heard C is similar to Java in some aspects since Java is part of the C family. Any tips? Thanks!",CollectionLocal7221,1h8zsmf,https://reddit.com/r/learnprogramming/comments/1h8zsmf/how_do_i_learn_c/,https://www.reddit.com/r/learnprogramming/comments/1h8zsmf/how_do_i_learn_c/,2024-12-07 19:13:30,5,0.7,5,0,15,0,0,False,False,True,False,False,,,t3_1h8zsmf
learnprogramming,Help with building a basic programming language.,"
I have always wanted to try making my own programming language .i know its quite a difficult endeavor even if a simple one , but anyways i wanted ur guys help . It might be an amazing moment for u also if u helped me do it, atleast u could always boast the u had some hands in making a programming language.
If u have some free time and can collaborate with me to make it then we can do that on github . if not then ur advice will be greatly appreciated. I mean i dont know a heck about it right now. 


My basic idea is to make a simple Ai bot making programming language. it might be feasible or not but it would be great if it would a simple one . Hope u all enjoy ur free time helping me...

 

",AstroPhile___,1h9k58z,https://reddit.com/r/learnprogramming/comments/1h9k58z/help_with_building_a_basic_programming_language/,https://www.reddit.com/r/learnprogramming/comments/1h9k58z/help_with_building_a_basic_programming_language/,2024-12-08 14:36:57,0,0.5,0,0,8,0,0,False,False,True,False,False,,,t3_1h9k58z
learnprogramming,I created this programming cheat sheet for my workspace—thoughts?,"Hey everyone,
I’ve been learning programming for a while, and I always wanted something visually appealing to keep coding principles and best practices at my fingertips. So, I designed this cheat sheet poster for myself to combine learning and workspace decor.

I’m curious—what do you think of the design? Do you think something like this is good to stay focused and motivated? I'm just experimenting with the idea, and feedback from fellow learners would be amazing.

https://ibb.co/Y8QC5Z5

",bear007,1h9f16q,https://reddit.com/r/learnprogramming/comments/1h9f16q/i_created_this_programming_cheat_sheet_for_my/,https://www.reddit.com/r/learnprogramming/comments/1h9f16q/i_created_this_programming_cheat_sheet_for_my/,2024-12-08 09:13:04,3,0.8,3,0,7,0,0,False,False,True,False,False,,,t3_1h9f16q
learnprogramming,Stucked,"Hello everyone, I need advice, support, or any tips for the situation I’m in. I’m a third-year student of Information Technology (4-year program) and am also working full-time in healthcare. I’m not entirely satisfied with my progress at university; it feels like it’s going too slowly. So, I decided to do some additional learning through Udemy and came across the *Complete Web Development Bootcamp With Angela Yu*, which I really liked at first. However, as time goes on, it’s becoming harder and harder to understand. I feel like I’m ""stuck"" at a beginner level and that I’ll never progress beyond the basics of each programming language.

So far, I’ve worked with Python, C#, C++, Java, JavaScript, CSS, and HTML, along with their frameworks. I’m most interested in Fullstack Web Development, but in the bootcamp I’m currently taking, the topics are covered too quickly, and it feels like they don’t explain certain essential things in enough detail.

I can make a decent project, i know how to use node,ejs,git,etc, but somehow i rely a lot on google and chatgpt, and i dont want that, is it a common thing, i feel like an impostor.

Do you have any advice on what to focus on? Should i start everything over and dedicate more time to each section in course? My goal is to leave my current job as soon as possible and land a relevant position as a programmer.

Thanks in advance",Itchy-Juggernaut-580,1h8wgh2,https://reddit.com/r/learnprogramming/comments/1h8wgh2/stucked/,https://www.reddit.com/r/learnprogramming/comments/1h8wgh2/stucked/,2024-12-07 16:44:10,5,0.86,5,0,1,0,0,False,False,True,False,False,,,t3_1h8wgh2
learnprogramming,Using an IDE to learn C++,"When the question ""How to learn C++?"" shows up online, one of the top answers always seems to be something along the lines of ""get an IDE"" or ""download MS Visual Studio"".

VS was used in the college course that I followed when learning C++ and I'm relatively sure it slowed down my learning process by years. Specifying include search paths, libraries and their directories, compile options, etc. seemed all like black magic that you have to enter in the right menus.

The right way seems glaringly obvious now... To learn C++, use Linux (or WSL on Windows) and whatever combination of compiler and editor, e.g. gcc + nano.

At least during the first few weeks (or months) when learning about the basic syntax, header files, oop, templates and the STL, compile your code manually. Look at what the preprocessor produces, maybe even take a look at the created Assembly, run the linker manually. Once this gets too repetitive, switch to CMake to automate those building tasks.

Then later, If you apply for a job at a place that uses a specific IDE, take a week to get familiar with it.

I don't get why people recommend (and colleges use) Visual Studio for the purpose of learning.",pesky_jellyfish,1h8vpb7,https://reddit.com/r/learnprogramming/comments/1h8vpb7/using_an_ide_to_learn_c/,https://www.reddit.com/r/learnprogramming/comments/1h8vpb7/using_an_ide_to_learn_c/,2024-12-07 16:09:34,3,0.6,3,0,22,0,0,False,False,True,False,False,,,t3_1h8vpb7
learnprogramming,React native or Flutter ,"I am looking for some advice as to whether to learn JavaScript and React Native, or Dart and Flutter. I am a hobbyist, and just starting to learn programming with the eventual goal of building a mobile app that is cross platform. 

Beginner-friendly languages and frameworks, with the most free guides/learning tools would be ideal. Just wanted to get everyone’s input especially if you have been here before. 

Bonus points if anyone has any input on KMP and kotlin, if this would be the better option. 

All spoken as a newbie to programming! Thanks! ",Budget-Pollution-391,1h9ivdr,https://reddit.com/r/learnprogramming/comments/1h9ivdr/react_native_or_flutter/,https://www.reddit.com/r/learnprogramming/comments/1h9ivdr/react_native_or_flutter/,2024-12-08 13:29:41,2,0.75,2,0,5,0,0,False,False,True,False,False,,,t3_1h9ivdr
learnprogramming,Little man computer,"So my computer architecture exam’s is nearing and I’m having a hard time fully understanding little man computer. I understand all of the instructions and how they work but I find it really hard to make use of them. 

I can make simple programs such as outputting numbers, addition and subtraction but I have trouble making complex programs such as multiplication, division, etc..

Some of my friends from same class have really great understanding of little man computer like they’ve known them since the beginning of time but I on the other hand feel so dumb. Any resources or advice would be really helpful right now!",houdinititties,1h9f1bf,https://reddit.com/r/learnprogramming/comments/1h9f1bf/little_man_computer/,https://www.reddit.com/r/learnprogramming/comments/1h9f1bf/little_man_computer/,2024-12-08 09:13:18,3,1.0,3,0,1,0,0,False,False,True,False,False,,,t3_1h9f1bf
learnprogramming,How to freely place images when building a website?,"[https://imgur.com/a/nXJvKVz](https://imgur.com/a/nXJvKVz) &lt;- Here's a diagram of what I want to do, I know how to place images within elements (blue) but I don't know how to make them look like stickers/free place them (red). Is there a way to do this?",Dermestid-beetle,1h96x1n,https://reddit.com/r/learnprogramming/comments/1h96x1n/how_to_freely_place_images_when_building_a_website/,https://www.reddit.com/r/learnprogramming/comments/1h96x1n/how_to_freely_place_images_when_building_a_website/,2024-12-08 00:52:17,2,0.63,2,0,5,0,0,False,False,True,False,False,Tutorial,,t3_1h96x1n
learnprogramming,R programming mcq help,"I have a final for my R programming class next week, and throughout the quarter I had trouble with the way my professor formats his MCQs. He likes to give examples of edge cases and test your understanding of each and every syntax, for example:

x &lt;- c(1, 2, 3)

x\[""4""\]

A. Returns `NA`  
B. Throws an error because 4 is not a valid position  
C. Returns 3  
D. The code will not run

Usually, MCQs would be easier because you can usually guess the closest answer, but there will always be an option where ""the code will not run"", or ""the code throws an error"" and it always messes me up because I cannot possibly remember every single functions syntax or edge cases. What makes it worse is that the final is on paper and I am used to being able to autofill function syntax or just be able to test edge cases in the console.

Is there a strategy to answer these type of questions?",Zealousideal-Kale532,1h95za6,https://reddit.com/r/learnprogramming/comments/1h95za6/r_programming_mcq_help/,https://www.reddit.com/r/learnprogramming/comments/1h95za6/r_programming_mcq_help/,2024-12-08 00:05:27,2,1.0,2,0,1,0,0,False,False,True,False,False,,,t3_1h95za6
learnprogramming,Teaching a short middle school class over the summer in Python. Help!,"I just taught my first high school intro course over the fall semester in Python, and for my first time I thought it went great! There were a few things I could improve, which I'll focus on in the spring semester.

The opportunity has arisen to teach a short middle school programming course over the summer. I have full control of # of weeks, how many days per week, and the curriculum. Kids can sign up on their own accord, meaning the students I have will be interested in the subject (in theory). I think it would be silly for me to pass this up, but I'm a bit intimidated by the idea of teaching middle school students code. I would like to keep it in Python, because it's the language I know best and I feel it's the easiest to learn as a first language.

What I'm looking for:

1) Any tips on how I should teach this stuff at the middle school level. I treated the format of my high school class like a college intro course, where I would alternate between lecture days &amp; lab days and have a few major projects throughout the semester. I'm not sure 50% of the time being lecture is great for middle school students who want to code.

2) This is a shot in the dark, but if anyone has curriculum they are willing to share, I would be more than thrilled to take a look.

Thank you!",quinthlid,1h907ne,https://reddit.com/r/learnprogramming/comments/1h907ne/teaching_a_short_middle_school_class_over_the/,https://www.reddit.com/r/learnprogramming/comments/1h907ne/teaching_a_short_middle_school_class_over_the/,2024-12-07 19:32:23,2,0.67,2,0,3,0,0,False,False,True,False,False,,,t3_1h907ne
learnprogramming,How long should I try before quitting a problem?,"How long should I try before quitting a leetcode problem? Like I guess it would be different for easies, mediums and hards, so how long is the time limit for each after which I should just look at the solution/look at a hint?",Blazed0ut,1h8xp17,https://reddit.com/r/learnprogramming/comments/1h8xp17/how_long_should_i_try_before_quitting_a_problem/,https://www.reddit.com/r/learnprogramming/comments/1h8xp17/how_long_should_i_try_before_quitting_a_problem/,2024-12-07 17:40:02,2,0.67,2,0,9,0,0,False,False,True,False,False,Resource,,t3_1h8xp17
learnprogramming,libSDL3.so.0: cannot open shared object file: No such file or directory,"I am trying to compile [this example code](https://github.com/libsdl-org/SDL/blob/main/examples/renderer/01-clear/clear.c) from SDL's own github. 

My ""makefile"" (actually just a bash file) looks like this: `gcc -O -Wall -W -pedantic --std=c17 -o game main.c -lSDL3 -lm`

It compiles fine, so I guess my installation of SDL3 was successful. The CMake script put it in `/usr/local/` instead of just `/usr/` where apt put SDL2.

libSDL3.so.0 is in here: 

    /usr/local/lib$ ls -a
    .   cmake       libSDL3.so.0      libSDL3_test.a  python3.10
    ..  libSDL3.so  libSDL3.so.0.1.3  pkgconfig

The weird thing though is that [libSDL3.so](http://libSDL3.so) is a link to libSDL.so.0, which in turn is a link to libSDL.so.0.1.3 which are all in the same folder... I have no idea what that is good for, but then again, I am a newb.

What should I do? I found a similar problem someone had with SDL2 back in the day, on SO, but I don't really understand that thread. 

Thankful for any support!  
",Winter_Zucchini7415,1h9kkk4,https://reddit.com/r/learnprogramming/comments/1h9kkk4/libsdl3so0_cannot_open_shared_object_file_no_such/,https://www.reddit.com/r/learnprogramming/comments/1h9kkk4/libsdl3so0_cannot_open_shared_object_file_no_such/,2024-12-08 14:58:14,1,1.0,1,0,1,0,0,False,False,True,False,False,Solved,,t3_1h9kkk4
learnprogramming,Best Programming Language to learn for Maths,"I am thinking of going down a Pure maths path, and would like to ask what programming language is best to learn and gives the highest pay.
Currently learning python, but only the very basics,  so don't mind changing at all.",Natural-Programmer63,1h9iq1z,https://reddit.com/r/learnprogramming/comments/1h9iq1z/best_programming_language_to_learn_for_maths/,https://www.reddit.com/r/learnprogramming/comments/1h9iq1z/best_programming_language_to_learn_for_maths/,2024-12-08 13:21:24,4,0.63,4,0,10,0,0,False,False,True,False,False,,,t3_1h9iq1z
learnprogramming,Cant think of a concrete path or roadmap for learning programming and math,Title. Im an engineering student(ece) but im also interested in learning math and programming. But my college is very keen on removing a lot of topics from the portion and the teachers also seem a bit uninterested in teaching them. Can you guys suggest what order i should study topics in?,Key_Apartment1576,1h9i3l4,https://reddit.com/r/learnprogramming/comments/1h9i3l4/cant_think_of_a_concrete_path_or_roadmap_for/,https://www.reddit.com/r/learnprogramming/comments/1h9i3l4/cant_think_of_a_concrete_path_or_roadmap_for/,2024-12-08 12:45:08,1,0.6,1,0,4,0,0,False,False,True,False,False,Resource,,t3_1h9i3l4
learnprogramming,Question about my website,"I am creating a website where it is possible for each user to have a kind of archive in which to store only certain types of files (.wav and .mp3).  
First I was thinking about storing the files in a database.  
Subsequently I thought that this system was not very efficient so I decided to always use the database but this time putting only a text string that points to the absolute position of the files involved (Example: D:\\Songs\\Song.wav).  
I'm not sure if this system is good; the problem is that this site will be public (rightly so), I would need a sort of protected virtual archive directly connected to the website page where it is possible to put and extrapolate the files (which on the page will appear as audio in scalar order while in the archive the files will be divided into folders and subfolders based on the name of the user and the file so as to make the collection and storage of files more orderly and efficient).  
So my questions are:  
Is there a better way I can use the database to point to folders or some other better way to store files? If my system is otherwise acceptable, could you tell me about a virtual archive service that can do what I requested?  
I apologize if my English is incorrect, I don't know how to speak it well and I often use Google Translate.",UnViandanteSperduto,1h9h3xl,https://reddit.com/r/learnprogramming/comments/1h9h3xl/question_about_my_website/,https://www.reddit.com/r/learnprogramming/comments/1h9h3xl/question_about_my_website/,2024-12-08 11:41:03,1,1.0,1,0,8,0,0,False,False,True,False,False,Question,,t3_1h9h3xl
