subreddit,title,selftext,author,id,permalink,url,created_utc,score,upvote_ratio,ups,downs,num_comments,total_awards_received,gilded,is_video,is_original_content,is_self,over_18,spoiler,link_flair_text,thumbnail,name
science,"A study links higher urinary arsenic levels to hearing loss in U.S. adults, especially at low and speech frequencies.",,calliope_kekule,1h9khq8,https://reddit.com/r/science/comments/1h9khq8/a_study_links_higher_urinary_arsenic_levels_to/,https://www.frontiersin.org/journals/public-health/articles/10.3389/fpubh.2024.1431122/abstract,2024-12-08 14:54:27,101,0.97,101,0,4,0,0,False,False,False,False,False,Health,https://a.thumbs.redditmedia.com/TCHjhN9nYwxxCXxMDc_3ASME4mZ31DbMdlqFfn2um50.jpg,t3_1h9khq8
science,"Fear of missing out, or FOMO, isn’t just about missing out on fun. It’s about missing opportunities to bond with people we care about. FOMO stems from anxiety over how our absence affects our relationships and belonging in social groups, even when the missed events aren’t particularly enjoyable.",,mvea,1h9gjvx,https://reddit.com/r/science/comments/1h9gjvx/fear_of_missing_out_or_fomo_isnt_just_about/,https://www.psypost.org/new-psychology-research-shows-whats-really-driving-your-fear-of-missing-out/,2024-12-08 11:02:45,1699,0.94,1699,0,31,0,0,False,False,False,False,False,Psychology,https://b.thumbs.redditmedia.com/dzi_31b_IdriMgjk7denSAcHC_5bnrJMO9uY7HY88rI.jpg,t3_1h9gjvx
science,"The global elite are educated at a small number of globally prestigious universities, with Harvard University playing an outsized role. 10% of global elites went to Harvard. 23% went to the Ivy League.",,smurfyjenkins,1h8vwg9,https://reddit.com/r/science/comments/1h8vwg9/the_global_elite_are_educated_at_a_small_number/,https://onlinelibrary.wiley.com/doi/10.1111/glob.12509,2024-12-07 16:18:34,6195,0.95,6195,0,366,0,0,False,False,False,False,False,Social Science,default,t3_1h8vwg9
science,"Older adults are more likely than younger cohorts to engage with unreliable new sources, their susceptibility does not stem from an inability to identify false content. Instead, heightened partisan bias and entrenched political identities appear to drive their engagement.",,mvea,1h92jzf,https://reddit.com/r/science/comments/1h92jzf/older_adults_are_more_likely_than_younger_cohorts/,https://www.psypost.org/its-not-digital-illiteracy-heres-why-older-adults-are-drawn-to-dubious-news/,2024-12-07 21:20:19,1928,0.94,1928,0,48,0,0,False,False,False,False,False,Psychology,https://b.thumbs.redditmedia.com/DXmV2Brq6vhpy56YsrchnQRBJwagS6GcusYZNd9eXrw.jpg,t3_1h92jzf
science,"An MRI-based imaging technique developed at the University of Cambridge predicts the response of ovarian cancer tumours to treatment, and rapidly reveals how well treatment is working, in patient-derived cell models",,thebelsnickle1991,1h9d08p,https://reddit.com/r/science/comments/1h9d08p/an_mribased_imaging_technique_developed_at_the/,https://www.cam.ac.uk/research/news/imaging-technique-allows-rapid-assessment-of-ovarian-cancer-subtypes-and-their-response-to-treatment,2024-12-08 06:45:45,170,0.98,170,0,3,0,0,False,False,False,False,False,Cancer,default,t3_1h9d08p
science,"A study explored how our brains learn from past experiences of social acceptance and rejection, finding that painful social rejection can be a powerful learning tool for building future connections",,giuliomagnifico,1h91qdi,https://reddit.com/r/science/comments/1h91qdi/a_study_explored_how_our_brains_learn_from_past/,https://today.usc.edu/what-social-rejection-teaches-your-brain/,2024-12-07 20:41:26,980,0.97,980,0,28,0,0,False,False,False,False,False,Neuroscience,https://b.thumbs.redditmedia.com/DbmZ0pBuOXkkU5t_QGO3kXIesFsgXuieuLanmCVpYqs.jpg,t3_1h91qdi
science,Global clinical trial shows improved survival rates for common childhood leukemia,,calliope_kekule,1h9gwo0,https://reddit.com/r/science/comments/1h9gwo0/global_clinical_trial_shows_improved_survival/,https://www.nejm.org/doi/full/10.1056/NEJMoa2411680,2024-12-08 11:27:10,65,0.93,65,0,1,0,0,False,False,False,False,False,Health,default,t3_1h9gwo0
science,"Chronic social stress causes neurons in key brain regions to exhibit signs of senescence—a state where cells stop dividing and secrete inflammatory signals linked to aging-related diseases, finds a new study in mice. This shows how social stress may influence the aging process.",,mvea,1h8q7c1,https://reddit.com/r/science/comments/1h8q7c1/chronic_social_stress_causes_neurons_in_key_brain/,https://www.psypost.org/scientists-uncover-an-unsettling-effect-of-chronic-social-stress-on-brain-cells/,2024-12-07 11:02:47,2620,0.98,2620,0,46,0,0,False,False,False,False,False,Psychology,https://b.thumbs.redditmedia.com/ZwJ9BJrOJYOErMv97OL48kFHdXQzh9ZbzBGdX7hJJTU.jpg,t3_1h8q7c1
science,Deciding when to stop driving can be challenging for older adults and their families. A study published today in the Journal of the American Geriatric Society shows that using a decision aid tool can be beneficial and help older adults when faced with this difficult decision.,,CUAnschutzMed,1h8xb5i,https://reddit.com/r/science/comments/1h8xb5i/deciding_when_to_stop_driving_can_be_challenging/,https://news.cuanschutz.edu/news-stories/study-shows-driving-decision-aid-can-help-older-adults-with-the-difficult-decision-for-when-to-stop-driving0?utm_campaign=older&amp;utm_source=reddit&amp;utm_medium=social,2024-12-07 17:22:24,652,0.95,652,0,75,0,0,False,False,False,False,False,Health,default,t3_1h8xb5i
science,"Agricultural land preserved around river confluences can help mitigate floods, research finds: Municipalities with agricultural land in areas with high water storage potential suffered fewer floods, with stronger correlation when agricultural land was situated near river confluences.",,FunnyGamer97,1h98bha,https://reddit.com/r/science/comments/1h98bha/agricultural_land_preserved_around_river/,https://www.eurekalert.org/news-releases/1066976,2024-12-08 02:05:59,94,0.96,94,0,2,0,0,False,False,False,False,False,Engineering,https://b.thumbs.redditmedia.com/t-wrPdUlneP0L3y60-hewBGpy-WzkHCl_GhdYqXMZAg.jpg,t3_1h98bha
science,Effectiveness of Harm Reduction Interventions in Chemsex: A Systematic Review,,ghostmrchicken,1h99o20,https://reddit.com/r/science/comments/1h99o20/effectiveness_of_harm_reduction_interventions_in/,https://www.mdpi.com/2227-9032/12/14/1411,2024-12-08 03:21:07,70,0.75,70,0,20,0,0,False,False,False,False,False,Epidemiology,https://b.thumbs.redditmedia.com/LJCWJA8fLJc4Di4cc2Xg3e-mPInI5mF8pRluczmNGbQ.jpg,t3_1h99o20
science,"Largest Study of CTE in Male Ice Hockey Players Finds Odds Increased 34% With Each Year Played. Ice-hockey is the third major sport, after American football and rugby, to show a dose-response relationship between years of play and CTE risk",,Wagamaga,1h8sbtu,https://reddit.com/r/science/comments/1h8sbtu/largest_study_of_cte_in_male_ice_hockey_players/,https://www.bumc.bu.edu/camed/2024/12/04/largest-study-of-cte-in-male-ice-hockey-players-finds-odds-increased-34-with-each-year-played/,2024-12-07 13:19:27,905,0.96,905,0,38,0,0,False,False,False,False,False,Neuroscience,default,t3_1h8sbtu
science,New research revealed that neighborhood disadvantage may significantly affect brain and heart health among older adults without cognitive issues. Blood pressure was specifically pertinent to heart health analyses.,,Wagamaga,1h8x2zu,https://reddit.com/r/science/comments/1h8x2zu/new_research_revealed_that_neighborhood/,https://www.mcknights.com/news/neighborhood-disadvantage-linked-to-heart-and-brain-health-among-older-adults/,2024-12-07 17:12:25,415,0.95,415,0,7,0,0,False,False,False,False,False,Neuroscience,https://b.thumbs.redditmedia.com/j3Mkh6Rr0ZYr9gKzH2f-gz-JEqT46KMFThFco4UZ2Js.jpg,t3_1h8x2zu
science,Cannabis Use and Age-Related Changes in Cognitive Function From Early Adulthood to Late Midlife in 5162 Danish Men,,Diggy_Soze,1h8itel,https://reddit.com/r/science/comments/1h8itel/cannabis_use_and_agerelated_changes_in_cognitive/,https://www.cannabissciencetech.com/view/long-term-cannabis-use-and-cognitive-function-findings-from-a-longitudinal-study,2024-12-07 02:48:49,4101,0.91,4101,0,288,0,0,False,False,False,True,False,Biology,nsfw,t3_1h8itel
science,"Researchers developed a neurobiological model that predicts facial expressions elicited by painful stimuli. Using machine-learning algorithms trained on magnetic resonance brain imaging data, they created a Facial Expression Pain Signature",,giuliomagnifico,1h8vwux,https://reddit.com/r/science/comments/1h8vwux/researchers_developed_a_neurobiological_model/,https://nouvelles.umontreal.ca/en/article/2024/12/04/facial-expressions-of-pain-can-be-predicted-from-brain-activity/,2024-12-07 16:19:06,128,0.91,128,0,8,0,0,False,False,False,False,False,Neuroscience,https://a.thumbs.redditmedia.com/T6HAAFNhctsSC4VaZeYS3Iln_Qa59lVWsomkbS8EAF4.jpg,t3_1h8vwux
science,"Republicans judged authority violations by women more harshly, while Democrats judged such violations by men as worse. This suggests gender norms and female deference to authority are important for Republicans and perceived biases against women leading to harsher judgments of men for Democrats.",,mvea,1h8d9v8,https://reddit.com/r/science/comments/1h8d9v8/republicans_judged_authority_violations_by_women/,https://www.psypost.org/neurolinguistic-priming-reveals-contrasting-gender-biases-in-republicans-and-democrats/,2024-12-06 22:13:31,3481,0.9,3481,0,383,0,0,False,False,False,False,False,Psychology,https://b.thumbs.redditmedia.com/E9815qcOtvwkQkZiLSZDbotAGKozRpQCMy19NQ4oTgc.jpg,t3_1h8d9v8
science,Adults who frequently post on social media are at more risk of developing mental health problems than those who passively view social media content,,giuliomagnifico,1h83ki1,https://reddit.com/r/science/comments/1h83ki1/adults_who_frequently_post_on_social_media_are_at/,https://www.ucl.ac.uk/news/2024/dec/regularly-posting-social-media-may-worsen-mental-health-adults,2024-12-06 15:14:41,7634,0.97,7634,0,243,0,0,False,False,False,False,False,Psychology,https://a.thumbs.redditmedia.com/IWD2erysz40ng3nmMaDOjvQ-RPDfpvO34c6cmPLxgt4.jpg,t3_1h83ki1
science,"Research found everyday physical activity, like going for a short walk or playing with the kids, may provide short-term benefits for cognitive health, equivalent to reversing four years of cognitive aging. ",,Wagamaga,1h89v0q,https://reddit.com/r/science/comments/1h89v0q/research_found_everyday_physical_activity_like/,https://www.psypost.org/short-daily-walks-may-reverse-cognitive-aging-by-four-years-study-finds/,2024-12-06 19:43:03,1803,0.98,1803,0,17,0,0,False,False,False,False,False,Health,https://b.thumbs.redditmedia.com/asJoIZEVic-MVr0Bz-MCGuDXHkI6rfkW0-nRy3yZSTw.jpg,t3_1h89v0q
science,Lizards and snakes are 35 million years older than we thought | Reanalysis of a fossil finds that reptiles' traits go back earlier than we thought.,,chrisdh79,1h8a63l,https://reddit.com/r/science/comments/1h8a63l/lizards_and_snakes_are_35_million_years_older/,https://arstechnica.com/science/2024/12/lizards-and-snakes-are-35-million-years-older-than-we-thought/,2024-12-06 19:56:17,816,0.98,816,0,20,0,0,False,False,False,False,False,Paleontology,https://b.thumbs.redditmedia.com/L6Hu4d9OPvS0QaghUZoHnEGgONx8MIyq0AUXs2Q0PlY.jpg,t3_1h8a63l
science,"Researchers fed mealworms ground-up face masks mixed with bran and found that the bugs excreted a small fraction of the microplastics consumed. After 30 days, the research team found the mealworms ate about half the microplastics available, about 150 particles per insect, and gained weight.",,mvea,1h7yqzu,https://reddit.com/r/science/comments/1h7yqzu/researchers_fed_mealworms_groundup_face_masks/,https://news.ubc.ca/2024/12/can-plastic-eating-bugs-help-with-our-microplastic-problem/,2024-12-06 10:51:14,3483,0.97,3483,0,176,0,0,False,False,False,False,False,Biology,https://b.thumbs.redditmedia.com/i_cGFSvyV-qFrZQDTE73uRwbwp_4SJiUQTFSDQnqTaA.jpg,t3_1h7yqzu
science,Autonomous LLM-Driven Research — from Data to Human-Verifiable Research Papers,,Many-Advisor4345,1h8scl9,https://reddit.com/r/science/comments/1h8scl9/autonomous_llmdriven_research_from_data_to/,https://ai.nejm.org/doi/full/10.1056/AIoa2400555,2024-12-07 13:20:38,19,0.63,19,0,8,0,0,False,False,False,False,False,Computer Science,default,t3_1h8scl9
science,Research has shown that genetic load for schizophrenia and frequent use of cannabis have independent links to the likelihood of developing clinical psychosis. ,,Wagamaga,1h8224b,https://reddit.com/r/science/comments/1h8224b/research_has_shown_that_genetic_load_for/,https://www.kcl.ac.uk/news/cannabis-use-increases-risk-of-psychosis-independently-from-genetic-predisposition,2024-12-06 14:04:12,1144,0.96,1144,0,107,0,0,False,False,False,False,False,Neuroscience,https://b.thumbs.redditmedia.com/EtgPn4nid9pCz7IPthFzqkIOqlUud71cWc8ehV43d0c.jpg,t3_1h8224b
science,"Conserving agricultural land in flood-prone confluence areas offers substantial flood mitigation benefits, whereas urban expansion in these areas heightens flood risks. ",,calliope_kekule,1h8m1ip,https://reddit.com/r/science/comments/1h8m1ip/conserving_agricultural_land_in_floodprone/,https://doi.org/10.1016/j.indic.2024.100533,2024-12-07 05:58:58,61,0.9,61,0,1,0,0,False,False,False,False,False,Earth Science,default,t3_1h8m1ip
science,A new study in Scientific Reports reveals that microplastic particles (MPs) are present in 88.9% of human blood samples,,calliope_kekule,1h7yvby,https://reddit.com/r/science/comments/1h7yvby/a_new_study_in_scientific_reports_reveals_that/,https://www.nature.com/articles/s41598-024-81931-9,2024-12-06 10:59:48,1466,0.97,1466,0,69,0,0,False,False,False,False,False,Health,https://a.thumbs.redditmedia.com/qlytfoRF7RAnAbq5KXc85s6MOlVZD3F94zkJS2neWc4.jpg,t3_1h7yvby
