subreddit,title,selftext,author,id,permalink,url,created_utc,score,upvote_ratio,ups,downs,num_comments,total_awards_received,gilded,is_video,is_original_content,is_self,over_18,spoiler,link_flair_text,thumbnail,name
science,"The global elite are educated at a small number of globally prestigious universities, with Harvard University playing an outsized role. 10% of global elites went to Harvard. 23% went to the Ivy League.",,smurfyjenkins,1h8vwg9,https://reddit.com/r/science/comments/1h8vwg9/the_global_elite_are_educated_at_a_small_number/,https://onlinelibrary.wiley.com/doi/10.1111/glob.12509,2024-12-07 16:18:34,6193,0.95,6193,0,366,0,0,False,False,False,False,False,Social Science,default,t3_1h8vwg9
science,"Older adults are more likely than younger cohorts to engage with unreliable new sources, their susceptibility does not stem from an inability to identify false content. Instead, heightened partisan bias and entrenched political identities appear to drive their engagement.",,mvea,1h92jzf,https://reddit.com/r/science/comments/1h92jzf/older_adults_are_more_likely_than_younger_cohorts/,https://www.psypost.org/its-not-digital-illiteracy-heres-why-older-adults-are-drawn-to-dubious-news/,2024-12-07 21:20:19,1931,0.94,1931,0,48,0,0,False,False,False,False,False,Psychology,https://b.thumbs.redditmedia.com/DXmV2Brq6vhpy56YsrchnQRBJwagS6GcusYZNd9eXrw.jpg,t3_1h92jzf
science,"Fear of missing out, or FOMO, isn’t just about missing out on fun. It’s about missing opportunities to bond with people we care about. FOMO stems from anxiety over how our absence affects our relationships and belonging in social groups, even when the missed events aren’t particularly enjoyable.",,mvea,1h9gjvx,https://reddit.com/r/science/comments/1h9gjvx/fear_of_missing_out_or_fomo_isnt_just_about/,https://www.psypost.org/new-psychology-research-shows-whats-really-driving-your-fear-of-missing-out/,2024-12-08 11:02:45,1688,0.94,1688,0,31,0,0,False,False,False,False,False,Psychology,https://b.thumbs.redditmedia.com/dzi_31b_IdriMgjk7denSAcHC_5bnrJMO9uY7HY88rI.jpg,t3_1h9gjvx
science,"A study explored how our brains learn from past experiences of social acceptance and rejection, finding that painful social rejection can be a powerful learning tool for building future connections",,giuliomagnifico,1h91qdi,https://reddit.com/r/science/comments/1h91qdi/a_study_explored_how_our_brains_learn_from_past/,https://today.usc.edu/what-social-rejection-teaches-your-brain/,2024-12-07 20:41:26,977,0.97,977,0,28,0,0,False,False,False,False,False,Neuroscience,https://b.thumbs.redditmedia.com/DbmZ0pBuOXkkU5t_QGO3kXIesFsgXuieuLanmCVpYqs.jpg,t3_1h91qdi
science,Deciding when to stop driving can be challenging for older adults and their families. A study published today in the Journal of the American Geriatric Society shows that using a decision aid tool can be beneficial and help older adults when faced with this difficult decision.,,CUAnschutzMed,1h8xb5i,https://reddit.com/r/science/comments/1h8xb5i/deciding_when_to_stop_driving_can_be_challenging/,https://news.cuanschutz.edu/news-stories/study-shows-driving-decision-aid-can-help-older-adults-with-the-difficult-decision-for-when-to-stop-driving0?utm_campaign=older&amp;utm_source=reddit&amp;utm_medium=social,2024-12-07 17:22:24,650,0.95,650,0,74,0,0,False,False,False,False,False,Health,default,t3_1h8xb5i
science,New research revealed that neighborhood disadvantage may significantly affect brain and heart health among older adults without cognitive issues. Blood pressure was specifically pertinent to heart health analyses.,,Wagamaga,1h8x2zu,https://reddit.com/r/science/comments/1h8x2zu/new_research_revealed_that_neighborhood/,https://www.mcknights.com/news/neighborhood-disadvantage-linked-to-heart-and-brain-health-among-older-adults/,2024-12-07 17:12:25,416,0.95,416,0,7,0,0,False,False,False,False,False,Neuroscience,https://b.thumbs.redditmedia.com/j3Mkh6Rr0ZYr9gKzH2f-gz-JEqT46KMFThFco4UZ2Js.jpg,t3_1h8x2zu
science,"An MRI-based imaging technique developed at the University of Cambridge predicts the response of ovarian cancer tumours to treatment, and rapidly reveals how well treatment is working, in patient-derived cell models",,thebelsnickle1991,1h9d08p,https://reddit.com/r/science/comments/1h9d08p/an_mribased_imaging_technique_developed_at_the/,https://www.cam.ac.uk/research/news/imaging-technique-allows-rapid-assessment-of-ovarian-cancer-subtypes-and-their-response-to-treatment,2024-12-08 06:45:45,172,0.98,172,0,3,0,0,False,False,False,False,False,Cancer,default,t3_1h9d08p
science,"Researchers developed a neurobiological model that predicts facial expressions elicited by painful stimuli. Using machine-learning algorithms trained on magnetic resonance brain imaging data, they created a Facial Expression Pain Signature",,giuliomagnifico,1h8vwux,https://reddit.com/r/science/comments/1h8vwux/researchers_developed_a_neurobiological_model/,https://nouvelles.umontreal.ca/en/article/2024/12/04/facial-expressions-of-pain-can-be-predicted-from-brain-activity/,2024-12-07 16:19:06,133,0.91,133,0,8,0,0,False,False,False,False,False,Neuroscience,https://a.thumbs.redditmedia.com/T6HAAFNhctsSC4VaZeYS3Iln_Qa59lVWsomkbS8EAF4.jpg,t3_1h8vwux
science,"Agricultural land preserved around river confluences can help mitigate floods, research finds: Municipalities with agricultural land in areas with high water storage potential suffered fewer floods, with stronger correlation when agricultural land was situated near river confluences.",,FunnyGamer97,1h98bha,https://reddit.com/r/science/comments/1h98bha/agricultural_land_preserved_around_river/,https://www.eurekalert.org/news-releases/1066976,2024-12-08 02:05:59,94,0.96,94,0,2,0,0,False,False,False,False,False,Engineering,https://b.thumbs.redditmedia.com/t-wrPdUlneP0L3y60-hewBGpy-WzkHCl_GhdYqXMZAg.jpg,t3_1h98bha
science,Effectiveness of Harm Reduction Interventions in Chemsex: A Systematic Review,,ghostmrchicken,1h99o20,https://reddit.com/r/science/comments/1h99o20/effectiveness_of_harm_reduction_interventions_in/,https://www.mdpi.com/2227-9032/12/14/1411,2024-12-08 03:21:07,70,0.75,70,0,20,0,0,False,False,False,False,False,Epidemiology,https://b.thumbs.redditmedia.com/LJCWJA8fLJc4Di4cc2Xg3e-mPInI5mF8pRluczmNGbQ.jpg,t3_1h99o20
science,Global clinical trial shows improved survival rates for common childhood leukemia,,calliope_kekule,1h9gwo0,https://reddit.com/r/science/comments/1h9gwo0/global_clinical_trial_shows_improved_survival/,https://www.nejm.org/doi/full/10.1056/NEJMoa2411680,2024-12-08 11:27:10,62,0.92,62,0,1,0,0,False,False,False,False,False,Health,default,t3_1h9gwo0
science,"A study links higher urinary arsenic levels to hearing loss in U.S. adults, especially at low and speech frequencies.",,calliope_kekule,1h9khq8,https://reddit.com/r/science/comments/1h9khq8/a_study_links_higher_urinary_arsenic_levels_to/,https://www.frontiersin.org/journals/public-health/articles/10.3389/fpubh.2024.1431122/abstract,2024-12-08 14:54:27,104,0.97,104,0,4,0,0,False,False,False,False,False,Health,https://a.thumbs.redditmedia.com/TCHjhN9nYwxxCXxMDc_3ASME4mZ31DbMdlqFfn2um50.jpg,t3_1h9khq8
