subreddit,title,selftext,author,id,permalink,url,created_utc,score,upvote_ratio,ups,downs,num_comments,total_awards_received,gilded,is_video,is_original_content,is_self,over_18,spoiler,link_flair_text,thumbnail,name
pcgaming,"Deepest Fear - Official Gameplay Trailer
",,Mister_Rob0t,1hdlq2f,https://reddit.com/r/pcgaming/comments/1hdlq2f/deepest_fear_official_gameplay_trailer/,https://www.youtube.com/watch?v=-KyAwHrjgZg,2024-12-13 20:39:39,5,0.54,5,0,18,0,0,False,False,False,False,False,Video,https://b.thumbs.redditmedia.com/mHKucu41ROYybpsRy4yK-WMggpTfp2Q3O1vXi3p2BHc.jpg,t3_1hdlq2f
pcgaming,Announcing my game No Alibi! Think Hotline Miami meets Payday - any feedback?,,necmas_studios,1hdpwni,https://reddit.com/r/pcgaming/comments/1hdpwni/announcing_my_game_no_alibi_think_hotline_miami/,https://store.steampowered.com/app/3266730/No_Alibi/,2024-12-13 23:53:59,0,0.42,0,0,2,0,0,False,False,False,False,False,,https://b.thumbs.redditmedia.com/z-ccPWsUqVN2Ehfnr2jsRKEhcSRjf_1xi-YYiPN6RHQ.jpg,t3_1hdpwni
pcgaming,5 Years of building the KoKeShi game demo or How I went from CG Artist to Indie developer.,,royaltymisha,1hdjf8l,https://reddit.com/r/pcgaming/comments/1hdjf8l/5_years_of_building_the_kokeshi_game_demo_or_how/,https://store.steampowered.com/app/3254830/KoKeShi_The_Secret_of_the_Cicadas_Nest_Demo/?beta=0,2024-12-13 18:56:50,0,0.48,0,0,3,0,0,False,False,False,False,False,,https://a.thumbs.redditmedia.com/I2kdyJFJiXTqdZPvZLK0bMYTIuiqKYvFCNF6Pzh5Vz4.jpg,t3_1hdjf8l
pcgaming,I really miss Command &amp; Conquer—imagine how amazing a proper remake of this legendary game would be!,,Petr_Zhigulev,1hdz55j,https://reddit.com/r/pcgaming/comments/1hdz55j/i_really_miss_command_conquerimagine_how_amazing/,https://youtu.be/DrtodXOIeW8?si=uAsTil8EqYOwIoW5,2024-12-14 09:05:14,0,0.43,0,0,6,0,0,False,False,False,False,False,Video,https://b.thumbs.redditmedia.com/czw9JjdBQTPFGYkReN697TQ62FBvycSzNuplqifjnJU.jpg,t3_1hdz55j
pcgaming,Teeto - New Gameplay Trailer | WLGxTGA,,themiddyd,1hdhyu7,https://reddit.com/r/pcgaming/comments/1hdhyu7/teeto_new_gameplay_trailer_wlgxtga/,https://youtu.be/Djwn-FhXcSg?si=p9mATsgGZcuDN2Yd,2024-12-13 17:53:56,0,0.39,0,0,1,0,0,False,False,False,False,False,Video,https://b.thumbs.redditmedia.com/TmVS6G_BqFgdaitJlaMtbvkT6_6I8jmqMBbiJ2ud76Q.jpg,t3_1hdhyu7
pcgaming,I found my old receipt for Call of Duty 2,"[https://imgur.com/a/XNa45Fw](https://imgur.com/a/XNa45Fw)

Bring back the ability to buy physical PC games again!",ClassicPCgames,1hdixp5,https://reddit.com/r/pcgaming/comments/1hdixp5/i_found_my_old_receipt_for_call_of_duty_2/,https://www.reddit.com/r/pcgaming/comments/1hdixp5/i_found_my_old_receipt_for_call_of_duty_2/,2024-12-13 18:35:30,0,0.33,0,0,5,0,0,False,False,True,False,False,,self,t3_1hdixp5
pcgaming,The Witcher IV - Official Cinematic Reveal Trailer Breakdown,,M337ING,1hdfoxa,https://reddit.com/r/pcgaming/comments/1hdfoxa/the_witcher_iv_official_cinematic_reveal_trailer/,https://www.youtube.com/watch?v=3FIFslGpiZA,2024-12-13 16:14:09,0,0.31,0,0,1,0,0,False,False,False,False,False,Video,https://b.thumbs.redditmedia.com/diIbsUXqfkVePJyvc5xSEqEMla3rCNxeP4LCUulRuyw.jpg,t3_1hdfoxa
pcgaming,Ray Tracing Has a Noise Problem,,M337ING,1he08de,https://reddit.com/r/pcgaming/comments/1he08de/ray_tracing_has_a_noise_problem/,https://youtu.be/K3ZHzJ_bhaI,2024-12-14 10:30:07,172,0.79,172,0,80,0,0,False,False,False,False,False,Video,https://b.thumbs.redditmedia.com/HTwxxsXDYDSQ38WU1IGh91GctjFuTj7AlV7-ft2Qj7o.jpg,t3_1he08de
pcgaming,The Great Awards for Games With Creative And Gutsy Aspira (also known as the The Game Awards for Games Who Can't Afford the Game Awards) even page is now on steam,,Blueisland5,1hdkoah,https://reddit.com/r/pcgaming/comments/1hdkoah/the_great_awards_for_games_with_creative_and/,https://store.steampowered.com/curator/45328769/sale/TGAGWCAGA,2024-12-13 19:52:03,54,0.79,54,0,3,0,0,False,False,False,False,False,,https://b.thumbs.redditmedia.com/QCG2J1qc9B5bclJ7vMN3RKENDckDrl6zW10Bw3sWP9g.jpg,t3_1hdkoah
pcgaming,Giveaway: Scorn (Steam Key),"Hi, I have a few keys of games I already own that I want to give away. This time, it's the Steam key for **Scorn**, which came with last February's Humble Choice,

To enter, please just leave a brief comment.

IMPORTANT: Your reddit account should be at least 1 month old and please refrain from double-posting!

I will randomly choose a winner in \~ 24 hours and let that person know via PM.

Good luck and have a nice day!

DISCLAIMER: As I am aware that some users enter giveaways to sell or trade game keys and not actually redeem them, I will reserve the rights to check the winner's Reddit profile to make sure it's not just used to enter giveaways. Depending on the individual case, I might also ask for a link to your Steam profile. I'm really sorry for this, but I want to avoid giving away keys to someone who does not intend to play it. If I notice suspicious behaviour, I will re-roll the winner.",Extreme_Ad6519,1he3q87,https://reddit.com/r/pcgaming/comments/1he3q87/giveaway_scorn_steam_key/,https://www.reddit.com/r/pcgaming/comments/1he3q87/giveaway_scorn_steam_key/,2024-12-14 14:14:17,32,0.88,32,0,103,0,0,False,False,True,False,False,,self,t3_1he3q87
pcgaming,"Weekend PC Game Deals: Daily encore bundles, nominee discounts, and more",,bassbeater,1he08z4,https://reddit.com/r/pcgaming/comments/1he08z4/weekend_pc_game_deals_daily_encore_bundles/,https://www.neowin.net/news/weekend-pc-game-deals-daily-encore-bundles-nominee-discounts-and-more/,2024-12-14 10:31:21,30,0.82,30,0,4,0,0,False,False,False,False,False,,https://b.thumbs.redditmedia.com/NvwiuwEAFsTj6c3vIiYVtn_RojbHouuySri5jawMJmE.jpg,t3_1he08z4
pcgaming,"Intel Fixed Its Problems, Tearing Down the Arc B580 Video Card (Gamers Nexus)",,reps_up,1hdufke,https://reddit.com/r/pcgaming/comments/1hdufke/intel_fixed_its_problems_tearing_down_the_arc/,https://www.youtube.com/watch?v=vNKWIBKUKG4,2024-12-14 03:56:18,66,0.82,66,0,5,0,0,False,False,False,False,False,Video,https://b.thumbs.redditmedia.com/CThwC3iT6didAMQ96ng6KW49d4J91GZ2h67ps3yQlXI.jpg,t3_1hdufke
pcgaming,Marvel Rivals director reflects on hated Helldivers 2 nerfs - 'Players don't like things taken away',,UsualInitial,1hdhth2,https://reddit.com/r/pcgaming/comments/1hdhth2/marvel_rivals_director_reflects_on_hated/,https://www.videogamer.com/news/marvel-rivals-game-director-on-helldivers-2-nerfs-players-dont-like-things-taken-away/,2024-12-13 17:47:29,1720,0.9,1720,0,221,0,0,False,False,False,False,False,,https://b.thumbs.redditmedia.com/tbCEgV6pxT08FB5KNfPAJmIIfSD2k4HyB_OdqTuXihU.jpg,t3_1hdhth2
pcgaming,Swen Vincke's (Baldur's Gate 3 Director) TGAs speech was remarkable,"Last night at The Game Awards, Swen Vincke, the director of Baldur's Gate 3 gave a shocking speech that put's many things into perspective about the video game industry.

This is what he said:

""The Oracle told me that the game of the year 2025 was going to be made by a studio, a studio who found the formula to make it up here on stage. It's stupidly simple, but somehow it keeps on getting lost. Studio made their game because they wanted to make a game that they wanted to play themselves. They created it because it hadn't been created before.

They didn't make it to increase market share. They didn't make it to serve as a brand. They didn't have to meet arbitrary sales targets or fear being laid off if they didn't meet those targets.

And furthermore, the people in charge forbade them from cramming the game with anything whose only purpose was to increase revenue and didn't serve the game design. They didn't treat their developers like numbers on a spreadsheet. They didn't treat their players as users to exploit. And they didn't make decisions they knew were shortsighted in function of a bonus or politics.

They knew that if you put the game and the team first, the revenue will follow. They were driven by idealism and wanted players to have fun. And they realized that if the developers didn't have fun, nobody was going to have any fun. They understood the value of respect, that if they treated their developers and players well, those same developers and players would forgive them when things didn't go as planned. But above all, they cared about their game because they loved games. It's really that simple, said the Oracle.""

🤔 This reminds me of a quote I heard from David Brevik, the creator of Diablo, many years ago, that stuck with me forever, in which he said that he did that game because it was the game he wanted to play, but nobody had made it.

❌ He was rejected by many publishers because the market was terrible for CRPGs at the time, until Blizzard, being a young company led by gamers, decided to take the project in. Rest is history!

✅ If anybody has updated insight on how to make a game described in that speech, it is Swen. Thanks for leading by example!",AtlasBenighted,1hdoypx,https://reddit.com/r/pcgaming/comments/1hdoypx/swen_vinckes_baldurs_gate_3_director_tgas_speech/,https://www.reddit.com/r/pcgaming/comments/1hdoypx/swen_vinckes_baldurs_gate_3_director_tgas_speech/,2024-12-13 23:08:11,2233,0.91,2233,0,259,0,0,False,False,True,False,False,,self,t3_1hdoypx
pcgaming,Match-3 FPS hybrid Matcho by Blackhole developers is releasing March 13th 2025,,Fritolex,1he3scr,https://reddit.com/r/pcgaming/comments/1he3scr/match3_fps_hybrid_matcho_by_blackhole_developers/,https://store.steampowered.com/app/878210/MATCHO/,2024-12-14 14:17:17,4,0.63,4,0,0,0,0,False,False,False,False,False,,https://b.thumbs.redditmedia.com/5e_8KlPT56GAro-FjMrZz47kK4PTSUn5zC1QbqdVcng.jpg,t3_1he3scr
pcgaming,GreedFall II: The Dying World - Community Update #7 | End of the year and onwards,,_Protector,1hdfusn,https://reddit.com/r/pcgaming/comments/1hdfusn/greedfall_ii_the_dying_world_community_update_7/,https://store.steampowered.com/news/app/1997660/view/554602728738784050?l=english,2024-12-13 16:21:21,74,0.87,74,0,19,0,0,False,False,False,False,False,,https://b.thumbs.redditmedia.com/NbLcJXAPmDcvRq_eZpl8NHFnWIbDr_-zH2X4X8B6ubM.jpg,t3_1hdfusn
pcgaming,Epic being compliant to selfishness,"Epic now also revised their EULA to state that all purchased games are just licensed to us, not owned, just the way Ubisoft and EA wanted it to.

Are we really becoming renters, when they always say ""purchase"" this game or that game? Because last time I remember, I don't lease what I purchased from a grocery, I owned it. That's the very definition of the word! And the game is not the disc or cartridge, but the contents of said media.",jaceleon29,1hdzrap,https://reddit.com/r/pcgaming/comments/1hdzrap/epic_being_compliant_to_selfishness/,https://www.reddit.com/r/pcgaming/comments/1hdzrap/epic_being_compliant_to_selfishness/,2024-12-14 09:54:25,0,0.13,0,0,20,0,0,False,False,True,False,False,,self,t3_1hdzrap
pcgaming,Lenovo might soon announce a SteamOS handheld,,M337ING,1hdgdgt,https://reddit.com/r/pcgaming/comments/1hdgdgt/lenovo_might_soon_announce_a_steamos_handheld/,https://www.theverge.com/2024/12/13/24320477/lenovo-legion-go-s-steamos-handheld-gaming-pc-rumors,2024-12-13 16:44:20,281,0.92,281,0,61,0,0,False,False,False,False,False,,https://b.thumbs.redditmedia.com/8UJay-8rBN-DMBv7KJxXZyCbOHqB7ecZDmfeIGuUHnM.jpg,t3_1hdgdgt
pcgaming,Former Bungie Legal Exec Reveals Studio Hired Fans To Save Money: 'Fans Would Work for Less',,Turbostrider27,1hderzl,https://reddit.com/r/pcgaming/comments/1hderzl/former_bungie_legal_exec_reveals_studio_hired/,https://thegamepost.com/former-bungie-legal-exec-studio-hired-fans-money/,2024-12-13 15:33:27,1027,0.96,1027,0,124,0,0,False,False,False,False,False,,https://b.thumbs.redditmedia.com/IQzxTZKg3jn0FK9zZAq8xEjfoQyuFJdmA5LCHlr1KIE.jpg,t3_1hderzl
pcgaming,"Planetary Annihilation successor has a bumpy landing on Steam, and the backers aren't happy: 'So bare bones that it's basically an asset show without a game'",,Turbostrider27,1hdeiop,https://reddit.com/r/pcgaming/comments/1hdeiop/planetary_annihilation_successor_has_a_bumpy/,https://www.pcgamer.com/games/rts/planetary-annihilation-successor-has-a-bumpy-landing-on-steam-and-the-backers-arent-happy-so-bare-bones-that-its-basically-an-asset-show-without-a-game/,2024-12-13 15:21:31,558,0.96,558,0,100,0,0,False,False,False,False,False,,https://a.thumbs.redditmedia.com/KqYmBspN_L_PbP2PdizOg8gYgln8gVEXc0wKl_TwNV8.jpg,t3_1hdeiop
