subreddit,title,selftext,author,id,permalink,url,created_utc,score,upvote_ratio,ups,downs,num_comments,total_awards_received,gilded,is_video,is_original_content,is_self,over_18,spoiler,link_flair_text,thumbnail,name
movies,Question about the movie Die Hard (1988),"
In the movie Die Hard John McClane spends 30+ minutes trying to alert the police that there’s a hostage situation at Nakatomi Plaza. When they finally arrive and set up a perimeter, he seems quite relieved but once he observes the police get ready to enter the building he immediately switches to aggravated and criticizes them saying “no, no, you macho assholes.” and radios down something about “I told you what kind of guys you’re dealing with!” He even seems exasperated when they try to breach the building with the armored vehicle. 

I guess I’m having a hard time following the logic. Did I miss something? What kind of response was he expecting? 

The only thing I could come up with was he was expecting some kind of negotiation scenario. 

",Financial-Extreme325,1hgd36v,https://reddit.com/r/movies/comments/1hgd36v/question_about_the_movie_die_hard_1988/,https://www.reddit.com/r/movies/comments/1hgd36v/question_about_the_movie_die_hard_1988/,2024-12-17 15:29:12,0,0.5,0,0,12,0,0,False,False,True,False,False,Question,self,t3_1hgd36v
movies,Nic Cage and Long Legs,"Just saw this film and thought it was really good. I have a question for people who saw it in the theater or with friends at home. 

When he sings that creepy-ass song, did people laugh or was it quiet? I thought it was freaking terrifying. I'm not a Nic Cage fanboy. I like him and I know he does some wacky movies and has a certain . . . edge.  But did the people who are really into him see this as different, or just Nic Cage being Nic Cage?

Thanks. ",Independent_Sea502,1hgcc1h,https://reddit.com/r/movies/comments/1hgcc1h/nic_cage_and_long_legs/,https://www.reddit.com/r/movies/comments/1hgcc1h/nic_cage_and_long_legs/,2024-12-17 14:54:20,0,0.39,0,0,25,0,0,False,False,True,False,True,Discussion,spoiler,t3_1hgcc1h
movies,80s/90s action movies with heavy cleavage,"Been watching some real low-budget trash recently....Mankillers and Angel of Destruction specifically 

I like the well-lit style and the absurdity of these films as they're predictable but fun

Looking for some recommendations of ones that specifically feature top-heavy talent either teasing a lot or baring it all",classicmaterial,1hgcqin,https://reddit.com/r/movies/comments/1hgcqin/80s90s_action_movies_with_heavy_cleavage/,https://www.reddit.com/r/movies/comments/1hgcqin/80s90s_action_movies_with_heavy_cleavage/,2024-12-17 15:12:53,0,0.38,0,0,9,0,0,False,False,True,False,False,Discussion,self,t3_1hgcqin
movies,"Hey /r/movies! We’re Tyler Nilson and Michael Schwartz, writers/directors of LOS FRIKIS and PEANUT BUTTER FALCON! LOS FRIKIS is out 12/20 in LA+NY and 12/25 in other cities. Ask us anything!
",,LosFrikis,1hgbyi3,https://reddit.com/r/movies/comments/1hgbyi3/hey_rmovies_were_tyler_nilson_and_michael/,https://i.redd.it/lnz131ri6f7e1.jpeg,2024-12-17 14:36:12,8,0.91,8,0,3,0,0,False,False,False,False,False,AMA,https://a.thumbs.redditmedia.com/44CWk2Ky-ljK8gOUma_Kbsbq1Cx7tK1xHJvn5HrSoB0.jpg,t3_1hgbyi3
movies,'Bluey' animated movie from Disney to hit theaters in 2027,,frogsgemsntrains,1hgap4l,https://reddit.com/r/movies/comments/1hgap4l/bluey_animated_movie_from_disney_to_hit_theaters/,https://abcnews.go.com/GMA/Culture/bluey-animated-movie-disney-hit-theaters-2027/story?id=116860985,2024-12-17 13:33:11,1100,0.92,1100,0,159,0,0,False,False,False,False,False,News,https://b.thumbs.redditmedia.com/joiiCVRDPH1CCWelU-MNBKHv-lSnq4kJDB5BzbVWyvA.jpg,t3_1hgap4l
movies,KARATE KID: LEGENDS - Official Trailer ,,MarvelsGrantMan136,1hgb938,https://reddit.com/r/movies/comments/1hgb938/karate_kid_legends_official_trailer/,https://www.youtube.com/watch?v=uPzOyzsnmio,2024-12-17 14:01:14,513,0.86,513,0,224,0,0,False,False,False,False,False,Trailer,https://a.thumbs.redditmedia.com/FcEsANxIIc0_niJwp3P4tAU8idduetYUleUJqhcLMl0.jpg,t3_1hgb938
movies,‘Wicked: Part Two’ Officially Titled ‘Wicked: For Good’,,KillerCroc1234567,1hftsx6,https://reddit.com/r/movies/comments/1hftsx6/wicked_part_two_officially_titled_wicked_for_good/,https://variety.com/2024/film/news/wicked-2-title-for-good-1236250920/,2024-12-16 21:16:32,4995,0.83,4995,0,790,0,0,False,False,False,False,False,News,https://b.thumbs.redditmedia.com/GJgnhp8Gipeogzwl53yyt48FScYHlwFA0BBVibpjhWU.jpg,t3_1hftsx6
movies,"Official Poster for A24's 'Death of a Unicorn', Starring Paul Rudd &amp; Jenna Ortega",,MarvelsGrantMan136,1hgbb1m,https://reddit.com/r/movies/comments/1hgbb1m/official_poster_for_a24s_death_of_a_unicorn/,https://i.redd.it/sbyqu1x51f7e1.jpeg,2024-12-17 14:03:46,168,0.89,168,0,34,0,0,False,False,False,False,False,Poster,https://b.thumbs.redditmedia.com/G9EQyDFSI6bD-jIZvN84F2TpwDZgDFgJdOXAQrMHiKY.jpg,t3_1hgbb1m
movies,28 Days Later Trailer for Digital Release,,Grogenhymer,1hga62l,https://reddit.com/r/movies/comments/1hga62l/28_days_later_trailer_for_digital_release/,https://youtu.be/mWEhfF27O0c?si=SYfbD61osCeD_3bd,2024-12-17 13:04:29,171,0.89,171,0,52,0,0,False,False,False,False,False,Trailer,https://a.thumbs.redditmedia.com/7LFQelpwYh7WlOiwS86WmsndQcjz0qc62qXEntvSqX0.jpg,t3_1hga62l
movies,'28 Years Later' Is 2nd Most Watched Horror Trailer Ever; Sony Releasing '28 Days Later' On Digital on December 18 Due To Fan Response,,MarvelsGrantMan136,1hfogdy,https://reddit.com/r/movies/comments/1hfogdy/28_years_later_is_2nd_most_watched_horror_trailer/,https://deadline.com/2024/12/28-years-later-record-28-days-later-digital-release-1236204600/,2024-12-16 17:32:27,6602,0.96,6602,0,456,0,0,False,False,False,False,False,News,https://b.thumbs.redditmedia.com/e935UMtCZ2tua6UCP45OXRXxkHFJ4ZK8M8zTWYhfxyQ.jpg,t3_1hfogdy
movies,Official Poster for James Gunn’s ‘Superman’,,MarvelsGrantMan136,1hfjiis,https://reddit.com/r/movies/comments/1hfjiis/official_poster_for_james_gunns_superman/,https://i.redd.it/zneipeuyt77e1.jpeg,2024-12-16 13:50:53,23906,0.88,23906,0,2355,0,0,False,False,False,False,False,Poster,https://b.thumbs.redditmedia.com/PubLqANnva1d6D3M46U0rf_MmjKdt1qIER7MxLA38OY.jpg,t3_1hfjiis
movies,"Oscar-winning documentary filmmaker Alex Gibney will produce a documentary about the Dec. 4 killing of UnitedHealthcare CEO Brian Thompson and his accused killer, 26-year-old University of Pennsylvania graduate Luigi Mangione
",,Puzzled-Tap8042,1hfvzzi,https://reddit.com/r/movies/comments/1hfvzzi/oscarwinning_documentary_filmmaker_alex_gibney/,https://www.forbes.com/sites/conormurray/2024/12/16/unitedhealthcare-ceo-shooting-documentary-in-the-works-from-oscar-winning-filmmaker/,2024-12-16 22:51:02,2128,0.86,2128,0,228,0,0,False,False,False,False,False,News,https://b.thumbs.redditmedia.com/dNBYL0ydMOo3eM6C-rcJGzMuUPhgq3juYfFZQkbRkAA.jpg,t3_1hfvzzi
movies,"1915 recording of Rudyard Kipling's ""Boots."" Used in the trailer for 28 Years Later.",,Scienscatologist,1hg1h1n,https://reddit.com/r/movies/comments/1hg1h1n/1915_recording_of_rudyard_kiplings_boots_used_in/,https://youtu.be/DXffdLMxt0o?si=ZgeB6riWa2OxFs-I,2024-12-17 03:20:07,795,0.91,795,0,64,0,0,False,False,False,False,False,Trailer,https://b.thumbs.redditmedia.com/7OvvHw1zRRsJturRoF9OG-MSiEnDeI29irSknTBS_Vs.jpg,t3_1hg1h1n
movies,Variety's Worst Movies of 2024,,ebradio,1hfv1pk,https://reddit.com/r/movies/comments/1hfv1pk/varietys_worst_movies_of_2024/,https://variety.com/lists/worst-movies-of-2024/1-poolman/,2024-12-16 22:08:51,1840,0.9,1840,0,721,0,0,False,False,False,False,False,Article,https://b.thumbs.redditmedia.com/uHPsvlfzx8qaYYWdU71OTYafD1sfUcn89Oz0HtxuteA.jpg,t3_1hfv1pk
movies,"December 13-15 Box Office Recap: 'Kraven the Hunter' and 'The Lord of the Rings: The War of the Rohirrim' massively flop. Meanwhile, 'Moana 2' crosses $700 million worldwide, and 'Interstellar' finally crosses $200 million domestically.","https://preview.redd.it/xi19z0g5ta7e1.png?width=1920&amp;format=png&amp;auto=webp&amp;s=fbcef545fce2b03a13f66a8bb3efbda972af2d6f

The man finally came around.

***Moana 2*** was still on top of the box office, although the gap between it and ***Wicked*** is becoming smaller. We got two newcomers this week and both were colossal failures. ***Kraven the Hunter*** ended the SSU on a new low, while ***The Lord of the Rings: The War of the Rohirrim*** finished outside the Top 5. In limited release, ***Nickel Boys*** had a solid start, while ***September 5*** disappointed.

The Top 10 earned a combined $87.6 million this weekend. That's up 27% from last year, when ***Wonka*** debuted on top.

***Moana 2*** threepeated on the top spot, earning $26.4 million. That's a 48% drop, which is quite rough after its steep second weekend drop. After a record-breaking opening weekend, the legs are proving to be quite front-loaded. The film has earned $337.3 million, and it's now guaranteed to miss $500 million domestically. And depending on how much it drops against ***Mufasa*** and ***Sonic***, it could miss $450 million domestically.

***Wicked*** was still on second place, but it's getting close to ***Moana 2***. It earned $22.6 million this weekend, which was just 38% down from last weekend. The film has amassed $359.1 million, and it's now poised to earn more domestically than ***Moana 2***. It could start overtaking it next weekend, assuming it doesn't have a bad drop against ***Mufasa*** and ***Sonic***.

Debuting in third place, ***Kraven the Hunter*** flopped with just $11 million in 3,211 theaters. That's the worst debut in the SSU (Spider-Manless Spider-Man Universe), and one of the worst for a Marvel property. Hell, it even debuted below ***Kick-Ass*** ($19 million), another R-rated comic book movie starring Aaron Taylor-Johnson.

This is not really a surprise. I mean, where do we start?

The SSU has earned a cumulative $2.1 billion worldwide. But the *Venom* films account for $1.83 billion of that, which is like 86% of its gross. The other two films, ***Morbius*** and ***Madame Web***, were critical and commercial duds, becoming Internet's laughingstock. Even the ***Venom*** films are already losing good will among the general audience. Basically, it's a universe with absolutely nothing to offer, where the bar keeps going lower and lower. Fool me once, shame on you. Fool me six times...

But how could ***Kraven*** open below ***Madame Web***? On top of having lost any audience interest after the amount of trash released, ***Kraven*** barely felt like a comic book movie. The trailers emphasized brutal action, but it only reinforced that it felt like a generic action flick that come every couple weeks. The character of Kraven might be known for its hunt for Spider-Man, yet obviously we find ourselves in another lame attempt to give a villain a standalone origin story. With no signs of Spider-Man.

For some reason, Sony decided that ***Kraven*** warranted a big budget. The film was originally set at $90 million, which rose to $110 million due to the strikes (although some reports say that it actually cost $130 million). That's almost on par with the previous ***Venom*** film, and it's way too high for a C-lister. Especially when they made it R-rated. Sony is aware that this universe isn't working; [TheWrap](https://www.thewrap.com/kraven-the-hunter-sony-marvel-universe-spider-man-box-office/) reported that Sony will stop developing films for this universe, choosing to focus on ***Spider-Man 4***, ***Beyond the Spider-Verse*** and the ***Spider-Noir*** series. They admitted defeat before the film even came out.

There was some slight hope that J.C. Chandor's presence would also lead to a competent film. But that was not the case; it's currently at an awful 15% on RT. Nothing but a paycheck. 

According to Sony, 71% of the audience was male, which is higher than usual for a comic book title. 40% of the audience was 35 and over. They gave it a horrible ""C"" on CinemaScore, which is even worse than ***Morbius*** and ***Madame Web***. If you think these numbers look bad, just wait for the second weekend drop. Even with the holiday season, it's unlikely ***Kraven*** can hit $30 million domestically. A comparison could be ***Star Trek: Nemesis***, which also opened on December 13. After disappointing with $18 million, it closed with just $43 million. If it follows the same trajectory, ***Kraven*** will finish with just $25 million. Yike.

After its rough drop, ***Gladiator II*** slightly recovered. It dropped 39%, earning $7.6 million this weekend. Looks like ***Kraven*** barely had an impact. The film has earned $145.7 million, and it should finish with close to $170 million.

Barely cracking the Top 5 was ***The Lord of the Rings: The War of the Rohirrim***, which flopped with just $4.5 million this weekend. There's no point in even comparing it to the ***Lord of the Rings*** trilogy, which earned over 10 times this number on their first opening weekend.

While ***The Lord of the Rings*** is a massively popular franchise, there was a ceilling to this project when it was announced that it would be an anime prequel. To understand how anime has a ceilling; last year, ***The Boy and the Heron***, with all the buzz it could achieve, made $46 million domestically. That's far less than what other animated films can earn. Warner Bros. knew this couldn't be a big moneymaker, which is why they only spent $30 million on the film, and released it in just 2,602 theaters.

It has been reported that the film's existence was fast-tracked to prevent New Line from losing the film adaptation rights for Tolkien's novels. Although with the recent announcement of a ***Hunt for Gollum*** film coming in 2026, it was clear ***Rohirrim*** wouldn't really be a priority. If people were on the fence over this film, the film's middling reviews (51% on RT) indicated that this wasn't worth it.

According to Warner Bros., 68% of the audience was male and 66% of the audience was in the 18-34 demographic. They gave it a lukewarm ""B"" on CinemaScore, far worse than any Middle-Earth film. This is not gonna last long in theaters; it'd be a surprise if this earned over $15 million lifetime.

Despite being available on Prime Video, ***Red One*** dropped just 39% this weekend, adding $4.2 million. The film has earned $92.4 million, and it's fighting to hit $100 million.

It took 10 years, but Christopher Nolan's ***Interstellar*** has crossed $200 million domestically. The IMAX re-release added $3.6 million, which was just 21% down from last weekend. Fantastic all around.

***Pushpa 2: The Rule*** fell 67% this weekend, adding $1.6 million and taking its domestic total to $13 million.

***The Best Christmas Pageant Ever*** eased just 14% and added $1.2 million this weekend. That took its domestic total to $36.6 million.

Rounding up the Top 10 was Luca Guadagnino's ***Queer***, which expanded to 460 theaters this weekend. That allowed it to increase again, earning $790,954. The film's domestic total stands at $1.9 million, and it will need some Oscar buzz here.

***Interstella 5555: The 5tory of the 5ecret 5tar 5ystem*** finished outside the Top 10 with $737K during the weekend ($2.3 million four-day).

A24's ***Y2K*** lost 160 theaters and fell 68%, earning $684,957 this weekend. Through 10 days, the film has earned just $3.7 million, and it's gonna miss $5 million.

Paramount released ***September 5***, an awards hopeful, into 7 theaters. But the film earned $80,802, which translates to a very underwhelming $11,543 per-theater average. The film will expand nationwide on January 17, 2025, but this is a very weak start.

Amazon MGM's ***Nickel Boys*** debuted in 2 theaters, and earned $54,794 this weekend. That's a solid $27,397 per-theater average, and it will continue expanding in the coming weeks.

Gia Coppola's ***The Last Showgirl*** debuted in one single screen, earning $50,300 this weekend. That's a fantastic per-theater average, making it the fifth highest of the year. It will hit nationwide in January.

#**OVERSEAS**

***Moana 2*** was once again topping the overseas box office. It added $57 million overseas, taking its worldwide total to $716.8 million. The best markets are France ($40.5M), UK ($33.5M), Germany ($24.8M), Mexico ($23.5M) and Brazil ($21.1M). It's gonna the billion milestone, but it's taking some time in getting there.

***Wicked*** added $21.5 million, and its worldwide total is now $525 million. It debuted in Germany with $4 million, which is the best for a Broadway film. The film's best markets are the UK ($55.2M), Australia ($20.1M), Korea ($12M), Mexico ($9M) and Philippines ($5M). It will hit its final market, Japan, on February.

***Kraven the Hunter*** also flopped overseas. It earned just $15 million, taking its worldwide debut to just $26 million. For comparison, ***Madame Web*** earned $49 million on its worldwide debut and closed with just $100 million. There's a strong chance ***Kraven*** finishes below $60 million worldwide.

After missing the mark domestically, ***The Lord of the Rings: The War of the Rohirrim*** also flopped overseas, earning only $4 million overseas. That's a paltry $9.9 million worldwide.

#**FILMS THAT ENDED THEIR RUN THIS WEEK**

Movie | Release Date | Studio | Domestic Opening | Domestic Total | Worldwide Total | Budget |
----------|----------|----------|:--------:|:--------:|:--------:|:--------:
*Smile 2* | Oct/18 | Paramount | $23,021,692 | $68,967,012 | $137,991,092 | $28M

- Paramount's ***Smile 2*** has closed with $137 million worldwide. While that's a 37% drop from the original, it's still a box office success. Reception as a whole was much better than the first, with Naomi Scott earning praise for her performance. ***Smile 3: This Time It's Personal*** should be coming anytime now.

#**THIS WEEKEND**

***Moana 2*** will cede the top spot, and it's a battle between a lion and a hedgehog.

Disney is releasing ***Mufasa: The Lion King***, five years after the 2019 remake earned over $1.6 billion worldwide. Jon Favreau was replaced with Barry Jenkins, and the film will serve as a prequel depicting a young Mufasa and Scar. This is a strong IP, but this is uncharted territories, given that this is a completely new story with new songs. It's not gonna come anywhere close to that $1.6 billion gross, but we'll see how much it can make.

The other release is ***Sonic the Hedgehog 3***. The franchise is going strong, and this film has added Keanu Reeves as Shadow, which drew hype among the Internet. The trailers have done a fantastic job in selling the film, and the pre-sales look very strong so far. With the holiday corridor, another increase is pretty much imminent.

In limited release, A24 is opening Brady Corbet's ***The Brutalist***. It stars Adrien Brody as László Tóth, a Hungarian-born Jewish architect who survives the Holocaust and emigrates to the United States, where he struggles to achieve the American Dream until a wealthy client changes his life. The film has received fantastic reviews so far, and it's poised to become a big Oscar player. Look for a healthy run, even if the 215-minute runtime might be too much for many.

____________________________________________________________________________________________

If you're interested in following the box office, come join us in r/BoxOffice.",SanderSo47,1hfxc9z,https://reddit.com/r/movies/comments/1hfxc9z/december_1315_box_office_recap_kraven_the_hunter/,https://www.reddit.com/r/movies/comments/1hfxc9z/december_1315_box_office_recap_kraven_the_hunter/,2024-12-16 23:52:28,1105,0.95,1105,0,279,0,0,False,False,True,False,False,Weekly Box Office,https://b.thumbs.redditmedia.com/sjbhFnGvJJeCzYvtFW-mmqnoR9Z13D5qxJtnzCmLr7g.jpg,t3_1hfxc9z
movies,"National Film Registry: 'Dirty Dancing', 'Beverly Hills Cop', 'Star Trek II: The Wrath Of Khan' &amp; 'Texas Chainsaw Massacre' Among 25 Movies Added This Year",,MarvelsGrantMan136,1hg7fss,https://reddit.com/r/movies/comments/1hg7fss/national_film_registry_dirty_dancing_beverly/,https://deadline.com/2024/12/national-film-registry-2024-1236205258/,2024-12-17 10:01:11,144,0.9,144,0,35,0,0,False,False,False,False,False,News,https://b.thumbs.redditmedia.com/7PQdeIHJEJnB88uB0A3qVkKsnwupC4MWLZ0fsx3z1Wk.jpg,t3_1hg7fss
movies,Black Bag | Official Trailer,,KillerCroc1234567,1hgaiub,https://reddit.com/r/movies/comments/1hgaiub/black_bag_official_trailer/,https://youtu.be/Du0Xp8WX_7I?si=AHH2KTxlvvt7V2ON,2024-12-17 13:24:11,68,0.87,68,0,56,0,0,False,False,False,False,False,Trailer,https://b.thumbs.redditmedia.com/RcUkJdzJbs1KH12SH1XRXpGBs2rh7WmDN3YDrc1GVrw.jpg,t3_1hgaiub
movies,Just finished Oblivion. Legitimately really enjoyed it.,"I'm not going to sit here and say it was the best movie ever. Nor do I have any knowledge about the books the movie is based on. But I had a lot of fun with the movie. (This is my first movie review, plus I'm pretty tired, so I apologize in advance for how disjointed it may feel)

I'll start with what I disliked, which honestly wasn't much:
There were issues with the pacing and the dialogue, I found some performances a little stilted, and some twists were more expected than others (the Tet being evil was obvious from the get go).

As for the positives:
Tom Cruise, Andrea Riseborough, and Morgan Freeman delivered great performances I thought. I found myself actually being super absorbed in the plot, and it wasn't too difficult to follow (like a lot of sci-fi can be), which I liked. I think what everyone can agree on when it comes to this movie is that both the score and the visuals were absolutely top notch. The fact that the movie came out in 2013 blows my mind a little. 

Overall, I thought the movie was a solid 8/10. I can't say I'm totally sure why the movie gets as much hate as it does. Who knows? Maybe I just enjoyed it because I'm a huge Tron fan, and this feels similar. ",Chase-Dixon,1hg7e4p,https://reddit.com/r/movies/comments/1hg7e4p/just_finished_oblivion_legitimately_really/,https://www.reddit.com/r/movies/comments/1hg7e4p/just_finished_oblivion_legitimately_really/,2024-12-17 09:57:48,123,0.82,123,0,60,0,0,False,False,True,False,False,Review,self,t3_1hg7e4p
movies,"John C. Reilly to Be Honored at the Oscar Wilde Awards - The ceremony celebrates the work of those with strong ties to Ireland who contribute to film, television and music, while also encouraging the shooting of films in Ireland.",,BunyipPouch,1hfwi1e,https://reddit.com/r/movies/comments/1hfwi1e/john_c_reilly_to_be_honored_at_the_oscar_wilde/,https://www.hollywoodreporter.com/news/general-news/john-c-reilly-oscar-wilde-awards-1236087216/,2024-12-16 23:13:16,748,0.94,748,0,45,0,0,False,False,False,False,False,News,https://b.thumbs.redditmedia.com/-moGgdfJbbDI6JnQZbXgsChO0KUrI-jeVYtJRizclQY.jpg,t3_1hfwi1e
movies,First Images from 'Karate Kid: Legends',,MarvelsGrantMan136,1hfid0q,https://reddit.com/r/movies/comments/1hfid0q/first_images_from_karate_kid_legends/,https://i.redd.it/tggs1wq2j77e1.jpeg,2024-12-16 12:49:55,5283,0.89,5283,0,711,0,0,False,False,False,False,False,Media,https://b.thumbs.redditmedia.com/IvvrjKE2Czip2joa8PhUa-7jO5U-GvkSHAgmfdtDv1E.jpg,t3_1hfid0q
movies,"It’s that time of year again, time to rewatch A Muppet’s Christmas Carol. So in the spirit, what classic film do you wish the Muppets would make a Muppet retelling of?","The only criticism I have of the Muppet films that retell classic stories is that there aren't more of them. A Muppet's Christmas Carol and Muppet's Treasure Island (Bless you Tim Curry) are two of my favourite comfort films of all time. Recently my friends and I have been trying to work out what film would be the best to have a Muppets version of.

It's surprisingly hard to think of the best one, but my pick would be Misery. Ms Piggy is made to play Pyscho Annie and her kidnapping the writer (not sure if Kermit or a human actor would work better) and forcing them to write her a book would be amazing to see!

What do you all think? Any of you reckon you can top Misery?",Born-Captain7056,1hfyx7s,https://reddit.com/r/movies/comments/1hfyx7s/its_that_time_of_year_again_time_to_rewatch_a/,https://www.reddit.com/r/movies/comments/1hfyx7s/its_that_time_of_year_again_time_to_rewatch_a/,2024-12-17 01:07:19,392,0.91,392,0,522,0,0,False,False,True,False,False,Discussion,self,t3_1hfyx7s
movies,Warfare | Official Trailer | A24,,MarvelsGrantMan136,1hfij17,https://reddit.com/r/movies/comments/1hfij17/warfare_official_trailer_a24/,https://www.youtube.com/watch?v=JER0Fkyy3tw,2024-12-16 12:59:24,3711,0.92,3711,0,1107,0,0,False,False,False,False,False,Trailer,https://b.thumbs.redditmedia.com/qPh_cXEQxVyWRPjZ4APjR4nmMYC4uTViS2KXMDm95Sg.jpg,t3_1hfij17
movies,"THR Actors Roundtable 2024: Adrien Brody, Daniel Craig, Paul Mescal, Sebastian Stan, Colman Domingo, Peter Sarsgaard",,joesen_one,1hgbp0h,https://reddit.com/r/movies/comments/1hgbp0h/thr_actors_roundtable_2024_adrien_brody_daniel/,https://www.youtube.com/watch?v=lUxa5122WJU,2024-12-17 14:23:19,26,0.76,26,0,12,0,0,False,False,False,False,False,Media,https://b.thumbs.redditmedia.com/UuzgwbxHz3E91miPbXkjRxOyhSSLG55Ao58ZnYBDDxc.jpg,t3_1hgbp0h
