subreddit,title,selftext,author,id,permalink,url,created_utc,score,upvote_ratio,ups,downs,num_comments,total_awards_received,gilded,is_video,is_original_content,is_self,over_18,spoiler,link_flair_text,thumbnail,name
pcgaming,Star Citizen Funding Passes $750m,,Tenith,1h42icn,https://reddit.com/r/pcgaming/comments/1h42icn/star_citizen_funding_passes_750m/,https://robertsspaceindustries.com/funding-goals,2024-12-01 12:45:02,318,0.8,318,0,233,0,0,False,False,False,False,False,,https://b.thumbs.redditmedia.com/Fw_h5lQF2rm-QR3uVKfSDytHKJflCJ4iFpNB1m1yS6c.jpg,t3_1h42icn
pcgaming,"Do Not Buy NZXT | Predatory, Evil Rental Computer Scam Investigated",,xxzxcuzx__me,1h3qkv3,https://reddit.com/r/pcgaming/comments/1h3qkv3/do_not_buy_nzxt_predatory_evil_rental_computer/,https://www.youtube.com/watch?v=0pomC1CfpC0,2024-12-01 00:24:53,1736,0.93,1736,0,202,0,0,False,False,False,False,False,,https://b.thumbs.redditmedia.com/5V6ZMb6k0K5uZz4jprn9N8kP2EnjyUSmFWV2WS8tCBA.jpg,t3_1h3qkv3
pcgaming,"Terraria dev won't have staff crunch to get its next big update out before the end of the year: 'Apologies for this one taking so long for sure, but it will be well worth it'",,Turbostrider27,1h3ev4v,https://reddit.com/r/pcgaming/comments/1h3ev4v/terraria_dev_wont_have_staff_crunch_to_get_its/,https://www.pcgamer.com/games/survival-crafting/terraria-dev-wont-have-staff-crunch-to-get-its-next-big-update-out-before-the-end-of-the-year-apologies-for-this-one-taking-so-long-for-sure-but-it-will-be-well-worth-it/,2024-11-30 15:26:05,1714,0.93,1714,0,90,0,0,False,False,False,False,False,,https://b.thumbs.redditmedia.com/skMxIrr9Tu8aS3-5ZclJKdquaywEGyJQycULkP5vBLA.jpg,t3_1h3ev4v
pcgaming,What was it like playing half life for the first time in 2004 or whenever you did?,"Because 20th anniversary happened i decided to replay half life 2 since my first time was 2009. I am still blown away on how great it is, the graphics don't feel jarring, voice acting and animations are great, story, atmosphere, physics especially, i can't even think of a game that has that level of interactions in the world around you. So what was it like for you? Even if you only played it recently for the first time.

edit: just realised title is missing a 2, even then maybe tell a story on playing half life 1.",FrisCo58,1h41f39,https://reddit.com/r/pcgaming/comments/1h41f39/what_was_it_like_playing_half_life_for_the_first/,https://www.reddit.com/r/pcgaming/comments/1h41f39/what_was_it_like_playing_half_life_for_the_first/,2024-12-01 11:34:21,26,0.67,26,0,101,0,0,False,False,True,False,False,,self,t3_1h41f39
pcgaming,Do you know examples of steam games that are region locked that only exist in certain countries? (As in them not having a worldwide release.),"I know for instance, *The Idolmaster: Starlit Season* &amp; *Dragon Quest X (Offline)* remain region locked (even on steam) to exist within Asia (both East &amp; SEA nations such as *Japan, South Korea, Taiwan, China, Hong Kong, Philippines, Indonesia, Thailand, Vietnam &amp; Singapore.* which for some reason the distributors only aimed for the Asian demographic leaving out as evident with the available languages being Japanese, Chinese &amp; Korean.

Then, how can Western fans of the Dragon Quest series acquire access to [DQ X (Offline)](https://store.steampowered.com/app/1358750/?snr=1_25_4__318) \[&gt;!This game won't be available if you reside outside Japan or other Asian countries, just keep that in mind.!&lt;\] since Square Enix did not release it worldwide? The only way they would get access to them is by changing their region to Japan or create a second account set there just to buy it. For example: Dragon Quest X Offline.",Old_North8419,1h44983,https://reddit.com/r/pcgaming/comments/1h44983/do_you_know_examples_of_steam_games_that_are/,https://www.reddit.com/r/pcgaming/comments/1h44983/do_you_know_examples_of_steam_games_that_are/,2024-12-01 14:19:50,14,0.8,14,0,9,0,0,False,False,True,False,False,,self,t3_1h44983
pcgaming,S.T.A.L.K.E.R. 2: Heart of Chornobyl - Patch 1.0.2 is here!,,ZazaLeNounours,1h3bncm,https://reddit.com/r/pcgaming/comments/1h3bncm/stalker_2_heart_of_chornobyl_patch_102_is_here/,https://store.steampowered.com/news/app/1643320/view/4455844537830474746,2024-11-30 12:33:41,657,0.88,657,0,241,0,0,False,False,False,False,False,,https://b.thumbs.redditmedia.com/3yXm6o_fs2AO7tVUgUhEnrQ9u8tUdvxtNCJHGtoBc7Q.jpg,t3_1h3bncm
pcgaming,"Lost my AAA game dev job, got tired of endless interviews, so me and my friend decided to make our own game HELLBREAK while waiting for the new Doom. Demo is finally out after almost 2 years and here is the trailer, recommend watching with sound on!",,HELLBREAKOFFICIAL,1h3d2bd,https://reddit.com/r/pcgaming/comments/1h3d2bd/lost_my_aaa_game_dev_job_got_tired_of_endless/,https://www.youtube.com/watch?v=QNWEaGyxJmY,2024-11-30 13:55:18,507,0.77,507,0,134,0,0,False,False,False,False,False,Video,https://b.thumbs.redditmedia.com/5w8sxs7WH3eABv_VXML5DUlZ0W0mCh0PbsXFGDVVGEA.jpg,t3_1h3d2bd
pcgaming,Intel releases teaser for Arc Battlemage GPUs,,reps_up,1h3dahj,https://reddit.com/r/pcgaming/comments/1h3dahj/intel_releases_teaser_for_arc_battlemage_gpus/,https://x.com/IntelGaming/status/1862859173207113798,2024-11-30 14:07:31,266,0.92,266,0,53,0,0,False,False,False,False,False,,https://b.thumbs.redditmedia.com/dFB0L7auDxeEX9KIq53wwmwLYXbxZ0e3s-fg0ZZI6bA.jpg,t3_1h3dahj
pcgaming,"Introducing my chill, story-driven survival-crafting game, AETHUS.","Hey PC gamers!

I wanted to introduce my solo-dev project, a sci-fi survival-crafter/base-builder, [AETHUS](https://store.steampowered.com/app/2541530/AETHUS/?utm_source=redpcgaming).

**[Check out the trailer here!](https://www.youtube.com/watch?v=FwB0r5f6T80)**

**AETHUS is a story-driven survival game, meaning there's always a narrative-driven reason to go on your next expedition into the underground open world!** 

You'll mine and gather resources in a physics-driven world rendered with Lumen and Nanite in UE5, while building up your mining outpost on the surface with easy to use yet extremely powerful building and decoration tools.

I've spent a lot of time making these tools as simple to use as possible and the whole game is **packed with quality-of-life features** like building/crafting/cooking from storage automatically, the ability to disable collisions when building so you can position things JUST right, and much more.

I left my AAA job after 7 years in the industry back in 2023 to go indie on my own and make this game, with **no AAA bullshit** - no AI, no microtransactions or cosmetics, no predatory development, no releasing a half-done bug-filled product in Early Access, just good old-fashioned gamedev.

[I'd love to get your thoughts on the game, so there's a demo you can try out right now on Steam!](https://store.steampowered.com/app/2541530/AETHUS/?utm_source=redpcgaming)

A [Wishlist](https://store.steampowered.com/app/2541530/AETHUS/?utm_source=redpcgaming) would be super appreciated if you like the look of the game, single every one helps a solo indie dev like me!

[You an also join the community on Discord and chat with me \(the sole developer\) directly!](https://discord.gg/WJEBMYgpgt)",BeaconDev,1h3h8jc,https://reddit.com/r/pcgaming/comments/1h3h8jc/introducing_my_chill_storydriven_survivalcrafting/,https://www.reddit.com/r/pcgaming/comments/1h3h8jc/introducing_my_chill_storydriven_survivalcrafting/,2024-11-30 17:12:34,260,0.76,260,0,6,0,0,False,False,True,False,False,,self,t3_1h3h8jc
pcgaming,Weekend PC Game Deals: Autumn and Black Friday specials take over,,bassbeater,1h3ajkd,https://reddit.com/r/pcgaming/comments/1h3ajkd/weekend_pc_game_deals_autumn_and_black_friday/,https://www.neowin.net/news/weekend-pc-game-deals-autumn-and-black-friday-specials-take-over/,2024-11-30 11:19:03,265,0.93,265,0,26,0,0,False,False,False,False,False,,https://b.thumbs.redditmedia.com/NNAF2YM-bR8Golb0H-kdGR-JRzvBhheTHMAWCugQuMM.jpg,t3_1h3ajkd
pcgaming,The Greatest Challenge In CRPGs - The Ultimate,,_Protector,1h42mu2,https://reddit.com/r/pcgaming/comments/1h42mu2/the_greatest_challenge_in_crpgs_the_ultimate/,https://www.youtube.com/watch?v=4ZOuUOrnLes,2024-12-01 12:52:30,1,0.52,1,0,3,0,0,False,False,False,False,False,,https://a.thumbs.redditmedia.com/PVbOE_Ds0w4iroMF6WOCBhM5bpSkExds4PZc_jarpI8.jpg,t3_1h42mu2
pcgaming,No Man's Sky dev reflects on the new Very Positive rating on Steam and promises that this is only the beginning: 'We aren’t even close to being finished yet',,Turbostrider27,1h2rbge,https://reddit.com/r/pcgaming/comments/1h2rbge/no_mans_sky_dev_reflects_on_the_new_very_positive/,https://www.pcgamer.com/games/action/no-mans-sky-dev-reflects-on-the-new-very-positive-rating-on-steam-and-promises-that-this-is-only-the-beginning-we-arent-even-close-to-being-finished-yet/,2024-11-29 17:45:47,2250,0.93,2250,0,245,0,0,False,False,False,False,False,,https://b.thumbs.redditmedia.com/KA_eLbDgFpDs8suDaQpDmIGA1Crx97hNsQJqHBQw8NA.jpg,t3_1h2rbge
pcgaming,I'm making a rhythm-RPG where you pilot giant mechs in dance battles!,,agaubatz,1h3j787,https://reddit.com/r/pcgaming/comments/1h3j787/im_making_a_rhythmrpg_where_you_pilot_giant_mechs/,https://youtu.be/WfEBugBmdjE,2024-11-30 18:41:32,20,0.61,20,0,23,0,0,False,False,False,False,False,Video,https://b.thumbs.redditmedia.com/g-NFWzsz818zrZX91HstR34YteUBevpUcfqqCeIrzhE.jpg,t3_1h3j787
