subreddit,title,selftext,author,id,permalink,url,created_utc,score,upvote_ratio,ups,downs,num_comments,total_awards_received,gilded,is_video,is_original_content,is_self,over_18,spoiler,link_flair_text,thumbnail,name
science,Pre-roman copper industry had no polluting impact on the global environment,,calliope_kekule,1h3wx4t,https://reddit.com/r/science/comments/1h3wx4t/preroman_copper_industry_had_no_polluting_impact/,https://www.nature.com/articles/s41598-024-80939-5,2024-12-01 06:13:38,339,0.84,339,0,28,0,0,False,False,False,False,False,Anthropology,https://b.thumbs.redditmedia.com/AeifzciYxNmyyq5So6ZiPc4azcDGkFj5ru9EQEx8AXE.jpg,t3_1h3wx4t
science,"Vegetarians and vegans consume slightly more processed foods than meat eaters, sparking debate on diet quality. UPFs are industrially formulated items primarily made from substances extracted from food or synthesized in laboratories.",,Wagamaga,1h3z83n,https://reddit.com/r/science/comments/1h3z83n/vegetarians_and_vegans_consume_slightly_more/,https://uk.news.yahoo.com/vegetarians-eat-significantly-higher-amount-113600050.html,2024-12-01 08:54:42,3193,0.89,3193,0,434,0,0,False,False,False,False,False,Health,https://b.thumbs.redditmedia.com/46poIz52XfLQNRuvJZg8BTwqMl7oP6tR3rWhkJzF1kQ.jpg,t3_1h3z83n
science,"How U.S. Presidential elections strengthen global hate networks - The election triggered new hate content at scale around immigration, ethnicity, and antisemitism that aligns with conspiracy theories about Jewish-led replacement. Telegram acts as a key hardening agent. ",,mvea,1h3gco9,https://reddit.com/r/science/comments/1h3gco9/how_us_presidential_elections_strengthen_global/,https://www.nature.com/articles/s44260-024-00018-8,2024-11-30 16:34:16,3789,0.9,3789,0,219,0,0,False,False,False,False,False,Social Science,https://b.thumbs.redditmedia.com/3fy7EB5aQ59hzO-8snYEIESbdGeTSrU2rBXpij1EY5g.jpg,t3_1h3gco9
science,"Research identifies 574 political streamers on Twitch, discussing topics such as identity politics and international issues. Analysis highlights unique audience interactions and the role of real-time chat in shaping political discourse.",,calliope_kekule,1h3wlg3,https://reddit.com/r/science/comments/1h3wlg3/research_identifies_574_political_streamers_on/,https://journals.plos.org/plosone/article?id=10.1371/journal.pone.0314429,2024-12-01 05:53:39,108,0.87,108,0,1,0,0,False,False,False,False,False,Social Science,https://b.thumbs.redditmedia.com/rVJVjiI2mcEoQbOkNt_qT04S6P6rSrNt7RLDWy1btfM.jpg,t3_1h3wlg3
science,"New research  finds that cues to ambient darkness decrease women’s willingness to engage with physically strong men. This suggests that in darker environments, perceived strength in men may be more strongly associated with potential threat than with protection or attractiveness.",,mvea,1h3h2j4,https://reddit.com/r/science/comments/1h3h2j4/new_research_finds_that_cues_to_ambient_darkness/,https://www.psypost.org/womens-interest-in-strong-men-adapts-to-environmental-cues-of-potential-threat/,2024-11-30 17:05:17,3883,0.93,3883,0,392,0,0,False,False,False,False,False,Psychology,https://b.thumbs.redditmedia.com/vpceWb_9uFxI7AYWVFTaYLk3yrSeUymV2os9S2X8mik.jpg,t3_1h3h2j4
science,"Political polarization has been increasing across the globe. People even rate products less favorably when they are associated with their least-liked political party. This tendency is stronger in public than in private situations, suggesting that people may do this for reputational reasons.",,mvea,1h416qw,https://reddit.com/r/science/comments/1h416qw/political_polarization_has_been_increasing_across/,https://www.psypost.org/political-contamination-can-affect-everyday-choices-in-surprising-ways/,2024-12-01 11:17:54,419,0.94,419,0,53,0,0,False,False,False,False,False,Psychology,https://b.thumbs.redditmedia.com/ZjKUasrNK5svggksVsUUd_CYco-kdNezMv46vjoAnfo.jpg,t3_1h416qw
science,"Study: A third of the decline in support for Brexit in the UK since 2016 is due to cohort replacement where many older voters (who support Brexit) have passed away, while younger voters (who oppose Brexit) have entered the electorate.",,smurfyjenkins,1h3go4k,https://reddit.com/r/science/comments/1h3go4k/study_a_third_of_the_decline_in_support_for/,https://ejpr.onlinelibrary.wiley.com/doi/10.1111/1475-6765.12745,2024-11-30 16:48:26,1817,0.96,1817,0,123,0,0,False,False,False,False,False,Social Science,default,t3_1h3go4k
science,"Antibiotics can change how bacteria build proteins by altering RNA, potentially affecting resistance. This study explores these changes and introduces a new tool for better RNA research.",,calliope_kekule,1h3k9wd,https://reddit.com/r/science/comments/1h3k9wd/antibiotics_can_change_how_bacteria_build/,https://www.nature.com/articles/s41467-024-54368-x,2024-11-30 19:29:54,220,0.97,220,0,4,0,0,False,False,False,False,False,Health,https://b.thumbs.redditmedia.com/Q9t2ER4Jxi7cBaD5UIJCBbfoFV5iu6p73-XHU3PTVlI.jpg,t3_1h3k9wd
science,"A study involving 14,053 participants seeking weight loss through GLP-1 found that it also reduces alcohol use, with 45.3% reporting a decrease in their category of alcohol consumption. This may be because GLP-1 potentially diminish the rewarding effects of alcohol, similar to their effect on food",,giuliomagnifico,1h3i3bf,https://reddit.com/r/science/comments/1h3i3bf/a_study_involving_14053_participants_seeking/,https://jamanetwork.com/journals/jamanetworkopen/fullarticle/2827069,2024-11-30 17:50:55,1578,0.98,1578,0,45,0,0,False,False,False,False,False,Health,https://a.thumbs.redditmedia.com/9tAqyTx0BQlOWs6F4Oj8qRDRWrSeE3AEaOCIiOkIga4.jpg,t3_1h3i3bf
science,Researchers develop 3D-printed hydrogels for continuous drug delivery through contact lenses,,giuliomagnifico,1h3gaew,https://reddit.com/r/science/comments/1h3gaew/researchers_develop_3dprinted_hydrogels_for/,https://uwaterloo.ca/news/media/cutting-edge-contact-lens-gel-delivers-medication,2024-11-30 16:31:30,352,0.98,352,0,8,0,0,False,False,False,False,False,Materials Science,https://b.thumbs.redditmedia.com/e65RiTrdGGnY_qun8NUNYkcmaLp1R2Eu5p3FEw59oyM.jpg,t3_1h3gaew
science,Formation of Himalayas may have erased 30% of continental crust: study,,Iamsulthan,1h44gde,https://reddit.com/r/science/comments/1h44gde/formation_of_himalayas_may_have_erased_30_of/,https://madhyamamonline.com/science/formation-of-himalayas-may-have-erased-30-of-continental-crust-study-1355182,2024-12-01 14:29:48,217,0.97,217,0,3,0,0,False,False,False,False,False,Geology,https://b.thumbs.redditmedia.com/qmXpdGV1cSlD8BDdg6uRpQT8RjeSyFihbQvIEgdcePI.jpg,t3_1h44gde
