subreddit,title,selftext,author,id,permalink,url,created_utc,score,upvote_ratio,ups,downs,num_comments,total_awards_received,gilded,is_video,is_original_content,is_self,over_18,spoiler,link_flair_text,thumbnail,name
programming,"Compile JavaScript to a Assembly, AST, C, and executable using Facebook's shermes",,guest271314,1gvba7b,https://reddit.com/r/programming/comments/1gvba7b/compile_javascript_to_a_assembly_ast_c_and/,https://gitlab.com/-/snippets/4770898,2024-11-19 23:28:36,0,0.47,0,0,2,0,0,False,False,False,False,False,,,t3_1gvba7b
programming,"🚀 Simplified HTTP Server for C# – Inspired by ExpressJS, Cross-Platform &amp; Intuitive Interface! 🌍","🚀Simplified HTTP Server for C# inspired by ExpressJS, Cross-Platform and intuitive interface🌎

Hi everyone!👋

I’m exiting to charge a project I’ve been working on - TGV (French express trains), a lightweight C# library designed to simplify the process of building HTTP servers. Inspired by simplicity and flexibility of ExpressJS, I created this to be a cross-platform easy-to-use framework for building apps. 

🎯Features:

🌐HTTP(S) request handling with routings 

🔓Middleware support

🖥️Cross-platform (at least Linux and Windows)

📦Minimal dependencies and no boilerplates


🚀Getting started

You can check out and try library on GitHub and NuGet today! The library is still in development stage so any feedback, suggestions or contributions are very welcome!

Feel free to ask any question, I’ll be happy to answer them!
",Oshi41,1gvfnj3,https://reddit.com/r/programming/comments/1gvfnj3/simplified_http_server_for_c_inspired_by/,https://github.com/Oshi41/tgv,2024-11-20 02:57:48,0,0.38,0,0,2,0,0,False,False,False,False,False,,,t3_1gvfnj3
programming,NASA C++ Static Analyzer Open Source ,,morglod,1guqlxz,https://reddit.com/r/programming/comments/1guqlxz/nasa_c_static_analyzer_open_source/,https://www.youtube.com/watch?v=HszHill46_M&amp;ab_channel=Tariq10x,2024-11-19 06:05:07,23,0.82,23,0,4,0,0,False,False,False,False,False,,,t3_1guqlxz
programming,The application I developed to follow the list of Books to Read Before You Die,,sav_say,1gvjw17,https://reddit.com/r/programming/comments/1gvjw17/the_application_i_developed_to_follow_the_list_of/,https://medium.com/@savsay/the-application-i-developed-to-follow-the-list-of-books-to-read-before-you-die-c717f9851126,2024-11-20 07:07:42,0,0.22,0,0,2,0,0,False,False,False,False,False,,,t3_1gvjw17
programming,AI Flame Graphs,,finallyanonymous,1gux3lj,https://reddit.com/r/programming/comments/1gux3lj/ai_flame_graphs/,https://www.brendangregg.com/blog/2024-10-29/ai-flame-graphs.html,2024-11-19 13:27:44,5,0.63,5,0,0,0,0,False,False,False,False,False,,,t3_1gux3lj
programming,Playground Wisdom: Threads Beat Async/Await,,alexeyr,1guft07,https://reddit.com/r/programming/comments/1guft07/playground_wisdom_threads_beat_asyncawait/,https://lucumr.pocoo.org/2024/11/18/threads-beat-async-await/,2024-11-18 21:16:47,92,0.81,92,0,32,0,0,False,False,False,False,False,,,t3_1guft07
programming,What's new in POSIX 2024,,cosmic-parsley,1guhr89,https://reddit.com/r/programming/comments/1guhr89/whats_new_in_posix_2024/,https://blog.toast.cafe/posix2024-xcu,2024-11-18 22:37:49,69,0.95,69,0,5,0,0,False,False,False,False,False,,,t3_1guhr89
programming,Building SQL-based Observability With ClickHouse and Grafana,,mmaksimovic,1guugbd,https://reddit.com/r/programming/comments/1guugbd/building_sqlbased_observability_with_clickhouse/,https://cmtops.dev/posts/building-observability-with-clickhouse/,2024-11-19 10:50:04,7,0.82,7,0,0,0,0,False,False,False,False,False,,,t3_1guugbd
programming,Introducción a Plug de Elixir,,emanuelpeg,1gvgxpu,https://reddit.com/r/programming/comments/1gvgxpu/introducción_a_plug_de_elixir/,https://emanuelpeg.blogspot.com/2024/11/introduccion-plug-de-elixir.html,2024-11-20 04:05:11,0,0.31,0,0,0,0,0,False,False,False,False,False,,,t3_1gvgxpu
programming,Mastering Helm from Scratch: Part 5 — Building Your First Custom Helm Chart,,kirshiyin,1gv8gls,https://reddit.com/r/programming/comments/1gv8gls/mastering_helm_from_scratch_part_5_building_your/,https://medium.com/curious-devs-corner/mastering-helm-from-scratch-part-5-building-your-first-custom-helm-chart-3a2ed391bdea,2024-11-19 21:26:53,0,0.44,0,0,0,0,0,False,False,False,False,False,,,t3_1gv8gls
programming,Paged Out Issue #5,,Rufus_T_Stone,1gv2hck,https://reddit.com/r/programming/comments/1gv2hck/paged_out_issue_5/,https://pagedout.institute/download/PagedOut_005.pdf,2024-11-19 17:20:20,1,0.57,1,0,0,0,0,False,False,False,False,False,,,t3_1gv2hck
programming,"OpenAPI Generator v7.10.0 released with 3 new generators for Rust, C# and GDScript",,wing328,1gu478a,https://reddit.com/r/programming/comments/1gu478a/openapi_generator_v7100_released_with_3_new/,https://github.com/OpenAPITools/openapi-generator/releases/tag/v7.10.0,2024-11-18 13:03:03,178,0.88,178,0,30,0,0,False,False,False,False,False,,,t3_1gu478a
programming,Traits are a Local Maxima,,thunderseethe,1guaup7,https://reddit.com/r/programming/comments/1guaup7/traits_are_a_local_maxima/,https://thunderseethe.dev/posts/traits-are-a-local-maxima/,2024-11-18 17:54:14,64,0.84,64,0,18,0,0,False,False,False,False,False,,,t3_1guaup7
programming,Flutter MediaQuery Explained: DevicePixelRatio Made Simple | amplifyabhi,,amplifyabhi,1gvc0pr,https://reddit.com/r/programming/comments/1gvc0pr/flutter_mediaquery_explained_devicepixelratio/,https://youtu.be/kkRUanH5TXk,2024-11-20 00:01:23,0,0.2,0,0,0,0,0,False,False,False,False,False,,,t3_1gvc0pr
programming,Cats-Actors 2.0.0: Production-Ready Functional Actor Model,,kloudmark,1guyhuc,https://reddit.com/r/programming/comments/1guyhuc/catsactors_200_productionready_functional_actor/,https://github.com/suprnation/cats-actors,2024-11-19 14:33:09,0,0.5,0,0,3,0,0,False,False,False,False,False,,,t3_1guyhuc
programming,On Safe Cxx,,MaleficentFig7578,1gv92kl,https://reddit.com/r/programming/comments/1gv92kl/on_safe_cxx/,https://izzys.casa/2024/11/on-safe-cxx/,2024-11-19 21:52:47,0,0.47,0,0,9,0,0,False,False,False,False,False,,,t3_1gv92kl
programming,Collecting and handling result values,,cherry-pie123,1guxkrk,https://reddit.com/r/programming/comments/1guxkrk/collecting_and_handling_result_values/,https://blog.ploeh.dk//2024/11/18/collecting-and-handling-result-values/,2024-11-19 13:50:49,0,0.33,0,0,0,0,0,False,False,False,False,False,,,t3_1guxkrk
programming,How I use 1Password to manage SSH keys for multiple GitHub accounts (including on WSL),,ejmck55,1gv5vce,https://reddit.com/r/programming/comments/1gv5vce/how_i_use_1password_to_manage_ssh_keys_for/,https://gist.github.com/edwhad/a25f728e6add3f6d1f7a483810e9d555,2024-11-19 19:38:22,0,0.41,0,0,5,0,0,False,False,False,False,False,,,t3_1gv5vce
programming,"Microservices Panel • Ian Cooper, James Lewis &amp; Kris Jenkins",,goto-con,1guxky7,https://reddit.com/r/programming/comments/1guxky7/microservices_panel_ian_cooper_james_lewis_kris/,https://youtu.be/JkZvdasAofs,2024-11-19 13:51:05,0,0.29,0,0,0,0,0,False,False,False,False,False,,,t3_1guxky7
programming,"How to design a URL Shortener System on GCP
I just published an article, would be useful for new grades ",,rasvi786,1gv5j9v,https://reddit.com/r/programming/comments/1gv5j9v/how_to_design_a_url_shortener_system_on_gcp_i/,https://medium.com/@rasvihostings/url-shortener-system-on-gcp-56bcc5910c14,2024-11-19 19:24:37,0,0.18,0,0,1,0,0,False,False,False,False,False,,,t3_1gv5j9v
programming,Find a needle in a haystack with git bisect,,orr94,1gu31y4,https://reddit.com/r/programming/comments/1gu31y4/find_a_needle_in_a_haystack_with_git_bisect/,https://sundry.jerryorr.com/2024/11/15/git-bisect,2024-11-18 11:56:43,44,0.86,44,0,7,0,0,False,False,False,False,False,,,t3_1gu31y4
programming,How to Manage Remote Docker Containers Using Go SDK and SSH Tunnel,,Historical_Wing_9573,1gu3jwa,https://reddit.com/r/programming/comments/1gu3jwa/how_to_manage_remote_docker_containers_using_go/,https://vitaliihonchar.com/blog/go/access-to-remote-docker,2024-11-18 12:26:59,23,0.73,23,0,0,0,0,False,False,False,False,False,,,t3_1gu3jwa
programming,Picking the right communication pattern for your microservices,,West-Chard-1474,1gub6nn,https://reddit.com/r/programming/comments/1gub6nn/picking_the_right_communication_pattern_for_your/,https://www.cerbos.dev/blog/inter-service-communication-microservices,2024-11-18 18:07:41,10,0.68,10,0,3,0,0,False,False,False,False,False,,,t3_1gub6nn
programming,Real-Time Video Processing - iPhone Continuity Camera - Active Graph Networks,"Hey r/Programming,

I’ve been working on a project that processes raw iPhone camera data in real time, applying dynamic enhancements like stabilization, UV filtering, and even simulated AC130-style thermal effects. This all runs through a compact, custom-built pipeline using a relational neural network and a 4D programming framework I’ve been experimenting with.

The framework models state changes in video data over time, mapping it into a “4D” structure that includes spatial, temporal, and attribute dimensions. This allows for real-time effects that adapt dynamically as the camera moves or conditions change.

The cool part? It’s running off consumer-grade hardware—a MacBook paired with an iPhone using Continuity Camera as the feed. The framework’s focus is on lightweight, efficient processing that could be adapted for mobile devices or edge computing.

I’m not entirely sure how this compares to how cameras or computers traditionally work, but I think there’s something novel here.

Happy to be told I’m wrong—or that this is just reinventing something better done elsewhere! Either way, I’d love feedback or to hear if this sparks ideas for applications I might not have considered.",Internal_Vibe,1guohc7,https://reddit.com/r/programming/comments/1guohc7/realtime_video_processing_iphone_continuity/,https://youtu.be/mdILzkYX4bU?si=RA_DH6c07gEWsSYS,2024-11-19 04:02:21,1,0.54,1,0,2,0,0,False,False,False,False,False,,,t3_1guohc7
programming,Made a simple spy pixel server using golang,,Serious_Worker_9871,1guwj00,https://reddit.com/r/programming/comments/1guwj00/made_a_simple_spy_pixel_server_using_golang/,https://github.com/YasTheGoat/Spixel,2024-11-19 12:59:02,0,0.21,0,0,0,0,0,False,False,False,False,False,,,t3_1guwj00
programming,"LLQL 0.2.0 has matcher functions for instruction usage, arguments, constants, labels",,AmrDeveloper,1gu9eze,https://reddit.com/r/programming/comments/1gu9eze/llql_020_has_matcher_functions_for_instruction/,https://github.com/AmrDeveloper/LLQL,2024-11-18 16:56:56,4,0.63,4,0,0,0,0,False,False,False,False,False,,,t3_1gu9eze
programming,Building SimpleDB Database From Scratch in Go - Intro to the series,,inelp,1guazsv,https://reddit.com/r/programming/comments/1guazsv/building_simpledb_database_from_scratch_in_go/,https://youtu.be/pWeY93KhF4Q,2024-11-18 18:00:15,6,0.72,6,0,0,0,0,False,False,False,False,False,,,t3_1guazsv
programming,QuickSort en Ponylang,,emanuelpeg,1gupsmm,https://reddit.com/r/programming/comments/1gupsmm/quicksort_en_ponylang/,https://emanuelpeg.blogspot.com/2024/11/quicksort-en-pony.html,2024-11-19 05:15:01,0,0.44,0,0,0,0,0,False,False,False,False,False,,,t3_1gupsmm
programming,New Physics Project - Realistic orbital calculations all in the console!,,NachoTwins,1gtv8ct,https://reddit.com/r/programming/comments/1gtv8ct/new_physics_project_realistic_orbital/,https://www.github.com/NT-Bean/ConsoleAerospaceSim,2024-11-18 03:09:58,52,0.8,52,0,18,0,0,False,False,False,False,False,,,t3_1gtv8ct
programming,IonQ to Advance Hybrid Quantum Computing with New Chemistry Application and NVIDIA CUDA-Q,,donutloop,1gurvq2,https://reddit.com/r/programming/comments/1gurvq2/ionq_to_advance_hybrid_quantum_computing_with_new/,https://ionq.com/news/ionq-to-advance-hybrid-quantum-computing-with-new-chemistry-application-and?utm_source=linkedin&amp;utm_medium=press-release&amp;utm_campaign=nvidia-hybrid&amp;utm_content=press-release&amp;utm_term=45597,2024-11-19 07:35:26,0,0.4,0,0,0,0,0,False,False,False,False,False,,,t3_1gurvq2
programming,"Golang Nugget - November 18, 2024",,ByteVoyagerX,1gu5yky,https://reddit.com/r/programming/comments/1gu5yky/golang_nugget_november_18_2024/,https://mondaynugget.com/golang/2024/11/18/golang-nugget/,2024-11-18 14:28:55,4,0.6,4,0,0,0,0,False,False,False,False,False,,,t3_1gu5yky
programming,"Terminal3d - View 3d Models in your Terminal, Written in Rust 🦀",,liamilan,1gtmrz1,https://reddit.com/r/programming/comments/1gtmrz1/terminal3d_view_3d_models_in_your_terminal/,https://github.com/liam-ilan/terminal3d,2024-11-17 20:26:38,83,0.92,83,0,15,0,0,False,False,False,False,False,,,t3_1gtmrz1
programming,Elixir: Concurrencia Hecha Sencilla,,emanuelpeg,1gunfl7,https://reddit.com/r/programming/comments/1gunfl7/elixir_concurrencia_hecha_sencilla/,https://emanuelpeg.blogspot.com/2024/11/elixir-concurrencia-hecha-sencilla.html,2024-11-19 03:05:45,0,0.29,0,0,0,0,0,False,False,False,False,False,,,t3_1gunfl7
programming,"ChibiHash: Small, Fast 64 bit hash function",,pavel_v,1gtcxlp,https://reddit.com/r/programming/comments/1gtcxlp/chibihash_small_fast_64_bit_hash_function/,https://nrk.neocities.org/articles/chibihash,2024-11-17 12:54:19,243,0.83,243,0,45,0,0,False,False,False,False,False,,,t3_1gtcxlp
programming,C web framework with “kernel like” modules. ,"

I’ve been working on my hobby project inspired by kernel modules. The idea is: write some raw C code, upload it to a server, and it compiles and runs it at runtime. No precompilation, no restarts. :D

C isn’t usually the go-to for web dev (for good reasons), but here’s how I’ve tried to make it less painful:

•	⁠Slow Build Cycles: Upload code, and the server handles the rest—like ""hot reloading,"" but in C.
•	⁠Speed vs. Practicality: Great for scenarios where performance actually matters, like data-heavy or real-time stuff.
•	⁠Memory Management: Modules are isolated, so crashes don’t take everything down.
•	⁠Built-In Libraries: Comes with SQLite3, OpenSSL, and Jansson support to save you from reinventing the wheel.

It’s just a proof of concept, not production-ready (please don’t deploy it), but it’s fun to work on! Would love any feedback on it. It allows for some interesting possibilities, like being able to update WebSocket handlers at runtime without even closing the WebSocket connection.",warothia,1gtieba,https://reddit.com/r/programming/comments/1gtieba/c_web_framework_with_kernel_like_modules/,https://github.com/joexbayer/c-web-modules,2024-11-17 17:15:15,80,0.8,80,0,28,0,0,False,False,False,False,False,,,t3_1gtieba
programming,There's the easy way...,,Paddy3118,1gtrd9k,https://reddit.com/r/programming/comments/1gtrd9k/theres_the_easy_way/,https://paddy3118.blogspot.com/2024/11/theres-easy-way.html?m=1,2024-11-17 23:54:30,22,0.66,22,0,16,0,0,False,False,False,False,False,,,t3_1gtrd9k
programming,A Server Error Got Me a Free Meal (system design story),,No-Bug-242,1gtzpyl,https://reddit.com/r/programming/comments/1gtzpyl/a_server_error_got_me_a_free_meal_system_design/,https://nyadgar.com/posts/a-server-error-got-me-a-free-meal/,2024-11-18 07:48:31,5,0.62,5,0,5,0,0,False,False,False,False,False,,,t3_1gtzpyl
programming,Chrome For Developers Podcast: Squishy Wasm apps using Extism with Dylibso's Steve Manuel,,nilslice,1guh0pp,https://reddit.com/r/programming/comments/1guh0pp/chrome_for_developers_podcast_squishy_wasm_apps/,https://www.youtube.com/watch?v=gJPYvv1flJY,2024-11-18 22:06:34,0,0.45,0,0,0,0,0,False,False,False,False,False,,,t3_1guh0pp
programming,"Framer Motion is now independent, introducing Motion",,getriglad,1gte6ca,https://reddit.com/r/programming/comments/1gte6ca/framer_motion_is_now_independent_introducing/,https://motion.dev/blog/framer-motion-is-now-independent-introducing-motion,2024-11-17 14:01:35,104,0.84,104,0,4,0,0,False,False,False,False,False,,,t3_1gte6ca
programming,Oniguruma-To-ES: An obsessively accurate Ruby to native JavaScript RegExp transpiler that adds many advanced regex features to JS and allows sharing regexes across languages,,slevlife,1gu16db,https://reddit.com/r/programming/comments/1gu16db/onigurumatoes_an_obsessively_accurate_ruby_to/,https://github.com/slevithan/oniguruma-to-es,2024-11-18 09:42:54,3,0.67,3,0,0,0,0,False,False,False,False,False,,,t3_1gu16db
programming,FORTRAN II Hypersource,,texdraft,1gtz9bm,https://reddit.com/r/programming/comments/1gtz9bm/fortran_ii_hypersource/,https://texdraft.github.io/fortran/fortran.html,2024-11-18 07:14:49,4,0.63,4,0,0,0,0,False,False,False,False,False,,,t3_1gtz9bm
programming,I Made My Own Programming Language,,BinaryBillyGoat,1gueqsj,https://reddit.com/r/programming/comments/1gueqsj/i_made_my_own_programming_language/,https://medium.com/humanai/i-made-my-own-programming-language-it-sucks-but-i-love-it-9dd58728fc4f,2024-11-18 20:32:36,0,0.44,0,0,3,0,0,False,False,False,False,False,,,t3_1gueqsj
programming,"Tools and resources to help you build, design, and win hackathons! 🏆",,dogancanbakir,1guej8l,https://reddit.com/r/programming/comments/1guej8l/tools_and_resources_to_help_you_build_design_and/,https://github.com/HappyHackingSpace/Awesome-Hackathon,2024-11-18 20:23:55,0,0.18,0,0,0,0,0,False,False,False,False,False,,,t3_1guej8l
programming,DIY CUSTOM Programmable Mechanical Macro Keyboard with OLED and Encoders/Knobs,,Keyboard_Warrior364,1gtnqs9,https://reddit.com/r/programming/comments/1gtnqs9/diy_custom_programmable_mechanical_macro_keyboard/,https://youtube.com/watch?v=CmnHtQ5szXs&amp;si=ECKLVRqmVcV-5HKF,2024-11-17 21:09:17,11,0.68,11,0,1,0,0,False,False,False,False,False,,,t3_1gtnqs9
programming,How AWS Lambda Supports Container Images up to 10 GiB in Size,,scalablethread,1gtg946,https://reddit.com/r/programming/comments/1gtg946/how_aws_lambda_supports_container_images_up_to_10/,https://newsletter.scalablethread.com/p/rapid-scaling-in-faas-high-performance,2024-11-17 15:41:49,24,0.71,24,0,2,0,0,False,False,False,False,False,,,t3_1gtg946
programming,How to  Create a Responsive Periodic Table of Elements Using HTML and CSS only?,,shokatjaved,1gubcti,https://reddit.com/r/programming/comments/1gubcti/how_to_create_a_responsive_periodic_table_of/,https://youtu.be/9yoUUlyPqP8,2024-11-18 18:14:42,0,0.22,0,0,1,0,0,False,False,False,False,False,,,t3_1gubcti
programming,Watch the Web AI Summit 2024 videos,,feross,1guazsy,https://reddit.com/r/programming/comments/1guazsy/watch_the_web_ai_summit_2024_videos/,https://web.dev/blog/web-ai-summit-2024-recap?hl=en,2024-11-18 18:00:15,0,0.23,0,0,0,0,0,False,False,False,False,False,,,t3_1guazsy
programming,Coding + Maths = Art - The Beauty of the Balanced Centrifuge Challenge with a Miraculous One-Liner!,,The_Random_Coder,1gu8y77,https://reddit.com/r/programming/comments/1gu8y77/coding_maths_art_the_beauty_of_the_balanced/,https://www.youtube.com/watch?v=MRnbFSTC6cs,2024-11-18 16:37:49,0,0.22,0,0,0,0,0,False,False,False,False,False,,,t3_1gu8y77
programming,Access Remote Servers with SSH ProxyJump and Jump Hosts,,bishakhghosh_,1gtw8cb,https://reddit.com/r/programming/comments/1gtw8cb/access_remote_servers_with_ssh_proxyjump_and_jump/,https://pinggy.io/blog/accessing_remote_servers_with_ssh_proxyjump_and_jump_hosts/,2024-11-18 04:04:39,4,0.59,4,0,0,0,0,False,False,False,False,False,,,t3_1gtw8cb
programming,How to Build an MVP in 30 days,,alexlazar98,1gu9o5h,https://reddit.com/r/programming/comments/1gu9o5h/how_to_build_an_mvp_in_30_days/,https://leetsoftware.com/how-to-build-an-mvp-in-30-days-without-blowing-your-budget/,2024-11-18 17:06:51,0,0.4,0,0,0,0,0,False,False,False,False,False,,,t3_1gu9o5h
programming,Good software development habits,,fagnerbrack,1gt4f50,https://reddit.com/r/programming/comments/1gt4f50/good_software_development_habits/,https://zarar.dev/good-software-development-habits/,2024-11-17 03:17:25,163,0.87,163,0,64,0,0,False,False,False,False,False,,,t3_1gt4f50
programming,Database anonymization tool release. Greenmask v0.2.4,,anyweny,1gu0kii,https://reddit.com/r/programming/comments/1gu0kii/database_anonymization_tool_release_greenmask_v024/,https://github.com/GreenmaskIO/greenmask/releases/tag/v0.2.4,2024-11-18 08:54:46,0,0.43,0,0,0,0,0,False,False,False,False,False,,,t3_1gu0kii
programming,Automating the pain away: about using command line and LLMs to stay sane,,realflakm,1gu54or,https://reddit.com/r/programming/comments/1gu54or/automating_the_pain_away_about_using_command_line/,https://flakm.com/posts/automate_boring_stuff/,2024-11-18 13:50:17,0,0.27,0,0,0,0,0,False,False,False,False,False,,,t3_1gu54or
programming,Boosting Postgres INSERT Performance by 50% With UNNEST,,jamesgresql,1gsylyv,https://reddit.com/r/programming/comments/1gsylyv/boosting_postgres_insert_performance_by_50_with/,https://www.timescale.com/blog/boosting-postgres-insert-performance/,2024-11-16 22:21:20,266,0.93,266,0,29,0,0,False,False,False,False,False,,,t3_1gsylyv
programming,"It’s dangerous to go alone: take our guide to the ""IDEAL"" HTTP client! (Examples in Ruby)",,alexeyr,1gu6c2b,https://reddit.com/r/programming/comments/1gu6c2b/its_dangerous_to_go_alone_take_our_guide_to_the/,https://evilmartians.com/chronicles/its-dangerous-to-go-alone-take-our-guide-to-the-ideal-http-client,2024-11-18 14:45:59,0,0.27,0,0,2,0,0,False,False,False,False,False,,,t3_1gu6c2b
programming,Can OSSPledge Fix Open Source Sustainability?,,Practical-Ideal6236,1gtjqcz,https://reddit.com/r/programming/comments/1gtjqcz/can_osspledge_fix_open_source_sustainability/,https://www.trevorlasn.com/blog/can-open-source-pledge-fix-open-source-sustainability,2024-11-17 18:13:06,8,0.6,8,0,19,0,0,False,False,False,False,False,,,t3_1gtjqcz
programming,Learn these simple tricks before using GitHub Copilot,,Special_Community179,1gu8cs6,https://reddit.com/r/programming/comments/1gu8cs6/learn_these_simple_tricks_before_using_github/,https://www.youtube.com/watch?v=3bABOqTkELE,2024-11-18 16:13:19,0,0.2,0,0,1,0,0,False,False,False,False,False,,,t3_1gu8cs6
programming,No one wants to hire you. Now what?,,joyancefa,1gu599l,https://reddit.com/r/programming/comments/1gu599l/no_one_wants_to_hire_you_now_what/,https://www.frontendjoy.com/p/no-one-wants-to-hire-you-now-what,2024-11-18 13:56:29,0,0.33,0,0,8,0,0,False,False,False,False,False,,,t3_1gu599l
programming,FOSS JSON Schema Editor,,hyperaeolian,1gtquy3,https://reddit.com/r/programming/comments/1gtquy3/foss_json_schema_editor/,https://github.com/Clarabase/json-schema-editor,2024-11-17 23:30:04,2,0.67,2,0,0,0,0,False,False,False,False,False,,,t3_1gtquy3
programming,System Design Part 1: Building a Simple Load Balancer,,JLC007007,1gu3zmb,https://reddit.com/r/programming/comments/1gu3zmb/system_design_part_1_building_a_simple_load/,https://conradlotz.com/system-design-part-1-building-a-simple-load-balancer/,2024-11-18 12:52:01,0,0.44,0,0,6,0,0,False,False,False,False,False,,,t3_1gu3zmb
programming,JWST- A JavaScript-to-WebAssembly Static Translator,,guest271314,1gtv42d,https://reddit.com/r/programming/comments/1gtv42d/jwst_a_javascripttowebassembly_static_translator/,https://lists.w3.org/Archives/Public/www-archive/2023Sep/att-0021/W3C-TPAC-JWST-Beihang-ShiXiaohua-final.pdf,2024-11-18 03:03:23,0,0.5,0,0,37,0,0,False,False,False,False,False,,,t3_1gtv42d
programming,Building a real-time chat using WebSockets over HTTP/2 streams,,c410-f3r,1gttu5v,https://reddit.com/r/programming/comments/1gttu5v/building_a_realtime_chat_using_websockets_over/,https://c410-f3r.github.io/thoughts/building-a-real-time-chat-using-web-sockets-over-http2-streams/,2024-11-18 01:56:08,2,0.51,2,0,25,0,0,False,False,False,False,False,,,t3_1gttu5v
programming,Time to Bash the Bash Language,,Due_Block_3054,1gu69nz,https://reddit.com/r/programming/comments/1gu69nz/time_to_bash_the_bash_language/,https://blog.smidt.dev/posts/2024-10-20-no-bash-script/,2024-11-18 14:42:59,0,0.25,0,0,17,0,0,False,False,False,False,False,,,t3_1gu69nz
programming,How Databases Keep Passwords Securely,,sdxyz42,1gu4lmi,https://reddit.com/r/programming/comments/1gu4lmi/how_databases_keep_passwords_securely/,https://newsletter.systemdesign.one/p/how-to-store-passwords-in-database,2024-11-18 13:24:14,0,0.36,0,0,10,0,0,False,False,False,False,False,,,t3_1gu4lmi
programming,Fantastic talk about pre-mortem and decision making under stress,,fagnerbrack,1gti5k7,https://reddit.com/r/programming/comments/1gti5k7/fantastic_talk_about_premortem_and_decision/,https://www.ted.com/talks/daniel_levitin_how_to_stay_calm_when_you_know_you_ll_be_stressed,2024-11-17 17:05:17,4,0.58,4,0,1,0,0,False,False,False,False,False,,,t3_1gti5k7
programming,What Challenges Does Generative AI Face with Respect to Data,,AzilenTech,1gu1dyy,https://reddit.com/r/programming/comments/1gu1dyy/what_challenges_does_generative_ai_face_with/,https://www.azilen.com/blog/what-challenges-does-generative-ai-face-with-respect-to-data/,2024-11-18 09:59:49,0,0.11,0,0,0,0,0,False,False,False,False,False,,,t3_1gu1dyy
programming,An Engineer’s Checklist of Logging Best Practices,,pmz,1gsnso0,https://reddit.com/r/programming/comments/1gsnso0/an_engineers_checklist_of_logging_best_practices/,https://www.honeycomb.io/blog/engineers-checklist-logging-best-practices,2024-11-16 13:56:17,465,0.87,465,0,80,0,0,False,False,False,False,False,,,t3_1gsnso0
programming,Partitions and Compositions,,hmeh922,1gtui5l,https://reddit.com/r/programming/comments/1gtui5l/partitions_and_compositions/,https://github.com/aaronjensen/software-development/blob/master/partitions-and-compositions.md#partitions-and-compositions,2024-11-18 02:30:55,0,0.38,0,0,0,0,0,False,False,False,False,False,,,t3_1gtui5l
programming,What To Use Instead of PGP,,ScottContini,1gt97jd,https://reddit.com/r/programming/comments/1gt97jd/what_to_use_instead_of_pgp/,https://soatok.blog/2024/11/15/what-to-use-instead-of-pgp/,2024-11-17 08:30:30,6,0.53,6,0,51,0,0,False,False,False,False,False,,,t3_1gt97jd
