subreddit,title,selftext,author,id,permalink,url,created_utc,score,upvote_ratio,ups,downs,num_comments,total_awards_received,gilded,is_video,is_original_content,is_self,over_18,spoiler,link_flair_text,thumbnail,name
programming,The State of the Subreddit (May 2024),"Hello fellow programs! 

**tl;dr** some revisions to the rules to reduce low quality blogspam. The most notable are: banning **listicles** (""7 cool things I copy-pasted from somebody else!""), **extreme beginner articles** (""how to use a for loop""), and some **limitations on career posts** (they must be related to programming careers). Lastly, I want **feedback** on these changes and the subreddit in general and invite you to **vote** and **use the report button** when you see posts that violate the rules because they'll help us get to it faster.

r/programming's mission is to **be the place with the highest quality programming content, where I can go to read something interesting and learn something new every day**. [Last time we spoke](https://www.reddit.com/r/programming/comments/173viwj/meta_the_future_of_rprogramming/) I introduced the rules that we've been moderating by to accomplish that. Subjectively, quality on the subreddit while not perfect is much improved since then. Since it's still mainly just me moderating it's hard to tell what's objectively bad vs what just annoys me personally, and to do that I've been keeping an eye on a few forms of content to see how they perform (using mostly votes and comment quantity &amp; health).

Based on that the notable changes are:

* 🚫 **Listicles**. ""7 cool python functions"", ""14 ways to get promoted"". These are usually spammy content farms. If you found 15 amazing open source projects that will blow my mind, post those projects instead.
* 🚫 **Extreme beginner content** (""how to write a for loop""). This is difficult to identify objectively (how can you tell it from good articles like ""how does kafka work?"" or ""getting started with linear algebra for ML""?) so there will be some back and forth on calibrating, but there has been a swath of very low quality [""tutorials""](https://www.reddit.com/r/programming/comments/1chogwb/first_program_of_java/) if you can even call them that, that I very much doubt anybody is actually learning anything from and they sit at 0 points. Since ""what is a variable?"" is probably not useful to anybody already reading r/programming this is a quick painless way to boost the average quality on the subreddit.
* ⚠️ **Career posts must be related to software engineering careers**. To be honest I'm personally not a fan of career posts on r/programming at all (but shout out to [cscareerquestions](https://www.reddit.com/r/cscareerquestions/)!) but during the last rules revision they were doing pretty well so I know there is an audience for it that I don't want to get in the way of. Since then there has been growth in this category [all across the quality spectrum](https://www.reddit.com/domain/eng-leadership.com/) (with an accompanying rise in product management methodology like ""agile vs waterfall"", also across the quality spectrum). Going forward these posts must be distinctly related to software engineering careers rather than just generic working. This isn't a huge problem yet but I predict that it will be as the percentage of career content is growing.

In all of these cases the category is more of a tell that the quality is probably low, so exceptions will be made where that's not the case. These are difficult categories to moderate by so I'll **probably make some mistakes** on the boundaries and that's okay, let me know and we'll figure it out.

Some other categories that I'm **keeping an eye on** but not ruling on today are:

* **Corporate blogs** simply describing their product in the guise of ""what is an authorisation framework?"" (I'm [looking at you Auth0](https://www.reddit.com/domain/a0.to/) and [others like it](https://www.reddit.com/r/programming/comments/1cgx739/what_is_ai_infrastructure_software/)). Pretty much anything with a rocket ship emoji in it. Companies use their blogs as marketing, branding, and recruiting tools and that's okay when it's ""writing a good article will make people think of us"" but it doesn't go here if it's just a literal advert. Usually they are titled in a way that I don't spot them until somebody reports it or mentions it in the comments.
* **Generic AI content** that [isn't](https://www.reddit.com/r/programming/comments/1chll2o/ai_still_hasnt_figured_out_branding_yet_heres_why/) technical in content. ""Does Devin mean that programming is over?"", ""Will AI put farmers out of work?"", ""Is AI art?"". For a few weeks these were the titles of about 20 articles per day, some scoring high and some low. Fashions like this come and go but I'm keeping an eye on it.
* **Newsletters**: There are a [few people](https://www.reddit.com/r/programming/comments/1cho9ye/big_tech_digest_15_introducing_meta_llama_3_at/) that post every edition of their newsletter to reddit, where that newsletter is really just aggregating content from elsewhere. It's clear that they are trying to grow a monetised audience using reddit, but that's okay if it's providing valuable curation or if the content is good and people like it. So we'll see.
* **Career posts**. Personally I'd like r/programming to be a deeply technical place but as mentioned there's clearly an audience for career advice. That said, the posts that are scoring the highest in this category are mostly people upvoting to agree with a statement in the title, not something that anybody is learning from. (""Don't make your engineers context-switch."" ""Everybody should get private offices."" ""Micromanaging sucks."") The ones that one could actually learn from with an instructive lean mostly don't do well; people seem to not really be interested in how to have the best 1:1s with their managers or how you went from Junior to Senior in 18 hours (though [sometimes they are](https://www.reddit.com/domain/highgrowthengineer.com/)). That tells me that there's some subtlety to why these posts are scoring well and I'm keeping an eye on the category. What I don't want is for ""vote up if you want free snacks"" to push out the good stuff or to be a farm for the other 90% of content that's really just personal brand builders.

I'm sure you're as annoyed as I am about these but they're fuzzy lines and difficult to come up with objective criteria around. As always **I'm looking for feedback** on these and if I'm missing any and any other points regarding the subreddit and moderation so let me know what you think.

------

## The rules!

With all of that, here is the current set of the rules with the above changes included so I can link to them all in one place.

✅ means that it's currently allowed, 🚫 means that it's not currently allowed, ⚠️ means that we leave it up if it is already popular but if we catch it young in its life we do try to remove it early.

* ✅ Actual programming content. They probably have actual code in them. Language or library writeups, papers, technology descriptions. How an allocator works. How my new fancy allocator I just wrote works. How our startup built our Frobnicator. For many years this was the only category of allowed content.
* ✅ Academic CS or programming papers
* ✅ Programming news. ChatGPT can write code. A big new CVE just dropped. Curl 8.01 released now with Coffee over IP support.
* ✅ Programmer career content. How to become a Staff engineer in 30 days. Habits of the best engineering managers. These must be related or specific to programming/software engineering careers in some way
* ✅ Articles/news interesting *to* programmers but not about programming. Work from home is bullshit. Return to office is bullshit. There's a Steam sale on programming games. Terry Davis has died. How to SCRUMM. App Store commissions are going up. How to hire a more diverse development team. Interviewing programmers is broken.
* ⚠️ General technology news. Google buys its last competitor. A self driving car hit a pedestrian. Twitter is collapsing. Oculus accidentally showed your grandmother a penis. Github sued when Copilot produces the complete works of Harry Potter in a code comment. Meta cancels work from home. Gnome dropped a feature I like. How to run Stable Diffusion to generate pictures of, uh, cats, yeah it's definitely just for cats. A bitcoin VR metaversed my AI and now my app store is mobile social local.
* 🚫 Politics. The Pirate Party is winning in Sweden. Please vote for net neutrality. Big Tech is being sued in Europe for *gestures broadly*. Grace Hopper Conference is now 60% male.
* 🚫 Gossip. Richard Stallman switches to Windows. Elon Musk farted. Linus Torvalds was a poopy-head on a mailing list. The People's Rust Foundation is arguing with the Rust Foundation For The People. Terraform has been forked into Terra and Form. Stack Overflow sucks now. Stack Overflow is good actually.
* ✅ Demos with code. I wrote a game, here it is on GitHub
* 🚫 Demos without code. I wrote a game, come buy it! Please give me feedback on my startup (totally not an ad nosirree). I stayed up all night writing a commercial text editor, here's the pricing page. I made a DALL-E image generator. I made the fifteenth animation of A* this week, here's a GIF.
* 🚫 AskReddit type forum questions. What's your favourite programming language? Tabs or spaces? Does anyone else hate it when.
* 🚫 Support questions. How do I write a web crawler? How do I get into programming? Where's my missing semicolon? Please do this obvious homework problem for me. Personally I feel very strongly about not allowing these because they'd quickly drown out all of the actual content I come to see, and there are already much more effective places to get them answered anyway. In real life the quality of the ones that we see is also universally very low.
* 🚫 Surveys and 🚫 Job postings and anything else that is looking to extract value from a place a lot of programmers hang out without contributing anything itself.
* 🚫 Meta posts. DAE think r/programming sucks? Why did you remove my post? Why did you ban this user that is totes not me I swear I'm just asking questions. Except this meta post. This one is okay because I'm a tyrant that the rules don't apply to (I assume you are saying about me to yourself right now).
* 🚫 Images, memes, anything low-effort or low-content. Thankfully we very rarely see any of this so there's not much to remove but like support questions once you have a few of these they tend to totally take over because it's easier to make a meme than to write a paper and also easier to vote on a meme than to read a paper.
* ⚠️ Posts that we'd normally allow but that are obviously, unquestioningly super low quality like blogspam copy-pasted onto a site with a bazillion ads. It has to be pretty bad before we remove it and even then sometimes these are the first post to get traction about a news event so we leave them up if they're the best discussion going on about the news event. There's a lot of grey area here with CVE announcements in particular: there are a lot of spammy security ""blogs"" that syndicate stories like this. Pretty much all listicles are disallowed under this rule. 7 cool python functions. 14 ways to get promoted. If you found 15 amazing open source projects that will blow my mind, post those projects instead.
* ⚠️ Extreme beginner content. What is a variable. What is a `for` loop. Making an HTPT request using curl. Like listicles this is disallowed because of the quality typical to them, but high quality tutorials are still allowed and actively encouraged.
* ⚠️ Posts that are duplicates of other posts or the same news event. We leave up either the first one or the healthiest discussion.
* ⚠️ Posts where the title editorialises too heavily or especially is a lie or conspiracy theory.
* Comments are only very loosely moderated and it's mostly 🚫 Bots of any kind (Beep boop you misspelled misspelled!) and 🚫 Incivility (You idiot, everybody knows that my favourite toy is better than your favourite toy.)
However the number of obvious GPT comment bots is rising and will quickly become untenable for the number of active moderators we have.",ketralnis,1chs4ib,https://reddit.com/r/programming/comments/1chs4ib/the_state_of_the_subreddit_may_2024/,https://www.reddit.com/r/programming/comments/1chs4ib/the_state_of_the_subreddit_may_2024/,2024-05-01 17:37:38,658,0.97,658,0,154,0,0,False,False,True,False,False,,,t3_1chs4ib
programming,Bruno: Open-Source and Git-friendly API Client ,"So happy I found an easy to use, free no stupid extras api client! ",JollyShopland,1h2wcei,https://reddit.com/r/programming/comments/1h2wcei/bruno_opensource_and_gitfriendly_api_client/,https://youtu.be/FXckKHtZo4o,2024-11-29 21:28:43,189,0.83,189,0,74,0,0,False,False,False,False,False,,,t3_1h2wcei
programming,Django and Postgres for the Busy Rails Developer,,andatki,1h3c4bw,https://reddit.com/r/programming/comments/1h3c4bw/django_and_postgres_for_the_busy_rails_developer/,https://andyatkinson.com/django-python-postgres-busy-rails-developer,2024-11-30 13:02:12,5,1.0,5,0,0,0,0,False,False,False,False,False,,,t3_1h3c4bw
programming,Slow Deployment Causes Meetings,,fagnerbrack,1h2vr5x,https://reddit.com/r/programming/comments/1h2vr5x/slow_deployment_causes_meetings/,https://tidyfirst.substack.com/p/slow-deployment-causes-meetings,2024-11-29 21:01:30,63,0.79,63,0,5,0,0,False,False,False,False,False,,,t3_1h2vr5x
programming,How PlayStation Graphics &amp; Visual Artefacts Work,,rom1v,1h2nutt,https://reddit.com/r/programming/comments/1h2nutt/how_playstation_graphics_visual_artefacts_work/,https://pikuma.com/blog/how-to-make-ps1-graphics,2024-11-29 15:11:10,154,0.94,154,0,15,0,0,False,False,False,False,False,,,t3_1h2nutt
programming,Queueing - an interactive study on queueing strategies,,konaraddi,1h2vgcl,https://reddit.com/r/programming/comments/1h2vgcl/queueing_an_interactive_study_on_queueing/,https://encore.dev/blog/queueing,2024-11-29 20:47:43,51,0.86,51,0,2,0,0,False,False,False,False,False,,,t3_1h2vgcl
programming,Concurrency diagrams,,philboooo,1h3d0tu,https://reddit.com/r/programming/comments/1h3d0tu/concurrency_diagrams/,https://philbooth.me/blog/concurrency-diagrams,2024-11-30 13:53:02,1,1.0,1,0,0,0,0,False,False,False,False,False,,,t3_1h3d0tu
programming,Practical JavaScript debugging tips to improve your workflow,,Alternative_Ball_895,1h3cf6k,https://reddit.com/r/programming/comments/1h3cf6k/practical_javascript_debugging_tips_to_improve/,https://medium.com/@all.technology.stories/mastering-javascript-debugging-tips-you-can-use-today-13fc3bab8a28?source=friends_link&amp;sk=5fc6dbc88f4f968b8bd765ab5e4b53c2,2024-11-30 13:19:24,0,0.33,0,0,2,0,0,False,False,False,False,False,,,t3_1h3cf6k
programming,An Illustrated Proof of the CAP Theorem,,fagnerbrack,1h38r86,https://reddit.com/r/programming/comments/1h38r86/an_illustrated_proof_of_the_cap_theorem/,https://mwhittaker.github.io/blog/an_illustrated_proof_of_the_cap_theorem/,2024-11-30 09:07:23,2,0.6,2,0,3,0,0,False,False,False,False,False,,,t3_1h38r86
programming,Understanding small world networks with interactive simulations,,sanity,1h2xi7o,https://reddit.com/r/programming/comments/1h2xi7o/understanding_small_world_networks_with/,https://freenet.org/news/small-world-networks/,2024-11-29 22:22:17,14,0.74,14,0,1,0,0,False,False,False,False,False,,,t3_1h2xi7o
programming,A dead simple command line journal (encrypted entries &amp; almost no dependencies),,nilz_bilz,1h3bdh2,https://reddit.com/r/programming/comments/1h3bdh2/a_dead_simple_command_line_journal_encrypted/,https://github.com/nilz-bilz/cli-jrnl,2024-11-30 12:16:35,1,0.67,1,0,0,0,0,False,False,False,False,False,,,t3_1h3bdh2
programming,LocalStorage vs. IndexedDB vs. Cookies vs. OPFS vs. WASM-SQLite,,stackoverflooooooow,1h2c2q3,https://reddit.com/r/programming/comments/1h2c2q3/localstorage_vs_indexeddb_vs_cookies_vs_opfs_vs/,https://rxdb.info/articles/localstorage-indexeddb-cookies-opfs-sqlite-wasm.html,2024-11-29 02:52:57,439,0.94,439,0,62,0,0,False,False,False,False,False,,,t3_1h2c2q3
programming,How to Implement Undo/Redo for a Half-Edge Data Structure?,,innochenti,1h37q5v,https://reddit.com/r/programming/comments/1h37q5v/how_to_implement_undoredo_for_a_halfedge_data/,http://alexsyniakov.com/2024/11/27/how-to-implement-undo-redo-for-a-half-edge-data-structure/,2024-11-30 07:52:56,2,0.75,2,0,0,0,0,False,False,False,False,False,,,t3_1h37q5v
programming,On Histograms in Decision Making,,radekmie,1h39cwy,https://reddit.com/r/programming/comments/1h39cwy/on_histograms_in_decision_making/,https://radekmie.dev/blog/on-histograms-in-decision-making/,2024-11-30 09:52:18,1,0.6,1,0,0,0,0,False,False,False,False,False,,,t3_1h39cwy
programming,"Homemade incremental programming, part 1: how and why to abolish update code, and what React has to do with anything",,tmewett,1h3ck6a,https://reddit.com/r/programming/comments/1h3ck6a/homemade_incremental_programming_part_1_how_and/,https://tmewett.com/homemade-incremental-pt-1/,2024-11-30 13:27:09,0,0.38,0,0,1,0,0,False,False,False,False,False,,,t3_1h3ck6a
programming,How 2 enhances OpenAI O1 response ,I found some tips for using OpenAI O1,[deleted],1h3c79n,https://reddit.com/r/programming/comments/1h3c79n/how_2_enhances_openai_o1_response/,https://www.mmtool.top/blog/self-correction-enhances-openai-o1-reasoning,2024-11-30 13:06:49,0,0.2,0,0,0,0,0,False,False,False,False,False,,,t3_1h3c79n
programming,Google's Rust Adoption Cuts Android Memory Vulnerabilities by 68%,,CuriousActive2322,1h3d2xw,https://reddit.com/r/programming/comments/1h3d2xw/googles_rust_adoption_cuts_android_memory/,https://medium.com/@bchr56284/googles-rust-adoption-cuts-android-memory-vulnerabilities-by-68-043c5b5acff8,2024-11-30 13:56:14,0,0.38,0,0,1,0,0,False,False,False,False,False,,,t3_1h3d2xw
programming,Microcontroller Bootloaders: Boxing up - Part 3 of a series on microcontrollers and how to update them,,Shad_Amethyst,1h2oy6e,https://reddit.com/r/programming/comments/1h2oy6e/microcontroller_bootloaders_boxing_up_part_3_of_a/,https://shadamethyst.xyz/blog/bootloader-boxing-up/,2024-11-29 16:01:54,11,0.81,11,0,9,0,0,False,False,False,False,False,,,t3_1h2oy6e
programming,"Atomic Agents - A no-bullshit lightweight true framework for integrating (Agentic) AI in a way that stays true to good programming principles. For real developers, by real developers.",,TheDeadlyPretzel,1h3aki8,https://reddit.com/r/programming/comments/1h3aki8/atomic_agents_a_nobullshit_lightweight_true/,https://github.com/BrainBlend-AI/atomic-agents,2024-11-30 11:21:05,0,0.29,0,0,2,0,0,False,False,False,False,False,,,t3_1h3aki8
programming,JavaScript Interactive Quiz,"For my JS interview, I was bored of scrolling through the GitHub repo of some famous JS trivia questions repo so ended up creating an interactive JS Quiz game. 

Though I wanted to learn, I hardly learnt anything, spent entire time building this.

(In my defence, I spend time playing JS quiz instead of scrolling Reddit while in toilet)
 
I know this is nothing fancy, but might help you to revise concepts before the interview.

Feedback, Suggestions, PR welcome.

Repo link : https://github.com/ishwarrimal/javascript-quiz",theHumbleBeing,1h39ouh,https://reddit.com/r/programming/comments/1h39ouh/javascript_interactive_quiz/,https://ishwarrimal.github.io/javascript-quiz/,2024-11-30 10:16:41,0,0.13,0,0,3,0,0,False,False,False,False,False,,,t3_1h39ouh
programming,Exploring Text Segmentation in Retrieval-Augmented Generation (RAG),,Only_Piccolo5736,1h36sgw,https://reddit.com/r/programming/comments/1h36sgw/exploring_text_segmentation_in_retrievalaugmented/,https://pieces.app/blog/text-segmentation-in-rag?utm_source=reddit&amp;utm_medium=referral&amp;utm_campaign=r10,2024-11-30 06:46:52,0,0.17,0,0,0,0,0,False,False,False,False,False,,,t3_1h36sgw
programming,Scams In Software Engineering,,Distinct-Curve-660,1h3cp5p,https://reddit.com/r/programming/comments/1h3cp5p/scams_in_software_engineering/,https://www.youtube.com/watch?v=8hjqZ7EIc0k,2024-11-30 13:34:49,0,0.06,0,0,9,0,0,False,False,False,False,False,,,t3_1h3cp5p
programming,Disillusioning the Magic of the fork System Call,,jaromil,1h2k701,https://reddit.com/r/programming/comments/1h2k701/disillusioning_the_magic_of_the_fork_system_call/,https://blog.codingconfessions.com/p/the-magic-of-fork,2024-11-29 11:55:35,5,0.63,5,0,1,0,0,False,False,False,False,False,,,t3_1h2k701
programming,How Much Memory Do You Need in 2024 to Run 1 Million Concurrent Tasks?,,hez2010,1h22aq6,https://reddit.com/r/programming/comments/1h22aq6/how_much_memory_do_you_need_in_2024_to_run_1/,https://hez2010.github.io/async-runtimes-benchmarks-2024/,2024-11-28 18:23:13,149,0.81,149,0,106,0,0,False,False,False,False,False,,,t3_1h22aq6
programming,Weaponizing SSO for profit -- a rage blog post to be able to move on with my life,,--raz,1h1unbl,https://reddit.com/r/programming/comments/1h1unbl/weaponizing_sso_for_profit_a_rage_blog_post_to_be/,https://raz.sh/blog/2024-11-27_weaponizing_sso_for_profit,2024-11-28 12:13:28,374,0.94,374,0,94,0,0,False,False,False,False,False,,,t3_1h1unbl
programming,Top 50 MERN Stack Interview Questions and Answers ,,Latter-Dust8587,1h36rr0,https://reddit.com/r/programming/comments/1h36rr0/top_50_mern_stack_interview_questions_and_answers/,https://makemychance.com/top-50-mern-stack-interview-questions-and-answers/,2024-11-30 06:45:29,0,0.18,0,0,2,0,0,False,False,False,False,False,,,t3_1h36rr0
programming,"Online Spanish-Language Coding Dojo: TDD &amp; Pair Programming Practice (Dec 11, Free)",,rkasper,1h31ax9,https://reddit.com/r/programming/comments/1h31ax9/online_spanishlanguage_coding_dojo_tdd_pair/,https://www.eventbrite.com/e/dojo-de-codificacion-global-en-linea-tickets-1093680540939,2024-11-30 01:28:41,0,0.38,0,0,0,0,0,False,False,False,False,False,,,t3_1h31ax9
programming,OReilly Black Friday - 22 Coding Books for $25 - Solid Titles,,YellowTime9637,1h24dvo,https://reddit.com/r/programming/comments/1h24dvo/oreilly_black_friday_22_coding_books_for_25_solid/,https://www.humblebundle.com/books/coding-cookbooks-2024-oreilly-books?hmb_source=,2024-11-28 20:00:02,52,0.79,52,0,11,0,0,False,False,False,False,False,,,t3_1h24dvo
programming,Cedit: A Single-File C Text Editor That Runs Everywhere (Even Your Router) ,,This-Percentage5049,1h2udam,https://reddit.com/r/programming/comments/1h2udam/cedit_a_singlefile_c_text_editor_that_runs/,https://github.com/chaitanyarahalkar/Cedit,2024-11-29 19:58:35,0,0.46,0,0,0,0,0,False,False,False,False,False,,,t3_1h2udam
programming,Practices of Reliable Software Design,,fagnerbrack,1h2huc9,https://reddit.com/r/programming/comments/1h2huc9/practices_of_reliable_software_design/,https://entropicthoughts.com/practices-of-reliable-software-design,2024-11-29 09:08:01,3,0.57,3,0,1,0,0,False,False,False,False,False,,,t3_1h2huc9
programming,Not My Philosophy of Software Design,,Master-Region-140,1h2yxfl,https://reddit.com/r/programming/comments/1h2yxfl/not_my_philosophy_of_software_design/,https://andremoniy.medium.com/not-my-philosophy-of-software-design-13d9f1e09451,2024-11-29 23:29:56,0,0.29,0,0,5,0,0,False,False,False,False,False,,,t3_1h2yxfl
programming,You can use C-Reduce for any language,,mmaksimovic,1h1sd3d,https://reddit.com/r/programming/comments/1h1sd3d/you_can_use_creduce_for_any_language/,https://bernsteinbear.com/blog/creduce/,2024-11-28 09:34:33,115,0.94,115,0,15,0,0,False,False,False,False,False,,,t3_1h1sd3d
programming,ExeViewer: A Command Line Executable Viewer Written in Rust,,sunxfancy,1h2uyb2,https://reddit.com/r/programming/comments/1h2uyb2/exeviewer_a_command_line_executable_viewer/,https://github.com/sunxfancy/ExeViewer,2024-11-29 20:24:49,0,0.29,0,0,7,0,0,False,False,False,False,False,,,t3_1h2uyb2
programming,Shrinking a Postgres Table,,craigkerstiens,1h204jt,https://reddit.com/r/programming/comments/1h204jt/shrinking_a_postgres_table/,https://www.johnnunemaker.com/shrinking-a-postgres-table/,2024-11-28 16:46:54,21,0.75,21,0,3,0,0,False,False,False,False,False,,,t3_1h204jt
programming,The Copenhagen Book,,fagnerbrack,1h2qe0w,https://reddit.com/r/programming/comments/1h2qe0w/the_copenhagen_book/,https://thecopenhagenbook.com/,2024-11-29 17:05:36,0,0.23,0,0,2,0,0,False,False,False,False,False,,,t3_1h2qe0w
programming,Unusual Git IDs,,FoxInTheRedBox,1h1vl2b,https://reddit.com/r/programming/comments/1h1vl2b/unusual_git_ids/,https://www.bryanbraun.com/2024/11/19/unusual-git-ids/,2024-11-28 13:08:18,27,0.61,27,0,8,0,0,False,False,False,False,False,,,t3_1h1vl2b
programming,WebBuild,,PenaltyLower1814,1h2qv8i,https://reddit.com/r/programming/comments/1h2qv8i/webbuild/,http://webbuild.js.org/,2024-11-29 17:26:13,0,0.2,0,0,0,0,0,False,False,False,False,False,,,t3_1h2qv8i
programming,About 10% of developers 'do virtually nothing',,shift_devs,1h2p268,https://reddit.com/r/programming/comments/1h2p268/about_10_of_developers_do_virtually_nothing/,https://shiftmag.dev/ghost-engineers-stanford-study-4643/,2024-11-29 16:06:43,0,0.4,0,0,16,0,0,False,False,False,False,False,,,t3_1h2p268
programming,Code coverage doesn't matter much,,ahuth,1h2oosn,https://reddit.com/r/programming/comments/1h2oosn/code_coverage_doesnt_matter_much/,https://andrewhuth.substack.com/p/code-coverage-doesnt-matter-much,2024-11-29 15:50:03,0,0.19,0,0,27,0,0,False,False,False,False,False,,,t3_1h2oosn
programming,Deno v. Oracle: Canceling the JavaScript Trademark,,asantos3,1h14kc9,https://reddit.com/r/programming/comments/1h14kc9/deno_v_oracle_canceling_the_javascript_trademark/,https://deno.com/blog/deno-v-oracle,2024-11-27 13:41:35,581,0.96,581,0,149,0,0,False,False,False,False,False,,,t3_1h14kc9
