subreddit,title,selftext,author,id,permalink,url,created_utc,score,upvote_ratio,ups,downs,num_comments,total_awards_received,gilded,is_video,is_original_content,is_self,over_18,spoiler,link_flair_text,thumbnail,name
gaming,Season 0: Dooms' Rise Official Trailer | Marvel Rivals,,critxcanuck88,1h7mnkz,https://reddit.com/r/gaming/comments/1h7mnkz/season_0_dooms_rise_official_trailer_marvel_rivals/,https://youtube.com/watch?v=jyCJbGUsUkc&amp;si=ZdRttYJB6Q4TLF1T,2024-12-05 23:06:49,0,0.47,0,0,9,0,0,False,False,False,False,False,,https://b.thumbs.redditmedia.com/4TxwPqnPimUZzibCIBw23AwYJ2VRoSuGoCp1NAG7o_I.jpg,t3_1h7mnkz
gaming,PlayStation Has Had A GOTY Nominee Every Single Year In The Last Decade,,Imaginary_Cause2216,1h5mnet,https://reddit.com/r/gaming/comments/1h5mnet/playstation_has_had_a_goty_nominee_every_single/,https://i.redd.it/uwpze1q4rm4e1.jpeg,2024-12-03 12:49:23,14689,0.86,14689,0,1604,0,0,False,False,False,False,False,,https://a.thumbs.redditmedia.com/pFhLvEvse4VUnd0zApACJMuPEIzrzVimuhlnxdUE1U0.jpg,t3_1h5mnet
gaming,"Indiana Jones and the Great Circle PC system requirements, these are some hefty specs....",,Lo_jak,1h5zljg,https://reddit.com/r/gaming/comments/1h5zljg/indiana_jones_and_the_great_circle_pc_system/,https://i.redd.it/j2ljxz4aip4e1.jpeg,2024-12-03 22:05:04,1304,0.92,1304,0,880,0,0,False,False,False,False,False,,https://b.thumbs.redditmedia.com/ZYwW7iVNuobHrcNPe7RzPEXR6s6mj89hDQJVptcL9Mw.jpg,t3_1h5zljg
gaming,why in 2025 is asdw still the default keyboard binding for movement!?,"This has literally been annoying me for more than 35 years! I understand back in the day keyboards didn't have arrow keys but for literal decades after we get the arrow keys it's lunacy to keep using asdw. I have to re-bind every damn game. I'll be doing it when I'm 90 I bet.

ETA: The annoying part of wasd is of course the keys are not symmetrical.",wizardyourlifeforce,1h83v57,https://reddit.com/r/gaming/comments/1h83v57/why_in_2025_is_asdw_still_the_default_keyboard/,https://www.reddit.com/r/gaming/comments/1h83v57/why_in_2025_is_asdw_still_the_default_keyboard/,2024-12-06 15:27:47,0,0.05,0,0,112,0,0,False,False,True,False,False,,self,t3_1h83v57
gaming,"For a game where most of it occurs well above 3,000 feet, the ground level of detail in Flight Simulator 2024 is insane.",,Alc2005,1h5pgcz,https://reddit.com/r/gaming/comments/1h5pgcz/for_a_game_where_most_of_it_occurs_well_above/,https://i.redd.it/m0lnvva0cn4e1.jpeg,2024-12-03 15:05:13,4101,0.97,4101,0,122,0,0,False,False,False,False,False,,https://b.thumbs.redditmedia.com/39nm9N8fQG6vRfSViESYIl-cHvsv3RO2t3DAcwWJIPI.jpg,t3_1h5pgcz
gaming,"30 years, but it seems like yesterday",,Kvra,1h5pzgd,https://reddit.com/r/gaming/comments/1h5pzgd/30_years_but_it_seems_like_yesterday/,https://i.redd.it/dyr79zvbjn4e1.jpeg,2024-12-03 15:27:53,3457,0.96,3457,0,111,0,0,False,False,False,False,False,,https://b.thumbs.redditmedia.com/749PXMLVlaR9RArJQYBobGSxFpVjvR8h1BYvRvs_-gI.jpg,t3_1h5pzgd
gaming,This is wrong - Roblox,This is aimed at kids. Children. What child should be spending £199.99 on Robux? This is just predatory behaviour. There needs to be a change in the gaming industry. Suits shouldn’t have so much power that it will end up affecting people’s psyche in the future. I dread to think how kids will act in twenty years having grown up with this.,TheYokoDono,1h7pbuh,https://reddit.com/r/gaming/comments/1h7pbuh/this_is_wrong_roblox/,https://i.redd.it/78648fr7p45e1.jpeg,2024-12-06 01:10:39,0,0.34,0,0,13,0,0,False,False,False,False,False,,https://b.thumbs.redditmedia.com/T3I-Em2GwA_3XBN-VRMoOmnGALu_bIP4bALS1OhIwGU.jpg,t3_1h7pbuh
gaming,Quick review of (almost) all current mini bluetooth controllers!,"Images here: https://imgur.com/a/SZ3VbEy


I love local multiplayer and the easiest way to find people for it is on the go. Lugging around proper full size controllers* would be a chore, and with micro size I can always have even 4 without thinking.

So for starters: my use case is quick plays, 30-90 minutes. Using these regularly for long time would get uncomfortable (and carpal-tunnely I suppose).

The landscape of small controllers is pretty dire to be honest: 8BitDo (for a long time the only option) and rando chinese suppliers.



**8BitDo Lite 2**

It has every button from a classic PS/Xbox layout - including stick click/L3+R3. High quality plastics. Shoulder and trigger button placement is genius and usable. Joystick has a good movement area. Clicks and presses are exquisite. Size is great for the hand, and still light. This is the one controller I could imagine being usable in daily gaming even.

This would be my dream controller. IF it had XInput. Unrelated, but I'm mighty pissed at 8BitDo for not including this with newer models. Yes, these are all aimed for the Switch, but it would have costed next to nothing to add one more mode. Vibration also only works in Switch mode. Yes you can remap with XOutput and the like, but it's a hassle and strangely does not work in every game.

Modes: Switch, Android
Verdict: so close to be perfect, but not reaching it


**8BitDo Zero 2**

My current go-to mini controller. Has XInput. Sadly charges via micro usb (all other are usb-c). No vibration. Buttons feel right. The L/R button is clickable from all directions despite the length, but not really comfortable - which isn't a problem, this size is only used for simple layout games anyway. I wish it would have toggle for modes, there is no visible sign in which it is (toggle is via shortcut combinations).

There is now also a Micro with the same layout as the Q36 below - not ordered becaus missing XInput and I had enough of that after Lite 2)

Modes: Switch, Android, Windows
Verdict: ol' trusty working horse, shows it's age

**LinYuvo Meteor**

Now this is an interesting animal. You can order it for less than half the zero. It has bajillions of color options - I suggest ordering the covered ones, as the LEDs are so bright that you wouldn't want to use them on transparent versions, despite them looking cool as well. It has a circular dpad which I'm neutral about. For some it's easier to hit corners, but it's not as easy as eg. XBox controller's circular one. But it's really clicky, and a bit hard to press, as you can read in the few reviews it has. So dpad is certainly it's biggest drawback. Has vibration. It has a really interesting feature, you can replace keys - dpad with joystick directions and L/R buttons with trigger - without any software, just shortcuts! You can also toggle the light effects and colors, there are quite a few, as gimmick, or turn it off completely (will be remembered).

Verdict: price/features orders of magnitude better than the Zero 2, even Micro. Buttons just don't feel that good, but it's a close call.

**ShanWan Q37**

There exists a version with horizontal and cross (PS and XBox style) joystick placement. You can tell they used CADs from 8BitDo, the inputs have the same appearance - albeit with a very, very cheap plastic. The rounded off body is a bit smaller but thicker and overall harder to hold. But the presses feel ok. There is vibration - both sides even. It has a weird gyro mode in non-switch mode as well where gyro controls the joystick. Can be accidentally triggered and a useless gimmick. But a very welcomed feature is that every single key can be remapped (including this shortcut). It needs a seemingly unrelated mobile app (""GamepadSpace"") - connecting is hacky as you need to enter firmware upload mode - but once done, you are free to customize, even sensitivity, and everything is saved to the controller. This is great, especially since very stupidly in XInput mode the buttons match the switch layout (eg A is B) by default. Until now you would think this is in the endvery ok controller, but you'd be mistaken. Sadly it all falls apart by how incredibly bad quality this controller is. You will get constant disconnects, lag, ghost presses and stuck input. It's just bad, and generic QC issue. I had multiple controllers showing the same sign.

Verdict: It could be the ""good version"" rip-off of 8BitDo, but sadly it's just a mess, and costs the same as 8BitDo.


Modes: Windows/Android, Switch, Playstation

**ShanWan Q36**

The same as Q37, just with copying the 8BitDo Micro form and layout - which makes it even more sad that it's bad.

Modes: Windows/Android, Switch, Playstation


**Keychain controller**

Being available for 8+ years this is more like an afterthought rather than a serious contender, I included it only for fun. But it's by far the smallest you can go! It only has Android and keyboard function. The ""joystick"" is actually moving only on a 2D plane. Very practical and interesting, but a bit hard to move. Buttons are too mushy. But it is useful as a remote, eg. A is mapped to take a photo in Android.

Modes: IOS/Android, Keyboard",poisonborz,1h6svb8,https://reddit.com/r/gaming/comments/1h6svb8/quick_review_of_almost_all_current_mini_bluetooth/,https://www.reddit.com/r/gaming/comments/1h6svb8/quick_review_of_almost_all_current_mini_bluetooth/,2024-12-04 22:15:09,10,0.61,10,0,2,0,0,False,False,True,False,False,,self,t3_1h6svb8
gaming,What’s a small feature in a game that made it way more immersive for you?,"I’ve been playing a lot of games recently, and I’ve realized how small details can make or break immersion. For example, seeing wet footprints fade on a rainy sidewalk in Sleeping Dogs really stuck with me. What’s your favorite little detail that enhanced your experience?",m2104,1h6mvz7,https://reddit.com/r/gaming/comments/1h6mvz7/whats_a_small_feature_in_a_game_that_made_it_way/,https://www.reddit.com/r/gaming/comments/1h6mvz7/whats_a_small_feature_in_a_game_that_made_it_way/,2024-12-04 18:13:27,15,0.66,15,0,119,0,0,False,False,True,False,False,,self,t3_1h6mvz7
gaming,"Path of Exile 2, and a recent trend in gaming","It seems like Path of Exile 2 is shaping up to follow in the footsteps of Elden Ring and Baldur's Gate 3, a game in a more niche genre, that doubles down on the things people love about that genre, and finds mainstream success by virtue of it being really, really good. Even Metaphor: Re Fantazio sort of fits into that catagory, although I think it's a littke more refined than Persona. And it's got me thinking about how some of the bigger failures of the past few years were games that tried for the broadest appeal possible, and ended up being super bland and forgettable in doing so. Games like Suicide Squad and Star Wars Outlaws. There's nothing really wrong with those games, there's just nothing that makes them stand out.",thewalkindude,1h5vyez,https://reddit.com/r/gaming/comments/1h5vyez/path_of_exile_2_and_a_recent_trend_in_gaming/,https://www.reddit.com/r/gaming/comments/1h5vyez/path_of_exile_2_and_a_recent_trend_in_gaming/,2024-12-03 19:36:26,804,0.83,804,0,413,0,0,False,False,True,False,False,,self,t3_1h5vyez
gaming,T-45 Power Armor cosplay from Fallout ,,Zoidberrg,1h5vf9a,https://reddit.com/r/gaming/comments/1h5vf9a/t45_power_armor_cosplay_from_fallout/,https://i.redd.it/lumljw5xno4e1.jpeg,2024-12-03 19:15:10,832,0.84,832,0,44,0,0,False,False,False,False,False,,https://b.thumbs.redditmedia.com/iStyB_zCy9wUjr9OQ5pwCWMZ6dylHpIuejYjuY5Z2lM.jpg,t3_1h5vf9a
gaming,"What was that one final mission that you played and made you go ""HOLY SHIT""?","I just completed outlast and I had this thought on my head, so I gotta ask...which one?",adm_anonimo,1h7d2i1,https://reddit.com/r/gaming/comments/1h7d2i1/what_was_that_one_final_mission_that_you_played/,https://www.reddit.com/r/gaming/comments/1h7d2i1/what_was_that_one_final_mission_that_you_played/,2024-12-05 16:26:21,0,0.45,0,0,126,0,0,False,False,True,False,False,,self,t3_1h7d2i1
gaming,Finally did the switch to PC! ,,Chilicarlos,1h5z0zr,https://reddit.com/r/gaming/comments/1h5z0zr/finally_did_the_switch_to_pc/,https://i.redd.it/lp7d9d22ep4e1.jpeg,2024-12-03 21:41:22,458,0.85,458,0,80,0,0,False,False,False,False,False,,https://b.thumbs.redditmedia.com/BzOmeed2pihvoDmol9JW_0yx5tY4PAvU37vper8Q0vc.jpg,t3_1h5z0zr
gaming,"What would ""fair"" microtransactions look like?","We all know how greedy the game industry has become, especially most mobile games. It's insane that +$100 tiers even exist for virtual in-game currencies, but even more so that there are people actually buying them.

This all has made me wonder, can a ""fair"" microtransaction model even exist? If so, what would it look like? Limited purchases? No +$100 tiers? Giving the player something besides just virtual currency, such as DLC type content? Actually being ""micro"" only at 1 or 2 bucks?

What are your thoughts?",Routasoft,1h7l1ve,https://reddit.com/r/gaming/comments/1h7l1ve/what_would_fair_microtransactions_look_like/,https://www.reddit.com/r/gaming/comments/1h7l1ve/what_would_fair_microtransactions_look_like/,2024-12-05 21:57:01,0,0.27,0,0,65,0,0,False,False,True,False,False,,self,t3_1h7l1ve
gaming,"Is a 16:10 the same width as a 16:9 monitor, only taller?","When I play a game the resolution is 2560x1600, I'm used to the 16:9 1920x1080, is it just as wide only taller on the screen? I feel like it's in 4:3 ration and I'm not getting as wide view as the the 16:9 would give me",KPeters93,1h7h3rl,https://reddit.com/r/gaming/comments/1h7h3rl/is_a_1610_the_same_width_as_a_169_monitor_only/,https://www.reddit.com/r/gaming/comments/1h7h3rl/is_a_1610_the_same_width_as_a_169_monitor_only/,2024-12-05 19:11:46,0,0.25,0,0,24,0,0,False,False,True,False,False,,self,t3_1h7h3rl
gaming,1v1 tournament,"I want to organize a gaming tournament for friends. I therefore look for games that are 1v1 versus. A match should not be longer than 20 min max. The games need to be local/couch games. Not online. Do you have any tips for this?

Some examples: -mortal combat - Tetris - all ea sports games - Nidhogg - tricky towers - brawhalla

The games are mainly played on PlayStation. Nintendo Switch is possible, but preferably not.

All ideas are welcome.

Footnote:I search a little bit on the subreddit. I see that a lot of people are looking for co op games. Cooperation is not what I am looking for.",boibetterknow444,1h7aien,https://reddit.com/r/gaming/comments/1h7aien/1v1_tournament/,https://www.reddit.com/r/gaming/comments/1h7aien/1v1_tournament/,2024-12-05 14:33:46,0,0.41,0,0,8,0,0,False,False,True,False,False,,self,t3_1h7aien
gaming,Is there any point in getting a PS5 Slim if I own a Desktop already?,"So for more context, Ive just ordered an LG C4 55 inch and im not sure if I should just move my desktop setup closer to it and plug my pc in or buy a PS5 and use that one. PC has 32 gb ram ddr5, 6700 xt, r5 7600 which im not exactly sure if it will be capable of pulling 4K resolution well enough. Another thing to note is that I live in a country that got hit by the Sony region block, so the only way to play their new releases on pc is by sailing the high seas which im not a big fan of if im honest. PC I was planning to use for older titles that arent well supported by PS5 or indies/live service games and movies since it pulls all of that with the tech it has atm, PS5 main use would be just Story games which is mostly what I play.

Feel free to ask any other questions for more info and thanks for checking the post out.",Nurosuki,1h7ikoo,https://reddit.com/r/gaming/comments/1h7ikoo/is_there_any_point_in_getting_a_ps5_slim_if_i_own/,https://www.reddit.com/r/gaming/comments/1h7ikoo/is_there_any_point_in_getting_a_ps5_slim_if_i_own/,2024-12-05 20:13:27,0,0.26,0,0,41,0,0,False,False,True,False,False,,self,t3_1h7ikoo
gaming,What games are you thankful for this year?,,tInteresting_Space,1h7arpy,https://reddit.com/r/gaming/comments/1h7arpy/what_games_are_you_thankful_for_this_year/,https://hardcoregamer.com/games-we-are-thankful-for-in-2024/,2024-12-05 14:46:00,0,0.29,0,0,28,0,0,False,False,False,False,False,,https://b.thumbs.redditmedia.com/ZtszBrfjQ7GDQmZTZAFWCQUSRWKVkmieOhVrOLQMxdA.jpg,t3_1h7arpy
gaming,What makes an esport good?,Why are some esports more fun to watch than others? Why would someone rather watch an esport than play it? What are the core elements of an esport compared to any competitive online game? ,CallSign_Fjor,1h7d6tx,https://reddit.com/r/gaming/comments/1h7d6tx/what_makes_an_esport_good/,https://www.reddit.com/r/gaming/comments/1h7d6tx/what_makes_an_esport_good/,2024-12-05 16:31:22,0,0.18,0,0,17,0,0,False,False,True,False,False,,self,t3_1h7d6tx
gaming,Games with a sense of long-term progression and goals?,"I love WoW and Tarkov and Runescape, but also Stardew Valley, Rimworld, and a whole bunch of others. 

Nothing makes me happier than having a game with a sense of long-term progress, like I’ve built something and have something to show for it. For example, I love the Player-Owned house in Runescape and showing off my pets and achievements. I love mounts and transmogs in wow because I love building my own aesthetic based around my greatest moments. I LOVE my hideout in Tarkov because I feel like I made it with my blood, sweat, and tears, and each mannequin with boss armor on it reminds me of those first kills. 

I’m burned out of most of the above, and while I’m obviously okay with grinding, I need a purpose for it (looking at you WoW) 

Any suggestions for someone looking for a long-term experience?",ArcadeRay,1h6bsax,https://reddit.com/r/gaming/comments/1h6bsax/games_with_a_sense_of_longterm_progression_and/,https://www.reddit.com/r/gaming/comments/1h6bsax/games_with_a_sense_of_longterm_progression_and/,2024-12-04 08:57:24,30,0.71,30,0,120,0,0,False,False,True,False,False,,self,t3_1h6bsax
gaming,"What's going on with ""Delta Force""?","It's weird. I keep seeing images of a Delta Force game which seems to be a follow-up to the older Novalogic games... But it's got ""tacticool"" characters who look like something from a hero shooter.

What's going on with it?

Last time I checked in with this series, they made the sequel-in-all-but-name *Joint Operations: Typhoon Rising*, which was an amazing game - but these have all been quite realistic shooters that kinda pitched their flag halfway between Battlefield and ARMA.

The images I'm seeing of the new one are jarring.",ByEthanFox,1h773b2,https://reddit.com/r/gaming/comments/1h773b2/whats_going_on_with_delta_force/,https://www.reddit.com/r/gaming/comments/1h773b2/whats_going_on_with_delta_force/,2024-12-05 11:30:31,0,0.42,0,0,36,0,0,False,False,True,False,False,,self,t3_1h773b2
gaming,When you are not feeling the beat,,unbalancedbreakfast,1h5u8al,https://reddit.com/r/gaming/comments/1h5u8al/when_you_are_not_feeling_the_beat/,https://i.redd.it/7tnjtzk6fo4e1.jpeg,2024-12-03 18:25:55,323,0.92,323,0,29,0,0,False,False,False,False,False,,https://b.thumbs.redditmedia.com/EvGZJvZ1CUNh4NbqwChzfdTre_sqhplkzErSE0glqHQ.jpg,t3_1h5u8al
gaming,Official launch trailer. Indiana Jones and the Great Circle.,,bestest_at_grammar,1h5o8ea,https://reddit.com/r/gaming/comments/1h5o8ea/official_launch_trailer_indiana_jones_and_the/,https://youtu.be/TQOJCrQq6hs?si=94knLxqsd5Hf4V5L,2024-12-03 14:10:09,616,0.84,616,0,298,0,0,False,False,False,False,False,,https://b.thumbs.redditmedia.com/kfDRMButHCKw2xq0mBA1_6lbvYGIA9RenJTMvgC5ctA.jpg,t3_1h5o8ea
gaming,What game gives you a strong feeling of nostalgia and makes you remember everything that happened to you at the time when you were actively playing this game?,"I was recently surfing net when, out of nowhere, I decided to open ***Super Mario 64***. No real reason, just a random decision

The second the title screen appeared, I felt like I was a kid again. That familiar music, Mario’s face, the vibrant world - it all came rushing back. After a few minutes of gameplay I was literally hooked. Running around, hearing the old sound effects and all that stuff - everything felt so nostalgic

Then suddenly memories started flooding in. I remembered where I was when I first played it - the old couch in my living room, the excitement of my first time exploring the game, the friends I used to play it with after school. I hadn’t realized how much I missed it until I was already lost in the game. It was like no time had passed at all

**Do you have games that make you feel like that?**",rockzxm,1h66dxl,https://reddit.com/r/gaming/comments/1h66dxl/what_game_gives_you_a_strong_feeling_of_nostalgia/,https://www.reddit.com/r/gaming/comments/1h66dxl/what_game_gives_you_a_strong_feeling_of_nostalgia/,2024-12-04 03:17:40,48,0.78,48,0,152,0,0,False,False,True,False,False,,self,t3_1h66dxl
gaming,Musings on Video Gaming,"I’m over 65 and have been playing video games (badly) since my Intellevision days. I’m now using a PS5.
I have loved games such as The Last of Us, Days Gone, Zelda and so many more and I played almost every day especially since the ps3 days.
Recently my hands and wrists have gotten a little painful so I haven’t played in a few weeks. The thing is I don’t miss it. Right now as it stands if I never played again it wouldn’t kill me.
It made me wonder how many of us are playing for the love of gaming or because it’s become an easy habit to fall into.
When was the last time any of us stopped playing for a week just to catch our breath so to speak?
This is a hobby that can consume thousands of hours.Maybe we should set aside some of those hours in levelling ourselves up rather than our avatars. 
",TemperatureTime1617,1h67phc,https://reddit.com/r/gaming/comments/1h67phc/musings_on_video_gaming/,https://www.reddit.com/r/gaming/comments/1h67phc/musings_on_video_gaming/,2024-12-04 04:27:58,38,0.64,38,0,39,0,0,False,False,True,False,False,,self,t3_1h67phc
gaming,What's the most significant or memorable gaming content that's also entirely missable?,"When playing games that bother to fully flesh out their worlds, there must be so much you could complete a game without seeing or being signposted towards or lead through. Rockstar in particular seem to have entire areas, characters and plot points that you could in theory never experience.

What's the most compelling part of a game that you've experienced that you realised could have easily been missed?",danielgmal,1h6v1gk,https://reddit.com/r/gaming/comments/1h6v1gk/whats_the_most_significant_or_memorable_gaming/,https://www.reddit.com/r/gaming/comments/1h6v1gk/whats_the_most_significant_or_memorable_gaming/,2024-12-04 23:48:21,0,0.46,0,0,63,0,0,False,False,True,False,False,,self,t3_1h6v1gk
gaming,"Blizzard is delisting the OG Warcrafts from GOG, but GOG says it's gonna preserve them forever anyway, hands out a discount, and announces new policy for its preservation program to boot",,Former-Fix4842,1h52r8c,https://reddit.com/r/gaming/comments/1h52r8c/blizzard_is_delisting_the_og_warcrafts_from_gog/,https://www.pcgamer.com/software/platforms/blizzard-is-delisting-the-og-warcrafts-from-gog-but-gog-says-its-gonna-preserve-them-forever-anyway-hands-out-a-discount-and-announces-new-policy-for-its-preservation-program-to-boot/,2024-12-02 19:02:58,31556,0.96,31556,0,1454,0,0,False,False,False,False,False,,https://b.thumbs.redditmedia.com/VQ4Ymc2U9pq5_CoH26xa1jPi7jEDt_HbbVxmGM9Fk5Y.jpg,t3_1h52r8c
gaming,What are you playing Wednesday!,"What game's got your attention this week? What's great about it? What sucks? Tell us all about it! 

&amp;#x200B;

 This thread is posted weekly on Wednesdays (adjustments made as needed).",AutoModerator,1h6a7ql,https://reddit.com/r/gaming/comments/1h6a7ql/what_are_you_playing_wednesday/,https://www.reddit.com/r/gaming/comments/1h6a7ql/what_are_you_playing_wednesday/,2024-12-04 07:00:10,17,0.71,17,0,130,0,0,False,False,True,False,False,Weekly Play Thread,self,t3_1h6a7ql
gaming,Nether Portal I made with the new Minecraft Resin Blocks,,dancsa222,1h5oiic,https://reddit.com/r/gaming/comments/1h5oiic/nether_portal_i_made_with_the_new_minecraft_resin/,https://i.redd.it/3gtugcxu7n4e1.png,2024-12-03 14:23:06,290,0.88,290,0,21,0,0,False,False,False,False,False,,https://a.thumbs.redditmedia.com/LMEBl8eZbtRWs5vnPGSecidtZ1Gg7udz8kcL7Btifm0.jpg,t3_1h5oiic
gaming,"Open World Games For PS4 That Feel Drenched In Melancholy Despite Not Necessarily Being A ""Sad Story""?","I know this sort of question has been asked many times, but this is my spin on it. As the title says, I'm not looking for a game with a ""sad story"", but rather an open world game where the world, music, overall atmosphere, and the protagonist just feel drenched in a deep sense of melancholy/sadness. I think a good example of what I'm looking for is Red Dead Redemption 1... despite what happens in the end, I wouldn't necessarily consider it a ""sad story"", but rather a story that gives this overwhelming sense that the world is changing, the old ways are dying, and you are powerless to stop it. Just simply stopping to stand somewhere in the middle of the desert plains, and hearing the haunting music in RDR1 gives this feeling, like the whole game just has this constant, overhanging thick layer of melancholy, no matter where you go. In other words, it's as if the world itself is sad. 

I hope you understand what I mean by all this. Any open world game suggestions like this on PS4 would be greatly appreciated!",701921225,1h6yro1,https://reddit.com/r/gaming/comments/1h6yro1/open_world_games_for_ps4_that_feel_drenched_in/,https://www.reddit.com/r/gaming/comments/1h6yro1/open_world_games_for_ps4_that_feel_drenched_in/,2024-12-05 02:43:27,0,0.48,0,0,58,0,0,False,False,True,False,False,,self,t3_1h6yro1
