subreddit,title,selftext,author,id,permalink,url,created_utc,score,upvote_ratio,ups,downs,num_comments,total_awards_received,gilded,is_video,is_original_content,is_self,over_18,spoiler,link_flair_text,thumbnail,name
gaming,Self Promotion Saturday! Small streamer? Just getting started? Tell us about it here!,"Use this post to tell us about your YouTube Channel or Twitch stream! Show us your creativity and tell us why we should subscribe. What makes you unique?

Please note that this thread is NOT for selling or advertising stores. Report any such posts and we'll deal with them. Thanks!

This thread is posted weekly on Saturdays (adjustments made as needed).

Reminder that you must follow our [rules of promotion.](https://www.reddit.com/r/gaming/wiki/index?utm_source=reddit&amp;utm_medium=usertext&amp;utm_name=gaming&amp;utm_content=t5_2qh03#wiki_rule_7.3A_self-promotion)",AutoModerator,1h8myeh,https://reddit.com/r/gaming/comments/1h8myeh/self_promotion_saturday_small_streamer_just/,https://www.reddit.com/r/gaming/comments/1h8myeh/self_promotion_saturday_small_streamer_just/,2024-12-07 07:00:12,0,0.42,0,0,12,0,0,False,False,True,False,False,Weekly Self Promotion Thread,self,t3_1h8myeh
gaming,2024 was a good year for games imo,,Due_Teaching_6974,1h8peyb,https://reddit.com/r/gaming/comments/1h8peyb/2024_was_a_good_year_for_games_imo/,https://i.redd.it/qb9gamdwwd5e1.png,2024-12-07 10:03:14,3035,0.82,3035,0,911,0,0,False,False,False,False,False,,https://b.thumbs.redditmedia.com/foWmyHkSz9ZePQTu2vgDv5aFTbxj3V8w7yFMKu1Cuhg.jpg,t3_1h8peyb
gaming,My Skyrim cosplay,,TheRaimundCosplay,1h8ubts,https://reddit.com/r/gaming/comments/1h8ubts/my_skyrim_cosplay/,https://i.redd.it/mygjt8iwyf5e1.jpeg,2024-12-07 15:04:33,642,0.98,642,0,22,0,0,False,False,False,False,False,,https://b.thumbs.redditmedia.com/P5uQ1p00zgrFQWe25bdnyymQhzYBO904KZLLgP2H3cA.jpg,t3_1h8ubts
gaming,I need more time,,propdynamic,1h8pdwc,https://reddit.com/r/gaming/comments/1h8pdwc/i_need_more_time/,https://i.redd.it/ufr3nzfmge5e1.png,2024-12-07 10:01:15,989,0.94,989,0,73,0,0,False,False,False,False,False,,https://b.thumbs.redditmedia.com/ybgRU-kwYjmUeenm-1xB9WDELGJm2-a-LT9Pqq-OshU.jpg,t3_1h8pdwc
gaming,I now have immortalized a relic to gamings greatest failure thus far,,ThatGuyOnyx,1h8gsql,https://reddit.com/r/gaming/comments/1h8gsql/i_now_have_immortalized_a_relic_to_gamings/,https://i.redd.it/lqvim4hqsb5e1.jpeg,2024-12-07 01:02:51,5494,0.93,5494,0,336,0,0,False,False,False,False,False,,https://b.thumbs.redditmedia.com/bdMOXJBrr7uVUKMvLBc8w7mFoo_DnxxBqHATKjVZSvg.jpg,t3_1h8gsql
gaming,"EA announces it will patent 23 accessibility technologies that will be available to developers royalty-free ""to reduce or eliminate as many barriers to access as possible and empower our gamers""",,TylerFortier_Photo,1h8uw0h,https://reddit.com/r/gaming/comments/1h8uw0h/ea_announces_it_will_patent_23_accessibility/,https://www.windowscentral.com/gaming/ea-doubles-technologies-patents,2024-12-07 15:31:37,309,0.96,309,0,57,0,0,False,False,False,False,False,,https://b.thumbs.redditmedia.com/r5Jep0iTr9I4Pnk1YVQXfZtfu1WmkbBGqnoXat7ZayA.jpg,t3_1h8uw0h
gaming,Is this the longest video game title of all time? ,,JoeZocktGames,1h8t2ch,https://reddit.com/r/gaming/comments/1h8t2ch/is_this_the_longest_video_game_title_of_all_time/,https://i.redd.it/hlyzs03enf5e1.jpeg,2024-12-07 14:00:02,254,0.9,254,0,60,0,0,False,False,False,False,False,,https://b.thumbs.redditmedia.com/5mYSqjtOLeDzYgwfmLMfrVTtValK47_vki_gDZvRdIA.jpg,t3_1h8t2ch
gaming,Black Ops 6 loading screen (Look at the hand). ,,80zVoid,1h850ur,https://reddit.com/r/gaming/comments/1h850ur/black_ops_6_loading_screen_look_at_the_hand/,https://i.redd.it/3ggugld2795e1.png,2024-12-06 16:17:49,39903,0.85,39903,0,3091,0,0,False,False,False,False,False,,https://b.thumbs.redditmedia.com/iZSI8b71d7Jgvop79LGDourf3144U5jfcKI30RkGA5U.jpg,t3_1h850ur
gaming,When you've been thrown around for 6 hours but you're just a chill gnome who wanted to fly in a rocket.,,HeroRadio,1h8fy3f,https://reddit.com/r/gaming/comments/1h8fy3f/when_youve_been_thrown_around_for_6_hours_but/,https://i.redd.it/yaebmcmvkb5e1.jpeg,2024-12-07 00:20:46,1612,0.95,1612,0,44,0,0,False,False,False,False,False,,https://b.thumbs.redditmedia.com/538KJIyI1f8gpsddOyOfmggfb-9BJaJNlF9ECJ66VcM.jpg,t3_1h8fy3f
gaming,"One of those games on an airplane monitor.  Seems like whoever designed this doesn't know the definition of ""multiplayer""",,Tomnookslostbrother,1h8guf2,https://reddit.com/r/gaming/comments/1h8guf2/one_of_those_games_on_an_airplane_monitor_seems/,https://i.redd.it/jx3xgge7kb5e1.jpeg,2024-12-07 01:05:10,451,0.88,451,0,11,0,0,False,False,False,False,False,,https://b.thumbs.redditmedia.com/cjvMpEXQyipd6DCm9UypsvifTfOOg7Et4UF64ZDBtnM.jpg,t3_1h8guf2
gaming,Ex-Rockstar dev reveals truth about GTA 6 trailer “conspiracy theories”,,Healthy-Career7226,1h81bdi,https://reddit.com/r/gaming/comments/1h81bdi/exrockstar_dev_reveals_truth_about_gta_6_trailer/,https://www.dexerto.com/gta/ex-rockstar-dev-reveals-truth-about-gta-6-trailer-conspiracy-theories-2999820/,2024-12-06 13:26:59,3863,0.93,3863,0,274,0,0,False,False,False,False,False,,https://b.thumbs.redditmedia.com/tu35BIWUJyT4Pn2qh07SZyx8Ls4TwdInXi12JLif3qI.jpg,t3_1h81bdi
gaming,One handed game suggestions? (mouse only),"Hey gamers,

I've broken my left hand (keyboard hand) and I'm looking for some game suggestions to keep me busy whilst I'm off work for a bit.

I've already tried/aware of:
- This War of mine, I liked it and will probably keep playing it
- Civ 6, I will be playing this
- inscryption, already own it and have almost finished it prior to breaking my hand
- slay the spire, played it heaps and over it
- One Finger death punch, wasn't for me


I'm open to buying a mouse with a bunch of extra buttons if I find a game worth it. 

P.S: I know this has been asked before however there haven't been any fairly recent posts, especially ones specifically referring to mouse hand only 

Thankyou so much for your help!",scrappypatchy,1h8nak0,https://reddit.com/r/gaming/comments/1h8nak0/one_handed_game_suggestions_mouse_only/,https://www.reddit.com/r/gaming/comments/1h8nak0/one_handed_game_suggestions_mouse_only/,2024-12-07 07:24:17,125,0.88,125,0,371,0,0,False,False,True,False,False,,self,t3_1h8nak0
gaming,Batman Arkham Knight is truly a Next Gen game on a Last Gen Hardware,Still no 60fps on PS5 but still puts most AAA game to shame in terms of graphics and game content,Zairy47,1h8b107,https://reddit.com/r/gaming/comments/1h8b107/batman_arkham_knight_is_truly_a_next_gen_game_on/,https://i.redd.it/4rati4vqga5e1.jpeg,2024-12-06 20:33:52,810,0.83,810,0,137,0,0,False,False,False,False,False,,https://b.thumbs.redditmedia.com/vhNaEcwpiX7rP0IE_V9Lij8kNXI3TeIPXfki794SPVY.jpg,t3_1h8b107
gaming,Name a starter weapon that somehow still holds up at the end of the game,example: the Wrench from Bioshock,HF484,1h888cg,https://reddit.com/r/gaming/comments/1h888cg/name_a_starter_weapon_that_somehow_still_holds_up/,https://www.reddit.com/r/gaming/comments/1h888cg/name_a_starter_weapon_that_somehow_still_holds_up/,2024-12-06 18:33:11,1113,0.9,1113,0,1292,0,0,False,False,True,False,False,,self,t3_1h888cg
gaming,Marvel Rivals has had the smoothest launch for an online game in a while ,"You just get right into the game. No long ass queue, no random disconnects with like 400k players. Sounds like an ad but it makes me wonder wtf the rest of these  companies with  basically limitless money  ( not literally cause it’s Reddit ) were/are doing lol ",ThisNameDoesntCount,1h8to7n,https://reddit.com/r/gaming/comments/1h8to7n/marvel_rivals_has_had_the_smoothest_launch_for_an/,https://www.reddit.com/r/gaming/comments/1h8to7n/marvel_rivals_has_had_the_smoothest_launch_for_an/,2024-12-07 14:31:41,22,0.6,22,0,23,0,0,False,False,True,False,False,,self,t3_1h8to7n
gaming,The Nostalgia,,Odd_Pirate_8756,1h7s0hs,https://reddit.com/r/gaming/comments/1h7s0hs/the_nostalgia/,https://i.redd.it/6geo54vid55e1.jpeg,2024-12-06 03:26:55,69278,0.9,69278,0,476,0,0,False,False,False,False,False,,https://a.thumbs.redditmedia.com/H95dn-HxIDTR74d3wqeeblBDk9tFviUIflN8q0ckeJ0.jpg,t3_1h7s0hs
gaming,"Everyone talking about the Indiana Jones game lately, so I gave in and bought it. This is great!",,d0ggzilla,1h7y86n,https://reddit.com/r/gaming/comments/1h7y86n/everyone_talking_about_the_indiana_jones_game/,https://i.redd.it/9kdkpgxod75e1.jpeg,2024-12-06 10:13:17,3223,0.96,3223,0,212,0,0,False,False,False,False,False,,https://b.thumbs.redditmedia.com/P5YnZz3Zc_7NbaWIDlwWrXe8Zl9Z_BwxJc9XMPLZ5ko.jpg,t3_1h7y86n
gaming,"The best games of 2024, picked by NPR's staff",,sundler,1h88tuj,https://reddit.com/r/gaming/comments/1h88tuj/the_best_games_of_2024_picked_by_nprs_staff/,https://www.npr.org/2024/07/16/g-s1-9554/best-games-2024-picked-by-npr-staff,2024-12-06 18:59:04,598,0.92,598,0,58,0,0,False,False,False,False,False,,https://b.thumbs.redditmedia.com/fzIKqobORU5KgfXnQe-FIUaMccTEN1IvJ8nqtUNs6wI.jpg,t3_1h88tuj
gaming,It's out now!!,"I never thought this game would get a remaster. It is an amazing obscure sequel to one of the best movies. The game went from TBD to releasing today or yesterday. 30mins before work, here we go!",anonerble,1h81gov,https://reddit.com/r/gaming/comments/1h81gov/its_out_now/,https://i.redd.it/wv8jdnsxd85e1.jpeg,2024-12-06 13:34:34,1468,0.95,1468,0,173,0,0,False,False,False,False,False,,https://b.thumbs.redditmedia.com/iKT-5RDmdMgFEeO3bPg84h-uZJ9V-_SeHBNqV1YfMlk.jpg,t3_1h81gov
gaming,"Guillemot family wants to retain control of Ubisoft in potential buyout, but Tencent wants more control",,rickjamesbich,1h8v0es,https://reddit.com/r/gaming/comments/1h8v0es/guillemot_family_wants_to_retain_control_of/,https://www.pcgamer.com/gaming-industry/ubisoft-buyout-talks-are-reportedly-progressing-but-theres-one-small-hitch-the-guillemot-family-wants-to-stay-in-charge-but-tencent-isnt-so-sure-about-that/,2024-12-07 15:37:18,8,0.75,8,0,5,0,0,False,False,False,False,False,,https://b.thumbs.redditmedia.com/MFx_XwdhRO7lUD9X-2WbY7mRPDwFqsDPOB6DRWAgNNM.jpg,t3_1h8v0es
gaming,What games can you play as hulk? My son wants a hulk video game. ,My 5 year old wrote “hulk video game” on his Santa list. They haven’t made a hulk specific game in awhile. I was thinking either Lego avengers or Lego super hero’s but I’m not clear which you can actually play as hulk or what’s better. He’s on the cover of both. We have a switch and an Xbox series x in terms of systems. Any advise is appreciated. ,Macsimus15,1h83411,https://reddit.com/r/gaming/comments/1h83411/what_games_can_you_play_as_hulk_my_son_wants_a/,https://www.reddit.com/r/gaming/comments/1h83411/what_games_can_you_play_as_hulk_my_son_wants_a/,2024-12-06 14:54:27,655,0.9,655,0,270,0,0,False,False,True,False,False,,self,t3_1h83411
gaming,"Ubisoft shareholders in talks over possible buyout terms, sources say ",,Imaginary_Cause2216,1h84v1c,https://reddit.com/r/gaming/comments/1h84v1c/ubisoft_shareholders_in_talks_over_possible/,https://www.reuters.com/markets/deals/ubisoft-shareholders-talks-over-possible-buyout-terms-sources-say-2024-12-06/,2024-12-06 16:11:04,477,0.94,477,0,91,0,0,False,False,False,False,False,,default,t3_1h84v1c
gaming,Bring Back Good Co-Op Games,"Marvel Rivals came out. Was pretty cool for like 15 minutes and then I just felt kinda bored and a little sad. 

I’ve been playing games since the 80s and idk, I’m just tired of PvP stuff. Really missing the cooperative games of old.

I remember stuff like Zombies Ate My Neighbors or Left 4 Dead or Gauntlet Legends or Halo or even Destiny or the arcade beat em ups like X-men or the Simpsons or Turtles game when it first came out and these games were just so epic and fostered such great teamwork and camaraderie. Helluva dope feeling and rush having to work together to win. Especially back in the days of arcades, nothing cooler than actually assembling 4 people dedicated to pulling it off.

Idk. Everything just feels so competitive, battle royale, hero shootery, and it’s just beginning to feel unnecessary and kinda forced and stale.

Maybe I’m just feeling nostalgic and outta touch lol but I feel like bringing these kinds of great co-op games back in a modern sense in actual abundance would really inject some love and positive vibes back into the community while also, bringing in a whole new demographic of gamers looking for something less demanding and stressful than PvP gaming which I feel like is just low key bloating the market at this point.

P.S. this is no dig Marvel Rivals or to gamers that enjoy these games, I’m just getting this off my chest lol sorry it’s late, I’m high, rant over.

lol nope just a husband, father, business owner and student. I’ve been playing games since the 80s. I know major titles and indie games exist guys no offense lol. Mostly all the ones that have been named so far are not new names to me or games I haven’t tried at some point that just didn’t capture my interest.

Edit: Idk why I’m getting downvoted so much lmao are you taking offense to the fact that I just don’t like the games you’re suggesting as much as you or others do or haven’t played them? 

Idk I think I’ve been pretty respectful about the games I have talked about, even the ones I may not care for as well but idk. Either way, I’ve played Indie game guys. I’ve played games like stardew valley (well technically my wife played and I watched) or warhammer (specifically the vermintide one) and that was honestly years ago. Maybe I’m wrong but, those I don’t feel like are recent games (came out this year) and when I did watch/play them, they weren’t my cup of tea. I guess I should have been specific (like when I mentioned Destiny, I meant specifically the first one as I played 2 and did not care for it as much).

I’m almost 40 and a pretty avid gamer blessed to be able to play a PLETHORA of games over the last few years through different means (work, personal life, events), with 2 kids and a wife who are all also gamers either various taste whether that be in console (we have most past and present) or game type. I do not live under a rock, maybe a more a pineapple under the sea and my only burden is the business of life but, I’ve still found time to do my gaming and follow my hobbies (for business/pleasure) so I’m not completely out the loop.

I’ve had some great suggestion here to help solidify the push to try certain titles (maybe the art style has been putting me off or mechanics or story didn’t capture me) that I have been putting off or stayed away from. And I appreciate everyone’s suggestions and even opinions but let’s not trip on each other off of video games. The post was meant to just be light hearted and random, not this deep dive into my personal gaming preferences or an attack on others interest lol. 

From one gamer to another, let’s try to foster more positivity and cohesion so we gamers don’t always have to carry the title of toxic and negative and build a more appealing and inviting community. 

Alright it’s 6am, I’m turning my notifications off on this post because it’s been making my phone go off all night lol enjoy yalls weekend and remember, it’s all just a game🖖😎 see ya!!",SadRoll1966,1h8jtx2,https://reddit.com/r/gaming/comments/1h8jtx2/bring_back_good_coop_games/,https://www.reddit.com/r/gaming/comments/1h8jtx2/bring_back_good_coop_games/,2024-12-07 03:45:09,47,0.67,47,0,83,0,0,False,False,True,False,False,,self,t3_1h8jtx2
gaming,Just bought a switch with animal crossing,Wanna be friends?,Acceptable-Eagle3214,1h85n4i,https://reddit.com/r/gaming/comments/1h85n4i/just_bought_a_switch_with_animal_crossing/,https://i.redd.it/jtprhqksb95e1.jpeg,2024-12-06 16:44:20,360,0.83,360,0,41,0,0,False,False,False,False,False,,https://b.thumbs.redditmedia.com/0ahRBXj26aOuPlQRP7vHZPh1ugw3qeuAgkxMkPPeeeI.jpg,t3_1h85n4i
gaming,Indiana Jones and The Great Circle releases with a 87/100 metascore ,,IcePopsicleDragon,1h7oc17,https://reddit.com/r/gaming/comments/1h7oc17/indiana_jones_and_the_great_circle_releases_with/,https://opencritic.com/game/17732/indiana-jones-and-the-great-circle,2024-12-06 00:23:34,8621,0.96,8621,0,805,0,0,False,False,False,False,False,,https://a.thumbs.redditmedia.com/TKH8Qi0fnody2Trm63y1Rxg6I7uikt77B6d_W3GQXm4.jpg,t3_1h7oc17
gaming,Oh it’s beautiful ,,Xenomorph_kills,1h7jvw1,https://reddit.com/r/gaming/comments/1h7jvw1/oh_its_beautiful/,https://i.redd.it/4wc92tuxh35e1.jpeg,2024-12-05 21:08:06,13652,0.91,13652,0,340,0,0,False,False,False,False,False,,https://b.thumbs.redditmedia.com/yDH5cMJYlQWPA2gE9Z3ANiw52XN3Ku73T3xIe0mXTnI.jpg,t3_1h7jvw1
gaming,Indiana Jones and The Great Circle review – a grand adventure brilliantly executed,,Ok-fine-man,1h7o7qt,https://reddit.com/r/gaming/comments/1h7o7qt/indiana_jones_and_the_great_circle_review_a_grand/,https://www.mirror.co.uk/gaming/indiana-jones-great-circle-review-34256689,2024-12-06 00:17:51,2467,0.95,2467,0,222,0,0,False,False,False,False,False,,https://b.thumbs.redditmedia.com/OwS325AwLG8gp4xfr0P2SZ9XgfBXB5V91gDvO512dUM.jpg,t3_1h7o7qt
gaming,No matter how much time passes I still want to play this again,,adm_anonimo,1h82b5e,https://reddit.com/r/gaming/comments/1h82b5e/no_matter_how_much_time_passes_i_still_want_to/,https://i.redd.it/g936gomel85e1.jpeg,2024-12-06 14:16:26,169,0.69,169,0,97,0,0,False,False,False,False,False,,https://b.thumbs.redditmedia.com/VWfISKNB735WTVZkqAk60yo8NIzMQVYnKHM0tfKt1Sg.jpg,t3_1h82b5e
gaming,The Verge: 'Amazon’s Secret Level is a hollow anthology of video game cutscenes',,Real-Deal-Steel,1h7gur0,https://reddit.com/r/gaming/comments/1h7gur0/the_verge_amazons_secret_level_is_a_hollow/,https://www.theverge.com/24313309/secret-level-review-amazon-prime-video,2024-12-05 19:01:28,5931,0.95,5931,0,538,0,0,False,False,False,False,False,,https://b.thumbs.redditmedia.com/E1bOmvrz7NVB-kV2gnFRi_yaAJAuPe4wjXZySUMfO8M.jpg,t3_1h7gur0
gaming,"What are some ""bad"" games with good communities?","We've all heard of the surprisingly prevalent case of great games with poor communities, yes; but what about the opposite: average, mediocre or even outright bad games with genuinely great communities? Please comment any that you know of!",theDaemon0,1h87qlx,https://reddit.com/r/gaming/comments/1h87qlx/what_are_some_bad_games_with_good_communities/,https://www.reddit.com/r/gaming/comments/1h87qlx/what_are_some_bad_games_with_good_communities/,2024-12-06 18:12:20,63,0.71,63,0,86,0,0,False,False,True,False,False,,self,t3_1h87qlx
gaming,Question about FFVII REBIRTH,"Hey Hive Mind, 

My partner and I are playing Rebirth and are both big on getting every piece of loot in any game we play. 

This game feels way more open world so far, but does it work like Remake where we hit a point and can no longer go back to old parts of the world? Do we have to do all exploration of the world/loot hunting as the story progresses, or can we just open world travel to check out areas after the story moves us to another part of the world?

Thanks!",zdragan2,1h8v80f,https://reddit.com/r/gaming/comments/1h8v80f/question_about_ffvii_rebirth/,https://www.reddit.com/r/gaming/comments/1h8v80f/question_about_ffvii_rebirth/,2024-12-07 15:47:23,0,0.5,0,0,1,0,0,False,False,True,False,False,,self,t3_1h8v80f
gaming,Games like Time Crisis with gun controllers ,"What happened to the games with the guns like time crisis?

They would be amazing on modern tv’s.

Nothing like it on Xbox and I ain’t seen anything advertised in the media for any platform.

Surely there’s a kickstarter or something out there? ",PPShooter69rip,1h8upa6,https://reddit.com/r/gaming/comments/1h8upa6/games_like_time_crisis_with_gun_controllers/,https://www.reddit.com/r/gaming/comments/1h8upa6/games_like_time_crisis_with_gun_controllers/,2024-12-07 15:22:42,2,0.67,2,0,14,0,0,False,False,True,False,False,,self,t3_1h8upa6
gaming,"What song (Non-OST) in a game makes you go ""Hell yeah""","I was playing Sonic x Shadows Generations earlier this week (an excellent game which i highly recommend for platforming fans) when the familiar tune of Crush 40's Escape from the City started up on one of the levels. I instantly was teleported back to 2002 with that upbeat tempo and the insanely catchy ""Follow me, set me free, trust me and we can escape from the city"" quip has been stuck in my head ever since.

There are a couple of instances of a song that's not your standard Mario jingle or the Final Fantasy melody that gets your gamer brain going ""Hell yeah, this is that shit right there"" what songs are they? ",FellowDeviant,1h8bhdn,https://reddit.com/r/gaming/comments/1h8bhdn/what_song_nonost_in_a_game_makes_you_go_hell_yeah/,https://www.reddit.com/r/gaming/comments/1h8bhdn/what_song_nonost_in_a_game_makes_you_go_hell_yeah/,2024-12-06 20:54:28,23,0.67,23,0,123,0,0,False,False,True,False,False,,self,t3_1h8bhdn
gaming,Cosplay Bloodrayne ,,Lavenok,1h7kc1r,https://reddit.com/r/gaming/comments/1h7kc1r/cosplay_bloodrayne/,https://i.redd.it/j60s0sa7l35e1.jpeg,2024-12-05 21:26:22,1767,0.83,1767,0,87,0,0,False,False,False,False,False,,https://b.thumbs.redditmedia.com/nqXmEcHT2aINmj3EbzzsnKmNYS__uROSmBYk5vm06hk.jpg,t3_1h7kc1r
gaming,Made these pen holders for a work buddy,,raisedbytides,1h7b8po,https://reddit.com/r/gaming/comments/1h7b8po/made_these_pen_holders_for_a_work_buddy/,https://i.redd.it/co2i7t5jp15e1.jpeg,2024-12-05 15:07:07,4854,0.97,4854,0,213,0,0,False,False,False,False,False,,https://b.thumbs.redditmedia.com/H5RbqAU7wrSE36onMigyYSMs72eHfc6S27bmvHnZihc.jpg,t3_1h7b8po
gaming,"Shuhei Yoshida recreates ""This is how you share your games on PS4"" moment with Stellar Blade Director",,Imaginary_Cause2216,1h7cz6b,https://reddit.com/r/gaming/comments/1h7cz6b/shuhei_yoshida_recreates_this_is_how_you_share/,https://i.redd.it/c343jnxw225e1.jpeg,2024-12-05 16:22:21,3813,0.95,3813,0,147,0,0,False,False,False,False,False,,https://b.thumbs.redditmedia.com/P01NEodXVSaTYu_wjxxdcbdVyHvz18Zn9sAIH24vB4I.jpg,t3_1h7cz6b
gaming,TRIBES: The Most Influential FPS You Never Played,,FishStix1,1h7dxcx,https://reddit.com/r/gaming/comments/1h7dxcx/tribes_the_most_influential_fps_you_never_played/,https://www.youtube.com/watch?v=cgcXD0vZsrs,2024-12-05 17:01:45,3039,0.9,3039,0,1147,0,0,False,False,False,False,False,,https://b.thumbs.redditmedia.com/2x4aXmwkv6FO7VokdDqGgzVh1IexBx8nQvvNJVFqrUA.jpg,t3_1h7dxcx
gaming,Lego Star Wars: The SkyWalker Saga is free on the Epic Game Store until 12/12. ,,Jazzlike-Lunch5390,1h7k3o6,https://reddit.com/r/gaming/comments/1h7k3o6/lego_star_wars_the_skywalker_saga_is_free_on_the/,https://store.epicgames.com/en-US/p/lego-star-wars-the-skywalker-saga,2024-12-05 21:16:42,1282,0.91,1282,0,162,0,0,False,False,False,False,False,,default,t3_1h7k3o6
gaming,Looking for text based rpg’s with automated combat,"Way back in the day I used to play a browser game that was text based with basic imagery of your character.

You could do quests, explore dungeons, fight in an arena and there was a PvP ladder (PvP ladder is not necessary)

During the fights you would get a rundown of how the fight went, example:

Player hit Goblin with a heavy attack inflicting 10 damage

Goblin hit Player with “Fireball” but Player managed to block 5 damage. Etc

You could use items and certain cooldowns before each fight to help you out but not during the fights themselves.

Any and all recommendations of similar games are very much appreciated!
Can be browser based or require download or purchase",AverageBad,1h8qfmo,https://reddit.com/r/gaming/comments/1h8qfmo/looking_for_text_based_rpgs_with_automated_combat/,https://www.reddit.com/r/gaming/comments/1h8qfmo/looking_for_text_based_rpgs_with_automated_combat/,2024-12-07 11:19:27,0,0.47,0,0,16,0,0,False,False,True,False,False,,self,t3_1h8qfmo
gaming,This Is Why Real Time Cutscenes Are Superior,,fusinaz,1h7hi7i,https://reddit.com/r/gaming/comments/1h7hi7i/this_is_why_real_time_cutscenes_are_superior/,https://youtu.be/2-Wj4-BCcME?si=onlIc1uPLQcUQKt0,2024-12-05 19:28:51,1547,0.91,1547,0,87,0,0,False,False,False,False,True,,spoiler,t3_1h7hi7i
gaming,Stuck between Evil Tonight and We Love Katamari REROLL,"Both games are currently on sale on Switch but I can't decide between the two.

For anyone that has played either game feel free to weigh in in the comments.",CaptainAnimeTitties,1h8pi8g,https://reddit.com/r/gaming/comments/1h8pi8g/stuck_between_evil_tonight_and_we_love_katamari/,https://www.reddit.com/r/gaming/comments/1h8pi8g/stuck_between_evil_tonight_and_we_love_katamari/,2024-12-07 10:10:10,0,0.5,0,0,5,0,0,False,False,True,False,False,,self,t3_1h8pi8g
gaming,Favorite ways music is weaved into gameplay in otherwise non-musical games? ,"Was just listening to my favorite boss fight soundtrack and it got me thinking. That boss in particular was music themed - Hyperion from Returnal. He attacks you with the power of his instrument, an alien pipe organ. The fight itself is great, but the music and specifically how it's incorporated into the fight truly elevates it into my favorite boss hands down. 
  
What other games are there that weave their music into gameplay in similar ways, while also not being necessarily thought of as a ""music game"" or ""rhythm game?""
  

Edit: Another great example is Rain World's threat themes that vary in intensity as you are in more hazardous situations: https://youtu.be/or9GhWqx0P0?si=r4ORtfw4ogWFU2il",legomann97,1h8dsmj,https://reddit.com/r/gaming/comments/1h8dsmj/favorite_ways_music_is_weaved_into_gameplay_in/,https://www.reddit.com/r/gaming/comments/1h8dsmj/favorite_ways_music_is_weaved_into_gameplay_in/,2024-12-06 22:37:38,7,0.6,7,0,56,0,0,False,False,True,False,False,,self,t3_1h8dsmj
