subreddit,title,selftext,author,id,permalink,url,created_utc,score,upvote_ratio,ups,downs,num_comments,total_awards_received,gilded,is_video,is_original_content,is_self,over_18,spoiler,link_flair_text,thumbnail,name
gaming,Does anyone here use walkthroughs for horror games?,"I'm not scared by horror games actually, but one thing I absolutely HATE about this genre are all the annoying puzzles everywhere. You need to somehow find the key to this to unlock that then backtrack to a very specific location etc. It really detracts from the gaming experience for me. So far I've used walkthroughs for virtually all the RE games I've played (RE6, RE7, the remakes) and games like Amnesia.

But at the same time I do find walkthroughs spoils a lot of the horror elements since the walkthrough tells me what is going to happen in advance.",WackFlagMass,1h899x9,https://reddit.com/r/gaming/comments/1h899x9/does_anyone_here_use_walkthroughs_for_horror_games/,https://www.reddit.com/r/gaming/comments/1h899x9/does_anyone_here_use_walkthroughs_for_horror_games/,2024-12-06 19:17:43,0,0.29,0,0,15,0,0,False,False,True,False,False,,self,t3_1h899x9
gaming,"I still have my original copy of Half Life 2. Was a Christmas gift from my wife in 2004, though I think she gave it to me a little earlier.",,ecnerwal1234,1h6p3xg,https://reddit.com/r/gaming/comments/1h6p3xg/i_still_have_my_original_copy_of_half_life_2_was/,https://i.redd.it/i90iocwnxv4e1.jpeg,2024-12-04 19:41:58,1000,0.95,1000,0,114,0,0,False,False,False,False,False,,https://b.thumbs.redditmedia.com/uAWxExwbLakyeYoiIjJRDkBtOSJE59379qBVnYiXEns.jpg,t3_1h6p3xg
gaming,Looking for new games to play after finishing Divinity Original Sin 2 on Xbox one. ,"I just finished Divinity Original Sin 2, and loved it.  I'm looking for something else to play now.  Would love an Rpg suggestion, but anything will do.

I've played Torment: Tales of Numenora, and both Pillars of Eternity games, so leave them out

Edit: I don't have a series X or S so please limit suggestions to Xbox one, that's why I specifically said Xbox one in the title.",SavageTS1979,1h7opia,https://reddit.com/r/gaming/comments/1h7opia/looking_for_new_games_to_play_after_finishing/,https://www.reddit.com/r/gaming/comments/1h7opia/looking_for_new_games_to_play_after_finishing/,2024-12-06 00:41:16,2,0.53,2,0,85,0,0,False,False,True,False,False,,self,t3_1h7opia
gaming,Kingmakers | Winter Games Expo Trailer - Early Access Release in Q1 2025 AD,,abcinng,1h6pvu2,https://reddit.com/r/gaming/comments/1h6pvu2/kingmakers_winter_games_expo_trailer_early_access/,https://www.youtube.com/watch?v=ZXujvsd9C58,2024-12-04 20:13:03,755,0.96,755,0,44,0,0,False,False,False,False,False,,https://b.thumbs.redditmedia.com/svrxWUTCM4_Szp4esiX7KXaExvNE_MZ_WcVyjbx_r9s.jpg,t3_1h6pvu2
gaming,Initial Marvel Rival Thoughts?,"I’ve only put about 3-4 hours into Marvel Rivals last night, so it’s still really early, and I don’t have any real definitive opinions yet.

But my initial thoughts are more so about how great of an initial “free to play, GaaS package” this game is starting out as.

These past few years have been pretty rough for new GaaS titles with the majority of them outright failing.

Now there’s different reasons for these failures, that are unique to the titles themselves. 

But I am really impressed that NetEase clearly “read the room” and ensured that a lot of quality of life aspects are in Rivials day one. Which is sadly far from the norm with GaaS titles. 

Not to mention this is probably one of the best performing GaaS titles to come out in a long time. I didn’t wait at all to get into matches, no lag, no replay in inputs. 

Overall I’m pretty positive on Rivals for now. ",Hungry-Sir6349,1h83h6i,https://reddit.com/r/gaming/comments/1h83h6i/initial_marvel_rival_thoughts/,https://www.reddit.com/r/gaming/comments/1h83h6i/initial_marvel_rival_thoughts/,2024-12-06 15:10:46,0,0.45,0,0,80,0,0,False,False,True,False,False,,self,t3_1h83h6i
gaming,Blizzard - Get Rid Of Your Battle.net logins. Honestly.,"Trying to play Diablo 4 with my wife who does not like to play video games. Why did I need to sign up for an account? Even worse, she had to for couch coop as well. Took 25min, enough time for her to lose interest.

Edit: After reading the comments... finally got to play and she is enjoying it because of the simplicity of the game. So, yes Blizzard and companies need to knock this crap off in their games.",Money_Tough,1h8i9u0,https://reddit.com/r/gaming/comments/1h8i9u0/blizzard_get_rid_of_your_battlenet_logins_honestly/,https://www.reddit.com/r/gaming/comments/1h8i9u0/blizzard_get_rid_of_your_battlenet_logins_honestly/,2024-12-07 02:19:10,0,0.29,0,0,53,0,0,False,False,True,False,False,,self,t3_1h8i9u0
gaming,I remember playing the first one on PlayStation but never beating it. (Soul Reaver 1+2 Remaster),,RL_CaptainMorgan,1h7dk5x,https://reddit.com/r/gaming/comments/1h7dk5x/i_remember_playing_the_first_one_on_playstation/,https://www.ign.com/videos/legacy-of-kain-soul-reaver-1-2-remastered-official-launch-trailer,2024-12-05 16:46:46,17,0.67,17,0,12,0,0,False,False,False,False,False,,https://b.thumbs.redditmedia.com/RobrjvrjdMWnUxaBGASJ3qRimdYYJYqmc3zJTy1IwFA.jpg,t3_1h7dk5x
gaming,Which game to get? ,"Evening All,

I have £25 burning a hole in my pocket  and I have the choice between Caves Of Qud or Drova - Forsaken Kin! 

What would you choose?

Thanks in advance! 

",fartforce5000,1h884av,https://reddit.com/r/gaming/comments/1h884av/which_game_to_get/,https://www.reddit.com/r/gaming/comments/1h884av/which_game_to_get/,2024-12-06 18:28:34,0,0.32,0,0,3,0,0,False,False,True,False,False,,self,t3_1h884av
gaming,What are some sleeper hit games that people should give more attention to?,"For me, it’s probably Teardown and Children of the Sun.

Teardown is a game where you can destroy anything and everything. It’s the perfect vandalism/heist game too. But I do not recommend the DLC’s. Most are hit or miss. But there is a modding community that frequently makes new content for others to play.

As for Children of the Sun. It’s a game where you have one single Sniper Rifle bullet, and you must make the bullet change trajectory to kill multiple enemies. 

Think of it like the Sniper Elite games, but it’s also a puzzle as well. You have to find out the best path and use shortcuts to your advantage.

Both of these games have amazing Indie devs and they deserve so much praise. You won’t regret getting these two. Pick them up on a sale.",Brungala,1h7ry8s,https://reddit.com/r/gaming/comments/1h7ry8s/what_are_some_sleeper_hit_games_that_people/,https://www.reddit.com/r/gaming/comments/1h7ry8s/what_are_some_sleeper_hit_games_that_people/,2024-12-06 03:23:36,2,0.51,2,0,106,0,0,False,False,True,False,False,,self,t3_1h7ry8s
gaming,What bands/ songs/ albums remind you of playing a game?,"For me- Pantera Far Beyond Driven: Ocarina of Time (Water Temple specifically), Bloodhound Gang Hooray For Boobies: GTA 2, early-to-mid '90's Guided By Voices; Civ  6",DarmiansMuttonChops,1h7el44,https://reddit.com/r/gaming/comments/1h7el44/what_bands_songs_albums_remind_you_of_playing_a/,https://www.reddit.com/r/gaming/comments/1h7el44/what_bands_songs_albums_remind_you_of_playing_a/,2024-12-05 17:29:00,14,0.64,14,0,70,0,0,False,False,True,False,False,,self,t3_1h7el44
gaming,Legacy of Kain: Soul Reaver 1 &amp; 2 Remastered - Launch Trailer,,Apprehensive_Day212,1h6y3ls,https://reddit.com/r/gaming/comments/1h6y3ls/legacy_of_kain_soul_reaver_1_2_remastered_launch/,https://youtu.be/LpKy31RzDBA?si=8oBG2TtggrGhV0k3,2024-12-05 02:10:43,176,0.92,176,0,66,0,0,False,False,False,False,False,,https://b.thumbs.redditmedia.com/HBLtgYAhAZoIz2nREeVZw5YCDt36evEfwxg1rxq1FUY.jpg,t3_1h6y3ls
gaming,"welp, there goes my weekend",,rsjpeckham,1h6gj4d,https://reddit.com/r/gaming/comments/1h6gj4d/welp_there_goes_my_weekend/,https://i.redd.it/jtyf6wno7u4e1.jpeg,2024-12-04 13:54:34,1431,0.93,1431,0,53,0,0,False,False,False,False,False,,https://b.thumbs.redditmedia.com/cbg78vUtsreP5YNZy2UMhuSy_ShJJEgoRslv4cm_vHM.jpg,t3_1h6gj4d
gaming,Warning: GameStop sells open games as “New” and put them in these crappy plastic bag. ,,landofthebeez,1h830zm,https://reddit.com/r/gaming/comments/1h830zm/warning_gamestop_sells_open_games_as_new_and_put/,https://i.redd.it/3o1eagthr85e1.jpeg,2024-12-06 14:50:32,0,0.48,0,0,82,0,0,False,False,False,False,False,,https://b.thumbs.redditmedia.com/9jAI8n9-sK9lAMwMRIjyxL-4cH15i3YNEyYGU_U9bAs.jpg,t3_1h830zm
gaming,"After more than 20 years, I went back to Disney's Tarzan (1999) and finally took down Clayton. Watching him fall from that cliff was the most satisfying thing I've done all week. Childhood me can finally rest easy :) ",,mason_mte,1h6tfc7,https://reddit.com/r/gaming/comments/1h6tfc7/after_more_than_20_years_i_went_back_to_disneys/,https://i.redd.it/6jbbv0vxsw4e1.gif,2024-12-04 22:37:28,230,0.94,230,0,17,0,0,False,False,False,False,True,,spoiler,t3_1h6tfc7
gaming,Dragon Age Veilguard is 30% off on consoles nearly 1 month after release,"I just saw on the official Dragon age Facebook page that Dragon Age Veilguard is 30% off.

This only 1 month after release. I know we are after Black Friday and near Christmas, but do you know its a hint about how game did sale and it's success?

  
It may be the time for people to grab it if they didnt ant to pay full price.",AigledeFeu_,1h88jj3,https://reddit.com/r/gaming/comments/1h88jj3/dragon_age_veilguard_is_30_off_on_consoles_nearly/,https://www.reddit.com/r/gaming/comments/1h88jj3/dragon_age_veilguard_is_30_off_on_consoles_nearly/,2024-12-06 18:46:30,0,0.29,0,0,39,0,0,False,False,True,False,False,,self,t3_1h88jj3
gaming,The hidden master,,DreadedDrMaybe,1h648xr,https://reddit.com/r/gaming/comments/1h648xr/the_hidden_master/,https://i.redd.it/vtenpyf0jq4e1.jpeg,2024-12-04 01:30:56,8577,0.96,8577,0,241,0,0,False,False,False,False,False,,https://b.thumbs.redditmedia.com/hQAR4cfSg1osdRKZPooyHQltkD11t0PDJhP-gQiYdfM.jpg,t3_1h648xr
gaming,"Casual spoilers (in Fallout, Silent Hill, Ghost of Tsushima subreddits)","This is honestly out of control, how many people just blurt spoilers constantly in Fallout, Silent Hill, Ghost of Tsushima and etc subreddits.

Listen. It does not matter how long a game has been out. Just blurting spoilers with no warning left and right is asinine and ignorant, plain and simple. I asked the Silent Hill sub to post spoiler tags and got mobbed over it.

Some people are broke. Some people are young and new to games. And on top of that, some of us take time playing games, be it by choice or time restrictions.

Again. It doesn’t matter how long a game has been out. I have a right to interact on a subreddit, spoiler free, without being mobbed for asking people to stop blatantly spoiling plot points. 

That is literally what spoiler tags are for. Instead I get literal screenshots of the endings to games or casual plot points in random comments.

It is toxic and ignorant. Plain and simple. It’s bad enough I can’t google a game without spoilers. 

Be better. ",DynamicThreads,1h8bifu,https://reddit.com/r/gaming/comments/1h8bifu/casual_spoilers_in_fallout_silent_hill_ghost_of/,https://www.reddit.com/r/gaming/comments/1h8bifu/casual_spoilers_in_fallout_silent_hill_ghost_of/,2024-12-06 20:55:48,0,0.24,0,0,33,0,0,False,False,True,False,True,,spoiler,t3_1h8bifu
gaming,XDefiant officially shutting down as Ubisoft announces FPS end date,,BigT232,1h62k12,https://reddit.com/r/gaming/comments/1h62k12/xdefiant_officially_shutting_down_as_ubisoft/,https://www.dexerto.com/gaming/xdefiant-officially-shutting-down-2997613/,2024-12-04 00:12:12,7997,0.97,7997,0,1244,0,0,False,False,False,False,False,,https://b.thumbs.redditmedia.com/tliIphH3VnjUdEC7SLpQDDxD0V3GCwPRokQg_ILUOuM.jpg,t3_1h62k12
gaming,The most 2009 video game choice,,JustTrollingYou,1h634lo,https://reddit.com/r/gaming/comments/1h634lo/the_most_2009_video_game_choice/,https://i.imgur.com/6xKo70k.png,2024-12-04 00:38:17,6899,0.94,6899,0,422,0,0,False,False,False,False,False,,https://b.thumbs.redditmedia.com/4zajYl4iqlP4SZV4CckPDzq_8PTQwiUMOYfs4fkwsaw.jpg,t3_1h634lo
gaming,The most 2009 video game choice ,inFamous ,NoLastNameForNow,1h5xa7d,https://reddit.com/r/gaming/comments/1h5xa7d/the_most_2009_video_game_choice/,https://i.redd.it/i1sxq8f61p4e1.jpeg,2024-12-03 20:29:12,23875,0.95,23875,0,856,0,0,False,False,False,False,False,,https://a.thumbs.redditmedia.com/ZV7OwEK-PGhBvLreJb-CIULoDZsUOdiNp7csrb6-cb0.jpg,t3_1h5xa7d
gaming,What game has the biggest issue with money being worthles?,"Money makes the world go round, but in many video game worlds, it often ends up worthless, so monetary rewards can end up moot.

The Legend of Zelda series has a recurring problem, the worst cases I have seen are Breath of the Wild and Echoes of Wisdom (I haven't played Tears yet). Despite Breath of the Wild not having money you can find by cutting grass, you still end up with more than you'll ever need because you can sell virtually anything you come across. I often ended up netting a profit from shopping by selling a fraction of the stuff you collect. The are items for sale you can use in cooking, and I didn't buy most of them because the stuff I found worked fine.

The most annoying part for me was that shops did sell special arrows except they quit restocking them if you had enough in your inventory so I was better off find enemies to get more. Past the early game I didn't need money for anything besides upgrading armor and quests.

Echoes of Wisdom has health items for sale, that there isn't a ton of need for when you can use a bed to recover your health for free.

However, the worst case I have seen is Xenoblade 3. This is a JRPG where you don't buy weapons or armor. Like its predecessors, you also heal out of combat, KOed characters revive after a fight, and in this game, your healers can be revived KOed characters an unlimited number of times during a fight. As a result, a lot of commonly seen RPG items aren't in this game removing a lot you can spend money on.

There are items for sale you can use in quests and cooking, I got buy without needing to use the cooking mechanic and for the most you can find items for quests without spending any money. The accessories for sale have use on paper except exploring the map almost always let to better ones.

The Land of Challenge DLC was the final nail in the coffin since while it does require grinding resources there you can get better stuff for clearing its challenges than from shops.

None of this makes these games bad, it just feels weird to carry around so much cash and not have a use for it.",Sensitive-Hotel-9871,1h6g2sj,https://reddit.com/r/gaming/comments/1h6g2sj/what_game_has_the_biggest_issue_with_money_being/,https://www.reddit.com/r/gaming/comments/1h6g2sj/what_game_has_the_biggest_issue_with_money_being/,2024-12-04 13:32:56,488,0.86,488,0,610,0,0,False,False,True,False,False,,self,t3_1h6g2sj
gaming,"Kingdom Come: Deliverance 2 will offer 60fps on PS5/XSX, new release date February 4th",,Paul_cz,1h6lhv2,https://reddit.com/r/gaming/comments/1h6lhv2/kingdom_come_deliverance_2_will_offer_60fps_on/,https://x.com/WarhorseStudios/status/1864354217139314820,2024-12-04 17:19:08,233,0.93,233,0,54,0,0,False,False,False,False,False,,https://b.thumbs.redditmedia.com/Yqj1Xg20dPCWRxPupknxYwo9FH1Wfw25m7VSYolhdzM.jpg,t3_1h6lhv2
gaming,What's a habit that you have in multiple different games,My roommate has to unlock every fast travel location as soon as physically possible in every game he plays. When he played Tears of the Kingdom he spent 20 hours going around all of the map unlocking stuff. What's something you are compelled to do no matter what game it is?,lordlemming,1h6g8lr,https://reddit.com/r/gaming/comments/1h6g8lr/whats_a_habit_that_you_have_in_multiple_different/,https://www.reddit.com/r/gaming/comments/1h6g8lr/whats_a_habit_that_you_have_in_multiple_different/,2024-12-04 13:40:31,419,0.91,419,0,681,0,0,False,False,True,False,False,,self,t3_1h6g8lr
gaming,A map of my 1:1 fictional Minecraft City after nearly 5 years of work. 2024 update. ,,KanyeWaste69,1h679mu,https://reddit.com/r/gaming/comments/1h679mu/a_map_of_my_11_fictional_minecraft_city_after/,https://i.redd.it/fmzvjeqs9r4e1.png,2024-12-04 04:03:46,2171,0.95,2171,0,93,0,0,False,False,False,False,False,,https://b.thumbs.redditmedia.com/sX47EVVxir4Thn80U-mWvl_kcA_xvQt7VcJEcnJCpBk.jpg,t3_1h679mu
gaming,What are some good Christmasy games ?,"Currently replaying Arkham Origins, and it made me think that there aren't many games set around the holiday season. What do you play for the xmas vibes? World of warcraft always reminds me of Christmas, especially Wotlk. Also Skyrim. Anything with snow.",treefruit,1h6zmxz,https://reddit.com/r/gaming/comments/1h6zmxz/what_are_some_good_christmasy_games/,https://www.reddit.com/r/gaming/comments/1h6zmxz/what_are_some_good_christmasy_games/,2024-12-05 03:25:58,28,0.75,28,0,86,0,0,False,False,True,False,False,,self,t3_1h6zmxz
gaming,"How ‘Indiana Jones’ and ‘Call of Duty’ Are Pushing Xbox Ahead of PlayStation, Nintendo in a Next Gen Console-Less Holiday Season",,littlemushroompod,1h895j5,https://reddit.com/r/gaming/comments/1h895j5/how_indiana_jones_and_call_of_duty_are_pushing/,https://variety.com/2024/gaming/news/indiana-jones-and-the-great-circle-preview-video-game-plot-details-1236233902/,2024-12-06 19:12:30,0,0.27,0,0,75,0,0,False,False,False,False,False,,https://a.thumbs.redditmedia.com/f5rUCJfv7FoPGgBvndHqUJ9wmJd-m_CtROLN1HZwXF8.jpg,t3_1h895j5
gaming,This should be on the list of remakes ,,Essa_ea,1h6r84r,https://reddit.com/r/gaming/comments/1h6r84r/this_should_be_on_the_list_of_remakes/,https://i.redd.it/kcdrpwaycw4e1.jpeg,2024-12-04 21:07:41,84,0.73,84,0,58,0,0,False,False,False,False,False,,https://b.thumbs.redditmedia.com/nwYIz5021gZDECz8Rsmc0Vwh14tuV4t3zUOUWKOOzIE.jpg,t3_1h6r84r
gaming,How to deal with gaming FOMO?,"I can never focus on one game at a time. When I play one, i’m already thinking about others I want to play or replay, and because of that, i can’t really enjoy any of them… any tips?",Edu_Vivan,1h7xu7t,https://reddit.com/r/gaming/comments/1h7xu7t/how_to_deal_with_gaming_fomo/,https://www.reddit.com/r/gaming/comments/1h7xu7t/how_to_deal_with_gaming_fomo/,2024-12-06 09:44:37,0,0.39,0,0,49,0,0,False,False,True,False,False,,self,t3_1h7xu7t
gaming,Ubisoft Now Allows Rewards Points to be used on Pre-Orders and New Release Titles,"Ubisoft Now Allows Rewards Points to be used on Pre-Orders and New Release Titles as of December 5th

Seems like a reaction to losing money?

https://preview.redd.it/13mekbeuz65e1.png?width=2377&amp;format=png&amp;auto=webp&amp;s=0ce433330727c96b9a6517301c2fce214dd4e3b4

",FOXYRAZER,1h7x62p,https://reddit.com/r/gaming/comments/1h7x62p/ubisoft_now_allows_rewards_points_to_be_used_on/,https://www.reddit.com/r/gaming/comments/1h7x62p/ubisoft_now_allows_rewards_points_to_be_used_on/,2024-12-06 08:53:32,0,0.34,0,0,10,0,0,False,False,True,False,False,,https://a.thumbs.redditmedia.com/4T6OkfhGdFnIRuEbgmn37pLKQ3Yvhr0Ig5GmjNPDe_8.jpg,t3_1h7x62p
gaming,"Currently sitting at 86/100, if this holds, Indiana Jones and the Great Circle will have a higher Metacritic score than all but FOUR Star Wars video game titles released in the past three decades","2003 (XBOX) Star Wars: Knights of the Old Republic -  94

1997 (PC) Star Wars Jedi Knight: Dark Forces II - 91

2001 (GC) Star Wars Rogue Leader: Rogue Squadron II - 90

2002 (PC) Star Wars Jedi Knight II: Jedi Outcast - 89

2024 (XSX) Indiana Jones and the Great Circle - 86

2004 (XBOX) Star Wars: Knights of the Old Republic II - The Sith Lords - 86

2023 (PS5) Star Wars Jedi Survivor - 85

2011 (PC) Star Wars The Old Republic - 85

1998 (N64) Star Wars Rogue Squadron 3D - 85

Per Metacritic - [https://www.metacritic.com/search/star%20wars/?page=1&amp;category=13&amp;sortBy=META\_SCORE](https://www.metacritic.com/search/star%20wars/?page=1&amp;category=13&amp;sortBy=META_SCORE)

",TheEmeraldRaven,1h7wv3w,https://reddit.com/r/gaming/comments/1h7wv3w/currently_sitting_at_86100_if_this_holds_indiana/,https://www.reddit.com/r/gaming/comments/1h7wv3w/currently_sitting_at_86100_if_this_holds_indiana/,2024-12-06 08:30:14,0,0.36,0,0,18,0,0,False,False,True,False,False,,self,t3_1h7wv3w
gaming,I gathered all my controllers! Pretty grateful for my gaming journey. (my mother sold my N64 when I was a kid :( ),,6Kaliba9,1h6vens,https://reddit.com/r/gaming/comments/1h6vens/i_gathered_all_my_controllers_pretty_grateful_for/,https://i.redd.it/ahn6xijh8x4e1.jpeg,2024-12-05 00:04:25,26,0.62,26,0,19,0,0,False,False,False,False,False,,https://a.thumbs.redditmedia.com/PFDnCn3Kv6UAsc9nPXCECmcAGWQpaAr8TB6b3t26eu4.jpg,t3_1h6vens
gaming,The Pokémon TCGP experience ,,TheSpectacularBagMan,1h6cswa,https://reddit.com/r/gaming/comments/1h6cswa/the_pokémon_tcgp_experience/,https://i.redd.it/xc54xzzd4t4e1.png,2024-12-04 10:14:19,281,0.85,281,0,105,0,0,False,False,False,False,False,,https://b.thumbs.redditmedia.com/jLldjrOoX_L-ffkll80ZDw0UUFqg-DZ3cYwC3yFg1eI.jpg,t3_1h6cswa
gaming,"Former PlayStation exec says there's a ""collapse of creativity"" in the industry","&gt;""Today, the entry costs for making a AAA game is in triple digit millions now,"" he continued. ""I think naturally, risk tolerance drops. And you're [looking] at sequels, you're looking at copycats, because the finance guys who draw the line say, 'Well, if Fortnite made this much money in this amount of time, my Fortnite knockoff can make this in that amount of time.' We're seeing a collapse of creativity in games today [with] studio consolidation and the high cost of production.""

Sequels and requels; the Disney™️ accountant model. ",rematar,1h5q5ib,https://reddit.com/r/gaming/comments/1h5q5ib/former_playstation_exec_says_theres_a_collapse_of/,https://www.eurogamer.net/former-playstation-exec-says-theres-a-collapse-of-creativity-in-the-industry,2024-12-03 15:35:00,11066,0.96,11066,0,1485,0,0,False,False,False,False,False,,https://b.thumbs.redditmedia.com/CnxzdyRaKnHUyz5JBPPI9MI7Jnj4kQhQTDwQCLcOj0Y.jpg,t3_1h5q5ib
gaming,Purchased sonic 3D blast before it’s gone for good (or sm) ,"Sega can be sorta cool and release cool games, and then cruel and take shit away",ZenKoko,1h7ude8,https://reddit.com/r/gaming/comments/1h7ude8/purchased_sonic_3d_blast_before_its_gone_for_good/,https://www.reddit.com/r/gaming/comments/1h7ude8/purchased_sonic_3d_blast_before_its_gone_for_good/,2024-12-06 05:39:34,0,0.21,0,0,11,0,0,False,False,True,True,False,,nsfw,t3_1h7ude8
gaming,How do I fill the hole that finishing Titanfall 2 left in me?,"After a lot of recommendations, I bought Titanfall 2 this steam sale. What I didn't know is how short this game is. As I started to become accustomed to it's gameplay and mechanics especially controlling the Titan, it ended and man i haven't been this disappointed in a while. I was really enjoying the mission design, the unique platforming, the dynamic between BT and pilot and ther overall badass feeling of controlling a giant mech.

Unfortunately for me though, I can really play online multiplayer as I don't think there are SEA servers for this game. 

Anyways I was hoping you guys could recommend me some games which offer the same unique gameplay as Titanfall 2.

Really appreciate your suggestions..",Top_Distribution_497,1h6ib47,https://reddit.com/r/gaming/comments/1h6ib47/how_do_i_fill_the_hole_that_finishing_titanfall_2/,https://www.reddit.com/r/gaming/comments/1h6ib47/how_do_i_fill_the_hole_that_finishing_titanfall_2/,2024-12-04 15:11:26,94,0.69,94,0,178,0,0,False,False,True,False,False,,self,t3_1h6ib47
gaming,I'm tired of compiling shaders ,"Legit every game now. 

Stalker 2 takes 5+min to launch because of these damn shaders. Like, why tf wasn't this done already? I don't remember having to do this 5+ years ago, and I honestly don't feel like this shit makes me enjoy games more. ",dtv20,1h7r5bk,https://reddit.com/r/gaming/comments/1h7r5bk/im_tired_of_compiling_shaders/,https://www.reddit.com/r/gaming/comments/1h7r5bk/im_tired_of_compiling_shaders/,2024-12-06 02:43:10,0,0.42,0,0,42,0,0,False,False,True,False,False,,self,t3_1h7r5bk
gaming,[RANT] I need a new open world pirate game!,"I want to catch the horizon. I want to feel lonely. I want to sail between wind and tide. And then I want action, islands to explore, treasure to loot. I want NMS on the water. Give me a near accurate map of the Caribbean and enough control without being a full on simulator; I don't need to know what every rope does. Maybe I'm a merchant, maybe I'm a pirate, privateer, navy sailor... Give me something! [END RANT]

fuck.... I'm about to play Black Flag again....",TiresOnFire,1h6yj7k,https://reddit.com/r/gaming/comments/1h6yj7k/rant_i_need_a_new_open_world_pirate_game/,https://www.reddit.com/r/gaming/comments/1h6yj7k/rant_i_need_a_new_open_world_pirate_game/,2024-12-05 02:32:05,10,0.55,10,0,44,0,0,False,False,True,False,False,,self,t3_1h6yj7k
gaming,What game to play while quarantined?,"For the first time, I’ve contracted COVID (and man does it suck). So I figured while I’m quarantining in my office/man cave, I might as well finish one of the games that I have put off for years. So, what would you guys recommend? The options are:

Death Stranding

Cyberpunk 2077

Returnal

Thanks for your suggestions!

Edit: fixed formatting. Realized the options I listed were in-line instead of on separate lines. ",slicklikeagato,1h7rcud,https://reddit.com/r/gaming/comments/1h7rcud/what_game_to_play_while_quarantined/,https://www.reddit.com/r/gaming/comments/1h7rcud/what_game_to_play_while_quarantined/,2024-12-06 02:54:05,0,0.35,0,0,24,0,0,False,False,True,False,False,,self,t3_1h7rcud
