subreddit,title,selftext,author,id,permalink,url,created_utc,score,upvote_ratio,ups,downs,num_comments,total_awards_received,gilded,is_video,is_original_content,is_self,over_18,spoiler,link_flair_text,thumbnail,name
gaming,Been playing Skyrim for a long time and still find the music to be next level. Is it one of the best soundtracks of all time?,"Every single track works wonderfully, no matter where you are or what you are doing it just hits on many emotional levels.",Kinetic_Pen,1h7tpvy,https://reddit.com/r/gaming/comments/1h7tpvy/been_playing_skyrim_for_a_long_time_and_still/,https://www.reddit.com/r/gaming/comments/1h7tpvy/been_playing_skyrim_for_a_long_time_and_still/,2024-12-06 05:01:38,144,0.76,144,0,114,0,0,False,False,True,False,False,,self,t3_1h7tpvy
gaming,I digged up a screen cap from 19 years ago,COD 1 - OG,Bounder1103,1h7ackk,https://reddit.com/r/gaming/comments/1h7ackk/i_digged_up_a_screen_cap_from_19_years_ago/,https://i.redd.it/ke122a49i15e1.jpeg,2024-12-05 14:26:16,2093,0.79,2093,0,329,0,0,False,False,False,False,False,,https://a.thumbs.redditmedia.com/noCmNEQWvqoHv6YOVAZHI-xa3SCm_5Pq1IshAUZU1q0.jpg,t3_1h7ackk
gaming,Co-Op PC games after BG3,"Hi All! 

I have a group of 2 fellows and the 3 of us like to play games together. We have recently played Divinity Original Sin2, and are wrapping up our 2nd playtrhu in BG3 after a brief stint in Diablo 4 VoH. 

My question is simple: Is there any game out there that will allow me to play with my mates (required) and also help scratch various itches? My itches include RPG elements/good story/PvP (but not JUST PvP), and stretegy. I know that sounds like MMO stuff, but we all played WoW and various other MMOs for years and years and now we are in our late 30s and cannot commit THAT kind of time. 

  
Up next on the roster is Warhammer 40k Roguetrader, which is a lot like BG3 I think - story, strategy, and RPG elements, but misses that one itch to scrath of PvP. 

Anybody feeling like me and can help a guy out? 

  
TIA. ",purplekermit,1h8mrnm,https://reddit.com/r/gaming/comments/1h8mrnm/coop_pc_games_after_bg3/,https://www.reddit.com/r/gaming/comments/1h8mrnm/coop_pc_games_after_bg3/,2024-12-07 06:47:04,0,0.47,0,0,8,0,0,False,False,True,False,False,,self,t3_1h8mrnm
gaming,Indiana Jones and the Great Circle’s early access period won’t include full ray tracing,What on earth are they doing with this game ???,Lo_jak,1h7j43b,https://reddit.com/r/gaming/comments/1h7j43b/indiana_jones_and_the_great_circles_early_access/,https://www.theverge.com/2024/12/5/24314171/indiana-jones-and-the-great-circle-early-access-full-ray-tracing,2024-12-05 20:35:52,442,0.83,442,0,191,0,0,False,False,False,False,False,,https://b.thumbs.redditmedia.com/KTl2WAgZNCeMDipzI2Ns9P5OM5y2FKacwr2lnl3RPUg.jpg,t3_1h7j43b
gaming,Is there a game you finished but then regretted all the time you spent on it?,"For me it's Euro Truck Simulator 2. It was mostly boring (imo), and I also nearly destroyed my left hand middle finger by pressing/releasing “W”, because I only found out halfway through that there was cruise control…..",YottaYobi,1h8tx0y,https://reddit.com/r/gaming/comments/1h8tx0y/is_there_a_game_you_finished_but_then_regretted/,https://www.reddit.com/r/gaming/comments/1h8tx0y/is_there_a_game_you_finished_but_then_regretted/,2024-12-07 14:44:32,0,0.42,0,0,80,0,0,False,False,True,False,False,,self,t3_1h8tx0y
gaming,My most prized possession ,So,HeartTreeHugger,1h7kndr,https://reddit.com/r/gaming/comments/1h7kndr/my_most_prized_possession/,https://i.redd.it/7byhabjkn35e1.jpeg,2024-12-05 21:39:38,289,0.85,289,0,38,0,0,False,False,False,False,False,,https://b.thumbs.redditmedia.com/4Cil6x7R7iRdDtlY0WsrI3nuFavkx4tfRBiDjThXlFQ.jpg,t3_1h7kndr
gaming,Kingdom Come: Deliverance II - Official Story Trailer,,Paul_cz,1h7llad,https://reddit.com/r/gaming/comments/1h7llad/kingdom_come_deliverance_ii_official_story_trailer/,https://www.youtube.com/watch?v=vPS-pgg3scE,2024-12-05 22:20:19,238,0.9,238,0,101,0,0,False,False,False,False,False,,https://a.thumbs.redditmedia.com/gQtJFZheylRxumblyCQgmq_jJvfWBRHTBm7b3oCSvm8.jpg,t3_1h7llad
gaming,Moonlighter 2: The Endless Vault | Announcement Trailer,,LiquifiedSpam,1h7ih4q,https://reddit.com/r/gaming/comments/1h7ih4q/moonlighter_2_the_endless_vault_announcement/,https://www.youtube.com/watch?v=uZW8MwekNHk,2024-12-05 20:09:10,337,0.94,337,0,52,0,0,False,False,False,False,False,,https://b.thumbs.redditmedia.com/28lYRuoJ5pC5plRN1Bim7G5TuS4DGwqf_scRcVOiVKQ.jpg,t3_1h7ih4q
gaming,A use for AI in games that nobody could reasonably complain about ,"Okay so there's a bajillion games out there with voice acting that let you name your player, right? And yet NOBODY in these games calls you by name. 

It kinda breaks immersion for me when I'm only ever referred to as ""Hero"" or ""Captain"" or whatnot. So just add some AI redubbing to replace a placeholder word with your character's name!

I don't think anyone can reasonably complain about this idea because:

A) AI voice redubbing is pretty darn high quality atm, it won't sound like ""slop"".

2) It's not taking jobs away from anyone, particularly not voice actors.

III) You can finally have NPCs refer to you as BonerHaver9000 as God intended.",varkarrus,1h8tan8,https://reddit.com/r/gaming/comments/1h8tan8/a_use_for_ai_in_games_that_nobody_could/,https://www.reddit.com/r/gaming/comments/1h8tan8/a_use_for_ai_in_games_that_nobody_could/,2024-12-07 14:12:12,0,0.39,0,0,21,0,0,False,False,True,False,False,,self,t3_1h8tan8
gaming,Need some co-pp split screen recommendations for ps4,"I need some good 2 player recommendations for ps4. My fiance likes mostly surviva and RPG type games but will also play some more action type games. We've tried ARK but the games bugged and creates weird shadows on the bottom screen.   

She tried borderlands but it was a little too fast paced, she doesnt love FPS and trying to menu is weird. We've played some Minecraft but got bored of it. Any recommendations would be very helpful!   

EDIT: Thank you everyone for the suggestions! Very much appreciates. I'll look into these games!",PM_ME_YOUR_ANT_FARMS,1h83sr1,https://reddit.com/r/gaming/comments/1h83sr1/need_some_copp_split_screen_recommendations_for/,https://www.reddit.com/r/gaming/comments/1h83sr1/need_some_copp_split_screen_recommendations_for/,2024-12-06 15:24:54,5,0.6,5,0,23,0,0,False,False,True,False,False,,self,t3_1h83sr1
gaming,Anyone getting texture smearing on Indianna Jones xbox series x?,Hard to explain but almost like a smearing of the textures when the camera is moved quickly. Anyone else getting this? ,jayissuperman,1h8rbxa,https://reddit.com/r/gaming/comments/1h8rbxa/anyone_getting_texture_smearing_on_indianna_jones/,https://www.reddit.com/r/gaming/comments/1h8rbxa/anyone_getting_texture_smearing_on_indianna_jones/,2024-12-07 12:20:33,0,0.17,0,0,2,0,0,False,False,True,False,False,,self,t3_1h8rbxa
gaming,Used to be a huge fan of MicroMachines back in the day ! This week I released my first ever game on Steam with heavy retro arcade inspirations :D,,Zyguliptu,1h7df3d,https://reddit.com/r/gaming/comments/1h7df3d/used_to_be_a_huge_fan_of_micromachines_back_in/,https://i.redd.it/8unfbvwy525e1.gif,2024-12-05 16:40:55,327,0.88,327,0,68,0,0,False,False,False,False,False,,https://b.thumbs.redditmedia.com/U4PRvN9TFo6XW0XGd16iBy6qAWYpEqOw5LP8uAxXRms.jpg,t3_1h7df3d
gaming,POV its 2000 and you're about to buy your first pokemon game.,,ZooterTheWooter,1h6ubk9,https://reddit.com/r/gaming/comments/1h6ubk9/pov_its_2000_and_youre_about_to_buy_your_first/,https://i.redd.it/v11twczxzw4e1.jpeg,2024-12-04 23:16:34,7875,0.97,7875,0,465,0,0,False,False,False,False,False,,https://a.thumbs.redditmedia.com/82yHORgObKeFk1T1ObF8VDMRhSkELoILtufsF6lnXk4.jpg,t3_1h6ubk9
gaming,Cyberpunk multiplayer mod is coming along nicely,,gattzu20,1h7ifkw,https://reddit.com/r/gaming/comments/1h7ifkw/cyberpunk_multiplayer_mod_is_coming_along_nicely/,https://www.youtube.com/watch?v=7aE7Es1Ow6E,2024-12-05 20:07:23,133,0.79,133,0,45,0,0,False,False,False,False,False,,https://b.thumbs.redditmedia.com/SsTn76UTCqAwQfn-0GEXcS49fqPmdWUxfbshn6Bhc4o.jpg,t3_1h7ifkw
gaming,Any recommendations for comfortable earbuds?,"I'm looking for some new earbuds, preferably wired and I'd like some that don't go into my ear canal too much, just resting outside. I use them primarily for gaming, want to spend between $50-100.",StretchyPlays,1h8ds8k,https://reddit.com/r/gaming/comments/1h8ds8k/any_recommendations_for_comfortable_earbuds/,https://www.reddit.com/r/gaming/comments/1h8ds8k/any_recommendations_for_comfortable_earbuds/,2024-12-06 22:37:10,0,0.5,0,0,19,0,0,False,False,True,False,False,,self,t3_1h8ds8k
gaming,Choices matter hell...,"I have a very big issue with this type of games.

It's not a rule, but more often than not it completely breaks the game for me.

My problem with those games, is that in most cases you get locked out of part of the content, based on the decisions you made.

In my opinion this is a very poor game design, artificially forcing you to do multiple playthroughs, if you want to see complete content.

As I never do more than one playthrough of any single player game, I feel somewhat robbed of a full experience.

Another complaint that I could log, is that at their launch many of these games are not balanced well enough, meaning if you pick a ""wrong"" side, you might be underpowered, compared to others.

This inherently leads me to not playing them until at least one or two major patches land, or I might skip them completely, if they fall off my radar.

If I am being completely honest, I would also have to blame my OCD, for wanting to see, and do, everything there is in every game I play, and wanting to min-max my character(s) each time.

Anyone else out there, with similar issues?   

Edit: based on early comments, I want to elaborate.  
For me it would be a much better game design if your choices dictate on which side of the situation/discussion, your character ends up, not completely lock you out of certain content.",OhforfsakeMJ,1h8qecr,https://reddit.com/r/gaming/comments/1h8qecr/choices_matter_hell/,https://www.reddit.com/r/gaming/comments/1h8qecr/choices_matter_hell/,2024-12-07 11:16:50,0,0.28,0,0,34,0,0,False,False,True,False,False,,self,t3_1h8qecr
gaming,Texas Chain Saw Massacre: Official Bones and Wyatt Character Trailer,,Apprehensive_Day212,1h8k74u,https://reddit.com/r/gaming/comments/1h8k74u/texas_chain_saw_massacre_official_bones_and_wyatt/,https://youtu.be/kHY0ts-awVQ?si=7GxBCybp3VjIixIs,2024-12-07 04:06:15,0,0.41,0,0,4,0,0,False,False,False,False,False,,https://b.thumbs.redditmedia.com/m6QqVecTqCiDr9IOhEpDJu8M8ifah6xnolIX-gFHXOE.jpg,t3_1h8k74u
gaming,Indiana Jones is great,,TheCrach,1h8k0xd,https://reddit.com/r/gaming/comments/1h8k0xd/indiana_jones_is_great/,https://imgur.com/a/FeZuAIO,2024-12-07 03:56:09,0,0.46,0,0,3,0,0,False,False,False,False,False,,https://b.thumbs.redditmedia.com/rhc0VHDKyEDizwaD0DZ24hexvlPLlsXvYpt8fNPgJ-s.jpg,t3_1h8k0xd
gaming,Should remakes be eligible for awards other than best remake? ,"Tell me if I’m being dumb. I saw Silent Hill 2 won a bunch of awards and just got to thinking, is that frustrating for game devs who worked on brand new titles? I have enjoyed the SH2 remake, and agree that it is of award-winning quality. But the people who worked on that had an almost unfair advantage in that the difficult work of world building, story making, etc. was already done for them, and the original was popular as it was. Not that the remake wasn’t hard work, but it can’t have been harder than developing a great game from scratch. So, could it not be considered a little unfair when a remake wins awards that could have gone to a new original game?",ResponsibleGreen0,1h8jn8s,https://reddit.com/r/gaming/comments/1h8jn8s/should_remakes_be_eligible_for_awards_other_than/,https://www.reddit.com/r/gaming/comments/1h8jn8s/should_remakes_be_eligible_for_awards_other_than/,2024-12-07 03:34:36,0,0.33,0,0,11,0,0,False,False,True,False,False,,self,t3_1h8jn8s
gaming,5 Holiday Games (That have nothing to do with the Holidays),It’s my first real video in years! I hope everyone enjoys. If you have any feedback feel free to let me know :),ThatGamerMoshpit,1h8ldnu,https://reddit.com/r/gaming/comments/1h8ldnu/5_holiday_games_that_have_nothing_to_do_with_the/,https://youtu.be/ZqTwkDvn-s0,2024-12-07 05:16:34,0,0.33,0,0,3,0,0,False,False,False,False,False,,https://b.thumbs.redditmedia.com/1NQ9c9A2j72VzlzY_LN0nL485OzWlqyKwvwkvB7xlzY.jpg,t3_1h8ldnu
gaming,"Marvel Rivals is surprisingly good, but really dgaf","I played a ton over overwatch over the years but lost interest long before overwatch 2 was a thing.

In the run up to release I had seen a lot of trailers and was a bit interested. Superheroes doing their thing in a decent game will always get my interest.

Game released yesterday and it's very bright, colourful, destructible environments, team ups, and so on and so on.

It's plays great as well, but I can't get excited for it.  I feel like having to learn  another game that is just Overwatch on steroids isn't very exciting to me anymore.

Not intending to make an overly profound point but interested if others feel the same.

I hope the game does well as it's clearly the finished product, but I don't think il be a long for the ride.",allaboutthewheels,1h8o9er,https://reddit.com/r/gaming/comments/1h8o9er/marvel_rivals_is_surprisingly_good_but_really_dgaf/,https://www.reddit.com/r/gaming/comments/1h8o9er/marvel_rivals_is_surprisingly_good_but_really_dgaf/,2024-12-07 08:35:46,0,0.38,0,0,21,0,0,False,False,True,False,False,,self,t3_1h8o9er
gaming,The last time I seriously played and enjoyed COD,"Going through my old game storage found physical disks of oblivion, Morrowind, Aion, Diablo three and this old classic. ",MinervaMedica000,1h6ngkh,https://reddit.com/r/gaming/comments/1h6ngkh/the_last_time_i_seriously_played_and_enjoyed_cod/,https://i.redd.it/h2syc7rwlv4e1.jpeg,2024-12-04 18:36:05,7549,0.93,7549,0,632,0,0,False,False,False,False,False,,https://b.thumbs.redditmedia.com/bx7LzVfdg_HMOeqTL4_oGiYHyBm8ip8hTctCev6RgoQ.jpg,t3_1h6ngkh
gaming,"Sony was “lucky to survive” the PS3 era, says ex PlayStation boss Shawn Layden - “PS3 was Sony’s Icarus moment. We flew too close to the sun,”",,ChiefLeef22,1h6ih1y,https://reddit.com/r/gaming/comments/1h6ih1y/sony_was_lucky_to_survive_the_ps3_era_says_ex/,https://www.playstationlifestyle.net/2024/12/03/sony-felt-lucky-survived-ps3-struggles-says-shawn-layden/,2024-12-04 15:18:14,21359,0.95,21359,0,2145,0,0,False,False,False,False,False,,https://a.thumbs.redditmedia.com/VZIyjhiJRQlzDU2qNRQIa1QB6EHF5e_I0zMn8fmTVE0.jpg,t3_1h6ih1y
gaming,Need advice for a christmas present,"I need some advice on which game to get my nephew.

I remember when I was a kid with my 8-bit NES and my family was always happy when they 'got a videa game' for me for Christmas. The problem is, they usually didn't know anything about games and had terrible taste. I don't want to be that guy.

So my nephew - 12, m - is getting a PS5 from his parents. He's historically gamed on the Switch, and he (and I) LOVES the Legend of Zelda series. We've played BoTW and ToTK together, and regularly share tips, tricks, and advice.

I want to get his something for his PS5 that he'll enjoy, I'm looking for: open-world, lots of content to explore, appropriate levels of violence and language (he'll be playing it in the same room as his mom/my sister; I don't want it to be over the top), and fun. Something that someone who loves Zelda will be into.

Problem is, I'm in my 40's now and not as up on these things as I used to be. So, Reddit, please help me out here. What should I wrap up under the tree?",Nwcray,1h827a7,https://reddit.com/r/gaming/comments/1h827a7/need_advice_for_a_christmas_present/,https://www.reddit.com/r/gaming/comments/1h827a7/need_advice_for_a_christmas_present/,2024-12-06 14:11:15,0,0.5,0,0,23,0,0,False,False,True,False,False,,self,t3_1h827a7
gaming,"wait, the Thing is a good remaster of a very mid-game? Always has been",,HattedSandwich,1h8kfkz,https://reddit.com/r/gaming/comments/1h8kfkz/wait_the_thing_is_a_good_remaster_of_a_very/,https://i.redd.it/q7tluxrrrc5e1.jpeg,2024-12-07 04:19:30,0,0.47,0,0,29,0,0,False,False,False,False,False,,https://a.thumbs.redditmedia.com/dz7WPtawoznWcVBdGhCWQT-b673bujdu4xKUpVa6lp4.jpg,t3_1h8kfkz
gaming,"Finally playing ""Friends of Ringo Ishikawa"" and it's really good! I was kinda lost at first and kept getting knocked out, but once I trained up a bit and started getting paid for my grades it got a lot easier. Highly recommend it. ",,YeahMarkYeah,1h7koh3,https://reddit.com/r/gaming/comments/1h7koh3/finally_playing_friends_of_ringo_ishikawa_and_its/,https://i.redd.it/d6tzwdcpn35e1.png,2024-12-05 21:40:55,41,0.71,41,0,20,0,0,False,False,False,False,False,,https://b.thumbs.redditmedia.com/4Gq6H8mb66pr9ACECNFufvY4LqljFib1clNQN1lKedA.jpg,t3_1h7koh3
gaming,We are getting Anime GTA before GTA 6 - Ananta - Official Gameplay Trailer,,CryMoreFanboys,1h6zsnf,https://reddit.com/r/gaming/comments/1h6zsnf/we_are_getting_anime_gta_before_gta_6_ananta/,https://www.youtube.com/watch?v=Cq88FSVNJRE,2024-12-05 03:34:11,922,0.78,922,0,424,0,0,False,False,False,False,False,,https://b.thumbs.redditmedia.com/FFaaEQkFH7DuwstHYiHzh6DbqmG5eK30Gm1OErQ4M8w.jpg,t3_1h6zsnf
gaming,What are some video game misconceptions that specifically bother you to no end?,"using tv tropes as an example but 
for Overwatch there was A surprisingly large number of fans think Mercy is either evil, does not age or is a vampire despite there was no indication that this is true. Even official confirmation from the head writer, Michael Chu, and the introduction of Moira, an actual evil healer, hasn't done much to stem it. This likely stems from Mercy being surprisingly youthful, in full body armor (minus her face), and the reveal that she turned Genji into a cyborg.(that also bothered me from almost a decade ago)",bomb5000,1h8gvpx,https://reddit.com/r/gaming/comments/1h8gvpx/what_are_some_video_game_misconceptions_that/,https://www.reddit.com/r/gaming/comments/1h8gvpx/what_are_some_video_game_misconceptions_that/,2024-12-07 01:07:04,0,0.44,0,0,111,0,0,False,False,True,False,False,,self,t3_1h8gvpx
gaming,Looking for newer Co-op story mode to play with my buddy. (Ps5),"We’ve played:

It takes two, loved it…

A way out, loved it…

We played previous call of duty coop campaigns. And other things. We’re looking for a cool coop game to finish. Nothing indie or 2d.

What games are out there on ps5 ? I feel like our list is slim. ",supahotfiiire,1h88yu9,https://reddit.com/r/gaming/comments/1h88yu9/looking_for_newer_coop_story_mode_to_play_with_my/,https://www.reddit.com/r/gaming/comments/1h88yu9/looking_for_newer_coop_story_mode_to_play_with_my/,2024-12-06 19:04:34,0,0.49,0,0,32,0,0,False,False,True,False,False,,self,t3_1h88yu9
gaming,Marvel Rivals Official Launch Trailer. 33 hero's. Destructible Environment and Team-ups.  Live 7pm EST.,,critxcanuck88,1h7937f,https://reddit.com/r/gaming/comments/1h7937f/marvel_rivals_official_launch_trailer_33_heros/,https://youtube.com/watch?v=6QtF-z25nIA&amp;si=PnwSTDrq8jKmnQfn,2024-12-05 13:24:23,118,0.67,118,0,188,0,0,False,False,False,False,False,,https://a.thumbs.redditmedia.com/rwmWlMT-AKZNsySJPoRgs8AqfPuSwU1ORNv863p_rW4.jpg,t3_1h7937f
gaming,Sly Cooper Trilogy to Return for sale on PS5 and PS4,,mucho-gusto,1h72ltw,https://reddit.com/r/gaming/comments/1h72ltw/sly_cooper_trilogy_to_return_for_sale_on_ps5_and/,https://comicbook.com/gaming/news/ps2-games-playstation-2-ps5-ps4-trilogy/,2024-12-05 06:09:56,390,0.94,390,0,54,0,0,False,False,False,False,False,,https://b.thumbs.redditmedia.com/xFezVc1P8GOVUYMGtNNtzwZt2isc9g9mHRjenvzQ-OY.jpg,t3_1h72ltw
gaming,Game mechanics in non shooter FP-games,"Do you have any favorite game mechanics in first-person games which does not involve shooting? Preferably that actually utilize the first-person perspective.

There are several puzzle games that come to mind for me like The Witness and Outer Wilds or walking sims like What Remains of Edith Finch.",Gourkan,1h8eoek,https://reddit.com/r/gaming/comments/1h8eoek/game_mechanics_in_non_shooter_fpgames/,https://www.reddit.com/r/gaming/comments/1h8eoek/game_mechanics_in_non_shooter_fpgames/,2024-12-06 23:18:29,0,0.33,0,0,10,0,0,False,False,True,False,False,,self,t3_1h8eoek
gaming,Free Talk Friday!,"Use this post to discuss life, post memes, or just talk about whatever! 

This thread is posted weekly on Fridays (adjustments made as needed).",AutoModerator,1h7vmtl,https://reddit.com/r/gaming/comments/1h7vmtl/free_talk_friday/,https://www.reddit.com/r/gaming/comments/1h7vmtl/free_talk_friday/,2024-12-06 07:00:11,3,0.58,3,0,63,0,0,False,False,True,False,False,Weekly Free Talk Thread,self,t3_1h7vmtl
gaming,Marvel Rivals unpopular opinion ,"I really wanted to enjoy this game, I've been waiting since the first play test for the game to release, but between godwaful matchmaking and low-key pretty unbalanced hero's, I think I'd rather play overwatch 

Sure, there's something to be said about running around as spider man punching dudes into the sky and webbing them up, or using Loki's decoys to escape and punish people, but overall the balance on character abilities feels extremely lacking. 

Like why is punishers ultimate so broken, but scarlet witch needs to be within slapping distance to get a kill with it, while having a huge red **SHOOT HERE SIGN** on top of you. Making it early impossible to use even if you get the drop on people.

That's not to me to mention the amount of times Hawkeye has one shot me across the map, or how groots stun ability lasts like 10x as long as Wanda's. 

Just feels like after that many play tests, the balancing should have been in a better spot at launch. Maybe I'll try again in a few months once the honeymoon phase wears off and people can see it for what it is. ",LifeAintFair2Me,1h8jt2j,https://reddit.com/r/gaming/comments/1h8jt2j/marvel_rivals_unpopular_opinion/,https://www.reddit.com/r/gaming/comments/1h8jt2j/marvel_rivals_unpopular_opinion/,2024-12-07 03:43:47,0,0.26,0,0,17,0,0,False,False,True,False,False,,self,t3_1h8jt2j
gaming,Another W for Marvel Rivals,,critxcanuck88,1h6pa76,https://reddit.com/r/gaming/comments/1h6pa76/another_w_for_marvel_rivals/,https://i.redd.it/dididwpuyv4e1.jpeg,2024-12-04 19:49:07,1563,0.85,1563,0,383,0,0,False,False,False,False,False,,https://b.thumbs.redditmedia.com/kFDcQH8PUn8O_TyRyjtgyRJ3YYqE-o9cpOmsj-ELnHc.jpg,t3_1h6pa76
gaming,"Name a game that seemed ""meh"" at first, but then hooked you on the first try.","To me that game was definitely Vampire Survivors. I was looking at the screenshots and thought it looked quite messy, uninteresting and I wasn't very impressed.

But hey, I gave it a try; could not put it down for hours until realizing I should've been in the bed long ago.

What's yours?",Routasoft,1h6v9em,https://reddit.com/r/gaming/comments/1h6v9em/name_a_game_that_seemed_meh_at_first_but_then/,https://www.reddit.com/r/gaming/comments/1h6v9em/name_a_game_that_seemed_meh_at_first_but_then/,2024-12-04 23:58:04,707,0.9,707,0,963,0,0,False,False,True,False,False,,self,t3_1h6v9em
gaming,Helldivers 2 weapon's realism is insane,,MakubeC,1h6iu7i,https://reddit.com/r/gaming/comments/1h6iu7i/helldivers_2_weapons_realism_is_insane/,https://www.youtube.com/watch?v=u2dxexfGf44,2024-12-04 15:33:09,3449,0.91,3449,0,176,0,0,False,False,False,False,False,,https://b.thumbs.redditmedia.com/udTCxFakcx546VWRV21xAB7RXA8NYWL9rH3zhdoEBiE.jpg,t3_1h6iu7i
gaming,Most underrated handheld game of all time. ,Dragon Ball Z Supersonic Warriors was one of the most memorable gameboy games I've played and I feel it wasn't widely known or appreciated. I spent hours on this. ,pur0drl0k0,1h70yv4,https://reddit.com/r/gaming/comments/1h70yv4/most_underrated_handheld_game_of_all_time/,https://i.redd.it/gh13fc5vky4e1.jpeg,2024-12-05 04:35:34,276,0.85,276,0,59,0,0,False,False,False,False,False,,https://b.thumbs.redditmedia.com/DHaax5VcLLgi9LyaHFaIVi3mbm2yxC4YJs4iu2TvTtU.jpg,t3_1h70yv4
gaming,I digged up a screen cap from 15 years ago.,,cheezburgapocalypse,1h6g7k9,https://reddit.com/r/gaming/comments/1h6g7k9/i_digged_up_a_screen_cap_from_15_years_ago/,https://i.redd.it/2zirk9dx4u4e1.jpeg,2024-12-04 13:39:09,4493,0.86,4493,0,374,0,0,False,False,False,False,False,,https://b.thumbs.redditmedia.com/8zEtHb72fiW6fRZT8HBmmt0p3k1GryfBAK7LxUVA7Us.jpg,t3_1h6g7k9
gaming,What game had a feature/scene that wasn’t a micro transaction that made you go “WTF were they thinking???”,"I saw a comment talking about seizures and the topic of Cyberpunk 2077 came up about the brain dance scene.

I personally played the game on release and when I got to the brain dance scene I had to cover my eyes because it was way too intense and almost painful to experience that and not too long after cases of legit seizures came up in the news concerning that scene. I’m not even epileptic!

I understand that there is an in game lore saying that brain dances work by triggering a mini seizure but what in the ever loving hell were they thinking creating an actual seizure scene??????

I also understand that there are warnings in the game saying that but those are meant as a precaution towards particularly epileptic people and the brain dance cutscene is a forced watch if you want to progress in the story.

The scene has since been toned down and many people have no idea what we are talking about since the devs have fixed the issue ",Rabid-GNN,1h88tpv,https://reddit.com/r/gaming/comments/1h88tpv/what_game_had_a_featurescene_that_wasnt_a_micro/,https://www.reddit.com/r/gaming/comments/1h88tpv/what_game_had_a_featurescene_that_wasnt_a_micro/,2024-12-06 18:58:53,0,0.49,0,0,42,0,0,False,False,True,False,False,,self,t3_1h88tpv
