subreddit,title,selftext,author,id,permalink,url,created_utc,score,upvote_ratio,ups,downs,num_comments,total_awards_received,gilded,is_video,is_original_content,is_self,over_18,spoiler,link_flair_text,thumbnail,name
gaming,"Sony was “lucky to survive” the PS3 era, says ex PlayStation boss Shawn Layden - “PS3 was Sony’s Icarus moment. We flew too close to the sun,”",,ChiefLeef22,1h6ih1y,https://reddit.com/r/gaming/comments/1h6ih1y/sony_was_lucky_to_survive_the_ps3_era_says_ex/,https://www.playstationlifestyle.net/2024/12/03/sony-felt-lucky-survived-ps3-struggles-says-shawn-layden/,2024-12-04 15:18:14,20722,0.95,20722,0,2096,0,0,False,False,False,False,False,,https://a.thumbs.redditmedia.com/VZIyjhiJRQlzDU2qNRQIa1QB6EHF5e_I0zMn8fmTVE0.jpg,t3_1h6ih1y
gaming,The last time I seriously played and enjoyed COD,"Going through my old game storage found physical disks of oblivion, Morrowind, Aion, Diablo three and this old classic. ",MinervaMedica000,1h6ngkh,https://reddit.com/r/gaming/comments/1h6ngkh/the_last_time_i_seriously_played_and_enjoyed_cod/,https://i.redd.it/h2syc7rwlv4e1.jpeg,2024-12-04 18:36:05,6618,0.93,6618,0,555,0,0,False,False,False,False,False,,https://b.thumbs.redditmedia.com/bx7LzVfdg_HMOeqTL4_oGiYHyBm8ip8hTctCev6RgoQ.jpg,t3_1h6ngkh
gaming,POV its 2000 and you're about to buy your first pokemon game.,,ZooterTheWooter,1h6ubk9,https://reddit.com/r/gaming/comments/1h6ubk9/pov_its_2000_and_youre_about_to_buy_your_first/,https://i.redd.it/v11twczxzw4e1.jpeg,2024-12-04 23:16:34,5370,0.96,5370,0,369,0,0,False,False,False,False,False,,https://a.thumbs.redditmedia.com/82yHORgObKeFk1T1ObF8VDMRhSkELoILtufsF6lnXk4.jpg,t3_1h6ubk9
gaming,Helldivers 2 weapon's realism is insane,,MakubeC,1h6iu7i,https://reddit.com/r/gaming/comments/1h6iu7i/helldivers_2_weapons_realism_is_insane/,https://www.youtube.com/watch?v=u2dxexfGf44,2024-12-04 15:33:09,3262,0.91,3262,0,159,0,0,False,False,False,False,False,,https://b.thumbs.redditmedia.com/udTCxFakcx546VWRV21xAB7RXA8NYWL9rH3zhdoEBiE.jpg,t3_1h6iu7i
gaming,Another W for Marvel Rivals,,critxcanuck88,1h6pa76,https://reddit.com/r/gaming/comments/1h6pa76/another_w_for_marvel_rivals/,https://i.redd.it/dididwpuyv4e1.jpeg,2024-12-04 19:49:07,1271,0.85,1271,0,360,0,0,False,False,False,False,False,,https://b.thumbs.redditmedia.com/kFDcQH8PUn8O_TyRyjtgyRJ3YYqE-o9cpOmsj-ELnHc.jpg,t3_1h6pa76
gaming,"I still have my original copy of Half Life 2. Was a Christmas gift from my wife in 2004, though I think she gave it to me a little earlier.",,ecnerwal1234,1h6p3xg,https://reddit.com/r/gaming/comments/1h6p3xg/i_still_have_my_original_copy_of_half_life_2_was/,https://i.redd.it/i90iocwnxv4e1.jpeg,2024-12-04 19:41:58,900,0.95,900,0,104,0,0,False,False,False,False,False,,https://b.thumbs.redditmedia.com/uAWxExwbLakyeYoiIjJRDkBtOSJE59379qBVnYiXEns.jpg,t3_1h6p3xg
gaming,Kingmakers | Winter Games Expo Trailer - Early Access Release in Q1 2025 AD,,abcinng,1h6pvu2,https://reddit.com/r/gaming/comments/1h6pvu2/kingmakers_winter_games_expo_trailer_early_access/,https://www.youtube.com/watch?v=ZXujvsd9C58,2024-12-04 20:13:03,736,0.97,736,0,40,0,0,False,False,False,False,False,,https://b.thumbs.redditmedia.com/svrxWUTCM4_Szp4esiX7KXaExvNE_MZ_WcVyjbx_r9s.jpg,t3_1h6pvu2
gaming,We are getting Anime GTA before GTA 6 - Ananta - Official Gameplay Trailer,,CryMoreFanboys,1h6zsnf,https://reddit.com/r/gaming/comments/1h6zsnf/we_are_getting_anime_gta_before_gta_6_ananta/,https://www.youtube.com/watch?v=Cq88FSVNJRE,2024-12-05 03:34:11,574,0.76,574,0,314,0,0,False,False,False,False,False,,https://b.thumbs.redditmedia.com/FFaaEQkFH7DuwstHYiHzh6DbqmG5eK30Gm1OErQ4M8w.jpg,t3_1h6zsnf
gaming,"Name a game that seemed ""meh"" at first, but then hooked you on the first try.","To me that game was definitely Vampire Survivors. I was looking at the screenshots and thought it looked quite messy, uninteresting and I wasn't very impressed.

But hey, I gave it a try; could not put it down for hours until realizing I should've been in the bed long ago.

What's yours?",Routasoft,1h6v9em,https://reddit.com/r/gaming/comments/1h6v9em/name_a_game_that_seemed_meh_at_first_but_then/,https://www.reddit.com/r/gaming/comments/1h6v9em/name_a_game_that_seemed_meh_at_first_but_then/,2024-12-04 23:58:04,422,0.89,422,0,741,0,0,False,False,True,False,False,,self,t3_1h6v9em
gaming,"Kingdom Come: Deliverance 2 will offer 60fps on PS5/XSX, new release date February 4th",,Paul_cz,1h6lhv2,https://reddit.com/r/gaming/comments/1h6lhv2/kingdom_come_deliverance_2_will_offer_60fps_on/,https://x.com/WarhorseStudios/status/1864354217139314820,2024-12-04 17:19:08,214,0.92,214,0,52,0,0,False,False,False,False,False,,https://b.thumbs.redditmedia.com/Yqj1Xg20dPCWRxPupknxYwo9FH1Wfw25m7VSYolhdzM.jpg,t3_1h6lhv2
gaming,Most underrated handheld game of all time. ,Dragon Ball Z Supersonic Warriors was one of the most memorable gameboy games I've played and I feel it wasn't widely known or appreciated. I spent hours on this. ,pur0drl0k0,1h70yv4,https://reddit.com/r/gaming/comments/1h70yv4/most_underrated_handheld_game_of_all_time/,https://i.redd.it/gh13fc5vky4e1.jpeg,2024-12-05 04:35:34,200,0.84,200,0,45,0,0,False,False,False,False,False,,https://b.thumbs.redditmedia.com/DHaax5VcLLgi9LyaHFaIVi3mbm2yxC4YJs4iu2TvTtU.jpg,t3_1h70yv4
gaming,"After more than 20 years, I went back to Disney's Tarzan (1999) and finally took down Clayton. Watching him fall from that cliff was the most satisfying thing I've done all week. Childhood me can finally rest easy :) ",,mason_mte,1h6tfc7,https://reddit.com/r/gaming/comments/1h6tfc7/after_more_than_20_years_i_went_back_to_disneys/,https://i.redd.it/6jbbv0vxsw4e1.gif,2024-12-04 22:37:28,155,0.93,155,0,14,0,0,False,False,False,False,True,,spoiler,t3_1h6tfc7
gaming,Sly Cooper Trilogy to Return for sale on PS5 and PS4,,mucho-gusto,1h72ltw,https://reddit.com/r/gaming/comments/1h72ltw/sly_cooper_trilogy_to_return_for_sale_on_ps5_and/,https://comicbook.com/gaming/news/ps2-games-playstation-2-ps5-ps4-trilogy/,2024-12-05 06:09:56,132,0.91,132,0,23,0,0,False,False,False,False,False,,https://b.thumbs.redditmedia.com/xFezVc1P8GOVUYMGtNNtzwZt2isc9g9mHRjenvzQ-OY.jpg,t3_1h72ltw
gaming,I digged up a screen cap from 19 years ago,COD 1 - OG,Bounder1103,1h7ackk,https://reddit.com/r/gaming/comments/1h7ackk/i_digged_up_a_screen_cap_from_19_years_ago/,https://i.redd.it/ke122a49i15e1.jpeg,2024-12-05 14:26:16,407,0.75,407,0,101,0,0,False,False,False,False,False,,https://a.thumbs.redditmedia.com/noCmNEQWvqoHv6YOVAZHI-xa3SCm_5Pq1IshAUZU1q0.jpg,t3_1h7ackk
gaming,Legacy of Kain: Soul Reaver 1 &amp; 2 Remastered - Launch Trailer,,Apprehensive_Day212,1h6y3ls,https://reddit.com/r/gaming/comments/1h6y3ls/legacy_of_kain_soul_reaver_1_2_remastered_launch/,https://youtu.be/LpKy31RzDBA?si=8oBG2TtggrGhV0k3,2024-12-05 02:10:43,116,0.9,116,0,48,0,0,False,False,False,False,False,,https://b.thumbs.redditmedia.com/HBLtgYAhAZoIz2nREeVZw5YCDt36evEfwxg1rxq1FUY.jpg,t3_1h6y3ls
gaming,How do I fill the hole that finishing Titanfall 2 left in me?,"After a lot of recommendations, I bought Titanfall 2 this steam sale. What I didn't know is how short this game is. As I started to become accustomed to it's gameplay and mechanics especially controlling the Titan, it ended and man i haven't been this disappointed in a while. I was really enjoying the mission design, the unique platforming, the dynamic between BT and pilot and ther overall badass feeling of controlling a giant mech.

Unfortunately for me though, I can really play online multiplayer as I don't think there are SEA servers for this game. 

Anyways I was hoping you guys could recommend me some games which offer the same unique gameplay as Titanfall 2.

Really appreciate your suggestions..",Top_Distribution_497,1h6ib47,https://reddit.com/r/gaming/comments/1h6ib47/how_do_i_fill_the_hole_that_finishing_titanfall_2/,https://www.reddit.com/r/gaming/comments/1h6ib47/how_do_i_fill_the_hole_that_finishing_titanfall_2/,2024-12-04 15:11:26,91,0.68,91,0,176,0,0,False,False,True,False,False,,self,t3_1h6ib47
gaming,This should be on the list of remakes ,,Essa_ea,1h6r84r,https://reddit.com/r/gaming/comments/1h6r84r/this_should_be_on_the_list_of_remakes/,https://i.redd.it/kcdrpwaycw4e1.jpeg,2024-12-04 21:07:41,73,0.73,73,0,50,0,0,False,False,False,False,False,,https://b.thumbs.redditmedia.com/nwYIz5021gZDECz8Rsmc0Vwh14tuV4t3zUOUWKOOzIE.jpg,t3_1h6r84r
gaming,What are some good Christmasy games ?,"Currently replaying Arkham Origins, and it made me think that there aren't many games set around the holiday season. What do you play for the xmas vibes? World of warcraft always reminds me of Christmas, especially Wotlk. Also Skyrim. Anything with snow.",treefruit,1h6zmxz,https://reddit.com/r/gaming/comments/1h6zmxz/what_are_some_good_christmasy_games/,https://www.reddit.com/r/gaming/comments/1h6zmxz/what_are_some_good_christmasy_games/,2024-12-05 03:25:58,15,0.69,15,0,61,0,0,False,False,True,False,False,,self,t3_1h6zmxz
gaming,What’s a small feature in a game that made it way more immersive for you?,"I’ve been playing a lot of games recently, and I’ve realized how small details can make or break immersion. For example, seeing wet footprints fade on a rainy sidewalk in Sleeping Dogs really stuck with me. What’s your favorite little detail that enhanced your experience?",m2104,1h6mvz7,https://reddit.com/r/gaming/comments/1h6mvz7/whats_a_small_feature_in_a_game_that_made_it_way/,https://www.reddit.com/r/gaming/comments/1h6mvz7/whats_a_small_feature_in_a_game_that_made_it_way/,2024-12-04 18:13:27,11,0.63,11,0,97,0,0,False,False,True,False,False,,self,t3_1h6mvz7
gaming,[RANT] I need a new open world pirate game!,"I want to catch the horizon. I want to feel lonely. I want to sail between wind and tide. And then I want action, islands to explore, treasure to loot. I want NMS on the water. Give me a near accurate map of the Caribbean and enough control without being a full on simulator; I don't need to know what every rope does. Maybe I'm a merchant, maybe I'm a pirate, privateer, navy sailor... Give me something! [END RANT]

fuck.... I'm about to play Black Flag again....",TiresOnFire,1h6yj7k,https://reddit.com/r/gaming/comments/1h6yj7k/rant_i_need_a_new_open_world_pirate_game/,https://www.reddit.com/r/gaming/comments/1h6yj7k/rant_i_need_a_new_open_world_pirate_game/,2024-12-05 02:32:05,4,0.53,4,0,31,0,0,False,False,True,False,False,,self,t3_1h6yj7k
gaming,Quick review of (almost) all current mini bluetooth controllers!,"Images here: https://imgur.com/a/SZ3VbEy


I love local multiplayer and the easiest way to find people for it is on the go. Lugging around proper full size controllers* would be a chore, and with micro size I can always have even 4 without thinking.

So for starters: my use case is quick plays, 30-90 minutes. Using these regularly for long time would get uncomfortable (and carpal-tunnely I suppose).

The landscape of small controllers is pretty dire to be honest: 8BitDo (for a long time the only option) and rando chinese suppliers.



**8BitDo Lite 2**

It has every button from a classic PS/Xbox layout - including stick click/L3+R3. High quality plastics. Shoulder and trigger button placement is genius and usable. Joystick has a good movement area. Clicks and presses are exquisite. Size is great for the hand, and still light. This is the one controller I could imagine being usable in daily gaming even.

This would be my dream controller. IF it had XInput. Unrelated, but I'm mighty pissed at 8BitDo for not including this with newer models. Yes, these are all aimed for the Switch, but it would have costed next to nothing to add one more mode. Vibration also only works in Switch mode. Yes you can remap with XOutput and the like, but it's a hassle and strangely does not work in every game.

Modes: Switch, Android
Verdict: so close to be perfect, but not reaching it


**8BitDo Zero 2**

My current go-to mini controller. Has XInput. Sadly charges via micro usb (all other are usb-c). No vibration. Buttons feel right. The L/R button is clickable from all directions despite the length, but not really comfortable - which isn't a problem, this size is only used for simple layout games anyway. I wish it would have toggle for modes, there is no visible sign in which it is (toggle is via shortcut combinations).

There is now also a Micro with the same layout as the Q36 below - not ordered becaus missing XInput and I had enough of that after Lite 2)

Modes: Switch, Android, Windows
Verdict: ol' trusty working horse, shows it's age

**LinYuvo Meteor**

Now this is an interesting animal. You can order it for less than half the zero. It has bajillions of color options - I suggest ordering the covered ones, as the LEDs are so bright that you wouldn't want to use them on transparent versions, despite them looking cool as well. It has a circular dpad which I'm neutral about. For some it's easier to hit corners, but it's not as easy as eg. XBox controller's circular one. But it's really clicky, and a bit hard to press, as you can read in the few reviews it has. So dpad is certainly it's biggest drawback. Has vibration. It has a really interesting feature, you can replace keys - dpad with joystick directions and L/R buttons with trigger - without any software, just shortcuts! You can also toggle the light effects and colors, there are quite a few, as gimmick, or turn it off completely (will be remembered).

Verdict: price/features orders of magnitude better than the Zero 2, even Micro. Buttons just don't feel that good, but it's a close call.

**ShanWan Q37**

There exists a version with horizontal and cross (PS and XBox style) joystick placement. You can tell they used CADs from 8BitDo, the inputs have the same appearance - albeit with a very, very cheap plastic. The rounded off body is a bit smaller but thicker and overall harder to hold. But the presses feel ok. There is vibration - both sides even. It has a weird gyro mode in non-switch mode as well where gyro controls the joystick. Can be accidentally triggered and a useless gimmick. But a very welcomed feature is that every single key can be remapped (including this shortcut). It needs a seemingly unrelated mobile app (""GamepadSpace"") - connecting is hacky as you need to enter firmware upload mode - but once done, you are free to customize, even sensitivity, and everything is saved to the controller. This is great, especially since very stupidly in XInput mode the buttons match the switch layout (eg A is B) by default. Until now you would think this is in the endvery ok controller, but you'd be mistaken. Sadly it all falls apart by how incredibly bad quality this controller is. You will get constant disconnects, lag, ghost presses and stuck input. It's just bad, and generic QC issue. I had multiple controllers showing the same sign.

Verdict: It could be the ""good version"" rip-off of 8BitDo, but sadly it's just a mess, and costs the same as 8BitDo.


Modes: Windows/Android, Switch, Playstation

**ShanWan Q36**

The same as Q37, just with copying the 8BitDo Micro form and layout - which makes it even more sad that it's bad.

Modes: Windows/Android, Switch, Playstation


**Keychain controller**

Being available for 8+ years this is more like an afterthought rather than a serious contender, I included it only for fun. But it's by far the smallest you can go! It only has Android and keyboard function. The ""joystick"" is actually moving only on a 2D plane. Very practical and interesting, but a bit hard to move. Buttons are too mushy. But it is useful as a remote, eg. A is mapped to take a photo in Android.

Modes: IOS/Android, Keyboard",poisonborz,1h6svb8,https://reddit.com/r/gaming/comments/1h6svb8/quick_review_of_almost_all_current_mini_bluetooth/,https://www.reddit.com/r/gaming/comments/1h6svb8/quick_review_of_almost_all_current_mini_bluetooth/,2024-12-04 22:15:09,7,0.58,7,0,2,0,0,False,False,True,False,False,,self,t3_1h6svb8
gaming,Marvel Rivals Official Launch Trailer. 33 hero's. Destructible Environment and Team-ups.  Live 7pm EST.,,critxcanuck88,1h7937f,https://reddit.com/r/gaming/comments/1h7937f/marvel_rivals_official_launch_trailer_33_heros/,https://youtube.com/watch?v=6QtF-z25nIA&amp;si=PnwSTDrq8jKmnQfn,2024-12-05 13:24:23,21,0.6,21,0,59,0,0,False,False,False,False,False,,https://a.thumbs.redditmedia.com/rwmWlMT-AKZNsySJPoRgs8AqfPuSwU1ORNv863p_rW4.jpg,t3_1h7937f
gaming,I gathered all my controllers! Pretty grateful for my gaming journey. (my mother sold my N64 when I was a kid :( ),,6Kaliba9,1h6vens,https://reddit.com/r/gaming/comments/1h6vens/i_gathered_all_my_controllers_pretty_grateful_for/,https://i.redd.it/ahn6xijh8x4e1.jpeg,2024-12-05 00:04:25,10,0.56,10,0,16,0,0,False,False,False,False,False,,https://a.thumbs.redditmedia.com/PFDnCn3Kv6UAsc9nPXCECmcAGWQpaAr8TB6b3t26eu4.jpg,t3_1h6vens
gaming,Mario/Nintendo music rhythm game,"Theatrhythm Final Bar Line is my favourite rhythm game ever(i love the gameplay but it's the music i love most), I would absolutely love a similar game but with music from either just the mario games or nintendo franchises in general.

What do you think?",THEPSR,1h76x0w,https://reddit.com/r/gaming/comments/1h76x0w/marionintendo_music_rhythm_game/,https://www.reddit.com/r/gaming/comments/1h76x0w/marionintendo_music_rhythm_game/,2024-12-05 11:18:47,0,0.5,0,0,3,0,0,False,False,True,False,False,,self,t3_1h76x0w
gaming,"Open World Games For PS4 That Feel Drenched In Melancholy Despite Not Necessarily Being A ""Sad Story""?","I know this sort of question has been asked many times, but this is my spin on it. As the title says, I'm not looking for a game with a ""sad story"", but rather an open world game where the world, music, overall atmosphere, and the protagonist just feel drenched in a deep sense of melancholy/sadness. I think a good example of what I'm looking for is Red Dead Redemption 1... despite what happens in the end, I wouldn't necessarily consider it a ""sad story"", but rather a story that gives this overwhelming sense that the world is changing, the old ways are dying, and you are powerless to stop it. Just simply stopping to stand somewhere in the middle of the desert plains, and hearing the haunting music in RDR1 gives this feeling, like the whole game just has this constant, overhanging thick layer of melancholy, no matter where you go. In other words, it's as if the world itself is sad. 

I hope you understand what I mean by all this. Any open world game suggestions like this on PS4 would be greatly appreciated!",701921225,1h6yro1,https://reddit.com/r/gaming/comments/1h6yro1/open_world_games_for_ps4_that_feel_drenched_in/,https://www.reddit.com/r/gaming/comments/1h6yro1/open_world_games_for_ps4_that_feel_drenched_in/,2024-12-05 02:43:27,1,0.51,1,0,52,0,0,False,False,True,False,False,,self,t3_1h6yro1
gaming,What games are you thankful for this year?,,tInteresting_Space,1h7arpy,https://reddit.com/r/gaming/comments/1h7arpy/what_games_are_you_thankful_for_this_year/,https://hardcoregamer.com/games-we-are-thankful-for-in-2024/,2024-12-05 14:46:00,0,0.29,0,0,19,0,0,False,False,False,False,False,,https://b.thumbs.redditmedia.com/ZtszBrfjQ7GDQmZTZAFWCQUSRWKVkmieOhVrOLQMxdA.jpg,t3_1h7arpy
gaming,What's the most significant or memorable gaming content that's also entirely missable?,"When playing games that bother to fully flesh out their worlds, there must be so much you could complete a game without seeing or being signposted towards or lead through. Rockstar in particular seem to have entire areas, characters and plot points that you could in theory never experience.

What's the most compelling part of a game that you've experienced that you realised could have easily been missed?",danielgmal,1h6v1gk,https://reddit.com/r/gaming/comments/1h6v1gk/whats_the_most_significant_or_memorable_gaming/,https://www.reddit.com/r/gaming/comments/1h6v1gk/whats_the_most_significant_or_memorable_gaming/,2024-12-04 23:48:21,0,0.5,0,0,55,0,0,False,False,True,False,False,,self,t3_1h6v1gk
gaming,1v1 tournament,"I want to organize a gaming tournament for friends. I therefore look for games that are 1v1 versus. A match should not be longer than 20 min max. The games need to be local/couch games. Not online. Do you have any tips for this?

Some examples: -mortal combat - Tetris - all ea sports games - Nidhogg - tricky towers - brawhalla

The games are mainly played on PlayStation. Nintendo Switch is possible, but preferably not.

All ideas are welcome.

Footnote:I search a little bit on the subreddit. I see that a lot of people are looking for co op games. Cooperation is not what I am looking for.",boibetterknow444,1h7aien,https://reddit.com/r/gaming/comments/1h7aien/1v1_tournament/,https://www.reddit.com/r/gaming/comments/1h7aien/1v1_tournament/,2024-12-05 14:33:46,0,0.45,0,0,3,0,0,False,False,True,False,False,,self,t3_1h7aien
gaming,What are some video games that take place around Christmas,"I was talking to friend I came up with Bayonetta 2, Batman Arkham Origins, maybe Stardew",lotp22,1h6vt20,https://reddit.com/r/gaming/comments/1h6vt20/what_are_some_video_games_that_take_place_around/,https://www.reddit.com/r/gaming/comments/1h6vt20/what_are_some_video_games_that_take_place_around/,2024-12-05 00:22:38,0,0.41,0,0,40,0,0,False,False,True,False,False,,self,t3_1h6vt20
gaming,Games that are good but you don’t vibe with ,Recently started playing horizon remastered I had the disc bought awhile ago used for 15 bucks and upgraded it thought no better time to play it after beating Metaphor on Monday. I think the gameplay and visuals are really good but just don’t feel the motivation to keep playing. Maybe I’m still burned out on open worlds idk just not feeling it. So what games do you just don’t vibe with ? ,iNuclearPickle,1h6trph,https://reddit.com/r/gaming/comments/1h6trph/games_that_are_good_but_you_dont_vibe_with/,https://www.reddit.com/r/gaming/comments/1h6trph/games_that_are_good_but_you_dont_vibe_with/,2024-12-04 22:52:22,0,0.45,0,0,159,0,0,False,False,True,False,False,,self,t3_1h6trph
gaming,I have a Logitech G923 arriving today .. what racing/driving games should I buy before the Steam sale ends in 1 hour?,I subscribe to Game Pass on PC so I have access to anything in the GP / EA Play catalog.,ColdStoneCreamAustin,1h6kr7c,https://reddit.com/r/gaming/comments/1h6kr7c/i_have_a_logitech_g923_arriving_today_what/,https://www.reddit.com/r/gaming/comments/1h6kr7c/i_have_a_logitech_g923_arriving_today_what/,2024-12-04 16:50:05,0,0.27,0,0,15,0,0,False,False,True,False,False,,self,t3_1h6kr7c
gaming,"Assuming everything Intel showed in their Arc preview is exactly how the cards perform in real life, will you buy a B580/B570 for the MSRP of 250 or 210 and what would you be upgrading from?","I currently own a 2070S and with my 1440p ultrawide it does start to show it's age.

So if third party reviews confirm the performance Intel showed at their preview event (and drivers seem to play nice this time), I'm considering giving Arc a shot this time around.

That's why I'm interested in other peoples opinion on the matter.",CurZZe,1h6jwr9,https://reddit.com/r/gaming/comments/1h6jwr9/assuming_everything_intel_showed_in_their_arc/,https://www.reddit.com/r/gaming/comments/1h6jwr9/assuming_everything_intel_showed_in_their_arc/,2024-12-04 16:16:21,0,0.38,0,0,11,0,0,False,False,True,False,False,,self,t3_1h6jwr9
gaming,what are some video game sequels that would have been better off as a spinoff than a sequel.,i feel like Last of Us 2 would have been better as a anthology spinoff as I felt stories set in the Last of us universe for the perspective of other people's lives in the apocalypse sound more interesting tbh.,frogboss4020,1h737sz,https://reddit.com/r/gaming/comments/1h737sz/what_are_some_video_game_sequels_that_would_have/,https://www.reddit.com/r/gaming/comments/1h737sz/what_are_some_video_game_sequels_that_would_have/,2024-12-05 06:50:07,0,0.38,0,0,41,0,0,False,False,True,False,False,,self,t3_1h737sz
gaming,Help me find a game PLEASE!,"Guys, I’m currently off work for a few weeks and I’m struggling to find a game to play, I’ve bought quite a few games over the last few weeks but ultimately nothings really gripped me.

I’m looking for suggestions considering the following points.

1) I love RPG games with deep mechanics, especially turn based combat.

2) Graphics aren’t an issue.

3) Strategy games are a good shout if they aren’t overwhelming.

4) Need something I can pick up and put down as and when I’ve got 5 minutes.

5) Need to have a story behind them to some degree.

6) Love to grind levels/stats/materials anything but need to have a reason for the grind, grinding for the sake of grinding is a no go.

7) This may be controversial but I love open world/survival/crafting games

Games I’ve played and completed/got bored of recently and don’t want to go back to are as follows.

BG3
Elden Ring
Total war warhammer 3
Final Fantasy 7/9/10/7R
Satisfactory
Rimworld
Subnautica (survived 3hrs)
Graveyard keeper
Rust (might jump on for a few weeks)

Plenty of others but please recommend anything to me that even slightly fits into any of those.

Thanks guys!!",mdh89,1h6oj8u,https://reddit.com/r/gaming/comments/1h6oj8u/help_me_find_a_game_please/,https://www.reddit.com/r/gaming/comments/1h6oj8u/help_me_find_a_game_please/,2024-12-04 19:18:31,0,0.41,0,0,114,0,0,False,False,True,False,False,,self,t3_1h6oj8u
