subreddit,title,selftext,author,id,permalink,url,created_utc,score,upvote_ratio,ups,downs,num_comments,total_awards_received,gilded,is_video,is_original_content,is_self,over_18,spoiler,link_flair_text,thumbnail,name
gaming,What are you playing Wednesday!,"What game's got your attention this week? What's great about it? What sucks? Tell us all about it! 

&amp;#x200B;

 This thread is posted weekly on Wednesdays (adjustments made as needed).",AutoModerator,1h6a7ql,https://reddit.com/r/gaming/comments/1h6a7ql/what_are_you_playing_wednesday/,https://www.reddit.com/r/gaming/comments/1h6a7ql/what_are_you_playing_wednesday/,2024-12-04 07:00:10,17,0.72,17,0,121,0,0,False,False,True,False,False,Weekly Play Thread,self,t3_1h6a7ql
gaming,Made these pen holders for a work buddy,,raisedbytides,1h7b8po,https://reddit.com/r/gaming/comments/1h7b8po/made_these_pen_holders_for_a_work_buddy/,https://i.redd.it/co2i7t5jp15e1.jpeg,2024-12-05 15:07:07,413,0.98,413,0,25,0,0,False,False,False,False,False,,https://b.thumbs.redditmedia.com/H5RbqAU7wrSE36onMigyYSMs72eHfc6S27bmvHnZihc.jpg,t3_1h7b8po
gaming,I digged up a screen cap from 19 years ago,COD 1 - OG,Bounder1103,1h7ackk,https://reddit.com/r/gaming/comments/1h7ackk/i_digged_up_a_screen_cap_from_19_years_ago/,https://i.redd.it/ke122a49i15e1.jpeg,2024-12-05 14:26:16,404,0.74,404,0,101,0,0,False,False,False,False,False,,https://a.thumbs.redditmedia.com/noCmNEQWvqoHv6YOVAZHI-xa3SCm_5Pq1IshAUZU1q0.jpg,t3_1h7ackk
gaming,POV its 2000 and you're about to buy your first pokemon game.,,ZooterTheWooter,1h6ubk9,https://reddit.com/r/gaming/comments/1h6ubk9/pov_its_2000_and_youre_about_to_buy_your_first/,https://i.redd.it/v11twczxzw4e1.jpeg,2024-12-04 23:16:34,5363,0.96,5363,0,369,0,0,False,False,False,False,False,,https://a.thumbs.redditmedia.com/82yHORgObKeFk1T1ObF8VDMRhSkELoILtufsF6lnXk4.jpg,t3_1h6ubk9
gaming,"Sony was “lucky to survive” the PS3 era, says ex PlayStation boss Shawn Layden - “PS3 was Sony’s Icarus moment. We flew too close to the sun,”",,ChiefLeef22,1h6ih1y,https://reddit.com/r/gaming/comments/1h6ih1y/sony_was_lucky_to_survive_the_ps3_era_says_ex/,https://www.playstationlifestyle.net/2024/12/03/sony-felt-lucky-survived-ps3-struggles-says-shawn-layden/,2024-12-04 15:18:14,20724,0.95,20724,0,2096,0,0,False,False,False,False,False,,https://a.thumbs.redditmedia.com/VZIyjhiJRQlzDU2qNRQIa1QB6EHF5e_I0zMn8fmTVE0.jpg,t3_1h6ih1y
gaming,The last time I seriously played and enjoyed COD,"Going through my old game storage found physical disks of oblivion, Morrowind, Aion, Diablo three and this old classic. ",MinervaMedica000,1h6ngkh,https://reddit.com/r/gaming/comments/1h6ngkh/the_last_time_i_seriously_played_and_enjoyed_cod/,https://i.redd.it/h2syc7rwlv4e1.jpeg,2024-12-04 18:36:05,6619,0.93,6619,0,555,0,0,False,False,False,False,False,,https://b.thumbs.redditmedia.com/bx7LzVfdg_HMOeqTL4_oGiYHyBm8ip8hTctCev6RgoQ.jpg,t3_1h6ngkh
gaming,We are getting Anime GTA before GTA 6 - Ananta - Official Gameplay Trailer,,CryMoreFanboys,1h6zsnf,https://reddit.com/r/gaming/comments/1h6zsnf/we_are_getting_anime_gta_before_gta_6_ananta/,https://www.youtube.com/watch?v=Cq88FSVNJRE,2024-12-05 03:34:11,570,0.76,570,0,314,0,0,False,False,False,False,False,,https://b.thumbs.redditmedia.com/FFaaEQkFH7DuwstHYiHzh6DbqmG5eK30Gm1OErQ4M8w.jpg,t3_1h6zsnf
gaming,Helldivers 2 weapon's realism is insane,,MakubeC,1h6iu7i,https://reddit.com/r/gaming/comments/1h6iu7i/helldivers_2_weapons_realism_is_insane/,https://www.youtube.com/watch?v=u2dxexfGf44,2024-12-04 15:33:09,3271,0.91,3271,0,159,0,0,False,False,False,False,False,,https://b.thumbs.redditmedia.com/udTCxFakcx546VWRV21xAB7RXA8NYWL9rH3zhdoEBiE.jpg,t3_1h6iu7i
gaming,Another W for Marvel Rivals,,critxcanuck88,1h6pa76,https://reddit.com/r/gaming/comments/1h6pa76/another_w_for_marvel_rivals/,https://i.redd.it/dididwpuyv4e1.jpeg,2024-12-04 19:49:07,1270,0.85,1270,0,360,0,0,False,False,False,False,False,,https://b.thumbs.redditmedia.com/kFDcQH8PUn8O_TyRyjtgyRJ3YYqE-o9cpOmsj-ELnHc.jpg,t3_1h6pa76
gaming,I digged up a screen cap from 15 years ago.,,cheezburgapocalypse,1h6g7k9,https://reddit.com/r/gaming/comments/1h6g7k9/i_digged_up_a_screen_cap_from_15_years_ago/,https://i.redd.it/2zirk9dx4u4e1.jpeg,2024-12-04 13:39:09,4260,0.86,4260,0,361,0,0,False,False,False,False,False,,https://b.thumbs.redditmedia.com/8zEtHb72fiW6fRZT8HBmmt0p3k1GryfBAK7LxUVA7Us.jpg,t3_1h6g7k9
gaming,Most underrated handheld game of all time. ,Dragon Ball Z Supersonic Warriors was one of the most memorable gameboy games I've played and I feel it wasn't widely known or appreciated. I spent hours on this. ,pur0drl0k0,1h70yv4,https://reddit.com/r/gaming/comments/1h70yv4/most_underrated_handheld_game_of_all_time/,https://i.redd.it/gh13fc5vky4e1.jpeg,2024-12-05 04:35:34,201,0.84,201,0,45,0,0,False,False,False,False,False,,https://b.thumbs.redditmedia.com/DHaax5VcLLgi9LyaHFaIVi3mbm2yxC4YJs4iu2TvTtU.jpg,t3_1h70yv4
gaming,"Name a game that seemed ""meh"" at first, but then hooked you on the first try.","To me that game was definitely Vampire Survivors. I was looking at the screenshots and thought it looked quite messy, uninteresting and I wasn't very impressed.

But hey, I gave it a try; could not put it down for hours until realizing I should've been in the bed long ago.

What's yours?",Routasoft,1h6v9em,https://reddit.com/r/gaming/comments/1h6v9em/name_a_game_that_seemed_meh_at_first_but_then/,https://www.reddit.com/r/gaming/comments/1h6v9em/name_a_game_that_seemed_meh_at_first_but_then/,2024-12-04 23:58:04,427,0.89,427,0,741,0,0,False,False,True,False,False,,self,t3_1h6v9em
gaming,Sly Cooper Trilogy to Return for sale on PS5 and PS4,,mucho-gusto,1h72ltw,https://reddit.com/r/gaming/comments/1h72ltw/sly_cooper_trilogy_to_return_for_sale_on_ps5_and/,https://comicbook.com/gaming/news/ps2-games-playstation-2-ps5-ps4-trilogy/,2024-12-05 06:09:56,129,0.92,129,0,23,0,0,False,False,False,False,False,,https://b.thumbs.redditmedia.com/xFezVc1P8GOVUYMGtNNtzwZt2isc9g9mHRjenvzQ-OY.jpg,t3_1h72ltw
gaming,"I still have my original copy of Half Life 2. Was a Christmas gift from my wife in 2004, though I think she gave it to me a little earlier.",,ecnerwal1234,1h6p3xg,https://reddit.com/r/gaming/comments/1h6p3xg/i_still_have_my_original_copy_of_half_life_2_was/,https://i.redd.it/i90iocwnxv4e1.jpeg,2024-12-04 19:41:58,900,0.95,900,0,104,0,0,False,False,False,False,False,,https://b.thumbs.redditmedia.com/uAWxExwbLakyeYoiIjJRDkBtOSJE59379qBVnYiXEns.jpg,t3_1h6p3xg
gaming,Kingmakers | Winter Games Expo Trailer - Early Access Release in Q1 2025 AD,,abcinng,1h6pvu2,https://reddit.com/r/gaming/comments/1h6pvu2/kingmakers_winter_games_expo_trailer_early_access/,https://www.youtube.com/watch?v=ZXujvsd9C58,2024-12-04 20:13:03,739,0.97,739,0,40,0,0,False,False,False,False,False,,https://b.thumbs.redditmedia.com/svrxWUTCM4_Szp4esiX7KXaExvNE_MZ_WcVyjbx_r9s.jpg,t3_1h6pvu2
gaming,Marvel Rivals Official Launch Trailer. 33 hero's. Destructible Environment and Team-ups.  Live 7pm EST.,,critxcanuck88,1h7937f,https://reddit.com/r/gaming/comments/1h7937f/marvel_rivals_official_launch_trailer_33_heros/,https://youtube.com/watch?v=6QtF-z25nIA&amp;si=PnwSTDrq8jKmnQfn,2024-12-05 13:24:23,19,0.59,19,0,59,0,0,False,False,False,False,False,,https://a.thumbs.redditmedia.com/rwmWlMT-AKZNsySJPoRgs8AqfPuSwU1ORNv863p_rW4.jpg,t3_1h7937f
gaming,"welp, there goes my weekend",,rsjpeckham,1h6gj4d,https://reddit.com/r/gaming/comments/1h6gj4d/welp_there_goes_my_weekend/,https://i.redd.it/jtyf6wno7u4e1.jpeg,2024-12-04 13:54:34,1337,0.93,1337,0,49,0,0,False,False,False,False,False,,https://b.thumbs.redditmedia.com/cbg78vUtsreP5YNZy2UMhuSy_ShJJEgoRslv4cm_vHM.jpg,t3_1h6gj4d
gaming,Legacy of Kain: Soul Reaver 1 &amp; 2 Remastered - Launch Trailer,,Apprehensive_Day212,1h6y3ls,https://reddit.com/r/gaming/comments/1h6y3ls/legacy_of_kain_soul_reaver_1_2_remastered_launch/,https://youtu.be/LpKy31RzDBA?si=8oBG2TtggrGhV0k3,2024-12-05 02:10:43,117,0.9,117,0,48,0,0,False,False,False,False,False,,https://b.thumbs.redditmedia.com/HBLtgYAhAZoIz2nREeVZw5YCDt36evEfwxg1rxq1FUY.jpg,t3_1h6y3ls
gaming,"After more than 20 years, I went back to Disney's Tarzan (1999) and finally took down Clayton. Watching him fall from that cliff was the most satisfying thing I've done all week. Childhood me can finally rest easy :) ",,mason_mte,1h6tfc7,https://reddit.com/r/gaming/comments/1h6tfc7/after_more_than_20_years_i_went_back_to_disneys/,https://i.redd.it/6jbbv0vxsw4e1.gif,2024-12-04 22:37:28,158,0.93,158,0,14,0,0,False,False,False,False,True,,spoiler,t3_1h6tfc7
gaming,The hidden master,,DreadedDrMaybe,1h648xr,https://reddit.com/r/gaming/comments/1h648xr/the_hidden_master/,https://i.redd.it/vtenpyf0jq4e1.jpeg,2024-12-04 01:30:56,8331,0.96,8331,0,234,0,0,False,False,False,False,False,,https://b.thumbs.redditmedia.com/hQAR4cfSg1osdRKZPooyHQltkD11t0PDJhP-gQiYdfM.jpg,t3_1h648xr
gaming,XDefiant officially shutting down as Ubisoft announces FPS end date,,BigT232,1h62k12,https://reddit.com/r/gaming/comments/1h62k12/xdefiant_officially_shutting_down_as_ubisoft/,https://www.dexerto.com/gaming/xdefiant-officially-shutting-down-2997613/,2024-12-04 00:12:12,7943,0.97,7943,0,1211,0,0,False,False,False,False,False,,https://b.thumbs.redditmedia.com/tliIphH3VnjUdEC7SLpQDDxD0V3GCwPRokQg_ILUOuM.jpg,t3_1h62k12
gaming,The most 2009 video game choice,,JustTrollingYou,1h634lo,https://reddit.com/r/gaming/comments/1h634lo/the_most_2009_video_game_choice/,https://i.imgur.com/6xKo70k.png,2024-12-04 00:38:17,6715,0.94,6715,0,408,0,0,False,False,False,False,False,,https://b.thumbs.redditmedia.com/4zajYl4iqlP4SZV4CckPDzq_8PTQwiUMOYfs4fkwsaw.jpg,t3_1h634lo
gaming,The most 2009 video game choice ,inFamous ,NoLastNameForNow,1h5xa7d,https://reddit.com/r/gaming/comments/1h5xa7d/the_most_2009_video_game_choice/,https://i.redd.it/i1sxq8f61p4e1.jpeg,2024-12-03 20:29:12,23488,0.95,23488,0,841,0,0,False,False,False,False,False,,https://a.thumbs.redditmedia.com/ZV7OwEK-PGhBvLreJb-CIULoDZsUOdiNp7csrb6-cb0.jpg,t3_1h5xa7d
gaming,What game has the biggest issue with money being worthles?,"Money makes the world go round, but in many video game worlds, it often ends up worthless, so monetary rewards can end up moot.

The Legend of Zelda series has a recurring problem, the worst cases I have seen are Breath of the Wild and Echoes of Wisdom (I haven't played Tears yet). Despite Breath of the Wild not having money you can find by cutting grass, you still end up with more than you'll ever need because you can sell virtually anything you come across. I often ended up netting a profit from shopping by selling a fraction of the stuff you collect. The are items for sale you can use in cooking, and I didn't buy most of them because the stuff I found worked fine.

The most annoying part for me was that shops did sell special arrows except they quit restocking them if you had enough in your inventory so I was better off find enemies to get more. Past the early game I didn't need money for anything besides upgrading armor and quests.

Echoes of Wisdom has health items for sale, that there isn't a ton of need for when you can use a bed to recover your health for free.

However, the worst case I have seen is Xenoblade 3. This is a JRPG where you don't buy weapons or armor. Like its predecessors, you also heal out of combat, KOed characters revive after a fight, and in this game, your healers can be revived KOed characters an unlimited number of times during a fight. As a result, a lot of commonly seen RPG items aren't in this game removing a lot you can spend money on.

There are items for sale you can use in quests and cooking, I got buy without needing to use the cooking mechanic and for the most you can find items for quests without spending any money. The accessories for sale have use on paper except exploring the map almost always let to better ones.

The Land of Challenge DLC was the final nail in the coffin since while it does require grinding resources there you can get better stuff for clearing its challenges than from shops.

None of this makes these games bad, it just feels weird to carry around so much cash and not have a use for it.",Sensitive-Hotel-9871,1h6g2sj,https://reddit.com/r/gaming/comments/1h6g2sj/what_game_has_the_biggest_issue_with_money_being/,https://www.reddit.com/r/gaming/comments/1h6g2sj/what_game_has_the_biggest_issue_with_money_being/,2024-12-04 13:32:56,461,0.86,461,0,572,0,0,False,False,True,False,False,,self,t3_1h6g2sj
gaming,"Kingdom Come: Deliverance 2 will offer 60fps on PS5/XSX, new release date February 4th",,Paul_cz,1h6lhv2,https://reddit.com/r/gaming/comments/1h6lhv2/kingdom_come_deliverance_2_will_offer_60fps_on/,https://x.com/WarhorseStudios/status/1864354217139314820,2024-12-04 17:19:08,211,0.92,211,0,52,0,0,False,False,False,False,False,,https://b.thumbs.redditmedia.com/Yqj1Xg20dPCWRxPupknxYwo9FH1Wfw25m7VSYolhdzM.jpg,t3_1h6lhv2
gaming,What's a habit that you have in multiple different games,My roommate has to unlock every fast travel location as soon as physically possible in every game he plays. When he played Tears of the Kingdom he spent 20 hours going around all of the map unlocking stuff. What's something you are compelled to do no matter what game it is?,lordlemming,1h6g8lr,https://reddit.com/r/gaming/comments/1h6g8lr/whats_a_habit_that_you_have_in_multiple_different/,https://www.reddit.com/r/gaming/comments/1h6g8lr/whats_a_habit_that_you_have_in_multiple_different/,2024-12-04 13:40:31,402,0.91,402,0,647,0,0,False,False,True,False,False,,self,t3_1h6g8lr
gaming,A map of my 1:1 fictional Minecraft City after nearly 5 years of work. 2024 update. ,,KanyeWaste69,1h679mu,https://reddit.com/r/gaming/comments/1h679mu/a_map_of_my_11_fictional_minecraft_city_after/,https://i.redd.it/fmzvjeqs9r4e1.png,2024-12-04 04:03:46,2109,0.95,2109,0,86,0,0,False,False,False,False,False,,https://b.thumbs.redditmedia.com/sX47EVVxir4Thn80U-mWvl_kcA_xvQt7VcJEcnJCpBk.jpg,t3_1h679mu
gaming,This should be on the list of remakes ,,Essa_ea,1h6r84r,https://reddit.com/r/gaming/comments/1h6r84r/this_should_be_on_the_list_of_remakes/,https://i.redd.it/kcdrpwaycw4e1.jpeg,2024-12-04 21:07:41,71,0.72,71,0,50,0,0,False,False,False,False,False,,https://b.thumbs.redditmedia.com/nwYIz5021gZDECz8Rsmc0Vwh14tuV4t3zUOUWKOOzIE.jpg,t3_1h6r84r
gaming,What are some good Christmasy games ?,"Currently replaying Arkham Origins, and it made me think that there aren't many games set around the holiday season. What do you play for the xmas vibes? World of warcraft always reminds me of Christmas, especially Wotlk. Also Skyrim. Anything with snow.",treefruit,1h6zmxz,https://reddit.com/r/gaming/comments/1h6zmxz/what_are_some_good_christmasy_games/,https://www.reddit.com/r/gaming/comments/1h6zmxz/what_are_some_good_christmasy_games/,2024-12-05 03:25:58,15,0.69,15,0,61,0,0,False,False,True,False,False,,self,t3_1h6zmxz
gaming,The Pokémon TCGP experience ,,TheSpectacularBagMan,1h6cswa,https://reddit.com/r/gaming/comments/1h6cswa/the_pokémon_tcgp_experience/,https://i.redd.it/xc54xzzd4t4e1.png,2024-12-04 10:14:19,289,0.85,289,0,96,0,0,False,False,False,False,False,,https://b.thumbs.redditmedia.com/jLldjrOoX_L-ffkll80ZDw0UUFqg-DZ3cYwC3yFg1eI.jpg,t3_1h6cswa
gaming,"Former PlayStation exec says there's a ""collapse of creativity"" in the industry","&gt;""Today, the entry costs for making a AAA game is in triple digit millions now,"" he continued. ""I think naturally, risk tolerance drops. And you're [looking] at sequels, you're looking at copycats, because the finance guys who draw the line say, 'Well, if Fortnite made this much money in this amount of time, my Fortnite knockoff can make this in that amount of time.' We're seeing a collapse of creativity in games today [with] studio consolidation and the high cost of production.""

Sequels and requels; the Disney™️ accountant model. ",rematar,1h5q5ib,https://reddit.com/r/gaming/comments/1h5q5ib/former_playstation_exec_says_theres_a_collapse_of/,https://www.eurogamer.net/former-playstation-exec-says-theres-a-collapse-of-creativity-in-the-industry,2024-12-03 15:35:00,10950,0.95,10950,0,1455,0,0,False,False,False,False,False,,https://b.thumbs.redditmedia.com/CnxzdyRaKnHUyz5JBPPI9MI7Jnj4kQhQTDwQCLcOj0Y.jpg,t3_1h5q5ib
gaming,How do I fill the hole that finishing Titanfall 2 left in me?,"After a lot of recommendations, I bought Titanfall 2 this steam sale. What I didn't know is how short this game is. As I started to become accustomed to it's gameplay and mechanics especially controlling the Titan, it ended and man i haven't been this disappointed in a while. I was really enjoying the mission design, the unique platforming, the dynamic between BT and pilot and ther overall badass feeling of controlling a giant mech.

Unfortunately for me though, I can really play online multiplayer as I don't think there are SEA servers for this game. 

Anyways I was hoping you guys could recommend me some games which offer the same unique gameplay as Titanfall 2.

Really appreciate your suggestions..",Top_Distribution_497,1h6ib47,https://reddit.com/r/gaming/comments/1h6ib47/how_do_i_fill_the_hole_that_finishing_titanfall_2/,https://www.reddit.com/r/gaming/comments/1h6ib47/how_do_i_fill_the_hole_that_finishing_titanfall_2/,2024-12-04 15:11:26,86,0.68,86,0,176,0,0,False,False,True,False,False,,self,t3_1h6ib47
gaming,1v1 tournament,"I want to organize a gaming tournament for friends. I therefore look for games that are 1v1 versus. A match should not be longer than 20 min max. The games need to be local/couch games. Not online. Do you have any tips for this?

Some examples: -mortal combat - Tetris - all ea sports games - Nidhogg - tricky towers - brawhalla

The games are mainly played on PlayStation. Nintendo Switch is possible, but preferably not.

All ideas are welcome.

Footnote:I search a little bit on the subreddit. I see that a lot of people are looking for co op games. Cooperation is not what I am looking for.",boibetterknow444,1h7aien,https://reddit.com/r/gaming/comments/1h7aien/1v1_tournament/,https://www.reddit.com/r/gaming/comments/1h7aien/1v1_tournament/,2024-12-05 14:33:46,0,0.45,0,0,3,0,0,False,False,True,False,False,,self,t3_1h7aien
gaming,PlayStation Has Had A GOTY Nominee Every Single Year In The Last Decade,,Imaginary_Cause2216,1h5mnet,https://reddit.com/r/gaming/comments/1h5mnet/playstation_has_had_a_goty_nominee_every_single/,https://i.redd.it/uwpze1q4rm4e1.jpeg,2024-12-03 12:49:23,14597,0.86,14597,0,1605,0,0,False,False,False,False,False,,https://a.thumbs.redditmedia.com/pFhLvEvse4VUnd0zApACJMuPEIzrzVimuhlnxdUE1U0.jpg,t3_1h5mnet
gaming,"Indiana Jones and the Great Circle PC system requirements, these are some hefty specs....",,Lo_jak,1h5zljg,https://reddit.com/r/gaming/comments/1h5zljg/indiana_jones_and_the_great_circle_pc_system/,https://i.redd.it/j2ljxz4aip4e1.jpeg,2024-12-03 22:05:04,1289,0.91,1289,0,846,0,0,False,False,False,False,False,,https://b.thumbs.redditmedia.com/ZYwW7iVNuobHrcNPe7RzPEXR6s6mj89hDQJVptcL9Mw.jpg,t3_1h5zljg
gaming,I gathered all my controllers! Pretty grateful for my gaming journey. (my mother sold my N64 when I was a kid :( ),,6Kaliba9,1h6vens,https://reddit.com/r/gaming/comments/1h6vens/i_gathered_all_my_controllers_pretty_grateful_for/,https://i.redd.it/ahn6xijh8x4e1.jpeg,2024-12-05 00:04:25,12,0.57,12,0,16,0,0,False,False,False,False,False,,https://a.thumbs.redditmedia.com/PFDnCn3Kv6UAsc9nPXCECmcAGWQpaAr8TB6b3t26eu4.jpg,t3_1h6vens
gaming,"For a game where most of it occurs well above 3,000 feet, the ground level of detail in Flight Simulator 2024 is insane.",,Alc2005,1h5pgcz,https://reddit.com/r/gaming/comments/1h5pgcz/for_a_game_where_most_of_it_occurs_well_above/,https://i.redd.it/m0lnvva0cn4e1.jpeg,2024-12-03 15:05:13,4073,0.97,4073,0,120,0,0,False,False,False,False,False,,https://b.thumbs.redditmedia.com/39nm9N8fQG6vRfSViESYIl-cHvsv3RO2t3DAcwWJIPI.jpg,t3_1h5pgcz
gaming,"30 years, but it seems like yesterday",,Kvra,1h5pzgd,https://reddit.com/r/gaming/comments/1h5pzgd/30_years_but_it_seems_like_yesterday/,https://i.redd.it/dyr79zvbjn4e1.jpeg,2024-12-03 15:27:53,3397,0.96,3397,0,109,0,0,False,False,False,False,False,,https://b.thumbs.redditmedia.com/749PXMLVlaR9RArJQYBobGSxFpVjvR8h1BYvRvs_-gI.jpg,t3_1h5pzgd
gaming,Mario/Nintendo music rhythm game,"Theatrhythm Final Bar Line is my favourite rhythm game ever(i love the gameplay but it's the music i love most), I would absolutely love a similar game but with music from either just the mario games or nintendo franchises in general.

What do you think?",THEPSR,1h76x0w,https://reddit.com/r/gaming/comments/1h76x0w/marionintendo_music_rhythm_game/,https://www.reddit.com/r/gaming/comments/1h76x0w/marionintendo_music_rhythm_game/,2024-12-05 11:18:47,0,0.44,0,0,3,0,0,False,False,True,False,False,,self,t3_1h76x0w
gaming,I digged up a REAL screen cap from almost 18 years ago. (23 February 2007),,eddyxx,1h7c9rr,https://reddit.com/r/gaming/comments/1h7c9rr/i_digged_up_a_real_screen_cap_from_almost_18/,https://i.redd.it/l54n60e5x15e1.jpeg,2024-12-05 15:52:03,0,0.17,0,0,0,0,0,False,False,False,False,False,,https://b.thumbs.redditmedia.com/ugMRW_WZ3yAILv-YtDKjLzx6sWpFyWVd9_03vIv15UI.jpg,t3_1h7c9rr
