subreddit,title,selftext,author,id,permalink,url,created_utc,score,upvote_ratio,ups,downs,num_comments,total_awards_received,gilded,is_video,is_original_content,is_self,over_18,spoiler,link_flair_text,thumbnail,name
gaming,Quick review of (almost) all current mini bluetooth controllers!,"Images here: https://imgur.com/a/SZ3VbEy


I love local multiplayer and the easiest way to find people for it is on the go. Lugging around proper full size controllers* would be a chore, and with micro size I can always have even 4 without thinking.

So for starters: my use case is quick plays, 30-90 minutes. Using these regularly for long time would get uncomfortable (and carpal-tunnely I suppose).

The landscape of small controllers is pretty dire to be honest: 8BitDo (for a long time the only option) and rando chinese suppliers.



**8BitDo Lite 2**

It has every button from a classic PS/Xbox layout - including stick click/L3+R3. High quality plastics. Shoulder and trigger button placement is genius and usable. Joystick has a good movement area. Clicks and presses are exquisite. Size is great for the hand, and still light. This is the one controller I could imagine being usable in daily gaming even.

This would be my dream controller. IF it had XInput. Unrelated, but I'm mighty pissed at 8BitDo for not including this with newer models. Yes, these are all aimed for the Switch, but it would have costed next to nothing to add one more mode. Vibration also only works in Switch mode. Yes you can remap with XOutput and the like, but it's a hassle and strangely does not work in every game.

Modes: Switch, Android
Verdict: so close to be perfect, but not reaching it


**8BitDo Zero 2**

My current go-to mini controller. Has XInput. Sadly charges via micro usb (all other are usb-c). No vibration. Buttons feel right. The L/R button is clickable from all directions despite the length, but not really comfortable - which isn't a problem, this size is only used for simple layout games anyway. I wish it would have toggle for modes, there is no visible sign in which it is (toggle is via shortcut combinations).

There is now also a Micro with the same layout as the Q36 below - not ordered becaus missing XInput and I had enough of that after Lite 2)

Modes: Switch, Android, Windows
Verdict: ol' trusty working horse, shows it's age

**LinYuvo Meteor**

Now this is an interesting animal. You can order it for less than half the zero. It has bajillions of color options - I suggest ordering the covered ones, as the LEDs are so bright that you wouldn't want to use them on transparent versions, despite them looking cool as well. It has a circular dpad which I'm neutral about. For some it's easier to hit corners, but it's not as easy as eg. XBox controller's circular one. But it's really clicky, and a bit hard to press, as you can read in the few reviews it has. So dpad is certainly it's biggest drawback. Has vibration. It has a really interesting feature, you can replace keys - dpad with joystick directions and L/R buttons with trigger - without any software, just shortcuts! You can also toggle the light effects and colors, there are quite a few, as gimmick, or turn it off completely (will be remembered).

Verdict: price/features orders of magnitude better than the Zero 2, even Micro. Buttons just don't feel that good, but it's a close call.

**ShanWan Q37**

There exists a version with horizontal and cross (PS and XBox style) joystick placement. You can tell they used CADs from 8BitDo, the inputs have the same appearance - albeit with a very, very cheap plastic. The rounded off body is a bit smaller but thicker and overall harder to hold. But the presses feel ok. There is vibration - both sides even. It has a weird gyro mode in non-switch mode as well where gyro controls the joystick. Can be accidentally triggered and a useless gimmick. But a very welcomed feature is that every single key can be remapped (including this shortcut). It needs a seemingly unrelated mobile app (""GamepadSpace"") - connecting is hacky as you need to enter firmware upload mode - but once done, you are free to customize, even sensitivity, and everything is saved to the controller. This is great, especially since very stupidly in XInput mode the buttons match the switch layout (eg A is B) by default. Until now you would think this is in the endvery ok controller, but you'd be mistaken. Sadly it all falls apart by how incredibly bad quality this controller is. You will get constant disconnects, lag, ghost presses and stuck input. It's just bad, and generic QC issue. I had multiple controllers showing the same sign.

Verdict: It could be the ""good version"" rip-off of 8BitDo, but sadly it's just a mess, and costs the same as 8BitDo.


Modes: Windows/Android, Switch, Playstation

**ShanWan Q36**

The same as Q37, just with copying the 8BitDo Micro form and layout - which makes it even more sad that it's bad.

Modes: Windows/Android, Switch, Playstation


**Keychain controller**

Being available for 8+ years this is more like an afterthought rather than a serious contender, I included it only for fun. But it's by far the smallest you can go! It only has Android and keyboard function. The ""joystick"" is actually moving only on a 2D plane. Very practical and interesting, but a bit hard to move. Buttons are too mushy. But it is useful as a remote, eg. A is mapped to take a photo in Android.

Modes: IOS/Android, Keyboard",poisonborz,1h6svb8,https://reddit.com/r/gaming/comments/1h6svb8/quick_review_of_almost_all_current_mini_bluetooth/,https://www.reddit.com/r/gaming/comments/1h6svb8/quick_review_of_almost_all_current_mini_bluetooth/,2024-12-04 22:15:09,9,0.6,9,0,2,0,0,False,False,True,False,False,,self,t3_1h6svb8
gaming,[RANT] I need a new open world pirate game!,"I want to catch the horizon. I want to feel lonely. I want to sail between wind and tide. And then I want action, islands to explore, treasure to loot. I want NMS on the water. Give me a near accurate map of the Caribbean and enough control without being a full on simulator; I don't need to know what every rope does. Maybe I'm a merchant, maybe I'm a pirate, privateer, navy sailor... Give me something! [END RANT]

fuck.... I'm about to play Black Flag again....",TiresOnFire,1h6yj7k,https://reddit.com/r/gaming/comments/1h6yj7k/rant_i_need_a_new_open_world_pirate_game/,https://www.reddit.com/r/gaming/comments/1h6yj7k/rant_i_need_a_new_open_world_pirate_game/,2024-12-05 02:32:05,0,0.49,0,0,31,0,0,False,False,True,False,False,,self,t3_1h6yj7k
gaming,"Path of Exile 2, and a recent trend in gaming","It seems like Path of Exile 2 is shaping up to follow in the footsteps of Elden Ring and Baldur's Gate 3, a game in a more niche genre, that doubles down on the things people love about that genre, and finds mainstream success by virtue of it being really, really good. Even Metaphor: Re Fantazio sort of fits into that catagory, although I think it's a littke more refined than Persona. And it's got me thinking about how some of the bigger failures of the past few years were games that tried for the broadest appeal possible, and ended up being super bland and forgettable in doing so. Games like Suicide Squad and Star Wars Outlaws. There's nothing really wrong with those games, there's just nothing that makes them stand out.",thewalkindude,1h5vyez,https://reddit.com/r/gaming/comments/1h5vyez/path_of_exile_2_and_a_recent_trend_in_gaming/,https://www.reddit.com/r/gaming/comments/1h5vyez/path_of_exile_2_and_a_recent_trend_in_gaming/,2024-12-03 19:36:26,791,0.82,791,0,408,0,0,False,False,True,False,False,,self,t3_1h5vyez
gaming,What’s a small feature in a game that made it way more immersive for you?,"I’ve been playing a lot of games recently, and I’ve realized how small details can make or break immersion. For example, seeing wet footprints fade on a rainy sidewalk in Sleeping Dogs really stuck with me. What’s your favorite little detail that enhanced your experience?",m2104,1h6mvz7,https://reddit.com/r/gaming/comments/1h6mvz7/whats_a_small_feature_in_a_game_that_made_it_way/,https://www.reddit.com/r/gaming/comments/1h6mvz7/whats_a_small_feature_in_a_game_that_made_it_way/,2024-12-04 18:13:27,12,0.65,12,0,97,0,0,False,False,True,False,False,,self,t3_1h6mvz7
gaming,T-45 Power Armor cosplay from Fallout ,,Zoidberrg,1h5vf9a,https://reddit.com/r/gaming/comments/1h5vf9a/t45_power_armor_cosplay_from_fallout/,https://i.redd.it/lumljw5xno4e1.jpeg,2024-12-03 19:15:10,806,0.84,806,0,43,0,0,False,False,False,False,False,,https://b.thumbs.redditmedia.com/iStyB_zCy9wUjr9OQ5pwCWMZ6dylHpIuejYjuY5Z2lM.jpg,t3_1h5vf9a
gaming,Finally did the switch to PC! ,,Chilicarlos,1h5z0zr,https://reddit.com/r/gaming/comments/1h5z0zr/finally_did_the_switch_to_pc/,https://i.redd.it/lp7d9d22ep4e1.jpeg,2024-12-03 21:41:22,447,0.85,447,0,75,0,0,False,False,False,False,False,,https://b.thumbs.redditmedia.com/BzOmeed2pihvoDmol9JW_0yx5tY4PAvU37vper8Q0vc.jpg,t3_1h5z0zr
gaming,"Open World Games For PS4 That Feel Drenched In Melancholy Despite Not Necessarily Being A ""Sad Story""?","I know this sort of question has been asked many times, but this is my spin on it. As the title says, I'm not looking for a game with a ""sad story"", but rather an open world game where the world, music, overall atmosphere, and the protagonist just feel drenched in a deep sense of melancholy/sadness. I think a good example of what I'm looking for is Red Dead Redemption 1... despite what happens in the end, I wouldn't necessarily consider it a ""sad story"", but rather a story that gives this overwhelming sense that the world is changing, the old ways are dying, and you are powerless to stop it. Just simply stopping to stand somewhere in the middle of the desert plains, and hearing the haunting music in RDR1 gives this feeling, like the whole game just has this constant, overhanging thick layer of melancholy, no matter where you go. In other words, it's as if the world itself is sad. 

I hope you understand what I mean by all this. Any open world game suggestions like this on PS4 would be greatly appreciated!",701921225,1h6yro1,https://reddit.com/r/gaming/comments/1h6yro1/open_world_games_for_ps4_that_feel_drenched_in/,https://www.reddit.com/r/gaming/comments/1h6yro1/open_world_games_for_ps4_that_feel_drenched_in/,2024-12-05 02:43:27,4,0.54,4,0,52,0,0,False,False,True,False,False,,self,t3_1h6yro1
gaming,What games are you thankful for this year?,,tInteresting_Space,1h7arpy,https://reddit.com/r/gaming/comments/1h7arpy/what_games_are_you_thankful_for_this_year/,https://hardcoregamer.com/games-we-are-thankful-for-in-2024/,2024-12-05 14:46:00,0,0.29,0,0,19,0,0,False,False,False,False,False,,https://b.thumbs.redditmedia.com/ZtszBrfjQ7GDQmZTZAFWCQUSRWKVkmieOhVrOLQMxdA.jpg,t3_1h7arpy
gaming,Games with a sense of long-term progression and goals?,"I love WoW and Tarkov and Runescape, but also Stardew Valley, Rimworld, and a whole bunch of others. 

Nothing makes me happier than having a game with a sense of long-term progress, like I’ve built something and have something to show for it. For example, I love the Player-Owned house in Runescape and showing off my pets and achievements. I love mounts and transmogs in wow because I love building my own aesthetic based around my greatest moments. I LOVE my hideout in Tarkov because I feel like I made it with my blood, sweat, and tears, and each mannequin with boss armor on it reminds me of those first kills. 

I’m burned out of most of the above, and while I’m obviously okay with grinding, I need a purpose for it (looking at you WoW) 

Any suggestions for someone looking for a long-term experience?",ArcadeRay,1h6bsax,https://reddit.com/r/gaming/comments/1h6bsax/games_with_a_sense_of_longterm_progression_and/,https://www.reddit.com/r/gaming/comments/1h6bsax/games_with_a_sense_of_longterm_progression_and/,2024-12-04 08:57:24,30,0.7,30,0,114,0,0,False,False,True,False,False,,self,t3_1h6bsax
gaming,When you are not feeling the beat,,unbalancedbreakfast,1h5u8al,https://reddit.com/r/gaming/comments/1h5u8al/when_you_are_not_feeling_the_beat/,https://i.redd.it/7tnjtzk6fo4e1.jpeg,2024-12-03 18:25:55,314,0.92,314,0,28,0,0,False,False,False,False,False,,https://b.thumbs.redditmedia.com/EvGZJvZ1CUNh4NbqwChzfdTre_sqhplkzErSE0glqHQ.jpg,t3_1h5u8al
gaming,Official launch trailer. Indiana Jones and the Great Circle.,,bestest_at_grammar,1h5o8ea,https://reddit.com/r/gaming/comments/1h5o8ea/official_launch_trailer_indiana_jones_and_the/,https://youtu.be/TQOJCrQq6hs?si=94knLxqsd5Hf4V5L,2024-12-03 14:10:09,607,0.84,607,0,299,0,0,False,False,False,False,False,,https://b.thumbs.redditmedia.com/kfDRMButHCKw2xq0mBA1_6lbvYGIA9RenJTMvgC5ctA.jpg,t3_1h5o8ea
gaming,What game gives you a strong feeling of nostalgia and makes you remember everything that happened to you at the time when you were actively playing this game?,"I was recently surfing net when, out of nowhere, I decided to open ***Super Mario 64***. No real reason, just a random decision

The second the title screen appeared, I felt like I was a kid again. That familiar music, Mario’s face, the vibrant world - it all came rushing back. After a few minutes of gameplay I was literally hooked. Running around, hearing the old sound effects and all that stuff - everything felt so nostalgic

Then suddenly memories started flooding in. I remembered where I was when I first played it - the old couch in my living room, the excitement of my first time exploring the game, the friends I used to play it with after school. I hadn’t realized how much I missed it until I was already lost in the game. It was like no time had passed at all

**Do you have games that make you feel like that?**",rockzxm,1h66dxl,https://reddit.com/r/gaming/comments/1h66dxl/what_game_gives_you_a_strong_feeling_of_nostalgia/,https://www.reddit.com/r/gaming/comments/1h66dxl/what_game_gives_you_a_strong_feeling_of_nostalgia/,2024-12-04 03:17:40,47,0.78,47,0,151,0,0,False,False,True,False,False,,self,t3_1h66dxl
gaming,"What's going on with ""Delta Force""?","It's weird. I keep seeing images of a Delta Force game which seems to be a follow-up to the older Novalogic games... But it's got ""tacticool"" characters who look like something from a hero shooter.

What's going on with it?

Last time I checked in with this series, they made the sequel-in-all-but-name *Joint Operations: Typhoon Rising*, which was an amazing game - but these have all been quite realistic shooters that kinda pitched their flag halfway between Battlefield and ARMA.

The images I'm seeing of the new one are jarring.",ByEthanFox,1h773b2,https://reddit.com/r/gaming/comments/1h773b2/whats_going_on_with_delta_force/,https://www.reddit.com/r/gaming/comments/1h773b2/whats_going_on_with_delta_force/,2024-12-05 11:30:31,0,0.26,0,0,27,0,0,False,False,True,False,False,,self,t3_1h773b2
gaming,Musings on Video Gaming,"I’m over 65 and have been playing video games (badly) since my Intellevision days. I’m now using a PS5.
I have loved games such as The Last of Us, Days Gone, Zelda and so many more and I played almost every day especially since the ps3 days.
Recently my hands and wrists have gotten a little painful so I haven’t played in a few weeks. The thing is I don’t miss it. Right now as it stands if I never played again it wouldn’t kill me.
It made me wonder how many of us are playing for the love of gaming or because it’s become an easy habit to fall into.
When was the last time any of us stopped playing for a week just to catch our breath so to speak?
This is a hobby that can consume thousands of hours.Maybe we should set aside some of those hours in levelling ourselves up rather than our avatars. 
",TemperatureTime1617,1h67phc,https://reddit.com/r/gaming/comments/1h67phc/musings_on_video_gaming/,https://www.reddit.com/r/gaming/comments/1h67phc/musings_on_video_gaming/,2024-12-04 04:27:58,38,0.65,38,0,39,0,0,False,False,True,False,False,,self,t3_1h67phc
gaming,What's the most significant or memorable gaming content that's also entirely missable?,"When playing games that bother to fully flesh out their worlds, there must be so much you could complete a game without seeing or being signposted towards or lead through. Rockstar in particular seem to have entire areas, characters and plot points that you could in theory never experience.

What's the most compelling part of a game that you've experienced that you realised could have easily been missed?",danielgmal,1h6v1gk,https://reddit.com/r/gaming/comments/1h6v1gk/whats_the_most_significant_or_memorable_gaming/,https://www.reddit.com/r/gaming/comments/1h6v1gk/whats_the_most_significant_or_memorable_gaming/,2024-12-04 23:48:21,2,0.54,2,0,55,0,0,False,False,True,False,False,,self,t3_1h6v1gk
gaming,"Blizzard is delisting the OG Warcrafts from GOG, but GOG says it's gonna preserve them forever anyway, hands out a discount, and announces new policy for its preservation program to boot",,Former-Fix4842,1h52r8c,https://reddit.com/r/gaming/comments/1h52r8c/blizzard_is_delisting_the_og_warcrafts_from_gog/,https://www.pcgamer.com/software/platforms/blizzard-is-delisting-the-og-warcrafts-from-gog-but-gog-says-its-gonna-preserve-them-forever-anyway-hands-out-a-discount-and-announces-new-policy-for-its-preservation-program-to-boot/,2024-12-02 19:02:58,31291,0.96,31291,0,1458,0,0,False,False,False,False,False,,https://b.thumbs.redditmedia.com/VQ4Ymc2U9pq5_CoH26xa1jPi7jEDt_HbbVxmGM9Fk5Y.jpg,t3_1h52r8c
gaming,what are some video game sequels that would have been better off as a spinoff than a sequel.,i feel like Last of Us 2 would have been better as a anthology spinoff as I felt stories set in the Last of us universe for the perspective of other people's lives in the apocalypse sound more interesting tbh.,frogboss4020,1h737sz,https://reddit.com/r/gaming/comments/1h737sz/what_are_some_video_game_sequels_that_would_have/,https://www.reddit.com/r/gaming/comments/1h737sz/what_are_some_video_game_sequels_that_would_have/,2024-12-05 06:50:07,0,0.36,0,0,41,0,0,False,False,True,False,False,,self,t3_1h737sz
gaming,Nether Portal I made with the new Minecraft Resin Blocks,,dancsa222,1h5oiic,https://reddit.com/r/gaming/comments/1h5oiic/nether_portal_i_made_with_the_new_minecraft_resin/,https://i.redd.it/3gtugcxu7n4e1.png,2024-12-03 14:23:06,282,0.88,282,0,22,0,0,False,False,False,False,False,,https://a.thumbs.redditmedia.com/LMEBl8eZbtRWs5vnPGSecidtZ1Gg7udz8kcL7Btifm0.jpg,t3_1h5oiic
gaming,Am I crazy or did they just...,"They got no chill, going for two at once. Correct me if I am wrong but this moveset looks oddly familiar as well. 
(&gt;!Elden Ring - Falling Star Beast!&lt;)
I mean, taking inspiration is one thing, straight up copying is just maidenless behaviour at this point.

Video link: https://imgur.com/a/ICMXQo4
It's just clip snippet of their steam page trailer.

Edit: Ok guys, I got the point, I made this post way more dramatic than it is. I am just pointing it out...",Hammadforreal,1h791i2,https://reddit.com/r/gaming/comments/1h791i2/am_i_crazy_or_did_they_just/,https://www.reddit.com/r/gaming/comments/1h791i2/am_i_crazy_or_did_they_just/,2024-12-05 13:21:51,0,0.24,0,0,13,0,0,False,False,True,False,False,,self,t3_1h791i2
gaming,What are some irl games that exist inside other games,"Sometimes well playing a game you find other games left as easter eggs and sometimes they are even playable.

Off the top of my head here are some I can Think of:
Classic Doom in Doom Eternal: well in 2016 you can play a lot of the classic levels, they are all in a separate menu so out of universe but in Doom Eternal, you access them in universe in Doomguy’s computer inside his fortress

Crash in Uncharted: in the first few chapters of Uncharted 4 you get to a part where Elena tries to get Nate into a PS1 game she really likes and it happens to be Crash Bandicoot.

Classic Activition Games in Call of Duty Cold War: in Cold War there is a section where you go through a mock city used by the russians to train for a US ground invasion. In this mock city you can find arcades with classic activition games.

Those are the 3 I can think of, I also thought of the classic levels in Wolfenstein but those are see as nightmares so they don’t actually exist in universe but what are some others you guys can think of??",Plastic-Fly9455,1h5snb4,https://reddit.com/r/gaming/comments/1h5snb4/what_are_some_irl_games_that_exist_inside_other/,https://www.reddit.com/r/gaming/comments/1h5snb4/what_are_some_irl_games_that_exist_inside_other/,2024-12-03 17:20:51,141,0.88,141,0,214,0,0,False,False,True,False,False,,self,t3_1h5snb4
gaming,Which gaming community is suffering the most? 😭,"Is it:

1. The Hollow Knight Silk Song fans
2. Grand Theft Auto VI fans
3. The Bloodborne community

Feel free to debate in the comments as to why.",Afsan23,1h77s3b,https://reddit.com/r/gaming/comments/1h77s3b/which_gaming_community_is_suffering_the_most/,https://www.reddit.com/r/gaming/comments/1h77s3b/which_gaming_community_is_suffering_the_most/,2024-12-05 12:12:20,0,0.19,0,0,57,0,0,False,False,True,False,False,,self,t3_1h77s3b
gaming,Sunright Boba is doing a collab with Omori,They make it seem so bright and bubbly when Omori is anything but! ,VinTheHuman,1h61gns,https://reddit.com/r/gaming/comments/1h61gns/sunright_boba_is_doing_a_collab_with_omori/,https://i.redd.it/cg3fti4ewp4e1.jpeg,2024-12-03 23:24:12,38,0.67,38,0,9,0,0,False,False,False,False,False,,https://b.thumbs.redditmedia.com/c29BExafhh6auLnmBcxRmljZEBMdcd_6JKBSOVA7rQY.jpg,t3_1h61gns
gaming,"A Black Ops 6 player allegedly abused an AFK Zombies glitch and left his Xbox on for over a month to become the first Prestige level 1000 player
",,ChiefLeef22,1h4wacg,https://reddit.com/r/gaming/comments/1h4wacg/a_black_ops_6_player_allegedly_abused_an_afk/,https://www.ign.com/articles/row-over-call-of-duty-black-ops-6-player-who-used-zombies-exploits-to-become-first-to-hit-prestige-master-level-1000-and-reveal-rewards,2024-12-02 14:33:47,26444,0.95,26444,0,948,0,0,False,False,False,False,False,,https://b.thumbs.redditmedia.com/QpFoLEXv8gFpoWuVRdc5ZOZDu39SqnvYQW0MI21Xr0E.jpg,t3_1h4wacg
gaming,Got $100 Target Gift Card - What To Get,"This is a hard one for me because I just get PS+ Premium yearly with my Playstation. New games, I just borrow from the library. Also have a Switch where I borrow games from the library. Cannot buy gift cards with it...

Was thinking Silent Hill because its only 30 with price match... but idk. Also have a Quest 3s. The only item I can think of is save for GTA6 because that will never be on Plus and the library line will be 5 miles long.",Money_Tough,1h6zs1r,https://reddit.com/r/gaming/comments/1h6zs1r/got_100_target_gift_card_what_to_get/,https://www.reddit.com/r/gaming/comments/1h6zs1r/got_100_target_gift_card_what_to_get/,2024-12-05 03:33:19,0,0.11,0,0,11,0,0,False,False,True,False,False,,self,t3_1h6zs1r
gaming,"October 2024 Worldwide Console Sales PS5 11.19M, Nintendo Switch 7.59M, Xbox Series X|S 3.25M",,Imaginary_Cause2216,1h5p32y,https://reddit.com/r/gaming/comments/1h5p32y/october_2024_worldwide_console_sales_ps5_1119m/,https://www.vgchartz.com/article/463156/ps5-vs-xbox-series-xs-vs-switch-2024-worldwide-sales-comparison-charts-through-october/,2024-12-03 14:49:31,124,0.76,124,0,143,0,0,False,False,False,False,False,,https://b.thumbs.redditmedia.com/IMwJgEj6l6W6E_xB4JCrV77opQFyH1pQXZ48PtJK9es.jpg,t3_1h5p32y
