subreddit,title,selftext,author,id,permalink,url,created_utc,score,upvote_ratio,ups,downs,num_comments,total_awards_received,gilded,is_video,is_original_content,is_self,over_18,spoiler,link_flair_text,thumbnail,name
gaming,Got $100 Target Gift Card - What To Get,"This is a hard one for me because I just get PS+ Premium yearly with my Playstation. New games, I just borrow from the library. Also have a Switch where I borrow games from the library. Cannot buy gift cards with it...

Was thinking Silent Hill because its only 30 with price match... but idk. Also have a Quest 3s. The only item I can think of is save for GTA6 because that will never be on Plus and the library line will be 5 miles long.",Money_Tough,1h6zs1r,https://reddit.com/r/gaming/comments/1h6zs1r/got_100_target_gift_card_what_to_get/,https://www.reddit.com/r/gaming/comments/1h6zs1r/got_100_target_gift_card_what_to_get/,2024-12-05 03:33:19,0,0.25,0,0,11,0,0,False,False,True,False,False,,self,t3_1h6zs1r
gaming,A game from back than that you feel should have inspired more but didn't. ,I keep coming back to FTL and it bogs me that there aren't more games like it. What is a game that you feel should have spawned a whole sub-genre but didn't?,_demello,1h6w4qm,https://reddit.com/r/gaming/comments/1h6w4qm/a_game_from_back_than_that_you_feel_should_have/,https://www.reddit.com/r/gaming/comments/1h6w4qm/a_game_from_back_than_that_you_feel_should_have/,2024-12-05 00:37:16,0,0.32,0,0,35,0,0,False,False,True,False,False,,self,t3_1h6w4qm
gaming,"What's going on with ""Delta Force""?","It's weird. I keep seeing images of a Delta Force game which seems to be a follow-up to the older Novalogic games... But it's got ""tacticool"" characters who look like something from a hero shooter.

What's going on with it?

Last time I checked in with this series, they made the sequel-in-all-but-name *Joint Operations: Typhoon Rising*, which was an amazing game - but these have all been quite realistic shooters that kinda pitched their flag halfway between Battlefield and ARMA.

The images I'm seeing of the new one are jarring.",ByEthanFox,1h773b2,https://reddit.com/r/gaming/comments/1h773b2/whats_going_on_with_delta_force/,https://www.reddit.com/r/gaming/comments/1h773b2/whats_going_on_with_delta_force/,2024-12-05 11:30:31,0,0.28,0,0,27,0,0,False,False,True,False,False,,self,t3_1h773b2
gaming,I've become a demotivated gamer,"I often get into a new game that I've looked forward to, either at launch or because of discounts on Steam, but then I play for maybe 2-3 hours, a would-be normal session which I would naturally resume the next day or later in the week except... I don't.

I feel like in 2024 I've started so many games that I intended to play through but as soon as I get the first break from them the thought of booting them up again a day later, or the week after declines completely. FTR I don't actually ""game"". I never played League or CS or anything, and even my WoW days clocked in at lvl 50 during the Lich King stuff.

But I always had an affinity for single-player games that are anywhere between 12 hours or 100 hours long. I would get hooked on them, love them and obviously play them until the credits roll, especially RPGs. But now it's weird. I love it, I really have nothing negative to say but I just can't get myself to play it again. For example, I made it to Chapter 3 in Half Life Alyx, finally playing a VR game -- loving it. I don't feel like playing it at all right now. I made it almost to the end of Dragon Age: The Veilguard, and I'm like bruh... I don't even hate it like all the haters do, why am I suddenly not playing it anymore?

Do you find motivation to just keep playing your games?",linkenski,1h6rq80,https://reddit.com/r/gaming/comments/1h6rq80/ive_become_a_demotivated_gamer/,https://www.reddit.com/r/gaming/comments/1h6rq80/ive_become_a_demotivated_gamer/,2024-12-04 21:28:20,0,0.38,0,0,28,0,0,False,False,True,False,False,,self,t3_1h6rq80
gaming,I've never felt worse buying CoD.,"Been playing CoD since CoD3. I bought BO6 yesterday and played multiplayer for a few hours. Since the original MW2 I always bought every 3rd or so game in the series, because maybe after 2 to 4 ""new"" games they would have actually added one new feature. I still knew I was being charged $65 for what should be a patch I waited too long for, but I had fun. The last CoD I played was MW2019 (entry I played before that was BO3) and I had a great time with both.

I didn't even realize playing BO6 that its FIVE! (FIVE!!!!) games after MW19 and the only change was omni movement? Omni movement affects and helps my playstyle more than most and I still don't care. I've regretted buying games before, but this time I'm just pissed. Everyone please make fun of me for paying $75 so that I ""get"" to unlock the same acog scope for the same ak for the 20th time. I'm an idiot. Don't be like me. You already know it, but don't buy CoD.",Balzalderac,1h6ivjo,https://reddit.com/r/gaming/comments/1h6ivjo/ive_never_felt_worse_buying_cod/,https://www.reddit.com/r/gaming/comments/1h6ivjo/ive_never_felt_worse_buying_cod/,2024-12-04 15:34:40,0,0.43,0,0,71,0,0,False,False,True,False,False,,self,t3_1h6ivjo
gaming,Is the Grand Theft Auto series redundant now that IRL America has out-parodied anything the games could send up?,"GTA's America was always an over the top pastiche, but lately it would seem real life is far weirder than anything in the games. Can the series still playfully mock the American Dream™, or have we gone too far and fallen off the edge of our flat earth for real?",macaronicheezy,1h6ie4w,https://reddit.com/r/gaming/comments/1h6ie4w/is_the_grand_theft_auto_series_redundant_now_that/,https://www.reddit.com/r/gaming/comments/1h6ie4w/is_the_grand_theft_auto_series_redundant_now_that/,2024-12-04 15:14:55,0,0.44,0,0,20,0,0,False,False,True,False,False,,self,t3_1h6ie4w
gaming,I just got a ps5! Looking for recs,"Let me preface this by saying I don't follow gaming news literally at all.

I don't like Assassin's Creed, Call of Duty, or God of War; I'm not into sports games, flight sims, or souls-likes that aren't actually Souls games. Fortnite is cancer.

How's Armored Core 6? The last AC game I played was on ps2 so not exactly recent.

Is Baldurs Gate 3 any good?

Finally, any recs for 2 player simultaneous couch co-op that AREN'T minecraft or LEGO games?

Thx!",bloodectomy,1h6lrr2,https://reddit.com/r/gaming/comments/1h6lrr2/i_just_got_a_ps5_looking_for_recs/,https://www.reddit.com/r/gaming/comments/1h6lrr2/i_just_got_a_ps5_looking_for_recs/,2024-12-04 17:30:00,0,0.22,0,0,23,0,0,False,False,True,False,False,,self,t3_1h6lrr2
gaming,Birthday/Black Friday shopping,,Vladabeast,1h6z3l7,https://reddit.com/r/gaming/comments/1h6z3l7/birthdayblack_friday_shopping/,https://i.redd.it/2u52vher3y4e1.jpeg,2024-12-05 02:59:43,0,0.39,0,0,27,0,0,False,False,False,False,False,,https://b.thumbs.redditmedia.com/BhXKJ-upV2k0xhlnodd5p4gDllC81X8BoZnaO1QGwIs.jpg,t3_1h6z3l7
gaming,Should I Buy Games on Sale or Wait for Freebies?,"Every Steam sale, I feel like buying games I haven’t played yet but know are amazing—either because they’re popular or part of a famous franchise. The big discounts, like 80-95% off, make it super tempting.

But then, I think, *“What if this game becomes free on Epic or Prime Gaming later?”* It’s happened to me before. I bought the **Bioshock Collection** during a sale for ₹300 (\~$3.54), and just a few months later, it was free on Epic. That feeling is awful, isn't it?

Do you guys also deal with this constant FOMO or regret about buying games in sales? How do you decide whether to buy during sales or just wait for the freebies?

Would love to hear your thoughts (or regrets) on this!

P.S.: Any hidden gems you grabbed this sale that you feel were totally worth it? 😊",KSuraj,1h6mtrb,https://reddit.com/r/gaming/comments/1h6mtrb/should_i_buy_games_on_sale_or_wait_for_freebies/,https://www.reddit.com/r/gaming/comments/1h6mtrb/should_i_buy_games_on_sale_or_wait_for_freebies/,2024-12-04 18:10:58,0,0.13,0,0,14,0,0,False,False,True,False,False,,self,t3_1h6mtrb
gaming,Am I crazy or did they just...,"They got no chill, going for two at once. Correct me if I am wrong but this moveset looks oddly familiar as well. 
(&gt;!Elden Ring - Falling Star Beast!&lt;)
I mean, taking inspiration is one thing, straight up copying is just maidenless behaviour at this point.

Video link: https://imgur.com/a/ICMXQo4
It's just clip snippet of their steam page trailer.

Edit: Ok guys, I got the point, I made this post way more dramatic than it is. I am just pointing it out...",Hammadforreal,1h791i2,https://reddit.com/r/gaming/comments/1h791i2/am_i_crazy_or_did_they_just/,https://www.reddit.com/r/gaming/comments/1h791i2/am_i_crazy_or_did_they_just/,2024-12-05 13:21:51,0,0.24,0,0,13,0,0,False,False,True,False,False,,self,t3_1h791i2
gaming,Which gaming community is suffering the most? 😭,"Is it:

1. The Hollow Knight Silk Song fans
2. Grand Theft Auto VI fans
3. The Bloodborne community

Feel free to debate in the comments as to why.",Afsan23,1h77s3b,https://reddit.com/r/gaming/comments/1h77s3b/which_gaming_community_is_suffering_the_most/,https://www.reddit.com/r/gaming/comments/1h77s3b/which_gaming_community_is_suffering_the_most/,2024-12-05 12:12:20,0,0.22,0,0,57,0,0,False,False,True,False,False,,self,t3_1h77s3b
gaming,Ghost of Yotei pushback,"So, the latest anti-woke controversy is brewing, and it's giving me a lot of amusement, honestly.

Not gonna delve too far into Ghost of Tsushima because I haven't personally played it, so I'm not able to offer my own opinion on its gameplay or quality, but it was generally highly acclaimed.

Now, following the successful launch of a new IP, the obvious goal for gaming companies is to turn it into a franchise, so a sequel started getting discussed almost before the ink dried on the sales reports. 

Sony just had their - otherwise honestly lackluster - press event to announce upcoming products. 

One of those products was the intended sequel, Ghost of Yotei. As opposed to a direct sequel to the first game, continuing the story specifically of the male protagonist of the first game, Jin Sakai, Sony opted to turn the Ghost series into more of a related anthology apparently; Yotei follows a new character, a female samurai named Atsu.

And there was considerable backlash about that sequel, which Sony apparently didn't expect. 

That backlash has split into three slightly overlapping camps; I'll discuss two before zoning in on one specifically.

The first, and honestly the most reasonable and valid of them, is the gamers who were specifically looking for a continuation of Jin's story. Disappointment there is totally understandable; regardless of how complete a story is, if you are invested in the character, you want there to be more. More time with them, more insight into them, more story about them, more interaction with them, more. 

Since Yotei is still in development, we don't know how much of that there is. It's entirely possible that Sony is taking a page from Mad Max here and using the first game as an origin story for someone who then appears as a recurring character in other people's stories; we *do not know.*

But that viewpoint, that **""we wanted more Jin and this isn't that, wtf""** is the sane people objection to the announcement.

Second is objection to the voice actress. This is less reasonable but comprehensible, because Erika Ishii is a known and outspoken activist. This doesn't affect their voicework in the game one tiny bit - and the people who have discussed it so far have said it is absolutely top notch - but if you disagree with someone's personal stances, disapproving of their choice for your media is understandable.

For me, Erika is a fantastic choice; if you're not familiar, they are on Dimension 20 and a lot of other Dropout network stuff, and is a fairly prominent activist for LQBTQIA+ rights, but they're also immensely talented, creative, and funny. Especially on Dimension 20 you can see this; their characters are usually only second to Emily Axford's routinely game breaking creativity in terms of their impact, and despite their often super extra appearance on the show, they are very very good at submerging herself into the character, which is honestly literally the entire goal of voice acting for video games.

So, the people who are objecting to the game based on Erika have, you know, no taste and are also bigots, but at least it's a comprehensible sort of consistent bigotry.

The third group of objectors, however, is the one I think is funniest.

Now, I'm gonna reveal something totally unimportant that actually I promise will be sort of relevant: in video games, I almost always play a female character. *(In fact, one of my very few actual gaming regrets involves this; right after launch, I decided to play Genshin Impact with two accounts, one for each Traveler, and the account playing as Aether, the male Traveler, got so much luckier in the gacha that I ultimately ended up with that as my main account, and I'd frankly much rather be playing as Lumine.)*

My reasoning is, maybe silly, but very simple: I think girls are pretty. If I'm gonna be playing a game for hours on end and staring at a single character the whole time, I'd rather be looking at a girl. Not because I identify as a girl, but because I think looking at girls is a lot more fun than looking at other guys.

So, the third group of people who are objecting to Ghost of Yotei is entirely made up of guys, who are objecting on the exclusive grounds that they don't want to play a female character.

Unlike the other two reasons for objecting to the game, which while not necessarily reasonable are at least based on something that's a real thing, these guys are objecting based on the fact that a virtual avatar - an inherently unreal, sexless thing made of pixels - is shaped with slightly more curves. 

In other words, they're so utterly dedicated to staring at male bodies that the idea of looking at a female body makes them utterly revolted.

Now, as a guy who likes looking at girls, I gotta say, even as heterosexual as I am, I can't imagine being *offended* that I had to look at a guy; the most I can muster would be *disinterest.*

And that's what makes this so funny for me.

Can you even imagine *how* gay you have to be, to be willing to start a huge flame war online over the idea that you might have to *not* stare at a male for hours and hours on end for the entire duration of your gameplay?

That's way gayer than I am straight, man.

They keep saying it's ""woke"" or ""DEI"" as cover.

But y'all.

They're really saying that they *hunger* for those tasty man butts.

That's fucking funny.

*(Edited to fix Erika Ishii's pronouns because I didn't know they prefer they/them. Good catch!)*",WillDissolver,1h79gt4,https://reddit.com/r/gaming/comments/1h79gt4/ghost_of_yotei_pushback/,https://www.reddit.com/r/gaming/comments/1h79gt4/ghost_of_yotei_pushback/,2024-12-05 13:43:53,0,0.14,0,0,35,0,0,False,False,True,False,False,,self,t3_1h79gt4
