subreddit,title,selftext,author,id,permalink,url,created_utc,score,upvote_ratio,ups,downs,num_comments,total_awards_received,gilded,is_video,is_original_content,is_self,over_18,spoiler,link_flair_text,thumbnail,name
gaming,Game suggestions,"I’ve been dreaming about a playing a game like Zelda breath of the wild and tears of the kingdom but I didn’t really know what made them click for me until recently, it’s the David and Goliath dynamic. Something about being a little ant going up against a giant boss and ending up triumphant fires up neurons in my brain. 

I’d appreciate any game suggestions with a similar dynamic without going too crazy with difficulty (I managed to finish base game elden ring but I’m struggling with the dlc type of difficulty). Co-op would be a cherry on top!

Edit: thank you all for the replies, I’m seeing a common consensus centered around Shadow of The Colossus, I’ll download it and try it out soon!",1fris,1h5n1x6,https://reddit.com/r/gaming/comments/1h5n1x6/game_suggestions/,https://www.reddit.com/r/gaming/comments/1h5n1x6/game_suggestions/,2024-12-03 13:11:08,0,0.4,0,0,12,0,0,False,False,True,False,False,,self,t3_1h5n1x6
gaming,"Official Dragon Ball: Sparking Zero tournament ends in disaster as finalists fly up and down for 10 minutes straight, which some fans insist is peak performance",,komodo_dragonzord,1h3qxhq,https://reddit.com/r/gaming/comments/1h3qxhq/official_dragon_ball_sparking_zero_tournament/,https://www.gamesradar.com/games/fighting/official-dragon-ball-sparking-zero-tournament-ends-in-disaster-as-finalists-fly-up-and-down-for-10-minutes-straight-which-some-fans-insist-is-peak-performance/,2024-12-01 00:42:13,19809,0.95,19809,0,1020,0,0,False,False,False,False,False,,https://a.thumbs.redditmedia.com/FdSTFLLJFkCnfGF8KHDrHS650RF5E2KVLqr6Uj8GYq4.jpg,t3_1h3qxhq
gaming,GTA Online: Agents of Sabotage DLC Trailer,,EarthPuma120,1h5rg2u,https://reddit.com/r/gaming/comments/1h5rg2u/gta_online_agents_of_sabotage_dlc_trailer/,https://youtu.be/T3ZaWDcPiIo?si=zxcIQwyKEYB-nxn6,2024-12-03 16:30:16,0,0.28,0,0,2,0,0,False,False,False,False,False,,https://b.thumbs.redditmedia.com/Gzuxfe-jV_rFIXeNImKSB_Nxt-cLp3mnu1BJiAfBHWU.jpg,t3_1h5rg2u
gaming,Over twenty years later and nothing beats the experience of riding around in a warthog with your best friend. Halo: CE,"Finally got around to buying the Master Chief Collection. Playing through Halo: CE today and I again become amazed with how well Halo did vehicle combat. It’s not realistic in any way. It’s more like driving a Sea Do than a truck, but over twenty years later, it hasn’t been beaten. IMO, of course

Even Halo 2, which had amazing vehicle combat, lost something with destructible vehicles. There’s something pure about the indestructible warthog that goes soaring through the sky when it gets struck by a perfectly timed rocket/grenade. Hoping beyond hope that you’re able to pull off the landing and make it back to base with your flag

What happened? Why have game developers leaned so much more towards realism when it comes to vehicles? If they include them at all? 

Am I just alone here? Are there great vehicles in other FPSeseses that put the Warthog to shame? ",theoutlet,1h4e0e0,https://reddit.com/r/gaming/comments/1h4e0e0/over_twenty_years_later_and_nothing_beats_the/,https://www.reddit.com/r/gaming/comments/1h4e0e0/over_twenty_years_later_and_nothing_beats_the/,2024-12-01 21:26:06,196,0.79,196,0,56,0,0,False,False,True,False,False,,self,t3_1h4e0e0
gaming,What hidden gems are you guys buying during this Steam sale?,"I'm not much of AAA type of gamer so I'm curious to know what hidden gems people have been grabbing during this sale.

I currently have my eyes set on Archvale, which looks and feels very juicy and polished. Also Steam Deck verified.",teinimon,1h43lmg,https://reddit.com/r/gaming/comments/1h43lmg/what_hidden_gems_are_you_guys_buying_during_this/,https://www.reddit.com/r/gaming/comments/1h43lmg/what_hidden_gems_are_you_guys_buying_during_this/,2024-12-01 13:45:53,760,0.89,760,0,697,0,0,False,False,True,False,False,,self,t3_1h43lmg
gaming,why does odyssey feels boring and repetitive over origins? ,i've played origins and i actually enjoyed levelling up and grinding but for some reason trying to level up with side missions feels boring and sometimes makes me quit the game frequently. origins actually had some interesting story going on and when the members of the cult are killed there's an actual cutscene. odyssey feels like a whole different game. like this is my second time picking up the game after dropping it the first time. and last question is valhalla the same as odyssey or is it actually better or close to origins. sorry odyssey fans.,_rish01,1h5ob5b,https://reddit.com/r/gaming/comments/1h5ob5b/why_does_odyssey_feels_boring_and_repetitive_over/,https://www.reddit.com/r/gaming/comments/1h5ob5b/why_does_odyssey_feels_boring_and_repetitive_over/,2024-12-03 14:13:53,0,0.37,0,0,37,0,0,False,False,True,False,False,,self,t3_1h5ob5b
gaming,War rock. You remember it now. ,,Kachelpiepn,1h5qmgg,https://reddit.com/r/gaming/comments/1h5qmgg/war_rock_you_remember_it_now/,https://i.redd.it/2tdhl8daon4e1.jpeg,2024-12-03 15:55:09,0,0.33,0,0,10,0,0,False,False,False,False,False,,https://b.thumbs.redditmedia.com/67q0Ang0W22VIbkx-xo4ay18SFCZX1Ixxqfd_JM6HEQ.jpg,t3_1h5qmgg
gaming,"In the game Diplomacy is Not an Option, diplomacy is not an option.",,off-and-on,1h3m7wm,https://reddit.com/r/gaming/comments/1h3m7wm/in_the_game_diplomacy_is_not_an_option_diplomacy/,https://i.redd.it/nja2jf8qr34e1.jpeg,2024-11-30 20:58:54,14853,0.96,14853,0,152,0,0,False,False,False,False,False,,https://b.thumbs.redditmedia.com/T0mR7w2Q82TbbHL5orlfaVAtTIXhI-kLwVPUiRxCSzY.jpg,t3_1h3m7wm
gaming,So Guys!! Battlefield vs. Call of Duty? ,"Which of these iconic games you think deserves a VR adaptation? I just got a battery head strap for my Quest 2 from Syntech, and I am back in action. Since I had been continuously playing battlefield and COD on my PC, so I am kinda missing them in VR world. So which of these two you guys think would get a VR version soon? ",Civil_Practice_7172,1h5nvvf,https://reddit.com/r/gaming/comments/1h5nvvf/so_guys_battlefield_vs_call_of_duty/,https://www.reddit.com/r/gaming/comments/1h5nvvf/so_guys_battlefield_vs_call_of_duty/,2024-12-03 13:53:45,0,0.13,0,0,28,0,0,False,False,True,False,False,,self,t3_1h5nvvf
gaming,Crash 4 randomly appeared on my Firestick as Gamepass compatible. Maybe is coming soon?,When i try to open it It goes to the Nsane Trilogy page. Weird.,sonicfonico,1h47xnd,https://reddit.com/r/gaming/comments/1h47xnd/crash_4_randomly_appeared_on_my_firestick_as/,https://i.redd.it/d9ppsiwhr94e1.jpeg,2024-12-01 17:08:16,191,0.78,191,0,34,0,0,False,False,False,False,False,,https://b.thumbs.redditmedia.com/38BfNva_t11ZJqu0tJkLoqe1OjFD6LzkyPIB6UKfpzY.jpg,t3_1h47xnd
gaming,Looking for a game that doesn’t feel like your playing a game,"I’m looking for something were playing the game isn’t constantly “ding” upgraded x, “ding” go to Y on the map, or “make X of the easiest thing to upgrade Y skill”.

I think both BG3 and ER have massively changed my expectations.

Things I’ve played and enjoyed:

PoE 
The long dark
RdR2
Elden ring

Recent stuff I found meh:

Ghost of Tsushima
Kingdom come
Pillars of eternity 1/2

I’m probably going to try Sekiro, the curve sounds really well designed.

Thx in advance ",creedular,1h5ku3s,https://reddit.com/r/gaming/comments/1h5ku3s/looking_for_a_game_that_doesnt_feel_like_your/,https://www.reddit.com/r/gaming/comments/1h5ku3s/looking_for_a_game_that_doesnt_feel_like_your/,2024-12-03 10:55:27,0,0.29,0,0,48,0,0,False,False,True,False,False,,self,t3_1h5ku3s
gaming,Suggestions for Myst-Style Archeology/Puzzle games?,Bonus points if they have a Middle-Eastern/Ancient Egypt theme.,jwg2695,1h54ybp,https://reddit.com/r/gaming/comments/1h54ybp/suggestions_for_myststyle_archeologypuzzle_games/,https://www.reddit.com/r/gaming/comments/1h54ybp/suggestions_for_myststyle_archeologypuzzle_games/,2024-12-02 20:32:12,0,0.5,0,0,12,0,0,False,False,True,False,False,,self,t3_1h54ybp
gaming,Which kids in games did you genuinely care for?,"Everybody I know got really attached to protecting Clementine in the Walking Dead. Which kids were made well enough that you wanted to fight for? My list so far is

Haruka in the Yakuza/Like A Dragon series

The rest of the orphans in Yakuza/LAD

Nanako in Persona 4

Ciri in the Witcher

AJ in the Walking Dead",StMcAwesome,1h4eq2p,https://reddit.com/r/gaming/comments/1h4eq2p/which_kids_in_games_did_you_genuinely_care_for/,https://www.reddit.com/r/gaming/comments/1h4eq2p/which_kids_in_games_did_you_genuinely_care_for/,2024-12-01 21:56:39,57,0.7,57,0,126,0,0,False,False,True,False,False,,self,t3_1h4eq2p
gaming,I did not realize they put Aero the Acrobat on modern consoles. ,"Back in the day Areo was one of my favorite Blockbuster rentals. With all this talk about the Retro Engine and Sunsoft license holders interested in bringing their old games to current day platforms, I was eagerly awaiting an announcement, but I guess it flew by me. Much to my surprise when I was browsing the PS5 store a few minures ago, I saw it listed. It was apparently released last month and it's a port of the GBA remake. This makes me so happy. 

Edit: Apparently in addition to the GBA version, there's also ports of the Sega Genesis/SNES version as well. In addition Aero 2 is also available. ",virtualpig,1h4jol3,https://reddit.com/r/gaming/comments/1h4jol3/i_did_not_realize_they_put_aero_the_acrobat_on/,https://www.reddit.com/r/gaming/comments/1h4jol3/i_did_not_realize_they_put_aero_the_acrobat_on/,2024-12-02 01:45:50,25,0.72,25,0,6,0,0,False,False,True,False,False,,self,t3_1h4jol3
gaming,"RPG lovers, I need your advice - FF16 or Kingdom Hearts?","Hey fellow gamers!  For Christmas I can get one game and will probably have time to splurge out a full RPG (hopefully).  I love RPGs, I love everything Final Fantasy, I also love everything Disney... and now that these two are on PC I need your advice.  Do I get FF16 on Steam or do I get the Kingdom Hearts bundle? Can someone help offer me spoil free advice on pros / cons of each? 

In RPGs I'm mainly interested in great story and interesting characters.  I mainly play through for the plot and not for challenging difficult grinds or complicated gameplay.",Rapturos,1h5f96e,https://reddit.com/r/gaming/comments/1h5f96e/rpg_lovers_i_need_your_advice_ff16_or_kingdom/,https://www.reddit.com/r/gaming/comments/1h5f96e/rpg_lovers_i_need_your_advice_ff16_or_kingdom/,2024-12-03 04:29:46,0,0.42,0,0,35,0,0,False,False,True,False,False,,self,t3_1h5f96e
gaming,CASTLE DOOMBAD is Back!,"I loved playing this game on my phone years ago, and I just found out it's been re-released! I hear they're also working on a sequel.",DepartureOdd302,1h5ddkh,https://reddit.com/r/gaming/comments/1h5ddkh/castle_doombad_is_back/,https://youtu.be/SWXPV7itf74?si=0p3rfap6bjoroveu,2024-12-03 02:49:34,0,0.43,0,0,7,0,0,False,False,False,False,False,,https://b.thumbs.redditmedia.com/ImCeJCjmzl7VfVKXIx6HVtarqZRv50StTCF0aUnUQKk.jpg,t3_1h5ddkh
gaming,Any game that has a SAVE button should also have a LOAD button,,WineYoda,1h3ps18,https://reddit.com/r/gaming/comments/1h3ps18/any_game_that_has_a_save_button_should_also_have/,https://i.redd.it/w02wkemml44e1.png,2024-11-30 23:46:54,2431,0.95,2431,0,106,0,0,False,False,False,False,False,,https://b.thumbs.redditmedia.com/OyXtOePSlN3F-vgmccS8SuP6efKAJKIXVi5vRgSm7TM.jpg,t3_1h3ps18
gaming,Fable 1-choose evil commercial,,bomb5000,1h48y6r,https://reddit.com/r/gaming/comments/1h48y6r/fable_1choose_evil_commercial/,https://youtu.be/I4NwC3GBIDk,2024-12-01 17:51:34,83,0.82,83,0,26,0,0,False,False,False,False,False,,https://b.thumbs.redditmedia.com/DKX7RBjP5X1thwZ-3HLifGlOmFwhmL3Rmid_JxwFBqU.jpg,t3_1h48y6r
gaming,Is there any good character creators I would like?,"I love it when gams let me make my own characters. I like to set them in the world and create head cannons as a way to exercise my creativity. However, I haven't found a game that has really scratch the itch. The only one that has come close was a shitty MMO called KurtzPel but it was ruined by the devs and playerbase. I have played Eder scrolls and cyber punk and baldurs gate and none of those really get it. I want sliders and LOTS of them. I don't like just basic face options because its not personal enough. Maybe I am dreaming but here is hoping any of you guys know of at least one. Also no adult games.

Edit: Let me clarify that i do like the games mentioned I just don't like the character creation. Baldurs gate was especially disappointing for being a game based on a game about creation a very personal character. Good game though. I've had several runs.",Soulwater69,1h5ckqk,https://reddit.com/r/gaming/comments/1h5ckqk/is_there_any_good_character_creators_i_would_like/,https://www.reddit.com/r/gaming/comments/1h5ckqk/is_there_any_good_character_creators_i_would_like/,2024-12-03 02:08:42,0,0.39,0,0,36,0,0,False,False,True,False,False,,self,t3_1h5ckqk
gaming,"If you could only play one numbered entry in a game series (e.g., only the first game, only the second, etc.), which number would you pick and why?","I find reasons for go for anything 1, 2, and 3, but i think 2 might be my pick. Resident Evil 2, Black Ops 2, LittleBigPlanet 2, Hot Pursuit 2, list is probably longer but that's all I can remember that'd I actually play. 

Yes remakes count, and it doesn't necessarily have to be the second game in the series, just needs to be a sequel/have 2 in the title. Figured this would be more different than the usual ""only one game to play forever"" question. ",Fitz_01,1h4hgoc,https://reddit.com/r/gaming/comments/1h4hgoc/if_you_could_only_play_one_numbered_entry_in_a/,https://www.reddit.com/r/gaming/comments/1h4hgoc/if_you_could_only_play_one_numbered_entry_in_a/,2024-12-01 23:58:56,15,0.57,15,0,116,0,0,False,False,True,False,False,,self,t3_1h4hgoc
gaming,"What games have you played several times, enjoyed, but have never beaten?","I'll start with Hollow Knight and Kung-Fu for NES. Just can't beat those games no matter how hard I try. Honorable mention goes to Mertoid Prime but I finally just beat it after 3 full runs through that game.


Edit I meant Metroid Dread not Prime. Prime was very fun and beatable",dunkan799,1h425l8,https://reddit.com/r/gaming/comments/1h425l8/what_games_have_you_played_several_times_enjoyed/,https://www.reddit.com/r/gaming/comments/1h425l8/what_games_have_you_played_several_times_enjoyed/,2024-12-01 12:23:07,116,0.88,116,0,318,0,0,False,False,True,False,False,,self,t3_1h425l8
gaming,What are the best ps5 games?,I just bought a new ps5!! What are the best games to play on it?,Beneficial-One7903,1h5ai4i,https://reddit.com/r/gaming/comments/1h5ai4i/what_are_the_best_ps5_games/,https://www.reddit.com/r/gaming/comments/1h5ai4i/what_are_the_best_ps5_games/,2024-12-03 00:29:19,0,0.41,0,0,64,0,0,False,False,True,False,False,,self,t3_1h5ai4i
gaming,What's the best Easter egg you have ever found in a game?,I always love finding hidden Easter eggs. Especially by accident with no clue of their existence. I'm just curious to know what the best one is other have found?,TheHottestEmber,1h480no,https://reddit.com/r/gaming/comments/1h480no/whats_the_best_easter_egg_you_have_ever_found_in/,https://www.reddit.com/r/gaming/comments/1h480no/whats_the_best_easter_egg_you_have_ever_found_in/,2024-12-01 17:12:00,42,0.69,42,0,152,0,0,False,False,True,False,False,,self,t3_1h480no
gaming,Title of the one new pvp top down action hero game?,It was had a beta test phase 10-14 days ago. Probably on steam. And some people talked about it. But can’t find anything about it now. ,Greyman218,1h58wnw,https://reddit.com/r/gaming/comments/1h58wnw/title_of_the_one_new_pvp_top_down_action_hero_game/,https://www.reddit.com/r/gaming/comments/1h58wnw/title_of_the_one_new_pvp_top_down_action_hero_game/,2024-12-02 23:16:55,0,0.33,0,0,3,0,0,False,False,True,False,False,,self,t3_1h58wnw
gaming,Physically large objects/events in games?,"I'm writing a video of large objects in games. For example, I have Sovereign being on top of your play area in ME1, the space elevator in Satisfactory making it's initial connection and the final boss fight of Horizon FB's dlc.

Do y'all have any favorite moments or set pieces with super large objects? (relative to the scope of the play area)

I don't really want things from something like Stellaris because although yes everything is ""big"" in the scope of the game everything is pretty small, if that makes any sense. ",awesome6666,1h574e1,https://reddit.com/r/gaming/comments/1h574e1/physically_large_objectsevents_in_games/,https://www.reddit.com/r/gaming/comments/1h574e1/physically_large_objectsevents_in_games/,2024-12-02 22:00:49,0,0.36,0,0,46,0,0,False,False,True,False,False,,self,t3_1h574e1
gaming,"Arcane producer has the final say on explaining the Netflix show's $250 million budget: ""We are a game company… We didn't lease out the work""",,Roids-in-my-vains,1h38mzs,https://reddit.com/r/gaming/comments/1h38mzs/arcane_producer_has_the_final_say_on_explaining/,https://www.gamesradar.com/entertainment/animation-shows/arcane-producer-has-the-final-say-on-explaining-the-netflix-shows-usd250-million-budget-we-are-a-game-company-we-didnt-lease-out-the-work/,2024-11-30 08:59:08,23825,0.93,23825,0,1317,0,0,False,False,False,False,False,,https://b.thumbs.redditmedia.com/fV9fflZnOdMPzIArwZyA3nflBZlEa_qNni6DgbOOdEI.jpg,t3_1h38mzs
gaming,Anyone got Beginner tips for Crew 2? ,"Not normally a Arcade\\car game guy, but having fun! 

Anything i should do off the bat?   
Anything to focus on first to make the rest easier ?   
\*

Any other tips?= ",WastelandViking,1h57g6r,https://reddit.com/r/gaming/comments/1h57g6r/anyone_got_beginner_tips_for_crew_2/,https://www.reddit.com/r/gaming/comments/1h57g6r/anyone_got_beginner_tips_for_crew_2/,2024-12-02 22:14:27,0,0.17,0,0,4,0,0,False,False,True,False,False,,self,t3_1h57g6r
gaming,Last of us part 1 or Hitman WoA,Which one should I buy. I like both but which one to go first. Suggestions thank you,Successful_Tale5610,1h5769f,https://reddit.com/r/gaming/comments/1h5769f/last_of_us_part_1_or_hitman_woa/,https://www.reddit.com/r/gaming/comments/1h5769f/last_of_us_part_1_or_hitman_woa/,2024-12-02 22:02:53,0,0.15,0,0,15,0,0,False,False,True,False,False,,self,t3_1h5769f
gaming,What game would be amazing with a time loop perspective on another/new game+ playthrough?,"For example, I finished cyberpunk 2077 and immediately started a new game. I get to the Peralez side mission with Johnny warning me away, and I wanted to tell him it's way more interesting than he knows. I got to thinking, what if games had different dialogue options for multiple playthroughs in the style of a time-loop scenario?
",pauciradiatus,1h4azvd,https://reddit.com/r/gaming/comments/1h4azvd/what_game_would_be_amazing_with_a_time_loop/,https://www.reddit.com/r/gaming/comments/1h4azvd/what_game_would_be_amazing_with_a_time_loop/,2024-12-01 19:18:22,21,0.69,21,0,26,0,0,False,False,True,False,False,,self,t3_1h4azvd
gaming,"There should be a Sims but like, medieval. That'd be dope as hell.","Like imagine that, it'd be amazing ",WhiteWolf101043,1h3hv4f,https://reddit.com/r/gaming/comments/1h3hv4f/there_should_be_a_sims_but_like_medieval_thatd_be/,https://www.reddit.com/r/gaming/comments/1h3hv4f/there_should_be_a_sims_but_like_medieval_thatd_be/,2024-11-30 17:40:35,1991,0.92,1991,0,238,0,0,False,False,True,False,False,,self,t3_1h3hv4f
gaming,"Best ""I don't need a life"" Game during Steam's Autumn Sale?","I'm trying to stay under $20, but can go up to $30 if I skip a few meals this week.

(thanks in advance!!!)

EDIT: Thank you for your concern (those of you who said something).  I will not be skipping meals due to my gaming addiction.  I'm a little high on cannabis and thought my ""post desperation"" would help to show how much a retired old man appreciates every dollar (and some of the cheaper games have the best stories or are crazy challenging/interesting).

EDIT 2:  To everyone who contributed, thank you!  So far I pulled the trigger on....

Kingdom Come : Deliverance (with all DLC) for $3.99

&amp;

Cities for $2.99

(...and again... thank you!)

  
EDIT 3:  I'm blown away at the responses.  You people are awesome!!!  I'm in the middle of playing Kingdom Come, but will likely purchase one or two more (Mad Max for sure), then wait til the Winter Sale for some of the other suggestions (like Satisfactory or Rimworld) and THEN in 6 months I'll be playing the FREE version of....

Path of Exile 2

Again, I'm very thankful for the responses.  You guys rock!",MonkeySpittle,1h3haec,https://reddit.com/r/gaming/comments/1h3haec/best_i_dont_need_a_life_game_during_steams_autumn/,https://www.reddit.com/r/gaming/comments/1h3haec/best_i_dont_need_a_life_game_during_steams_autumn/,2024-11-30 17:14:56,2171,0.95,2171,0,684,0,0,False,False,True,False,False,,self,t3_1h3haec
gaming,What non-boss/regular enemies have the best MECHANICS?,"Inspired by this post (https://www.reddit.com/r/gaming/s/xgimO2Gq7x ) but most of the answers were about visual design and not mechanics, while the OP’s question and description allowed for both answers. 

I’m asking about best non-boss mechanics. ",0000000000000007,1h51jm6,https://reddit.com/r/gaming/comments/1h51jm6/what_nonbossregular_enemies_have_the_best/,https://www.reddit.com/r/gaming/comments/1h51jm6/what_nonbossregular_enemies_have_the_best/,2024-12-02 18:14:14,0,0.35,0,0,12,0,0,False,False,True,False,False,,self,t3_1h51jm6
gaming,S.T.A.L.K.E.R. 2 has scary sound design,I was just walking trying to find Artifacts when this event happened. I was scared for my life!,Lost_Knight12,1h4zagw,https://reddit.com/r/gaming/comments/1h4zagw/stalker_2_has_scary_sound_design/,https://youtu.be/rrJrbdRuGRI?feature=shared,2024-12-02 16:43:00,0,0.41,0,0,5,0,0,False,False,False,False,True,,spoiler,t3_1h4zagw
gaming,Building a steam library ,"As someone who is new to pc gaming and steam, i have an empty library and i want to build a pretty nice one with memorable games and with the autumn sale being here i wanna ask u guys for some suggestions for games to buy. Something to keep in mind is that i cant recall the last time i beat a game lol so any suggestions are fine ",Couchupz_,1h55nxe,https://reddit.com/r/gaming/comments/1h55nxe/building_a_steam_library/,https://www.reddit.com/r/gaming/comments/1h55nxe/building_a_steam_library/,2024-12-02 21:01:13,0,0.34,0,0,28,0,0,False,False,True,False,False,,self,t3_1h55nxe
gaming,Is anyone know the game Cell of empireo or familiar to games? ,"
This was an rpgmaker2003 also know as Cell divine commedia in Japanese by Sharktale Factory Im hoping someone know this game if you know. I wanna talk to you talked about the game also give information to game including the dlc! Honestly this was absolutely intriguing game I ever read through on translation if you know please replay to me!!",TieObjective8227,1h4qpna,https://reddit.com/r/gaming/comments/1h4qpna/is_anyone_know_the_game_cell_of_empireo_or/,https://www.reddit.com/r/gaming/comments/1h4qpna/is_anyone_know_the_game_cell_of_empireo_or/,2024-12-02 08:49:54,2,0.56,2,0,0,0,0,False,False,True,False,False,,self,t3_1h4qpna
gaming,Light of Motiram - Official Reveal Trailer,,abcinng,1h5adw1,https://reddit.com/r/gaming/comments/1h5adw1/light_of_motiram_official_reveal_trailer/,https://www.youtube.com/watch?v=v0Of5Xjdwbc,2024-12-03 00:23:47,0,0.2,0,0,35,0,0,False,False,False,False,False,,https://b.thumbs.redditmedia.com/3lfVInuWT4mOyo7m1yVpSw7e6tKLfPVDOb3WascdttA.jpg,t3_1h5adw1
gaming,"Seinfeld Ring: A Game About Nothing, Tarnished",,LandPirate62,1h51532,https://reddit.com/r/gaming/comments/1h51532/seinfeld_ring_a_game_about_nothing_tarnished/,https://docs.google.com/document/d/1Cbk3tSgYV8lY63zwv7hzNewvJIoXr_Z6odgNKij9MwY/edit?usp=sharing,2024-12-02 17:58:05,0,0.39,0,0,4,0,0,False,False,False,False,False,,https://b.thumbs.redditmedia.com/ZmVhmGdQP5xQ-4i5pWU8GSoNiBLMDaQ2rkzAkzpdPbw.jpg,t3_1h51532
gaming,Making Friends Monday! Share your game tags here!,"Use this post to look for new friends to game with! Share your gamer tag &amp; platform, and meet new people! 

This thread is posted weekly on Mondays (adjustments made as needed).",AutoModerator,1h4p86t,https://reddit.com/r/gaming/comments/1h4p86t/making_friends_monday_share_your_game_tags_here/,https://www.reddit.com/r/gaming/comments/1h4p86t/making_friends_monday_share_your_game_tags_here/,2024-12-02 07:00:13,0,0.5,0,0,17,0,0,False,False,True,False,False,Weekly Friends Thread,self,t3_1h4p86t
gaming,Max Payne 3 multiplayer on PC,"How many of you are still playing it?

If you haven't tried it yet, I highly recommend it, it's super fun and still being played.",Unomas1745,1h4x62l,https://reddit.com/r/gaming/comments/1h4x62l/max_payne_3_multiplayer_on_pc/,https://www.reddit.com/r/gaming/comments/1h4x62l/max_payne_3_multiplayer_on_pc/,2024-12-02 15:13:21,0,0.41,0,0,6,0,0,False,False,True,False,False,,self,t3_1h4x62l
gaming,POE2 early access on December 6. How do I tell my wife?,"Ah POE2 is set to release a few days from now. First off, my question is how do I manage my time playing and my commitment to wife’s needs for affection time and love? Next question is how do I fake my death so I can play non stop without having to explain to her that I cannot be bothered, not even if she’s having a heart attack? 

Any advice would be appreciated.",zav3rmd,1h59boo,https://reddit.com/r/gaming/comments/1h59boo/poe2_early_access_on_december_6_how_do_i_tell_my/,https://www.reddit.com/r/gaming/comments/1h59boo/poe2_early_access_on_december_6_how_do_i_tell_my/,2024-12-02 23:35:35,0,0.22,0,0,26,0,0,False,False,True,False,False,,self,t3_1h59boo
