subreddit,title,selftext,author,id,permalink,url,created_utc,score,upvote_ratio,ups,downs,num_comments,total_awards_received,gilded,is_video,is_original_content,is_self,over_18,spoiler,link_flair_text,thumbnail,name
movies,I always run out of Christmas movies before Christmas,"My wife loves to watch Christmas movies immediately starting after Thanksgiving dinner all the way through Christmas, and I always run out of Christmas movies before Christmas. What are some movies that are not “Christmas movies” but take place during Christmas at least in some point in the movie? Like Red or Die Hard 1 &amp; 2- does not need to be a Bruce Willis movie ",JonnyElbows,1h6t6dv,https://reddit.com/r/movies/comments/1h6t6dv/i_always_run_out_of_christmas_movies_before/,https://www.reddit.com/r/movies/comments/1h6t6dv/i_always_run_out_of_christmas_movies_before/,2024-12-04 22:27:39,0,0.36,0,0,39,0,0,False,False,True,False,False,Discussion,self,t3_1h6t6dv
movies,Santa Claus the Movie.  Actually a Creepy Movie,"When i was a kid.  One of my favorite Christmas Movies was Santa Claus : The Movie.    It is on the MGM+ this month and i watched it the other day which was the first time in a while .  I didn't think of this when i was a kid, but now as an adult.  It is a creepy movie.   

Here are my reasons

Santa and Mrs Claus and 2 of the reindeer are Undead because they froze to death at the beginning of the movie.

Santa and Mrs Claus are kidnappers because they allow the kids to stay at the north pole for at least a year at the end of the movie.    The homeless boy might not be missed, but I am sure there would be quite a bunch of missing posters and milk cartons looking for the redhead girl.   The lady who she lived with and I am sure her parents would be looking for her.   Rich girl gone missing for a year.  How would she explain that?

  
John Lithgow's character floating away into an agonizing death in space.  His only crime was that he wanted to take over Christmas.   

Such an evil movie",i_love_food_1974,1h6rurl,https://reddit.com/r/movies/comments/1h6rurl/santa_claus_the_movie_actually_a_creepy_movie/,https://www.reddit.com/r/movies/comments/1h6rurl/santa_claus_the_movie_actually_a_creepy_movie/,2024-12-04 21:33:31,0,0.38,0,0,15,0,0,False,False,True,False,False,Spoilers,self,t3_1h6rurl
movies,"A scene in Good Burger( 1997), is that a reference to the movie 12 Monkey( 1995)?","In Good burger Dexter and Ed were thrown into the asylum and Ed met sociopath. She talk about breaking into the zoo and freeing the kangaroo. 

Now in the movie 12 Monkey, James was thrown in a asylum where he met Jeffrey who is crazy and talk non sense. 

In Good burger, the Mondo burger owner and his 2 goon break into Good burger, they were wearing black uniform. They also met the old man. 

In 12 monkey, Jeffrey was the leader of the 12 monkey and they break into the zoo to free the animals and there were wearing black uniform. ",mango10977,1h6qd1s,https://reddit.com/r/movies/comments/1h6qd1s/a_scene_in_good_burger_1997_is_that_a_reference/,https://www.reddit.com/r/movies/comments/1h6qd1s/a_scene_in_good_burger_1997_is_that_a_reference/,2024-12-04 20:32:31,0,0.33,0,0,2,0,0,False,False,True,False,True,Discussion,spoiler,t3_1h6qd1s
movies,The Truman Show - First Time ReWatch,"Where they pushing Truman into having a kid?



Would his kid have become the next Truman when Truman himself eventually passes away or gets killed off?



Did ""they"" intentionally traumatize Truman into being afraid of the water to prevent him from getting to the edge of the dome?



In the bus, that in show extra must have been stressed! 🤣 ""I don't know how to drive a bus!""



Did the audience know he couldn't leave?  



Is it a borderline dystopian world?



The ""Love him Protect him"" t-shirt. Wtf...



It's played for laughs but golly people really freaked out when the show was ""experiencing technical difficulties"".



In case i don't see ya,

Good afternoon

Good evening

And good night!

... yeah.",JoshuaTheDude,1h6q33l,https://reddit.com/r/movies/comments/1h6q33l/the_truman_show_first_time_rewatch/,https://www.reddit.com/r/movies/comments/1h6q33l/the_truman_show_first_time_rewatch/,2024-12-04 20:21:01,0,0.29,0,0,3,0,0,False,False,True,False,False,Discussion,self,t3_1h6q33l
movies,How is the hdr orignal jurasic park trilogy and both blade master movies?,"How is the hdr original Jurassic park trilogy and both blade master movies? i plan on watching them soon and i have an lg c1 48 inch in if it matters

and can you recommend any other good hdr movies to watch? i was planning to also watch the latest batman movies and both dune movies via max soon

also any good hdr anime? kinda like how cyberpunk edgerunners was hdr?

please and thanks",zeek988,1h765xe,https://reddit.com/r/movies/comments/1h765xe/how_is_the_hdr_orignal_jurasic_park_trilogy_and/,https://www.reddit.com/r/movies/comments/1h765xe/how_is_the_hdr_orignal_jurasic_park_trilogy_and/,2024-12-05 10:26:28,0,0.27,0,0,2,0,0,False,False,True,False,False,Question,self,t3_1h765xe
movies,"Today is the  22 years, 9 months, and 19 day anniversary of the movie John Q","In John Q, John Archibald (Denzel Washington) is a factory worker whose son collapses from a heart condition requiring a transplant. Denied coverage by his health insurance and unable to afford the procedure, John becomes desperate. In a bold act, he takes the hospital’s emergency room hostage, demanding his son be placed on the transplant list. As tensions escalate, his actions spark a nationwide debate about healthcare inequities. John’s unwavering love for his son drives his moral conflict. The film ends with profound questions about heroic sacrifice and systemic reform.",KimberlyWexlersFoot,1h70iat,https://reddit.com/r/movies/comments/1h70iat/today_is_the_22_years_9_months_and_19_day/,https://www.reddit.com/r/movies/comments/1h70iat/today_is_the_22_years_9_months_and_19_day/,2024-12-05 04:10:58,0,0.43,0,0,12,0,0,False,False,True,False,False,Discussion,self,t3_1h70iat
movies,"Why do they arrest Dylan in Now You See Me 2, Just Because ""Some Voice"" Says So...?","I just watched the sequel today after watching the original years ago, and one thing is sounding so childish/stupid, that I just can't shake it off...

So the horsemen yeet themselves during the show, and the ""voice"" that sabotaged their show, says, *""Here's the fifth horseman, Dylan Rhodes...""*

And the FBI is like, *""Yep, arrest him, the voice says so...""*

I mean... wutt?? That's like the stupidest sheet in what is otherwise a decent movie...

",powrnutrition,1h75stu,https://reddit.com/r/movies/comments/1h75stu/why_do_they_arrest_dylan_in_now_you_see_me_2_just/,https://www.reddit.com/r/movies/comments/1h75stu/why_do_they_arrest_dylan_in_now_you_see_me_2_just/,2024-12-05 10:00:15,0,0.29,0,0,6,0,0,False,False,True,False,False,Discussion,self,t3_1h75stu
movies,When all their roles can't fit onto one wiki page so you are linked to another page dedicated to just their roles. Who does this make you think of?,"As an example, you are on Wikipedia checking out an actor and scroll down to their filmography to see what they have acted  in, most actors will have them in this  chapter of the page but lots of them also have a link to a separate page dedicated to just their entire filmography, who do you think off when you hear this?",lifeandtimes89,1h75mpt,https://reddit.com/r/movies/comments/1h75mpt/when_all_their_roles_cant_fit_onto_one_wiki_page/,https://www.reddit.com/r/movies/comments/1h75mpt/when_all_their_roles_cant_fit_onto_one_wiki_page/,2024-12-05 09:47:18,0,0.14,0,0,9,0,0,False,False,True,False,False,Discussion,self,t3_1h75mpt
movies,The Departed and Captain Queenan,"Now I know that The Departed is designed as a wildly entertaining movie that operates under movie logic. And I love it, as it is. 

But the thing that I can't come to terms with, and tears me out of the movie logic, is Captain Queenan. In the context of the movie, I just don't know what to make of him.

Here's a world where everyone is double crossing everyone, where every organization is more corrupt than the next, everyone has their own motives and is playing their own game.

And then we've got Queenan, who seems to be this pure and virtuous man, uncorrupted by his environment. And yet he's risen to a high rank in a corrupt organization! And he's supposed to be this mastermind that runs undercover operations. It is impossible for someone in that position to be as naive and innocent as Queenan is portrayed to be.

Every other character in the movie has motives for their actions, and they act accordingly. Queenan just doesn't fit, as I see it.

What am I missing?",the_uberdork,1h71noe,https://reddit.com/r/movies/comments/1h71noe/the_departed_and_captain_queenan/,https://www.reddit.com/r/movies/comments/1h71noe/the_departed_and_captain_queenan/,2024-12-05 05:13:19,0,0.41,0,0,46,0,0,False,False,True,False,False,Discussion,self,t3_1h71noe
movies,Is Smile 2 a bad movie for us to watch right now?,"Hi, I hope this is an appropriate place to ask this sort of question. 

My husband and I are currently in the middle of a miscarriage. We are devastated but getting through it together. Husband took some time off work and we mostly like watching movies to distract us. 

Unfortunately, there's been a few movies that have some content that have been a little grim to watch, like we watched the new beetlejuice movie and there was a scene with a an evil baby popping out and attacking someone. We got through it but want to avoid that type of thing moving forward. 

We love comedy and the occasional thriller. We were thinking of watching the Smile 2 but I wanted to see if anyone here knew if there's any content in it that would be hard for us to watch rn. We understand it's a horror movie and expect that, but particularly if there's any baby type scenes we want to know.

Also, any movie suggestions are warmly welcome. Thank you!!",Imyourdaddynow311,1h6of7g,https://reddit.com/r/movies/comments/1h6of7g/is_smile_2_a_bad_movie_for_us_to_watch_right_now/,https://www.reddit.com/r/movies/comments/1h6of7g/is_smile_2_a_bad_movie_for_us_to_watch_right_now/,2024-12-04 19:14:02,0,0.41,0,0,15,0,0,False,False,True,False,False,Discussion,self,t3_1h6of7g
movies,Has high budget television killed movies?,"I used to watch lots of movies, they were my thing. I still have a massive collection of DVDs that I used to watch multiple times. These days I'll be lucky to watch 2 or 3 movies a month, and I think the reason is because TV got better. 

It's not that I think that most TV is as good as movies, but It just takes up my viewing time a lot more than movies do now. I feel like there are so many shows that I need to start and ones that I started and need to finish, it's almost a job to get through them. 

TV used to be crappy shows and half funny sitcoms that you'd watch for a bit and then decide it was time for something decent, so you'd watch a film. Now the shows are a lot better, but they often aren't still as good as a film, but they suck you in. You get caught up in a sunken cost fallacy, you've stopped enjoying the show, but after 4 seasons you feel like it would all have been wasted if you don't keep going. 

I'm going to try and get back into watching and re-watching more films in the future, I wonder how many feel they are in the same boat as I am?",dedokta,1h6jvrp,https://reddit.com/r/movies/comments/1h6jvrp/has_high_budget_television_killed_movies/,https://www.reddit.com/r/movies/comments/1h6jvrp/has_high_budget_television_killed_movies/,2024-12-04 16:15:17,0,0.44,0,0,61,0,0,False,False,True,False,False,Discussion,self,t3_1h6jvrp
movies,An Elephant Sitting Still by Hu Bo triggers?,"Hello guys!! So me and my friends are going to do a christmas watchlist, and I thought about An Elephant Sitting Still by Hu Bo as it seems to be a masterpiece, and I've been planning to watch it for a long time now. 
I know it's emotionally loaded, but I wanted to know if there's triggers in the movie (such as suicide and things like that?) It seems like there is but is it the kind of movie that leaves you suicidally depressed by the end? I've avoided reading critics about it as I wanted to have a spontaneous experience. Thank you!",Imaginary-Tea-1150,1h6iio9,https://reddit.com/r/movies/comments/1h6iio9/an_elephant_sitting_still_by_hu_bo_triggers/,https://www.reddit.com/r/movies/comments/1h6iio9/an_elephant_sitting_still_by_hu_bo_triggers/,2024-12-04 15:20:05,0,0.21,0,0,4,0,0,False,False,True,False,False,Question,self,t3_1h6iio9
movies,The success of Moana 2 is nothing to be celebrated – there is a real crisis in animation,,crome66,1h70lcx,https://reddit.com/r/movies/comments/1h70lcx/the_success_of_moana_2_is_nothing_to_be/,https://www.msn.com/en-us/movies/news/the-success-of-moana-2-is-nothing-to-be-celebrated-there-is-a-real-crisis-in-animation/ar-AA1vassT,2024-12-05 04:15:33,0,0.43,0,0,21,0,0,False,False,False,False,False,Article,default,t3_1h70lcx
movies,1st time at the movies in 7 years. Exit signs are so bright.,"I enjoy watching movies immensely, and have many dvds at home. My movie experience at home has no random lights around the screen, and I love it. I’ve been feeling guilty that im not supporting movie theatre anymore, so I decided to try it out again…

There were bright, BRIGHT green exit signs on both sides of the theatre. I just… deflated. I dont know what the draw of a movie theatre is anymore. I wanted to leave and just wait to watch it at home. I stayed, but I think its my last theatre experience ever, and I’m sad. I dont remember signs being so bright and obnoxious",Admiral-Kar,1h72ma1,https://reddit.com/r/movies/comments/1h72ma1/1st_time_at_the_movies_in_7_years_exit_signs_are/,https://www.reddit.com/r/movies/comments/1h72ma1/1st_time_at_the_movies_in_7_years_exit_signs_are/,2024-12-05 06:10:42,0,0.37,0,0,14,0,0,False,False,True,False,False,Discussion,self,t3_1h72ma1
movies,"If Hollywood made a re-make of The Bodyguard, who would they cast as the leads? ","The film was one of the highest grossing films of all time upon it's release, netting what is equal to $800 million today with the brunt of the success coming from international audiences. It also spawned the highest grossing soundtrack of all time. What pairing(Pop Star - Popular Leading Man) could recreate that today?

Bradley Cooper - Taylor Swift

Michael Fassbender - Taylor Swift

Tom Hardy - Ariana Grande

Timothee Chalamet - Ariana Grande

Tom Holland - Ariana Grande

Alexander Skarsgård - Rihanna ",Aggressive-Bowl5196,1h6r1y2,https://reddit.com/r/movies/comments/1h6r1y2/if_hollywood_made_a_remake_of_the_bodyguard_who/,https://www.reddit.com/r/movies/comments/1h6r1y2/if_hollywood_made_a_remake_of_the_bodyguard_who/,2024-12-04 21:00:47,0,0.11,0,0,29,0,0,False,False,True,False,False,Discussion,self,t3_1h6r1y2
movies,Christmas movies are no longer as good as they were before,"Am I the only one who feels like Christmas movies have lost their magic? Remember the classics? *Home Alone* \- heartwarming story and genuine humor. Now it's just...reboots, sequels, and predictable rom-coms. They all follow the same formula: forced meet-cutes, unrealistic expectations, and a guaranteed happy ending. Give me a good old-fashioned Christmas movie with real stakes and a bit of heart! A movie that will have me on the edge of my seat not *Operation Mistletoe* or *The Christmas Quest.*",ImTheInternetC,1h6uk8m,https://reddit.com/r/movies/comments/1h6uk8m/christmas_movies_are_no_longer_as_good_as_they/,https://www.reddit.com/r/movies/comments/1h6uk8m/christmas_movies_are_no_longer_as_good_as_they/,2024-12-04 23:27:19,0,0.33,0,0,55,0,0,False,False,True,False,False,Discussion,self,t3_1h6uk8m
movies,Were movie sets in the past all toxic?,"So recently I watched The Wizard of Oz and I absolutely loved the movie; so, as we do, I went to research about the movie. And I stumbled upon various articles, youtube videos and reddit posts about how horrible every actor/actress were treated on set. The terrible techniques they used such as the asbestos for snow and how badly Judy Garland was over worker, drugged and essentially had no say on anything that was done to her due to lack of laws at the time. 

Now, I am sure most reading this have an idea of what I am talking about, but my question is, did other old Hollywood movies have these conditions? Was this something common at the time for movie set producers to treat their workers like this? And do things like these happen today in movie sets? 

I don't want to come across as ignorant just genuinely curious, since if at the time I knew about things of the nature happening during filming and I wanted to pursue a career in the area I might've changed my mind.",Kale-Objective,1h6npiy,https://reddit.com/r/movies/comments/1h6npiy/were_movie_sets_in_the_past_all_toxic/,https://www.reddit.com/r/movies/comments/1h6npiy/were_movie_sets_in_the_past_all_toxic/,2024-12-04 18:46:14,0,0.26,0,0,38,0,0,False,False,True,False,False,Question,self,t3_1h6npiy
movies,"‘Wicked’s Ariana Grande Set For Palm Springs Film Festival’s Rising Star Award
",,Puzzled-Tap8042,1h6nund,https://reddit.com/r/movies/comments/1h6nund/wickeds_ariana_grande_set_for_palm_springs_film/,https://deadline.com/2024/12/wicked-ariana-grande-palm-springs-film-festival-award-1236193105/,2024-12-04 18:51:58,0,0.35,0,0,17,0,0,False,False,False,False,False,News,https://b.thumbs.redditmedia.com/Ck-IADpmZo8I-ThBruLyF9DvpseBM0SZdjA30h3H3qU.jpg,t3_1h6nund
movies,A small defense of Live Action Remakes,"So everytime a trailer or poster for a new live action film drops, there are three types of generic negative comments rehashed again and again. They're kinda irritating so I'm just gonna get them out of the way first before I make my actual case for Live Action Remakes


**""wow another cashgrab""**

Yes movies are made to make money, obviously there are passion projects but making money is the goal even for a lot of passion projects. Literally 99% of movies are cashgrabs

**""Who asked for this""**

This one is the most annoying. Nobody asked for The 1982 remake of The Thing either and it became a classic, and before you bring out the pitchforks, I'm not comparing The Thing to the shitty Lion King remake or whatever. It's just to show that something being made with zero demand isn't a fucking critique. These remakes also make a boatload of cash, so it isn't even all that accurate. Anyway this is the dumbest bottom of the barrel comment imaginable. 

**""stop ruining my childhood""**

Your childhood is still there, you can still watch them at anytime. A live action adaptation doesn't delete the existence of those films or ruin the continuity. Heck a certain amount of those classic Disney film even have shitty DVD sequels or TV shows we'd rather forget about 


OK we're done, now for my actual argument. This isn't a defense of the quality of live action remakes, they still have way more misses than hits. I personally only digged one of them which is the Jungle Book. However, this negative attitude where people believe **it shouldn't be made** is what I'm vehemently against. Movies SHOULD be made, even bad ones. Stories have a right to be showcased in whatever medium imaginable 

Like take Aladin for example, it's generally believed to have originated in Arabia, through folk tales, then it became a book, then an animated movie, then a Broadway show, probably missing a few sequential steps but you get the gist of it. A live action movie is simply the next step, a new medium. Saying it shouldn't have been made is like saying it shouldn't have moved to Broadway, or even be made into an animated film.

Live action remakes are just another form of recreational storytelling, sure a lot of it has to do with making more money but it's still part of the human desire to experiment with new avenues and tools. Saying it shouldn't exist because you don't like it doesn't make sense. Do you think fan films shouldn't exist cause most of them are shit? If your answer is no then imagine Disney remakes as an expensive fan film of a fan film of a book or tale.

Like fucking get a grip. Where do you even draw the line on preserving the purity of your precious childhood gems, do paradies count? Should I drop down to my knees and start balling my eyes out when I encounter a different version of Pocahontas on pornhub",Hi_Im_zack,1h6sjuy,https://reddit.com/r/movies/comments/1h6sjuy/a_small_defense_of_live_action_remakes/,https://www.reddit.com/r/movies/comments/1h6sjuy/a_small_defense_of_live_action_remakes/,2024-12-04 22:02:03,0,0.14,0,0,13,0,0,False,False,True,False,False,Discussion,self,t3_1h6sjuy
movies,Pamela Anderson Interview: The Indie Film Goddess We've All Waited For,,indiewire,1h6mh44,https://reddit.com/r/movies/comments/1h6mh44/pamela_anderson_interview_the_indie_film_goddess/,https://www.indiewire.com/features/interviews/pamela-anderson-the-last-showgirl-interview-1235071450/,2024-12-04 17:57:08,0,0.25,0,0,1,0,0,False,False,False,False,False,Discussion,https://b.thumbs.redditmedia.com/j0H-mnPiduvfGsG_AWI19-h92YT8UVIXedvDbCPWqRY.jpg,t3_1h6mh44
