subreddit,title,selftext,author,id,permalink,url,created_utc,score,upvote_ratio,ups,downs,num_comments,total_awards_received,gilded,is_video,is_original_content,is_self,over_18,spoiler,link_flair_text,thumbnail,name
movies,What's a role that rubbed off on an actor/actress and permanently changed their personality off screen?,"For example, Kumail Nanjiani seems very different post Eternals. Someone pointed out in a different thread that Gary Sinise devoted a large part of his life to veterans after Forest Gump. Seems like some actors are changed by the experience of playing a role or potentially event the personality of the character they brought to life. ",PumpkinCarvingisFun,1h6xtok,https://reddit.com/r/movies/comments/1h6xtok/whats_a_role_that_rubbed_off_on_an_actoractress/,https://www.reddit.com/r/movies/comments/1h6xtok/whats_a_role_that_rubbed_off_on_an_actoractress/,2024-12-05 01:57:26,6374,0.93,6374,0,2466,0,0,False,False,True,False,False,Discussion,self,t3_1h6xtok
movies,Who do you think is the greatest living male actor working today under 65 years old??,"If we remove from the conversation the usual candidates for the title.

Anthony Hopkins (87 years)

Al Pacino (84 years)

Robert DeNiro (81 years)

Denzel Washington (70 years)

Willem Dafoe (69 years)

Tom Hanks (68 years)

Daniel Day-Lewis (67 years)

Gary Oldman (66 years)

Viggo Mortensen (66 years)

Who do you think is the greatest living male actor working today under 65 years old??",West_Conclusion_1239,1h6qgaw,https://reddit.com/r/movies/comments/1h6qgaw/who_do_you_think_is_the_greatest_living_male/,https://www.reddit.com/r/movies/comments/1h6qgaw/who_do_you_think_is_the_greatest_living_male/,2024-12-04 20:36:15,953,0.83,953,0,2069,0,0,False,False,True,False,False,Discussion,self,t3_1h6qgaw
movies,Jorma Taccone To Direct 'DNA' Comedy For Searchlight Pictures Starring Ben Schwartz &amp; Sam Rockwell,,MarvelsGrantMan136,1h6l2rc,https://reddit.com/r/movies/comments/1h6l2rc/jorma_taccone_to_direct_dna_comedy_for/,https://deadline.com/2024/12/jorma-taccone-to-direct-dna-comedy-searchlight-pictures-1236193945/,2024-12-04 17:02:34,559,0.92,559,0,57,0,0,False,False,False,False,False,News,https://b.thumbs.redditmedia.com/mkknzrKgc_E49nwKcts7LsgNQB4iCZGbt8ZuwS2bIYo.jpg,t3_1h6l2rc
movies,"‘Being Maria’, Starring Matt Dillon as Marlon Brando During Controversial ‘Last Tango in Paris’ Film Shoot, Secures U.S. Distribution Deal With Kino Lorber - The movie charts the turbulent life and career of the late French actress Maria Schneider (played by Anamaria Vartolomei).",,BunyipPouch,1h6su00,https://reddit.com/r/movies/comments/1h6su00/being_maria_starring_matt_dillon_as_marlon_brando/,https://variety.com/2024/film/global/matt-dillon-marlon-brando-being-maria-last-tango-in-paris-kino-lorber-1236197055/,2024-12-04 22:13:40,534,0.9,534,0,45,0,0,False,False,False,False,False,News,https://b.thumbs.redditmedia.com/SAyppternXS6zzj7YFVQgcFLCQk3OHHk_ICKDvOVJMg.jpg,t3_1h6su00
movies,Sienna Miller Joins ‘Jack Ryan’ Movie at Amazon,,KillerCroc1234567,1h6r2v4,https://reddit.com/r/movies/comments/1h6r2v4/sienna_miller_joins_jack_ryan_movie_at_amazon/,https://www.hollywoodreporter.com/movies/movie-news/sienna-miller-joins-john-krasinski-jack-ryan-movie-amazon-1236077666/,2024-12-04 21:01:46,481,0.89,481,0,86,0,0,False,False,False,False,False,News,https://b.thumbs.redditmedia.com/13iqg1qxcxqDvHuZlkbvaN9THBjh5XGHIddSj86EjXA.jpg,t3_1h6r2v4
movies,Sam Richardson Latest To Join Apple’s Live-Action ‘Matchbox’ Movie,,NoCulture3505,1h6rslg,https://reddit.com/r/movies/comments/1h6rslg/sam_richardson_latest_to_join_apples_liveaction/,https://deadline.com/2024/12/matchbox-sam-richardson-latest-join-apple-movie-1236194344/,2024-12-04 21:31:02,441,0.88,441,0,76,0,0,False,False,False,False,False,News,https://b.thumbs.redditmedia.com/1WGfqV_NAkUx4ftXwtqHP7aHAXeYyJ5MMh7dTPzeQ-M.jpg,t3_1h6rslg
movies,"What particularly violent scene from an already violent movie really messed you up, or stuck with you over the years?","Every now and then people talk about gnarly scenes that kind of come out of nowhere (like that one near the end of Bone Tomahawk) but what about scenes from movies that are already violent, but stand out anyway? For example, there's a brief bit in the Michael Bay movie 13 Hours where three dudes in a street get absolutely dismantled by a machine gun firing from the back of a pickup truck. It's quick, only about one second, but it stuck with me for a long time after watching the movie. Something about seeing those guys just fall apart has never really left my mind, even though the whole movie is pretty violent and has plenty of other gut-wrenching scenes. Another one that seems to be permanently implanted in my mind is in Saving Private Ryan, when they are storming the beach and a guy gets his entire face blown away. All that's left is a concave hole. Even in a movie as violent as SPR, that one brief bit has always stuck with me.


I mean, I've seen lots of violent movies (including all the Saw films) but somehow there's scenes like this that really hit hard and I'm not sure why. Wondering if anyone else has anything similar.",misterdhm,1h6yxzc,https://reddit.com/r/movies/comments/1h6yxzc/what_particularly_violent_scene_from_an_already/,https://www.reddit.com/r/movies/comments/1h6yxzc/what_particularly_violent_scene_from_an_already/,2024-12-05 02:51:54,456,0.86,456,0,1268,0,0,False,False,True,False,False,Discussion,self,t3_1h6yxzc
movies,"Hi /r/movies! I am Kyle Mooney, co-writer/director of Y2K, the new A24 movie in theaters Dec 6! Ask me anything!",,Y2K-AMA,1h79rz4,https://reddit.com/r/movies/comments/1h79rz4/hi_rmovies_i_am_kyle_mooney_cowriterdirector_of/,https://i.redd.it/42zmwq9ad15e1.png,2024-12-05 13:59:11,508,0.91,508,0,258,0,0,False,False,False,False,False,AMA,https://b.thumbs.redditmedia.com/bcrm4KG9QJ_TdagSxyExOHdENnrGR3saz0X4iNEmS9I.jpg,t3_1h79rz4
movies,Gangs of New York revisted,"I watched Gangs of New York tonight. I hadn’t seen this movie since it first came out in the theater 20+ years ago. Aside from a few stunning visual images, I didn’t remember anything about it.

Holy hell, is this movie riveting. It really strikes me as a spiritual counterpart to the Departed. The tension the story builds about an imposter or infiltrator trying not to be discovered keeps you glued to the screen.

Leonardo DiCaprio seems to thrive in that role - the infiltrator. Theres something about the  intensity of his eyes and face while taking orders - he listens intently while his body seems to be aching to lunge forward and attack.

Daniel Day Lewis of course is Daniel Day Lewis. Bill the Butcher is one of the great bad guys in cinema. He portrays that character so well that he humanizes the nativist backlash and gives us tremendous empathy. But we also agree he needs to die.

We’ve all heard stories about DDL being very method, getting himself in a character and refusing to break it on set or during the duration of filming, often treating costars and crew members badly in the process. I normally think this kind of process is a bit excessive, but Bill the Butcher makes me think that sometimes, the ends justify the means and that a piece of art so enduring may warrant some temporary suffering.

One of his killings (and you’ll know it when you see it) gave me one of most audible gasps that I’ve ever had watching something. Maybe season 2 episode 1 of House of Cards came close).

The production design is incredible. As a history lover, seeing a pre-automobile major city brought to life is magical. I wish I could step into it and walk among the filthy streets.

If you have never seen this film, or, like me - haven’t seen it in years. Check it out. I’m interested i hearing what others think.",DryTown,1h70ke1,https://reddit.com/r/movies/comments/1h70ke1/gangs_of_new_york_revisted/,https://www.reddit.com/r/movies/comments/1h70ke1/gangs_of_new_york_revisted/,2024-12-05 04:14:09,199,0.82,199,0,148,0,0,False,False,True,False,False,Discussion,self,t3_1h70ke1
movies,What recent movies will be seen as must-watch classics 20-30 years from now?,"Are there any movies from say…the last 10-15 years that have come out that you guys think will be considered must-watch classics 20ish years from now? Do you think that they’ll have the same rewatch-ability/lasting impact like movies in the past?

I’m thinking of movies like Godfather, Titanic, Jurassic Park, Breakfast Club, Wizard of Oz, The Shining, etc etc. Movies that my parents would consider the best of the best of their generation. And most have had a lasting impact in cinema and stood the test of time. 

We’ve had a lot of big titles that made a lot of money, but it has me wondering what will stay relevant years from now, movies that we show our kids and future generations will still love. ",AvatarDang,1h6py76,https://reddit.com/r/movies/comments/1h6py76/what_recent_movies_will_be_seen_as_mustwatch/,https://www.reddit.com/r/movies/comments/1h6py76/what_recent_movies_will_be_seen_as_mustwatch/,2024-12-04 20:15:35,182,0.76,182,0,604,0,0,False,False,True,False,False,Discussion,self,t3_1h6py76
movies,Hugh Grant &amp; Nicholas Hoult Reunite 21 Years After 'About a Boy' | Vanity Fair,,outremer_empire,1h74fpu,https://reddit.com/r/movies/comments/1h74fpu/hugh_grant_nicholas_hoult_reunite_21_years_after/,https://youtu.be/3a6x6C0kNrM?si=2ppImlo9RHRPF6At,2024-12-05 08:16:51,202,0.88,202,0,29,0,0,False,False,False,False,False,Media,https://b.thumbs.redditmedia.com/aOfZapG3gcyVb-DyUD9kBq9EJ3lv7HagsAnaEu06mgs.jpg,t3_1h74fpu
movies,Which Jeff Bridges movies are your favorites?,"In honor of Jeff Bridges' 75th birthday today, I'm just curious to hear some of your personal favorite movies he has starred in. 

He's done quite a lot over the *many* decades he's been in the movies. True Grit, Starman, Iron Man, Tron and Tron Legacy, Crazy Heart, The Big Lebowski, and so many more beyond just those listed here.

If I had to pick one personally, I really enjoyed his work in Tron: Legacy. He was no doubt iconic in The Big Lebowski of course, but I think his role as an older Kevin Flynn in Tron Legacy is something I always look forward to every single time I go and rewatch the movie.

What about all of you? What are some of your favorite Jeff Bridges movies?",Jamey4,1h6n4n9,https://reddit.com/r/movies/comments/1h6n4n9/which_jeff_bridges_movies_are_your_favorites/,https://www.reddit.com/r/movies/comments/1h6n4n9/which_jeff_bridges_movies_are_your_favorites/,2024-12-04 18:22:55,149,0.85,149,0,343,0,0,False,False,True,False,False,Discussion,self,t3_1h6n4n9
movies,Amy Adams Talks 'Nightbitch' and Exploring Her Edge,,indiewire,1h6r6ru,https://reddit.com/r/movies/comments/1h6r6ru/amy_adams_talks_nightbitch_and_exploring_her_edge/,https://www.indiewire.com/awards/consider-this/amy-adams-nightbitch-interview-1235072049/,2024-12-04 21:06:06,153,0.79,153,0,30,0,0,False,False,False,False,False,Discussion,https://b.thumbs.redditmedia.com/q00W9zkqaJNqUiaUZrvpTgXHZqjzn6BSBejdSVtSvhs.jpg,t3_1h6r6ru
movies,Which Robin Williams movies are your favourites?,"In remembrance of Robin Williams, who departed from us 10 years ago, I’m interested to know which of his films are some of your personal favorites.   
  
He had accomplished a great deal, including Jack, RV, Mrs. Doubtfire, Jumanji, Popeyes, Good Morning Vietnam and many more aside from those mentioned here.   
  
If I had to choose one for myself, I truly appreciated his performance in Mrs. Doubtfire. There is no question he was legendary in that film. This is something I would watch again and again.   
  
What about the rest of you? Which Robin Williams films do you enjoy the most?",Plenty-Spell-3404,1h6qeej,https://reddit.com/r/movies/comments/1h6qeej/which_robin_williams_movies_are_your_favourites/,https://www.reddit.com/r/movies/comments/1h6qeej/which_robin_williams_movies_are_your_favourites/,2024-12-04 20:34:06,132,0.78,132,0,374,0,0,False,False,True,False,False,Question,self,t3_1h6qeej
movies,Dark comedy ‘A Different Man’ surprisingly triumphs at Gotham Awards,,swellfella,1h70ikk,https://reddit.com/r/movies/comments/1h70ikk/dark_comedy_a_different_man_surprisingly_triumphs/,https://apnews.com/article/gotham-awards-192c45c2dd976596f2224cebaec65bfd,2024-12-05 04:11:22,90,0.85,90,0,11,0,0,False,False,False,False,False,News,https://b.thumbs.redditmedia.com/4htblTP1Ay0DkXmCFbxchmvoSQakMfLOCbW6hNTqPqo.jpg,t3_1h70ikk
movies,Can someone please give the vocabulary to express something that I've been observing in movies?,"Hello! I'm gonna try to make this quick and express myself as clearly as possible. How come some movies (those that rely a lot on CGI and built sets) look gorgeous while others look horrendous, but it's not necessarily a case of the bad ones looking that unrealistic?

For example: Dune (both parts), Poor Things, the Lord Of The Rings trilogy, MCU pre-Age Of Ultron, etc, all fill me with a sense of wonder and awe, like I could actually go to those worlds and walk around there, while Disney's live-action remakes, Wicked (2024), Wonka (2023), MCU post-Age of Ultron, etc, all look plastic-y and border on uncanny valley. It's like they're rendered too colorful and too dull at the same time, making them lack life or something.

What is that? Does anyone else get that feel? What are the words to describe this distinction? Because every time I talk about it I don't get the sense that people actually see what I mean, since I'm not solely talking about the cinematography, I don't think, it's more of a *feeling* of emptiness and fakeness.

Edit: obviously ""give *me* the vocabulary,"" I typed out the title too fast",goldentrunk,1h6zkgj,https://reddit.com/r/movies/comments/1h6zkgj/can_someone_please_give_the_vocabulary_to_express/,https://www.reddit.com/r/movies/comments/1h6zkgj/can_someone_please_give_the_vocabulary_to_express/,2024-12-05 03:22:21,75,0.8,75,0,67,0,0,False,False,True,False,False,Question,self,t3_1h6zkgj
movies,1993 was peak Spielberg. Has there been another year like it for anyone else?,"Hi all,

Just a random daydream earlier about how amazing 1993 was with both Jurassic Park and Schindler's List being directly by the same guy. Spielberg managed to drop two bangers in one year. I'm curious if anyone has examples of anyone else achieving something similar in another year. The best I can come up with would be Michael Crichton having a #1 book, movie, and tv show at the same time. Funny enough, it still involves Jurassic Park... but the book was written years earlier and the movie wasn't his direct product. Pretty everyone else I can think of at that level goes years between releases, even if most of them are solid hits (such as Cameron, Scorsese, Tarantino).

Thoughts?",ichuck1984,1h6nplm,https://reddit.com/r/movies/comments/1h6nplm/1993_was_peak_spielberg_has_there_been_another/,https://www.reddit.com/r/movies/comments/1h6nplm/1993_was_peak_spielberg_has_there_been_another/,2024-12-04 18:46:18,75,0.68,75,0,159,0,0,False,False,True,False,False,Discussion,self,t3_1h6nplm
movies,Not really a movie recommendation but a family movie night recommendation. ,"We have a teenage daughter and my wife and I love movies.we’ve seen countless and have have shown our daughter many, we have a family movie night, where we go to spin the wheel.com and each of us pick a movie for movie night, we spin the wheel, then watch whatever it lands on. Normally have conversation afterwards and rate the movie, the following week, the previous week’s winner sits out of the spin and it’s only 2 choices, the 3rd gets their pick on the 3rd week. It’s been great and it’s something we look forward to, my 13 year old has had some interesting choices. Anywho, just a suggestion to all the families of movie lovers.",Shirowoh,1h6nb9q,https://reddit.com/r/movies/comments/1h6nb9q/not_really_a_movie_recommendation_but_a_family/,https://www.reddit.com/r/movies/comments/1h6nb9q/not_really_a_movie_recommendation_but_a_family/,2024-12-04 18:30:18,51,0.77,51,0,48,0,0,False,False,True,False,False,Recommendation,self,t3_1h6nb9q
movies,El Topo (1970),,VOIDPCB,1h76wdv,https://reddit.com/r/movies/comments/1h76wdv/el_topo_1970/,https://www.youtube.com/watch?v=xjTlNTbv-xs,2024-12-05 11:17:38,49,0.79,49,0,14,0,0,False,False,False,False,False,Trailer,https://b.thumbs.redditmedia.com/tjo6q95xYOOHnM1aP1ezazw8b6BXji_6A_D6EMNYuIM.jpg,t3_1h76wdv
movies,Independent Spirit Award Nominations 2024: See the Full List,,indiewire,1h6iepo,https://reddit.com/r/movies/comments/1h6iepo/independent_spirit_award_nominations_2024_see_the/,https://www.indiewire.com/awards/results/independent-spirit-award-nominations-2024-see-full-list-1235072334/,2024-12-04 15:15:31,28,0.71,28,0,9,0,0,False,False,False,False,False,News,https://b.thumbs.redditmedia.com/KB-ZumMnHMymdy3cNMHOQ0Wpi7xKhNRu0twDlKfcH9Q.jpg,t3_1h6iepo
movies,Are so many iconic film moments really “improvised”? Or is it just marketing?,"Okay, so I just saw a video where it's revealed that Elpheba's tear in the ballroom scene from Wicked was improvised. But this got me thinking, I so often see interviews for films where it's revealed that x actor improvised x scene in x film. One popular example is Barry Keogan improvising the sevens when his character strips down and has sex with the ground in Saltburn.

So I guess my question is, do you think these scenes are actually improvised? Especially with how film making works (setting up shots etc) or do you think it's just a lie to market the movie as well as the actor? It just seems to happen a lot.",Cool-Cover2327,1h6ofoy,https://reddit.com/r/movies/comments/1h6ofoy/are_so_many_iconic_film_moments_really_improvised/,https://www.reddit.com/r/movies/comments/1h6ofoy/are_so_many_iconic_film_moments_really_improvised/,2024-12-04 19:14:34,26,0.59,26,0,41,0,0,False,False,True,False,False,Discussion,self,t3_1h6ofoy
movies,Keke Palmer &amp; SZA’s ‘One Of Them Days’ Shifts To MLK Weekend Debut,,NoCulture3505,1h6o4he,https://reddit.com/r/movies/comments/1h6o4he/keke_palmer_szas_one_of_them_days_shifts_to_mlk/,https://deadline.com/2024/12/keke-palmer-sza-one-of-them-days-new-release-date-1236194174/,2024-12-04 19:02:37,22,0.63,22,0,1,0,0,False,False,False,False,False,News,https://a.thumbs.redditmedia.com/jUAkCNQLHpvZ-9WSwTUCdHbKkmM8df0-f0BwSxFoeQ4.jpg,t3_1h6o4he
movies,What scene in a movie was the most emotional for you purely because of the score or song choice?,"Like the scene wasn't very emotional for you, and then the score kicked in and had you running for the tissues? For a recent one for me, the ending scene of Deadpool and Wolverine wasn't super emotional for me, still sad and all but not sob-worthy, until the choir version of Like a Prayer kicked in. Or the music during the ending of Inception. And the score all throughout Oppenheimer really elevated the emotions for me, making some scenes super moving that wouldn't have been without the score.",Desperate_Voice_7974,1h6tfck,https://reddit.com/r/movies/comments/1h6tfck/what_scene_in_a_movie_was_the_most_emotional_for/,https://www.reddit.com/r/movies/comments/1h6tfck/what_scene_in_a_movie_was_the_most_emotional_for/,2024-12-04 22:37:29,14,0.69,14,0,71,0,0,False,False,True,False,False,Discussion,self,t3_1h6tfck
movies,Favorite movie by european country: Slovakia,"Hello there!

A bit more than 24 hours ago, I've asked you for your most favorite movie set in Serbia, and to be honest, as an outsider, I'm absolutely surprised. Not so much about the fact, that *A Serbian Film* didn't win (okay, a little bit about that too), but more about how much hate it got especially by - as it seems to me - the Serbs themselves. As a result, instead of this very unappetizing film, ***Balkanski špijun*** (engl.: *Balkan Spy*) has now won the contest.

But no sooner has a new movie earned its place on [our official letterboxd list](https://letterboxd.com/lalunallena/list/reddits-favourite-movie-by-european-country/share/N58XneSCnjHwwiJw/detail/) than we move on to the next country. Now it's all about **Slovakia** and as the 41 times before, there are only two rules to have in regard in this game:

* It's about where the movie is set plot-wise and not about where the movie was filmed. In case of historical movies, it's important that the bigger part of the movie takes place in a geogprahical territory, that is part of the given country today. Sometimes, especially when it's really hard to find any movie, it is also fine if only a certain part of the film is set in the respective country - but it has to be a large part.
* Winner movie is the movie with the most upvotes (minus the given downvotes) after 24 hours. Therefore, it's important that you only mention one movie per comment and that you check up if your movie was mentioned in an earlier comment before you suggest it.

I'm really looking forward to your film suggestions!

&gt;Day 41: Serbia - Balkanski špijun (engl.: Balkan Spy)

&gt;Day 40: San Marino - Lo Sconosciuto di San Marino (engl.: Unknown Men of San Marino)

&gt;Day 39: Russia - Сталкер (engl.: Stalker)

&gt;Day 38: Romania - 4 luni, 3 săptămâni și 2 zile (engl.: 4 Months, 3 Weeks and 2 Days)

&gt;Day 37: Portugal - Capitão Falcão (engl.: The Portuguese Falcon)

&gt;Day 36: Poland - Krótki film o zabijaniu (engl.: A Short Film About Killing)

&gt;Day 35: Norway - Flåklypa Grand Prix (engl.: Pinchcliffe Grand Prix)

&gt;Day 34: North Macedonia - Нема да бидеш сама (engl.: You Won’t Be Alone)

&gt;Day 33: Netherlands - Zwartboek (engl.: Black Book)

&gt;Day 32: Montenegro - Igla Ispod Praga (engl.: The Black Pin)

&gt;Day 31: Monaco - La fille de Monaco (engl.: The Girl from Monaco)

&gt;Day 30: Moldova - Carbon

&gt;Day 29: Malta - Luzzu

&gt;Day 28: Luxembourg - Läif a Séil (engl.: The Last Ashes)

&gt;Day 27: Lithuania -Vaikai iš Amerikos viešbučio (engl.: The Children from the Hotel America)

&gt;Day 26: Liechtenstein - Kinder der Berge

&gt;Day 25: Latvia - Kriminālās ekselences fonds (engl.: The Foundation of Criminal Excellence)

&gt;Day 24: Kosovo - Zgjoi (engl.: Hive)

&gt;Day 23: Italy - Nuovo Cinema Paradiso (engl.: Cinema Paradiso)

&gt;Day 22: Ireland - The Wind That Shakes the Barley

&gt;Day 21: Iceland - Englar Alheimsins (engl.: Angels of the Universe)

&gt;Day 20: Hungary - Sátántangó

&gt;Day 19: Greece - Κυνόδοντας (engl.: Dogtooth)

&gt;Day 18: Germany - Das Leben der Anderen (engl.: The Lives of Others)

&gt;Day 17: Georgia - ცისფერი მთები ანუ დაუჯერებელი ამბავი (engl.: Blue Mountains)

&gt;Day 16: France - La Haine

&gt;Day 15: Finland - Mies vailla menneisyyttä (engl.: The Man Without a Past)

&gt;Day 14: Estonia - Vehkleja (engl.: The Fencer)

&gt;Day 13: Denmark - Jagten (engl.: The Hunt)

&gt;Day 12: Czechia - Spalovač mrtvol (engl.: The Cremator)

&gt;Day 11: Cyprus - Smuggling Hendrix

&gt;Day 10: Croatia - Kako je počeo rat na mome otoku (engl.: How the War Started on My Island)

&gt;Day 9: Bulgaria - Източни пиесиИзточни пиеси (engl.: Eastern Plays)

&gt;Day 8: Bosnia and Herzegovina - Ničija zemlja (engl.: No Man's Land)

&gt;Day 7: Belgium - In Bruges

&gt;Day 6: Belarus - Иди и смотри (engl.: Come and See)

&gt;Day 5: Azerbaijan - Yuxu (engl.: The Dream)

&gt;Day 4: Austria - Funny Games

&gt;Day 3: Armenia - Նռան գույնը (engl.: The Color of Pomegranates)

&gt;Day 2: Andorra - El fred que crema (engl.: The Burning Cold)

&gt;Day 1: Albania - Lulekuqët mbi Mure (engl.: Red Poppies on Walls)

&gt;",Impossible_Werewolf8,1h6smua,https://reddit.com/r/movies/comments/1h6smua/favorite_movie_by_european_country_slovakia/,https://www.reddit.com/r/movies/comments/1h6smua/favorite_movie_by_european_country_slovakia/,2024-12-04 22:05:30,12,0.73,12,0,17,0,0,False,False,True,False,False,Discussion,self,t3_1h6smua
movies,"Apple TV+ Rolling Out On Prime Video In UK, Australia &amp; Canada Following U.S. Deal",,Puzzled-Tap8042,1h7adow,https://reddit.com/r/movies/comments/1h7adow/apple_tv_rolling_out_on_prime_video_in_uk/,https://deadline.com/2024/12/apple-tv-plus-rolling-out-prime-video-uk-australia-canada-1236194951/,2024-12-05 14:27:45,17,0.76,17,0,11,0,0,False,False,False,False,False,News,https://b.thumbs.redditmedia.com/VC4my2bpnbOYZWlNjHUgSCyMRmZPw-QCoVaoN0u_VvA.jpg,t3_1h7adow
movies,I love the “Love is the Drug” scene from Sucker Punch where Oscar Isaac and Carla Gugino sing the song in an elaborate musical.,"I unironically think it’s one of the best scenes Snyder has directed, and I legitimately think he should direct a flamboyant musical. It’s crazy this was cut out of the theatrical version

It’s just got so much style in that 4 minute sequence. Great choreography, costumes, and most of all, showmanship. The whole movie is pretty much Oscar Isaac auditioning for his later role in Ex Machina. He’s a hell of a dancer, and has a great voice during this scene.

I recently learned that there was a lot of footage cut from this film that’s not even in the extended cut. According to the choreographer, this scene was a lot longer, and Oscar Isaac did stuff like jump onto the tables",Odd_Advance_6438,1h6sfix,https://reddit.com/r/movies/comments/1h6sfix/i_love_the_love_is_the_drug_scene_from_sucker/,https://www.reddit.com/r/movies/comments/1h6sfix/i_love_the_love_is_the_drug_scene_from_sucker/,2024-12-04 21:57:09,11,0.62,11,0,2,0,0,False,False,True,False,False,Discussion,self,t3_1h6sfix
