subreddit,title,selftext,author,id,permalink,url,created_utc,score,upvote_ratio,ups,downs,num_comments,total_awards_received,gilded,is_video,is_original_content,is_self,over_18,spoiler,link_flair_text,thumbnail,name
Physics,Jim Ottaviani discusses his graphic novel biography of Richard Feynman,,SKRyanrr,1h7abyg,https://reddit.com/r/Physics/comments/1h7abyg/jim_ottaviani_discusses_his_graphic_novel/,https://m.youtube.com/watch?v=s3OCm3GHUbI&amp;list=WL&amp;index=1&amp;pp=gAQBiAQB,2024-12-05 14:25:30,2,0.57,2,0,7,0,0,False,False,False,False,False,Video,https://b.thumbs.redditmedia.com/459utYxgePMEsYi_-fOutmIZ7NMpldtRCfKk1PvPhvo.jpg,t3_1h7abyg
Physics,Need Great gift ideas ,"I am trying to buy some presents for my uncle who is a physicist. He’s got a love for cool sort of gadgets and display objects like Newtons cradle. I was wondering what the best gifts like those would be, can be expensive obviously not too expensive though. Ideally to do with his favourite fields: relativity and quantum mechanics! Thank you ",InflationUnlikely354,1h7bg32,https://reddit.com/r/Physics/comments/1h7bg32/need_great_gift_ideas/,https://www.reddit.com/r/Physics/comments/1h7bg32/need_great_gift_ideas/,2024-12-05 15:16:19,1,0.6,1,0,2,0,0,False,False,True,False,False,,self,t3_1h7bg32
Physics,Physics-themed calendar?,"Hi all, not sure this post is allowed, in case not, feel free to remove it. I was thinking of buying a 2025 paper calendar as a decoration and I was looking for a science-themed one (preferably physics) do you know of a nice one? From a place that posts in Europe possibly.",__boringusername__,1h78clg,https://reddit.com/r/Physics/comments/1h78clg/physicsthemed_calendar/,https://www.reddit.com/r/Physics/comments/1h78clg/physicsthemed_calendar/,2024-12-05 12:45:01,12,0.93,12,0,1,0,0,False,False,True,False,False,Question,self,t3_1h78clg
Physics,"Careers/Education Questions - Weekly Discussion Thread - December 05, 2024","This is a dedicated thread for you to seek and provide advice concerning education and careers in physics.

If you need to make an important decision regarding your future, or want to know what your options are, please feel welcome to post a comment below.

A few years ago we held a graduate student panel, where many recently accepted grad students answered questions about the application process.  That [thread is here](https://www.reddit.com/r/Physics/comments/3i5d4u/graduate_student_panel_fall_2015_1_ask_your/), and has a lot of great information in it.

Helpful subreddits: /r/PhysicsStudents, /r/GradSchool, /r/AskAcademia, /r/Jobs, /r/CareerGuidance",AutoModerator,1h79srs,https://reddit.com/r/Physics/comments/1h79srs/careerseducation_questions_weekly_discussion/,https://www.reddit.com/r/Physics/comments/1h79srs/careerseducation_questions_weekly_discussion/,2024-12-05 14:00:12,3,0.81,3,0,0,0,0,False,False,True,False,False,Meta,self,t3_1h79srs
Physics,CERN offering free Particle Physics course aimed at High School students,,kevosauce1,1h62sr2,https://reddit.com/r/Physics/comments/1h62sr2/cern_offering_free_particle_physics_course_aimed/,https://ppc.web.cern.ch,2024-12-04 00:23:22,272,0.98,272,0,18,0,0,False,False,False,False,False,,default,t3_1h62sr2
Physics,Nuclear shape transitions visualized for the first time,,BiggieTwiggy1two3,1h60e54,https://reddit.com/r/Physics/comments/1h60e54/nuclear_shape_transitions_visualized_for_the/,https://physicsworld.com/a/nuclear-shape-transitions-visualized-for-the-first-time/,2024-12-03 22:37:59,75,0.93,75,0,2,0,0,False,False,False,False,False,,https://a.thumbs.redditmedia.com/VrJO8eqGVr04avTuXC_UEUkRN--pYNd5ST1VTeSB8V0.jpg,t3_1h60e54
Physics,"Even if a quantum computer that surpasses a classical computer is never successfully built, what are some useful research that has/will bear fruit along the way? ","This is similar to a previous question on [fusion energy](https://www.reddit.com/r/Physics/s/J4Ot4aPgq8), which I'm really curious about the answers for quantum computing too.

I believe there's always some nuance involved in these fields dedicated to building these technologies that're hailed as breakthroughs, it's not all or nothing.

With all this research going into it, there's bound to be at least some useful research done that could benefit other fields right? Be it on the experimental or theoretical side?",AbstractAlgebruh,1h5ppfn,https://reddit.com/r/Physics/comments/1h5ppfn/even_if_a_quantum_computer_that_surpasses_a/,https://www.reddit.com/r/Physics/comments/1h5ppfn/even_if_a_quantum_computer_that_surpasses_a/,2024-12-03 15:15:58,60,0.82,60,0,114,0,0,False,False,True,False,False,Question,self,t3_1h5ppfn
Physics,"Physics Questions - Weekly Discussion Thread - December 03, 2024","This thread is a dedicated thread for you to ask and answer questions about concepts in physics.

Homework problems or specific calculations may be removed by the moderators. We ask that you post these in /r/AskPhysics or /r/HomeworkHelp instead.

If you find your question isn't answered here, or cannot wait for the next thread, please also try /r/AskScience and /r/AskPhysics.",AutoModerator,1h5o0kx,https://reddit.com/r/Physics/comments/1h5o0kx/physics_questions_weekly_discussion_thread/,https://www.reddit.com/r/Physics/comments/1h5o0kx/physics_questions_weekly_discussion_thread/,2024-12-03 14:00:13,14,0.87,14,0,21,0,0,False,False,True,False,False,Meta,self,t3_1h5o0kx
