subreddit,title,selftext,author,id,permalink,url,created_utc,score,upvote_ratio,ups,downs,num_comments,total_awards_received,gilded,is_video,is_original_content,is_self,over_18,spoiler,link_flair_text,thumbnail,name
movies,"Hi r/movies! We are Nikola Petrovic &amp; Andrew Howard (TENET, LIMITLESS), a writer/director &amp; star of MUDBRICK, the new XYZ FILMS and MIR MEDIA movie available On Demand today! Ask Us Anything!",,MudbrickAMA,1hdfh0w,https://reddit.com/r/movies/comments/1hdfh0w/hi_rmovies_we_are_nikola_petrovic_andrew_howard/,https://i.redd.it/adywqdclzm6e1.png,2024-12-13 16:04:13,29,0.69,29,0,44,0,0,False,False,False,False,False,AMA,https://a.thumbs.redditmedia.com/FcQCO9e0Iph2QgNENvbo1-r7hzy5DvD6lQbv1dKGZl4.jpg,t3_1hdfh0w
movies,Official Discussion Megathread (Kraven the Hunter / The Lord of the Rings: The War of Rohirrim / Queer / Flow / Maria / The Piano Lesson),"# New Theatrical Releases

[Kraven the Hunter](https://old.reddit.com/r/movies/comments/1hd2v8v/official_discussion_kraven_the_hunter_spoilers/?)

[The Lord of the Rings: The War of Rohirrim](https://old.reddit.com/r/movies/comments/1hd2vab/official_discussion_the_lord_of_the_rings_the_war/?)

[Queer](https://old.reddit.com/r/movies/comments/1hd2vby/official_discussion_queer_spoilers/?)

[Flow](https://old.reddit.com/r/movies/comments/1hd2vdk/official_discussion_flow_spoilers/?)

# Streaming Releases

[Maria](https://old.reddit.com/r/movies/comments/1hd2vew/official_discussion_maria_spoilers/?)

[The Piano Lesson](https://old.reddit.com/r/movies/comments/1hd2vg7/official_discussion_the_piano_lesson_spoilers/?)

[Carry-On](https://old.reddit.com/r/movies/comments/1hdths9/official_discussion_carryon_spoilers/?)

# Still in Theaters

[Y2K](https://old.reddit.com/r/movies/comments/1h7rhq7/official_discussion_y2k_spoilers/?)

[Werewolves](https://old.reddit.com/r/movies/comments/1h7rhry/official_discussion_werewolves_spoilers/?)

[The Return](https://old.reddit.com/r/movies/comments/1h7rht7/official_discussion_the_return_spoilers/?)

[Wicked: Part 1](https://old.reddit.com/r/movies/comments/1gwxxy1/official_discussion_wicked_part_i_spoilers/)

[Gladiator II](https://old.reddit.com/r/movies/comments/1gwxxwd/official_discussion_gladiator_ii_spoilers/)

[Moana 2](https://old.reddit.com/r/movies/comments/1h0uevk/official_discussion_moana_2_spoilers/)",LiteraryBoner,1hd2xa8,https://reddit.com/r/movies/comments/1hd2xa8/official_discussion_megathread_kraven_the_hunter/,https://www.reddit.com/r/movies/comments/1hd2xa8/official_discussion_megathread_kraven_the_hunter/,2024-12-13 03:09:08,42,0.88,42,0,0,0,0,False,False,True,False,False,Official Discussion,self,t3_1hd2xa8
movies,"‘Peaky Blinders’ Movie Wraps Filming - Starring Cillian Murphy, Rebecca Ferguson, Barry Keoghan, Tim Roth, and Stephen Graham",,ICumCoffee,1henqg6,https://reddit.com/r/movies/comments/1henqg6/peaky_blinders_movie_wraps_filming_starring/,https://www.netflixjunkie.com/hollywood-news-now-we-wait-cillian-murphy-peaky-blinders-brings-exciting-new-update-leaves-fans-even-more-hopeful-for-the-flick/,2024-12-15 07:42:53,1547,0.93,1547,0,89,0,0,False,False,False,False,False,News,https://b.thumbs.redditmedia.com/ny9KkRR1e0t1bMENymmdbhyDB3fUebUwVxtEG1qS7lc.jpg,t3_1henqg6
movies,Finally got around to watching Trap and couldn’t help but feel like it was supposed to be… spoilers ahead,"I feel like this was originally supposed to be a part of his super hero, super villain universe. There's all these little clues in there that have no real pay off. Like him snatching the box of swag like it's nothing, the whole weirdly inserted psycho-analyst that seemed way too important (like it was supposed to be the chick who ran that weird organization from Glass), tanking like 3 stun guns, and him escaping at the end. 

Anyway, movie was whatever, but honestly just felt like it was originally something different - and not just a $20 million dollar investment in his daughter's career.",broncosmang,1heijcx,https://reddit.com/r/movies/comments/1heijcx/finally_got_around_to_watching_trap_and_couldnt/,https://www.reddit.com/r/movies/comments/1heijcx/finally_got_around_to_watching_trap_and_couldnt/,2024-12-15 02:08:53,864,0.85,864,0,176,0,0,False,False,True,False,True,Spoilers,spoiler,t3_1heijcx
movies,"I have a soft spot for ""Die Hard 2"" even though I admit it's basically the least of the original three ""Die Hard"" entries.","There's no way, of course, that ""2"" could hope to escape the shadow of the legendary original, but it's also overshadowed by ""Vengeance"" given that features such things as Bruce Willis and Sam Jackson's interplay and Jeremy Irons's terrific villain turn. It plays often like a rehash of the original (even making fun of it, like when Willis asks how it can happen to him twice). The villains are fine, but not anywhere near as memorable as Alan Rickman or Irons. And so on.

But I still really like it as a fun action flick and a worthy successor even if it doesn't quite compare to its predecessor and successor. The setting is great as an airport at Christmas is a fabulous setting for maximum carnage and chaos. Willis still has John McClane in this one as a beleaguered everyman thrown into a situation he didn't expect or want (guy just wants to pick up his wife and get back for Christmas with the in-laws) and we see him at arguably his most vulnerable at certain points. And it keeps the tradition of the first one by having even minor characters be memorable (like the cute Avis clerk who both aids and flirts with John or Holly's Taser-wielding seatmate). I frankly like watching both this and the original at Christmas as a pair for some good holiday-themed action.

I'd also add another aspect that stands out; this is the darkest and most brutal entry in the franchise. Not only does it have arguably the most graphic deaths of the series (see John stabbing the mook Baker through the eye with an icicle or Major Grant getting kicked into the plane turbine), but the villains are genuine terrorists in this one, not just using it for cover. Bill Sadler plays Lt. Col. Stuart as a cold-blooded sociopath with none of Hans or Simon's charisma or likable traits, which makes him arguably the scariest ""Die Hard"" villain (easily the most hatable; Sadler apparently considers it a compliment when people tell him how much they hate the character, because that's what he intended). And worst of all, THEY CRASH A PLANE. A plane with over 200 people on it, including children. And no one makes it out alive. You have to respect an action film with the guts to do that to show just how serious the threat is.",Mst3Kgf,1hetrq0,https://reddit.com/r/movies/comments/1hetrq0/i_have_a_soft_spot_for_die_hard_2_even_though_i/,https://www.reddit.com/r/movies/comments/1hetrq0/i_have_a_soft_spot_for_die_hard_2_even_though_i/,2024-12-15 14:33:34,73,0.86,73,0,75,0,0,False,False,True,False,False,Discussion,self,t3_1hetrq0
movies,"Ninth Gate (Johnny Depp, dir. Roman Polanski, 1999)","Does anyone else have a soft spot for this movie?  Something about it just does it for me.  Pre weird-era Johnny Depp as a rare books dealer; part Indiana Jones adventure, part National Treasure, but with satanic manuscripts instead of doodads and geegaws.  Not really horror, but still spooky and unsettling at times.  Impeccable vibes,
not really sure how to describe other than mellow and dusty?  Still plenty entertaining and engaging though- this is one of my go-to rewatches and always hits the spot.

 “Why the devil?”

“I saw him one day. I was fifteen years old, and I saw him as plain as I see you now. It was love at first sight.”",Dingus_Squatford,1hegku9,https://reddit.com/r/movies/comments/1hegku9/ninth_gate_johnny_depp_dir_roman_polanski_1999/,https://www.reddit.com/r/movies/comments/1hegku9/ninth_gate_johnny_depp_dir_roman_polanski_1999/,2024-12-15 00:23:18,825,0.86,825,0,360,0,0,False,False,True,False,False,Discussion,self,t3_1hegku9
movies,Hugh Jackman is phenomenal in Les Miserables,"I always loved Hugh Jackman as an actor since I was young, but really only just from playing Wolverine for a while. Now that I’ve seen a lot of his other roles, I’ve realized just how versatile and talented he really is.

I haven’t seen the musical, but I really enjoyed the film version of Les Mis, and it has a pretty incredible performance from Jackman. All the performances were great (I even enjoyed Russell Crowe as Javert) but he really stands out as Jean Valjean, particularly in the scene early on where he decides to turn his life around after being touched by the man’s kindness",Odd_Advance_6438,1heunkv,https://reddit.com/r/movies/comments/1heunkv/hugh_jackman_is_phenomenal_in_les_miserables/,https://www.reddit.com/r/movies/comments/1heunkv/hugh_jackman_is_phenomenal_in_les_miserables/,2024-12-15 15:17:53,51,0.79,51,0,23,0,0,False,False,True,False,False,Discussion,self,t3_1heunkv
movies,"What are the more incredible “must-see” films you’ve ever watched, that you never want to watch again? ","Some films just evoke that paradoxical sense of, “what a masterpiece… And I never want to see any of it ever again.”

Saving private ryan is firmly atop this list for me. No country for old men and the green mile spring to mind too. I loved all three of them, especially NCFOM… And yet. 

What’s on your list - and why? These much loved but “un-rewatchable” films are in their own very interesting category, especially when a large audience feels the same way about it. ",Physical_Plastic138,1hesdiv,https://reddit.com/r/movies/comments/1hesdiv/what_are_the_more_incredible_mustsee_films_youve/,https://www.reddit.com/r/movies/comments/1hesdiv/what_are_the_more_incredible_mustsee_films_youve/,2024-12-15 13:17:03,69,0.72,69,0,294,0,0,False,False,True,False,False,Discussion,self,t3_1hesdiv
movies,When does an actor officially know they’re in a bad movie? ,"I wonder at what point does an actor begin to understand the movie they’re in is not gonna be good? Is it the choice of director, producer, or the script? Or is it something else? With the recent movie Kraven the Hunter I was curious if Aaron Taylor-Johnson had seen the previous installments of their “universe” and if he had, how could he have possibly come to the conclusion this movie was gonna turn out any different? I’m just curious as to why most actors even bother associating themselves with something that is pretty much dead on arrival.",meatloafpoptarts,1he8w3a,https://reddit.com/r/movies/comments/1he8w3a/when_does_an_actor_officially_know_theyre_in_a/,https://www.reddit.com/r/movies/comments/1he8w3a/when_does_an_actor_officially_know_theyre_in_a/,2024-12-14 18:19:49,2044,0.92,2044,0,1047,0,0,False,False,True,False,False,Discussion,self,t3_1he8w3a
movies,‘Dune’ at 40: David Lynch’s Odball Adaptation Remains a Fascination,,MarvelsGrantMan136,1he1wj8,https://reddit.com/r/movies/comments/1he1wj8/dune_at_40_david_lynchs_odball_adaptation_remains/,https://www.theguardian.com/film/2024/dec/14/david-lynch-dune-1984,2024-12-14 12:31:16,5570,0.93,5570,0,799,0,0,False,False,False,False,False,Article,https://b.thumbs.redditmedia.com/IGwJO0nSAF5u9jOZyMPiPJ6xO6ZScciQDnl_79f2nhA.jpg,t3_1he1wj8
movies,I finally had the courage to go to the cinema on my own and I'm so glad I did,"Hey all, I love going to watch movies in the theatre as I truly believe it can make a huge difference for many films compared with watching at home. Unfortunately I don't always have friends or family that want to join but I've always felt too socially uncomfortable to go by myself as I feel people will judge me.

I just recently decided I should give it a try and man am I happy I did. Some movies are great to watch with friends, but sometimes it's awesome to be able to fully focus and engage with a film without being distracted by others, especially at the theatre. Most recently I went to catch the re-release of Interstellar in 70mm on my own and it was genuinely one of the best movie theatre experiences I've ever had. 

Long story short, if you've ever held back on going to a see a film alone, do yourself a favor and go to the movies on your own you won't regret it. Nobody is judging you!",majung33,1hekcqs,https://reddit.com/r/movies/comments/1hekcqs/i_finally_had_the_courage_to_go_to_the_cinema_on/,https://www.reddit.com/r/movies/comments/1hekcqs/i_finally_had_the_courage_to_go_to_the_cinema_on/,2024-12-15 03:55:48,246,0.83,246,0,108,0,0,False,False,True,False,False,Discussion,self,t3_1hekcqs
movies,Debra Paget's snake dance in the 1959 movie The Indian Tomb,,PinkThaiShorts,1he58zc,https://reddit.com/r/movies/comments/1he58zc/debra_pagets_snake_dance_in_the_1959_movie_the/,https://www.youtube.com/watch?v=sOXKW1AxBUQ,2024-12-14 15:28:45,2426,0.9,2426,0,375,0,0,False,False,False,False,False,Media,https://b.thumbs.redditmedia.com/kj274_M4pVb4xbR4GX3tX7N7YtRicPpFwewNVW116sQ.jpg,t3_1he58zc
movies,I realize now why I love “About Time” so much,"First and foremost I know this is a much discussed movie. When I first saw the promo pic for it, it looked like any other rom com. Plus Rachel macadams had done The Vow and Time travelers wife before it. So I initially judged it harshly.

I fell in love with this movie around 2018 when I finally got around to it and it’s become one of my top movies to watch.

I’ve realized why I love it so much and find it so comforting. The father and son relationship reminds me so much of my husband and his dad. They have a wonderful relationship of friendship, respect, playfulness and love. Whenever my husband is out of town and I’m missing him, I watch this movie and I’ve only just realized it’s because it reminds me of him in a way. 

We have 2 daughters and while he won’t have the son and father relationship, I know he will have the same silly and playful relationship with them rooted in love.


Sorry that was a lot! lol 


What movie reminds you of family?",ajurban24,1hekhen,https://reddit.com/r/movies/comments/1hekhen/i_realize_now_why_i_love_about_time_so_much/,https://www.reddit.com/r/movies/comments/1hekhen/i_realize_now_why_i_love_about_time_so_much/,2024-12-15 04:03:38,129,0.83,129,0,21,0,0,False,False,True,False,False,Discussion,self,t3_1hekhen
movies,"That’s Not Entirely Accurate - Independence Day (1996) - a thorough examination of one of the least likable characters in the history of cinema: Secretary of Defense Albert Nimziki, played by true genius and legend James Rebhorn.",,beasterne7,1he84we,https://reddit.com/r/movies/comments/1he84we/thats_not_entirely_accurate_independence_day_1996/,https://youtu.be/L02gl9YoSFg?si=tW3UkzySmmH5SZZ5,2024-12-14 17:44:47,817,0.9,817,0,109,0,0,False,False,False,False,False,Media,https://b.thumbs.redditmedia.com/l4PoJiSa-c8dSnyxMZfbbdEe-tFggVW4I1AsxupA8dI.jpg,t3_1he84we
movies,Luca Guadagnino Says ‘After the Hunt’ Won’t Tackle ‘Sexuality or Love’ as His Other Films Have,,Puzzled-Tap8042,1hea6bu,https://reddit.com/r/movies/comments/1hea6bu/luca_guadagnino_says_after_the_hunt_wont_tackle/,https://www.indiewire.com/news/general-news/luca-guadagnino-after-the-hunt-sexuality-love-1235076387/,2024-12-14 19:18:43,350,0.87,350,0,31,0,0,False,False,False,False,False,News,https://b.thumbs.redditmedia.com/vFrTtOzrVXPIhMDTusX0A_sHBQ3mv8azv5bv2Ud8QRk.jpg,t3_1hea6bu
movies,Noelle (2019) is an instant Christmas Classic in my family now,"This G-Rated Christmas film starring Anna Kendrick and Bill Hader really impressed me after never hearing much at all about it and giving it a watch tonight with my family. I was laughing, then I was tearing up, then I was laughing over and over again. Recommend giving it a watch if you’ve never checked it out before. Anyone else agree?",madcatzplayer5,1hej7fi,https://reddit.com/r/movies/comments/1hej7fi/noelle_2019_is_an_instant_christmas_classic_in_my/,https://www.reddit.com/r/movies/comments/1hej7fi/noelle_2019_is_an_instant_christmas_classic_in_my/,2024-12-15 02:47:55,47,0.74,47,0,16,0,0,False,False,True,False,False,Discussion,self,t3_1hej7fi
movies,I just finished watching all the Rocky movies ,"Holy shit man. These are some of the greatest movies I ever watched. 

The first movie is good, but it is pretty boring I can’t lie. It doesn’t really get all that interesting until the montage and the final fight. But man, something about that fight made it all worth it. I can’t describe it, just watching that iconic montage and fight made it feel like I didn’t waste my time. 

From there the movies just kept on getting better. My favorite one has to be 4. And to be honest I didn’t think 5 was that bad. It was enjoyable and had a good story, the only problem was since it was initially the last movie in the franchise, it would be a pretty bad way to end it. I’m glad they gave Rocky’s story a proper ending with Rocky Balboa (hate that name), which I also thought was a great movie. It had probably the most realistic fight in the whole franchise.

I’ve also just finished all the Rambo movies, and just finished the first Creed movie. All of this is to say that the Rocky movies kick ass and I’m mad at myself for not watching them sooner. ",MC_Triple_Fatal,1he77lp,https://reddit.com/r/movies/comments/1he77lp/i_just_finished_watching_all_the_rocky_movies/,https://www.reddit.com/r/movies/comments/1he77lp/i_just_finished_watching_all_the_rocky_movies/,2024-12-14 17:01:25,259,0.74,259,0,277,0,0,False,False,True,False,False,Discussion,self,t3_1he77lp
movies,"Dead Heat, The Stepfather, The Hidden, and More B-Movie Gems of the VHS Era",,Bennett1984,1hec1ez,https://reddit.com/r/movies/comments/1hec1ez/dead_heat_the_stepfather_the_hidden_and_more/,https://www.flickeringmyth.com/unmissable-b-movie-gems-of-the-vhs-era/,2024-12-14 20:44:12,120,0.85,120,0,22,0,0,False,False,False,False,False,Article,https://b.thumbs.redditmedia.com/emWMrGpRTVaZNbhBXqhImDPl9-XTrbcSBNoaG2ms8mE.jpg,t3_1hec1ez
movies,"Irish Rap-Comedy 'Kneecap' Tops British Independent Film Awards with 7 Wins (Best Film, Best Co-Lead Performance, Best Debut Screenplay, Best Casting, Best Editing, Best Original Music, and Best Music Supervision)",,BunyipPouch,1he5aj2,https://reddit.com/r/movies/comments/1he5aj2/irish_rapcomedy_kneecap_tops_british_independent/,https://www.theguardian.com/film/2024/dec/09/irish-rap-comedy-kneecap-tops-british-independent-film-awards,2024-12-14 15:30:47,303,0.89,303,0,19,0,0,False,False,False,False,False,News,https://b.thumbs.redditmedia.com/tZ_b8LXrqOTaZIaxLp9MQQfHiGKWoCxDwvHqhWF1wjo.jpg,t3_1he5aj2
movies,"Unforgiven is one of Clint Eastwood's best movies as a director ever. I mean imagine deconstructing the gunslinger image that made you a star, and stripping away the glamor behind the Wild West.","https://preview.redd.it/yicntwi7lq6e1.png?width=219&amp;format=png&amp;auto=webp&amp;s=4058b385363489b27ba3d34b8e628fe804990207

https://preview.redd.it/5a7q1fr9lq6e1.png?width=320&amp;format=png&amp;auto=webp&amp;s=49d5e104f8f85d119d971b127d6b9177902447d2

William Munny is everything that Clint Eastwood was not in his hey days. He can't mount a horse, he can't shoot straight, his hands shake when holding a gun. In one shot, Clint Eastwood demystified and deglamorized the gun slinger, the cowboy. He stripped him of his super hero status and showed he was some one like us, as vulnerable as could be.

https://preview.redd.it/9eglkeoplq6e1.png?width=1600&amp;format=png&amp;auto=webp&amp;s=beb95dfb6da04b33733c5019ea3b5560fbd7cafb



But much before too, the romance behind Wild West, gets busted in the scene where the  sheriff Little Bill( Gene Hackmann), shows the grimy reality to the starry eyed English Bob. English Bob's romantic visions are shattered, when he finds himself face to face with the actual violence, he can't handle it.

https://preview.redd.it/ldzw7xhwlq6e1.png?width=320&amp;format=png&amp;auto=webp&amp;s=79aa0d2c215f80f0c576af8e80fa301e9379f207

Characters here don't revel in the violence, they are horrified and appalled by it. The Schofeld Kid and English Bob find reality too uncomfortable to handle. Ned Logan( Morgan Freeman) is more of a pacifist, who wants to opt out of the mission, a decision that proves tragic for him. And William Munny himself is on the mission for some money, rather than any honor.

It is a Western in which there are no heroes and villains per se. William Munny's background is shown to be a sociopath who had no qualms about killing left, right and center. Little Bill while vicious and sadist, is also a God fearing sheriff, who wants to keep the town clean. There are no clear cut black and white, pretty much large swathes of grey.

And it has 3 great actors at the top of their game, Clint Eastwood essentially parodying his own image, just check the scene where he tests his shooting skills. Gene Hackmann as the Sheriff, in a morally ambigous character, you hate him when he tortures Morgan Freeman, but then you see that he just wants to keep the town clean, and will do anything for it. And Freeman is as reliable as ever as the soft spoken Ned.",LoneWolfIndia,1hduhu8,https://reddit.com/r/movies/comments/1hduhu8/unforgiven_is_one_of_clint_eastwoods_best_movies/,https://www.reddit.com/r/movies/comments/1hduhu8/unforgiven_is_one_of_clint_eastwoods_best_movies/,2024-12-14 03:59:59,2391,0.92,2391,0,212,0,0,False,False,True,False,True,Discussion,spoiler,t3_1hduhu8
movies,I was surprised so many people criticize Orlando Bloom’s performance in the Kingdom of Heaven directors cut. I thought he was pretty great,"I haven’t seen the theatrical version, so I can’t comment on criticisms of his performance in that, but I think the directors cut is easily his best performance. Felt like the audience gets a good sense of who he is, his morals, and the difficult odds he’s against

It’s difficult to keep up with actors like Edward Norton, Liam Neeson, and Jeremy Irons, but I think bloom does his best ",Odd_Advance_6438,1heb3a4,https://reddit.com/r/movies/comments/1heb3a4/i_was_surprised_so_many_people_criticize_orlando/,https://www.reddit.com/r/movies/comments/1heb3a4/i_was_surprised_so_many_people_criticize_orlando/,2024-12-14 20:00:16,110,0.78,110,0,44,0,0,False,False,True,False,False,Discussion,self,t3_1heb3a4
movies,With AI restorations on the rise in recent years I am becoming worried about the future of movie preservation.,"I will preface this post with something positive before I discuss my concerns. The truth is that as long as there are fans of art there will be people who will properly preserve it. If you want a movie in a particular form/ cut, with the original theatrical audio mix, with every special feature ever released for that movie, and in the best/ least compressed presentation possible then there are many places online where you can access it. This post isn't referring to crazy people like me that will seek out that material. This post is aimed at people that I refer to as “casuals” or the people that aren't as crazy as me about this sort of stuff. The people that just want to watch a movie with the click of a button rather than buying a physical disc or searching for an obscure torrent. 



I want to start my concerns about this phenomenon by stating that I am not a gloomy type of person. I see some of the benefits of AI technology when it comes to movie restorations, but my perspective changed after December 12th, 2024. That day I went with a friend to see a one night only screening of Interstella 5555 (2003). That presentation of the movie is the worst my friend and I have ever seen, which is saying something because that movie is cursed with sub par home media releases. The version that my friend and I saw that day was AI upscaled. It ruined all of the details in the image. Every shot in the movie looked like someone rubbed Vaseline on random parts of the screen. It was pretty much unwatchable. (Here are some examples of what my friend and I saw that night: [Example #1](https://www.reddit.com/r/DaftPunk/comments/1gfqxge/interstella_ai_remaster/), [Example #2](https://www.youtube.com/shorts/b_sL6bSRhWw), [Example #3](https://www.youtube.com/shorts/pX_Ss4BrepE)).



I knew this sort of stuff had happened before like with the recent Blu-ray release of [I Love Lucy](https://www.youtube.com/watch?v=lYdhJMOTPVw) and the [4Ks that James Cameron has released](https://www.youtube.com/watch?v=BxOqWYytypg&amp;pp=ygUXamFtZXMgY2FtZXJvbiA0ayBpc3N1ZXM%3D), however the difference with those is that most of them (except The Abyss) have some other decent release while Interstella 5555 is stuck with a sub par DVD and Blu-ray releases.



Then there is the issue of movies staying in circulation. If this version of Interstella 5555 is the only one available on streaming or a new Blu-ray release then what will “casuals” who have never watched this movie think. Will they think that the movie shouldn't look like that or will they think that the movie is supposed to look like a Vaseline smeared mess?



AI is a very helpful technology for movie restoration but it has become very obvious to me that studios are not using this technology properly and are getting extremely lazy with it. I will put it to you this way, you use a hammer to strike nails and you use a wrench to screw bolts. You can use a wrench to strike nails and you can use a hammer to screw bolts but the tools will do those tasks horribly if used in this manner. Use the right tool for the job and everything will be fine. After that night, I realized that these studios aren't doing that for whatever reason and that it is up to us to keep the art that we love alive.

",Reel-Rookie,1hef2tj,https://reddit.com/r/movies/comments/1hef2tj/with_ai_restorations_on_the_rise_in_recent_years/,https://www.reddit.com/r/movies/comments/1hef2tj/with_ai_restorations_on_the_rise_in_recent_years/,2024-12-14 23:07:43,58,0.76,58,0,41,0,0,False,False,True,False,False,Discussion,self,t3_1hef2tj
