subreddit,title,selftext,author,id,permalink,url,created_utc,score,upvote_ratio,ups,downs,num_comments,total_awards_received,gilded,is_video,is_original_content,is_self,over_18,spoiler,link_flair_text,thumbnail,name
movies,The Man With No Name In Italian,"i have been working on an edit of an edit of the man with no name trilogy that would combine all the dubs so each actor is speaking his or her own language and have a copy of each dub for all 3 except the italian dub and was wondering if anybody knew where i might be able to find it

  
i've never liked the fact that whenever i post here i have to make it three hundred characters or i can't post even though i'm not at all well spoken and like to make my sentences short to make up for how bad i am at words and talking and interacting with people ",ClearAd4299,1hdkhi0,https://reddit.com/r/movies/comments/1hdkhi0/the_man_with_no_name_in_italian/,https://www.reddit.com/r/movies/comments/1hdkhi0/the_man_with_no_name_in_italian/,2024-12-13 19:43:34,0,0.47,0,0,4,0,0,False,False,True,False,False,Discussion,self,t3_1hdkhi0
movies,Gimme All The Christmas Carols….,"I’ve watched several versions this month and it got me thinking just how many are there?

Prefer movie versions but TV is okay as well.

So far I’ve watched Scrooged, Muppet Christmas Carol, Mickey’s Christmas Carol, the Alistar Sims version and the George C. Scott version.

Just drop the title &amp; year please and where (if anywhere) its available.

  
Thanks!",sourbelle,1hdcbls,https://reddit.com/r/movies/comments/1hdcbls/gimme_all_the_christmas_carols/,https://www.reddit.com/r/movies/comments/1hdcbls/gimme_all_the_christmas_carols/,2024-12-13 13:35:21,3,0.64,3,0,9,0,0,False,False,True,False,False,Discussion,self,t3_1hdcbls
movies,"Alicia Silverstone, Oliver Hudson, Jameela Jamil, Pierson Fode &amp; Melissa Joan Hart To Star In Netflix Rom-Com ‘A Merry Little Ex-Mas’",,Sisiwakanamaru,1hcu4mu,https://reddit.com/r/movies/comments/1hcu4mu/alicia_silverstone_oliver_hudson_jameela_jamil/,https://deadline.com/2024/12/a-merry-little-ex-mas-alicia-silverstone-star-netflix-rom-com-1236202154/,2024-12-12 20:12:24,24,0.7,24,0,2,0,0,False,False,False,False,False,Article,https://b.thumbs.redditmedia.com/dqXZLHvkY09wb908gmevlXK6VTSKJeZdjvpvs-0Gn5k.jpg,t3_1hcu4mu
movies,Just finished watching Girl Haunts Boy and it was surprisingly good! ,The movie definitely made me feel something. I thoroughly enjoyed watching it. It was pretty short and simple but I guess that made it even more effective. The ending was really bittersweet but I like it because it felt like it was something different if that makes sense. What do y'all think? Did y'all like it?,Rabbidraccoon18,1hdguag,https://reddit.com/r/movies/comments/1hdguag/just_finished_watching_girl_haunts_boy_and_it_was/,https://www.reddit.com/r/movies/comments/1hdguag/just_finished_watching_girl_haunts_boy_and_it_was/,2024-12-13 17:04:18,0,0.38,0,0,1,0,0,False,False,True,False,False,Discussion,self,t3_1hdguag
movies,Who should you side with in 'Grave of the fileflies'?,"On one hand my western mindset wants me to side with the brother, but I don't wanna be xenophobic and ignore the aunts devotion to her real family? I don't wanna be the classic western idiot who imposes his views on an eastern piece like a racist. Obviously there are cultural factors to consider, and I don't wanna encroach on traditional values. I'm not a xenophobe if that's what this post seams to imply.",Agreeable-Divide-150,1hdvb56,https://reddit.com/r/movies/comments/1hdvb56/who_should_you_side_with_in_grave_of_the_fileflies/,https://www.reddit.com/r/movies/comments/1hdvb56/who_should_you_side_with_in_grave_of_the_fileflies/,2024-12-14 04:48:33,0,0.24,0,0,27,0,0,False,False,True,False,False,Question,self,t3_1hdvb56
movies,‘Wuthering Heights’ With Margot Robbie &amp; Jacob Elordi To Make Audiences Swoon On Valentine’s Day Weekend 2026,,KillerCroc1234567,1hdq25b,https://reddit.com/r/movies/comments/1hdq25b/wuthering_heights_with_margot_robbie_jacob_elordi/,https://deadline.com/2024/12/wuthering-heights-jacob-elordi-margot-robbie-release-date-1236203474/,2024-12-14 00:01:21,0,0.48,0,0,35,0,0,False,False,False,False,False,News,https://b.thumbs.redditmedia.com/vW3g2ANbcyTpIoGbXSvrK4D983pABdYLIcEEeazDRrU.jpg,t3_1hdq25b
movies,IMDB Ratings - Get rid of scores from people that mostly vote 1's and 10's,"I know a lot of people take IMDB ratings with a huge grain of salt, but I find they mostly track my preferences pretty well. I guess I'm pretty basic. However, I do think the score could be improved if IMDB just didn't count those users that mostly give out 1's and 10's. 

I don't know for sure if there are a bunch of users (or bots) that do this, but it sure seems like it.",Horny_GoatWeed,1hdqohj,https://reddit.com/r/movies/comments/1hdqohj/imdb_ratings_get_rid_of_scores_from_people_that/,https://www.reddit.com/r/movies/comments/1hdqohj/imdb_ratings_get_rid_of_scores_from_people_that/,2024-12-14 00:32:17,0,0.33,0,0,25,0,0,False,False,True,False,False,Discussion,self,t3_1hdqohj
movies,Is there a way to get the TBS version of movies ? ,"So back in the day ( I don't have cable now so I don't if they still do) TBS would show movies like twister , Indiana Jones and jaws but edit them to be Y7 . Does anyone know where I could get legal copies of those versions of the movies ? I have the originals of these movies and tried to edit them myself but they did a much better job . Plus they dubbed all the curse words and stuff which I haven't even begun to try and figure out how to do .",Puzzleheaded_Smoke77,1hdovyr,https://reddit.com/r/movies/comments/1hdovyr/is_there_a_way_to_get_the_tbs_version_of_movies/,https://www.reddit.com/r/movies/comments/1hdovyr/is_there_a_way_to_get_the_tbs_version_of_movies/,2024-12-13 23:04:27,0,0.38,0,0,23,0,0,False,False,True,False,False,Discussion,self,t3_1hdovyr
movies,"First Image of Alison Brie &amp; Dave Franco in 'Together' - With a move to the countryside already testing the limits of a couple’s relationship, a supernatural encounter begins an extreme transformation of their love, their lives, and their flesh.",,MarvelsGrantMan136,1hbz63l,https://reddit.com/r/movies/comments/1hbz63l/first_image_of_alison_brie_dave_franco_in/,https://i.redd.it/1cjfvc3ma96e1.jpeg,2024-12-11 17:42:07,2679,0.94,2679,0,188,0,0,False,False,False,False,False,Media,https://b.thumbs.redditmedia.com/5JSgGsktmnsn0Zc7fUmo2MXegSQAGnjTMAUlViyY5_Q.jpg,t3_1hbz63l
movies,Juror #2 is a perfect example why you shouldn't watch trailers.,"Walking into this movie blind was a great experience and I loved it. Watching how it all unfolds kept everything fresh and intense.

SPOILERS

If I would've watched the trailer - I already know he did something bad, I already know he's on jury duty for the bad thing he did and someone innocent can go to jail, I know people will find out, I know he confesses to Kiefer Sutherland's character, I know he'll eventually raise suspicions...only thing left for me in the movie is the verdict lol.


Not watching the trailer all I knew it's just some courtroom drama.


If you didn't see it yet, don't watch the trailer cause it's a pretty clever plot twist the trailer gives away.


",BackPains84,1hdpwqb,https://reddit.com/r/movies/comments/1hdpwqb/juror_2_is_a_perfect_example_why_you_shouldnt/,https://www.reddit.com/r/movies/comments/1hdpwqb/juror_2_is_a_perfect_example_why_you_shouldnt/,2024-12-13 23:54:06,0,0.35,0,0,10,0,0,False,False,True,False,True,Discussion,spoiler,t3_1hdpwqb
movies,Official Discussion - The Piano Lesson [SPOILERS],"#Poll

**If you've seen the film, please rate it [at this poll](https://strawpoll.ai/poll/vote/tugtY2xeQEzU)**

**If you haven't seen the film but would like to see the result of the poll [click here](https://strawpoll.ai/poll/results/tugtY2xeQEzU)**

#Rankings

[Click here](https://strawpoll.ai/list/ZPi3H5nAwrkj) to see the rankings of 2024 films

[Click here](https://youpoll.me/list/4/) to see the rankings for every poll done

---
**Summary:**

Follows the lives of the Charles family as they deal with themes of family legacy and more, in deciding what to do with an heirloom, the family piano.

**Director:**

Malcolm Washington

**Writers:**

Virgil Williams, Malcolm Washington, August Wilson

**Cast:**

* Samuel L. Jackson as Doaker
* John David Washington as Boy Willie
* Danielle Deadwyler as Berniece
* Ray Fisher as Lymon
* Corey Hawkins as Avery
* Michael Potts as Wining Boy

**Rotten Tomatoes:** [89%](https://www.rottentomatoes.com/m/the_piano_lesson)

**Metacritic:** [69](https://www.metacritic.com/movie/the-piano-lesson/)

**VOD:** Netflix",LiteraryBoner,1hd2vg7,https://reddit.com/r/movies/comments/1hd2vg7/official_discussion_the_piano_lesson_spoilers/,https://www.reddit.com/r/movies/comments/1hd2vg7/official_discussion_the_piano_lesson_spoilers/,2024-12-13 03:06:16,4,0.61,4,0,9,0,0,False,False,True,False,True,Official Discussion,spoiler,t3_1hd2vg7
movies,Nickel Boys review,"Nickel Boys: 

Boy oh boy, where do I begin. They told RaMell Ross that he wouldn’t pull this off, that people wouldn’t adapt to the style. Well I’m here to tell you, they were dead wrong. Nickel Boys is creatively astounding. Movies that are so unique don’t come around often and this is unique with a capital U. 

The cinematography is the obvious place to start here. This is an experiment that passes with flying colors. Every frame will be burned into your brain that you’ll see them when you close your eyes. This camera work is like nothing I’ve seen ever seen before and it’s executed to sheer perfection. 2 hours and 20 minutes of pure detail and effort that pays off massively. Don’t take your eyes off the screen cause not a single frame can be missed. Nickel Boys is a vision of artistic excellence. 

Onto the acting. Credit to all the actors and actresses involved cause they were all in danger of being over shadowed by the creative choices made, but man oh man do they hold their own. Pure emotion on display. A gripping but grounded tale. 

RaMell Ross is cinema’s Einstein. Everything about Nickel Boys is innovative and inspired, a truly staggering cinematic achievement. I felt like I was witnessing cinema history… I’m not saying it’s for everyone and Nickel Boys is a movie that will inevitably divide audiences. That said I think this movie is generational, and you can say I’m taking the bait but I have never witnessed something on this scale before and I’m deeply elated with what I have seen. 

Nickel Boys = 10/10 
",rjpresslee7,1hd7k76,https://reddit.com/r/movies/comments/1hd7k76/nickel_boys_review/,https://www.reddit.com/r/movies/comments/1hd7k76/nickel_boys_review/,2024-12-13 08:02:19,2,0.57,2,0,1,0,0,False,False,True,False,False,Review,self,t3_1hd7k76
movies,Sideways vs Million Dollar Baby (The Oscars),"Hi guys 
This is my first post on here and this might be a case of recency bias, but I just watched my 100th movie of the year and it was my first watch of Sideways (2004).

I believe 2004 was a good year for movies, but when I went on IMDb, I was kind of shocked to find out that Paul Giamatti wasn’t even nominated for his role in the movie. 

But regarding Best Picture award, admittedly, it’s been a while since I’ve seen The Aviator, Finding Neverland, and Million Dollar Baby, (haven’t seen Ray yet)but between Sideways and Million Dollar Baby (the Oscar winner), what do you think is the better movie? And why?


Thank you all for reading and I look forward to your inputs.",fsooli,1hdldzi,https://reddit.com/r/movies/comments/1hdldzi/sideways_vs_million_dollar_baby_the_oscars/,https://www.reddit.com/r/movies/comments/1hdldzi/sideways_vs_million_dollar_baby_the_oscars/,2024-12-13 20:24:14,0,0.4,0,0,19,0,0,False,False,True,False,False,Discussion,self,t3_1hdldzi
movies,Are Adaptations and “Based on” movies the same thing?,"Some friends of mine were having a debate on what qualifies as an Adaptation and what is a “Based on/in” movie. For example, twilight or Harry Potter movies take almost the exact plot from their book counterparts and transfer then to film. But then something like the Arcane tv show is an original new plot set in the world created through lore in League of Legends. Is there a difference?",Dyson_Gimix,1hdmf0u,https://reddit.com/r/movies/comments/1hdmf0u/are_adaptations_and_based_on_movies_the_same_thing/,https://www.reddit.com/r/movies/comments/1hdmf0u/are_adaptations_and_based_on_movies_the_same_thing/,2024-12-13 21:10:45,0,0.25,0,0,6,0,0,False,False,True,False,False,Discussion,self,t3_1hdmf0u
movies,What are your thoughts on watchmen chapter 1 and 2 is it a perfect adaptation ,"The animated Watchmen chapters I and II are a true love letter to the original graphic novel, staying incredibly faithful to the source material. The visuals capture the gritty, noir-like atmosphere of the comic perfectly, and the animation brings the artwork to life in a way that feels close to the original. The pacing mirrors the comic’s episodic structure, and the dialogue stays true to the sharp, complex exchanges that define the characters.

While this faithfulness will undoubtedly resonate with long-time fans, it also raises an interesting question: is it too faithful? The adaptation feels almost like a direct retelling, which can leave little room for new interpretations or creative risks. For those familiar with the comic, it offers a nostalgic experience, but does it stand out as something more than just a faithful retelling? Could it have pushed boundaries or expanded on themes in a way that feels fresh? It nails the essence of Watchmen, but does something still feel missing? What do you think?",Mental_Invite1077,1hdj4u7,https://reddit.com/r/movies/comments/1hdj4u7/what_are_your_thoughts_on_watchmen_chapter_1_and/,https://www.reddit.com/r/movies/comments/1hdj4u7/what_are_your_thoughts_on_watchmen_chapter_1_and/,2024-12-13 18:44:07,0,0.39,0,0,20,0,0,False,False,True,False,False,Discussion,self,t3_1hdj4u7
movies,Should more movies be available to watch at home on their release dates?,"
For numerous reasons my wife and I rarely go see a movie at the theater. We’ve often wondered if studios might eventually release some movies for home viewing on the same day that they are released at the theaters. We’ve seen this happen before, but I don’t remember it happening with very many high profile movies. They could charge $50 or so and we would still be interested. I understand that they might be afraid of losing  revenue but there are people like myself that are not going to the theater who would be providing additional income. I also understand the desire and need to support movie theaters so I’m sure that would be a big consideration. I’m not suggesting they do it with every movie. Maybe just occasionally. I’ve invested significant money in a home theater system and enjoy watching at home.",simonthecat33,1hdorax,https://reddit.com/r/movies/comments/1hdorax/should_more_movies_be_available_to_watch_at_home/,https://www.reddit.com/r/movies/comments/1hdorax/should_more_movies_be_available_to_watch_at_home/,2024-12-13 22:58:45,0,0.18,0,0,5,0,0,False,False,True,False,False,Discussion,self,t3_1hdorax
movies,The Last of the Mohicans is a Terminator movie.,"Magua (Wes Studi) is a Terminator who can’t be bargained with, can’t be reasoned with, doesn’t feel pity or remorse or fear, and absolutely will not stop… EVER, until the grey hair and his seed are dead.  
Once she’s being hunted by this relentless dark force, it takes hardly any time at all for Cora (Madeleine Stowe) to be captivated and changed by her rescuer, Hawkeye, who comes from outside of normal society.  
The English, like the police in *The Terminator*, are no match at all for what they’re up against. They separate the two lovers and condemn Hawkeye.  
Both the heart scene and Magua’s fight with Hawkeye’s father look like the T-800 in action.  
Cora: “You’ve done everything you can do. Save yourself! If the worst happens, and only one of us survives, something of the other does too”. This is like a line out of Wuthering Heights. Two souls metaphysically entwined. Two of the most romantic movies ever made.",Cosmo_Glass,1hdq03o,https://reddit.com/r/movies/comments/1hdq03o/the_last_of_the_mohicans_is_a_terminator_movie/,https://www.reddit.com/r/movies/comments/1hdq03o/the_last_of_the_mohicans_is_a_terminator_movie/,2024-12-13 23:58:48,0,0.34,0,0,8,0,0,False,False,True,False,False,Discussion,self,t3_1hdq03o
movies,A24's 'The Brutalist' To Receive IMAX Release,,BunyipPouch,1hc68cl,https://reddit.com/r/movies/comments/1hc68cl/a24s_the_brutalist_to_receive_imax_release/,https://www.imax.com/movie/the-brutalist,2024-12-11 22:39:09,706,0.94,706,0,79,0,0,False,False,False,False,False,News,https://a.thumbs.redditmedia.com/HP0xa5flb4C-r9oaGTmzh_bCVr_Z9uxQfyAnBOttiL0.jpg,t3_1hc68cl
movies,Alternate ending to Turning Red ,"I used to love Turning Red but I don't anymore. When I washed it for the second time the flaws in it became a lot more visible:

If the concert was happening on the 25th instead of the 18th, how did May and her friends go so long thinking it was the 18th? Did they not double check? Do nobody tell them?

If they stopped being friends for a while, why did Miriam keep Mei's pet toy?

Why did they suddenly love Tyler if he was a 4*Townie? Just because he likes the same band as them doesn't mean he's a good person.

Keeping these flaws in mind, here is how I would have done it:

At the party, Mei and her friends (Miriam, Priya, and Abby) hear that 4*Town's Toronto concert has been cancelled. Mei attacks Tyler after he insults her family and doesn't stand up for her friends when her mother blames them for everything. The ritual goes off without a hitch and her red panda form is sealed away.

When Mei returns to school the following Monday, she is shunned by her former friends, who are still mad at her for throwing them under the bus. She is heartbroken until Tyler approaches her and apologizes for his past behaviour. Mei extends an offer of friendship, which he gladly accepts, and the film ends with the two walking happily into the sunset.

Do you think it's a good ending or a bad ending? Share your thoughts below.",Conscious-South3990,1hdo62p,https://reddit.com/r/movies/comments/1hdo62p/alternate_ending_to_turning_red/,https://www.reddit.com/r/movies/comments/1hdo62p/alternate_ending_to_turning_red/,2024-12-13 22:30:29,0,0.19,0,0,6,0,0,False,False,True,False,False,Discussion,self,t3_1hdo62p
movies,"First Image of Ayo Ebebiri in A24's 'OPUS' - A young writer is invited to the remote compound of a legendary pop star who mysteriously disappeared 30 years ago. Surrounded by the star's cult of sycophants and intoxicated journalists, she finds herself in the middle of his twisted plan",,mayukhdas1999,1hc0958,https://reddit.com/r/movies/comments/1hc0958/first_image_of_ayo_ebebiri_in_a24s_opus_a_young/,https://i.redd.it/0ei4yxpmi96e1.jpeg,2024-12-11 18:26:48,1444,0.9,1444,0,106,0,0,False,False,False,False,False,Media,https://b.thumbs.redditmedia.com/ZGG3UeYtE_lSV_QU9bT19s2WlQc9RjnRxCC6TtBF03M.jpg,t3_1hc0958
movies,"First Image of Benedict Cumberbatch in 'The Thing with Feathers' - Struggling to process the sudden and unexpected death of his wife, a father loses his hold on reality as a seemingly malign presence begins to stalk him from the shadowy recesses of the apartment he shares with his two young sons",,MarvelsGrantMan136,1hc6w8z,https://reddit.com/r/movies/comments/1hc6w8z/first_image_of_benedict_cumberbatch_in_the_thing/,https://i.redd.it/tuodibqowa6e1.jpeg,2024-12-11 23:08:22,484,0.92,484,0,43,0,0,False,False,False,False,False,Media,https://b.thumbs.redditmedia.com/nPFcJ76hQfoj40N34Sw8smgdEyUDZ05FezEAXEiq_WA.jpg,t3_1hc6w8z
movies,Did Stallone ever make a commentary to Rocky IV?,"I was looking for the Rocky IV Steelbook which has the Rocky vs Drago Director's cut, but everywhere I have read- the editing decisions seem strange and makes the original cut look superior. and no commentary seems to be included.

So I looked at previous DVD releases of Rocky IV to see if any featured a commentary, but it doesn't look like it. I feel like it would be a fun one to listen to. 
",vagabond17,1hdikce,https://reddit.com/r/movies/comments/1hdikce/did_stallone_ever_make_a_commentary_to_rocky_iv/,https://www.reddit.com/r/movies/comments/1hdikce/did_stallone_ever_make_a_commentary_to_rocky_iv/,2024-12-13 18:19:28,0,0.33,0,0,7,0,0,False,False,True,False,False,Question,self,t3_1hdikce
movies,"What Do You Suggest For Superman 2025, A ONYX Screen or IMAX? ","I know Superman is more than half a year away. But I'm already mentally preparing where I want to watch it. I watched Deadpool and Wolverine on a ONYX screen and I really liked it. I was too close to the screen though so I will have to remedy that next time. But my IMAX is with Laser and I just saw War of the Rohirrim on it. 

So I'm deciding which screen is best for Superman. (Superman is my favorite superhero and character so that's why I'm preparing so early) Superman is being shot on IMAX and will most likely have a bigger aspect ratio for the entire film or specific action scenes. 

I like ONYX because of the LED screen, better color, brighter, and higher resolution. Though I don't like that the cinema with the ONYX screen has in person waitress so they are just walking in front of you while the movie plays. 

What are your opinions? ",GaelG721,1hdnxo1,https://reddit.com/r/movies/comments/1hdnxo1/what_do_you_suggest_for_superman_2025_a_onyx/,https://www.reddit.com/r/movies/comments/1hdnxo1/what_do_you_suggest_for_superman_2025_a_onyx/,2024-12-13 22:19:42,0,0.15,0,0,6,0,0,False,False,True,False,False,Discussion,self,t3_1hdnxo1
movies,2004 was peak comedy/teen movies,"Look at this list! Drama/horror was brilliant but comedy/teen movies were legendary. 

Any theories as to why? 

Comedy/teen movies:
50 first dates
Starsky &amp; Hutch
Ella Enchanted
The girl next door
13 going on 30
Mean Girls
Napolean Dynamite
White Chicks
The Notebook
Anchorman: Legend of Ron Burgundy
Harold &amp; Kumar go to White Castle
Shaun of the Dead
Team America
The Incredibles
Spongebob squarepants movie
Meet the Fockers
Life aquatic with Steve Zisou

Drama/horror:
Eternal sunshine of the spotless mind
Hellboy
Saddest music in the world
Super size me
Coffee &amp; cigarettes
Chronicles of Riddick
Fahrenheit 9/11
Before Sunset
The Village
Collateral
Open Water
The Grudge
Sideways
Birth
Saw
Closer",underscorex3,1hdfus8,https://reddit.com/r/movies/comments/1hdfus8/2004_was_peak_comedyteen_movies/,https://www.reddit.com/r/movies/comments/1hdfus8/2004_was_peak_comedyteen_movies/,2024-12-13 16:21:20,0,0.41,0,0,12,0,0,False,False,True,False,False,Discussion,self,t3_1hdfus8
movies,"CinemaCon: Amazon MGM Joins Lineup, Sony Returns for 2025 Edition",,KillerCroc1234567,1hcru0m,https://reddit.com/r/movies/comments/1hcru0m/cinemacon_amazon_mgm_joins_lineup_sony_returns/,https://variety.com/2024/film/news/cinemacon-amazon-mgm-sony-pictures-1236247076/,2024-12-12 18:33:53,10,0.65,10,0,0,0,0,False,False,False,False,False,News,https://a.thumbs.redditmedia.com/NKQdMfekBtlhIhs-VDJQ5ThguqGI3KIHqDnRlSXsPR4.jpg,t3_1hcru0m
movies,"Dane Cook &amp; Hana Mae Lee Leading Dark Comedy ‘Boris Is Dead’
",,Puzzled-Tap8042,1hdi8ga,https://reddit.com/r/movies/comments/1hdi8ga/dane_cook_hana_mae_lee_leading_dark_comedy_boris/,https://deadline.com/2024/12/dane-cook-hana-mae-lee-leading-dark-comedy-boris-is-dead-1236203012/,2024-12-13 18:05:06,0,0.4,0,0,12,0,0,False,False,False,False,False,News,https://b.thumbs.redditmedia.com/VwFGkSNiXF6g0B2iPswnVSYTQ2UIvY2xjIpQyuE4HlE.jpg,t3_1hdi8ga
movies,Dogma dvd missing background music,"I just pulled out my Dogma dvd (found buried in a $5 dvd bin years ago) to watch said movie.

It got to the scene in the strip club, and suddenly there was no music. Poor Salma Hayek was strutting around on stage in silence except dialog and miscellaneous bar noises.

The music came back the in the next scene.

It's been a long time since I've watched this dvd, but I don't remember it happening before.

Has anyone else had this problem?

Edit:
The fight scene with the shit demon is also missing sounds/music

Wtf is going on with my dvd?!",DashDifficult,1hd70iw,https://reddit.com/r/movies/comments/1hd70iw/dogma_dvd_missing_background_music/,https://www.reddit.com/r/movies/comments/1hd70iw/dogma_dvd_missing_background_music/,2024-12-13 07:19:59,0,0.46,0,0,6,0,0,False,False,True,False,False,Discussion,self,t3_1hd70iw
