subreddit,title,selftext,author,id,permalink,url,created_utc,score,upvote_ratio,ups,downs,num_comments,total_awards_received,gilded,is_video,is_original_content,is_self,over_18,spoiler,link_flair_text,thumbnail,name
movies,A parody of 90s movie of the week tropical paradise mystery?,"
I could have sworn I saw an announcement about a movie made in exactly this vein as a parody. It was an indie production due out this year or the next. It had even captured the waxy look of those films.

I was immediately compelled because of how specific this particular parody was and that’s often a sweet spot for me.",arrogant_ambassador,1hcnzqj,https://reddit.com/r/movies/comments/1hcnzqj/a_parody_of_90s_movie_of_the_week_tropical/,https://www.reddit.com/r/movies/comments/1hcnzqj/a_parody_of_90s_movie_of_the_week_tropical/,2024-12-12 15:48:56,0,0.33,0,0,5,0,0,False,False,True,False,False,Question,self,t3_1hcnzqj
movies,"Michael Cole, ‘Mod Squad’ Star, Dies at 84",,Puzzled-Tap8042,1hbeucg,https://reddit.com/r/movies/comments/1hbeucg/michael_cole_mod_squad_star_dies_at_84/,https://variety.com/2024/tv/news/michael-cole-dead-mod-squad-1236245131/,2024-12-10 22:57:13,445,0.9,445,0,19,0,0,False,False,False,False,False,News,https://b.thumbs.redditmedia.com/cwesMuG5w21M-rpLQZSfSstv7iLW1zTuKYkTPmI6rlE.jpg,t3_1hbeucg
movies,New ‘Chitty Chitty Bang Bang’ Movie In The Works At Eon Productions And Amazon MGM Studios,,KillerCroc1234567,1hcshah,https://reddit.com/r/movies/comments/1hcshah/new_chitty_chitty_bang_bang_movie_in_the_works_at/,https://deadline.com/2024/12/new-chitty-chitty-bang-bang-movie-amazon-mgm-studios-eon-productions-1236201842/,2024-12-12 19:01:08,0,0.42,0,0,29,0,0,False,False,False,False,False,News,https://b.thumbs.redditmedia.com/_LDXDEmBWqfxlWi_3VuJE5Nnq8izZ3BDLaH8ULU7t-s.jpg,t3_1hcshah
movies,Executive Decision (1996). The story of the Film,,NeoMorpheusCypher,1hcg20z,https://reddit.com/r/movies/comments/1hcg20z/executive_decision_1996_the_story_of_the_film/,https://www.youtube.com/watch?v=ND4882k5sd8,2024-12-12 07:42:50,1,0.51,1,0,25,0,0,False,False,False,False,False,Discussion,https://b.thumbs.redditmedia.com/wB6l0cyAHWTL9hMqtOCZ0mgliUYxH9zXw173ZW6Sn5I.jpg,t3_1hcg20z
movies,"Hildur Guđnadóttir (‘Chernobyl’, ‘Joker’) to Score ‘28 Years Later Part II: The Bone Temple’",,SanderSo47,1hbf5xs,https://reddit.com/r/movies/comments/1hbf5xs/hildur_guđnadóttir_chernobyl_joker_to_score_28/,https://filmmusicreporter.com/2024/12/09/hildur-gudnadottir-to-score-nia-dacostas-28-years-later-part-ii-the-bone-temple/,2024-12-10 23:11:26,336,0.92,336,0,45,0,0,False,False,False,False,False,News,default,t3_1hbf5xs
movies,"Gene Kelly and Donald O'Connor - Moses Supposes, from ""Singin' in the Rain"" (1952)",,Amaruq93,1hbdzwr,https://reddit.com/r/movies/comments/1hbdzwr/gene_kelly_and_donald_oconnor_moses_supposes_from/,https://www.youtube.com/watch?v=OmrUJ3ssLPM,2024-12-10 22:19:07,386,0.91,386,0,51,0,0,False,False,False,False,False,Media,https://b.thumbs.redditmedia.com/hGQSheir9UjPovqxL8f3b7bmtPY1DqwhW1KY6l63fSU.jpg,t3_1hbdzwr
movies,The Substance,"I watched the substance last night for the second time and it amazed me the symbolism the film incorporated had.
Something I kind of would like to see one day with this film would be a gender reversed. Yes I know this movie is like a horror movie version of the Nutty Professor with Eddie Murphy.
This is what imagine for a plot. A bodybuilder guy who does workout tv program gets fired on his 50th birthday and then takes the substance to make younger better version of himself because the firing made him insecure of his self image. Then as usual the substance causes a bad side effect of progressing his age or making his physique worse.",hylian_lo3,1hcrdpb,https://reddit.com/r/movies/comments/1hcrdpb/the_substance/,https://www.reddit.com/r/movies/comments/1hcrdpb/the_substance/,2024-12-12 18:14:21,0,0.28,0,0,7,0,0,False,False,True,False,False,Discussion,self,t3_1hcrdpb
movies,What futuristic movie would you most like to live in?,"If you could go live in any movie with futuristic elements taking place in the future what universe/reality would you choose?

Must take place on Earth, nothing in space or another planet. 

Also include why .. and do you think it’s realistic that the elements could happen.. 

I.e. surrogates, to be able to role play in someone else

Bonus points if it’s dystopian!",brothenberg,1hbudwh,https://reddit.com/r/movies/comments/1hbudwh/what_futuristic_movie_would_you_most_like_to_live/,https://www.reddit.com/r/movies/comments/1hbudwh/what_futuristic_movie_would_you_most_like_to_live/,2024-12-11 14:14:51,19,0.72,19,0,74,0,0,False,False,True,False,False,Discussion,self,t3_1hbudwh
movies,Why do movie characters always wear suits in heists?,"I don't know if that's a cultural thing or reference to something, but i came to notice that 99% of movies , games and even things like anime always make it so that characters wear fancy suits when robbing a bank or something similar.  
I think that this is quite weird because a suit is hot, hard to run in, can't carry things like mags because of the small and tight pockets, etc etc; Not to mention that i think it would be pretty easy to pin point a guy buying ten 2000+ dollar suits. lmao  
I also don't recall EVER seeing this happening in real life, even less on the country i live in.

Is there any particular reason for this?",AnarchySecRed,1hcr7v4,https://reddit.com/r/movies/comments/1hcr7v4/why_do_movie_characters_always_wear_suits_in/,https://www.reddit.com/r/movies/comments/1hcr7v4/why_do_movie_characters_always_wear_suits_in/,2024-12-12 18:07:27,0,0.33,0,0,24,0,0,False,False,True,False,False,Discussion,self,t3_1hcr7v4
movies,Why do movies don't show real props and processes of elaborate things?,"I know the title is a bit confusing but I don't really know how to frame it. I don't know if this is the right subreddit to post this, but I don't know where else to ask it.

What I'm referring to is things like in the Spider-Man movies. The way for the mask to look so perfectly fitting when Peter is using it, is by using a some sort of plastic mold in the front, so that it has the perfectly round shape on top, the straight shape on the sides without the ears popping out, and the chin shape at the bottom. However, in all movies with all 3 spidermen, whenever they take off the mask or whenever the mask is shown separately, it doesn't have that, it just shows the mask as if it was just the fabric, with no shape. Also, the way that the mask fits so perfectly with the suit and doesn't look separated at all is that it really isn't separate, the whole suit is one piece. However, in the movies they show it as if it were separate parts like the mask, the torso, the gloves, and even the the feet as if they were boots.

And what I said about processes, what comes to mind is hair, mostly for men. A lot of times there are actors who in a film have a hairstyle that clearly requires things like hairdryer and product, but according to the movie, the hair just naturally is like that by just drying it with a towel. One example that comes to mind (even though it is in a show and not a movie) Harvey Specter in Suits. Another thing is that an actor has his hair styled a certain way, and then puts on a baseball cap or does a lot of physical activity or gets his hair wet either because of rain or by falling in water, and after that, the hair is still the same. That's literally impossible. And I know a lot of people are going to say ""duh, it's a movie, it's not real"", and I know that, but I think a bit of realism would be appreciated by some.

This is just something that I have been curious about for a long time.",santivega,1hcr93z,https://reddit.com/r/movies/comments/1hcr93z/why_do_movies_dont_show_real_props_and_processes/,https://www.reddit.com/r/movies/comments/1hcr93z/why_do_movies_dont_show_real_props_and_processes/,2024-12-12 18:08:55,0,0.22,0,0,9,0,0,False,False,True,False,False,Question,self,t3_1hcr93z
movies,Good Side of Bad - Official Trailer,,Bennett1984,1hc9ihz,https://reddit.com/r/movies/comments/1hc9ihz/good_side_of_bad_official_trailer/,http://www.youtube.com/watch?v=QPUi1JEv42A,2024-12-12 01:15:24,4,0.64,4,0,1,0,0,False,False,False,False,False,Trailer,https://a.thumbs.redditmedia.com/zR7vGBGI9VPZOG8HlvJ0mzQ3eGxX3rG51ty17aCOJE4.jpg,t3_1hc9ihz
movies,I wanna talk about the movie Coherence(Spoiler Alert),"I have watched the movie and I fucking loved it but I saw some people saying it is just okish,I guess they are trying to act like a cool dude online,buttbh I loved it,I saw a clip of a director who says we stay with the same Em in the entire film.and I guess the realities were already parallel in the start cause,some people arrived at different times and when they were talking their topics weren't matching,like I don't know what the name of the guy was and he said he was an actor of a show but Em said she loved the show but she didn't saw him in the show,if we listen to the first conversation carefully we can notice that their personal topics were not matching.",SeePunjab1,1hco3vk,https://reddit.com/r/movies/comments/1hco3vk/i_wanna_talk_about_the_movie_coherencespoiler/,https://www.reddit.com/r/movies/comments/1hco3vk/i_wanna_talk_about_the_movie_coherencespoiler/,2024-12-12 15:54:03,0,0.3,0,0,2,0,0,False,False,True,False,True,Discussion,spoiler,t3_1hco3vk
movies,"Opinion / discussion: examples of iconic actors (and well written roles I guess) are those who only played a very small movie part, but feel like were much bigger! ","I posted this is r/television, but then thought maybe there are examples in movies too! Original post below:

For example: I was amazed to learn that Shelly Long, who played DeDe Pritchett (ex wife of Jay) in Modern Family, only appeared in 8 episodes (out of the total 250)! I really couldn’t believe it when I read that. I would have never guess that and felt like she really made such an impact that I felt she was in way more episodes.

Another example is for me is Kathy Bates who played Jo Bennett in the office for 8 episodes as the CEO of Sabre (out of 188 episode total). Or can you imagine Game of Thrones without Jason Momoa as Khal Drogo? He was only in 11 episodes out of 73. 

Obviously as the title says it’s not only the actor but also how well written te part is, but still execution is key.

How do you guys feel about this opinion? Or do you feel it’s mostly how well written it is? Do you have any other examples?

",DoubleRNL,1hcl3ah,https://reddit.com/r/movies/comments/1hcl3ah/opinion_discussion_examples_of_iconic_actors_and/,https://www.reddit.com/r/movies/comments/1hcl3ah/opinion_discussion_examples_of_iconic_actors_and/,2024-12-12 13:28:41,0,0.25,0,0,9,0,0,False,False,True,False,False,Discussion,self,t3_1hcl3ah
movies,The Brutalist | Official Trailer 2,,KillerCroc1234567,1hb2cso,https://reddit.com/r/movies/comments/1hb2cso/the_brutalist_official_trailer_2/,https://youtu.be/GdRXPAHIEW4?si=_bYLapUy4E6kBC2r,2024-12-10 13:59:32,960,0.93,960,0,208,0,0,False,False,False,False,False,Trailer,https://b.thumbs.redditmedia.com/wfwB-0l-b7GH3lUVglaBn0tDZarGRVRg5T7w8VGrjaw.jpg,t3_1hb2cso
movies,Sean Baker on directing 'Anora' and the struggle to make an independent film...,"“With each film I make, especially the next one when I know there’s going to be more eyes on me…” He trails off and is momentarily silent. “I can’t even imagine the pressure for the next one. I’m going to have to see a therapist or something. I can’t go into the next one with this approach or I won’t make it through.” [https://www.thesaturdaypaper.com.au/share/19864/23daxMUf](https://www.thesaturdaypaper.com.au/share/19864/23daxMUf)",TalkingElvish,1hbka8t,https://reddit.com/r/movies/comments/1hbka8t/sean_baker_on_directing_anora_and_the_struggle_to/,https://www.reddit.com/r/movies/comments/1hbka8t/sean_baker_on_directing_anora_and_the_struggle_to/,2024-12-11 03:24:08,77,0.82,77,0,8,0,0,False,False,True,False,False,News,self,t3_1hbka8t
movies,Rita Moreno turns 93,"

Rita Moreno is a Puerto Rico-born American actress, dancer, and singer. Throughout her career spanning over 70 years, she has appeared in numerous film, television, and theater projects. Moreno's notable acting work includes supporting roles in the golden age of Hollywood musical films Singin' in the Rain (1952), The King and I (1956) and West Side Story (1961). She continued acting in films such as Popi (1969), Carnal Knowledge (1971), The Four Seasons (1981), I Like It Like That (1994) and the cult film Slums of Beverly Hills (1998). In 2021, she played Valentina in Steven Spielberg's film adaptation of West Side Story.


She is also known for her work on the children's television series The Electric Company (1971–1977) as well as a supporting role as Sister Peter Marie Reimondo on the HBO series Oz (1997–2003). She voiced the titular role of Carmen Sandiego in Where on Earth Is Carmen Sandiego? from 1994 to 1999. From 2017 to 2020, she portrayed the role of the matriarch Lydia Margarita del Carmen Inclán Maribona Leyte-Vidal de Riera in the 2017 remake of One Day at a Time. For theater, she is best known for her role as Googie Gomez in The Ritz for which she received a Tony Award. She also starred in a female revival of The Odd Couple (1985–86) alongside Sally Struthers and Tony Shalhoub.",PatientCalendar1000,1hbn5mj,https://reddit.com/r/movies/comments/1hbn5mj/rita_moreno_turns_93/,https://www.reddit.com/r/movies/comments/1hbn5mj/rita_moreno_turns_93/,2024-12-11 06:11:47,41,0.68,41,0,8,0,0,False,False,True,False,False,News,self,t3_1hbn5mj
movies,Good movies or shows about colonisation ?,"I really like history and one of the things that I find extremely interesting is exploring and discovering new lands as well as developing them. Are there any movies or shows about the viking landings in Newfoundland or about Columbus discovering Central America, or movies and shows about settlers building their colonies and their struggle for survival, or any media about such things? It can be historical or fictional but I want to see if there are any! Thanks a lot in advance!!",AliTechMemes,1hc4n65,https://reddit.com/r/movies/comments/1hc4n65/good_movies_or_shows_about_colonisation/,https://www.reddit.com/r/movies/comments/1hc4n65/good_movies_or_shows_about_colonisation/,2024-12-11 21:30:10,3,0.55,3,0,22,0,0,False,False,True,False,False,Recommendation,self,t3_1hc4n65
movies,Deja Vu (2006),"So I just watched this, and I'm confused about the third act.

The movie very strongly suggests that there is only one, immutable timeline in the manner of 12 Monkeys.

We learn that the main character's partner is inexplicably killed in the ferry attack. Later we see the scientists send a warning back, which is intercepted by the partner and explains why he was killed. This is one timeline then: that note was *always* there for the partner to find

When the main character himself goes back in time, everything he does is stuff that already happened. His finger prints were found all over the house because he'd *always* traveled back in time to touch stuff. The bloody tissue was on the garbage because he'd *always* gone back in time to leave it there, etc. In this scene he realizes that this has always happened this way and then... suddenly changes things?

Did I miss something, or is this a glaring plot hole? He's been trying to use his knowledge of the future to change things for half the films runtime, only to be consistently thwarted with the realization that he'd *always* done those things. His foreknowledge consistently fails him because by trying to apply it, he's just ensuring that things happen the way they already happened. So how is he able to just suddenly change things at the end? What's different about that instance?",AnAquaticOwl,1hc4jdf,https://reddit.com/r/movies/comments/1hc4jdf/deja_vu_2006/,https://www.reddit.com/r/movies/comments/1hc4jdf/deja_vu_2006/,2024-12-11 21:25:40,1,0.55,1,0,4,0,0,False,False,True,False,False,Spoilers,self,t3_1hc4jdf
movies,Recent movie styles/trends that you don't like? ,"I've noticed that most movies tend to become more of the same, especially this:

\- Action movie that tries to be nitty gritty? Lower the colors, make everything green/gray and film shaky hand style during the adrenaline/fight scene. During the 2000's, the movies would try to at least choreograph an admirable fight scene and the camera 's point of view would be at least steady

\- There are almost no epilogues for romantic movies. They basically roll the credits as soon the couple kiss. We don't get a moment to catch our breath or appreciate whatever is happening and boom the credits starts. The epilogues doesn't even need to be a 5 minute if you want to cheapen the budget. Just a minute or something to show what the future holds. Even the side characters doesn't really get their side plot resolved or hear about it what happened.

\- Movie intro. In the 90's en 00's, we would hear music, the introduction names start, we see the main character start their morning/life/moment and there is a minute of no talk. We just get a sense of what their life is before the main plot starts. Now it's bam, immediately start and it takes us a lot more minutes before finding out the gist and we have to remember everything because of possible plot relevance. And the title comes just before the credits roll.

\- Car riding scenes: 80's and early 90's could get away with this because the technology wasn't quite there yet: Green screen driving. Back then, they could hide this by filming in the dark and have the character sway the wheel furiously from left to right and back to indicate he/she is driving all while telling us the problem in thoughts. Nowadays they film with a green screen, especially when we see it from sideways. The scenery is also a bit blurry, giving us a stark contrast when the characters and the car itself is in crisp 4K quality. I see this style getting back more and more.

What is your thing that you don't like, that has been happening lately? I'm not asking about the main character grabbing a toast from a full breakfast spread and heading off examples. ",Maatjuhhh,1hc938j,https://reddit.com/r/movies/comments/1hc938j/recent_movie_stylestrends_that_you_dont_like/,https://www.reddit.com/r/movies/comments/1hc938j/recent_movie_stylestrends_that_you_dont_like/,2024-12-12 00:54:38,1,0.52,1,0,24,0,0,False,False,True,False,False,Discussion,self,t3_1hc938j
movies,"Sundance 2025: JLo, Sly Stone, Putin, Ayo Edebiri, André Holland, &amp; Ex-NZ PM Jacinda Ardern Films Among Park City Festival Offerings",,Puzzled-Tap8042,1hbyfso,https://reddit.com/r/movies/comments/1hbyfso/sundance_2025_jlo_sly_stone_putin_ayo_edebiri/,https://deadline.com/2024/12/sundance-film-festival-lineup-2025-movies-1236200107/,2024-12-11 17:12:06,4,0.58,4,0,1,0,0,False,False,False,False,False,News,https://b.thumbs.redditmedia.com/tR74KbCN31y-9aopc8GJodnuY3eiOTlrWr1GSW2jxQQ.jpg,t3_1hbyfso
movies,"Pan-Indian cinema: A plague of tiring sequels, buzzkill cliffhangers, ineffective cameos and half-films",,sidroy81,1hbmh7e,https://reddit.com/r/movies/comments/1hbmh7e/panindian_cinema_a_plague_of_tiring_sequels/,https://www.thehindu.com/entertainment/movies/pan-indian-cinema-a-plague-of-tiring-sequels-buzzkill-cliffhangers-ineffective-cameos-and-half-films/article68968430.ece/,2024-12-11 05:27:51,31,0.65,31,0,6,0,0,False,False,False,False,False,News,https://b.thumbs.redditmedia.com/9rxTkOeU4qAwiJvy0_PO0v1V0h-FGyhcp6SgYvskISg.jpg,t3_1hbmh7e
movies,David Lean’s “Brief Encounter” and my paradoxical experience watching “classic” films,"I have a hard time placing my genuine thoughts towards judging older films from before the 60s, mainly stuff around the Hays Code era, as a lot of them maintain a place in the film canon by having been ahead of their time, or at least timeless enough to still be watchable in 2024. Having seen Brief Encounter last night, I didn’t fall in love with it but there are some sparkingly modern filmmaking techniques and creativity that must’ve been distinct at the time. I’m thinking of shots like the dream sequence Celia’s character has when reflected in the train window, it has this ethereal quality to it with the ornate lights that would feel very fitting to a new release today, and the “madness tilt” zoom on her when she contemplates suicide after the man leaves. Plus the whole recontextualisng of the beginning is very slickly done and easy to love. However, and this may be the jaded part of refusing myself emotional attachment to it, but like lots of classic revered titles I can’t tell if I like it for the film or the filmmaking. It’s difficult to decipher where my investment in the story ends with a recognition of how ahead-of-its-time a certain film was. 

This could be a wider humbug I have when it comes to my personal assessment of films in the “canon” and at the risk of overcomplicating matters, but when they have such a long reputation and are held up in every conversation about being essential viewing and/or revolutionary, it feels like an inevitable shadow on the film as I’m watching. I’m not just watching Brief Encounter, I’m watching David Lean’s universally acclaimed 1945 classic Brief Encounter. 

If this post ends up sounding more like an overly verbose rephrasing of “letting expectations hamper my viewing experience” then apologies for that, but it’s an issue I encounter regularly whenever I dip my toes into this circle of the movie world. ",Classic_Bass_1824,1hch4p3,https://reddit.com/r/movies/comments/1hch4p3/david_leans_brief_encounter_and_my_paradoxical/,https://www.reddit.com/r/movies/comments/1hch4p3/david_leans_brief_encounter_and_my_paradoxical/,2024-12-12 09:05:31,0,0.41,0,0,4,0,0,False,False,True,False,False,Discussion,self,t3_1hch4p3
movies,Angelina Jolie &amp; Cynthia Erivo | Actors on Actors,,NoCulture3505,1hcp2j5,https://reddit.com/r/movies/comments/1hcp2j5/angelina_jolie_cynthia_erivo_actors_on_actors/,https://youtu.be/sIxjJznFhrA?si=rco3e6pclmUWGb-H,2024-12-12 16:36:05,0,0.28,0,0,3,0,0,False,False,False,False,False,Media,https://b.thumbs.redditmedia.com/pe1xvU3SdYSPti5mSO63ZZgJoQWAxkTGET704zXDo9k.jpg,t3_1hcp2j5
movies,Chris Evans Sets Marvel Return in ‘Avengers: Doomsday’ ,,MarvelsGrantMan136,1han3vi,https://reddit.com/r/movies/comments/1han3vi/chris_evans_sets_marvel_return_in_avengers/,https://www.thewrap.com/chris-evans-avengers-doomsday-cast-marvel/,2024-12-09 23:01:58,11897,0.88,11897,0,1928,0,0,False,False,False,False,False,News,https://b.thumbs.redditmedia.com/Qw8GnyhDDa2Vg36lZKsbsXLHT7FZYo5z9tezZGLtelI.jpg,t3_1han3vi
movies,Is it fair to rank John Turturro as one of this generations great actors?,"He is so goddamn good in every movie and TV show i’ve ever seen him in, no matter how big, small or varied the part is he simply crushes it. He is excellent in any role in any genre. I’ve seen him be hilarious, terrifying, cool and/or pathetic. The ultimate character actor in my book. He has a few awards but deserves so many more.",Rosstin316,1hb8nnh,https://reddit.com/r/movies/comments/1hb8nnh/is_it_fair_to_rank_john_turturro_as_one_of_this/,https://www.reddit.com/r/movies/comments/1hb8nnh/is_it_fair_to_rank_john_turturro_as_one_of_this/,2024-12-10 18:33:30,223,0.79,223,0,160,0,0,False,False,True,False,False,Discussion,self,t3_1hb8nnh
movies,"After watching Salaar, Tiger 3 and Devara, how do you describe the ""Aesthetic"" of modern Indian movies?","After watching Salaar, Tiger 3 and Devara, how do you describe the ""Aesthetic"" of modern Indian movies?

Recently I watched the Indian movie ""Devara"" starring N. T. Rama Rao Jr. of RRR, and just like RRR the movie was astonishing. There's something about modern Indian movies of the last 15 years. The Aesthetic (?) is something else. I don't know any other word, because the movies are so unique. They way male characters stand on their word, the emphasis on concern for family and the community, the hero and villains' willingness to resort to cartoonish levels of violence, the preserving of women's virtues unless it's a colourful pop video in the middle and repeated fanfare when the hero appears or begins killing people. 

I always start laughing uncontrollably at these moments but I am throughly entertained! Are there any books or online articles that explain this style of filmmaking and why Indian producers believe or know this is what their audience responds to? The closest thing I can think of is like Michael Bay, but on a budget! Because I think the directors draw on a lot of elements of music videos &amp; commercials throughout the films through colour schemes, cinematography, family scenes, fight sequences and of course the pop songs. 

Are there any Hollywood movies made like these? I know Hollywood only just recognized RRR, but there must be something good about what the Indian filmmakers are doing as they show a hell of a lot more imagination and are determined to give their audiences spectacle on what is Hollywood mid-budgets. 

[Salaar Trailer](https://www.youtube.com/watch?v=9Im1q4gvk1M)

[Tiger 3 Trailer](https://www.youtube.com/watch?v=vEjTUDjjU6A)

[Devara Trailer](https://www.youtube.com/watch?v=Xg0vBOxV2to)",MorePea7207,1hclbz9,https://reddit.com/r/movies/comments/1hclbz9/after_watching_salaar_tiger_3_and_devara_how_do/,https://www.reddit.com/r/movies/comments/1hclbz9/after_watching_salaar_tiger_3_and_devara_how_do/,2024-12-12 13:41:33,0,0.2,0,0,0,0,0,False,False,True,False,False,Discussion,self,t3_1hclbz9
