subreddit,title,selftext,author,id,permalink,url,created_utc,score,upvote_ratio,ups,downs,num_comments,total_awards_received,gilded,is_video,is_original_content,is_self,over_18,spoiler,link_flair_text,thumbnail,name
science,The first ice-free day in the Arctic Ocean could occur before 2030,,Creative_soja,1h5ozys,https://reddit.com/r/science/comments/1h5ozys/the_first_icefree_day_in_the_arctic_ocean_could/,https://www.nature.com/articles/s41467-024-54508-3,2024-12-03 14:45:31,151,0.92,151,0,18,0,0,False,False,False,False,False,Environment,https://b.thumbs.redditmedia.com/0Rs4PtPufEh8AyGPqewXroVl-8uHrOtwjPCLRUMp0ls.jpg,t3_1h5ozys
science,"A study of medical cannabis patients found that ""that adult use laws decreased stress and legal concerns, and that patient perceptions of cannabis product quality and availability were higher, but prices were also higher.""",,OregonTripleBeam,1h5pu9t,https://reddit.com/r/science/comments/1h5pu9t/a_study_of_medical_cannabis_patients_found_that/,https://www.tandfonline.com/doi/full/10.1080/02791072.2024.2430608,2024-12-03 15:21:52,36,0.89,36,0,12,0,0,False,False,False,False,False,Social Science,default,t3_1h5pu9t
science,Clinical trial at Emory University reveals twice-yearly injection to be 99% effective in HIV prevention,,shahmegha053,1h5q27m,https://reddit.com/r/science/comments/1h5q27m/clinical_trial_at_emory_university_reveals/,https://news.emory.edu/stories/2024/11/hs_lenacapavir_trial_27-11-2024/story.html,2024-12-03 15:31:07,30,1.0,30,0,3,0,0,False,False,False,False,False,Medicine,https://b.thumbs.redditmedia.com/yFNSmp0Jwk-PgF6M1Nk0fNenGkHk01s1JvZpJl00JJs.jpg,t3_1h5q27m
science,"The richest 1% of the world’s population produces 50 times more greenhouse gasses than the 4 billion people in the bottom 50%, finds a new study across 168 countries. If the world’s top 20% of consumers shifted their consumption habits, they could reduce their environmental impact by 25 to 53%.",,mvea,1h5gc9c,https://reddit.com/r/science/comments/1h5gc9c/the_richest_1_of_the_worlds_population_produces/,https://www.rug.nl/fse/news/climate-and-nature/can-we-live-on-our-planet-without-destroying-it,2024-12-03 05:33:06,6391,0.96,6391,0,342,0,0,False,False,False,False,False,Environment,https://b.thumbs.redditmedia.com/L_pUhYBY4jydl2PxTRdh9M2NofW46qT9HKiAMt65ZXc.jpg,t3_1h5gc9c
science,"Study supports the safety of soy foods, finding that eating them 'had no effect on key markers of estrogen-related cancers'",,nationalpost,1h59p6p,https://reddit.com/r/science/comments/1h59p6p/study_supports_the_safety_of_soy_foods_finding/,https://nationalpost.com/life/food/does-soy-cause-cancer?utm_source=reddit&amp;utm_medium=organic&amp;utm_campaign=NP_social,2024-12-02 23:52:29,8377,0.94,8377,0,406,0,0,False,False,False,False,False,Health,https://b.thumbs.redditmedia.com/Iw4Ey6meleCQk4keSF4b2DfZJFkSc0GoZ3yo8SU3GWU.jpg,t3_1h59p6p
science,"Black students are punished more often | Researchers analyzed Black representation across six types of punishment, three comparison groups, 16 sub populations, and seven types of measurement. Authors say no matter how you slice it, Black students are over represented among those punished.",,Hashirama4AP,1h5fteb,https://reddit.com/r/science/comments/1h5fteb/black_students_are_punished_more_often/,https://publichealth.berkeley.edu/news-media/research-highlights/black-students-are-punished-more-often,2024-12-03 05:02:36,2537,0.79,2537,0,505,0,0,False,False,False,False,False,Social Science,https://a.thumbs.redditmedia.com/zib73xcGGreqTSODRTMLa3UR4DxlI4wHDkf1mDlxXQ0.jpg,t3_1h5fteb
science,Stimulating hypothalamus restores walking in paralyzed patients - deep brain stimulation therapy restored enough leg control in two individuals with partial spinal injuries to walk unaided and even climb stairs.,,mvea,1h5kw7v,https://reddit.com/r/science/comments/1h5kw7v/stimulating_hypothalamus_restores_walking_in/,https://actu.epfl.ch/news/stimulating-hypothalamus-restores-walking-in-par-3/,2024-12-03 10:59:40,305,0.99,305,0,8,0,0,False,False,False,False,False,Neuroscience,https://b.thumbs.redditmedia.com/zGy_gesk1X4ljwTQnbXOrbbGRPC2w0KLXQfJFJ_DZps.jpg,t3_1h5kw7v
science,"Researchers deal a blow to theory that Venus once had liquid water on its surface | Scientists say an analysis of the planet’s atmosphere has revealed the interior of Venus is dry, suggesting it has never had the oceans of liquid water traditionally thought necessary for life to begin.",,chrisdh79,1h5m1d1,https://reddit.com/r/science/comments/1h5m1d1/researchers_deal_a_blow_to_theory_that_venus_once/,https://www.cam.ac.uk/research/news/researchers-deal-a-blow-to-theory-that-venus-once-had-liquid-water-on-its-surface,2024-12-03 12:13:38,233,0.98,233,0,14,0,0,False,False,False,False,False,Astronomy,default,t3_1h5m1d1
science,"Employees think watching customers increases tips. New research shows that customers don't always tip more when they feel watched, but they are far less likely to recommend or return to the business.",,tipping_researcher,1h4vd4p,https://reddit.com/r/science/comments/1h4vd4p/employees_think_watching_customers_increases_tips/,https://theconversation.com/tip-pressure-might-work-in-the-moment-but-customers-are-less-likely-to-return-242089,2024-12-02 13:49:27,20422,0.96,20422,0,1225,0,0,False,False,False,False,False,Social Science,https://b.thumbs.redditmedia.com/qW5ugGpArC1vAG0Y75-0ACii418ItD4QHvU9qF_JcNM.jpg,t3_1h4vd4p
science,"Water can be a powerful tool for peace when managed sustainably and equitably, but there is increasing conflict for water as an irreplaceable resource for humans. A new study provides a blueprint to ensure safe, equitable and sustainable global access to clean water.",,mvea,1h5m0h3,https://reddit.com/r/science/comments/1h5m0h3/water_can_be_a_powerful_tool_for_peace_when/,https://www.birmingham.ac.uk/news/2024/strategies-for-safe-and-equitable-access-to-water-a-catalyst-for-global-peace-and-security,2024-12-03 12:12:04,178,0.94,178,0,7,0,0,False,False,False,False,False,Environment,https://b.thumbs.redditmedia.com/7FtJWkqZBHQul1FuTqGcXjSLbibGH_JLfh7BV5NZqvw.jpg,t3_1h5m0h3
science,"An unexpected ice collapse hints at worrying changes on the Antarctic coast. The coastal waters in the area have historically been quite cold, but small changes began around 2010. Ocean currents shifted, allowing water that was 0.6 degrees Celsius warmer than before to intrude toward the coastline",,Wagamaga,1h5l60p,https://reddit.com/r/science/comments/1h5l60p/an_unexpected_ice_collapse_hints_at_worrying/,https://www.sciencenews.org/article/unexpected-ice-collapse-antarctic-coast,2024-12-03 11:18:17,199,0.95,199,0,4,0,0,False,False,False,False,False,Environment,https://b.thumbs.redditmedia.com/Zw5d8G2779B0ODDtDSv8VjN1wcv_sVLcLf67ku8Vxdo.jpg,t3_1h5l60p
science,Men who adhere to traditional gender roles or masculine ideologies face more than double the risk of suicide,,giuliomagnifico,1h4xkld,https://reddit.com/r/science/comments/1h4xkld/men_who_adhere_to_traditional_gender_roles_or/,https://www.snf.ch/en/HTIYFmVEjJyqgfkE/news/conforming-to-roles-increases-mens-risk,2024-12-02 15:30:53,6887,0.9,6887,0,903,0,0,False,False,False,False,False,Social Science,https://a.thumbs.redditmedia.com/SO6eRjJ5jSJ9ZVAchXCVMIiIf3RmyvgQQdoclLdmMA8.jpg,t3_1h4xkld
science,"Temporary scalp e-tattoos that scan brain could replace traditional EEGs | Scientists have created a liquid ink that can be sprayed directly onto a person’s scalp, forming an ultra-thin electronic tattoo. This “tattoo” EEG listens to the brain beneath it.",,chrisdh79,1h5mvya,https://reddit.com/r/science/comments/1h5mvya/temporary_scalp_etattoos_that_scan_brain_could/,https://www.cell.com/cell-biomaterials/fulltext/S3050-5623(24)00004-7,2024-12-03 13:02:18,57,0.94,57,0,2,0,0,False,False,False,False,False,Materials Science,default,t3_1h5mvya
science,An alarming increase in people under 50 being diagnosed with bowel cancer has prompted researchers to urge people to increase fibre intake and improve eating habits. A diet high in healthy fats and vegetables whilst limiting sugars and alcohol could potentially reduce the risk of bowel cancer.,,mvea,1h4sxmg,https://reddit.com/r/science/comments/1h4sxmg/an_alarming_increase_in_people_under_50_being/,https://www.scimex.org/newsfeed/deadly-diets-driving-digestive-diseases,2024-12-02 11:32:04,4144,0.99,4144,0,179,0,0,False,False,False,False,False,Cancer,https://b.thumbs.redditmedia.com/PqZ5_ruHJM-Duy0NsLyjfzSbQ4ZIvrGfAEoOHGZSJrg.jpg,t3_1h4sxmg
science,"Researchers reveal what men and women envy in each other — and discover a new form of envy | Research found that women tend to envy men for their perceived social advantages and biological freedoms, while men envy women for their physical attractiveness and traditional roles, such as motherhood.",,chrisdh79,1h4ug5n,https://reddit.com/r/science/comments/1h4ug5n/researchers_reveal_what_men_and_women_envy_in/,https://www.psypost.org/researchers-reveal-what-men-and-women-envy-in-each-other-and-discover-a-new-form-of-envy/,2024-12-02 13:01:54,2934,0.93,2934,0,490,0,0,False,False,False,False,False,Psychology,https://a.thumbs.redditmedia.com/03siz0n2NYvMU8YZ0JpJvZ-OqZmjj5vE77_6L4OspK4.jpg,t3_1h4ug5n
science,"Feeding Grazing Cattle Seaweed Cuts Methane Emissions by Almost 40% | Researchers conducted a 10-week experiment with grazing cattle, where seaweed supplement is provided in pellet form. This resulted in a nearly 40% cut in emissions without affecting their health or weight.",,Hashirama4AP,1h563vz,https://reddit.com/r/science/comments/1h563vz/feeding_grazing_cattle_seaweed_cuts_methane/,https://www.ucdavis.edu/food/news/feeding-grazing-cattle-seaweed-cuts-methane-emissions-almost-40,2024-12-02 21:19:17,371,0.96,371,0,22,0,0,False,False,False,False,False,Animal Science,https://b.thumbs.redditmedia.com/FBjCkdPOx_cujG8AB5DnXt6D-CxdZQv0CJ9c9CiR0dE.jpg,t3_1h563vz
science,‘I don’t feel your pain’: Alcohol’s ability to increase people’s pain threshold is one reason that drinking also leads to more aggressive behavior.,,geoff199,1h4vlwx,https://reddit.com/r/science/comments/1h4vlwx/i_dont_feel_your_pain_alcohols_ability_to/,https://news.osu.edu/i-dont-feel-your-pain-how-alcohol-increases-aggression/?utm_campaign=omc_science-medicine_fy24&amp;utm_source=reddit&amp;utm_medium=social,2024-12-02 14:01:26,1324,0.97,1324,0,14,0,0,False,False,False,False,False,Psychology,https://b.thumbs.redditmedia.com/BdyN8oQFRSatZoxX8FOOo5darVJa_TZs1QwHWmNPc-E.jpg,t3_1h4vlwx
science,Pregnancy enhances natural immunity to block severe flu | Scientists discover a natural flu defense mechanism that activates in the nasal cavity during pregnancy,,FunnyGamer97,1h5fpju,https://reddit.com/r/science/comments/1h5fpju/pregnancy_enhances_natural_immunity_to_block/,https://www.mcgill.ca/newsroom/channels/news/pregnancy-enhances-natural-immunity-block-severe-flu-361713,2024-12-03 04:56:46,80,0.91,80,0,7,0,0,False,False,False,False,False,Health,https://b.thumbs.redditmedia.com/GaJ00R_EBSGf0_8yiIQ3McL42c7171KGq56rHzOpsQU.jpg,t3_1h5fpju
science,"Study of  US Crisis Pregnancy Centers Reveals Misleading and Dangerous Claims. Research found that 30% of CPC websites promoted ""abortion pill reversal,"" with some centers directly targeting women who might regret starting a medication abortion.",,Wagamaga,1h4zl6g,https://reddit.com/r/science/comments/1h4zl6g/study_of_us_crisis_pregnancy_centers_reveals/,https://today.ucsd.edu/story/study-of-crisis-pregnancy-centers-reveals-misleading-and-dangerous-claims,2024-12-02 16:55:38,711,0.94,711,0,23,0,0,False,False,False,False,False,Health,https://b.thumbs.redditmedia.com/bbL9J0fGK6h24eZun7l7cUMvHeMn0HXzFHkp-WZ4O6A.jpg,t3_1h4zl6g
science,"Giant hornets have been sighted in Europe for the first time | It’s going to attack an awful lot of things,” including other wasps, insects and even small vertebrates like geckos. “So if it gets established and abundant, it could be a real issue.”",,chrisdh79,1h4v5wf,https://reddit.com/r/science/comments/1h4v5wf/giant_hornets_have_been_sighted_in_europe_for_the/,https://www.sciencenews.org/article/giant-hornets-europe-first-sighting,2024-12-02 13:39:23,979,0.98,979,0,45,0,0,False,False,False,False,False,Biology,https://b.thumbs.redditmedia.com/-gItxOj10DUPANhsfYWM4OJyoep3gi2cT1GA522_CTA.jpg,t3_1h4v5wf
science,"New study showing that both men and women overestimate the facial appearance that the opposite-sex desires, which was associated with greater dissatisfaction of one's own appearance",,belledenuit,1h4y1jx,https://reddit.com/r/science/comments/1h4y1jx/new_study_showing_that_both_men_and_women/,https://journals.plos.org/plosone/article?id=10.1371/journal.pone.0310835,2024-12-02 15:51:18,634,0.94,634,0,78,0,0,False,False,False,False,False,Neuroscience,https://b.thumbs.redditmedia.com/6c2cOC8t4iP1SNhxyzkS00K7SoyILTudZaeYX6TAUfM.jpg,t3_1h4y1jx
science,"Men at risk of cardiovascular disease, including obesity, develop cognitive conditions up to a decade earlier than similarly at-risk women due to accelerated brain volume loss in the temporal lobe, which is crucial for memory and sensory processing",,giuliomagnifico,1h4z2f6,https://reddit.com/r/science/comments/1h4z2f6/men_at_risk_of_cardiovascular_disease_including/,https://www.imperial.ac.uk/news/258793/men-high-risk-heart-disease-face/,2024-12-02 16:33:49,458,0.97,458,0,6,0,0,False,False,False,False,False,Neuroscience,https://a.thumbs.redditmedia.com/wo8eFXuJltZON4GPY9_SdIBVBt88AvOpVgPE9o-SwZ4.jpg,t3_1h4z2f6
science,Wastewater surveillance: Wastewater is full of inhibitors which interfere with molecular analyses (i.e. PCR and sequencing). Removing these inhibitors improves the interpretability of wastewater-based epidemiology.,,nocdev,1h5j7nj,https://reddit.com/r/science/comments/1h5j7nj/wastewater_surveillance_wastewater_is_full_of/,https://doi.org/10.3390/microorganisms12122475,2024-12-03 08:54:27,21,0.85,21,0,1,0,0,False,False,False,False,False,Epidemiology,https://b.thumbs.redditmedia.com/s2EkTsDsUKA0WD6-9eJPr2aKvYuzc4LYnUA-AR3-4FM.jpg,t3_1h5j7nj
science,Nationwide cohort study demonstrate no link between childhood Lyme neuroborreliosis and neurodevelopmental disorders like ADHD or learning difficulties. These findings support current guidelines and provide reassurance that Lyme neuroborreliosis does not cause developmental issues in children.,,PerspectiveOk5317,1h5o4j2,https://reddit.com/r/science/comments/1h5o4j2/nationwide_cohort_study_demonstrate_no_link/,https://doi.org/10.1111/jcpp.14079,2024-12-03 14:04:57,7,0.9,7,0,1,0,0,False,False,False,False,False,Medicine,default,t3_1h5o4j2
science,"Eating more fruits and vegetables may help reduce depression in adults over 45, suggests new study of 3,483 twins across 4 countries, a discovery that emphasises the power of diet, particularly fibre and micronutrients, in boosting mental health. ",,mvea,1h4oqow,https://reddit.com/r/science/comments/1h4oqow/eating_more_fruits_and_vegetables_may_help_reduce/,https://www.scimex.org/newsfeed/link-between-low-fruit-and-vegetable-intake-and-depression-shown-in-twin-studies,2024-12-02 06:27:54,2434,0.97,2434,0,37,0,0,False,False,False,False,False,Health,https://b.thumbs.redditmedia.com/BiTH2vH-KfrlFTGrCk2MZW_c-EiDMtaL674WmoQXjtY.jpg,t3_1h4oqow
