subreddit,title,selftext,author,id,permalink,url,created_utc,score,upvote_ratio,ups,downs,num_comments,total_awards_received,gilded,is_video,is_original_content,is_self,over_18,spoiler,link_flair_text,thumbnail,name
gaming,Indiana Jones and The Great Circle Teases First DLC Details,,windywilli,1h5yhuz,https://reddit.com/r/gaming/comments/1h5yhuz/indiana_jones_and_the_great_circle_teases_first/,https://gamerant.com/indiana-jones-great-circle-dlc-order-giants-rome/,2024-12-03 21:19:35,0,0.39,0,0,49,0,0,False,False,False,False,False,,https://b.thumbs.redditmedia.com/FXRPZneZgJtIaO5P2p2Du9xUAeQaZRH3HJKfb8Hq5uc.jpg,t3_1h5yhuz
gaming,Its absolutely fascinating and somewhat seeing all the concept art that was made for Concord. The artists really put their best foot forward for a project that would turn out so underwhelming.,,Umikaloo,1h5xitz,https://reddit.com/r/gaming/comments/1h5xitz/its_absolutely_fascinating_and_somewhat_seeing/,https://www.artstation.com/artwork/oJ2nxB,2024-12-03 20:39:07,0,0.43,0,0,12,0,0,False,False,False,False,False,,https://b.thumbs.redditmedia.com/h95QVK0k6vgN5Effjo9kKo-8CbhVq7ik74nUCBQ9EUc.jpg,t3_1h5xitz
gaming,"Say what you will about Ubisoft, but their collabs with Nintendo are pretty great",,Instance-Dependent,1h6efxu,https://reddit.com/r/gaming/comments/1h6efxu/say_what_you_will_about_ubisoft_but_their_collabs/,https://i.redd.it/8a8bonx6ot4e1.jpeg,2024-12-04 12:05:19,0,0.35,0,0,13,0,0,False,False,False,False,False,,https://b.thumbs.redditmedia.com/Z1umOKsXGcPjZfQ6iXmcz60nLwE5tkg3FCjhocAxeTY.jpg,t3_1h6efxu
gaming,GTA Online: Agents of Sabotage DLC Trailer,,EarthPuma120,1h5rg2u,https://reddit.com/r/gaming/comments/1h5rg2u/gta_online_agents_of_sabotage_dlc_trailer/,https://youtu.be/T3ZaWDcPiIo?si=zxcIQwyKEYB-nxn6,2024-12-03 16:30:16,0,0.25,0,0,2,0,0,False,False,False,False,False,,https://b.thumbs.redditmedia.com/Gzuxfe-jV_rFIXeNImKSB_Nxt-cLp3mnu1BJiAfBHWU.jpg,t3_1h5rg2u
gaming,Soulslike Are Killing The Character Action Hack And Slash Genre,"I remember before the PS4/XBO gen we used to get a lot of character action games with hack and slash DMC style combat, wall running and double jumping, QTEs, giant collosal bosses etc. We dont get games like DMC, God of War trilogy, Prince of Persia trilogy, Ashura's Wrath, Darksiders, Metal Gear Rising etc anymore. The closest recent games are Stellar Blade, Nier, KH3, and Bayonetta 3. The silver lining is that it seems atleast Chinese devs are interested in keeping the genre alive, if games like Lost Soul Aside, Where Winds Meet, and Project Perciever are as good as their trailer like Black Myth was then that will be amazing

Now every game wants to have soulslike mechanics like a bonfire rest/save point that respawns enemies, losing resources on death, single target lock on combat focused around parry and dodge roll, etc",Imaginary_Cause2216,1h6ej0b,https://reddit.com/r/gaming/comments/1h6ej0b/soulslike_are_killing_the_character_action_hack/,https://www.reddit.com/r/gaming/comments/1h6ej0b/soulslike_are_killing_the_character_action_hack/,2024-12-04 12:10:33,0,0.42,0,0,30,0,0,False,False,True,False,False,,self,t3_1h6ej0b
gaming,If  you had a choice which would you choose between console and keyboard?,"I can't upgrade this computer to Windows 10 ( yes I know I can bypass the test) but i'm leery of doing that and then Microsoft decides to disable my computer  when the next Windows comes out.

So i'm contemplating making some changes. 

I'm trying to decide which would be a better way to go.

A console or a  new desktop or a laptop.

I've always played with keyboard because there are so many more action possibilities but maybe this would be a good time to simplify and use a gaming laptop to cast  to my big screen tv. A TCl  with a beautiful picture.

Wouldnt a gaming laptop give me the best of both worlds? Smaller size but stlll has a keyboard.

As I understand it, with a gaming laptop I can project sound and picture to my TV.

Right?

  
I know its a matter of preference but i'm wondering which route most people would take.

Presume you can spend around 2,000 without getting divorced. ",Arizona-Willie,1h5zzrq,https://reddit.com/r/gaming/comments/1h5zzrq/if_you_had_a_choice_which_would_you_choose/,https://www.reddit.com/r/gaming/comments/1h5zzrq/if_you_had_a_choice_which_would_you_choose/,2024-12-03 22:21:15,0,0.06,0,0,24,0,0,False,False,True,False,False,,self,t3_1h5zzrq
gaming,War rock. You remember it now. ,,Kachelpiepn,1h5qmgg,https://reddit.com/r/gaming/comments/1h5qmgg/war_rock_you_remember_it_now/,https://i.redd.it/2tdhl8daon4e1.jpeg,2024-12-03 15:55:09,0,0.35,0,0,10,0,0,False,False,False,False,False,,https://b.thumbs.redditmedia.com/67q0Ang0W22VIbkx-xo4ay18SFCZX1Ixxqfd_JM6HEQ.jpg,t3_1h5qmgg
gaming,I actually found a good mobile game and I want to talk about it. ,"The name of the game is Arcane Rush Battlegrounds. 

It’s a battleroyale card game that’s perfect for folks looking for a TFT like experience but something more casual. 

The game starts with 2 groups of 8, the top 4 players of each group then duke it out to find the top player. The original group stage is based on points and the second stage everyone gets 3 life and last one standing wins. 

The cool thing with this is that you’re playing against offline players. So there is no time pressure if something comes up which is great. I found that in the beginning it was very easy to score first place as I am getting to higher ranks I do take some losses against the AI. You earn gold for each elimination you achieve while offline. 

There is also an arena that takes your top builds from the battleroyale to test them against other players and I have found this to be very challenging. 

The game has dealers that have their own cards, and a hero collection they can draft from every game. On top of their being a number of unique races to play while in game each with their own strategy. My personal favourite race are demons and the discard strategy they play with. 

The only time the game pushes ads is to gain extra gold rewards or arena battle chances. Otherwise there are no ads. 

The negative, each of the races are kind of insular, there isn’t many combos to be found. If you start building a race your only real option is to fully build that race since they are all designed to work with themselves. Also the cost of upgrading your dealers is high,300 gold a shot where dailies may not give you enough to enough gold for an upgrade. There are currently 2 dealers with a third on the way and I hope they make some changes to upgrade costs or the amount of gold you can get. 

Well that’s the long and short of it. I hope you all check it out because I have had an overwhelmingly positive experience with the game. 

Thank you. ",Archereus,1h62ihp,https://reddit.com/r/gaming/comments/1h62ihp/i_actually_found_a_good_mobile_game_and_i_want_to/,https://www.reddit.com/r/gaming/comments/1h62ihp/i_actually_found_a_good_mobile_game_and_i_want_to/,2024-12-04 00:10:20,0,0.3,0,0,4,0,0,False,False,True,False,False,,self,t3_1h62ihp
gaming,What’s the point of an Xbox?,"I own a PS5, Xbox Series X, and a PC and I really don’t see the point to own an Xbox anymore. I like the power of the Xbox the UI works well, but the games are lacking and Microsoft seems to be putting no exclusives on Xbox and everything seems to be headed over to PlayStation regardless now. 

I’m seriously debating on selling my Xbox. I just don’t see the whole point of owning a console that will have no exclusives and have less games than Switch or PS5 or PC.

Microsoft destroyed the brand and its almost pointless to own an Xbox now",chrisz2012,1h6am6m,https://reddit.com/r/gaming/comments/1h6am6m/whats_the_point_of_an_xbox/,https://www.reddit.com/r/gaming/comments/1h6am6m/whats_the_point_of_an_xbox/,2024-12-04 07:28:26,0,0.25,0,0,47,0,0,False,False,True,False,False,,self,t3_1h6am6m
