subreddit,title,selftext,author,id,permalink,url,created_utc,score,upvote_ratio,ups,downs,num_comments,total_awards_received,gilded,is_video,is_original_content,is_self,over_18,spoiler,link_flair_text,thumbnail,name
gaming,The most 2009 video game choice ,inFamous ,NoLastNameForNow,1h5xa7d,https://reddit.com/r/gaming/comments/1h5xa7d/the_most_2009_video_game_choice/,https://i.redd.it/i1sxq8f61p4e1.jpeg,2024-12-03 20:29:12,21873,0.95,21873,0,775,0,0,False,False,False,False,False,,https://a.thumbs.redditmedia.com/ZV7OwEK-PGhBvLreJb-CIULoDZsUOdiNp7csrb6-cb0.jpg,t3_1h5xa7d
gaming,"Former PlayStation exec says there's a ""collapse of creativity"" in the industry","&gt;""Today, the entry costs for making a AAA game is in triple digit millions now,"" he continued. ""I think naturally, risk tolerance drops. And you're [looking] at sequels, you're looking at copycats, because the finance guys who draw the line say, 'Well, if Fortnite made this much money in this amount of time, my Fortnite knockoff can make this in that amount of time.' We're seeing a collapse of creativity in games today [with] studio consolidation and the high cost of production.""

Sequels and requels; the Disney™️ accountant model. ",rematar,1h5q5ib,https://reddit.com/r/gaming/comments/1h5q5ib/former_playstation_exec_says_theres_a_collapse_of/,https://www.eurogamer.net/former-playstation-exec-says-theres-a-collapse-of-creativity-in-the-industry,2024-12-03 15:35:00,10656,0.95,10656,0,1424,0,0,False,False,False,False,False,,https://b.thumbs.redditmedia.com/CnxzdyRaKnHUyz5JBPPI9MI7Jnj4kQhQTDwQCLcOj0Y.jpg,t3_1h5q5ib
gaming,XDefiant officially shutting down as Ubisoft announces FPS end date,,BigT232,1h62k12,https://reddit.com/r/gaming/comments/1h62k12/xdefiant_officially_shutting_down_as_ubisoft/,https://www.dexerto.com/gaming/xdefiant-officially-shutting-down-2997613/,2024-12-04 00:12:12,6747,0.97,6747,0,998,0,0,False,False,False,False,False,,https://b.thumbs.redditmedia.com/tliIphH3VnjUdEC7SLpQDDxD0V3GCwPRokQg_ILUOuM.jpg,t3_1h62k12
gaming,The hidden master,,DreadedDrMaybe,1h648xr,https://reddit.com/r/gaming/comments/1h648xr/the_hidden_master/,https://i.redd.it/vtenpyf0jq4e1.jpeg,2024-12-04 01:30:56,5382,0.96,5382,0,183,0,0,False,False,False,False,False,,https://b.thumbs.redditmedia.com/hQAR4cfSg1osdRKZPooyHQltkD11t0PDJhP-gQiYdfM.jpg,t3_1h648xr
gaming,The most 2009 video game choice,,JustTrollingYou,1h634lo,https://reddit.com/r/gaming/comments/1h634lo/the_most_2009_video_game_choice/,https://i.imgur.com/6xKo70k.png,2024-12-04 00:38:17,4699,0.94,4699,0,325,0,0,False,False,False,False,False,,https://b.thumbs.redditmedia.com/4zajYl4iqlP4SZV4CckPDzq_8PTQwiUMOYfs4fkwsaw.jpg,t3_1h634lo
gaming,"For a game where most of it occurs well above 3,000 feet, the ground level of detail in Flight Simulator 2024 is insane.",,Alc2005,1h5pgcz,https://reddit.com/r/gaming/comments/1h5pgcz/for_a_game_where_most_of_it_occurs_well_above/,https://i.redd.it/m0lnvva0cn4e1.jpeg,2024-12-03 15:05:13,3950,0.97,3950,0,116,0,0,False,False,False,False,False,,https://b.thumbs.redditmedia.com/39nm9N8fQG6vRfSViESYIl-cHvsv3RO2t3DAcwWJIPI.jpg,t3_1h5pgcz
gaming,"30 years, but it seems like yesterday",,Kvra,1h5pzgd,https://reddit.com/r/gaming/comments/1h5pzgd/30_years_but_it_seems_like_yesterday/,https://i.redd.it/dyr79zvbjn4e1.jpeg,2024-12-03 15:27:53,3231,0.96,3231,0,103,0,0,False,False,False,False,False,,https://b.thumbs.redditmedia.com/749PXMLVlaR9RArJQYBobGSxFpVjvR8h1BYvRvs_-gI.jpg,t3_1h5pzgd
gaming,A map of my 1:1 fictional Minecraft City after nearly 5 years of work. 2024 update. ,,KanyeWaste69,1h679mu,https://reddit.com/r/gaming/comments/1h679mu/a_map_of_my_11_fictional_minecraft_city_after/,https://i.redd.it/fmzvjeqs9r4e1.png,2024-12-04 04:03:46,1477,0.95,1477,0,78,0,0,False,False,False,False,False,,https://b.thumbs.redditmedia.com/sX47EVVxir4Thn80U-mWvl_kcA_xvQt7VcJEcnJCpBk.jpg,t3_1h679mu
gaming,"Indiana Jones and the Great Circle PC system requirements, these are some hefty specs....",,Lo_jak,1h5zljg,https://reddit.com/r/gaming/comments/1h5zljg/indiana_jones_and_the_great_circle_pc_system/,https://i.redd.it/j2ljxz4aip4e1.jpeg,2024-12-03 22:05:04,1113,0.91,1113,0,748,0,0,False,False,False,False,False,,https://b.thumbs.redditmedia.com/ZYwW7iVNuobHrcNPe7RzPEXR6s6mj89hDQJVptcL9Mw.jpg,t3_1h5zljg
gaming,T-45 Power Armor cosplay from Fallout ,,Zoidberrg,1h5vf9a,https://reddit.com/r/gaming/comments/1h5vf9a/t45_power_armor_cosplay_from_fallout/,https://i.redd.it/lumljw5xno4e1.jpeg,2024-12-03 19:15:10,733,0.83,733,0,41,0,0,False,False,False,False,False,,https://b.thumbs.redditmedia.com/iStyB_zCy9wUjr9OQ5pwCWMZ6dylHpIuejYjuY5Z2lM.jpg,t3_1h5vf9a
gaming,"Path of Exile 2, and a recent trend in gaming","It seems like Path of Exile 2 is shaping up to follow in the footsteps of Elden Ring and Baldur's Gate 3, a game in a more niche genre, that doubles down on the things people love about that genre, and finds mainstream success by virtue of it being really, really good. Even Metaphor: Re Fantazio sort of fits into that catagory, although I think it's a littke more refined than Persona. And it's got me thinking about how some of the bigger failures of the past few years were games that tried for the broadest appeal possible, and ended up being super bland and forgettable in doing so. Games like Suicide Squad and Star Wars Outlaws. There's nothing really wrong with those games, there's just nothing that makes them stand out.",thewalkindude,1h5vyez,https://reddit.com/r/gaming/comments/1h5vyez/path_of_exile_2_and_a_recent_trend_in_gaming/,https://www.reddit.com/r/gaming/comments/1h5vyez/path_of_exile_2_and_a_recent_trend_in_gaming/,2024-12-03 19:36:26,701,0.82,701,0,317,0,0,False,False,True,False,False,,self,t3_1h5vyez
gaming,I digged up a screen cap from 15 years ago.,,cheezburgapocalypse,1h6g7k9,https://reddit.com/r/gaming/comments/1h6g7k9/i_digged_up_a_screen_cap_from_15_years_ago/,https://i.redd.it/2zirk9dx4u4e1.jpeg,2024-12-04 13:39:09,847,0.77,847,0,144,0,0,False,False,False,False,False,,https://b.thumbs.redditmedia.com/8zEtHb72fiW6fRZT8HBmmt0p3k1GryfBAK7LxUVA7Us.jpg,t3_1h6g7k9
gaming,Finally did the switch to PC! ,,Chilicarlos,1h5z0zr,https://reddit.com/r/gaming/comments/1h5z0zr/finally_did_the_switch_to_pc/,https://i.redd.it/lp7d9d22ep4e1.jpeg,2024-12-03 21:41:22,392,0.85,392,0,65,0,0,False,False,False,False,False,,https://b.thumbs.redditmedia.com/BzOmeed2pihvoDmol9JW_0yx5tY4PAvU37vper8Q0vc.jpg,t3_1h5z0zr
gaming,When you are not feeling the beat,,unbalancedbreakfast,1h5u8al,https://reddit.com/r/gaming/comments/1h5u8al/when_you_are_not_feeling_the_beat/,https://i.redd.it/7tnjtzk6fo4e1.jpeg,2024-12-03 18:25:55,296,0.92,296,0,19,0,0,False,False,False,False,False,,https://b.thumbs.redditmedia.com/EvGZJvZ1CUNh4NbqwChzfdTre_sqhplkzErSE0glqHQ.jpg,t3_1h5u8al
gaming,The Pokémon TCGP experience ,,TheSpectacularBagMan,1h6cswa,https://reddit.com/r/gaming/comments/1h6cswa/the_pokémon_tcgp_experience/,https://i.redd.it/xc54xzzd4t4e1.png,2024-12-04 10:14:19,164,0.85,164,0,40,0,0,False,False,False,False,False,,https://b.thumbs.redditmedia.com/jLldjrOoX_L-ffkll80ZDw0UUFqg-DZ3cYwC3yFg1eI.jpg,t3_1h6cswa
gaming,What are some irl games that exist inside other games,"Sometimes well playing a game you find other games left as easter eggs and sometimes they are even playable.

Off the top of my head here are some I can Think of:
Classic Doom in Doom Eternal: well in 2016 you can play a lot of the classic levels, they are all in a separate menu so out of universe but in Doom Eternal, you access them in universe in Doomguy’s computer inside his fortress

Crash in Uncharted: in the first few chapters of Uncharted 4 you get to a part where Elena tries to get Nate into a PS1 game she really likes and it happens to be Crash Bandicoot.

Classic Activition Games in Call of Duty Cold War: in Cold War there is a section where you go through a mock city used by the russians to train for a US ground invasion. In this mock city you can find arcades with classic activition games.

Those are the 3 I can think of, I also thought of the classic levels in Wolfenstein but those are see as nightmares so they don’t actually exist in universe but what are some others you guys can think of??",Plastic-Fly9455,1h5snb4,https://reddit.com/r/gaming/comments/1h5snb4/what_are_some_irl_games_that_exist_inside_other/,https://www.reddit.com/r/gaming/comments/1h5snb4/what_are_some_irl_games_that_exist_inside_other/,2024-12-03 17:20:51,140,0.88,140,0,208,0,0,False,False,True,False,False,,self,t3_1h5snb4
gaming,"welp, there goes my weekend",,rsjpeckham,1h6gj4d,https://reddit.com/r/gaming/comments/1h6gj4d/welp_there_goes_my_weekend/,https://i.redd.it/jtyf6wno7u4e1.jpeg,2024-12-04 13:54:34,160,0.89,160,0,8,0,0,False,False,False,False,False,,https://b.thumbs.redditmedia.com/cbg78vUtsreP5YNZy2UMhuSy_ShJJEgoRslv4cm_vHM.jpg,t3_1h6gj4d
gaming,What's a habit that you have in multiple different games,My roommate has to unlock every fast travel location as soon as physically possible in every game he plays. When he played Tears of the Kingdom he spent 20 hours going around all of the map unlocking stuff. What's something you are compelled to do no matter what game it is?,lordlemming,1h6g8lr,https://reddit.com/r/gaming/comments/1h6g8lr/whats_a_habit_that_you_have_in_multiple_different/,https://www.reddit.com/r/gaming/comments/1h6g8lr/whats_a_habit_that_you_have_in_multiple_different/,2024-12-04 13:40:31,86,0.86,86,0,205,0,0,False,False,True,False,False,,self,t3_1h6g8lr
gaming,What game gives you a strong feeling of nostalgia and makes you remember everything that happened to you at the time when you were actively playing this game?,"I was recently surfing net when, out of nowhere, I decided to open ***Super Mario 64***. No real reason, just a random decision

The second the title screen appeared, I felt like I was a kid again. That familiar music, Mario’s face, the vibrant world - it all came rushing back. After a few minutes of gameplay I was literally hooked. Running around, hearing the old sound effects and all that stuff - everything felt so nostalgic

Then suddenly memories started flooding in. I remembered where I was when I first played it - the old couch in my living room, the excitement of my first time exploring the game, the friends I used to play it with after school. I hadn’t realized how much I missed it until I was already lost in the game. It was like no time had passed at all

**Do you have games that make you feel like that?**",rockzxm,1h66dxl,https://reddit.com/r/gaming/comments/1h66dxl/what_game_gives_you_a_strong_feeling_of_nostalgia/,https://www.reddit.com/r/gaming/comments/1h66dxl/what_game_gives_you_a_strong_feeling_of_nostalgia/,2024-12-04 03:17:40,42,0.8,42,0,129,0,0,False,False,True,False,False,,self,t3_1h66dxl
gaming,What game has the biggest issue with money being worthles?,"Money makes the world go round, but in many video game worlds, it often ends up worthless, so monetary rewards can end up moot.

The Legend of Zelda series has a recurring problem, the worst cases I have seen are Breath of the Wild and Echoes of Wisdom (I haven't played Tears yet). Despite Breath of the Wild not having money you can find by cutting grass, you still end up with more than you'll ever need because you can sell virtually anything you come across. I often ended up netting a profit from shopping by selling a fraction of the stuff you collect. The are items for sale you can use in cooking, and I didn't buy most of them because the stuff I found worked fine.

The most annoying part for me was that shops did sell special arrows except they quit restocking them if you had enough in your inventory so I was better off find enemies to get more. Past the early game I didn't need money for anything besides upgrading armor and quests.

Echoes of Wisdom has health items for sale, that there isn't a ton of need for when you can use a bed to recover your health for free.

However, the worst case I have seen is Xenoblade 3. This is a JRPG where you don't have to buy weapons or armor. There are items for sale you can use in quests and cooking, I got buy without needing to use the cooking mechanic and for the most you can find items for quests without spending any money. The accessories for sale have use on paper except exploring the map almost always let to better ones.

The Land of Challenge DLC was the final nail in the coffin since while it does require grinding resources there you can get better stuff for clearing its challenges than from shops.

None of this makes these games bad, it just feels weird to carry around so much cash and not have a use for it.",Sensitive-Hotel-9871,1h6g2sj,https://reddit.com/r/gaming/comments/1h6g2sj/what_game_has_the_biggest_issue_with_money_being/,https://www.reddit.com/r/gaming/comments/1h6g2sj/what_game_has_the_biggest_issue_with_money_being/,2024-12-04 13:32:56,62,0.72,62,0,212,0,0,False,False,True,False,False,,self,t3_1h6g2sj
gaming,Musings on Video Gaming,"I’m over 65 and have been playing video games (badly) since my Intellevision days. I’m now using a PS5.
I have loved games such as The Last of Us, Days Gone, Zelda and so many more and I played almost every day especially since the ps3 days.
Recently my hands and wrists have gotten a little painful so I haven’t played in a few weeks. The thing is I don’t miss it. Right now as it stands if I never played again it wouldn’t kill me.
It made me wonder how many of us are playing for the love of gaming or because it’s become an easy habit to fall into.
When was the last time any of us stopped playing for a week just to catch our breath so to speak?
This is a hobby that can consume thousands of hours.Maybe we should set aside some of those hours in levelling ourselves up rather than our avatars. 
",TemperatureTime1617,1h67phc,https://reddit.com/r/gaming/comments/1h67phc/musings_on_video_gaming/,https://www.reddit.com/r/gaming/comments/1h67phc/musings_on_video_gaming/,2024-12-04 04:27:58,29,0.64,29,0,31,0,0,False,False,True,False,False,,self,t3_1h67phc
gaming,Sunright Boba is doing a collab with Omori,They make it seem so bright and bubbly when Omori is anything but! ,VinTheHuman,1h61gns,https://reddit.com/r/gaming/comments/1h61gns/sunright_boba_is_doing_a_collab_with_omori/,https://i.redd.it/cg3fti4ewp4e1.jpeg,2024-12-03 23:24:12,29,0.64,29,0,9,0,0,False,False,False,False,False,,https://b.thumbs.redditmedia.com/c29BExafhh6auLnmBcxRmljZEBMdcd_6JKBSOVA7rQY.jpg,t3_1h61gns
gaming,Games with a sense of long-term progression and goals?,"I love WoW and Tarkov and Runescape, but also Stardew Valley, Rimworld, and a whole bunch of others. 

Nothing makes me happier than having a game with a sense of long-term progress, like I’ve built something and have something to show for it. For example, I love the Player-Owned house in Runescape and showing off my pets and achievements. I love mounts and transmogs in wow because I love building my own aesthetic based around my greatest moments. I LOVE my hideout in Tarkov because I feel like I made it with my blood, sweat, and tears, and each mannequin with boss armor on it reminds me of those first kills. 

I’m burned out of most of the above, and while I’m obviously okay with grinding, I need a purpose for it (looking at you WoW) 

Any suggestions for someone looking for a long-term experience?",ArcadeRay,1h6bsax,https://reddit.com/r/gaming/comments/1h6bsax/games_with_a_sense_of_longterm_progression_and/,https://www.reddit.com/r/gaming/comments/1h6bsax/games_with_a_sense_of_longterm_progression_and/,2024-12-04 08:57:24,25,0.72,25,0,90,0,0,False,False,True,False,False,,self,t3_1h6bsax
gaming,What are you playing Wednesday!,"What game's got your attention this week? What's great about it? What sucks? Tell us all about it! 

&amp;#x200B;

 This thread is posted weekly on Wednesdays (adjustments made as needed).",AutoModerator,1h6a7ql,https://reddit.com/r/gaming/comments/1h6a7ql/what_are_you_playing_wednesday/,https://www.reddit.com/r/gaming/comments/1h6a7ql/what_are_you_playing_wednesday/,2024-12-04 07:00:10,18,0.8,18,0,63,0,0,False,False,True,False,False,Weekly Play Thread,self,t3_1h6a7ql
gaming,"What are some good examples of single player games with ""modes"" or extended gameplay/endgame features?","A lot of single player games are just ""beat the campaign and repeat"" with the exception of maybe one mode, like Resident Evil's Mercenaries. I think Devil May Cry and Witcher 2 or 3 has a survival mode of such as well, but that's it. Aside from difficulties, there's no ""modes"" like it is in other genres. It don't have to be loot or anything, but even Mass Effect 3 has Armax Aresenal Arena just to have something to play, as the rest of the single player is mainly story and one-time missions.",NLK-3,1h629p3,https://reddit.com/r/gaming/comments/1h629p3/what_are_some_good_examples_of_single_player/,https://www.reddit.com/r/gaming/comments/1h629p3/what_are_some_good_examples_of_single_player/,2024-12-03 23:59:59,3,0.56,3,0,11,0,0,False,False,True,False,False,,self,t3_1h629p3
gaming,The most 2009 video game choice,,PalebloodSky,1h6hyre,https://reddit.com/r/gaming/comments/1h6hyre/the_most_2009_video_game_choice/,https://i.redd.it/xihegoopiu4e1.jpeg,2024-12-04 14:57:23,8,0.56,8,0,11,0,0,False,False,False,False,False,,https://a.thumbs.redditmedia.com/bY7z4DiN_bvDJyBaPP1ZWWPpsybOewQ-wZUoE-84F74.jpg,t3_1h6hyre
gaming,Spider-Man (2002) dev talks seeing the Raimi script early,,TheSpectacularBagMan,1h6hn0k,https://reddit.com/r/gaming/comments/1h6hn0k/spiderman_2002_dev_talks_seeing_the_raimi_script/,https://youtube.com/shorts/K7voqhcNb6A?si=0U-wi7J5NtoYOfZG,2024-12-04 14:43:13,0,0.33,0,0,6,0,0,False,False,False,False,False,,default,t3_1h6hn0k
gaming,Warren Spector about what makes Gaming unique,Stumbled upon this while searching for a quote from him and thought it was a neat little take on gaming.,Tetragrammator,1h6f92j,https://reddit.com/r/gaming/comments/1h6f92j/warren_spector_about_what_makes_gaming_unique/,https://youtu.be/55tQEaUjARU?si=3Wjgowi01R70V5hx,2024-12-04 12:52:07,1,0.53,1,0,1,0,0,False,False,False,False,False,,https://b.thumbs.redditmedia.com/Vg7S1ulKJwAqw22wNlujlOe7n38Q0yVfZ6GMGl4fLIE.jpg,t3_1h6f92j
gaming,What do y'all think is the coolest glitch/bug/exploit in any game? Why?,"Personally, i find blls in The legend of Zelda: Breath of the wild to be cool. Going at such high speeds in games is rly fun for me.",Profaned_Goddes,1h6i0tb,https://reddit.com/r/gaming/comments/1h6i0tb/what_do_yall_think_is_the_coolest/,https://www.reddit.com/r/gaming/comments/1h6i0tb/what_do_yall_think_is_the_coolest/,2024-12-04 14:59:46,3,0.58,3,0,36,0,0,False,False,True,False,False,,self,t3_1h6i0tb
gaming,What are the most memorable moments in games that made you cry from joy?,"(Not necessarily that you actually cried) I thought it would be a good idea to try to remember the happiest moments one remembers in video games, it can be a good ending, playing with friends, a good story, pretty much anything, for me at least was playing through Metal Gear Solid 3: Snake Eater's ending, what's yours?",WhereIsMahSuperSoup,1h60hmq,https://reddit.com/r/gaming/comments/1h60hmq/what_are_the_most_memorable_moments_in_games_that/,https://www.reddit.com/r/gaming/comments/1h60hmq/what_are_the_most_memorable_moments_in_games_that/,2024-12-03 22:42:10,0,0.47,0,0,37,0,0,False,False,True,False,False,,self,t3_1h60hmq
gaming,What’s the most fun and rewarding NG+ experience you had? ,"Sometimes games slap multiple playthroughs rewards &amp; achievements and feel underwhelming and a waste of time.

Which one did it right for you? ",MoeMalik,1h5x48w,https://reddit.com/r/gaming/comments/1h5x48w/whats_the_most_fun_and_rewarding_ng_experience/,https://www.reddit.com/r/gaming/comments/1h5x48w/whats_the_most_fun_and_rewarding_ng_experience/,2024-12-03 20:22:54,0,0.47,0,0,52,0,0,False,False,True,False,False,,self,t3_1h5x48w
gaming,This is very unfortunate,"Sega will be delisting classics such as Golden Axe, Streets of Rage and several others.",SmallTownKaiju,1h6ewsb,https://reddit.com/r/gaming/comments/1h6ewsb/this_is_very_unfortunate/,https://gamerant.com/sega-delisting-classic-games-december-6/,2024-12-04 12:33:05,0,0.41,0,0,24,0,0,False,False,False,False,False,,https://b.thumbs.redditmedia.com/AkPh1iVj2hLNDglA_DBHhhi5t5JIp8paPWx9mBrzh-E.jpg,t3_1h6ewsb
gaming,What games in your opinion have the most creative use of physics?,"Breath of the wild and Tears of the kingdom are obvious picks, they have really creative use of physics in puzzle solving and manipulating the environment. Especially TotK with the ability to rewind time on an object; in essence reverse physics.

If I had to pick another, I'd say Human Fall Flat since the whole game kinda revolves around the idea of controlling ragdoll physics.

What would be your picks?",Routasoft,1h6coj4,https://reddit.com/r/gaming/comments/1h6coj4/what_games_in_your_opinion_have_the_most_creative/,https://www.reddit.com/r/gaming/comments/1h6coj4/what_games_in_your_opinion_have_the_most_creative/,2024-12-04 10:05:18,0,0.47,0,0,84,0,0,False,False,True,False,False,,self,t3_1h6coj4
gaming,Is it still possible to find new Wii U and 2DS consoles for sale?,"Hey guys. I am looking to buy these consoles, and in my country there is a shopping center of unofficial re-sellers who sell these new and sealed consoles with all their cables and manuals. (they also sell second-hand at a cheaper price)

My question is, is this real or even possible? I ask because this month I've been looking at marketplaces like Amazon, Ebay, and Facebook Market and virtually no one sells these new, sealed consoles. They only sell them second-hand without manuals or boxes.

Is it possible that these consoles that are being sold in my country are really new or is it a scam?",NaitDraik,1h5qyfr,https://reddit.com/r/gaming/comments/1h5qyfr/is_it_still_possible_to_find_new_wii_u_and_2ds/,https://www.reddit.com/r/gaming/comments/1h5qyfr/is_it_still_possible_to_find_new_wii_u_and_2ds/,2024-12-03 16:09:11,0,0.4,0,0,20,0,0,False,False,True,False,False,,self,t3_1h5qyfr
gaming,Msi afterburner settings (pc),"Just wanted to share my experience and maybe help someone out with having drops with their gpu

I've been running my set up for a while and it's run fantastic without any problems (dead space remake, psychonauts 2, dungeons 4 ect ect) 

But I've got into some newer games where I would have gpu device hangs (such as stalker 2, cod 6, horizon forbidden west) which would happen less frequently when I dropped the graphics to the lowest end

I thought that was strange I was only getting these drops with very recent games even on low end settings and not 1-3 year old games on high end settings 

So I've been running my Nvidia stats the last couple days and realised once I hit the 75-80° the gpu would hang but that's not crazy surprising

What was surprising is that the default fan settings on msi afterburner aren't great so I set mine to max out at 80° but the fan curve to slowly rise evenly from 30&gt;80° and now even on the higher end of horizon forbidden west or stalker settings its sitting around 65-70°",JonnyNutz,1h6dmp7,https://reddit.com/r/gaming/comments/1h6dmp7/msi_afterburner_settings_pc/,https://i.redd.it/xim5unxpet4e1.jpeg,2024-12-04 11:12:14,0,0.33,0,0,10,0,0,False,False,False,False,False,,https://b.thumbs.redditmedia.com/Ae2-3-Kd9OnBSUE3p4142fwzp69pWznV6vicS43ynFY.jpg,t3_1h6dmp7
gaming,Anybody know what this cord is called?,"I found a listing for the entire power adapter but I only need the cord that plugs into the wall. Problem is,  idk how to look it up by itself and really don't want to pay for the full thing.

https://preview.redd.it/iadn7a7v2r4e1.jpg?width=1080&amp;format=pjpg&amp;auto=webp&amp;s=6a884c617c63f866a620bc6de7406140faa006e7

",FriendshipIntrepid91,1h66by5,https://reddit.com/r/gaming/comments/1h66by5/anybody_know_what_this_cord_is_called/,https://www.reddit.com/r/gaming/comments/1h66by5/anybody_know_what_this_cord_is_called/,2024-12-04 03:14:57,0,0.31,0,0,13,0,0,False,False,True,False,False,,https://b.thumbs.redditmedia.com/nkjNMuYS0Ora82oaCQgHTnddfmo3rxYuyy2K-DsmTtQ.jpg,t3_1h66by5
gaming,Any games out there like the Isekaed/Reencarnated Anime? ,"Anyone know of a game similar to the above? I do t want a MMORPG ( if I have to). I was wondering if there were games like that? 

Anime that comes to mind in Solo Leveling and Sword Art Online. ",Baidizzle,1h5x9nn,https://reddit.com/r/gaming/comments/1h5x9nn/any_games_out_there_like_the_isekaedreencarnated/,https://www.reddit.com/r/gaming/comments/1h5x9nn/any_games_out_there_like_the_isekaedreencarnated/,2024-12-03 20:28:35,0,0.33,0,0,17,0,0,False,False,True,False,False,,self,t3_1h5x9nn
gaming,Pause to Choose Your Next RPG Adventure!,,ShuTastyBytes,1h5vxkh,https://reddit.com/r/gaming/comments/1h5vxkh/pause_to_choose_your_next_rpg_adventure/,https://youtube.com/shorts/lcnsLXBopAE?feature=share,2024-12-03 19:35:31,0,0.1,0,0,8,0,0,False,False,False,False,False,,default,t3_1h5vxkh
gaming,Is it the game Enshrouded or is it my computer,"My game ( Enshrouded ) keeps crashing to the desktop periodically. I get very strange behavior such as not responding to mouse clicks etc. etc.

Is it my computer? 

Do  other Enshrouded player experience crashes to the desktop/",Arizona-Willie,1h5zs09,https://reddit.com/r/gaming/comments/1h5zs09/is_it_the_game_enshrouded_or_is_it_my_computer/,https://www.reddit.com/r/gaming/comments/1h5zs09/is_it_the_game_enshrouded_or_is_it_my_computer/,2024-12-03 22:12:22,0,0.09,0,0,1,0,0,False,False,True,False,False,,self,t3_1h5zs09
